
============================================================
     LF WORKER - PORT 9223
============================================================
Worker: Worker_9223
Status: READY
Waiting for tasks...
============================================================


============================================================
[Worker_9223] Processing: ATZ-JED
  Tier 0: Range 2, Chunk 1/3
  Dates: 4 days
  Date Range: 2026-01-20 to 2026-01-17
============================================================

2025-12-28 09:11:38 | INFO     | ======================================================================
2025-12-28 09:11:38 | INFO     | Load Factor Scraper Started - Route: ATZ-JED
2025-12-28 09:11:38 | INFO     | Log file: D:\CODERED\LAB\market_insights\outputs\run_generated_281225_at_09.11\logs\LF_ATZ-JED_20251228_091138.log
2025-12-28 09:11:38 | INFO     | Enhanced logging: Capturing both logging.info() and print()
2025-12-28 09:11:38 | INFO     | ======================================================================
[LF] Processing dates (override): ['20JAN', '19JAN', '18JAN', '17JAN']
[LF] Attaching to Chrome for Altea access
[LF][[OK] SUCCESS] Connected to Chrome on 127.0.0.1:9223 (after 1 attempts)
[LF][[OK] SUCCESS] Found Amadeus Altea window: Altéa Reservation Desktop
[LF][[INFO] INFO] URL: https://tc212.resdesktop.altea.amadeus.com/app_ard/apf/init/login?SITE=ESMPESMP&LANGUAGE=GB&MARKETS=ARDW_PROD_WBP&ACTION=clpLogin
[LF] Processing ATZ-JED for 20JAN
[LF][ERROR] Amadeus command error detected: UNKNOWN TRANSACTION
[LF][ERROR] Command: SN20JANATZJED/ASM
[LF][RESYNC] Triggering immediate resync to last successful SN command
============================================================
[LF][RESYNC] Command 'SN20JANATZJED/ASM' failed: TECH_ERROR:UNKNOWN TRANSACTION
[LF][RESYNC] Re-running entire day from SN command for ATZ-JED 20JAN
[LF][RESYNC] Attempt 1/50 (waiting 1.0s before retry...)
============================================================
[LF][RESYNC] Sending IG to clear session state...
[LF][RESYNC] Session cleared with IG
[LF] Processing ATZ-JED for 20JAN
[LF] 20JAN: found 2 direct flights
[LF] SM453 20JAN: BKG=145, GRP=135, CAP=179, LF%=81.0%, Brd-Off=ATZ-JED, Classes: P:135, X:3, T:5, W:2
[LF] SM455 20JAN: BKG=148, GRP=135, CAP=179, LF%=82.7%, Brd-Off=ATZ-JED, Classes: P:135, X:4, T:4, W:5
[LF] Getting WEEKLY/LASTSOLD data for 2 flights
[LF] SM453 20JAN: LASTSOLD=2025-12-27 00:00:00, WEEKLY=3, TODAY=0, YDAY=3
[LF] SM455 20JAN: LASTSOLD=2025-12-25 00:00:00, WEEKLY=9, TODAY=0, YDAY=0
[LF] Processing ATZ-JED for 19JAN
[LF] 19JAN: found 4 direct flights
[LF] SM491 19JAN: BKG=95, GRP=90, CAP=179, LF%=53.1%, Brd-Off=ATZ-JED, Classes: P:90, X:4, T:1
[LF] SM455 19JAN: BKG=139, GRP=135, CAP=179, LF%=77.6%, Brd-Off=ATZ-JED, Classes: P:135, X:4
[LF] SM421 19JAN: BKG=104, GRP=90, CAP=179, LF%=58.1%, Brd-Off=ATZ-JED, Classes: P:90, X:4, T:2, W:8
[LF] SM453 19JAN: BKG=180, GRP=175, CAP=179, LF%=100.6%, Brd-Off=ATZ-JED, Classes: P:175, X:4, T:1
[LF] Getting WEEKLY/LASTSOLD data for 4 flights
[LF] SM491 19JAN: LASTSOLD=2025-12-27 00:00:00, WEEKLY=3, TODAY=0, YDAY=1
[LF] SM455 19JAN: LASTSOLD=2025-12-25 00:00:00, WEEKLY=4, TODAY=0, YDAY=0
[LF] SM421 19JAN: LASTSOLD=2025-12-27 00:00:00, WEEKLY=13, TODAY=0, YDAY=5
[LF] SM453 19JAN: LASTSOLD=2025-12-21 00:00:00, WEEKLY=1, TODAY=0, YDAY=0
[LF] Processing ATZ-JED for 18JAN
[LF] 18JAN: found 2 direct flights
[LF] SM491 18JAN: BKG=153, GRP=135, CAP=179, LF%=85.5%, Brd-Off=ATZ-JED, Classes: P:135, X:4, T:4, W:7, S:3
[LF] SM455 18JAN: BKG=159, GRP=135, CAP=179, LF%=88.8%, Brd-Off=ATZ-JED, Classes: P:135, X:4, T:4, W:7, S:9
[LF] Getting WEEKLY/LASTSOLD data for 2 flights
[LF] SM491 18JAN: LASTSOLD=2025-12-27 00:00:00, WEEKLY=14, TODAY=0, YDAY=3
[LF] SM455 18JAN: LASTSOLD=2025-12-25 00:00:00, WEEKLY=9, TODAY=0, YDAY=0
[LF] Processing ATZ-JED for 17JAN
[LF] 17JAN: found 3 direct flights
[LF] SM491 17JAN: BKG=154, GRP=135, CAP=179, LF%=86.0%, Brd-Off=ATZ-JED, Classes: P:135, X:4, T:4, W:7, S:4
[LF] SM453 17JAN: BKG=105, GRP=90, CAP=179, LF%=58.7%, Brd-Off=ATZ-JED, Classes: P:90, X:4, T:4, W:7
[LF] SM455 17JAN: BKG=164, GRP=135, CAP=179, LF%=91.6%, Brd-Off=ATZ-JED, Classes: P:135, I:5, X:4, T:4, W:7, S:9
[LF] Getting WEEKLY/LASTSOLD data for 3 flights
[LF] SM491 17JAN: LASTSOLD=2025-12-24 00:00:00, WEEKLY=7, TODAY=0, YDAY=0
[LF] SM453 17JAN: LASTSOLD=2025-12-28 00:00:00, WEEKLY=5, TODAY=1, YDAY=0
[LF] SM455 17JAN: LASTSOLD=2025-12-27 00:00:00, WEEKLY=11, TODAY=0, YDAY=5
[LF] Results summary:
  2026-01-20: 2 flights
  2026-01-19: 4 flights
  2026-01-18: 2 flights
  2026-01-17: 3 flights

============================================================
[Worker_9223] ✓ COMPLETED: ATZ-JED
  Results: 4 dates
  Errors: 0 dates
  Total Processed: 1 groups
============================================================


============================================================
[Worker_9223] Processing: ATZ-JED
  Tier 0: Range 2, Chunk 3/3
  Dates: 3 days
  Date Range: 2026-01-13 to 2026-01-11
============================================================

2025-12-28 09:13:18 | INFO     | ======================================================================
2025-12-28 09:13:18 | INFO     | Load Factor Scraper Started - Route: ATZ-JED
2025-12-28 09:13:18 | INFO     | Log file: D:\CODERED\LAB\market_insights\outputs\run_generated_281225_at_09.11\logs\LF_ATZ-JED_20251228_091318.log
2025-12-28 09:13:18 | INFO     | Enhanced logging: Capturing both logging.info() and print()
2025-12-28 09:13:18 | INFO     | ======================================================================
[LF] Processing dates (override): ['13JAN', '12JAN', '11JAN']
[LF] Attaching to Chrome for Altea access
2025-12-28 09:13:18 | INFO     | Starting LF search for route: ATZ-JED
2025-12-28 09:13:18 | INFO     | [START] LF Search
[LF][[OK] SUCCESS] Connected to Chrome on 127.0.0.1:9223 (after 1 attempts)
2025-12-28 09:13:19 | INFO     | [HEALTH CHECK] [OK] Chrome connection is healthy
[LF][[OK] SUCCESS] Found Amadeus Altea window: Altéa Reservation Desktop
[LF][[INFO] INFO] URL: https://tc212.resdesktop.altea.amadeus.com/app_ard/apf/init/login?SITE=ESMPESMP&LANGUAGE=GB&MARKETS=ARDW_PROD_WBP&ACTION=clpLogin
2025-12-28 09:13:20 | INFO     | [DAY_START] Processing 13JAN
[LF] Processing ATZ-JED for 13JAN
2025-12-28 09:13:20 | INFO     | [lf.day.start] Processing ATZ-JED for 13JAN
[LF] 13JAN: found 2 direct flights
2025-12-28 09:13:21 | INFO     | [lf.day.flights_found] Found 2 flights on 13JAN
2025-12-28 09:13:23 | INFO     | [lf.flight.extracted] SM453 on 13JAN: BKG=173, LF=96.7%
[LF] SM453 13JAN: BKG=173, GRP=165, CAP=179, LF%=96.7%, Brd-Off=ATZ-JED, Classes: P:125, E:40, X:4, T:4
2025-12-28 09:13:26 | INFO     | [lf.flight.extracted] SM455 on 13JAN: BKG=150, LF=83.8%
[LF] SM455 13JAN: BKG=150, GRP=135, CAP=179, LF%=83.8%, Brd-Off=ATZ-JED, Classes: P:135, X:4, T:4, W:7
[LF] Getting WEEKLY/LASTSOLD data for 2 flights
[LF] SM453 13JAN: LASTSOLD=2025-12-27 00:00:00, WEEKLY=3, TODAY=0, YDAY=1
[LF] SM455 13JAN: LASTSOLD=2025-12-27 00:00:00, WEEKLY=8, TODAY=0, YDAY=1
2025-12-28 09:13:30 | INFO     | [SUCCESS] Day 13JAN
2025-12-28 09:13:30 | INFO     | [DAY_START] Processing 12JAN
[LF] Processing ATZ-JED for 12JAN
2025-12-28 09:13:30 | INFO     | [lf.day.start] Processing ATZ-JED for 12JAN
[LF] 12JAN: found 3 direct flights
2025-12-28 09:13:31 | INFO     | [lf.day.flights_found] Found 3 flights on 12JAN
2025-12-28 09:13:33 | INFO     | [lf.flight.extracted] SM491 on 12JAN: BKG=127, LF=71.0%
[LF] SM491 12JAN: BKG=127, GRP=90, CAP=179, LF%=71.0%, Brd-Off=ATZ-JED, Classes: P:90, I:10, O:10, U:10, X:4, T:3
2025-12-28 09:13:37 | INFO     | [lf.flight.extracted] SM455 on 12JAN: BKG=101, LF=56.4%
[LF] SM455 12JAN: BKG=101, GRP=90, CAP=179, LF%=56.4%, Brd-Off=ATZ-JED, Classes: P:90, X:11
2025-12-28 09:13:43 | INFO     | [lf.flight.extracted] SM453 on 12JAN: BKG=101, LF=56.4%
[LF] SM453 12JAN: BKG=101, GRP=85, CAP=179, LF%=56.4%, Brd-Off=ATZ-JED, Classes: P:85, X:4, T:11, W:1
[LF] Getting WEEKLY/LASTSOLD data for 3 flights
[LF] SM491 12JAN: LASTSOLD=2025-12-27 00:00:00, WEEKLY=34, TODAY=0, YDAY=2
[LF] SM455 12JAN: LASTSOLD=2025-12-27 00:00:00, WEEKLY=8, TODAY=0, YDAY=6
[LF] SM453 12JAN: LASTSOLD=2025-12-27 00:00:00, WEEKLY=9, TODAY=0, YDAY=4
2025-12-28 09:13:53 | INFO     | [SUCCESS] Day 12JAN
2025-12-28 09:13:53 | INFO     | [DAY_START] Processing 11JAN
[LF] Processing ATZ-JED for 11JAN
2025-12-28 09:13:53 | INFO     | [lf.day.start] Processing ATZ-JED for 11JAN
[LF] 11JAN: found 2 direct flights
2025-12-28 09:13:54 | INFO     | [lf.day.flights_found] Found 2 flights on 11JAN
2025-12-28 09:13:56 | INFO     | [lf.flight.extracted] SM491 on 11JAN: BKG=180, LF=100.6%
[LF] SM491 11JAN: BKG=180, GRP=180, CAP=179, LF%=100.6%, Brd-Off=ATZ-JED, Classes: P:180
2025-12-28 09:14:00 | INFO     | [lf.flight.extracted] SM455 on 11JAN: BKG=166, LF=92.7%
[LF] SM455 11JAN: BKG=166, GRP=143, CAP=179, LF%=92.7%, Brd-Off=ATZ-JED, Classes: P:143, X:4, T:14, W:5
[LF] Getting WEEKLY/LASTSOLD data for 2 flights
[LF] SM491 11JAN: LASTSOLD=2025-12-06 00:00:00, WEEKLY=0, TODAY=0, YDAY=0
[LF] SM455 11JAN: LASTSOLD=2025-12-25 00:00:00, WEEKLY=15, TODAY=0, YDAY=0
2025-12-28 09:14:07 | INFO     | [SUCCESS] Day 11JAN
[LF] Results summary:
  2026-01-13: 2 flights
  2026-01-12: 3 flights
  2026-01-11: 2 flights
2025-12-28 09:14:07 | INFO     | [SUCCESS] LF Search Complete

============================================================
[Worker_9223] ✓ COMPLETED: ATZ-JED
  Results: 3 dates
  Errors: 0 dates
  Total Processed: 2 groups
============================================================

2025-12-28 09:14:09 | INFO     | [Worker_9223] Completed: ATZ-JED - 3 results, 0 errors

============================================================
[Worker_9223] Processing: JED-CAI
  Tier 0: Range 1, Chunk 2/2
  Dates: 7 days
  Date Range: 2026-01-03 to 2025-12-28
============================================================

2025-12-28 09:14:09 | INFO     | [Worker_9223] Processing: JED-CAI
2025-12-28 09:14:09 | INFO     |   Tier 0: Range 1, Chunk 2/2 (7 days)
2025-12-28 09:14:09 | INFO     | ======================================================================
2025-12-28 09:14:09 | INFO     | Load Factor Scraper Started - Route: JED-CAI
2025-12-28 09:14:09 | INFO     | Log file: D:\CODERED\LAB\market_insights\outputs\run_generated_281225_at_09.11\logs\LF_JED-CAI_20251228_091409.log
2025-12-28 09:14:09 | INFO     | Enhanced logging: Capturing both logging.info() and print()
2025-12-28 09:14:09 | INFO     | ======================================================================
[LF] Processing dates (override): ['03JAN', '02JAN', '01JAN', '31DEC', '30DEC', '29DEC', '28DEC']
[LF] Attaching to Chrome for Altea access
2025-12-28 09:14:09 | INFO     | Starting LF search for route: JED-CAI
2025-12-28 09:14:09 | INFO     | [START] LF Search
[LF][[OK] SUCCESS] Connected to Chrome on 127.0.0.1:9223 (after 1 attempts)
2025-12-28 09:14:12 | INFO     | [HEALTH CHECK] [OK] Chrome connection is healthy
[LF][[OK] SUCCESS] Found Amadeus Altea window: Altéa Reservation Desktop
[LF][[INFO] INFO] URL: https://tc212.resdesktop.altea.amadeus.com/app_ard/apf/init/login?SITE=ESMPESMP&LANGUAGE=GB&MARKETS=ARDW_PROD_WBP&ACTION=clpLogin
2025-12-28 09:14:12 | INFO     | [DAY_START] Processing 03JAN
[LF] Processing JED-CAI for 03JAN
2025-12-28 09:14:12 | INFO     | [lf.day.start] Processing JED-CAI for 03JAN
[LF] 03JAN: found 3 direct flights
2025-12-28 09:14:14 | INFO     | [lf.day.flights_found] Found 3 flights on 03JAN
2025-12-28 09:14:17 | INFO     | [lf.flight.extracted] SM450 on 03JAN: BKG=162, LF=97.0%
[LF] SM450 03JAN: BKG=162, GRP=141, CAP=167, LF%=97.0%, Brd-Off=JED-CAI, Classes: P:141, U:10, X:7, T:2, K:2
[LPC] SM450 03JAN: Found 1 outbound flights with connecting passengers
2025-12-28 09:14:22 | INFO     | [lf.flight.extracted] SM476 on 03JAN: BKG=162, LF=91.0%
[LF] SM476 03JAN: BKG=162, GRP=131, CAP=178, LF%=91.0%, Brd-Off=JED-CAI, Classes: P:131, U:7, X:12, T:9, S:3
2025-12-28 09:14:26 | INFO     | [lf.flight.extracted] SM478 on 03JAN: BKG=167, LF=95.4%
[LF] SM478 03JAN: BKG=167, GRP=139, CAP=175, LF%=95.4%, Brd-Off=JED-CAI, Classes: P:139, I:5, U:15, W:6, S:2
[LF] Getting WEEKLY/LASTSOLD data for 3 flights
[LF] SM450 03JAN: LASTSOLD=2025-12-24 00:00:00, WEEKLY=2, TODAY=0, YDAY=0
[LF] SM476 03JAN: LASTSOLD=2025-12-26 00:00:00, WEEKLY=5, TODAY=0, YDAY=0
[LF] SM478 03JAN: LASTSOLD=2025-12-27 00:00:00, WEEKLY=14, TODAY=0, YDAY=2
2025-12-28 09:14:42 | INFO     | [SUCCESS] Day 03JAN
2025-12-28 09:14:42 | INFO     | [DAY_START] Processing 02JAN
[LF] Processing JED-CAI for 02JAN
2025-12-28 09:14:42 | INFO     | [lf.day.start] Processing JED-CAI for 02JAN
[LF] 02JAN: 2 cancelled flight(s) detected from SN
[LF] 02JAN: found 5 direct flights
2025-12-28 09:14:43 | INFO     | [lf.day.flights_found] Found 5 flights on 02JAN
2025-12-28 09:14:45 | INFO     | [lf.flight.extracted] SM424 on 02JAN: BKG=69, LF=41.3%
[LF] SM424 02JAN: BKG=69, GRP=45, CAP=167, LF%=41.3%, Brd-Off=JED-CAI, Classes: P:45, X:6, T:13, W:2, S:3
[LPC] SM424 02JAN: Found 2 outbound flights with connecting passengers
2025-12-28 09:14:49 | INFO     | [lf.flight.extracted] SM476 on 02JAN: BKG=73, LF=43.7%
[LF] SM476 02JAN: BKG=73, GRP=48, CAP=167, LF%=43.7%, Brd-Off=JED-CAI, Classes: P:48, I:5, O:5, U:1, X:10, T:4
2025-12-28 09:14:52 | INFO     | [lf.flight.extracted] SM480 on 02JAN: BKG=164, LF=98.2%
[LF] SM480 02JAN: BKG=164, GRP=135, CAP=167, LF%=98.2%, Brd-Off=JED-CAI, Classes: P:135, U:9, X:11, T:6, W:1, K:2
2025-12-28 09:14:56 | INFO     | [lf.flight.extracted] SM472 on 02JAN: BKG=160, LF=95.8%
[LF] SM472 02JAN: BKG=160, GRP=90, CAP=167, LF%=95.8%, Brd-Off=JED-CAI, Classes: P:90, I:5, O:5, U:12, X:22, T:24, S:2
2025-12-28 09:14:59 | INFO     | [lf.flight.extracted] SM460 on 02JAN: BKG=159, LF=95.2%
[LF] SM460 02JAN: BKG=159, GRP=118, CAP=167, LF%=95.2%, Brd-Off=JED-CAI, Classes: P:118, U:8, X:12, T:18, W:1, S:1, K:1
[LPC] SM460 02JAN: Found 0 outbound flights with connecting passengers
[LF] Getting WEEKLY/LASTSOLD data for 5 flights
[LF] SM424 02JAN: LASTSOLD=2025-12-28 00:00:00, WEEKLY=11, TODAY=1, YDAY=1
[LF] SM476 02JAN: LASTSOLD=2025-12-24 00:00:00, WEEKLY=5, TODAY=0, YDAY=0
[LF] SM480 02JAN: LASTSOLD=2025-12-27 00:00:00, WEEKLY=3, TODAY=0, YDAY=1
[LF] SM472 02JAN: LASTSOLD=2025-12-28 00:00:00, WEEKLY=20, TODAY=2, YDAY=2
[LF] SM460 02JAN: LASTSOLD=2025-12-27 00:00:00, WEEKLY=25, TODAY=0, YDAY=6
2025-12-28 09:15:33 | INFO     | [SUCCESS] Day 02JAN
2025-12-28 09:15:33 | INFO     | [DAY_START] Processing 01JAN
[LF] Processing JED-CAI for 01JAN
2025-12-28 09:15:33 | INFO     | [lf.day.start] Processing JED-CAI for 01JAN
[LF] 01JAN: found 7 direct flights
2025-12-28 09:15:36 | INFO     | [lf.day.flights_found] Found 7 flights on 01JAN
2025-12-28 09:15:39 | INFO     | [lf.flight.extracted] SM424 on 01JAN: BKG=23, LF=13.8%
[LF] SM424 01JAN: BKG=23, GRP=0, CAP=167, LF%=13.8%, Brd-Off=JED-CAI, Classes: U:20, X:3
[LPC] SM424 01JAN: Found 1 outbound flights with connecting passengers
2025-12-28 09:15:45 | INFO     | [lf.flight.extracted] SM472 on 01JAN: BKG=95, LF=57.9%
[LF] SM472 01JAN: BKG=95, GRP=51, CAP=164, LF%=57.9%, Brd-Off=JED-CAI, Classes: P:51, U:20, X:14, T:4, S:6
[LPC] SM472 01JAN: Found 1 outbound flights with connecting passengers
2025-12-28 09:15:52 | INFO     | [lf.flight.extracted] SM450 on 01JAN: BKG=179, LF=107.2%
[LF] SM450 01JAN: BKG=179, GRP=175, CAP=167, LF%=107.2%, Brd-Off=JED-CAI, Classes: N:5, P:46, E:125, U:3
[LPC] SM450 01JAN: Found 1 outbound flights with connecting passengers
2025-12-28 09:16:05 | INFO     | [lf.flight.extracted] SM476 on 01JAN: BKG=169, LF=97.1%
[LF] SM476 01JAN: BKG=169, GRP=128, CAP=174, LF%=97.1%, Brd-Off=JED-CAI, Classes: P:88, E:40, I:5, O:5, U:18, X:8, W:1, S:3, K:1
[LPC] SM476 01JAN: Found 3 outbound flights with connecting passengers
2025-12-28 09:16:12 | INFO     | [lf.flight.extracted] SM432 on 01JAN: BKG=0, LF=0.0%
[LF] SM432 01JAN: BKG=0, GRP=0, CAP=167, LF%=0.0%, Brd-Off=JED-ATZ
2025-12-28 09:16:27 | INFO     | [lf.flight.extracted] SM478 on 01JAN: BKG=160, LF=97.6%
[LF] SM478 01JAN: BKG=160, GRP=128, CAP=164, LF%=97.6%, Brd-Off=JED-CAI, Classes: P:128, X:10, T:5, W:11, S:6
[LPC] SM478 01JAN: Found 0 outbound flights with connecting passengers
2025-12-28 09:16:32 | INFO     | [lf.flight.extracted] SM480 on 01JAN: BKG=168, LF=94.4%
[LF] SM480 01JAN: BKG=168, GRP=139, CAP=178, LF%=94.4%, Brd-Off=JED-CAI, Classes: N:6, P:139, X:8, T:2, W:1, S:3, K:9
[LF] Getting WEEKLY/LASTSOLD data for 6 flights
[LF] SM424 01JAN: LASTSOLD=2025-12-26 00:00:00, WEEKLY=10, TODAY=0, YDAY=0
[LF] SM472 01JAN: LASTSOLD=2025-12-28 00:00:00, WEEKLY=29, TODAY=1, YDAY=10
[LF] SM450 01JAN: LASTSOLD=2025-12-21 00:00:00, WEEKLY=46, TODAY=0, YDAY=0
[LF] SM476 01JAN: LASTSOLD=2025-12-28 00:00:00, WEEKLY=28, TODAY=1, YDAY=0
[LF] SM478 01JAN: LASTSOLD=2025-12-27 00:00:00, WEEKLY=22, TODAY=0, YDAY=1
[LF] SM480 01JAN: LASTSOLD=2025-12-26 00:00:00, WEEKLY=3, TODAY=0, YDAY=0
2025-12-28 09:16:59 | INFO     | [SUCCESS] Day 01JAN
2025-12-28 09:16:59 | INFO     | [DAY_START] Processing 31DEC
[LF] Processing JED-CAI for 31DEC
2025-12-28 09:16:59 | INFO     | [lf.day.start] Processing JED-CAI for 31DEC
[LF] 31DEC: found 3 direct flights
2025-12-28 09:17:00 | INFO     | [lf.day.flights_found] Found 3 flights on 31DEC
2025-12-28 09:17:03 | INFO     | [lf.flight.extracted] SM476 on 31DEC: BKG=176, LF=98.9%
[LF] SM476 31DEC: BKG=176, GRP=132, CAP=178, LF%=98.9%, Brd-Off=JED-CAI, Classes: P:132, I:10, O:10, U:21, X:2, L:1
2025-12-28 09:17:06 | INFO     | [lf.flight.extracted] SM460 on 31DEC: BKG=125, LF=70.2%
[LF] SM460 31DEC: BKG=125, GRP=42, CAP=178, LF%=70.2%, Brd-Off=JED-CAI, Classes: P:42, I:10, O:10, U:21, X:24, T:3, W:7, S:8
[LPC] SM460 31DEC: Found 4 outbound flights with connecting passengers
2025-12-28 09:17:11 | INFO     | [lf.flight.extracted] SM478 on 31DEC: BKG=165, LF=92.7%
[LF] SM478 31DEC: BKG=165, GRP=100, CAP=178, LF%=92.7%, Brd-Off=JED-CAI, Classes: P:100, I:10, O:10, U:21, X:18, S:6
[LF] Getting WEEKLY/LASTSOLD data for 3 flights
[LF] SM476 31DEC: LASTSOLD=2025-12-27 00:00:00, WEEKLY=11, TODAY=0, YDAY=1
[LF] SM460 31DEC: LASTSOLD=2025-12-27 00:00:00, WEEKLY=26, TODAY=0, YDAY=7
[LF] SM478 31DEC: LASTSOLD=2025-12-28 00:00:00, WEEKLY=16, TODAY=1, YDAY=0
2025-12-28 09:17:27 | INFO     | [SUCCESS] Day 31DEC
2025-12-28 09:17:27 | INFO     | [DAY_START] Processing 30DEC
[LF] Processing JED-CAI for 30DEC
2025-12-28 09:17:27 | INFO     | [lf.day.start] Processing JED-CAI for 30DEC
[LF] 30DEC: found 6 direct flights
2025-12-28 09:17:28 | INFO     | [lf.day.flights_found] Found 6 flights on 30DEC
2025-12-28 09:17:30 | INFO     | [lf.flight.extracted] SM472 on 30DEC: BKG=161, LF=90.5%
[LF] SM472 30DEC: BKG=161, GRP=89, CAP=178, LF%=90.5%, Brd-Off=JED-CAI, Classes: P:89, I:20, O:10, U:11, X:8, T:21, W:1, K:1
[LPC] SM472 30DEC: Found 2 outbound flights with connecting passengers
2025-12-28 09:17:35 | INFO     | [lf.flight.extracted] SM480 on 30DEC: BKG=175, LF=98.3%
[LF] SM480 30DEC: BKG=175, GRP=140, CAP=178, LF%=98.3%, Brd-Off=JED-CAI, Classes: P:140, I:18, O:11, U:6
2025-12-28 09:17:38 | INFO     | [lf.flight.extracted] SM478 on 30DEC: BKG=170, LF=95.5%
[LF] SM478 30DEC: BKG=170, GRP=123, CAP=178, LF%=95.5%, Brd-Off=JED-CAI, Classes: P:78, E:45, I:21, O:10, U:11, X:4, S:1
[LPC] SM478 30DEC: Found 1 outbound flights with connecting passengers
2025-12-28 09:17:43 | INFO     | [lf.flight.extracted] SM460 on 30DEC: BKG=166, LF=94.9%
[LF] SM460 30DEC: BKG=166, GRP=94, CAP=175, LF%=94.9%, Brd-Off=JED-CAI, Classes: N:1, P:94, I:20, O:10, U:11, X:20, T:3, W:1, S:6
2025-12-28 09:17:47 | INFO     | [lf.flight.extracted] SM424 on 30DEC: BKG=174, LF=97.8%
[LF] SM424 30DEC: BKG=174, GRP=133, CAP=178, LF%=97.8%, Brd-Off=JED-CAI, Classes: P:88, E:45, I:20, O:10, U:10, V:1
2025-12-28 09:17:50 | INFO     | [lf.flight.extracted] SM476 on 30DEC: BKG=173, LF=98.9%
[LF] SM476 30DEC: BKG=173, GRP=100, CAP=175, LF%=98.9%, Brd-Off=JED-CAI, Classes: P:101, I:20, O:9, U:11, X:25, T:2, W:2, S:3
[LF] Getting WEEKLY/LASTSOLD data for 6 flights
[LF] SM472 30DEC: LASTSOLD=2025-12-27 00:00:00, WEEKLY=16, TODAY=0, YDAY=3
[LF] SM480 30DEC: LASTSOLD=2025-12-27 00:00:00, WEEKLY=9, TODAY=0, YDAY=1
[LF] SM478 30DEC: LASTSOLD=2025-12-24 00:00:00, WEEKLY=10, TODAY=0, YDAY=0
[LF] SM460 30DEC: LASTSOLD=2025-12-27 00:00:00, WEEKLY=17, TODAY=0, YDAY=2
[LF] SM424 30DEC: LASTSOLD=2025-12-24 00:00:00, WEEKLY=10, TODAY=0, YDAY=0
[LF] SM476 30DEC: LASTSOLD=2025-12-27 00:00:00, WEEKLY=16, TODAY=0, YDAY=1
2025-12-28 09:18:21 | INFO     | [SUCCESS] Day 30DEC
2025-12-28 09:18:21 | INFO     | [DAY_START] Processing 29DEC
[LF] Processing JED-CAI for 29DEC
2025-12-28 09:18:21 | INFO     | [lf.day.start] Processing JED-CAI for 29DEC
[LF] 29DEC: found 4 direct flights
2025-12-28 09:18:22 | INFO     | [lf.day.flights_found] Found 4 flights on 29DEC
2025-12-28 09:18:24 | INFO     | [lf.flight.extracted] SM480 on 29DEC: BKG=108, LF=61.4%
[LF] SM480 29DEC: BKG=108, GRP=0, CAP=176, LF%=61.4%, Brd-Off=JED-CAI, Classes: I:35, O:38, U:16, X:14, T:2, S:2, L:1
[LPC] SM480 29DEC: Found 2 outbound flights with connecting passengers
2025-12-28 09:18:29 | INFO     | [lf.flight.extracted] SM476 on 29DEC: BKG=171, LF=96.1%
[LF] SM476 29DEC: BKG=171, GRP=138, CAP=178, LF%=96.1%, Brd-Off=JED-CAI, Classes: P:138, I:20, O:10, S:2, G:1
2025-12-28 09:18:33 | INFO     | [lf.flight.extracted] SM478 on 29DEC: BKG=176, LF=100.6%
[LF] SM478 29DEC: BKG=176, GRP=129, CAP=175, LF%=100.6%, Brd-Off=JED-CAI, Classes: P:129, I:17, O:10, U:11, X:1, T:7, S:1
2025-12-28 09:18:37 | INFO     | [lf.flight.extracted] SM460 on 29DEC: BKG=177, LF=101.1%
[LF] SM460 29DEC: BKG=177, GRP=131, CAP=175, LF%=101.1%, Brd-Off=JED-CAI, Classes: P:131, I:16, O:1, X:1, W:3, S:22, G:3
[LPC] SM460 29DEC: Found 0 outbound flights with connecting passengers
[LF] Getting WEEKLY/LASTSOLD data for 4 flights
[LF] SM480 29DEC: LASTSOLD=2025-12-27 00:00:00, WEEKLY=38, TODAY=0, YDAY=7
[LF] SM476 29DEC: LASTSOLD=2025-12-23 00:00:00, WEEKLY=10, TODAY=0, YDAY=0
[LF] SM478 29DEC: LASTSOLD=2025-12-22 00:00:00, WEEKLY=8, TODAY=0, YDAY=0
[LF] SM460 29DEC: LASTSOLD=2025-12-25 00:00:00, WEEKLY=11, TODAY=0, YDAY=0
2025-12-28 09:18:58 | INFO     | [SUCCESS] Day 29DEC
[LF] Skipping 28DEC (Today) - will be processed by supplement scan
[LF] Results summary:
  2026-01-03: 3 flights
  2026-01-02: 5 flights
  2026-01-01: 7 flights
  2025-12-31: 3 flights
  2025-12-30: 6 flights
  2025-12-29: 4 flights
[LF] Cancelled flights found: 2
  - SM952 02JAN (SN)
  - SM478 02JAN (SN)
2025-12-28 09:18:58 | INFO     | [SUCCESS] LF Search Complete
[Worker_9223] Cancelled flights collected: 2

============================================================
[Worker_9223] ✓ COMPLETED: JED-CAI
  Results: 6 dates
  Errors: 0 dates
  Total Processed: 3 groups
============================================================

2025-12-28 09:19:00 | INFO     | [Worker_9223] Completed: JED-CAI - 6 results, 0 errors
[Worker_9223] Waiting for tasks...
