
============================================================
     LF WORKER - PORT 9224
============================================================
Worker: Worker_9224
Status: READY
Waiting for tasks...
============================================================


============================================================
[Worker_9224] Processing: JED-ATZ
  Tier 0: Range 2, Chunk 1/3
  Dates: 4 days
  Date Range: 2026-01-20 to 2026-01-17
============================================================

2025-12-28 09:11:38 | INFO     | ======================================================================
2025-12-28 09:11:38 | INFO     | Load Factor Scraper Started - Route: JED-ATZ
2025-12-28 09:11:38 | INFO     | Log file: D:\CODERED\LAB\market_insights\outputs\run_generated_281225_at_09.11\logs\LF_JED-ATZ_20251228_091138.log
2025-12-28 09:11:38 | INFO     | Enhanced logging: Capturing both logging.info() and print()
2025-12-28 09:11:38 | INFO     | ======================================================================
[LF] Processing dates (override): ['20JAN', '19JAN', '18JAN', '17JAN']
[LF] Attaching to Chrome for Altea access
[LF][[OK] SUCCESS] Connected to Chrome on 127.0.0.1:9224 (after 1 attempts)
[LF][[OK] SUCCESS] Found Amadeus Altea window: Altéa Reservation Desktop
[LF][[INFO] INFO] URL: https://tc212.resdesktop.altea.amadeus.com/app_ard/apf/init/login?SITE=ESMPESMP&LANGUAGE=GB&MARKETS=ARDW_PROD_WBP&ACTION=clpLogin
[LF] Processing JED-ATZ for 20JAN
[LF][ERROR] Amadeus command error detected: UNKNOWN TRANSACTION
[LF][ERROR] Command: SN20JANJEDATZ/ASM
[LF][RESYNC] Triggering immediate resync to last successful SN command
============================================================
[LF][RESYNC] Command 'SN20JANJEDATZ/ASM' failed: TECH_ERROR:UNKNOWN TRANSACTION
[LF][RESYNC] Re-running entire day from SN command for JED-ATZ 20JAN
[LF][RESYNC] Attempt 1/50 (waiting 1.0s before retry...)
============================================================
[LF][RESYNC] Sending IG to clear session state...
[LF][RESYNC] Session cleared with IG
[LF] Processing JED-ATZ for 20JAN
[LF] 20JAN: found 2 direct flights
[LF] SM454 20JAN: BKG=161, GRP=134, CAP=167, LF%=96.4%, Brd-Off=JED-ATZ, Classes: P:90, E:44, I:17, O:8, T:1, S:1
[LF] SM456 20JAN: BKG=159, GRP=135, CAP=167, LF%=95.2%, Brd-Off=JED-ATZ, Classes: P:135, I:17, O:4, U:3
[LF] Getting WEEKLY/LASTSOLD data for 2 flights
[LF] SM454 20JAN: LASTSOLD=2025-12-27 00:00:00, WEEKLY=9, TODAY=0, YDAY=4
[LF] SM456 20JAN: LASTSOLD=2025-12-27 00:00:00, WEEKLY=9, TODAY=0, YDAY=1
[LF] Processing JED-ATZ for 19JAN
[LF] 19JAN: found 4 direct flights
[LF] SM492 19JAN: BKG=67, GRP=48, CAP=167, LF%=40.1%, Brd-Off=JED-ATZ, Classes: P:48, I:16, O:2, S:1
[LF] SM456 19JAN: BKG=17, GRP=0, CAP=167, LF%=10.2%, Brd-Off=JED-ATZ, Classes: I:17
[LF] SM422 19JAN: BKG=21, GRP=0, CAP=167, LF%=12.6%, Brd-Off=JED-ATZ, Classes: I:17, O:3, K:1
[LF] SM454 19JAN: BKG=116, GRP=91, CAP=167, LF%=69.5%, Brd-Off=JED-ATZ, Classes: E:91, I:17, O:5, U:2, S:1
[LF] Getting WEEKLY/LASTSOLD data for 4 flights
[LF] SM492 19JAN: LASTSOLD=2025-12-27 00:00:00, WEEKLY=8, TODAY=0, YDAY=6
[LF] SM456 19JAN: LASTSOLD=2025-12-27 00:00:00, WEEKLY=11, TODAY=0, YDAY=1
[LF] SM422 19JAN: LASTSOLD=2025-12-26 00:00:00, WEEKLY=14, TODAY=0, YDAY=0
[LF] SM454 19JAN: LASTSOLD=2025-12-27 00:00:00, WEEKLY=9, TODAY=0, YDAY=2
[LF] Processing JED-ATZ for 18JAN
[LF] 18JAN: found 2 direct flights
[LF] SM492 18JAN: BKG=125, GRP=90, CAP=167, LF%=74.9%, Brd-Off=JED-ATZ, Classes: P:90, I:17, O:17, U:1
[LF] SM456 18JAN: BKG=77, GRP=45, CAP=167, LF%=46.1%, Brd-Off=JED-ATZ, Classes: P:45, I:17, O:14, S:1
[LF] Getting WEEKLY/LASTSOLD data for 2 flights
[LF] SM492 18JAN: LASTSOLD=2025-12-25 00:00:00, WEEKLY=14, TODAY=0, YDAY=0
[LF] SM456 18JAN: LASTSOLD=2025-12-27 00:00:00, WEEKLY=18, TODAY=0, YDAY=1
[LF] Processing JED-ATZ for 17JAN
[LF] 17JAN: found 3 direct flights
[LF] SM492 17JAN: BKG=100, GRP=94, CAP=167, LF%=59.9%, Brd-Off=JED-ATZ, Classes: P:45, E:49, I:4, L:1, K:1
[LF] SM454 17JAN: BKG=54, GRP=45, CAP=167, LF%=32.3%, Brd-Off=JED-ATZ, Classes: P:45, I:4, U:4, G:1
[LF] SM456 17JAN: BKG=59, GRP=50, CAP=167, LF%=35.3%, Brd-Off=JED-ATZ, Classes: P:50, I:4, O:2, G:3
[LF] Getting WEEKLY/LASTSOLD data for 3 flights
[LF] SM492 17JAN: LASTSOLD=2025-12-22 00:00:00, WEEKLY=1, TODAY=0, YDAY=0
[LF] SM454 17JAN: LASTSOLD=2025-12-27 00:00:00, WEEKLY=1, TODAY=0, YDAY=1
[LF] SM456 17JAN: LASTSOLD=2025-12-26 00:00:00, WEEKLY=3, TODAY=0, YDAY=0
[LF] Results summary:
  2026-01-20: 2 flights
  2026-01-19: 4 flights
  2026-01-18: 2 flights
  2026-01-17: 3 flights

============================================================
[Worker_9224] ✓ COMPLETED: JED-ATZ
  Results: 4 dates
  Errors: 0 dates
  Total Processed: 1 groups
============================================================


============================================================
[Worker_9224] Processing: JED-CAI
  Tier 0: Range 1, Chunk 1/2
  Dates: 7 days
  Date Range: 2026-01-10 to 2026-01-04
============================================================

2025-12-28 09:13:20 | INFO     | ======================================================================
2025-12-28 09:13:20 | INFO     | Load Factor Scraper Started - Route: JED-CAI
2025-12-28 09:13:20 | INFO     | Log file: D:\CODERED\LAB\market_insights\outputs\run_generated_281225_at_09.11\logs\LF_JED-CAI_20251228_091320.log
2025-12-28 09:13:20 | INFO     | Enhanced logging: Capturing both logging.info() and print()
2025-12-28 09:13:20 | INFO     | ======================================================================
[LF] Processing dates (override): ['10JAN', '09JAN', '08JAN', '07JAN', '06JAN', '05JAN', '04JAN']
[LF] Attaching to Chrome for Altea access
2025-12-28 09:13:20 | INFO     | Starting LF search for route: JED-CAI
2025-12-28 09:13:20 | INFO     | [START] LF Search
[LF][[OK] SUCCESS] Connected to Chrome on 127.0.0.1:9224 (after 1 attempts)
2025-12-28 09:13:22 | INFO     | [HEALTH CHECK] [OK] Chrome connection is healthy
[LF][[OK] SUCCESS] Found Amadeus Altea window: Altéa Reservation Desktop
[LF][[INFO] INFO] URL: https://tc212.resdesktop.altea.amadeus.com/app_ard/apf/init/login?SITE=ESMPESMP&LANGUAGE=GB&MARKETS=ARDW_PROD_WBP&ACTION=clpLogin
2025-12-28 09:13:22 | INFO     | [DAY_START] Processing 10JAN
[LF] Processing JED-CAI for 10JAN
2025-12-28 09:13:22 | INFO     | [lf.day.start] Processing JED-CAI for 10JAN
[LF] 10JAN: found 3 direct flights
2025-12-28 09:13:23 | INFO     | [lf.day.flights_found] Found 3 flights on 10JAN
2025-12-28 09:13:25 | INFO     | [lf.flight.extracted] SM450 on 10JAN: BKG=151, LF=90.4%
[LF] SM450 10JAN: BKG=151, GRP=79, CAP=167, LF%=90.4%, Brd-Off=JED-CAI, Classes: P:79, U:10, X:12, T:5, W:8, S:4, G:7, L:6, V:17, K:3
[LPC] SM450 10JAN: Found 1 outbound flights with connecting passengers
2025-12-28 09:13:32 | INFO     | [lf.flight.extracted] SM476 on 10JAN: BKG=154, LF=92.2%
[LF] SM476 10JAN: BKG=154, GRP=87, CAP=167, LF%=92.2%, Brd-Off=JED-CAI, Classes: P:87, U:10, X:12, T:12, W:1, G:13, L:19
[LPC] SM476 10JAN: Found 0 outbound flights with connecting passengers
2025-12-28 09:13:37 | INFO     | [lf.flight.extracted] SM478 on 10JAN: BKG=155, LF=94.5%
[LF] SM478 10JAN: BKG=155, GRP=123, CAP=164, LF%=94.5%, Brd-Off=JED-CAI, Classes: P:123, U:10, X:12, T:5, W:2, K:3
[LF] Getting WEEKLY/LASTSOLD data for 3 flights
[LF] SM450 10JAN: LASTSOLD=2025-12-26 00:00:00, WEEKLY=10, TODAY=0, YDAY=0
[LF] SM476 10JAN: LASTSOLD=2025-12-27 00:00:00, WEEKLY=27, TODAY=0, YDAY=18
[LF] SM478 10JAN: LASTSOLD=2025-12-22 00:00:00, WEEKLY=3, TODAY=0, YDAY=0
2025-12-28 09:13:59 | INFO     | [SUCCESS] Day 10JAN
2025-12-28 09:13:59 | INFO     | [DAY_START] Processing 09JAN
[LF] Processing JED-CAI for 09JAN
2025-12-28 09:13:59 | INFO     | [lf.day.start] Processing JED-CAI for 09JAN
[LF] 09JAN: found 6 direct flights
2025-12-28 09:14:01 | INFO     | [lf.day.flights_found] Found 6 flights on 09JAN
2025-12-28 09:14:04 | INFO     | [lf.flight.extracted] SM424 on 09JAN: BKG=100, LF=61.0%
[LF] SM424 09JAN: BKG=100, GRP=1, CAP=164, LF%=61.0%, Brd-Off=JED-CAI, Classes: P:1, U:10, X:12, T:7, W:11, S:8, G:5, L:27, V:15, K:4
[LPC] SM424 09JAN: Found 1 outbound flights with connecting passengers
2025-12-28 09:14:11 | INFO     | [lf.flight.extracted] SM476 on 09JAN: BKG=166, LF=99.4%
[LF] SM476 09JAN: BKG=166, GRP=58, CAP=167, LF%=99.4%, Brd-Off=JED-CAI, Classes: P:58, U:10, X:12, T:10, W:8, S:30, G:15, L:15, V:8
[LPC] SM476 09JAN: Found 1 outbound flights with connecting passengers
2025-12-28 09:14:18 | INFO     | [lf.flight.extracted] SM478 on 09JAN: BKG=125, LF=74.9%
[LF] SM478 09JAN: BKG=125, GRP=0, CAP=167, LF%=74.9%, Brd-Off=JED-CAI, Classes: U:10, X:12, T:12, W:12, S:11, G:11, L:27, V:14, K:16
[LPC] SM478 09JAN: Found 2 outbound flights with connecting passengers
2025-12-28 09:14:24 | INFO     | [lf.flight.extracted] SM480 on 09JAN: BKG=148, LF=88.6%
[LF] SM480 09JAN: BKG=148, GRP=45, CAP=167, LF%=88.6%, Brd-Off=JED-CAI, Classes: P:45, U:10, X:12, T:12, W:10, S:14, G:22, L:10, V:9, K:4
2025-12-28 09:14:28 | INFO     | [lf.flight.extracted] SM472 on 09JAN: BKG=121, LF=72.5%
[LF] SM472 09JAN: BKG=121, GRP=54, CAP=167, LF%=72.5%, Brd-Off=JED-CAI, Classes: P:54, U:10, X:12, T:12, W:12, S:11, G:7, K:3
[LPC] SM472 09JAN: Found 0 outbound flights with connecting passengers
2025-12-28 09:14:33 | INFO     | [lf.flight.extracted] SM460 on 09JAN: BKG=165, LF=100.6%
[LF] SM460 09JAN: BKG=165, GRP=135, CAP=164, LF%=100.6%, Brd-Off=JED-CAI, Classes: P:135, U:10, X:12, T:8
[LF] Getting WEEKLY/LASTSOLD data for 6 flights
[LF] SM424 09JAN: LASTSOLD=2025-12-27 00:00:00, WEEKLY=30, TODAY=0, YDAY=7
[LF] SM476 09JAN: LASTSOLD=2025-12-27 00:00:00, WEEKLY=37, TODAY=0, YDAY=5
[LF] SM478 09JAN: LASTSOLD=2025-12-27 00:00:00, WEEKLY=44, TODAY=0, YDAY=9
[LF] SM480 09JAN: LASTSOLD=2025-12-27 00:00:00, WEEKLY=34, TODAY=0, YDAY=4
[LF] SM472 09JAN: LASTSOLD=2025-12-26 00:00:00, WEEKLY=5, TODAY=0, YDAY=0
[LF] SM460 09JAN: LASTSOLD=2025-12-15 00:00:00, WEEKLY=0, TODAY=0, YDAY=0
2025-12-28 09:15:02 | INFO     | [SUCCESS] Day 09JAN
2025-12-28 09:15:02 | INFO     | [DAY_START] Processing 08JAN
[LF] Processing JED-CAI for 08JAN
2025-12-28 09:15:02 | INFO     | [lf.day.start] Processing JED-CAI for 08JAN
[LF] 08JAN: found 6 direct flights
2025-12-28 09:15:03 | INFO     | [lf.day.flights_found] Found 6 flights on 08JAN
2025-12-28 09:15:05 | INFO     | [lf.flight.extracted] SM472 on 08JAN: BKG=121, LF=72.5%
[LF] SM472 08JAN: BKG=121, GRP=47, CAP=167, LF%=72.5%, Brd-Off=JED-CAI, Classes: P:47, U:19, X:23, W:8, S:24
[LPC] SM472 08JAN: Found 3 outbound flights with connecting passengers
2025-12-28 09:15:10 | INFO     | [lf.flight.extracted] SM450 on 08JAN: BKG=137, LF=83.5%
[LF] SM450 08JAN: BKG=137, GRP=15, CAP=164, LF%=83.5%, Brd-Off=JED-CAI, Classes: E:15, U:10, X:12, T:6, W:1, S:17, G:8, L:15, V:22, K:19, Q:10, H:2
[LPC] SM450 08JAN: Found 2 outbound flights with connecting passengers
2025-12-28 09:15:25 | INFO     | [lf.flight.extracted] SM476 on 08JAN: BKG=174, LF=97.8%
[LF] SM476 08JAN: BKG=174, GRP=120, CAP=178, LF%=97.8%, Brd-Off=JED-CAI, Classes: P:120, U:10, X:17, T:7, W:5, S:15
[LPC] SM476 08JAN: Found 1 outbound flights with connecting passengers
2025-12-28 09:15:32 | INFO     | [lf.flight.extracted] SM432 on 08JAN: BKG=159, LF=95.2%
[LF] SM432 08JAN: BKG=159, GRP=120, CAP=167, LF%=95.2%, Brd-Off=JED-CAI, Classes: P:121, X:12, T:8, W:6, S:5, G:7
2025-12-28 09:15:38 | INFO     | [lf.flight.extracted] SM478 on 08JAN: BKG=164, LF=100.0%
[LF] SM478 08JAN: BKG=164, GRP=92, CAP=164, LF%=100.0%, Brd-Off=JED-CAI, Classes: P:92, U:10, X:12, T:11, W:12, S:12, G:13, L:1, Q:1
2025-12-28 09:15:43 | INFO     | [lf.flight.extracted] SM480 on 08JAN: BKG=174, LF=100.0%
[LF] SM480 08JAN: BKG=174, GRP=90, CAP=174, LF%=100.0%, Brd-Off=JED-CAI, Classes: P:90, U:10, X:12, T:12, W:11, S:11, G:18, L:4, V:6
[LF] Getting WEEKLY/LASTSOLD data for 6 flights
[LF] SM472 08JAN: LASTSOLD=2025-12-27 00:00:00, WEEKLY=26, TODAY=0, YDAY=12
[LF] SM450 08JAN: LASTSOLD=2025-12-27 00:00:00, WEEKLY=31, TODAY=0, YDAY=6
[LF] SM476 08JAN: LASTSOLD=2025-12-25 00:00:00, WEEKLY=52, TODAY=0, YDAY=0
[LF] SM432 08JAN: LASTSOLD=2025-12-28 00:00:00, WEEKLY=9, TODAY=1, YDAY=0
[LF] SM478 08JAN: LASTSOLD=2025-12-25 00:00:00, WEEKLY=1, TODAY=0, YDAY=0
[LF] SM480 08JAN: LASTSOLD=2025-12-27 00:00:00, WEEKLY=6, TODAY=0, YDAY=1
2025-12-28 09:16:19 | INFO     | [SUCCESS] Day 08JAN
2025-12-28 09:16:19 | INFO     | [DAY_START] Processing 07JAN
[LF] Processing JED-CAI for 07JAN
2025-12-28 09:16:19 | INFO     | [lf.day.start] Processing JED-CAI for 07JAN
[LF] 07JAN: found 4 direct flights
2025-12-28 09:16:19 | INFO     | [lf.day.flights_found] Found 4 flights on 07JAN
2025-12-28 09:16:22 | INFO     | [lf.flight.extracted] SM476 on 07JAN: BKG=169, LF=96.6%
[LF] SM476 07JAN: BKG=169, GRP=136, CAP=175, LF%=96.6%, Brd-Off=JED-CAI, Classes: P:136, U:10, X:12, W:8, S:3
2025-12-28 09:16:25 | INFO     | [lf.flight.extracted] SM478 on 07JAN: BKG=167, LF=100.0%
[LF] SM478 07JAN: BKG=167, GRP=95, CAP=167, LF%=100.0%, Brd-Off=JED-CAI, Classes: P:48, E:47, U:10, X:12, T:10, W:23, S:17
2025-12-28 09:16:29 | INFO     | [lf.flight.extracted] SM460 on 07JAN: BKG=168, LF=94.4%
[LF] SM460 07JAN: BKG=168, GRP=137, CAP=178, LF%=94.4%, Brd-Off=JED-CAI, Classes: P:137, U:10, X:12, T:5, S:4
2025-12-28 09:16:32 | INFO     | [lf.flight.extracted] SM424 on 07JAN: BKG=178, LF=100.0%
[LF] SM424 07JAN: BKG=178, GRP=142, CAP=178, LF%=100.0%, Brd-Off=JED-CAI, Classes: P:142, U:10, X:10, T:1, W:6, S:9
[LF] Getting WEEKLY/LASTSOLD data for 4 flights
[LF] SM476 07JAN: LASTSOLD=2025-12-28 00:00:00, WEEKLY=10, TODAY=1, YDAY=3
[LF] SM478 07JAN: LASTSOLD=2025-12-27 00:00:00, WEEKLY=40, TODAY=0, YDAY=11
[LF] SM460 07JAN: LASTSOLD=2025-12-25 00:00:00, WEEKLY=6, TODAY=0, YDAY=0
[LF] SM424 07JAN: LASTSOLD=2025-12-23 00:00:00, WEEKLY=9, TODAY=0, YDAY=0
2025-12-28 09:16:51 | INFO     | [SUCCESS] Day 07JAN
2025-12-28 09:16:51 | INFO     | [DAY_START] Processing 06JAN
[LF] Processing JED-CAI for 06JAN
2025-12-28 09:16:51 | INFO     | [lf.day.start] Processing JED-CAI for 06JAN
[LF] 06JAN: found 6 direct flights
2025-12-28 09:16:52 | INFO     | [lf.day.flights_found] Found 6 flights on 06JAN
2025-12-28 09:16:55 | INFO     | [lf.flight.extracted] SM472 on 06JAN: BKG=151, LF=90.4%
[LF] SM472 06JAN: BKG=151, GRP=107, CAP=167, LF%=90.4%, Brd-Off=JED-CAI, Classes: P:69, E:38, U:20, X:6, W:8, S:7, K:3
[LPC] SM472 06JAN: Found 1 outbound flights with connecting passengers
2025-12-28 09:16:59 | INFO     | [lf.flight.extracted] SM480 on 06JAN: BKG=114, LF=68.3%
[LF] SM480 06JAN: BKG=114, GRP=88, CAP=167, LF%=68.3%, Brd-Off=JED-CAI, Classes: P:48, E:40, U:14, X:2, T:8, W:1, S:1
2025-12-28 09:17:02 | INFO     | [lf.flight.extracted] SM478 on 06JAN: BKG=123, LF=75.0%
[LF] SM478 06JAN: BKG=123, GRP=95, CAP=164, LF%=75.0%, Brd-Off=JED-CAI, Classes: P:45, E:50, U:7, X:11, T:10
2025-12-28 09:17:06 | INFO     | [lf.flight.extracted] SM460 on 06JAN: BKG=127, LF=76.0%
[LF] SM460 06JAN: BKG=127, GRP=91, CAP=167, LF%=76.0%, Brd-Off=JED-CAI, Classes: N:4, P:91, U:10, X:12, T:10
2025-12-28 09:17:09 | INFO     | [lf.flight.extracted] SM424 on 06JAN: BKG=155, LF=92.8%
[LF] SM424 06JAN: BKG=155, GRP=136, CAP=167, LF%=92.8%, Brd-Off=JED-CAI, Classes: P:136, U:9, X:7, T:3
2025-12-28 09:17:13 | INFO     | [lf.flight.extracted] SM476 on 06JAN: BKG=112, LF=68.3%
[LF] SM476 06JAN: BKG=112, GRP=86, CAP=164, LF%=68.3%, Brd-Off=JED-CAI, Classes: P:86, U:10, T:7, W:8, S:1
[LPC] SM476 06JAN: Found 0 outbound flights with connecting passengers
[LF] Getting WEEKLY/LASTSOLD data for 6 flights
[LF] SM472 06JAN: LASTSOLD=2025-12-24 00:00:00, WEEKLY=82, TODAY=0, YDAY=0
[LF] SM480 06JAN: LASTSOLD=2025-12-27 00:00:00, WEEKLY=9, TODAY=0, YDAY=6
[LF] SM478 06JAN: LASTSOLD=2025-12-28 00:00:00, WEEKLY=11, TODAY=3, YDAY=1
[LF] SM460 06JAN: LASTSOLD=2025-12-27 00:00:00, WEEKLY=12, TODAY=0, YDAY=1
[LF] SM424 06JAN: LASTSOLD=2025-12-25 00:00:00, WEEKLY=9, TODAY=0, YDAY=0
[LF] SM476 06JAN: LASTSOLD=2025-12-27 00:00:00, WEEKLY=7, TODAY=0, YDAY=3
2025-12-28 09:17:39 | INFO     | [SUCCESS] Day 06JAN
2025-12-28 09:17:39 | INFO     | [DAY_START] Processing 05JAN
[LF] Processing JED-CAI for 05JAN
2025-12-28 09:17:39 | INFO     | [lf.day.start] Processing JED-CAI for 05JAN
[LF] 05JAN: found 4 direct flights
2025-12-28 09:17:41 | INFO     | [lf.day.flights_found] Found 4 flights on 05JAN
2025-12-28 09:17:43 | INFO     | [lf.flight.extracted] SM480 on 05JAN: BKG=73, LF=43.7%
[LF] SM480 05JAN: BKG=73, GRP=44, CAP=167, LF%=43.7%, Brd-Off=JED-CAI, Classes: P:44, U:21, X:3, S:5
2025-12-28 09:17:46 | INFO     | [lf.flight.extracted] SM476 on 05JAN: BKG=177, LF=98.9%
[LF] SM476 05JAN: BKG=177, GRP=142, CAP=179, LF%=98.9%, Brd-Off=JED-CAI, Classes: P:142, U:20, X:12, W:1, S:2
2025-12-28 09:17:49 | INFO     | [lf.flight.extracted] SM478 on 05JAN: BKG=168, LF=100.6%
[LF] SM478 05JAN: BKG=168, GRP=138, CAP=167, LF%=100.6%, Brd-Off=JED-CAI, Classes: P:138, U:16, X:12, W:1, K:1
2025-12-28 09:17:53 | INFO     | [lf.flight.extracted] SM460 on 05JAN: BKG=167, LF=100.0%
[LF] SM460 05JAN: BKG=167, GRP=132, CAP=167, LF%=100.0%, Brd-Off=JED-CAI, Classes: P:132, U:15, X:3, W:1, S:9, Q:2, H:5
[LPC] SM460 05JAN: Found 0 outbound flights with connecting passengers
[LF] Getting WEEKLY/LASTSOLD data for 4 flights
[LF] SM480 05JAN: LASTSOLD=2025-12-28 00:00:00, WEEKLY=14, TODAY=2, YDAY=2
[LF] SM476 05JAN: LASTSOLD=2025-12-26 00:00:00, WEEKLY=13, TODAY=0, YDAY=0
[LF] SM478 05JAN: LASTSOLD=2025-12-24 00:00:00, WEEKLY=8, TODAY=0, YDAY=0
[LF] SM460 05JAN: LASTSOLD=2025-12-25 00:00:00, WEEKLY=10, TODAY=0, YDAY=0
2025-12-28 09:18:15 | INFO     | [SUCCESS] Day 05JAN
2025-12-28 09:18:15 | INFO     | [DAY_START] Processing 04JAN
[LF] Processing JED-CAI for 04JAN
2025-12-28 09:18:15 | INFO     | [lf.day.start] Processing JED-CAI for 04JAN
[LF] 04JAN: found 5 direct flights
2025-12-28 09:18:16 | INFO     | [lf.day.flights_found] Found 5 flights on 04JAN
2025-12-28 09:18:18 | INFO     | [lf.flight.extracted] SM424 on 04JAN: BKG=168, LF=100.6%
[LF] SM424 04JAN: BKG=168, GRP=160, CAP=167, LF%=100.6%, Brd-Off=JED-CAI, Classes: N:5, E:155, X:5, T:3
[LPC] SM424 04JAN: Found 2 outbound flights with connecting passengers
2025-12-28 09:18:32 | INFO     | [lf.flight.extracted] SM476 on 04JAN: BKG=82, LF=49.1%
[LF] SM476 04JAN: BKG=82, GRP=27, CAP=167, LF%=49.1%, Brd-Off=JED-CAI, Classes: P:27, I:17, O:2, U:25, X:9, W:1, K:1
2025-12-28 09:18:35 | INFO     | [lf.flight.extracted] SM432 on 04JAN: BKG=118, LF=70.7%
[LF] SM432 04JAN: BKG=118, GRP=96, CAP=167, LF%=70.7%, Brd-Off=JED-CAI, Classes: P:96, U:10, X:11, K:1
2025-12-28 09:18:39 | INFO     | [lf.flight.extracted] SM460 on 04JAN: BKG=133, LF=79.6%
[LF] SM460 04JAN: BKG=133, GRP=97, CAP=167, LF%=79.6%, Brd-Off=JED-CAI, Classes: N:2, P:97, U:20, X:10, W:2, S:1, K:1
2025-12-28 09:18:42 | INFO     | [lf.flight.extracted] SM478 on 04JAN: BKG=133, LF=79.6%
[LF] SM478 04JAN: BKG=133, GRP=97, CAP=167, LF%=79.6%, Brd-Off=JED-CAI, Classes: P:97, I:1, U:19, X:13, W:2, S:1
[LF] Getting WEEKLY/LASTSOLD data for 5 flights
[LF] SM424 04JAN: LASTSOLD=2025-12-19 00:00:00, WEEKLY=0, TODAY=0, YDAY=0
[LF] SM476 04JAN: LASTSOLD=2025-12-28 00:00:00, WEEKLY=36, TODAY=1, YDAY=8
[LF] SM432 04JAN: LASTSOLD=2025-12-28 00:00:00, WEEKLY=10, TODAY=1, YDAY=6
[LF] SM460 04JAN: LASTSOLD=2025-12-27 00:00:00, WEEKLY=14, TODAY=0, YDAY=2
[LF] SM478 04JAN: LASTSOLD=2025-12-24 00:00:00, WEEKLY=10, TODAY=0, YDAY=0
2025-12-28 09:19:05 | INFO     | [SUCCESS] Day 04JAN
[LF] Results summary:
  2026-01-10: 3 flights
  2026-01-09: 6 flights
  2026-01-08: 6 flights
  2026-01-07: 4 flights
  2026-01-06: 6 flights
  2026-01-05: 4 flights
  2026-01-04: 5 flights
2025-12-28 09:19:05 | INFO     | [SUCCESS] LF Search Complete

============================================================
[Worker_9224] ✓ COMPLETED: JED-CAI
  Results: 7 dates
  Errors: 0 dates
  Total Processed: 2 groups
============================================================

2025-12-28 09:19:07 | INFO     | [Worker_9224] Completed: JED-CAI - 7 results, 0 errors
[Worker_9224] Waiting for tasks...
2025-12-28 09:26:08 | ERROR    | [Worker_9224] Worker error: 
Process Process-4:
