
============================================================
     LF WORKER - PORT 9226
============================================================
Worker: Worker_9226
Status: READY
Waiting for tasks...
============================================================


============================================================
[Worker_9226] Processing: JED-CAI
  Tier 0: Range 2, Chunk 2/3
  Dates: 3 days
  Date Range: 2026-01-16 to 2026-01-14
============================================================

2025-12-28 09:11:38 | INFO     | ======================================================================
2025-12-28 09:11:38 | INFO     | Load Factor Scraper Started - Route: JED-CAI
2025-12-28 09:11:38 | INFO     | Log file: D:\CODERED\LAB\market_insights\outputs\run_generated_281225_at_09.11\logs\LF_JED-CAI_20251228_091138.log
2025-12-28 09:11:38 | INFO     | Enhanced logging: Capturing both logging.info() and print()
2025-12-28 09:11:38 | INFO     | ======================================================================
[LF] Processing dates (override): ['16JAN', '15JAN', '14JAN']
[LF] Attaching to Chrome for Altea access
[LF][[OK] SUCCESS] Connected to Chrome on 127.0.0.1:9226 (after 1 attempts)
[LF][[OK] SUCCESS] Found Amadeus Altea window: Altéa Reservation Desktop
[LF][[INFO] INFO] URL: https://tc212.resdesktop.altea.amadeus.com/app_ard/apf/init/login?SITE=ESMPESMP&LANGUAGE=GB&MARKETS=ARDW_PROD_WBP&ACTION=clpLogin
[LF] Processing JED-CAI for 16JAN
[LF][ERROR] Amadeus command error detected: UNKNOWN TRANSACTION
[LF][ERROR] Command: SN16JANJEDCAI/ASM
[LF][RESYNC] Triggering immediate resync to last successful SN command
============================================================
[LF][RESYNC] Command 'SN16JANJEDCAI/ASM' failed: TECH_ERROR:UNKNOWN TRANSACTION
[LF][RESYNC] Re-running entire day from SN command for JED-CAI 16JAN
[LF][RESYNC] Attempt 1/50 (waiting 1.0s before retry...)
============================================================
[LF][RESYNC] Sending IG to clear session state...
[LF][RESYNC] Session cleared with IG
[LF] Processing JED-CAI for 16JAN
[LF] 16JAN: found 6 direct flights
[LF] SM424 16JAN: BKG=4, GRP=0, CAP=167, LF%=2.4%, Brd-Off=JED-CAI, Classes: O:3, U:1
[LF] SM476 16JAN: BKG=6, GRP=0, CAP=167, LF%=3.6%, Brd-Off=JED-CAI, Classes: O:2, U:4
[LF] SM478 16JAN: BKG=0, GRP=0, CAP=167, LF%=0.0%, Brd-Off=JED-CAI
[LF] SM480 16JAN: BKG=18, GRP=0, CAP=167, LF%=10.8%, Brd-Off=JED-CAI, Classes: O:6, U:7, G:1, K:4
[LF] SM472 16JAN: BKG=63, GRP=49, CAP=167, LF%=37.7%, Brd-Off=JED-CAI, Classes: E:49, O:3, U:10, X:1
[LF] SM460 16JAN: BKG=49, GRP=43, CAP=167, LF%=29.3%, Brd-Off=JED-CAI, Classes: P:43, U:5, G:1
[LF] Getting WEEKLY/LASTSOLD data for 5 flights
[LF] SM424 16JAN: LASTSOLD=2025-12-27 00:00:00, WEEKLY=3, TODAY=0, YDAY=2
[LF] SM476 16JAN: LASTSOLD=2025-12-27 00:00:00, WEEKLY=2, TODAY=0, YDAY=2
[LF] SM480 16JAN: LASTSOLD=2025-12-27 00:00:00, WEEKLY=10, TODAY=0, YDAY=3
[LF] SM472 16JAN: LASTSOLD=2025-12-26 00:00:00, WEEKLY=3, TODAY=0, YDAY=0
[LF] SM460 16JAN: LASTSOLD=2025-12-24 00:00:00, WEEKLY=2, TODAY=0, YDAY=0
[LF] Processing JED-CAI for 15JAN
[LF] 15JAN: found 6 direct flights
[LF] SM472 15JAN: BKG=55, GRP=45, CAP=167, LF%=32.9%, Brd-Off=JED-CAI, Classes: P:45, U:9, X:1
[LF] SM450 15JAN: BKG=1, GRP=0, CAP=167, LF%=0.6%, Brd-Off=JED-CAI, Classes: U:1
[LF] SM476 15JAN: BKG=0, GRP=0, CAP=167, LF%=0.0%, Brd-Off=JED-CAI
[LF] SM432 15JAN: BKG=0, GRP=0, CAP=164, LF%=0.0%, Brd-Off=JED-CAI
[LF] SM478 15JAN: BKG=103, GRP=94, CAP=167, LF%=61.7%, Brd-Off=JED-CAI, Classes: P:94, U:9
[LF] SM480 15JAN: BKG=101, GRP=92, CAP=167, LF%=60.5%, Brd-Off=JED-CAI, Classes: P:92, U:7, S:1, L:1
[LF] Getting WEEKLY/LASTSOLD data for 4 flights
[LF] SM472 15JAN: LASTSOLD=2025-12-15 00:00:00, WEEKLY=0, TODAY=0, YDAY=0
[LF] SM450 15JAN: LASTSOLD=2025-11-03 00:00:00, WEEKLY=0, TODAY=0, YDAY=0
[LF] SM478 15JAN: LASTSOLD=2025-12-13 00:00:00, WEEKLY=0, TODAY=0, YDAY=0
[LF] SM480 15JAN: LASTSOLD=2025-12-27 00:00:00, WEEKLY=6, TODAY=0, YDAY=2
[LF] Processing JED-CAI for 14JAN
[LF] 14JAN: found 4 direct flights
[LF] SM476 14JAN: BKG=54, GRP=48, CAP=167, LF%=32.3%, Brd-Off=JED-CAI, Classes: P:48, U:6
[LF] SM478 14JAN: BKG=108, GRP=96, CAP=164, LF%=65.8%, Brd-Off=JED-CAI, Classes: P:51, E:45, U:10, X:2
[LF] SM460 14JAN: BKG=145, GRP=135, CAP=167, LF%=86.8%, Brd-Off=JED-CAI, Classes: P:135, U:10
[LF] SM424 14JAN: BKG=8, GRP=0, CAP=167, LF%=4.8%, Brd-Off=JED-CAI, Classes: I:4, U:3, G:1
[LF] Getting WEEKLY/LASTSOLD data for 4 flights
[LF] SM476 14JAN: LASTSOLD=2025-12-23 00:00:00, WEEKLY=1, TODAY=0, YDAY=0
[LF] SM478 14JAN: LASTSOLD=2025-12-18 00:00:00, WEEKLY=0, TODAY=0, YDAY=0
[LF] SM460 14JAN: LASTSOLD=2025-12-14 00:00:00, WEEKLY=0, TODAY=0, YDAY=0
[LF] SM424 14JAN: LASTSOLD=2025-12-22 00:00:00, WEEKLY=1, TODAY=0, YDAY=0
[LF] Results summary:
  2026-01-16: 6 flights
  2026-01-15: 6 flights
  2026-01-14: 4 flights

============================================================
[Worker_9226] ✓ COMPLETED: JED-CAI
  Results: 3 dates
  Errors: 0 dates
  Total Processed: 1 groups
============================================================


============================================================
[Worker_9226] Processing: JED-ATZ
  Tier 0: Range 1, Chunk 1/2
  Dates: 7 days
  Date Range: 2026-01-10 to 2026-01-04
============================================================

2025-12-28 09:13:47 | INFO     | ======================================================================
2025-12-28 09:13:47 | INFO     | Load Factor Scraper Started - Route: JED-ATZ
2025-12-28 09:13:47 | INFO     | Log file: D:\CODERED\LAB\market_insights\outputs\run_generated_281225_at_09.11\logs\LF_JED-ATZ_20251228_091347.log
2025-12-28 09:13:47 | INFO     | Enhanced logging: Capturing both logging.info() and print()
2025-12-28 09:13:47 | INFO     | ======================================================================
[LF] Processing dates (override): ['10JAN', '09JAN', '08JAN', '07JAN', '06JAN', '05JAN', '04JAN']
[LF] Attaching to Chrome for Altea access
2025-12-28 09:13:47 | INFO     | Starting LF search for route: JED-ATZ
2025-12-28 09:13:47 | INFO     | [START] LF Search
[LF][[OK] SUCCESS] Connected to Chrome on 127.0.0.1:9226 (after 1 attempts)
2025-12-28 09:13:51 | INFO     | [HEALTH CHECK] [OK] Chrome connection is healthy
[LF][[OK] SUCCESS] Found Amadeus Altea window: Altéa Reservation Desktop
[LF][[INFO] INFO] URL: https://tc212.resdesktop.altea.amadeus.com/app_ard/apf/init/login?SITE=ESMPESMP&LANGUAGE=GB&MARKETS=ARDW_PROD_WBP&ACTION=clpLogin
2025-12-28 09:13:51 | INFO     | [DAY_START] Processing 10JAN
[LF] Processing JED-ATZ for 10JAN
2025-12-28 09:13:51 | INFO     | [lf.day.start] Processing JED-ATZ for 10JAN
[LF] 10JAN: found 3 direct flights
2025-12-28 09:13:52 | INFO     | [lf.day.flights_found] Found 3 flights on 10JAN
2025-12-28 09:13:54 | INFO     | [lf.flight.extracted] SM492 on 10JAN: BKG=152, LF=91.0%
[LF] SM492 10JAN: BKG=152, GRP=139, CAP=167, LF%=91.0%, Brd-Off=JED-ATZ, Classes: P:139, I:4, O:2, U:3, S:4
2025-12-28 09:13:58 | INFO     | [lf.flight.extracted] SM454 on 10JAN: BKG=154, LF=92.2%
[LF] SM454 10JAN: BKG=154, GRP=139, CAP=167, LF%=92.2%, Brd-Off=JED-ATZ, Classes: P:139, I:4, O:2, U:3, X:5, W:1
2025-12-28 09:14:03 | INFO     | [lf.flight.extracted] SM456 on 10JAN: BKG=161, LF=96.4%
[LF] SM456 10JAN: BKG=161, GRP=142, CAP=167, LF%=96.4%, Brd-Off=JED-ATZ, Classes: P:142, I:4, O:2, U:3, X:5, S:2, V:1, K:2
[LF] Getting WEEKLY/LASTSOLD data for 3 flights
[LF] SM492 10JAN: LASTSOLD=2025-12-25 00:00:00, WEEKLY=52, TODAY=0, YDAY=0
[LF] SM454 10JAN: LASTSOLD=2025-12-23 00:00:00, WEEKLY=52, TODAY=0, YDAY=0
[LF] SM456 10JAN: LASTSOLD=2025-12-23 00:00:00, WEEKLY=5, TODAY=0, YDAY=0
2025-12-28 09:14:24 | INFO     | [SUCCESS] Day 10JAN
2025-12-28 09:14:24 | INFO     | [DAY_START] Processing 09JAN
[LF] Processing JED-ATZ for 09JAN
2025-12-28 09:14:24 | INFO     | [lf.day.start] Processing JED-ATZ for 09JAN
[LF] 09JAN: found 1 direct flights
2025-12-28 09:14:25 | INFO     | [lf.day.flights_found] Found 1 flights on 09JAN
2025-12-28 09:14:27 | INFO     | [lf.flight.extracted] SM492 on 09JAN: BKG=44, LF=26.4%
[LF] SM492 09JAN: BKG=44, GRP=2, CAP=167, LF%=26.4%, Brd-Off=JED-ATZ, Classes: E:2, I:4, O:2, U:3, X:5, T:14, W:10, S:2, V:1, K:1
[LF] Getting WEEKLY/LASTSOLD data for 1 flights
[LF] SM492 09JAN: LASTSOLD=2025-12-28 00:00:00, WEEKLY=24, TODAY=1, YDAY=1
2025-12-28 09:14:32 | INFO     | [SUCCESS] Day 09JAN
2025-12-28 09:14:32 | INFO     | [DAY_START] Processing 08JAN
[LF] Processing JED-ATZ for 08JAN
2025-12-28 09:14:32 | INFO     | [lf.day.start] Processing JED-ATZ for 08JAN
[LF] 08JAN: 1 cancelled flight(s) detected from SN
[LF] 08JAN: found 3 direct flights
2025-12-28 09:14:33 | INFO     | [lf.day.flights_found] Found 3 flights on 08JAN
2025-12-28 09:14:35 | INFO     | [lf.flight.extracted] SM422 on 08JAN: BKG=167, LF=100.0%
[LF] SM422 08JAN: BKG=167, GRP=139, CAP=167, LF%=100.0%, Brd-Off=JED-ATZ, Classes: P:135, E:4, I:10, O:9, U:3, X:1, W:2, S:3
2025-12-28 09:14:38 | INFO     | [lf.flight.extracted] SM454 on 08JAN: BKG=141, LF=84.4%
[LF] SM454 08JAN: BKG=141, GRP=86, CAP=167, LF%=84.4%, Brd-Off=JED-ATZ, Classes: P:86, I:4, O:2, U:3, X:8, T:22, W:2, S:13, K:1
2025-12-28 09:14:41 | INFO     | [lf.flight.extracted] SM456 on 08JAN: BKG=179, LF=107.2%
[LF] SM456 08JAN: BKG=179, GRP=171, CAP=167, LF%=107.2%, Brd-Off=JED-ATZ, Classes: P:171, I:4, O:1, U:3
[LF] Getting WEEKLY/LASTSOLD data for 3 flights
[LF] SM422 08JAN: LASTSOLD=2025-12-17 00:00:00, WEEKLY=0, TODAY=0, YDAY=0
[LF] SM454 08JAN: LASTSOLD=2025-12-27 00:00:00, WEEKLY=21, TODAY=0, YDAY=4
[LF] SM456 08JAN: LASTSOLD=2025-12-24 00:00:00, WEEKLY=3, TODAY=0, YDAY=0
2025-12-28 09:14:56 | INFO     | [SUCCESS] Day 08JAN
2025-12-28 09:14:56 | INFO     | [DAY_START] Processing 07JAN
[LF] Processing JED-ATZ for 07JAN
2025-12-28 09:14:56 | INFO     | [lf.day.start] Processing JED-ATZ for 07JAN
[LF] 07JAN: found 2 direct flights
2025-12-28 09:14:57 | INFO     | [lf.day.flights_found] Found 2 flights on 07JAN
2025-12-28 09:14:59 | INFO     | [lf.flight.extracted] SM454 on 07JAN: BKG=174, LF=97.8%
[LF] SM454 07JAN: BKG=174, GRP=173, CAP=178, LF%=97.8%, Brd-Off=JED-ATZ, Classes: P:173, S:1
2025-12-28 09:15:02 | INFO     | [lf.flight.extracted] SM492 on 07JAN: BKG=183, LF=109.6%
[LF] SM492 07JAN: BKG=183, GRP=179, CAP=167, LF%=109.6%, Brd-Off=JED-ATZ, Classes: P:134, E:45, I:3, O:1
[LF] Getting WEEKLY/LASTSOLD data for 2 flights
[LF] SM454 07JAN: LASTSOLD=2025-12-26 00:00:00, WEEKLY=3, TODAY=0, YDAY=0
[LF] SM492 07JAN: LASTSOLD=2025-12-14 00:00:00, WEEKLY=0, TODAY=0, YDAY=0
2025-12-28 09:15:13 | INFO     | [SUCCESS] Day 07JAN
2025-12-28 09:15:13 | INFO     | [DAY_START] Processing 06JAN
[LF] Processing JED-ATZ for 06JAN
2025-12-28 09:15:13 | INFO     | [lf.day.start] Processing JED-ATZ for 06JAN
[LF] 06JAN: found 2 direct flights
2025-12-28 09:15:14 | INFO     | [lf.day.flights_found] Found 2 flights on 06JAN
2025-12-28 09:15:17 | INFO     | [lf.flight.extracted] SM454 on 06JAN: BKG=178, LF=106.6%
[LF] SM454 06JAN: BKG=178, GRP=177, CAP=167, LF%=106.6%, Brd-Off=JED-ATZ, Classes: P:177, I:1
2025-12-28 09:15:24 | INFO     | [lf.flight.extracted] SM456 on 06JAN: BKG=180, LF=107.8%
[LF] SM456 06JAN: BKG=180, GRP=180, CAP=167, LF%=107.8%, Brd-Off=JED-ATZ, Classes: P:180
[LF] Getting WEEKLY/LASTSOLD data for 2 flights
[LF] SM454 06JAN: LASTSOLD=2025-11-19 00:00:00, WEEKLY=0, TODAY=0, YDAY=0
[LF] SM456 06JAN: LASTSOLD=2025-11-12 00:00:00, WEEKLY=0, TODAY=0, YDAY=0
2025-12-28 09:15:41 | INFO     | [SUCCESS] Day 06JAN
2025-12-28 09:15:41 | INFO     | [DAY_START] Processing 05JAN
[LF] Processing JED-ATZ for 05JAN
2025-12-28 09:15:41 | INFO     | [lf.day.start] Processing JED-ATZ for 05JAN
[LF] 05JAN: found 4 direct flights
2025-12-28 09:15:43 | INFO     | [lf.day.flights_found] Found 4 flights on 05JAN
2025-12-28 09:15:45 | INFO     | [lf.flight.extracted] SM492 on 05JAN: BKG=92, LF=55.1%
[LF] SM492 05JAN: BKG=92, GRP=71, CAP=167, LF%=55.1%, Brd-Off=JED-ATZ, Classes: P:69, E:2, I:4, O:2, U:3, X:1, W:9, S:1, K:1
2025-12-28 09:15:50 | INFO     | [lf.flight.extracted] SM456 on 05JAN: BKG=121, LF=72.5%
[LF] SM456 05JAN: BKG=121, GRP=92, CAP=167, LF%=72.5%, Brd-Off=JED-ATZ, Classes: P:48, E:45, I:4, O:2, U:3, X:7, T:1, W:9, S:1, G:1
2025-12-28 09:15:54 | INFO     | [lf.flight.extracted] SM422 on 05JAN: BKG=171, LF=102.4%
[LF] SM422 05JAN: BKG=171, GRP=159, CAP=167, LF%=102.4%, Brd-Off=JED-ATZ, Classes: P:112, E:47, I:4, O:2, U:3, X:2, S:1
2025-12-28 09:15:58 | INFO     | [lf.flight.extracted] SM454 on 05JAN: BKG=170, LF=101.8%
[LF] SM454 05JAN: BKG=170, GRP=152, CAP=167, LF%=101.8%, Brd-Off=JED-ATZ, Classes: P:63, E:89, I:8, O:1, X:5, W:1, K:3
[LF] Getting WEEKLY/LASTSOLD data for 4 flights
[LF] SM492 05JAN: LASTSOLD=2025-12-28 00:00:00, WEEKLY=11, TODAY=1, YDAY=1
[LF] SM456 05JAN: LASTSOLD=2025-12-26 00:00:00, WEEKLY=4, TODAY=0, YDAY=0
[LF] SM422 05JAN: LASTSOLD=2025-12-17 00:00:00, WEEKLY=0, TODAY=0, YDAY=0
[LF] SM454 05JAN: LASTSOLD=2025-12-14 00:00:00, WEEKLY=0, TODAY=0, YDAY=0
2025-12-28 09:16:19 | INFO     | [SUCCESS] Day 05JAN
2025-12-28 09:16:19 | INFO     | [DAY_START] Processing 04JAN
[LF] Processing JED-ATZ for 04JAN
2025-12-28 09:16:19 | INFO     | [lf.day.start] Processing JED-ATZ for 04JAN
[LF] 04JAN: found 2 direct flights
2025-12-28 09:16:20 | INFO     | [lf.day.flights_found] Found 2 flights on 04JAN
2025-12-28 09:16:22 | INFO     | [lf.flight.extracted] SM492 on 04JAN: BKG=175, LF=104.8%
[LF] SM492 04JAN: BKG=175, GRP=175, CAP=167, LF%=104.8%, Brd-Off=JED-ATZ, Classes: P:175
2025-12-28 09:16:25 | INFO     | [lf.flight.extracted] SM456 on 04JAN: BKG=121, LF=72.5%
[LF] SM456 04JAN: BKG=121, GRP=92, CAP=167, LF%=72.5%, Brd-Off=JED-ATZ, Classes: P:92, I:4, O:2, U:6, X:4, W:9, S:3, K:1
[LF] Getting WEEKLY/LASTSOLD data for 2 flights
[LF] SM492 04JAN: LASTSOLD=2025-12-20 00:00:00, WEEKLY=0, TODAY=0, YDAY=0
[LF] SM456 04JAN: LASTSOLD=2025-12-27 00:00:00, WEEKLY=15, TODAY=0, YDAY=2
2025-12-28 09:16:36 | INFO     | [SUCCESS] Day 04JAN
[LF] Results summary:
  2026-01-10: 3 flights
  2026-01-09: 1 flights
  2026-01-08: 3 flights
  2026-01-07: 2 flights
  2026-01-06: 2 flights
  2026-01-05: 4 flights
  2026-01-04: 2 flights
[LF] Cancelled flights found: 1
  - SM492 08JAN (SN)
2025-12-28 09:16:36 | INFO     | [SUCCESS] LF Search Complete
[Worker_9226] Cancelled flights collected: 1

============================================================
[Worker_9226] ✓ COMPLETED: JED-ATZ
  Results: 7 dates
  Errors: 0 dates
  Total Processed: 2 groups
============================================================

2025-12-28 09:16:38 | INFO     | [Worker_9226] Completed: JED-ATZ - 7 results, 0 errors
[Worker_9226] Waiting for tasks...
