
============================================================
     LF WORKER - PORT 9227
============================================================
Worker: Worker_9227
Status: READY
Waiting for tasks...
============================================================


============================================================
[Worker_9227] Processing: CAI-JED
  Tier 0: Range 2, Chunk 2/3
  Dates: 3 days
  Date Range: 2026-01-16 to 2026-01-14
============================================================

2025-12-28 09:11:38 | INFO     | ======================================================================
2025-12-28 09:11:38 | INFO     | Load Factor Scraper Started - Route: CAI-JED
2025-12-28 09:11:38 | INFO     | Log file: D:\CODERED\LAB\market_insights\outputs\run_generated_281225_at_09.11\logs\LF_CAI-JED_20251228_091138.log
2025-12-28 09:11:38 | INFO     | Enhanced logging: Capturing both logging.info() and print()
2025-12-28 09:11:38 | INFO     | ======================================================================
[LF] Processing dates (override): ['16JAN', '15JAN', '14JAN']
[LF] Attaching to Chrome for Altea access
[LF][[OK] SUCCESS] Connected to Chrome on 127.0.0.1:9227 (after 1 attempts)
[LF][[OK] SUCCESS] Found Amadeus Altea window: Altéa Reservation Desktop
[LF][[INFO] INFO] URL: https://tc212.resdesktop.altea.amadeus.com/app_ard/apf/init/login?SITE=ESMPESMP&LANGUAGE=GB&MARKETS=ARDW_PROD_WBP&ACTION=clpLogin
[LF] Processing CAI-JED for 16JAN
[LF][ERROR] Amadeus command error detected: UNKNOWN TRANSACTION
[LF][ERROR] Command: SN16JANCAIJED/ASM
[LF][RESYNC] Triggering immediate resync to last successful SN command
============================================================
[LF][RESYNC] Command 'SN16JANCAIJED/ASM' failed: TECH_ERROR:UNKNOWN TRANSACTION
[LF][RESYNC] Re-running entire day from SN command for CAI-JED 16JAN
[LF][RESYNC] Attempt 1/50 (waiting 1.0s before retry...)
============================================================
[LF][RESYNC] Sending IG to clear session state...
[LF][RESYNC] Session cleared with IG
[LF] Processing CAI-JED for 16JAN
[LF] 16JAN: found 5 direct flights
[LF] SM475 16JAN: BKG=148, GRP=90, CAP=179, LF%=82.7%, Brd-Off=CAI-JED, Classes: P:90, U:12, X:6, T:5, W:25, S:10
[LF] SM477 16JAN: BKG=143, GRP=90, CAP=179, LF%=79.9%, Brd-Off=CAI-JED, Classes: P:90, U:8, X:5, T:4, W:25, S:11
[LF] SM479 16JAN: BKG=60, GRP=0, CAP=179, LF%=33.5%, Brd-Off=CAI-JED, Classes: U:9, X:4, T:14, W:21, S:12
[LF] SM471 16JAN: BKG=84, GRP=0, CAP=179, LF%=46.9%, Brd-Off=CAI-JED, Classes: U:10, X:3, T:13, W:31, S:16, G:11
[LF] SM459 16JAN: BKG=111, GRP=0, CAP=179, LF%=62.0%, Brd-Off=CAI-JED, Classes: U:10, X:3, T:14, W:38, S:13, G:14, L:13, V:6
[LF] Getting WEEKLY/LASTSOLD data for 5 flights
[LF] SM475 16JAN: LASTSOLD=2025-12-27 00:00:00, WEEKLY=34, TODAY=0, YDAY=7
[LF] SM477 16JAN: LASTSOLD=2025-12-27 00:00:00, WEEKLY=33, TODAY=0, YDAY=12
[LF] SM479 16JAN: LASTSOLD=2025-12-27 00:00:00, WEEKLY=31, TODAY=0, YDAY=1
[LF] SM471 16JAN: LASTSOLD=2025-12-27 00:00:00, WEEKLY=33, TODAY=0, YDAY=6
[LF] SM459 16JAN: LASTSOLD=2025-12-26 00:00:00, WEEKLY=34, TODAY=0, YDAY=0
[LF] Processing CAI-JED for 15JAN
[LF] 15JAN: found 6 direct flights
[LF] SM449 15JAN: BKG=10, GRP=0, CAP=179, LF%=5.6%, Brd-Off=CAI-JED, Classes: U:6, X:2, S:2
[LF] SM475 15JAN: BKG=149, GRP=139, CAP=179, LF%=83.2%, Brd-Off=CAI-JED, Classes: P:139, U:6, X:2, S:2
[LF] SM431 15JAN: BKG=150, GRP=141, CAP=176, LF%=85.2%, Brd-Off=CAI-JED, Classes: P:141, X:5, S:4
[LF] SM477 15JAN: BKG=168, GRP=135, CAP=179, LF%=93.8%, Brd-Off=CAI-JED, Classes: P:135, U:6, X:7, T:4, W:3, S:9, G:4
[LF] SM479 15JAN: BKG=179, GRP=135, CAP=179, LF%=100.0%, Brd-Off=CAI-JED, Classes: P:135, U:6, X:5, T:21, S:6, G:6
[LF] SM423 15JAN: BKG=49, GRP=0, CAP=179, LF%=27.4%, Brd-Off=CAI-JED, Classes: U:6, X:7, T:14, W:5, S:10, G:7
[LF] Getting WEEKLY/LASTSOLD data for 6 flights
[LF] SM449 15JAN: LASTSOLD=2025-12-27 00:00:00, WEEKLY=2, TODAY=0, YDAY=2
[LF] SM475 15JAN: LASTSOLD=2025-12-24 00:00:00, WEEKLY=3, TODAY=0, YDAY=0
[LF] SM431 15JAN: LASTSOLD=2025-12-25 00:00:00, WEEKLY=4, TODAY=0, YDAY=0
[LF] SM477 15JAN: LASTSOLD=2025-12-28 00:00:00, WEEKLY=13, TODAY=1, YDAY=8
[LF] SM479 15JAN: LASTSOLD=2025-12-27 00:00:00, WEEKLY=14, TODAY=0, YDAY=2
[LF] SM423 15JAN: LASTSOLD=2025-12-23 00:00:00, WEEKLY=10, TODAY=0, YDAY=0
[LF] Processing CAI-JED for 14JAN
[LF] 14JAN: found 5 direct flights
[LF] SM423 14JAN: BKG=156, GRP=139, CAP=179, LF%=87.2%, Brd-Off=CAI-JED, Classes: P:49, E:90, U:5, X:10, T:2
[LF] SM475 14JAN: BKG=63, GRP=45, CAP=179, LF%=35.2%, Brd-Off=CAI-JED, Classes: P:45, U:6, X:10, T:2
[LF] SM459 14JAN: BKG=63, GRP=45, CAP=179, LF%=35.2%, Brd-Off=CAI-JED, Classes: P:45, U:6, X:12
[LF] SM477 14JAN: BKG=176, GRP=140, CAP=176, LF%=100.0%, Brd-Off=CAI-JED, Classes: P:140, U:7, X:15, T:13, W:1
[LF] SM471 14JAN: BKG=102, GRP=48, CAP=179, LF%=57.0%, Brd-Off=CAI-JED, Classes: P:48, U:6, X:11, T:14, W:13, S:10
[LF] Getting WEEKLY/LASTSOLD data for 5 flights
[LF] SM423 14JAN: LASTSOLD=2025-12-25 00:00:00, WEEKLY=12, TODAY=0, YDAY=0
[LF] SM475 14JAN: LASTSOLD=2025-12-27 00:00:00, WEEKLY=13, TODAY=0, YDAY=2
[LF] SM459 14JAN: LASTSOLD=2025-12-22 00:00:00, WEEKLY=5, TODAY=0, YDAY=0
[LF] SM477 14JAN: LASTSOLD=2025-12-28 00:00:00, WEEKLY=19, TODAY=1, YDAY=2
[LF] SM471 14JAN: LASTSOLD=2025-12-27 00:00:00, WEEKLY=26, TODAY=0, YDAY=8
[LF] Results summary:
  2026-01-16: 5 flights
  2026-01-15: 6 flights
  2026-01-14: 5 flights

============================================================
[Worker_9227] ✓ COMPLETED: CAI-JED
  Results: 3 dates
  Errors: 0 dates
  Total Processed: 1 groups
============================================================


============================================================
[Worker_9227] Processing: JED-ATZ
  Tier 0: Range 1, Chunk 2/2
  Dates: 7 days
  Date Range: 2026-01-03 to 2025-12-28
============================================================

2025-12-28 09:14:11 | INFO     | ======================================================================
2025-12-28 09:14:11 | INFO     | Load Factor Scraper Started - Route: JED-ATZ
2025-12-28 09:14:11 | INFO     | Log file: D:\CODERED\LAB\market_insights\outputs\run_generated_281225_at_09.11\logs\LF_JED-ATZ_20251228_091411.log
2025-12-28 09:14:11 | INFO     | Enhanced logging: Capturing both logging.info() and print()
2025-12-28 09:14:11 | INFO     | ======================================================================
[LF] Processing dates (override): ['03JAN', '02JAN', '01JAN', '31DEC', '30DEC', '29DEC', '28DEC']
[LF] Attaching to Chrome for Altea access
2025-12-28 09:14:11 | INFO     | Starting LF search for route: JED-ATZ
2025-12-28 09:14:11 | INFO     | [START] LF Search
[LF][[OK] SUCCESS] Connected to Chrome on 127.0.0.1:9227 (after 1 attempts)
2025-12-28 09:14:14 | INFO     | [HEALTH CHECK] [OK] Chrome connection is healthy
[LF][[OK] SUCCESS] Found Amadeus Altea window: Altéa Reservation Desktop
[LF][[INFO] INFO] URL: https://tc212.resdesktop.altea.amadeus.com/app_ard/apf/init/login?SITE=ESMPESMP&LANGUAGE=GB&MARKETS=ARDW_PROD_WBP&ACTION=clpLogin
2025-12-28 09:14:14 | INFO     | [DAY_START] Processing 03JAN
[LF] Processing JED-ATZ for 03JAN
2025-12-28 09:14:14 | INFO     | [lf.day.start] Processing JED-ATZ for 03JAN
[LF] 03JAN: found 3 direct flights
2025-12-28 09:14:16 | INFO     | [lf.day.flights_found] Found 3 flights on 03JAN
2025-12-28 09:14:19 | INFO     | [lf.flight.extracted] SM492 on 03JAN: BKG=162, LF=91.0%
[LF] SM492 03JAN: BKG=162, GRP=135, CAP=178, LF%=91.0%, Brd-Off=JED-ATZ, Classes: P:135, I:4, O:2, U:7, W:13, S:1
2025-12-28 09:14:23 | INFO     | [lf.flight.extracted] SM454 on 03JAN: BKG=162, LF=91.0%
[LF] SM454 03JAN: BKG=162, GRP=140, CAP=178, LF%=91.0%, Brd-Off=JED-ATZ, Classes: P:140, I:2, O:4, U:2, X:4, W:10
2025-12-28 09:14:26 | INFO     | [lf.flight.extracted] SM456 on 03JAN: BKG=130, LF=77.8%
[LF] SM456 03JAN: BKG=130, GRP=90, CAP=167, LF%=77.8%, Brd-Off=JED-ATZ, Classes: P:90, I:8, O:8, U:8, X:7, S:8, G:1
[LF] Getting WEEKLY/LASTSOLD data for 3 flights
[LF] SM492 03JAN: LASTSOLD=2025-12-27 00:00:00, WEEKLY=9, TODAY=0, YDAY=1
[LF] SM454 03JAN: LASTSOLD=2025-12-27 00:00:00, WEEKLY=6, TODAY=0, YDAY=1
[LF] SM456 03JAN: LASTSOLD=2025-12-18 00:00:00, WEEKLY=0, TODAY=0, YDAY=0
2025-12-28 09:14:42 | INFO     | [SUCCESS] Day 03JAN
2025-12-28 09:14:42 | INFO     | [DAY_START] Processing 02JAN
[LF] Processing JED-ATZ for 02JAN
2025-12-28 09:14:42 | INFO     | [lf.day.start] Processing JED-ATZ for 02JAN
[LF] 02JAN: found 1 direct flights
2025-12-28 09:14:43 | INFO     | [lf.day.flights_found] Found 1 flights on 02JAN
2025-12-28 09:14:45 | INFO     | [lf.flight.extracted] SM492 on 02JAN: BKG=166, LF=99.4%
[LF] SM492 02JAN: BKG=166, GRP=130, CAP=167, LF%=99.4%, Brd-Off=JED-ATZ, Classes: P:130, I:4, O:1, U:4, X:8, T:7, W:2, S:10
[LF] Getting WEEKLY/LASTSOLD data for 1 flights
[LF] SM492 02JAN: LASTSOLD=2025-12-27 00:00:00, WEEKLY=5, TODAY=0, YDAY=1
2025-12-28 09:14:51 | INFO     | [SUCCESS] Day 02JAN
2025-12-28 09:14:51 | INFO     | [DAY_START] Processing 01JAN
[LF] Processing JED-ATZ for 01JAN
2025-12-28 09:14:51 | INFO     | [lf.day.start] Processing JED-ATZ for 01JAN
[LF] 01JAN: found 3 direct flights
2025-12-28 09:14:51 | INFO     | [lf.day.flights_found] Found 3 flights on 01JAN
2025-12-28 09:14:54 | INFO     | [lf.flight.extracted] SM422 on 01JAN: BKG=148, LF=88.6%
[LF] SM422 01JAN: BKG=148, GRP=126, CAP=167, LF%=88.6%, Brd-Off=JED-ATZ, Classes: P:126, I:4, O:2, U:2, X:7, W:6, S:1
2025-12-28 09:14:57 | INFO     | [lf.flight.extracted] SM454 on 01JAN: BKG=108, LF=64.7%
[LF] SM454 01JAN: BKG=108, GRP=79, CAP=167, LF%=64.7%, Brd-Off=JED-ATZ, Classes: P:80, I:4, O:2, U:2, X:10, W:7, S:1, K:2
2025-12-28 09:15:00 | INFO     | [lf.flight.extracted] SM456 on 01JAN: BKG=126, LF=75.4%
[LF] SM456 01JAN: BKG=126, GRP=91, CAP=167, LF%=75.4%, Brd-Off=JED-ATZ, Classes: P:91, I:4, O:2, U:3, X:8, T:1, W:11, S:5, K:1
[LF] Getting WEEKLY/LASTSOLD data for 3 flights
[LF] SM422 01JAN: LASTSOLD=2025-12-27 00:00:00, WEEKLY=5, TODAY=0, YDAY=4
[LF] SM454 01JAN: LASTSOLD=2025-12-25 00:00:00, WEEKLY=7, TODAY=0, YDAY=0
[LF] SM456 01JAN: LASTSOLD=2025-12-27 00:00:00, WEEKLY=11, TODAY=0, YDAY=4
2025-12-28 09:15:17 | INFO     | [SUCCESS] Day 01JAN
2025-12-28 09:15:17 | INFO     | [DAY_START] Processing 31DEC
[LF] Processing JED-ATZ for 31DEC
2025-12-28 09:15:17 | INFO     | [lf.day.start] Processing JED-ATZ for 31DEC
[LF] 31DEC: found 2 direct flights
2025-12-28 09:15:18 | INFO     | [lf.day.flights_found] Found 2 flights on 31DEC
2025-12-28 09:15:22 | INFO     | [lf.flight.extracted] SM454 on 31DEC: BKG=171, LF=96.1%
[LF] SM454 31DEC: BKG=171, GRP=149, CAP=178, LF%=96.1%, Brd-Off=JED-ATZ, Classes: P:142, E:7, I:4, O:2, U:3, X:7, T:2, S:4
2025-12-28 09:15:27 | INFO     | [lf.flight.extracted] SM492 on 31DEC: BKG=179, LF=107.2%
[LF] SM492 31DEC: BKG=179, GRP=178, CAP=167, LF%=107.2%, Brd-Off=JED-ATZ, Classes: P:133, E:45, I:1
[LF] Getting WEEKLY/LASTSOLD data for 2 flights
[LF] SM454 31DEC: LASTSOLD=2025-12-23 00:00:00, WEEKLY=6, TODAY=0, YDAY=0
[LF] SM492 31DEC: LASTSOLD=2025-11-10 00:00:00, WEEKLY=0, TODAY=0, YDAY=0
2025-12-28 09:15:45 | INFO     | [SUCCESS] Day 31DEC
2025-12-28 09:15:45 | INFO     | [DAY_START] Processing 30DEC
[LF] Processing JED-ATZ for 30DEC
2025-12-28 09:15:45 | INFO     | [lf.day.start] Processing JED-ATZ for 30DEC
[LF] 30DEC: found 2 direct flights
2025-12-28 09:15:47 | INFO     | [lf.day.flights_found] Found 2 flights on 30DEC
2025-12-28 09:15:50 | INFO     | [lf.flight.extracted] SM454 on 30DEC: BKG=168, LF=100.6%
[LF] SM454 30DEC: BKG=168, GRP=142, CAP=167, LF%=100.6%, Brd-Off=JED-ATZ, Classes: P:97, I:2, O:4, U:48, X:6, T:11
2025-12-28 09:15:54 | INFO     | [lf.flight.extracted] SM456 on 30DEC: BKG=170, LF=95.5%
[LF] SM456 30DEC: BKG=170, GRP=139, CAP=178, LF%=95.5%, Brd-Off=JED-ATZ, Classes: P:137, E:2, I:4, O:1, U:3, X:8, T:3, W:2, S:3, L:7
[LF] Getting WEEKLY/LASTSOLD data for 2 flights
[LF] SM454 30DEC: LASTSOLD=2025-12-22 00:00:00, WEEKLY=5, TODAY=0, YDAY=0
[LF] SM456 30DEC: LASTSOLD=2025-12-27 00:00:00, WEEKLY=7, TODAY=0, YDAY=4
2025-12-28 09:16:06 | INFO     | [SUCCESS] Day 30DEC
2025-12-28 09:16:06 | INFO     | [DAY_START] Processing 29DEC
[LF] Processing JED-ATZ for 29DEC
2025-12-28 09:16:06 | INFO     | [lf.day.start] Processing JED-ATZ for 29DEC
[LF] 29DEC: found 3 direct flights
2025-12-28 09:16:07 | INFO     | [lf.day.flights_found] Found 3 flights on 29DEC
2025-12-28 09:16:09 | INFO     | [lf.flight.extracted] SM492 on 29DEC: BKG=138, LF=82.6%
[LF] SM492 29DEC: BKG=138, GRP=88, CAP=167, LF%=82.6%, Brd-Off=JED-ATZ, Classes: P:42, E:46, I:4, O:1, U:3, X:12, T:15, W:8, S:7
2025-12-28 09:16:12 | INFO     | [lf.flight.extracted] SM456 on 29DEC: BKG=152, LF=91.0%
[LF] SM456 29DEC: BKG=152, GRP=31, CAP=167, LF%=91.0%, Brd-Off=JED-ATZ, Classes: P:31, I:36, O:18, U:22, X:19, T:10, W:9, S:7
2025-12-28 09:16:16 | INFO     | [lf.flight.extracted] SM454 on 29DEC: BKG=160, LF=95.8%
[LF] SM454 29DEC: BKG=160, GRP=90, CAP=167, LF%=95.8%, Brd-Off=JED-ATZ, Classes: P:46, E:44, I:4, O:14, U:15, X:15, T:20, W:2
[LF] Getting WEEKLY/LASTSOLD data for 3 flights
[LF] SM492 29DEC: LASTSOLD=2025-12-28 00:00:00, WEEKLY=23, TODAY=1, YDAY=7
[LF] SM456 29DEC: LASTSOLD=2025-12-27 00:00:00, WEEKLY=30, TODAY=0, YDAY=9
[LF] SM454 29DEC: LASTSOLD=2025-12-27 00:00:00, WEEKLY=31, TODAY=0, YDAY=5
2025-12-28 09:16:32 | INFO     | [SUCCESS] Day 29DEC
[LF] Skipping 28DEC (Today) - will be processed by supplement scan
[LF] Results summary:
  2026-01-03: 3 flights
  2026-01-02: 1 flights
  2026-01-01: 3 flights
  2025-12-31: 2 flights
  2025-12-30: 2 flights
  2025-12-29: 3 flights
2025-12-28 09:16:32 | INFO     | [SUCCESS] LF Search Complete

============================================================
[Worker_9227] ✓ COMPLETED: JED-ATZ
  Results: 6 dates
  Errors: 0 dates
  Total Processed: 2 groups
============================================================

2025-12-28 09:16:34 | INFO     | [Worker_9227] Completed: JED-ATZ - 6 results, 0 errors
[Worker_9227] Waiting for tasks...
