
============================================================
     LF WORKER - PORT 9224
============================================================
Worker: Worker_9224
Status: READY
Waiting for tasks...
============================================================


============================================================
[Worker_9224] Processing: CAI-DMM
  Tier 0: Range 1, Chunk 1/2
  Dates: 11 days
  Date Range: 2026-01-31 to 2026-01-21
============================================================

2026-01-10 08:36:25 | INFO     | ======================================================================
2026-01-10 08:36:25 | INFO     | Load Factor Scraper Started - Route: CAI-DMM
2026-01-10 08:36:25 | INFO     | Log file: D:\CODERED\LAB\Artifacts\run_generated_100126_at_08.36\logs\LF_CAI-DMM_20260110_083625.log
2026-01-10 08:36:25 | INFO     | Enhanced logging: Capturing both logging.info() and print()
2026-01-10 08:36:25 | INFO     | ======================================================================
[LF] Processing dates (override): ['31JAN', '30JAN', '29JAN', '28JAN', '27JAN', '26JAN', '25JAN', '24JAN', '23JAN', '22JAN', '21JAN']
[LF] Attaching to Chrome for Altea access
[LF][[OK] SUCCESS] Connected to Chrome on 127.0.0.1:9224 (after 1 attempts)
[LF][[OK] SUCCESS] Found Amadeus Altea window: Altéa Reservation Desktop
[LF][[INFO] INFO] URL: https://tc212.resdesktop.altea.amadeus.com/app_ard/apf/init/login?SITE=ESMPESMP&LANGUAGE=GB&MARKETS=ARDW_PROD_WBP&ACTION=clpLogin
[LF] Processing CAI-DMM for 31JAN
[LF][ERROR] Amadeus command error detected: UNKNOWN TRANSACTION
[LF][ERROR] Command: SN31JANCAIDMM/ASM
[LF][RESYNC] Triggering immediate resync to last successful SN command
============================================================
[LF][RESYNC] Command 'SN31JANCAIDMM/ASM' failed: TECH_ERROR:UNKNOWN TRANSACTION
[LF][RESYNC] Re-running entire day from SN command for CAI-DMM 31JAN
[LF][RESYNC] Attempt 1/50 (waiting 1.0s before retry...)
============================================================
[LF][RESYNC] Sending IG to clear session state...
[LF][RESYNC] Session cleared with IG
[LF] Processing CAI-DMM for 31JAN
[LF] 31JAN: found 1 direct flights
[LF] SM433 31JAN: BKG=46, GRP=0, CAP=179, LF%=25.7%, Brd-Off=CAI-DMM, Classes: O:3, U:7, X:4, T:14, W:15, S:2, G:1
[LF] Getting WEEKLY/LASTSOLD data for 1 flights
[LF] SM433 31JAN: LASTSOLD=2026-01-09 00:00:00, WEEKLY=4, TODAY=0, YDAY=1
[LF] Processing CAI-DMM for 30JAN
[LF] 30JAN: found 1 direct flights
[LF] SM433 30JAN: BKG=56, GRP=0, CAP=179, LF%=31.3%, Brd-Off=CAI-DMM, Classes: O:12, U:32, X:12
[LF] Getting WEEKLY/LASTSOLD data for 1 flights
[LF] SM433 30JAN: LASTSOLD=2026-01-09 00:00:00, WEEKLY=33, TODAY=0, YDAY=2
[LF] Processing CAI-DMM for 29JAN
[LF] 29JAN: found 1 direct flights
[LF] SM433 29JAN: BKG=70, GRP=0, CAP=179, LF%=39.1%, Brd-Off=CAI-DMM, Classes: O:14, U:23, X:26, T:3, S:4
[LF] Getting WEEKLY/LASTSOLD data for 1 flights
[LF] SM433 29JAN: LASTSOLD=2026-01-09 00:00:00, WEEKLY=38, TODAY=0, YDAY=2
[LF] Processing CAI-DMM for 28JAN
[LF] No direct flights on 28JAN for CAI-DMM
[LF] Processing CAI-DMM for 27JAN
[LF] 27JAN: found 1 direct flights
[LF] SM433 27JAN: BKG=55, GRP=0, CAP=179, LF%=30.7%, Brd-Off=CAI-DMM, Classes: I:10, O:10, U:10, X:18, W:2, S:4, G:1
[LF] Getting WEEKLY/LASTSOLD data for 1 flights
[LF] SM433 27JAN: LASTSOLD=2026-01-09 00:00:00, WEEKLY=26, TODAY=0, YDAY=3
[LF] Processing CAI-DMM for 26JAN
[LF] No direct flights on 26JAN for CAI-DMM
[LF] Processing CAI-DMM for 25JAN
[LF] No direct flights on 25JAN for CAI-DMM
[LF] Processing CAI-DMM for 24JAN
[LF] 24JAN: found 1 direct flights
[LF] SM433 24JAN: BKG=89, GRP=0, CAP=179, LF%=49.7%, Brd-Off=CAI-DMM, Classes: W:14, S:34, G:36, L:5
[LF] Getting WEEKLY/LASTSOLD data for 1 flights
[LF] SM433 24JAN: LASTSOLD=2026-01-09 00:00:00, WEEKLY=60, TODAY=0, YDAY=25
[LF] Processing CAI-DMM for 23JAN
[LF] 23JAN: found 1 direct flights
[LF] SM433 23JAN: BKG=65, GRP=0, CAP=179, LF%=36.3%, Brd-Off=CAI-DMM, Classes: S:18, G:17, L:28, V:2
[LF] Getting WEEKLY/LASTSOLD data for 1 flights
[LF] SM433 23JAN: LASTSOLD=2026-01-09 00:00:00, WEEKLY=19, TODAY=0, YDAY=7
[LF] Processing CAI-DMM for 22JAN
[LF] 22JAN: found 1 direct flights
[LF] SM433 22JAN: BKG=92, GRP=0, CAP=179, LF%=51.4%, Brd-Off=CAI-DMM, Classes: W:6, S:6, G:49, L:27, V:4
[LF] Getting WEEKLY/LASTSOLD data for 1 flights
[LF] SM433 22JAN: LASTSOLD=2026-01-09 00:00:00, WEEKLY=51, TODAY=0, YDAY=3
[LF] Processing CAI-DMM for 21JAN
[LF] No direct flights on 21JAN for CAI-DMM
[LF] Results summary:
  2026-01-31: 1 flights
  2026-01-30: 1 flights
  2026-01-29: 1 flights
  2026-01-28: 0 flights
  2026-01-27: 1 flights
  2026-01-26: 0 flights
  2026-01-25: 0 flights
  2026-01-24: 1 flights
  2026-01-23: 1 flights
  2026-01-22: 1 flights
  2026-01-21: 0 flights

============================================================
[Worker_9224] ✓ COMPLETED: CAI-DMM
  Results: 11 dates
  Errors: 0 dates
  Total Processed: 1 groups
============================================================


============================================================
[Worker_9224] Processing: CAI-JED
  Tier 0: Range 1, Chunk 2/2
  Dates: 11 days
  Date Range: 2026-01-20 to 2026-01-10
============================================================

2026-01-10 08:37:36 | INFO     | ======================================================================
2026-01-10 08:37:36 | INFO     | Load Factor Scraper Started - Route: CAI-JED
2026-01-10 08:37:36 | INFO     | Log file: D:\CODERED\LAB\Artifacts\run_generated_100126_at_08.36\logs\LF_CAI-JED_20260110_083736.log
2026-01-10 08:37:36 | INFO     | Enhanced logging: Capturing both logging.info() and print()
2026-01-10 08:37:36 | INFO     | ======================================================================
[LF] Processing dates (override): ['20JAN', '19JAN', '18JAN', '17JAN', '16JAN', '15JAN', '14JAN', '13JAN', '12JAN', '11JAN', '10JAN']
[LF] Attaching to Chrome for Altea access
2026-01-10 08:37:36 | INFO     | Starting LF search for route: CAI-JED
2026-01-10 08:37:36 | INFO     | [START] LF Search
[LF][[OK] SUCCESS] Connected to Chrome on 127.0.0.1:9224 (after 1 attempts)
2026-01-10 08:37:37 | INFO     | [HEALTH CHECK] [OK] Chrome connection is healthy
[LF][[OK] SUCCESS] Found Amadeus Altea window: Altéa Reservation Desktop
[LF][[INFO] INFO] URL: https://tc212.resdesktop.altea.amadeus.com/app_ard/apf/init/login?SITE=ESMPESMP&LANGUAGE=GB&MARKETS=ARDW_PROD_WBP&ACTION=clpLogin
2026-01-10 08:37:37 | INFO     | [DAY_START] Processing 20JAN
[LF] Processing CAI-JED for 20JAN
2026-01-10 08:37:37 | INFO     | [lf.day.start] Processing CAI-JED for 20JAN
[LF] 20JAN: found 7 direct flights
2026-01-10 08:37:38 | INFO     | [lf.day.flights_found] Found 7 flights on 20JAN
2026-01-10 08:37:40 | INFO     | [lf.flight.extracted] SM471 on 20JAN: BKG=175, LF=97.8%
[LF] SM471 20JAN: BKG=175, GRP=130, CAP=179, LF%=97.8%, Brd-Off=CAI-JED, Classes: P:45, E:85, U:3, X:24, T:15, S:2, G:1
2026-01-10 08:37:44 | INFO     | [lf.flight.extracted] SM953 on 20JAN: BKG=179, LF=100.0%
[LF] SM953 20JAN: BKG=179, GRP=90, CAP=179, LF%=100.0%, Brd-Off=CAI-JED, Classes: P:90, I:15, O:13, U:15, X:14, T:31, V:1
2026-01-10 08:37:48 | INFO     | [lf.flight.extracted] SM479 on 20JAN: BKG=176, LF=100.0%
[LF] SM479 20JAN: BKG=176, GRP=135, CAP=176, LF%=100.0%, Brd-Off=CAI-JED, Classes: P:135, U:6, X:23, T:11, W:1
2026-01-10 08:37:51 | INFO     | [lf.flight.extracted] SM477 on 20JAN: BKG=175, LF=97.8%
[LF] SM477 20JAN: BKG=175, GRP=95, CAP=179, LF%=97.8%, Brd-Off=CAI-JED, Classes: P:95, U:14, X:22, T:18, W:18, S:8
2026-01-10 08:37:55 | INFO     | [lf.flight.extracted] SM459 on 20JAN: BKG=180, LF=102.3%
[LF] SM459 20JAN: BKG=180, GRP=135, CAP=176, LF%=102.3%, Brd-Off=CAI-JED, Classes: P:135, U:6, X:37, S:1, G:1
2026-01-10 08:37:59 | INFO     | [lf.flight.extracted] SM423 on 20JAN: BKG=137, LF=76.5%
[LF] SM423 20JAN: BKG=137, GRP=90, CAP=179, LF%=76.5%, Brd-Off=CAI-JED, Classes: P:90, U:5, X:21, T:13, S:5, L:3
2026-01-10 08:38:03 | INFO     | [lf.flight.extracted] SM475 on 20JAN: BKG=176, LF=98.3%
[LF] SM475 20JAN: BKG=176, GRP=90, CAP=179, LF%=98.3%, Brd-Off=CAI-JED, Classes: P:90, U:4, X:47, T:18, W:15, G:2
[LF] Getting WEEKLY/LASTSOLD data for 7 flights
[LF] SM471 20JAN: LASTSOLD=2026-01-09 00:00:00, WEEKLY=17, TODAY=0, YDAY=1
[LF] SM953 20JAN: LASTSOLD=2026-01-08 00:00:00, WEEKLY=30, TODAY=0, YDAY=0
[LF] SM479 20JAN: LASTSOLD=2026-01-08 00:00:00, WEEKLY=10, TODAY=0, YDAY=0
[LF] SM477 20JAN: LASTSOLD=2026-01-09 00:00:00, WEEKLY=53, TODAY=0, YDAY=10
[LF] SM459 20JAN: LASTSOLD=2026-01-06 00:00:00, WEEKLY=1, TODAY=0, YDAY=0
[LF] SM423 20JAN: LASTSOLD=2026-01-09 00:00:00, WEEKLY=7, TODAY=0, YDAY=3
[LF] SM475 20JAN: LASTSOLD=2026-01-09 00:00:00, WEEKLY=28, TODAY=0, YDAY=1
2026-01-10 08:38:33 | INFO     | [SUCCESS] Day 20JAN
2026-01-10 08:38:33 | INFO     | [DAY_START] Processing 19JAN
[LF] Processing CAI-JED for 19JAN
2026-01-10 08:38:33 | INFO     | [lf.day.start] Processing CAI-JED for 19JAN
[LF] 19JAN: found 3 direct flights
2026-01-10 08:38:33 | INFO     | [lf.day.flights_found] Found 3 flights on 19JAN
2026-01-10 08:38:35 | INFO     | [lf.flight.extracted] SM475 on 19JAN: BKG=179, LF=100.0%
[LF] SM475 19JAN: BKG=179, GRP=140, CAP=179, LF%=100.0%, Brd-Off=CAI-JED, Classes: P:140, U:6, X:24, T:7, Q:2
2026-01-10 08:38:39 | INFO     | [lf.flight.extracted] SM477 on 19JAN: BKG=179, LF=100.0%
[LF] SM477 19JAN: BKG=179, GRP=135, CAP=179, LF%=100.0%, Brd-Off=CAI-JED, Classes: P:135, U:6, X:35, T:1, G:2
2026-01-10 08:38:42 | INFO     | [lf.flight.extracted] SM459 on 19JAN: BKG=179, LF=100.0%
[LF] SM459 19JAN: BKG=179, GRP=135, CAP=179, LF%=100.0%, Brd-Off=CAI-JED, Classes: P:135, U:8, X:25, T:6, L:4, Q:1
[LF] Getting WEEKLY/LASTSOLD data for 3 flights
[LF] SM475 19JAN: LASTSOLD=2026-01-10 00:00:00, WEEKLY=2, TODAY=1, YDAY=0
[LF] SM477 19JAN: LASTSOLD=2026-01-10 00:00:00, WEEKLY=2, TODAY=1, YDAY=0
[LF] SM459 19JAN: LASTSOLD=2026-01-09 00:00:00, WEEKLY=1, TODAY=0, YDAY=1
2026-01-10 08:38:59 | INFO     | [SUCCESS] Day 19JAN
2026-01-10 08:38:59 | INFO     | [DAY_START] Processing 18JAN
[LF] Processing CAI-JED for 18JAN
2026-01-10 08:38:59 | INFO     | [lf.day.start] Processing CAI-JED for 18JAN
[LF] 18JAN: found 5 direct flights
2026-01-10 08:39:00 | INFO     | [lf.day.flights_found] Found 5 flights on 18JAN
2026-01-10 08:39:02 | INFO     | [lf.flight.extracted] SM475 on 18JAN: BKG=180, LF=100.6%
[LF] SM475 18JAN: BKG=180, GRP=137, CAP=179, LF%=100.6%, Brd-Off=CAI-JED, Classes: P:137, U:8, X:13, T:13, W:6, S:3
2026-01-10 08:39:06 | INFO     | [lf.flight.extracted] SM431 on 18JAN: BKG=179, LF=100.0%
[LF] SM431 18JAN: BKG=179, GRP=90, CAP=179, LF%=100.0%, Brd-Off=CAI-JED, Classes: N:1, P:90, I:9, O:9, U:8, X:42, T:13, W:6, S:1
2026-01-10 08:39:09 | INFO     | [lf.flight.extracted] SM459 on 18JAN: BKG=179, LF=101.7%
[LF] SM459 18JAN: BKG=179, GRP=138, CAP=176, LF%=101.7%, Brd-Off=CAI-JED, Classes: P:138, U:6, X:21, T:6, W:7, K:1
2026-01-10 08:39:13 | INFO     | [lf.flight.extracted] SM477 on 18JAN: BKG=141, LF=78.8%
[LF] SM477 18JAN: BKG=141, GRP=90, CAP=179, LF%=78.8%, Brd-Off=CAI-JED, Classes: P:90, U:8, X:17, T:14, W:5, V:7
2026-01-10 08:39:16 | INFO     | [lf.flight.extracted] SM479 on 18JAN: BKG=178, LF=99.4%
[LF] SM479 18JAN: BKG=178, GRP=90, CAP=179, LF%=99.4%, Brd-Off=CAI-JED, Classes: P:90, U:6, X:39, T:29, W:14
[LF] Getting WEEKLY/LASTSOLD data for 5 flights
[LF] SM475 18JAN: LASTSOLD=2026-01-01 00:00:00, WEEKLY=0, TODAY=0, YDAY=0
[LF] SM431 18JAN: LASTSOLD=2026-01-06 00:00:00, WEEKLY=4, TODAY=0, YDAY=0
[LF] SM459 18JAN: LASTSOLD=2026-01-07 00:00:00, WEEKLY=1, TODAY=0, YDAY=0
[LF] SM477 18JAN: LASTSOLD=2026-01-09 00:00:00, WEEKLY=8, TODAY=0, YDAY=4
[LF] SM479 18JAN: LASTSOLD=2025-12-31 00:00:00, WEEKLY=0, TODAY=0, YDAY=0
2026-01-10 08:39:43 | INFO     | [SUCCESS] Day 18JAN
2026-01-10 08:39:43 | INFO     | [DAY_START] Processing 17JAN
[LF] Processing CAI-JED for 17JAN
2026-01-10 08:39:43 | INFO     | [lf.day.start] Processing CAI-JED for 17JAN
[LF] 17JAN: found 4 direct flights
2026-01-10 08:39:44 | INFO     | [lf.day.flights_found] Found 4 flights on 17JAN
2026-01-10 08:39:46 | INFO     | [lf.flight.extracted] SM449 on 17JAN: BKG=180, LF=100.6%
[LF] SM449 17JAN: BKG=180, GRP=128, CAP=179, LF%=100.6%, Brd-Off=CAI-JED, Classes: P:45, E:83, U:10, X:4, T:14, W:16, S:8
2026-01-10 08:39:49 | INFO     | [lf.flight.extracted] SM475 on 17JAN: BKG=179, LF=100.0%
[LF] SM475 17JAN: BKG=179, GRP=135, CAP=179, LF%=100.0%, Brd-Off=CAI-JED, Classes: P:135, U:9, X:3, T:13, W:19
2026-01-10 08:39:53 | INFO     | [lf.flight.extracted] SM477 on 17JAN: BKG=179, LF=100.0%
[LF] SM477 17JAN: BKG=179, GRP=90, CAP=179, LF%=100.0%, Brd-Off=CAI-JED, Classes: P:90, U:10, X:3, T:15, W:24, S:14, G:12, L:10, V:1
[LPC] SM477 17JAN: Found 1 outbound flights with connecting passengers
2026-01-10 08:39:58 | INFO     | [lf.flight.extracted] SM423 on 17JAN: BKG=157, LF=87.7%
[LF] SM423 17JAN: BKG=157, GRP=5, CAP=179, LF%=87.7%, Brd-Off=CAI-JED, Classes: E:5, U:11, X:2, T:23, W:27, S:33, G:13, L:11, V:13, K:12, Q:7
[LF] Getting WEEKLY/LASTSOLD data for 4 flights
[LF] SM449 17JAN: LASTSOLD=2025-12-21 00:00:00, WEEKLY=0, TODAY=0, YDAY=0
[LF] SM475 17JAN: LASTSOLD=2025-12-24 00:00:00, WEEKLY=0, TODAY=0, YDAY=0
[LF] SM477 17JAN: LASTSOLD=2025-12-31 00:00:00, WEEKLY=0, TODAY=0, YDAY=0
[LF] SM423 17JAN: LASTSOLD=2026-01-09 00:00:00, WEEKLY=25, TODAY=0, YDAY=8
2026-01-10 08:40:19 | INFO     | [SUCCESS] Day 17JAN
2026-01-10 08:40:19 | INFO     | [DAY_START] Processing 16JAN
[LF] Processing CAI-JED for 16JAN
2026-01-10 08:40:19 | INFO     | [lf.day.start] Processing CAI-JED for 16JAN
[LF] 16JAN: found 5 direct flights
2026-01-10 08:40:20 | INFO     | [lf.day.flights_found] Found 5 flights on 16JAN
2026-01-10 08:40:23 | INFO     | [lf.flight.extracted] SM475 on 16JAN: BKG=171, LF=95.5%
[LF] SM475 16JAN: BKG=171, GRP=45, CAP=179, LF%=95.5%, Brd-Off=CAI-JED, Classes: P:45, U:12, X:6, T:13, W:42, S:15, G:22, L:10, V:6
2026-01-10 08:40:28 | INFO     | [lf.flight.extracted] SM477 on 16JAN: BKG=137, LF=76.5%
[LF] SM477 16JAN: BKG=137, GRP=45, CAP=179, LF%=76.5%, Brd-Off=CAI-JED, Classes: P:45, U:8, X:5, T:6, W:42, S:16, G:6, L:9
2026-01-10 08:40:31 | INFO     | [lf.flight.extracted] SM479 on 16JAN: BKG=177, LF=98.9%
[LF] SM479 16JAN: BKG=177, GRP=45, CAP=179, LF%=98.9%, Brd-Off=CAI-JED, Classes: E:45, U:9, X:4, T:28, W:45, S:15, G:14, L:10, V:5, K:1, Q:1
2026-01-10 08:40:35 | INFO     | [lf.flight.extracted] SM471 on 16JAN: BKG=150, LF=83.8%
[LF] SM471 16JAN: BKG=150, GRP=0, CAP=179, LF%=83.8%, Brd-Off=CAI-JED, Classes: U:9, X:3, T:13, W:36, S:44, G:20, L:20, V:5
2026-01-10 08:40:39 | INFO     | [lf.flight.extracted] SM459 on 16JAN: BKG=179, LF=100.0%
[LF] SM459 16JAN: BKG=179, GRP=0, CAP=179, LF%=100.0%, Brd-Off=CAI-JED, Classes: U:10, X:3, T:13, W:48, S:38, G:28, L:20, V:17, K:2
[LF] Getting WEEKLY/LASTSOLD data for 5 flights
[LF] SM475 16JAN: LASTSOLD=2026-01-09 00:00:00, WEEKLY=38, TODAY=0, YDAY=1
[LF] SM477 16JAN: LASTSOLD=2026-01-09 00:00:00, WEEKLY=13, TODAY=0, YDAY=3
[LF] SM479 16JAN: LASTSOLD=2026-01-10 00:00:00, WEEKLY=30, TODAY=1, YDAY=3
[LF] SM471 16JAN: LASTSOLD=2026-01-09 00:00:00, WEEKLY=29, TODAY=0, YDAY=6
[LF] SM459 16JAN: LASTSOLD=2026-01-10 00:00:00, WEEKLY=23, TODAY=2, YDAY=2
2026-01-10 08:41:07 | INFO     | [SUCCESS] Day 16JAN
2026-01-10 08:41:07 | INFO     | [DAY_START] Processing 15JAN
[LF] Processing CAI-JED for 15JAN
2026-01-10 08:41:07 | INFO     | [lf.day.start] Processing CAI-JED for 15JAN
[LF] 15JAN: found 6 direct flights
2026-01-10 08:41:08 | INFO     | [lf.day.flights_found] Found 6 flights on 15JAN
2026-01-10 08:41:10 | INFO     | [lf.flight.extracted] SM449 on 15JAN: BKG=179, LF=100.0%
[LF] SM449 15JAN: BKG=179, GRP=45, CAP=179, LF%=100.0%, Brd-Off=CAI-JED, Classes: N:1, P:45, I:5, O:5, U:21, X:36, T:9, W:29, S:18, G:10
2026-01-10 08:41:14 | INFO     | [lf.flight.extracted] SM475 on 15JAN: BKG=180, LF=100.6%
[LF] SM475 15JAN: BKG=180, GRP=140, CAP=179, LF%=100.6%, Brd-Off=CAI-JED, Classes: P:140, U:18, X:17, S:5
2026-01-10 08:41:17 | INFO     | [lf.flight.extracted] SM431 on 15JAN: BKG=176, LF=100.0%
[LF] SM431 15JAN: BKG=176, GRP=141, CAP=176, LF%=100.0%, Brd-Off=CAI-JED, Classes: P:141, U:11, X:20, S:4
2026-01-10 08:41:21 | INFO     | [lf.flight.extracted] SM477 on 15JAN: BKG=179, LF=100.0%
[LF] SM477 15JAN: BKG=179, GRP=135, CAP=179, LF%=100.0%, Brd-Off=CAI-JED, Classes: P:135, U:6, X:7, T:13, W:4, S:9, G:5
2026-01-10 08:41:24 | INFO     | [lf.flight.extracted] SM479 on 15JAN: BKG=179, LF=100.0%
[LF] SM479 15JAN: BKG=179, GRP=125, CAP=179, LF%=100.0%, Brd-Off=CAI-JED, Classes: P:125, U:6, X:5, T:27, W:5, S:6, G:5
2026-01-10 08:41:27 | INFO     | [lf.flight.extracted] SM423 on 15JAN: BKG=153, LF=85.5%
[LF] SM423 15JAN: BKG=153, GRP=0, CAP=179, LF%=85.5%, Brd-Off=CAI-JED, Classes: U:6, X:11, T:24, W:35, S:15, G:26, L:24, V:4, K:5, Q:2, H:1
[LF] Getting WEEKLY/LASTSOLD data for 6 flights
[LF] SM449 15JAN: LASTSOLD=2026-01-06 00:00:00, WEEKLY=34, TODAY=0, YDAY=0
[LF] SM475 15JAN: LASTSOLD=2026-01-08 00:00:00, WEEKLY=2, TODAY=0, YDAY=0
[LF] SM431 15JAN: LASTSOLD=2026-01-02 00:00:00, WEEKLY=0, TODAY=0, YDAY=0
[LF] SM477 15JAN: LASTSOLD=2025-12-30 00:00:00, WEEKLY=0, TODAY=0, YDAY=0
[LF] SM479 15JAN: LASTSOLD=2026-01-09 00:00:00, WEEKLY=2, TODAY=0, YDAY=2
[LF] SM423 15JAN: LASTSOLD=2026-01-10 00:00:00, WEEKLY=56, TODAY=1, YDAY=6
2026-01-10 08:41:59 | INFO     | [SUCCESS] Day 15JAN
2026-01-10 08:41:59 | INFO     | [DAY_START] Processing 14JAN
[LF] Processing CAI-JED for 14JAN
2026-01-10 08:41:59 | INFO     | [lf.day.start] Processing CAI-JED for 14JAN
[LF] 14JAN: found 5 direct flights
2026-01-10 08:42:00 | INFO     | [lf.day.flights_found] Found 5 flights on 14JAN
2026-01-10 08:42:02 | INFO     | [lf.flight.extracted] SM423 on 14JAN: BKG=176, LF=98.3%
[LF] SM423 14JAN: BKG=176, GRP=144, CAP=179, LF%=98.3%, Brd-Off=CAI-JED, Classes: P:54, E:90, U:17, X:10, T:2, S:3
2026-01-10 08:42:05 | INFO     | [lf.flight.extracted] SM475 on 14JAN: BKG=149, LF=83.2%
[LF] SM475 14JAN: BKG=149, GRP=45, CAP=179, LF%=83.2%, Brd-Off=CAI-JED, Classes: P:45, I:2, U:30, X:20, T:14, W:14, S:15, G:9
2026-01-10 08:42:09 | INFO     | [lf.flight.extracted] SM459 on 14JAN: BKG=179, LF=100.0%
[LF] SM459 14JAN: BKG=179, GRP=85, CAP=179, LF%=100.0%, Brd-Off=CAI-JED, Classes: P:85, U:29, X:14, T:17, W:16, S:14, G:3, K:1
2026-01-10 08:42:12 | INFO     | [lf.flight.extracted] SM477 on 14JAN: BKG=179, LF=101.7%
[LF] SM477 14JAN: BKG=179, GRP=140, CAP=176, LF%=101.7%, Brd-Off=CAI-JED, Classes: P:140, U:8, X:15, T:13, W:3
2026-01-10 08:42:15 | INFO     | [lf.flight.extracted] SM471 on 14JAN: BKG=179, LF=100.0%
[LF] SM471 14JAN: BKG=179, GRP=48, CAP=179, LF%=100.0%, Brd-Off=CAI-JED, Classes: P:48, U:21, X:46, T:15, W:24, S:16, G:9
[LF] Getting WEEKLY/LASTSOLD data for 5 flights
[LF] SM423 14JAN: LASTSOLD=2026-01-10 00:00:00, WEEKLY=8, TODAY=1, YDAY=1
[LF] SM475 14JAN: LASTSOLD=2026-01-10 00:00:00, WEEKLY=44, TODAY=6, YDAY=3
[LF] SM459 14JAN: LASTSOLD=2026-01-10 00:00:00, WEEKLY=45, TODAY=1, YDAY=2
[LF] SM477 14JAN: LASTSOLD=2026-01-05 00:00:00, WEEKLY=1, TODAY=0, YDAY=0
[LF] SM471 14JAN: LASTSOLD=2026-01-07 00:00:00, WEEKLY=25, TODAY=0, YDAY=0
2026-01-10 08:42:41 | INFO     | [SUCCESS] Day 14JAN
2026-01-10 08:42:41 | INFO     | [DAY_START] Processing 13JAN
[LF] Processing CAI-JED for 13JAN
2026-01-10 08:42:41 | INFO     | [lf.day.start] Processing CAI-JED for 13JAN
[LF] 13JAN: found 6 direct flights
2026-01-10 08:42:41 | INFO     | [lf.day.flights_found] Found 6 flights on 13JAN
2026-01-10 08:42:44 | INFO     | [lf.flight.extracted] SM471 on 13JAN: BKG=153, LF=86.9%
[LF] SM471 13JAN: BKG=153, GRP=47, CAP=176, LF%=86.9%, Brd-Off=CAI-JED, Classes: E:47, O:25, U:35, X:19, T:15, W:5, S:7
2026-01-10 08:42:47 | INFO     | [lf.flight.extracted] SM479 on 13JAN: BKG=177, LF=98.9%
[LF] SM479 13JAN: BKG=177, GRP=147, CAP=179, LF%=98.9%, Brd-Off=CAI-JED, Classes: P:75, E:72, U:6, X:15, W:9
2026-01-10 08:42:50 | INFO     | [lf.flight.extracted] SM477 on 13JAN: BKG=179, LF=100.0%
[LF] SM477 13JAN: BKG=179, GRP=116, CAP=179, LF%=100.0%, Brd-Off=CAI-JED, Classes: P:81, E:35, O:10, U:21, X:22, T:10
2026-01-10 08:42:54 | INFO     | [lf.flight.extracted] SM459 on 13JAN: BKG=127, LF=71.0%
[LF] SM459 13JAN: BKG=127, GRP=35, CAP=179, LF%=71.0%, Brd-Off=CAI-JED, Classes: P:35, O:10, U:22, X:21, T:19, W:17, S:3
2026-01-10 08:42:57 | INFO     | [lf.flight.extracted] SM423 on 13JAN: BKG=134, LF=74.9%
[LF] SM423 13JAN: BKG=134, GRP=0, CAP=179, LF%=74.9%, Brd-Off=CAI-JED, Classes: O:10, U:32, X:58, T:19, W:8, S:7
2026-01-10 08:43:00 | INFO     | [lf.flight.extracted] SM475 on 13JAN: BKG=132, LF=73.7%
[LF] SM475 13JAN: BKG=132, GRP=45, CAP=179, LF%=73.7%, Brd-Off=CAI-JED, Classes: P:45, U:33, X:20, T:17, W:16, S:1
[LF] Getting WEEKLY/LASTSOLD data for 6 flights
[LF] SM471 13JAN: LASTSOLD=2026-01-09 00:00:00, WEEKLY=58, TODAY=0, YDAY=2
[LF] SM479 13JAN: LASTSOLD=2026-01-09 00:00:00, WEEKLY=8, TODAY=0, YDAY=2
[LF] SM477 13JAN: LASTSOLD=2026-01-08 00:00:00, WEEKLY=28, TODAY=0, YDAY=0
[LF] SM459 13JAN: LASTSOLD=2026-01-09 00:00:00, WEEKLY=48, TODAY=0, YDAY=9
[LF] SM423 13JAN: LASTSOLD=2026-01-10 00:00:00, WEEKLY=68, TODAY=2, YDAY=18
[LF] SM475 13JAN: LASTSOLD=2026-01-09 00:00:00, WEEKLY=34, TODAY=0, YDAY=6
2026-01-10 08:43:29 | INFO     | [SUCCESS] Day 13JAN
2026-01-10 08:43:29 | INFO     | [DAY_START] Processing 12JAN
[LF] Processing CAI-JED for 12JAN
2026-01-10 08:43:29 | INFO     | [lf.day.start] Processing CAI-JED for 12JAN
[LF] 12JAN: found 3 direct flights
2026-01-10 08:43:30 | INFO     | [lf.day.flights_found] Found 3 flights on 12JAN
2026-01-10 08:43:32 | INFO     | [lf.flight.extracted] SM475 on 12JAN: BKG=170, LF=95.0%
[LF] SM475 12JAN: BKG=170, GRP=95, CAP=179, LF%=95.0%, Brd-Off=CAI-JED, Classes: P:95, O:7, U:27, X:20, T:16, S:1, K:4
2026-01-10 08:43:35 | INFO     | [lf.flight.extracted] SM477 on 12JAN: BKG=179, LF=100.0%
[LF] SM477 12JAN: BKG=179, GRP=137, CAP=179, LF%=100.0%, Brd-Off=CAI-JED, Classes: P:137, O:10, U:23, X:9
2026-01-10 08:43:38 | INFO     | [lf.flight.extracted] SM459 on 12JAN: BKG=106, LF=59.2%
[LF] SM459 12JAN: BKG=106, GRP=0, CAP=179, LF%=59.2%, Brd-Off=CAI-JED, Classes: I:5, O:24, U:34, X:19, T:16, W:6, S:2
[LF] Getting WEEKLY/LASTSOLD data for 3 flights
[LF] SM475 12JAN: LASTSOLD=2026-01-09 00:00:00, WEEKLY=45, TODAY=0, YDAY=4
[LF] SM477 12JAN: LASTSOLD=2026-01-09 00:00:00, WEEKLY=11, TODAY=0, YDAY=1
[LF] SM459 12JAN: LASTSOLD=2026-01-10 00:00:00, WEEKLY=60, TODAY=2, YDAY=5
2026-01-10 08:43:54 | INFO     | [SUCCESS] Day 12JAN
2026-01-10 08:43:54 | INFO     | [DAY_START] Processing 11JAN
[LF] Processing CAI-JED for 11JAN
2026-01-10 08:43:54 | INFO     | [lf.day.start] Processing CAI-JED for 11JAN
[LF] 11JAN: found 5 direct flights
2026-01-10 08:43:55 | INFO     | [lf.day.flights_found] Found 5 flights on 11JAN
2026-01-10 08:43:57 | INFO     | [lf.flight.extracted] SM475 on 11JAN: BKG=166, LF=92.7%
[LF] SM475 11JAN: BKG=166, GRP=48, CAP=179, LF%=92.7%, Brd-Off=CAI-JED, Classes: P:48, I:40, O:40, U:38
2026-01-10 08:44:00 | INFO     | [lf.flight.extracted] SM431 on 11JAN: BKG=161, LF=89.9%
[LF] SM431 11JAN: BKG=161, GRP=36, CAP=179, LF%=89.9%, Brd-Off=CAI-JED, Classes: P:36, I:40, O:40, U:37, X:5, S:3
2026-01-10 08:44:03 | INFO     | [lf.flight.extracted] SM459 on 11JAN: BKG=171, LF=95.5%
[LF] SM459 11JAN: BKG=171, GRP=90, CAP=179, LF%=95.5%, Brd-Off=CAI-JED, Classes: P:90, I:24, O:22, U:23, X:12
[LPC] SM459 11JAN: Found 0 outbound flights with connecting passengers
2026-01-10 08:44:08 | INFO     | [lf.flight.extracted] SM477 on 11JAN: BKG=166, LF=94.3%
[LF] SM477 11JAN: BKG=166, GRP=85, CAP=176, LF%=94.3%, Brd-Off=CAI-JED, Classes: P:85, I:22, O:19, U:24, X:14, T:1, K:1
[LPC] SM477 11JAN: Found 1 outbound flights with connecting passengers
2026-01-10 08:44:13 | INFO     | [lf.flight.extracted] SM479 on 11JAN: BKG=139, LF=77.6%
[LF] SM479 11JAN: BKG=139, GRP=0, CAP=179, LF%=77.6%, Brd-Off=CAI-JED, Classes: I:26, O:54, U:40, X:19
[LF] Getting WEEKLY/LASTSOLD data for 5 flights
[LF] SM475 11JAN: LASTSOLD=2026-01-09 00:00:00, WEEKLY=79, TODAY=0, YDAY=19
[LF] SM431 11JAN: WEEKLY=99 → LP/T MANDATORY
[DEBUG] SM431 11JAN: Match #1: HK 09JAN | Line: 001  02ALSAYED/AMER               	76XR9J S  HK 09JAN RUHAA28WH
[DEBUG] SM431 11JAN: Match #2: HK 09JAN | Line: 003  02ELMRIOUECH/GHITA           	76XR9J S  HK 09JAN RUHAA28WH
[DEBUG] SM431 11JAN: Match #3: HK 08JAN | Line: 004  01ABDELRAHMAN/DAHLI          	9EXBXO X  HK 08JAN JEDS228F8
[DEBUG] SM431 11JAN: Match #4: HK 09JAN | Line: 005  01ALSAIDAN/MARYAM S          	7AYZDV X  HK 09JAN RUHAA28WH
[DEBUG] SM431 11JAN: Match #5: HK 07JAN | Line: 006  01ELBAKRY/KHALED             	94JQ45 X  HK 07JAN CAISM0727
[DEBUG] SM431 11JAN: DUPLICATE #1: 001 HK 09JAN | Skipping
[DEBUG] SM431 11JAN: DUPLICATE #2: 003 HK 09JAN | Skipping
[DEBUG] SM431 11JAN: DUPLICATE #3: 004 HK 08JAN | Skipping
[DEBUG] SM431 11JAN: DUPLICATE #4: 005 HK 09JAN | Skipping
[DEBUG] SM431 11JAN: DUPLICATE #5: 006 HK 07JAN | Skipping
[DEBUG] SM431 11JAN: Match #6: HK 09JAN | Line: 009  05A ABOUARAB/MOHAME          	779WPC U  HK 09JAN RUHAK38AB
[DEBUG] SM431 11JAN: Match #7: HK 09JAN | Line: 010  01ABDELHALIM/AMR             	7A5JBH U  HK 09JAN RUHAA28WH
[DEBUG] SM431 11JAN: Match #8: HK 05JAN | Line: 011  01ABDELNABI/ALI M            	88T6MA U  HK 05JAN RUHAA28WH
[DEBUG] SM431 11JAN: Match #9: HK 09JAN | Line: 012  01ABDELRAHMAN/ABDAL          	77NYM4 U  HK 09JAN CAIEG25K8
[DEBUG] SM431 11JAN: Match #10: HK 09JAN | Line: 013  02ABDELTAWAB/OMAR M          	7A55BN U  HK 09JAN CAI3C28CL
[DEBUG] SM431 11JAN: Match #11: HK 09JAN | Line: 014  01AHMED/ELABD MR             	746FVX U  HK 09JAN CAISM08AA
[DEBUG] SM431 11JAN: Match #12: HK 06JAN | Line: 015  01AHMED/EMAN MS              	8MD5ZP U  HK 06JAN RUHS228ZW
[DEBUG] SM431 11JAN: Match #13: HK 09JAN | Line: 016  01AHMED/MOHAMED              	773TT8 U  HK 09JAN RUHAA28WH
[DEBUG] SM431 11JAN: Match #14: HK 09JAN | Line: 017  02AL GAMISH/ALSHIMA          	74O54B U  HK 09JAN CAISM07TP
[DEBUG] SM431 11JAN: Match #15: HK 09JAN | Line: 018  02AL RADAAI/NAJAT M          	74O54B U  HK 09JAN CAISM07TP
[DEBUG] SM431 11JAN: Match #16: HK 09JAN | Line: 019  02ALALIY/NASSER RBI          	79Y3RG U  HK 09JAN LAXSM07NI
[DEBUG] SM431 11JAN: Match #17: HK 06JAN | Line: 020  01ALI/AYMAN MR               	8LDZ5J U  HK 06JAN CAISM07TP
[DEBUG] SM431 11JAN: Match #18: HK 09JAN | Line: 021  05ALI ATTIA/ALI AHM          	779WPC U  HK 09JAN RUHAK38AB
[DEBUG] SM431 11JAN: Match #19: HK 09JAN | Line: 022  01ALJOHARY/HAMZAH M          	7WIMVE U  HK 09JAN RUHS93120
[DEBUG] SM431 11JAN: Match #20: HK 09JAN | Line: 023  02ALZANDANI/ABDULMA          	79Y3RG U  HK 09JAN LAXSM07NI
[DEBUG] SM431 11JAN: Match #21: HK 05JAN | Line: 024  01AZIZ/MICHAEL MR            	7Z8CIC U  HK 05JAN ISTSM07TP
[DEBUG] SM431 11JAN: Match #22: HK 09JAN | Line: 025  01ELASHMAWI/ASHRAF           	764FCM U  HK 09JAN CAISM07TP
[DEBUG] SM431 11JAN: Match #23: HK 09JAN | Line: 026  02ELMEGHAMAD/MOHAME          	7A55BN U  HK 09JAN CAI3C28CL
[DEBUG] SM431 11JAN: Match #24: HK 06JAN | Line: 027  01ELMEZAIN/MOUSTAFA          	8JV9OC U  HK 06JAN LONSM07TP
[DEBUG] SM431 11JAN: Match #25: HK 05JAN | Line: 028  01ELMORSI/TAMER ELF          	88M4D4 U  HK 05JAN CAI3C28CL
[DEBUG] SM431 11JAN: Match #26: HK 06JAN | Line: 029  01ELSAYED/DOAA               	8QQECE U  HK 06JAN RUHS228YD
[DEBUG] SM431 11JAN: Match #27: HK 06JAN | Line: 030  01ELSEIDI/MOHAMED A          	8NS7KK U  HK 06JAN CAIEG28P3
[DEBUG] SM431 11JAN: Match #28: HK 07JAN | Line: 031  01GHONIM/MOHAMED MR          	98NDGJ U  HK 07JAN CAIEG28WT
[DEBUG] SM431 11JAN: Match #29: HK 09JAN | Line: 032  01HAGAWI/AHMED MANS          	9ZEJXD U  HK 09JAN JEDSM08MB
[DEBUG] SM431 11JAN: Match #30: HK 06JAN | Line: 033  01HASSAN/MOHAME MR           	8RTYWU U  HK 06JAN CAI3C28CL
[DEBUG] SM431 11JAN: Match #31: HK 09JAN | Line: 034  01HASSAN ALI/MAHMOU          	78UNZO U  HK 09JAN CAISM07TP
[DEBUG] SM431 11JAN: Match #32: HK 06JAN | Line: 036  01MEWAFY/HASSAN MR           	8OE2VZ U  HK 06JAN RUHS2236X
[DEBUG] SM431 11JAN: Match #33: HK 07JAN | Line: 037  01MOHAMED/FATEH MR           	Z2MJOL U  HK 07JAN OSLSG34AA
[DEBUG] SM431 11JAN: Match #34: HK 09JAN | Line: 039  05MOHAMED ALI/MOHAM          	779WPC U  HK 09JAN RUHAK38AB
[DEBUG] SM431 11JAN: Match #35: HK 09JAN | Line: 040  05MORSY KANDEEL/RAM          	779WPC U  HK 09JAN RUHAK38AB
[DEBUG] SM431 11JAN: Match #36: HK 09JAN | Line: 043  01NOUR HASSAN/MOHAM          	78NGIG U  HK 09JAN CAISM08AA
[DEBUG] SM431 11JAN: Match #37: HK 06JAN | Line: 044  01RAMADAN/ATEF MR            	8PAGTI U  HK 06JAN CAI3C28CL
[DEBUG] SM431 11JAN: Match #38: HK 09JAN | Line: 045  05TAHA MOHAMED/MOST          	779WPC U  HK 09JAN RUHAK38AB
[DEBUG] SM431 11JAN: Match #39: HK 08JAN | Line: 046  05ABDALLA IBRAHIM/A          	9NT3O7 O  HK 08JAN RUHAK38AB
[DEBUG] SM431 11JAN: Match #40: HK 08JAN | Line: 047  01ABDELAZIZ/WAFAA M          	9N5RMQ O  HK 08JAN JEDSM07TP
[DEBUG] SM431 11JAN: Match #41: HK 08JAN | Line: 048  05ABDELFATTAH ELSAY          	9NT3O7 O  HK 08JAN RUHAK38AB
[DEBUG] SM431 11JAN: Match #42: HK 04JAN | Line: 050  01ABDELSALAM/SAYED           	7M45FG O  HK 04JAN CAISM07TP
[DEBUG] SM431 11JAN: Match #43: HK 08JAN | Line: 051  05ABDELSAMIE HAMOUD          	9NT3O7 O  HK 08JAN RUHAK38AB
[DEBUG] SM431 11JAN: Match #44: HK 08JAN | Line: 052  05ABDELWAHAB ABDELM          	9NT3O7 O  HK 08JAN RUHAK38AB
[DEBUG] SM431 11JAN: Match #45: HK 04JAN | Line: 053  01AHMED/AHMED MOHAM          	7IGJQ8 O  HK 04JAN CAISM07TP
[DEBUG] SM431 11JAN: Match #46: HK 08JAN | Line: 054  04AHMED/KAREMA EID           	9NJTC5 O  HK 08JAN CAIEG23G0
[DEBUG] SM431 11JAN: Match #47: HK 04JAN | Line: 056  01ALI/HOSNY MOHAMED          	7HDU8F O  HK 04JAN CAISM07NI
[DEBUG] SM431 11JAN: Match #48: HK 08JAN | Line: 057  01ALY/ESLAM ESSAM            	9OGCDJ O  HK 08JAN CAIEG26O0
[DEBUG] SM431 11JAN: Match #49: HK 08JAN | Line: 058  05ATTALLA MADBOULY/          	9NT3O7 O  HK 08JAN RUHAK38AB
[DEBUG] SM431 11JAN: Match #50: HK 03JAN | Line: 059  02BADAWI/MOUAZ MSTR          	77N5NT O  HK 03JAN ELQS22248
[DEBUG] SM431 11JAN: Match #51: HK 08JAN | Line: 060  04BADAWY/EID GABER           	9NJTC5 O  HK 08JAN CAIEG23G0
[DEBUG] SM431 11JAN: Match #52: HK 08JAN | Line: 061  04BADAWY/NEFISA KOR          	9NJTC5 O  HK 08JAN CAIEG23G0
[DEBUG] SM431 11JAN: Match #53: HK 08JAN | Line: 062  02BAIOUMY/AHMED MR           	9N2KXZ O  HK 08JAN ALYEG3722
[DEBUG] SM431 11JAN: Match #54: HK 04JAN | Line: 065  01ELGABRY/MAHMOUD B          	7K73NA O  HK 04JAN JEDS228F8
[DEBUG] SM431 11JAN: Match #55: HK 04JAN | Line: 066  01ELHESI/MOHAMED MO          	7IB8A2 O  HK 04JAN CAIEG21W4
[DEBUG] SM431 11JAN: Match #56: HK 08JAN | Line: 067  01HAMED KHALIL/ABDE          	9LO3ZA O  HK 08JAN CAISM07TP
[DEBUG] SM431 11JAN: Match #57: HK 08JAN | Line: 068  03HASSAN/KARIMA MOH          	9NZM5C O  HK 08JAN CAIEG23G0
[DEBUG] SM431 11JAN: Match #58: HK 08JAN | Line: 070  04IBRAHIM/ARZAK MOH          	9NJTC5 O  HK 08JAN CAIEG23G0
[DEBUG] SM431 11JAN: Match #59: HK 04JAN | Line: 071  01IBRAHIM/MOHAMED M          	7J4CQP O  HK 04JAN CAIEG358J
[DEBUG] SM431 11JAN: Match #60: HK 04JAN | Line: 072  01LI/XIAOLONG MR             	DL7R6J O  HK 04JAN TYOHW2115
[DEBUG] SM431 11JAN: Match #61: HK 04JAN | Line: 073  03LI/YINGJIE MR              	BZCLHZ O  HK 04JAN ORD1S21DH
[DEBUG] SM431 11JAN: Match #62: HK 04JAN | Line: 074  01MA/ENPEI MR                	7JXQRW O  HK 04JAN LONSM07TP
[DEBUG] SM431 11JAN: Match #63: HK 04JAN | Line: 075  03MA/YI MR                   	BZCLHZ O  HK 04JAN ORD1S21DH
[DEBUG] SM431 11JAN: Match #64: HK 08JAN | Line: 076  03MADBOULY/SHAIMAA           	9NZM5C O  HK 08JAN CAIEG23G0
[DEBUG] SM431 11JAN: Match #65: HK 08JAN | Line: 077  01MOHAMED/ELSHAHHAT          	9LYXQL O  HK 08JAN CAISM07TP
[DEBUG] SM431 11JAN: Match #66: HK 03JAN | Line: 079  02MOHAMED/SAMAH MS           	77N5NT O  HK 03JAN ELQS22248
[DEBUG] SM431 11JAN: Match #67: HK 08JAN | Line: 080  01MOHAMMAD/HUSSEIN           	9NTFAO O  HK 08JAN CAIEG28FF
[DEBUG] SM431 11JAN: Match #68: HK 08JAN | Line: 082  02SALEM/AHMED MR             	9N2KXZ O  HK 08JAN ALYEG3722
[DEBUG] SM431 11JAN: Match #69: HK 08JAN | Line: 083  03SAYED/SAMAH RAMAD          	9NZM5C O  HK 08JAN CAIEG23G0
[DEBUG] SM431 11JAN: Match #70: HK 08JAN | Line: 084  01SELIM/ENTESAR FAT          	9ONTN9 O  HK 08JAN QSUSM0100
[DEBUG] SM431 11JAN: Match #71: HK 04JAN | Line: 085  03WU/ZEHUI MR                	BZCLHZ O  HK 04JAN ORD1S21DH
[DEBUG] SM431 11JAN: Match #72: HK 03JAN | Line: 118  01MOHAMED/ABAZAR MR          	9ZJKCL I  HK 03JAN CAIEG2410
[DEBUG] SM431 11JAN: Match #73: HK 03JAN | Line: 126N 01ABDELA/EHSAN ABDE          	76K4DE P  HK 03JAN CAISM0100
[DEBUG] SM431 11JAN: Match #74: HK 03JAN | Line: 127N 01ABDELHAFEZ/SALMA           	76K4DE P  HK 03JAN CAISM0100
[DEBUG] SM431 11JAN: Match #75: HK 03JAN | Line: 128N 01ABDELNABY/MOHAMED          	76K4DE P  HK 03JAN CAISM0100
[DEBUG] SM431 11JAN: Match #76: HK 03JAN | Line: 129N 01ABOELFADEL/AZZA A          	76K4DE P  HK 03JAN CAISM0100
[DEBUG] SM431 11JAN: Match #77: HK 03JAN | Line: 130N 01ABOTAHOUN/SABAH F          	76K4DE P  HK 03JAN CAISM0100
[DEBUG] SM431 11JAN: Match #78: HK 03JAN | Line: 131N 01ABOUHASSAN/FATHY           	76K4DE P  HK 03JAN CAISM0100
[DEBUG] SM431 11JAN: Match #79: HK 03JAN | Line: 132N 01ALATTAR/AMIRA ROS          	76K4DE P  HK 03JAN CAISM0100
[DEBUG] SM431 11JAN: Match #80: HK 03JAN | Line: 133N 01ALMEZAIN/REDA MAH          	76K4DE P  HK 03JAN CAISM0100
[DEBUG] SM431 11JAN: Match #81: HK 03JAN | Line: 134N 01ALTABAKH/LAYLA IB          	76K4DE P  HK 03JAN CAISM0100
[DEBUG] SM431 11JAN: Match #82: HK 03JAN | Line: 135N 01ANAB/SALWA MOHAME          	76K4DE P  HK 03JAN CAISM0100
[DEBUG] SM431 11JAN: Match #83: HK 03JAN | Line: 136N 01ATTIA/HEBA ELSAYE          	76K4DE P  HK 03JAN CAISM0100
[DEBUG] SM431 11JAN: Match #84: HK 03JAN | Line: 137N 01AYOUB/NORHAN REFA          	76K4DE P  HK 03JAN CAISM0100
[DEBUG] SM431 11JAN: Match #85: HK 03JAN | Line: 138N 01DAWOUD/NESMA ABDE          	76K4DE P  HK 03JAN CAISM0100
[DEBUG] SM431 11JAN: Match #86: HK 03JAN | Line: 139N 01EDRIS/KARIMA MOHA          	76K4DE P  HK 03JAN CAISM0100
[DEBUG] SM431 11JAN: Match #87: HK 03JAN | Line: 140N 01ELBAKRY/MOHAMED K          	76K4DE P  HK 03JAN CAISM0100
[DEBUG] SM431 11JAN: Match #88: HK 03JAN | Line: 141N 01ELBROL/KARIMA ABD          	76K4DE P  HK 03JAN CAISM0100
[DEBUG] SM431 11JAN: Match #89: HK 03JAN | Line: 142N 01ELGHORAB/MOHAMED           	76K4DE P  HK 03JAN CAISM0100
[DEBUG] SM431 11JAN: Match #90: HK 03JAN | Line: 143N 01ELHAMSA/NABILA HA          	76K4DE P  HK 03JAN CAISM0100
[DEBUG] SM431 11JAN: Match #91: HK 03JAN | Line: 144N 01ELHAW/ABDELREHIM           	76K4DE P  HK 03JAN CAISM0100
[DEBUG] SM431 11JAN: Match #92: HK 03JAN | Line: 145N 01ELMADBOULY/AHMED           	76K4DE P  HK 03JAN CAISM0100
[DEBUG] SM431 11JAN: Match #93: HK 03JAN | Line: 146N 01ELSAADAWY/ABIR ZA          	76K4DE P  HK 03JAN CAISM0100
[DEBUG] SM431 11JAN: Match #94: HK 03JAN | Line: 147N 01ELSAKA/MOUSTAFA Z          	76K4DE P  HK 03JAN CAISM0100
[DEBUG] SM431 11JAN: Match #95: HK 03JAN | Line: 148N 01ELTABAKH/AHMED IB          	76K4DE P  HK 03JAN CAISM0100
[DEBUG] SM431 11JAN: Match #96: HK 03JAN | Line: 149N 01ELTOUKHY/MERVAT M          	76K4DE P  HK 03JAN CAISM0100
[DEBUG] SM431 11JAN: Match #97: HK 03JAN | Line: 150N 01ELZANT/MOUSTAFA A          	76K4DE P  HK 03JAN CAISM0100
[DEBUG] SM431 11JAN: Match #98: HK 03JAN | Line: 151N 01ESHIBA/HEMAT MOST          	76K4DE P  HK 03JAN CAISM0100
[DEBUG] SM431 11JAN: Match #99: HK 03JAN | Line: 152N 01FADEL/MARWA SHAAB          	76K4DE P  HK 03JAN CAISM0100
[DEBUG] SM431 11JAN: Match #100: HK 03JAN | Line: 153N 01GHORAB/ESSAM MOHA          	76K4DE P  HK 03JAN CAISM0100
[DEBUG] SM431 11JAN: Match #101: HK 03JAN | Line: 154N 01HAGGAG/SAIDA YOUS          	76K4DE P  HK 03JAN CAISM0100
[DEBUG] SM431 11JAN: Match #102: HK 03JAN | Line: 155N 01IBRAHIM/AHMED ABD          	76K4DE P  HK 03JAN CAISM0100
[DEBUG] SM431 11JAN: Match #103: HK 03JAN | Line: 156N 01MAGHRABY/AFAF MOH          	76K4DE P  HK 03JAN CAISM0100
[DEBUG] SM431 11JAN: Match #104: HK 03JAN | Line: 157N 01MAGHRBY/THORYA MO          	76K4DE P  HK 03JAN CAISM0100
[DEBUG] SM431 11JAN: Match #105: HK 03JAN | Line: 158N 01MAHHAR/SOUAD BASI          	76K4DE P  HK 03JAN CAISM0100
[DEBUG] SM431 11JAN: DUPLICATE #6: 155N HK 03JAN | Skipping
[DEBUG] SM431 11JAN: DUPLICATE #7: 156N HK 03JAN | Skipping
[DEBUG] SM431 11JAN: DUPLICATE #8: 157N HK 03JAN | Skipping
[DEBUG] SM431 11JAN: DUPLICATE #9: 158N HK 03JAN | Skipping
[DEBUG] SM431 11JAN: Match #106: HK 03JAN | Line: 159N 01METWALLY/MONERA A          	76K4DE P  HK 03JAN CAISM0100
[DEBUG] SM431 11JAN: Match #107: HK 03JAN | Line: 160N 01MOUSTAFA/HAFIZA M          	76K4DE P  HK 03JAN CAISM0100
[DEBUG] SM431 11JAN: Match #108: HK 03JAN | Line: 161N 01OSHIBA/HODA MOSTA          	76K4DE P  HK 03JAN CAISM0100
[LF] SM431 11JAN: LP/T count complete. True WEEKLY: 108, TODAY: 0, YDAY: 23 | Removed 9 duplicates
[LF] SM431 11JAN: LP/T result: WEEKLY=108, TODAY=0, YDAY=23
[LF] SM431 11JAN: LASTSOLD=2026-01-09 00:00:00, WEEKLY=108, TODAY=0, YDAY=23
[LF] SM459 11JAN: LASTSOLD=2026-01-09 00:00:00, WEEKLY=45, TODAY=0, YDAY=2
[LF] SM477 11JAN: LASTSOLD=2026-01-09 00:00:00, WEEKLY=40, TODAY=0, YDAY=5
[LF] SM479 11JAN: LASTSOLD=2026-01-09 00:00:00, WEEKLY=79, TODAY=0, YDAY=17
2026-01-10 08:44:53 | INFO     | [SUCCESS] Day 11JAN
[LF] Skipping 10JAN (Today) - will be processed by supplement scan
[LF] Results summary:
  2026-01-20: 7 flights
  2026-01-19: 3 flights
  2026-01-18: 5 flights
  2026-01-17: 4 flights
  2026-01-16: 5 flights
  2026-01-15: 6 flights
  2026-01-14: 5 flights
  2026-01-13: 6 flights
  2026-01-12: 3 flights
  2026-01-11: 5 flights
2026-01-10 08:44:53 | INFO     | [SUCCESS] LF Search Complete

============================================================
[Worker_9224] ✓ COMPLETED: CAI-JED
  Results: 10 dates
  Errors: 0 dates
  Total Processed: 2 groups
============================================================

2026-01-10 08:44:55 | INFO     | [Worker_9224] Completed: CAI-JED - 10 results, 0 errors
[Worker_9224] Waiting for tasks...

============================================================
[Worker_9224] Shutdown signal received
Exiting...
============================================================
2026-01-10 08:45:35 | INFO     | [Worker_9224] Shutdown signal received, exiting...

============================================================
[Worker_9224] FINISHED
  Total Groups Processed: 2
============================================================

2026-01-10 08:45:35 | INFO     | [Worker_9224] Finished. Processed 2 groups.
