
============================================================
     LF WORKER - PORT 9227
============================================================
Worker: Worker_9227
Status: READY
Waiting for tasks...
============================================================


============================================================
[Worker_9227] Processing: JED-CAI
  Tier 0: Range 1, Chunk 2/2
  Dates: 11 days
  Date Range: 2026-01-20 to 2026-01-10
============================================================

2026-01-10 08:36:25 | INFO     | ======================================================================
2026-01-10 08:36:25 | INFO     | Load Factor Scraper Started - Route: JED-CAI
2026-01-10 08:36:25 | INFO     | Log file: D:\CODERED\LAB\Artifacts\run_generated_100126_at_08.36\logs\LF_JED-CAI_20260110_083625.log
2026-01-10 08:36:25 | INFO     | Enhanced logging: Capturing both logging.info() and print()
2026-01-10 08:36:25 | INFO     | ======================================================================
[LF] Processing dates (override): ['20JAN', '19JAN', '18JAN', '17JAN', '16JAN', '15JAN', '14JAN', '13JAN', '12JAN', '11JAN', '10JAN']
[LF] Attaching to Chrome for Altea access
[LF][[OK] SUCCESS] Connected to Chrome on 127.0.0.1:9227 (after 1 attempts)
[LF][[OK] SUCCESS] Found Amadeus Altea window: Altéa Reservation Desktop
[LF][[INFO] INFO] URL: https://tc212.resdesktop.altea.amadeus.com/app_ard/apf/init/login?SITE=ESMPESMP&LANGUAGE=GB&MARKETS=ARDW_PROD_WBP&ACTION=clpLogin
[LF] Processing JED-CAI for 20JAN
[LF][ERROR] Amadeus command error detected: UNKNOWN TRANSACTION
[LF][ERROR] Command: SN20JANJEDCAI/ASM
[LF][RESYNC] Triggering immediate resync to last successful SN command
============================================================
[LF][RESYNC] Command 'SN20JANJEDCAI/ASM' failed: TECH_ERROR:UNKNOWN TRANSACTION
[LF][RESYNC] Re-running entire day from SN command for JED-CAI 20JAN
[LF][RESYNC] Attempt 1/50 (waiting 1.0s before retry...)
============================================================
[LF][RESYNC] Sending IG to clear session state...
[LF][RESYNC] Session cleared with IG
[LF] Processing JED-CAI for 20JAN
[LF] 20JAN: found 7 direct flights
[LF] SM472 20JAN: BKG=11, GRP=0, CAP=175, LF%=6.3%, Brd-Off=JED-CAI, Classes: I:9, U:2
[LF] SM954 20JAN: BKG=10, GRP=0, CAP=167, LF%=6.0%, Brd-Off=JED-CAI, Classes: I:10
[LF] SM480 20JAN: BKG=122, GRP=94, CAP=175, LF%=69.7%, Brd-Off=JED-CAI, Classes: P:94, I:18, O:1, U:8, X:1
[LF] SM478 20JAN: BKG=155, GRP=130, CAP=168, LF%=92.3%, Brd-Off=JED-CAI, Classes: P:130, I:15, O:1, U:7, L:1, Y:1
[LF] SM460 20JAN: BKG=121, GRP=91, CAP=172, LF%=70.3%, Brd-Off=JED-CAI, Classes: N:3, P:91, I:17, O:1, U:9
[LF] SM424 20JAN: BKG=20, GRP=0, CAP=175, LF%=11.4%, Brd-Off=JED-CAI, Classes: I:16, U:3, K:1
[LF] SM476 20JAN: BKG=59, GRP=45, CAP=175, LF%=33.7%, Brd-Off=JED-CAI, Classes: P:45, I:9, O:1, U:3, S:1
[LPC] SM476 20JAN: Found 0 outbound flights with connecting passengers
[LF] Getting WEEKLY/LASTSOLD data for 7 flights
[LF] SM472 20JAN: LASTSOLD=2026-01-07 00:00:00, WEEKLY=4, TODAY=0, YDAY=0
[LF] SM954 20JAN: LASTSOLD=2026-01-05 00:00:00, WEEKLY=2, TODAY=0, YDAY=0
[LF] SM480 20JAN: LASTSOLD=2026-01-09 00:00:00, WEEKLY=11, TODAY=0, YDAY=2
[LF] SM478 20JAN: LASTSOLD=2026-01-09 00:00:00, WEEKLY=13, TODAY=0, YDAY=1
[LF] SM460 20JAN: LASTSOLD=2026-01-09 00:00:00, WEEKLY=5, TODAY=0, YDAY=2
[LF] SM424 20JAN: LASTSOLD=2026-01-09 00:00:00, WEEKLY=8, TODAY=0, YDAY=2
[LF] SM476 20JAN: LASTSOLD=2026-01-08 00:00:00, WEEKLY=8, TODAY=0, YDAY=0
[LF] Processing JED-CAI for 19JAN
[LF] 19JAN: found 4 direct flights
[LF] SM480 19JAN: BKG=46, GRP=41, CAP=175, LF%=26.3%, Brd-Off=JED-CAI, Classes: P:41, I:4, U:1
[LF] SM476 19JAN: BKG=142, GRP=123, CAP=175, LF%=81.1%, Brd-Off=JED-CAI, Classes: P:123, I:13, U:6
[LF] SM478 19JAN: BKG=77, GRP=51, CAP=175, LF%=44.0%, Brd-Off=JED-CAI, Classes: P:51, I:20, U:5, S:1
[LPC] SM478 19JAN: Found 1 outbound flights with connecting passengers
[LF] SM460 19JAN: BKG=122, GRP=103, CAP=175, LF%=69.7%, Brd-Off=JED-CAI, Classes: P:96, E:8, I:18
[LPC] SM460 19JAN: Found 0 outbound flights with connecting passengers
[LF] Getting WEEKLY/LASTSOLD data for 4 flights
[LF] SM480 19JAN: LASTSOLD=2026-01-07 00:00:00, WEEKLY=44, TODAY=0, YDAY=0
[LF] SM476 19JAN: LASTSOLD=2026-01-09 00:00:00, WEEKLY=5, TODAY=0, YDAY=2
[LF] SM478 19JAN: LASTSOLD=2026-01-09 00:00:00, WEEKLY=14, TODAY=0, YDAY=1
[LF] SM460 19JAN: LASTSOLD=2026-01-09 00:00:00, WEEKLY=8, TODAY=0, YDAY=4
[LF] Processing JED-CAI for 18JAN
[LF] 18JAN: found 5 direct flights
[LF] SM424 18JAN: BKG=98, GRP=76, CAP=175, LF%=56.0%, Brd-Off=JED-CAI, Classes: P:76, I:22
[LF] SM476 18JAN: BKG=10, GRP=0, CAP=175, LF%=5.7%, Brd-Off=JED-CAI, Classes: I:8, U:2
[LF] SM432 18JAN: BKG=54, GRP=40, CAP=175, LF%=30.9%, Brd-Off=JED-CAI, Classes: P:40, I:9, U:4, S:1
[LPC] SM432 18JAN: Found 1 outbound flights with connecting passengers
[LF] SM460 18JAN: BKG=78, GRP=51, CAP=172, LF%=45.4%, Brd-Off=JED-CAI, Classes: P:51, I:24, O:2, U:1
[LF] SM478 18JAN: BKG=168, GRP=137, CAP=168, LF%=100.0%, Brd-Off=JED-CAI, Classes: P:137, I:24, O:1, U:3, S:3
[LF] Getting WEEKLY/LASTSOLD data for 5 flights
[LF] SM424 18JAN: LASTSOLD=2026-01-06 00:00:00, WEEKLY=6, TODAY=0, YDAY=0
[LF] SM476 18JAN: LASTSOLD=2026-01-06 00:00:00, WEEKLY=5, TODAY=0, YDAY=0
[LF] SM432 18JAN: LASTSOLD=2026-01-09 00:00:00, WEEKLY=6, TODAY=0, YDAY=2
[LF] SM460 18JAN: LASTSOLD=2026-01-08 00:00:00, WEEKLY=19, TODAY=0, YDAY=0
[LF] SM478 18JAN: LASTSOLD=2026-01-05 00:00:00, WEEKLY=4, TODAY=0, YDAY=0
[LF] Processing JED-CAI for 17JAN
[LF] 17JAN: found 3 direct flights
[LF] SM450 17JAN: BKG=32, GRP=0, CAP=175, LF%=18.3%, Brd-Off=JED-CAI, Classes: I:19, O:7, U:6
[LF] SM476 17JAN: BKG=128, GRP=92, CAP=175, LF%=73.1%, Brd-Off=JED-CAI, Classes: P:92, I:12, O:4, U:10, X:10
[LF] SM478 17JAN: BKG=133, GRP=70, CAP=175, LF%=76.0%, Brd-Off=JED-CAI, Classes: P:70, I:30, O:16, U:8, X:9
[LF] Getting WEEKLY/LASTSOLD data for 3 flights
[LF] SM450 17JAN: LASTSOLD=2026-01-08 00:00:00, WEEKLY=19, TODAY=0, YDAY=0
[LF] SM476 17JAN: LASTSOLD=2026-01-09 00:00:00, WEEKLY=12, TODAY=0, YDAY=1
[LF] SM478 17JAN: LASTSOLD=2026-01-10 00:00:00, WEEKLY=18, TODAY=2, YDAY=4
[LF] Processing JED-CAI for 16JAN
[LF] 16JAN: found 6 direct flights
[LF] SM424 16JAN: BKG=22, GRP=0, CAP=175, LF%=12.6%, Brd-Off=JED-CAI, Classes: I:19, O:1, U:1, S:1
[LF] SM476 16JAN: BKG=13, GRP=0, CAP=175, LF%=7.4%, Brd-Off=JED-CAI, Classes: I:6, O:2, U:4, S:1
[LPC] SM476 16JAN: Found 1 outbound flights with connecting passengers
[LF] SM478 16JAN: BKG=34, GRP=0, CAP=175, LF%=19.4%, Brd-Off=JED-CAI, Classes: I:32, O:2
[LF] SM480 16JAN: BKG=42, GRP=0, CAP=175, LF%=24.0%, Brd-Off=JED-CAI, Classes: I:21, O:9, U:7, G:1, K:4
[LF] SM472 16JAN: BKG=116, GRP=49, CAP=175, LF%=66.3%, Brd-Off=JED-CAI, Classes: E:49, I:10, O:29, U:17, X:10, W:1
[LF] SM460 16JAN: BKG=81, GRP=42, CAP=175, LF%=46.3%, Brd-Off=JED-CAI, Classes: P:42, I:19, O:13, U:5, W:1, G:1
[LF] Getting WEEKLY/LASTSOLD data for 6 flights
[LF] SM424 16JAN: LASTSOLD=2026-01-08 00:00:00, WEEKLY=12, TODAY=0, YDAY=0
[LF] SM476 16JAN: LASTSOLD=2026-01-08 00:00:00, WEEKLY=3, TODAY=0, YDAY=0
[LF] SM478 16JAN: LASTSOLD=2026-01-07 00:00:00, WEEKLY=12, TODAY=0, YDAY=0
[LF] SM480 16JAN: LASTSOLD=2026-01-08 00:00:00, WEEKLY=11, TODAY=0, YDAY=0
[LF] SM472 16JAN: LASTSOLD=2026-01-09 00:00:00, WEEKLY=12, TODAY=0, YDAY=4
[LF] SM460 16JAN: LASTSOLD=2026-01-07 00:00:00, WEEKLY=29, TODAY=0, YDAY=0
[LF] Processing JED-CAI for 15JAN
[LF] 15JAN: found 6 direct flights
[LF] SM472 15JAN: BKG=93, GRP=45, CAP=175, LF%=53.1%, Brd-Off=JED-CAI, Classes: P:45, I:35, O:2, U:9, X:1, S:1
[LPC] SM472 15JAN: Found 1 outbound flights with connecting passengers
[LF] SM450 15JAN: BKG=22, GRP=0, CAP=175, LF%=12.6%, Brd-Off=JED-CAI, Classes: I:21, U:1
[LF] SM476 15JAN: BKG=18, GRP=0, CAP=175, LF%=10.3%, Brd-Off=JED-CAI, Classes: I:18
[LF] SM432 15JAN: BKG=18, GRP=0, CAP=172, LF%=10.5%, Brd-Off=JED-CAI, Classes: I:18
[LF] SM478 15JAN: BKG=156, GRP=94, CAP=175, LF%=89.1%, Brd-Off=JED-CAI, Classes: P:94, I:40, O:10, U:9, X:3
[LF] SM480 15JAN: BKG=175, GRP=92, CAP=175, LF%=100.0%, Brd-Off=JED-CAI, Classes: P:92, I:45, O:22, U:11, X:3, S:1, L:1
[LF] Getting WEEKLY/LASTSOLD data for 6 flights
[LF] SM472 15JAN: LASTSOLD=2026-01-09 00:00:00, WEEKLY=33, TODAY=0, YDAY=2
[LF] SM450 15JAN: LASTSOLD=2026-01-09 00:00:00, WEEKLY=20, TODAY=0, YDAY=5
[LF] SM476 15JAN: LASTSOLD=2026-01-08 00:00:00, WEEKLY=13, TODAY=0, YDAY=0
[LF] SM432 15JAN: LASTSOLD=2026-01-10 00:00:00, WEEKLY=12, TODAY=2, YDAY=2
[LF] SM478 15JAN: LASTSOLD=2026-01-09 00:00:00, WEEKLY=34, TODAY=0, YDAY=3
[LF] SM480 15JAN: LASTSOLD=2026-01-09 00:00:00, WEEKLY=49, TODAY=0, YDAY=1
[LF] Processing JED-CAI for 14JAN
[LF] 14JAN: found 4 direct flights
[LF] SM476 14JAN: BKG=118, GRP=47, CAP=175, LF%=67.4%, Brd-Off=JED-CAI, Classes: P:47, I:33, O:18, U:18, X:1, S:1
[LPC] SM476 14JAN: Found 1 outbound flights with connecting passengers
[LF] SM478 14JAN: BKG=155, GRP=96, CAP=172, LF%=90.1%, Brd-Off=JED-CAI, Classes: P:51, E:45, I:30, O:5, U:20, X:4
[LF] SM460 14JAN: BKG=173, GRP=125, CAP=175, LF%=98.9%, Brd-Off=JED-CAI, Classes: P:125, I:18, O:20, U:10
[LF] SM424 14JAN: BKG=65, GRP=0, CAP=175, LF%=37.1%, Brd-Off=JED-CAI, Classes: I:25, O:24, U:10, X:5, G:1
[LF] Getting WEEKLY/LASTSOLD data for 4 flights
[LF] SM476 14JAN: LASTSOLD=2026-01-10 00:00:00, WEEKLY=47, TODAY=1, YDAY=3
[LF] SM478 14JAN: LASTSOLD=2026-01-09 00:00:00, WEEKLY=29, TODAY=0, YDAY=2
[LF] SM460 14JAN: LASTSOLD=2026-01-09 00:00:00, WEEKLY=24, TODAY=0, YDAY=1
[LF] SM424 14JAN: LASTSOLD=2026-01-10 00:00:00, WEEKLY=34, TODAY=1, YDAY=4
[LF] Processing JED-CAI for 13JAN
[LF] 13JAN: found 6 direct flights
[LF] SM472 13JAN: BKG=138, GRP=49, CAP=172, LF%=80.2%, Brd-Off=JED-CAI, Classes: P:49, I:12, O:20, U:40, X:12, S:5
[LPC] SM472 13JAN: Found 2 outbound flights with connecting passengers
[LF] SM480 13JAN: BKG=134, GRP=85, CAP=175, LF%=76.6%, Brd-Off=JED-CAI, Classes: P:40, E:45, U:25, X:21, T:3
[LF] SM478 13JAN: BKG=161, GRP=125, CAP=175, LF%=92.0%, Brd-Off=JED-CAI, Classes: P:125, U:25, X:10, K:1
[LF] SM460 13JAN: BKG=139, GRP=94, CAP=175, LF%=79.4%, Brd-Off=JED-CAI, Classes: N:2, P:93, E:1, U:24, X:13, T:3, W:3
[LF] SM424 13JAN: BKG=104, GRP=46, CAP=175, LF%=59.4%, Brd-Off=JED-CAI, Classes: P:46, I:14, O:26, U:16, X:2
[LF] SM476 13JAN: BKG=119, GRP=75, CAP=175, LF%=68.0%, Brd-Off=JED-CAI, Classes: P:75, O:25, U:11, X:7, K:1
[LF] Getting WEEKLY/LASTSOLD data for 6 flights
[LF] SM472 13JAN: LASTSOLD=2026-01-10 00:00:00, WEEKLY=61, TODAY=4, YDAY=8
[LF] SM480 13JAN: LASTSOLD=2026-01-09 00:00:00, WEEKLY=22, TODAY=0, YDAY=3
[LF] SM478 13JAN: LASTSOLD=2026-01-09 00:00:00, WEEKLY=24, TODAY=0, YDAY=1
[LF] SM460 13JAN: LASTSOLD=2026-01-10 00:00:00, WEEKLY=25, TODAY=2, YDAY=4
[LF] SM424 13JAN: LASTSOLD=2026-01-09 00:00:00, WEEKLY=41, TODAY=0, YDAY=6
[LF] SM476 13JAN: LASTSOLD=2026-01-09 00:00:00, WEEKLY=29, TODAY=0, YDAY=4
[LF] Processing JED-CAI for 12JAN
[LF] 12JAN: found 4 direct flights
[LF] SM480 12JAN: BKG=163, GRP=131, CAP=175, LF%=93.1%, Brd-Off=JED-CAI, Classes: P:131, U:22, X:10
[LF] SM476 12JAN: BKG=167, GRP=117, CAP=167, LF%=100.0%, Brd-Off=JED-CAI, Classes: P:117, U:12, X:28, T:8, G:1, K:1
[LF] SM478 12JAN: BKG=168, GRP=125, CAP=175, LF%=96.0%, Brd-Off=JED-CAI, Classes: P:125, U:10, X:26, T:4, S:2, K:1
[LPC] SM478 12JAN: Found 1 outbound flights with connecting passengers
[LF] SM460 12JAN: BKG=175, GRP=112, CAP=175, LF%=100.0%, Brd-Off=JED-CAI, Classes: P:112, O:15, U:26, X:20, G:1, L:1
[LPC] SM460 12JAN: Found 0 outbound flights with connecting passengers
[LF] Getting WEEKLY/LASTSOLD data for 4 flights
[LF] SM480 12JAN: LASTSOLD=2026-01-10 00:00:00, WEEKLY=3, TODAY=1, YDAY=1
[LF] SM476 12JAN: LASTSOLD=2026-01-08 00:00:00, WEEKLY=21, TODAY=0, YDAY=0
[LF] SM478 12JAN: LASTSOLD=2026-01-08 00:00:00, WEEKLY=19, TODAY=0, YDAY=0
[LF] SM460 12JAN: LASTSOLD=2026-01-08 00:00:00, WEEKLY=31, TODAY=0, YDAY=0
[LF] Processing JED-CAI for 11JAN
[LF] 11JAN: found 5 direct flights
[LF] SM424 11JAN: BKG=174, GRP=128, CAP=175, LF%=99.4%, Brd-Off=JED-CAI, Classes: N:1, P:65, E:62, U:8, X:13, T:19, V:6
[LPC] SM424 11JAN: Found 1 outbound flights with connecting passengers
[LF] SM476 11JAN: BKG=177, GRP=66, CAP=178, LF%=99.4%, Brd-Off=JED-CAI, Classes: P:66, I:1, U:22, X:30, T:16, W:14, S:27, Q:1
[LPC] SM476 11JAN: Found 1 outbound flights with connecting passengers
[LF] SM432 11JAN: BKG=178, GRP=140, CAP=178, LF%=100.0%, Brd-Off=JED-CAI, Classes: P:140, O:7, U:12, X:19
[LF] SM460 11JAN: BKG=178, GRP=94, CAP=178, LF%=100.0%, Brd-Off=JED-CAI, Classes: P:94, I:14, O:14, U:14, X:13, T:11, W:7, S:9, G:2
[LPC] SM460 11JAN: Found 0 outbound flights with connecting passengers
[LF] SM478 11JAN: BKG=175, GRP=137, CAP=175, LF%=100.0%, Brd-Off=JED-CAI, Classes: P:43, E:94, U:13, X:11, T:10, S:4
[LF] Getting WEEKLY/LASTSOLD data for 5 flights
[LF] SM424 11JAN: LASTSOLD=2026-01-05 00:00:00, WEEKLY=4, TODAY=0, YDAY=0
[LF] SM476 11JAN: LASTSOLD=2026-01-09 00:00:00, WEEKLY=42, TODAY=0, YDAY=2
[LF] SM432 11JAN: LASTSOLD=2026-01-09 00:00:00, WEEKLY=11, TODAY=0, YDAY=1
[LF] SM460 11JAN: LASTSOLD=2026-01-08 00:00:00, WEEKLY=43, TODAY=0, YDAY=0
[LF] SM478 11JAN: LASTSOLD=2026-01-09 00:00:00, WEEKLY=10, TODAY=0, YDAY=1
[LF] Skipping 10JAN (Today) - will be processed by supplement scan
[LF] Results summary:
  2026-01-20: 7 flights
  2026-01-19: 4 flights
  2026-01-18: 5 flights
  2026-01-17: 3 flights
  2026-01-16: 6 flights
  2026-01-15: 6 flights
  2026-01-14: 4 flights
  2026-01-13: 6 flights
  2026-01-12: 4 flights
  2026-01-11: 5 flights

============================================================
[Worker_9227] ✓ COMPLETED: JED-CAI
  Results: 10 dates
  Errors: 0 dates
  Total Processed: 1 groups
============================================================

[Worker_9227] Waiting for tasks...

============================================================
[Worker_9227] Shutdown signal received
Exiting...
============================================================

============================================================
[Worker_9227] FINISHED
  Total Groups Processed: 1
============================================================

