
============================================================
     LF WORKER - PORT 9232
============================================================
Worker: Worker_9232
Status: READY
Waiting for tasks...
============================================================


============================================================
[Worker_9232] Processing: JED-CAI
  Tier 0: Range 1, Chunk 1/2
  Dates: 11 days
  Date Range: 2026-01-31 to 2026-01-21
============================================================

2026-01-10 08:36:25 | INFO     | ======================================================================
2026-01-10 08:36:25 | INFO     | Load Factor Scraper Started - Route: JED-CAI
2026-01-10 08:36:25 | INFO     | Log file: D:\CODERED\LAB\Artifacts\run_generated_100126_at_08.36\logs\LF_JED-CAI_20260110_083625.log
2026-01-10 08:36:25 | INFO     | Enhanced logging: Capturing both logging.info() and print()
2026-01-10 08:36:25 | INFO     | ======================================================================
[LF] Processing dates (override): ['31JAN', '30JAN', '29JAN', '28JAN', '27JAN', '26JAN', '25JAN', '24JAN', '23JAN', '22JAN', '21JAN']
[LF] Attaching to Chrome for Altea access
[LF][[OK] SUCCESS] Connected to Chrome on 127.0.0.1:9232 (after 1 attempts)
[LF][[OK] SUCCESS] Found Amadeus Altea window: Altéa Reservation Desktop
[LF][[INFO] INFO] URL: https://tc212.resdesktop.altea.amadeus.com/app_ard/apf/init/login?SITE=ESMPESMP&LANGUAGE=GB&MARKETS=ARDW_PROD_WBP&ACTION=clpLogin
[LF] Processing JED-CAI for 31JAN
[LF][ERROR] Amadeus command error detected: UNKNOWN TRANSACTION
[LF][ERROR] Command: SN31JANJEDCAI/ASM
[LF][RESYNC] Triggering immediate resync to last successful SN command
============================================================
[LF][RESYNC] Command 'SN31JANJEDCAI/ASM' failed: TECH_ERROR:UNKNOWN TRANSACTION
[LF][RESYNC] Re-running entire day from SN command for JED-CAI 31JAN
[LF][RESYNC] Attempt 1/50 (waiting 1.0s before retry...)
============================================================
[LF][RESYNC] Sending IG to clear session state...
[LF][RESYNC] Session cleared with IG
[LF] Processing JED-CAI for 31JAN
[LF] 31JAN: found 3 direct flights
[LF] SM450 31JAN: BKG=158, GRP=127, CAP=175, LF%=90.3%, Brd-Off=JED-CAI, Classes: N:2, E:125, I:6, U:18, X:7
[LPC] SM450 31JAN: Found 1 outbound flights with connecting passengers
[LF] SM476 31JAN: BKG=168, GRP=135, CAP=175, LF%=96.0%, Brd-Off=JED-CAI, Classes: P:135, I:17, O:1, U:3, X:3, W:5, S:4
[LPC] SM476 31JAN: Found 1 outbound flights with connecting passengers
[LF] SM478 31JAN: BKG=105, GRP=70, CAP=175, LF%=60.0%, Brd-Off=JED-CAI, Classes: N:4, P:70, U:9, X:21, K:1
[LPC] SM478 31JAN: Found 0 outbound flights with connecting passengers
[LF] Getting WEEKLY/LASTSOLD data for 3 flights
[LF] SM450 31JAN: LASTSOLD=2026-01-09 00:00:00, WEEKLY=18, TODAY=0, YDAY=8
[LF] SM476 31JAN: LASTSOLD=2026-01-05 00:00:00, WEEKLY=3, TODAY=0, YDAY=0
[LF] SM478 31JAN: LASTSOLD=2026-01-08 00:00:00, WEEKLY=20, TODAY=0, YDAY=0
[LF] Processing JED-CAI for 30JAN
[LF] 30JAN: found 6 direct flights
[LF] SM424 30JAN: BKG=55, GRP=45, CAP=172, LF%=32.0%, Brd-Off=JED-CAI, Classes: P:45, I:1, U:4, X:3, Q:2
[LPC] SM424 30JAN: Found 2 outbound flights with connecting passengers
[LF] SM476 30JAN: BKG=32, GRP=0, CAP=175, LF%=18.3%, Brd-Off=JED-CAI, Classes: I:11, O:15, U:6
[LF] SM478 30JAN: BKG=34, GRP=0, CAP=175, LF%=19.4%, Brd-Off=JED-CAI, Classes: I:1, O:25, U:8
[LF] SM480 30JAN: BKG=20, GRP=0, CAP=175, LF%=11.4%, Brd-Off=JED-CAI, Classes: I:8, U:12
[LF] SM472 30JAN: BKG=97, GRP=52, CAP=175, LF%=55.4%, Brd-Off=JED-CAI, Classes: P:7, E:45, I:14, U:15, X:16
[LF] SM460 30JAN: BKG=138, GRP=90, CAP=168, LF%=82.1%, Brd-Off=JED-CAI, Classes: N:1, P:90, I:17, O:2, U:18, X:9, K:1
[LF] Getting WEEKLY/LASTSOLD data for 6 flights
[LF] SM424 30JAN: LASTSOLD=2026-01-06 00:00:00, WEEKLY=2, TODAY=0, YDAY=0
[LF] SM476 30JAN: LASTSOLD=2026-01-09 00:00:00, WEEKLY=22, TODAY=0, YDAY=4
[LF] SM478 30JAN: LASTSOLD=2026-01-08 00:00:00, WEEKLY=9, TODAY=0, YDAY=0
[LF] SM480 30JAN: LASTSOLD=2026-01-08 00:00:00, WEEKLY=2, TODAY=0, YDAY=0
[LF] SM472 30JAN: LASTSOLD=2026-01-08 00:00:00, WEEKLY=11, TODAY=0, YDAY=0
[LF] SM460 30JAN: LASTSOLD=2026-01-09 00:00:00, WEEKLY=12, TODAY=0, YDAY=1
[LF] Processing JED-CAI for 29JAN
[LF] 29JAN: found 6 direct flights
[LF] SM472 29JAN: BKG=71, GRP=48, CAP=175, LF%=40.6%, Brd-Off=JED-CAI, Classes: P:48, I:18, U:5
[LF] SM450 29JAN: BKG=123, GRP=108, CAP=172, LF%=71.5%, Brd-Off=JED-CAI, Classes: E:108, I:11, U:4
[LPC] SM450 29JAN: Found 2 outbound flights with connecting passengers
[LF] SM476 29JAN: BKG=77, GRP=55, CAP=175, LF%=44.0%, Brd-Off=JED-CAI, Classes: P:55, I:20, U:2
[LF] SM432 29JAN: BKG=168, GRP=140, CAP=175, LF%=96.0%, Brd-Off=JED-CAI, Classes: P:140, I:27, K:1
[LF] SM478 29JAN: BKG=152, GRP=135, CAP=168, LF%=90.5%, Brd-Off=JED-CAI, Classes: P:135, I:2, U:15
[LF] SM480 29JAN: BKG=123, GRP=90, CAP=175, LF%=70.3%, Brd-Off=JED-CAI, Classes: N:4, P:90, I:10, U:10, X:8, K:1
[LF] Getting WEEKLY/LASTSOLD data for 6 flights
[LF] SM472 29JAN: LASTSOLD=2026-01-08 00:00:00, WEEKLY=8, TODAY=0, YDAY=0
[LF] SM450 29JAN: LASTSOLD=2026-01-09 00:00:00, WEEKLY=13, TODAY=0, YDAY=2
[LF] SM476 29JAN: LASTSOLD=2026-01-09 00:00:00, WEEKLY=15, TODAY=0, YDAY=9
[LF] SM432 29JAN: LASTSOLD=2026-01-04 00:00:00, WEEKLY=1, TODAY=0, YDAY=0
[LF] SM478 29JAN: LASTSOLD=2026-01-09 00:00:00, WEEKLY=7, TODAY=0, YDAY=1
[LF] SM480 29JAN: LASTSOLD=2026-01-05 00:00:00, WEEKLY=2, TODAY=0, YDAY=0
[LF] Processing JED-CAI for 28JAN
[LF] 28JAN: found 4 direct flights
[LF] SM476 28JAN: BKG=120, GRP=90, CAP=175, LF%=68.6%, Brd-Off=JED-CAI, Classes: P:90, I:27, U:2, X:1
[LF] SM478 28JAN: BKG=74, GRP=45, CAP=175, LF%=42.3%, Brd-Off=JED-CAI, Classes: P:45, I:23, U:6
[LF] SM460 28JAN: BKG=133, GRP=95, CAP=168, LF%=79.2%, Brd-Off=JED-CAI, Classes: P:95, I:29, O:2, U:7
[LF] SM424 28JAN: BKG=32, GRP=0, CAP=175, LF%=18.3%, Brd-Off=JED-CAI, Classes: I:32
[LF] Getting WEEKLY/LASTSOLD data for 4 flights
[LF] SM476 28JAN: LASTSOLD=2026-01-09 00:00:00, WEEKLY=21, TODAY=0, YDAY=1
[LF] SM478 28JAN: LASTSOLD=2026-01-09 00:00:00, WEEKLY=12, TODAY=0, YDAY=2
[LF] SM460 28JAN: LASTSOLD=2026-01-09 00:00:00, WEEKLY=17, TODAY=0, YDAY=4
[LF] SM424 28JAN: LASTSOLD=2026-01-10 00:00:00, WEEKLY=8, TODAY=2, YDAY=0
[LF] Processing JED-CAI for 27JAN
[LF] 27JAN: found 6 direct flights
[LF] SM472 27JAN: BKG=8, GRP=0, CAP=172, LF%=4.7%, Brd-Off=JED-CAI, Classes: I:8
[LF] SM480 27JAN: BKG=104, GRP=79, CAP=175, LF%=59.4%, Brd-Off=JED-CAI, Classes: P:79, I:23, U:1, K:1
[LF] SM478 27JAN: BKG=56, GRP=31, CAP=168, LF%=33.3%, Brd-Off=JED-CAI, Classes: P:31, I:15, U:7, S:2, K:1
[LF] SM460 27JAN: BKG=162, GRP=129, CAP=172, LF%=94.2%, Brd-Off=JED-CAI, Classes: P:129, I:26, O:4, U:3
[LF] SM424 27JAN: BKG=6, GRP=0, CAP=175, LF%=3.4%, Brd-Off=JED-CAI, Classes: I:4, U:2
[LF] SM476 27JAN: BKG=100, GRP=94, CAP=175, LF%=57.1%, Brd-Off=JED-CAI, Classes: P:49, E:45, I:6
[LF] Getting WEEKLY/LASTSOLD data for 6 flights
[LF] SM472 27JAN: LASTSOLD=2026-01-07 00:00:00, WEEKLY=4, TODAY=0, YDAY=0
[LF] SM480 27JAN: LASTSOLD=2026-01-08 00:00:00, WEEKLY=9, TODAY=0, YDAY=0
[LF] SM478 27JAN: LASTSOLD=2026-01-07 00:00:00, WEEKLY=6, TODAY=0, YDAY=0
[LF] SM460 27JAN: LASTSOLD=2026-01-10 00:00:00, WEEKLY=53, TODAY=4, YDAY=1
[LF] SM424 27JAN: LASTSOLD=2026-01-09 00:00:00, WEEKLY=3, TODAY=0, YDAY=1
[LF] SM476 27JAN: LASTSOLD=2026-01-08 00:00:00, WEEKLY=6, TODAY=0, YDAY=0
[LF] Processing JED-CAI for 26JAN
[LF] 26JAN: found 4 direct flights
[LF] SM480 26JAN: BKG=26, GRP=6, CAP=175, LF%=14.9%, Brd-Off=JED-CAI, Classes: P:6, I:19, U:1
[LF] SM476 26JAN: BKG=106, GRP=92, CAP=172, LF%=61.6%, Brd-Off=JED-CAI, Classes: P:92, I:4, O:9, U:1
[LF] SM478 26JAN: BKG=122, GRP=90, CAP=175, LF%=69.7%, Brd-Off=JED-CAI, Classes: P:45, E:45, I:17, O:10, U:4, K:1
[LF] SM460 26JAN: BKG=160, GRP=140, CAP=175, LF%=91.4%, Brd-Off=JED-CAI, Classes: P:140, I:8, O:6, U:1, X:1, K:4
[LPC] SM460 26JAN: Found 0 outbound flights with connecting passengers
[LF] Getting WEEKLY/LASTSOLD data for 4 flights
[LF] SM480 26JAN: LASTSOLD=2026-01-08 00:00:00, WEEKLY=19, TODAY=0, YDAY=0
[LF] SM476 26JAN: LASTSOLD=2026-01-10 00:00:00, WEEKLY=3, TODAY=1, YDAY=0
[LF] SM478 26JAN: LASTSOLD=2026-01-09 00:00:00, WEEKLY=15, TODAY=0, YDAY=3
[LF] SM460 26JAN: LASTSOLD=2026-01-07 00:00:00, WEEKLY=7, TODAY=0, YDAY=0
[LF] Processing JED-CAI for 25JAN
[LF] 25JAN: found 5 direct flights
[LF] SM424 25JAN: BKG=96, GRP=90, CAP=175, LF%=54.9%, Brd-Off=JED-CAI, Classes: P:90, I:6
[LF] SM476 25JAN: BKG=51, GRP=45, CAP=175, LF%=29.1%, Brd-Off=JED-CAI, Classes: P:45, I:1, U:5
[LF] SM432 25JAN: BKG=15, GRP=0, CAP=175, LF%=8.6%, Brd-Off=JED-CAI, Classes: I:15
[LF] SM460 25JAN: BKG=124, GRP=100, CAP=175, LF%=70.9%, Brd-Off=JED-CAI, Classes: P:100, I:15, O:5, U:4
[LF] SM478 25JAN: BKG=131, GRP=91, CAP=175, LF%=74.9%, Brd-Off=JED-CAI, Classes: N:5, P:91, I:20, O:9, U:4, X:1, K:1
[LF] Getting WEEKLY/LASTSOLD data for 5 flights
[LF] SM424 25JAN: LASTSOLD=2026-01-08 00:00:00, WEEKLY=2, TODAY=0, YDAY=0
[LF] SM476 25JAN: LASTSOLD=2025-12-19 00:00:00, WEEKLY=0, TODAY=0, YDAY=0
[LF] SM432 25JAN: LASTSOLD=2026-01-07 00:00:00, WEEKLY=8, TODAY=0, YDAY=0
[LF] SM460 25JAN: LASTSOLD=2026-01-09 00:00:00, WEEKLY=13, TODAY=0, YDAY=7
[LF] SM478 25JAN: LASTSOLD=2026-01-09 00:00:00, WEEKLY=15, TODAY=0, YDAY=4
[LF] Processing JED-CAI for 24JAN
[LF] 24JAN: found 3 direct flights
[LF] SM450 24JAN: BKG=30, GRP=0, CAP=175, LF%=17.1%, Brd-Off=JED-CAI, Classes: I:26, U:2, X:1, T:1
[LF] SM476 24JAN: BKG=149, GRP=132, CAP=172, LF%=86.6%, Brd-Off=JED-CAI, Classes: P:132, I:4, O:11, U:1, K:1
[LF] SM478 24JAN: BKG=151, GRP=87, CAP=175, LF%=86.3%, Brd-Off=JED-CAI, Classes: N:2, P:87, I:27, O:17, U:15, S:1, L:2
[LF] Getting WEEKLY/LASTSOLD data for 3 flights
[LF] SM450 24JAN: LASTSOLD=2026-01-09 00:00:00, WEEKLY=11, TODAY=0, YDAY=2
[LF] SM476 24JAN: LASTSOLD=2026-01-10 00:00:00, WEEKLY=6, TODAY=2, YDAY=0
[LF] SM478 24JAN: LASTSOLD=2026-01-09 00:00:00, WEEKLY=24, TODAY=0, YDAY=3
[LF] Processing JED-CAI for 23JAN
[LF] 23JAN: found 6 direct flights
[LF] SM424 23JAN: BKG=12, GRP=0, CAP=172, LF%=7.0%, Brd-Off=JED-CAI, Classes: I:8, O:3, U:1
[LF] SM476 23JAN: BKG=4, GRP=0, CAP=175, LF%=2.3%, Brd-Off=JED-CAI, Classes: I:3, U:1
[LF] SM478 23JAN: BKG=17, GRP=0, CAP=175, LF%=9.7%, Brd-Off=JED-CAI, Classes: I:15, O:2
[LF] SM480 23JAN: BKG=53, GRP=40, CAP=175, LF%=30.3%, Brd-Off=JED-CAI, Classes: P:40, I:4, O:7, U:2
[LF] SM472 23JAN: BKG=98, GRP=68, CAP=175, LF%=56.0%, Brd-Off=JED-CAI, Classes: P:41, E:27, I:18, O:5, U:3, X:2, S:2
[LPC] SM472 23JAN: Found 1 outbound flights with connecting passengers
[LF] SM460 23JAN: BKG=68, GRP=46, CAP=175, LF%=38.9%, Brd-Off=JED-CAI, Classes: P:46, I:15, O:4, U:1, K:2
[LF] Getting WEEKLY/LASTSOLD data for 6 flights
[LF] SM424 23JAN: LASTSOLD=2026-01-09 00:00:00, WEEKLY=4, TODAY=0, YDAY=1
[LF] SM476 23JAN: LASTSOLD=2026-01-06 00:00:00, WEEKLY=1, TODAY=0, YDAY=0
[LF] SM478 23JAN: LASTSOLD=2026-01-09 00:00:00, WEEKLY=7, TODAY=0, YDAY=1
[LF] SM480 23JAN: LASTSOLD=2026-01-07 00:00:00, WEEKLY=4, TODAY=0, YDAY=0
[LF] SM472 23JAN: LASTSOLD=2026-01-08 00:00:00, WEEKLY=17, TODAY=0, YDAY=0
[LF] SM460 23JAN: LASTSOLD=2026-01-08 00:00:00, WEEKLY=10, TODAY=0, YDAY=0
[LF] Processing JED-CAI for 22JAN
[LF] 22JAN: found 7 direct flights
[LF] SM472 22JAN: BKG=12, GRP=1, CAP=175, LF%=6.9%, Brd-Off=JED-CAI, Classes: P:1, I:8, U:3
[LF] SM450 22JAN: BKG=7, GRP=0, CAP=168, LF%=4.2%, Brd-Off=JED-CAI, Classes: I:5, U:2
[LF] SM476 22JAN: BKG=12, GRP=10, CAP=175, LF%=6.9%, Brd-Off=JED-CAI, Classes: P:10, U:2
[LF] SM432 22JAN: BKG=12, GRP=0, CAP=175, LF%=6.9%, Brd-Off=JED-CAI, Classes: I:12
[LF] SM962 22JAN: BKG=17, GRP=0, CAP=164, LF%=10.4%, Brd-Off=JED-CAI, Classes: I:16, O:1
[LF] SM478 22JAN: BKG=131, GRP=115, CAP=175, LF%=74.9%, Brd-Off=JED-CAI, Classes: P:115, I:4, O:9, U:3
[LF] SM480 22JAN: BKG=165, GRP=122, CAP=175, LF%=94.3%, Brd-Off=JED-CAI, Classes: P:77, E:45, I:23, O:15, U:5
[LF] Getting WEEKLY/LASTSOLD data for 7 flights
[LF] SM472 22JAN: LASTSOLD=2026-01-09 00:00:00, WEEKLY=6, TODAY=0, YDAY=2
[LF] SM450 22JAN: LASTSOLD=2026-01-04 00:00:00, WEEKLY=5, TODAY=0, YDAY=0
[LF] SM476 22JAN: LASTSOLD=2025-11-30 00:00:00, WEEKLY=0, TODAY=0, YDAY=0
[LF] SM432 22JAN: LASTSOLD=2026-01-08 00:00:00, WEEKLY=5, TODAY=0, YDAY=0
[LF] SM962 22JAN: LASTSOLD=2026-01-09 00:00:00, WEEKLY=2, TODAY=0, YDAY=1
[LF] SM478 22JAN: LASTSOLD=2026-01-09 00:00:00, WEEKLY=5, TODAY=0, YDAY=1
[LF] SM480 22JAN: LASTSOLD=2026-01-10 00:00:00, WEEKLY=23, TODAY=1, YDAY=4
[LF] Processing JED-CAI for 21JAN
[LF] 21JAN: found 4 direct flights
[LF] SM476 21JAN: BKG=51, GRP=40, CAP=175, LF%=29.1%, Brd-Off=JED-CAI, Classes: P:40, I:7, U:4
[LF] SM478 21JAN: BKG=106, GRP=100, CAP=175, LF%=60.6%, Brd-Off=JED-CAI, Classes: P:100, I:2, O:3, X:1
[LF] SM460 21JAN: BKG=165, GRP=143, CAP=175, LF%=94.3%, Brd-Off=JED-CAI, Classes: P:98, E:45, I:11, O:9, U:2
[LF] SM424 21JAN: BKG=35, GRP=0, CAP=175, LF%=20.0%, Brd-Off=JED-CAI, Classes: I:30, O:4, U:1
[LF] Getting WEEKLY/LASTSOLD data for 4 flights
[LF] SM476 21JAN: LASTSOLD=2026-01-08 00:00:00, WEEKLY=6, TODAY=0, YDAY=0
[LF] SM478 21JAN: LASTSOLD=2026-01-07 00:00:00, WEEKLY=7, TODAY=0, YDAY=0
[LF] SM460 21JAN: LASTSOLD=2026-01-08 00:00:00, WEEKLY=15, TODAY=0, YDAY=0
[LF] SM424 21JAN: LASTSOLD=2026-01-08 00:00:00, WEEKLY=18, TODAY=0, YDAY=0
[LF] Results summary:
  2026-01-31: 3 flights
  2026-01-30: 6 flights
  2026-01-29: 6 flights
  2026-01-28: 4 flights
  2026-01-27: 6 flights
  2026-01-26: 4 flights
  2026-01-25: 5 flights
  2026-01-24: 3 flights
  2026-01-23: 6 flights
  2026-01-22: 7 flights
  2026-01-21: 4 flights

============================================================
[Worker_9232] ✓ COMPLETED: JED-CAI
  Results: 11 dates
  Errors: 0 dates
  Total Processed: 1 groups
============================================================

[Worker_9232] Waiting for tasks...

============================================================
[Worker_9232] Shutdown signal received
Exiting...
============================================================

============================================================
[Worker_9232] FINISHED
  Total Groups Processed: 1
============================================================

