
============================================================
     LF WORKER - PORT 9223
============================================================
Worker: Worker_9223
Status: READY
Waiting for tasks...
============================================================


============================================================
[Worker_9223] Processing: JED-CAI
  Tier 0: Range 1, Chunk 1/2
  Dates: 13 days
  Date Range: 2026-01-31 to 2026-01-19
============================================================

2026-01-06 08:43:42 | INFO     | ======================================================================
2026-01-06 08:43:42 | INFO     | Load Factor Scraper Started - Route: JED-CAI
2026-01-06 08:43:42 | INFO     | Log file: D:\CODERED\LAB\market_insights\outputs\run_generated_060126_at_08.43\logs\LF_JED-CAI_20260106_084342.log
2026-01-06 08:43:42 | INFO     | Enhanced logging: Capturing both logging.info() and print()
2026-01-06 08:43:42 | INFO     | ======================================================================
[LF] Processing dates (override): ['31JAN', '30JAN', '29JAN', '28JAN', '27JAN', '26JAN', '25JAN', '24JAN', '23JAN', '22JAN', '21JAN', '20JAN', '19JAN']
[LF] Attaching to Chrome for Altea access
[LF][[OK] SUCCESS] Connected to Chrome on 127.0.0.1:9223 (after 1 attempts)
[LF][[OK] SUCCESS] Found Amadeus Altea window: Altéa Reservation Desktop
[LF][[INFO] INFO] URL: https://tc212.resdesktop.altea.amadeus.com/app_ard/apf/init/login?SITE=ESMPESMP&LANGUAGE=GB&MARKETS=ARDW_PROD_WBP&ACTION=clpLogin
[LF] Processing JED-CAI for 31JAN
[LF][ERROR] Amadeus command error detected: UNKNOWN TRANSACTION
[LF][ERROR] Command: SN31JANJEDCAI/ASM
[LF][RESYNC] Triggering immediate resync to last successful SN command
============================================================
[LF][RESYNC] Command 'SN31JANJEDCAI/ASM' failed: TECH_ERROR:UNKNOWN TRANSACTION
[LF][RESYNC] Re-running entire day from SN command for JED-CAI 31JAN
[LF][RESYNC] Attempt 1/50 (waiting 1.0s before retry...)
============================================================
[LF][RESYNC] Sending IG to clear session state...
[LF][RESYNC] Session cleared with IG
[LF] Processing JED-CAI for 31JAN
[LF] 31JAN: found 3 direct flights
[LF] SM450 31JAN: BKG=148, GRP=130, CAP=175, LF%=84.6%, Brd-Off=JED-CAI, Classes: E:130, I:6, U:12
[LPC] SM450 31JAN: Found 1 outbound flights with connecting passengers
[LF] SM476 31JAN: BKG=168, GRP=135, CAP=175, LF%=96.0%, Brd-Off=JED-CAI, Classes: P:135, I:17, O:1, U:3, X:3, W:5, S:4
[LPC] SM476 31JAN: Found 1 outbound flights with connecting passengers
[LF] SM478 31JAN: BKG=139, GRP=115, CAP=175, LF%=79.4%, Brd-Off=JED-CAI, Classes: N:4, P:115, U:9, X:10, K:1
[LPC] Error parsing connecting passengers for SM478/31JAN: Message: stale element reference: stale element not found in the current frame
  (Session info: chrome=143.0.7499.170); For documentation on this error, please visit: https://www.selenium.dev/documentation/webdriver/troubleshooting/errors#staleelementreferenceexception
Stacktrace:
Symbols not available. Dumping unresolved backtrace:
	0x7ff67fc788e5
	0x7ff67fc78940
	0x7ff67fa5165d
	0x7ff67fa592cc
	0x7ff67fa5c74e
	0x7ff67fafc05f
	0x7ff67fad1fda
	0x7ff67fafac97
	0x7ff67fa9ac29
	0x7ff67fa9ba93
	0x7ff67ff90640
	0x7ff67ff8af80
	0x7ff67ffa96e6
	0x7ff67fc95de4
	0x7ff67fc9ed8c
	0x7ff67fc82004
	0x7ff67fc821b5
	0x7ff67fc67ee2
	0x7ff845c6e8d7
	0x7ff846d6c53c

[LF] Getting WEEKLY/LASTSOLD data for 3 flights
[LF] SM450 31JAN: LASTSOLD=2026-01-06 00:00:00, WEEKLY=2, TODAY=2, YDAY=0
[LF] SM476 31JAN: LASTSOLD=2026-01-05 00:00:00, WEEKLY=9, TODAY=0, YDAY=3
[LF] SM478 31JAN: LASTSOLD=2026-01-05 00:00:00, WEEKLY=9, TODAY=0, YDAY=3
[LF] Processing JED-CAI for 30JAN
[LF] 30JAN: found 6 direct flights
[LF] SM424 30JAN: BKG=55, GRP=45, CAP=172, LF%=32.0%, Brd-Off=JED-CAI, Classes: P:45, I:1, U:4, X:3, Q:2
[LPC] SM424 30JAN: Found 2 outbound flights with connecting passengers
[LF] SM476 30JAN: BKG=22, GRP=0, CAP=175, LF%=12.6%, Brd-Off=JED-CAI, Classes: I:7, O:12, U:3
[LF] SM478 30JAN: BKG=29, GRP=0, CAP=175, LF%=16.6%, Brd-Off=JED-CAI, Classes: I:1, O:20, U:8
[LF] SM480 30JAN: BKG=19, GRP=0, CAP=175, LF%=10.9%, Brd-Off=JED-CAI, Classes: I:8, U:10, T:1
[LF] SM472 30JAN: BKG=94, GRP=55, CAP=175, LF%=53.7%, Brd-Off=JED-CAI, Classes: P:10, E:45, I:15, U:8, X:16
[LF] SM460 30JAN: BKG=131, GRP=90, CAP=168, LF%=78.0%, Brd-Off=JED-CAI, Classes: N:1, P:90, I:17, O:2, U:11, X:9, K:1
[LF] Getting WEEKLY/LASTSOLD data for 6 flights
[LF] SM424 30JAN: LASTSOLD=2026-01-06 00:00:00, WEEKLY=3, TODAY=2, YDAY=0
[LF] SM476 30JAN: LASTSOLD=2026-01-05 00:00:00, WEEKLY=18, TODAY=0, YDAY=6
[LF] SM478 30JAN: LASTSOLD=2026-01-05 00:00:00, WEEKLY=20, TODAY=0, YDAY=4
[LF] SM480 30JAN: LASTSOLD=2026-01-04 00:00:00, WEEKLY=1, TODAY=0, YDAY=0
[LF] SM472 30JAN: LASTSOLD=2026-01-05 00:00:00, WEEKLY=7, TODAY=0, YDAY=1
[LF] SM460 30JAN: LASTSOLD=2026-01-05 00:00:00, WEEKLY=6, TODAY=0, YDAY=2
[LF] Processing JED-CAI for 29JAN
[LF] 29JAN: found 6 direct flights
[LF] SM472 29JAN: BKG=67, GRP=48, CAP=175, LF%=38.3%, Brd-Off=JED-CAI, Classes: P:48, I:14, U:5
[LF] SM450 29JAN: BKG=125, GRP=118, CAP=172, LF%=72.7%, Brd-Off=JED-CAI, Classes: E:118, I:3, U:4
[LPC] SM450 29JAN: Found 2 outbound flights with connecting passengers
[LF] SM476 29JAN: BKG=63, GRP=55, CAP=175, LF%=36.0%, Brd-Off=JED-CAI, Classes: P:55, I:6, U:2
[LF] SM432 29JAN: BKG=168, GRP=140, CAP=175, LF%=96.0%, Brd-Off=JED-CAI, Classes: P:140, I:27, K:1
[LF] SM478 29JAN: BKG=152, GRP=140, CAP=168, LF%=90.5%, Brd-Off=JED-CAI, Classes: P:140, I:2, U:10
[LF] SM480 29JAN: BKG=168, GRP=135, CAP=175, LF%=96.0%, Brd-Off=JED-CAI, Classes: N:4, P:135, I:10, U:10, X:8, K:1
[LF] Getting WEEKLY/LASTSOLD data for 6 flights
[LF] SM472 29JAN: LASTSOLD=2026-01-05 00:00:00, WEEKLY=7, TODAY=0, YDAY=1
[LF] SM450 29JAN: LASTSOLD=2026-01-01 00:00:00, WEEKLY=2, TODAY=0, YDAY=0
[LF] SM476 29JAN: LASTSOLD=2026-01-03 00:00:00, WEEKLY=4, TODAY=0, YDAY=0
[LF] SM432 29JAN: LASTSOLD=2026-01-04 00:00:00, WEEKLY=17, TODAY=0, YDAY=0
[LF] SM478 29JAN: LASTSOLD=2026-01-03 00:00:00, WEEKLY=1, TODAY=0, YDAY=0
[LF] SM480 29JAN: LASTSOLD=2026-01-05 00:00:00, WEEKLY=2, TODAY=0, YDAY=1
[LF] Processing JED-CAI for 28JAN
[LF] 28JAN: found 4 direct flights
[LF] SM476 28JAN: BKG=103, GRP=90, CAP=175, LF%=58.9%, Brd-Off=JED-CAI, Classes: P:90, I:11, U:2
[LF] SM478 28JAN: BKG=109, GRP=90, CAP=175, LF%=62.3%, Brd-Off=JED-CAI, Classes: P:90, I:13, U:6
[LF] SM460 28JAN: BKG=128, GRP=95, CAP=168, LF%=76.2%, Brd-Off=JED-CAI, Classes: P:95, I:24, O:2, U:7
[LF] SM424 28JAN: BKG=27, GRP=0, CAP=175, LF%=15.4%, Brd-Off=JED-CAI, Classes: I:27
[LF] Getting WEEKLY/LASTSOLD data for 4 flights
[LF] SM476 28JAN: LASTSOLD=2026-01-06 00:00:00, WEEKLY=6, TODAY=1, YDAY=0
[LF] SM478 28JAN: LASTSOLD=2026-01-05 00:00:00, WEEKLY=10, TODAY=0, YDAY=1
[LF] SM460 28JAN: LASTSOLD=2026-01-04 00:00:00, WEEKLY=21, TODAY=0, YDAY=0
[LF] SM424 28JAN: LASTSOLD=2026-01-05 00:00:00, WEEKLY=15, TODAY=0, YDAY=1
[LF] Processing JED-CAI for 27JAN
[LF] 27JAN: found 6 direct flights
[LF] SM472 27JAN: BKG=6, GRP=0, CAP=175, LF%=3.4%, Brd-Off=JED-CAI, Classes: I:6
[LF] SM480 27JAN: BKG=102, GRP=80, CAP=172, LF%=59.3%, Brd-Off=JED-CAI, Classes: P:80, I:20, U:1, K:1
[LF] SM478 27JAN: BKG=67, GRP=45, CAP=168, LF%=39.9%, Brd-Off=JED-CAI, Classes: P:45, I:14, U:7, K:1
[LF] SM460 27JAN: BKG=153, GRP=129, CAP=175, LF%=87.4%, Brd-Off=JED-CAI, Classes: P:129, I:18, O:3, U:3
[LF] SM424 27JAN: BKG=5, GRP=0, CAP=175, LF%=2.9%, Brd-Off=JED-CAI, Classes: I:3, U:2
[LF] SM476 27JAN: BKG=47, GRP=45, CAP=175, LF%=26.9%, Brd-Off=JED-CAI, Classes: E:45, I:2
[LF] Getting WEEKLY/LASTSOLD data for 6 flights
[LF] SM472 27JAN: LASTSOLD=2026-01-04 00:00:00, WEEKLY=6, TODAY=0, YDAY=0
[LF] SM480 27JAN: LASTSOLD=2026-01-05 00:00:00, WEEKLY=6, TODAY=0, YDAY=1
[LF] SM478 27JAN: LASTSOLD=2026-01-04 00:00:00, WEEKLY=8, TODAY=0, YDAY=0
[LF] SM460 27JAN: LASTSOLD=2026-01-04 00:00:00, WEEKLY=59, TODAY=0, YDAY=0
[LF] SM424 27JAN: LASTSOLD=2026-01-05 00:00:00, WEEKLY=2, TODAY=0, YDAY=2
[LF] SM476 27JAN: LASTSOLD=2025-12-22 00:00:00, WEEKLY=0, TODAY=0, YDAY=0
[LF] Processing JED-CAI for 26JAN
[LF] 26JAN: found 4 direct flights
[LF] SM480 26JAN: BKG=8, GRP=0, CAP=175, LF%=4.6%, Brd-Off=JED-CAI, Classes: I:7, U:1
[LF] SM476 26JAN: BKG=104, GRP=92, CAP=175, LF%=59.4%, Brd-Off=JED-CAI, Classes: P:92, I:2, O:9, U:1
[LF] SM478 26JAN: BKG=156, GRP=135, CAP=175, LF%=89.1%, Brd-Off=JED-CAI, Classes: P:90, E:45, I:8, O:10, U:3
[LF] SM460 26JAN: BKG=159, GRP=140, CAP=175, LF%=90.9%, Brd-Off=JED-CAI, Classes: P:140, I:7, O:6, U:1, X:1, K:4
[LPC] SM460 26JAN: Found 0 outbound flights with connecting passengers
[LF] Getting WEEKLY/LASTSOLD data for 4 flights
[LF] SM480 26JAN: LASTSOLD=2026-01-02 00:00:00, WEEKLY=5, TODAY=0, YDAY=0
[LF] SM476 26JAN: LASTSOLD=2026-01-05 00:00:00, WEEKLY=11, TODAY=0, YDAY=1
[LF] SM478 26JAN: LASTSOLD=2026-01-05 00:00:00, WEEKLY=9, TODAY=0, YDAY=1
[LF] SM460 26JAN: LASTSOLD=2026-01-05 00:00:00, WEEKLY=12, TODAY=0, YDAY=6
[LF] Processing JED-CAI for 25JAN
[LF] 25JAN: found 5 direct flights
[LF] SM424 25JAN: BKG=95, GRP=90, CAP=175, LF%=54.3%, Brd-Off=JED-CAI, Classes: P:90, I:5
[LF] SM476 25JAN: BKG=52, GRP=45, CAP=175, LF%=29.7%, Brd-Off=JED-CAI, Classes: P:45, I:1, U:6
[LF] SM432 25JAN: BKG=15, GRP=0, CAP=175, LF%=8.6%, Brd-Off=JED-CAI, Classes: I:15
[LF] SM460 25JAN: BKG=112, GRP=100, CAP=175, LF%=64.0%, Brd-Off=JED-CAI, Classes: P:100, I:3, O:5, U:4
[LF] SM478 25JAN: BKG=127, GRP=95, CAP=175, LF%=72.6%, Brd-Off=JED-CAI, Classes: N:5, P:95, I:12, O:9, U:2, K:1, Q:3
[LF] Getting WEEKLY/LASTSOLD data for 5 flights
[LF] SM424 25JAN: LASTSOLD=2026-01-05 00:00:00, WEEKLY=1, TODAY=0, YDAY=1
[LF] SM476 25JAN: LASTSOLD=2025-12-19 00:00:00, WEEKLY=0, TODAY=0, YDAY=0
[LF] SM432 25JAN: LASTSOLD=2026-01-05 00:00:00, WEEKLY=15, TODAY=0, YDAY=1
[LF] SM460 25JAN: LASTSOLD=2026-01-04 00:00:00, WEEKLY=3, TODAY=0, YDAY=0
[LF] SM478 25JAN: LASTSOLD=2026-01-05 00:00:00, WEEKLY=9, TODAY=0, YDAY=4
[LF] Processing JED-CAI for 24JAN
[LF] 24JAN: found 3 direct flights
[LF] SM450 24JAN: BKG=25, GRP=0, CAP=175, LF%=14.3%, Brd-Off=JED-CAI, Classes: I:21, U:2, X:1, T:1
[LF] SM476 24JAN: BKG=148, GRP=134, CAP=168, LF%=88.1%, Brd-Off=JED-CAI, Classes: P:134, I:1, O:12, U:1
[LF] SM478 24JAN: BKG=142, GRP=90, CAP=175, LF%=81.1%, Brd-Off=JED-CAI, Classes: N:2, P:90, I:17, O:15, U:15, S:1, L:2
[LF] Getting WEEKLY/LASTSOLD data for 3 flights
[LF] SM450 24JAN: LASTSOLD=2026-01-03 00:00:00, WEEKLY=17, TODAY=0, YDAY=0
[LF] SM476 24JAN: LASTSOLD=2026-01-05 00:00:00, WEEKLY=11, TODAY=0, YDAY=1
[LF] SM478 24JAN: LASTSOLD=2026-01-05 00:00:00, WEEKLY=20, TODAY=0, YDAY=5
[LF] Processing JED-CAI for 23JAN
[LF] 23JAN: found 6 direct flights
[LF] SM424 23JAN: BKG=10, GRP=0, CAP=168, LF%=5.9%, Brd-Off=JED-CAI, Classes: I:6, O:3, U:1
[LF] SM476 23JAN: BKG=3, GRP=0, CAP=175, LF%=1.7%, Brd-Off=JED-CAI, Classes: I:3
[LF] SM478 23JAN: BKG=16, GRP=0, CAP=175, LF%=9.1%, Brd-Off=JED-CAI, Classes: I:14, O:2
[LF] SM480 23JAN: BKG=55, GRP=45, CAP=175, LF%=31.4%, Brd-Off=JED-CAI, Classes: P:45, I:1, O:7, U:2
[LF] SM472 23JAN: BKG=99, GRP=75, CAP=175, LF%=56.6%, Brd-Off=JED-CAI, Classes: P:45, E:30, I:10, O:7, U:3, X:2, S:2
[LPC] SM472 23JAN: Found 1 outbound flights with connecting passengers
[LF] SM460 23JAN: BKG=62, GRP=46, CAP=175, LF%=35.4%, Brd-Off=JED-CAI, Classes: P:46, I:9, O:4, U:1, K:2
[LF] Getting WEEKLY/LASTSOLD data for 6 flights
[LF] SM424 23JAN: LASTSOLD=2026-01-04 00:00:00, WEEKLY=7, TODAY=0, YDAY=0
[LF] SM476 23JAN: LASTSOLD=2025-12-23 00:00:00, WEEKLY=0, TODAY=0, YDAY=0
[LF] SM478 23JAN: LASTSOLD=2026-01-05 00:00:00, WEEKLY=12, TODAY=0, YDAY=1
[LF] SM480 23JAN: LASTSOLD=2026-01-05 00:00:00, WEEKLY=3, TODAY=0, YDAY=1
[LF] SM472 23JAN: LASTSOLD=2026-01-05 00:00:00, WEEKLY=5, TODAY=0, YDAY=2
[LF] SM460 23JAN: LASTSOLD=2026-01-05 00:00:00, WEEKLY=9, TODAY=0, YDAY=3
[LF] Processing JED-CAI for 22JAN
[LF] 22JAN: found 7 direct flights
[LF] SM472 22JAN: BKG=6, GRP=1, CAP=175, LF%=3.4%, Brd-Off=JED-CAI, Classes: P:1, I:2, U:3
[LF] SM450 22JAN: BKG=7, GRP=0, CAP=168, LF%=4.2%, Brd-Off=JED-CAI, Classes: I:5, U:2
[LF] SM476 22JAN: BKG=12, GRP=10, CAP=175, LF%=6.9%, Brd-Off=JED-CAI, Classes: P:10, U:2
[LF] SM432 22JAN: BKG=11, GRP=0, CAP=175, LF%=6.3%, Brd-Off=JED-CAI, Classes: I:11
[LF] SM962 22JAN: BKG=16, GRP=0, CAP=164, LF%=9.8%, Brd-Off=JED-CAI, Classes: I:15, O:1
[LF] SM478 22JAN: BKG=130, GRP=115, CAP=175, LF%=74.3%, Brd-Off=JED-CAI, Classes: P:115, I:5, O:9, U:1
[LF] SM480 22JAN: BKG=158, GRP=122, CAP=175, LF%=90.3%, Brd-Off=JED-CAI, Classes: P:77, E:45, I:17, O:14, U:5
[LF] Getting WEEKLY/LASTSOLD data for 7 flights
[LF] SM472 22JAN: LASTSOLD=2025-12-30 00:00:00, WEEKLY=2, TODAY=0, YDAY=0
[LF] SM450 22JAN: LASTSOLD=2026-01-04 00:00:00, WEEKLY=5, TODAY=0, YDAY=0
[LF] SM476 22JAN: LASTSOLD=2025-11-30 00:00:00, WEEKLY=0, TODAY=0, YDAY=0
[LF] SM432 22JAN: LASTSOLD=2026-01-05 00:00:00, WEEKLY=7, TODAY=0, YDAY=3
[LF] SM962 22JAN: LASTSOLD=2026-01-05 00:00:00, WEEKLY=3, TODAY=0, YDAY=1
[LF] SM478 22JAN: LASTSOLD=2026-01-03 00:00:00, WEEKLY=10, TODAY=0, YDAY=0
[LF] SM480 22JAN: LASTSOLD=2026-01-05 00:00:00, WEEKLY=61, TODAY=0, YDAY=10
[LF] Processing JED-CAI for 21JAN
[LF] 21JAN: found 4 direct flights
[LF] SM476 21JAN: BKG=47, GRP=40, CAP=175, LF%=26.9%, Brd-Off=JED-CAI, Classes: P:40, I:3, U:4
[LF] SM478 21JAN: BKG=104, GRP=100, CAP=175, LF%=59.4%, Brd-Off=JED-CAI, Classes: P:100, O:3, X:1
[LF] SM460 21JAN: BKG=155, GRP=143, CAP=175, LF%=88.6%, Brd-Off=JED-CAI, Classes: P:98, E:45, I:1, O:9, U:2
[LF] SM424 21JAN: BKG=23, GRP=0, CAP=175, LF%=13.1%, Brd-Off=JED-CAI, Classes: I:18, O:4, U:1
[LF] Getting WEEKLY/LASTSOLD data for 4 flights
[LF] SM476 21JAN: LASTSOLD=2026-01-05 00:00:00, WEEKLY=2, TODAY=0, YDAY=2
[LF] SM478 21JAN: LASTSOLD=2026-01-05 00:00:00, WEEKLY=2, TODAY=0, YDAY=1
[LF] SM460 21JAN: LASTSOLD=2026-01-04 00:00:00, WEEKLY=6, TODAY=0, YDAY=0
[LF] SM424 21JAN: LASTSOLD=2026-01-04 00:00:00, WEEKLY=19, TODAY=0, YDAY=0
[LF] Processing JED-CAI for 20JAN
[LF] 20JAN: found 7 direct flights
[LF] SM472 20JAN: BKG=10, GRP=0, CAP=175, LF%=5.7%, Brd-Off=JED-CAI, Classes: I:8, U:2
[LF] SM954 20JAN: BKG=10, GRP=0, CAP=167, LF%=6.0%, Brd-Off=JED-CAI, Classes: I:10
[LF] SM480 20JAN: BKG=116, GRP=94, CAP=175, LF%=66.3%, Brd-Off=JED-CAI, Classes: P:94, I:12, O:1, U:8, X:1
[LF] SM478 20JAN: BKG=145, GRP=128, CAP=168, LF%=86.3%, Brd-Off=JED-CAI, Classes: P:128, I:8, O:1, U:7, L:1
[LF] SM460 20JAN: BKG=120, GRP=91, CAP=175, LF%=68.6%, Brd-Off=JED-CAI, Classes: N:3, P:91, I:15, O:1, U:10
[LF] SM424 20JAN: BKG=18, GRP=0, CAP=175, LF%=10.3%, Brd-Off=JED-CAI, Classes: I:14, U:3, K:1
[LF] SM476 20JAN: BKG=55, GRP=45, CAP=175, LF%=31.4%, Brd-Off=JED-CAI, Classes: P:45, I:7, U:3
[LF] Getting WEEKLY/LASTSOLD data for 7 flights
[LF] SM472 20JAN: LASTSOLD=2026-01-05 00:00:00, WEEKLY=5, TODAY=0, YDAY=1
[LF] SM954 20JAN: LASTSOLD=2026-01-05 00:00:00, WEEKLY=2, TODAY=0, YDAY=2
[LF] SM480 20JAN: LASTSOLD=2026-01-05 00:00:00, WEEKLY=12, TODAY=0, YDAY=4
[LF] SM478 20JAN: LASTSOLD=2026-01-03 00:00:00, WEEKLY=6, TODAY=0, YDAY=0
[LF] SM460 20JAN: LASTSOLD=2026-01-05 00:00:00, WEEKLY=11, TODAY=0, YDAY=1
[LF][RECONNECT] Connection lost. Attempting reconnect #1...
[LF][INFO] Make sure Chrome is open with remote debugging port
[LF][[OK] SUCCESS] Connected to Chrome on 127.0.0.1:9223 (after 1 attempts)
[LF][[OK] SUCCESS] Found Amadeus Altea window: Altéa Reservation Desktop
[LF][[INFO] INFO] URL: https://tc212.resdesktop.altea.amadeus.com/app_ard/apf/init/login?SITE=ESMPESMP&LANGUAGE=GB&MARKETS=ARDW_PROD_WBP&ACTION=clpLogin
[LF][SUCCESS] Chrome reconnected successfully!
[LF][RESUME] Restoring session context with: SN20JANJEDCAI/ASM
[LF][RESUME] Session context restored!
[LF] Processing JED-CAI for 20JAN
[LF] 20JAN: found 7 direct flights
[LF] SM472 20JAN: BKG=10, GRP=0, CAP=175, LF%=5.7%, Brd-Off=JED-CAI, Classes: I:8, U:2
[LF] SM954 20JAN: BKG=10, GRP=0, CAP=167, LF%=6.0%, Brd-Off=JED-CAI, Classes: I:10
[LF] SM480 20JAN: BKG=116, GRP=94, CAP=175, LF%=66.3%, Brd-Off=JED-CAI, Classes: P:94, I:12, O:1, U:8, X:1
[LF] SM478 20JAN: BKG=145, GRP=128, CAP=168, LF%=86.3%, Brd-Off=JED-CAI, Classes: P:128, I:8, O:1, U:7, L:1
[LF] SM460 20JAN: BKG=120, GRP=91, CAP=175, LF%=68.6%, Brd-Off=JED-CAI, Classes: N:3, P:91, I:15, O:1, U:10
[LF] SM424 20JAN: BKG=18, GRP=0, CAP=175, LF%=10.3%, Brd-Off=JED-CAI, Classes: I:14, U:3, K:1
[LF] SM476 20JAN: BKG=55, GRP=45, CAP=175, LF%=31.4%, Brd-Off=JED-CAI, Classes: P:45, I:7, U:3
[LF] Getting WEEKLY/LASTSOLD data for 7 flights
[LF] SM472 20JAN: LASTSOLD=2026-01-05 00:00:00, WEEKLY=5, TODAY=0, YDAY=1
[LF] SM954 20JAN: LASTSOLD=2026-01-05 00:00:00, WEEKLY=2, TODAY=0, YDAY=2
[LF] SM480 20JAN: LASTSOLD=2026-01-05 00:00:00, WEEKLY=12, TODAY=0, YDAY=4
[LF] SM478 20JAN: LASTSOLD=2026-01-03 00:00:00, WEEKLY=6, TODAY=0, YDAY=0
[LF] SM460 20JAN: LASTSOLD=2026-01-05 00:00:00, WEEKLY=11, TODAY=0, YDAY=1
[LF] SM424 20JAN: LASTSOLD=2026-01-06 00:00:00, WEEKLY=8, TODAY=1, YDAY=5
[LF] SM476 20JAN: LASTSOLD=2026-01-03 00:00:00, WEEKLY=7, TODAY=0, YDAY=0
[LF] Processing JED-CAI for 19JAN
[LF] 19JAN: found 4 direct flights
[LF] SM480 19JAN: BKG=4, GRP=0, CAP=175, LF%=2.3%, Brd-Off=JED-CAI, Classes: I:3, U:1
[LF] SM476 19JAN: BKG=138, GRP=123, CAP=175, LF%=78.9%, Brd-Off=JED-CAI, Classes: P:123, I:9, U:6
[LF] SM478 19JAN: BKG=74, GRP=51, CAP=175, LF%=42.3%, Brd-Off=JED-CAI, Classes: P:51, I:17, U:6
[LF] SM460 19JAN: BKG=118, GRP=105, CAP=175, LF%=67.4%, Brd-Off=JED-CAI, Classes: P:96, E:10, I:12
[LPC] SM460 19JAN: Found 0 outbound flights with connecting passengers
[LF] Getting WEEKLY/LASTSOLD data for 4 flights
[LF] SM480 19JAN: LASTSOLD=2026-01-04 00:00:00, WEEKLY=3, TODAY=0, YDAY=0
[LF] SM476 19JAN: LASTSOLD=2026-01-04 00:00:00, WEEKLY=2, TODAY=0, YDAY=0
[LF] SM478 19JAN: LASTSOLD=2026-01-05 00:00:00, WEEKLY=9, TODAY=0, YDAY=1
[LF] SM460 19JAN: LASTSOLD=2026-01-05 00:00:00, WEEKLY=15, TODAY=0, YDAY=1
[LF] Results summary:
  2026-01-31: 3 flights
  2026-01-30: 6 flights
  2026-01-29: 6 flights
  2026-01-28: 4 flights
  2026-01-27: 6 flights
  2026-01-26: 4 flights
  2026-01-25: 5 flights
  2026-01-24: 3 flights
  2026-01-23: 6 flights
  2026-01-22: 7 flights
  2026-01-21: 4 flights
  2026-01-20: 7 flights
  2026-01-19: 4 flights

============================================================
[Worker_9223] ✓ COMPLETED: JED-CAI
  Results: 13 dates
  Errors: 0 dates
  Total Processed: 1 groups
============================================================

[Worker_9223] Waiting for tasks...

============================================================
[Worker_9223] Shutdown signal received
Exiting...
============================================================

============================================================
[Worker_9223] FINISHED
  Total Groups Processed: 1
============================================================

