
============================================================
     LF WORKER - PORT 9227
============================================================
Worker: Worker_9227
Status: READY
Waiting for tasks...
============================================================


============================================================
[Worker_9227] Processing: JED-ASW
  Tier 0: Range 2, Chunk 1/3
  Dates: 7 days
  Date Range: 2026-01-31 to 2026-01-25
============================================================

2026-01-10 07:33:03 | INFO     | ======================================================================
2026-01-10 07:33:03 | INFO     | Load Factor Scraper Started - Route: JED-ASW
2026-01-10 07:33:03 | INFO     | Log file: D:\CODERED\LAB\Artifacts\run_100126_at_07.32\logs\LF_JED-ASW_20260110_073303.log
2026-01-10 07:33:03 | INFO     | Enhanced logging: Capturing both logging.info() and print()
2026-01-10 07:33:03 | INFO     | ======================================================================
[LF] Processing dates (override): ['31JAN', '30JAN', '29JAN', '28JAN', '27JAN', '26JAN', '25JAN']
[LF] Attaching to Chrome for Altea access
[LF][[OK] SUCCESS] Connected to Chrome on 127.0.0.1:9227 (after 1 attempts)
[LF][[OK] SUCCESS] Found Amadeus Altea window: Altéa Reservation Desktop
[LF][[INFO] INFO] URL: https://tc212.resdesktop.altea.amadeus.com/app_ard/apf/init/login?SITE=ESMPESMP&LANGUAGE=GB&MARKETS=ARDW_PROD_WBP&ACTION=clpLogin
[LF] Processing JED-ASW for 31JAN
[LF][ERROR] Amadeus command error detected: UNKNOWN TRANSACTION
[LF][ERROR] Command: SN31JANJEDASW/ASM
[LF][RESYNC] Triggering immediate resync to last successful SN command
============================================================
[LF][RESYNC] Command 'SN31JANJEDASW/ASM' failed: TECH_ERROR:UNKNOWN TRANSACTION
[LF][RESYNC] Re-running entire day from SN command for JED-ASW 31JAN
[LF][RESYNC] Attempt 1/50 (waiting 1.0s before retry...)
============================================================
[LF][RESYNC] Sending IG to clear session state...
[LF][RESYNC] Session cleared with IG
[LF] Processing JED-ASW for 31JAN
[LF] No direct flights on 31JAN for JED-ASW
[LF] Processing JED-ASW for 30JAN
[LF] No direct flights on 30JAN for JED-ASW
[LF] Processing JED-ASW for 29JAN
[LF] No direct flights on 29JAN for JED-ASW
[LF] Processing JED-ASW for 28JAN
[LF] No direct flights on 28JAN for JED-ASW
[LF] Processing JED-ASW for 27JAN
[LF] 27JAN: found 1 direct flights
[LF] SM986 27JAN: BKG=0, GRP=0, CAP=167, LF%=0.0%, Brd-Off=JED-ASW
[LF] Processing JED-ASW for 26JAN
[LF] 26JAN: found 2 direct flights
[LF] SM426 26JAN: BKG=0, GRP=0, CAP=167, LF%=0.0%, Brd-Off=JED-ASW
[LF] SM950 26JAN: BKG=0, GRP=0, CAP=167, LF%=0.0%, Brd-Off=JED-ASW
[LF] Processing JED-ASW for 25JAN
[LF] No direct flights on 25JAN for JED-ASW
[LF] Results summary:
  2026-01-31: 0 flights
  2026-01-30: 0 flights
  2026-01-29: 0 flights
  2026-01-28: 0 flights
  2026-01-27: 1 flights
  2026-01-26: 2 flights
  2026-01-25: 0 flights

============================================================
[Worker_9227] ✓ COMPLETED: JED-ASW
  Results: 7 dates
  Errors: 0 dates
  Total Processed: 1 groups
============================================================


============================================================
[Worker_9227] Processing: RUH-ATZ
  Tier 0: Range 2, Chunk 1/3
  Dates: 7 days
  Date Range: 2026-01-31 to 2026-01-25
============================================================

2026-01-10 07:33:26 | INFO     | ======================================================================
2026-01-10 07:33:26 | INFO     | Load Factor Scraper Started - Route: RUH-ATZ
2026-01-10 07:33:26 | INFO     | Log file: D:\CODERED\LAB\Artifacts\run_100126_at_07.32\logs\LF_RUH-ATZ_20260110_073326.log
2026-01-10 07:33:26 | INFO     | Enhanced logging: Capturing both logging.info() and print()
2026-01-10 07:33:26 | INFO     | ======================================================================
[LF] Processing dates (override): ['31JAN', '30JAN', '29JAN', '28JAN', '27JAN', '26JAN', '25JAN']
[LF] Attaching to Chrome for Altea access
2026-01-10 07:33:26 | INFO     | Starting LF search for route: RUH-ATZ
2026-01-10 07:33:26 | INFO     | [START] LF Search
[LF][[OK] SUCCESS] Connected to Chrome on 127.0.0.1:9227 (after 1 attempts)
2026-01-10 07:33:27 | INFO     | [HEALTH CHECK] [OK] Chrome connection is healthy
[LF][[OK] SUCCESS] Found Amadeus Altea window: Altéa Reservation Desktop
[LF][[INFO] INFO] URL: https://tc212.resdesktop.altea.amadeus.com/app_ard/apf/init/login?SITE=ESMPESMP&LANGUAGE=GB&MARKETS=ARDW_PROD_WBP&ACTION=clpLogin
2026-01-10 07:33:27 | INFO     | [DAY_START] Processing 31JAN
[LF] Processing RUH-ATZ for 31JAN
2026-01-10 07:33:27 | INFO     | [lf.day.start] Processing RUH-ATZ for 31JAN
[LF] No direct flights on 31JAN for RUH-ATZ
2026-01-10 07:33:28 | WARNING  | [lf.day.no_flights] No direct flights on 31JAN
2026-01-10 07:33:28 | INFO     | [SUCCESS] Day 31JAN
2026-01-10 07:33:28 | INFO     | [DAY_START] Processing 30JAN
[LF] Processing RUH-ATZ for 30JAN
2026-01-10 07:33:28 | INFO     | [lf.day.start] Processing RUH-ATZ for 30JAN
[LF] No direct flights on 30JAN for RUH-ATZ
2026-01-10 07:33:29 | WARNING  | [lf.day.no_flights] No direct flights on 30JAN
2026-01-10 07:33:29 | INFO     | [SUCCESS] Day 30JAN
2026-01-10 07:33:29 | INFO     | [DAY_START] Processing 29JAN
[LF] Processing RUH-ATZ for 29JAN
2026-01-10 07:33:29 | INFO     | [lf.day.start] Processing RUH-ATZ for 29JAN
[LF] No direct flights on 29JAN for RUH-ATZ
2026-01-10 07:33:30 | WARNING  | [lf.day.no_flights] No direct flights on 29JAN
2026-01-10 07:33:30 | INFO     | [SUCCESS] Day 29JAN
2026-01-10 07:33:30 | INFO     | [DAY_START] Processing 28JAN
[LF] Processing RUH-ATZ for 28JAN
2026-01-10 07:33:30 | INFO     | [lf.day.start] Processing RUH-ATZ for 28JAN
[LF] 28JAN: found 1 direct flights
2026-01-10 07:33:31 | INFO     | [lf.day.flights_found] Found 1 flights on 28JAN
2026-01-10 07:33:33 | INFO     | [lf.flight.extracted] SM466 on 28JAN: BKG=59, LF=33.7%
[LF] SM466 28JAN: BKG=59, GRP=0, CAP=175, LF%=33.7%, Brd-Off=RUH-ATZ, Classes: O:6, U:24, X:10, T:10, W:9
[LF] Getting WEEKLY/LASTSOLD data for 1 flights
[LF] SM466 28JAN: LASTSOLD=2026-01-08 00:00:00, WEEKLY=6, TODAY=0, YDAY=0
2026-01-10 07:33:37 | INFO     | [SUCCESS] Day 28JAN
2026-01-10 07:33:37 | INFO     | [DAY_START] Processing 27JAN
[LF] Processing RUH-ATZ for 27JAN
2026-01-10 07:33:37 | INFO     | [lf.day.start] Processing RUH-ATZ for 27JAN
[LF] 27JAN: found 1 direct flights
2026-01-10 07:33:38 | INFO     | [lf.day.flights_found] Found 1 flights on 27JAN
2026-01-10 07:33:40 | INFO     | [lf.flight.extracted] SM464 on 27JAN: BKG=79, LF=45.1%
[LF] SM464 27JAN: BKG=79, GRP=0, CAP=175, LF%=45.1%, Brd-Off=RUH-ATZ, Classes: O:20, U:35, X:10, T:9, W:4, K:1
[LF] Getting WEEKLY/LASTSOLD data for 1 flights
[LF] SM464 27JAN: LASTSOLD=2026-01-09 00:00:00, WEEKLY=11, TODAY=0, YDAY=4
2026-01-10 07:33:45 | INFO     | [SUCCESS] Day 27JAN
2026-01-10 07:33:45 | INFO     | [DAY_START] Processing 26JAN
[LF] Processing RUH-ATZ for 26JAN
2026-01-10 07:33:45 | INFO     | [lf.day.start] Processing RUH-ATZ for 26JAN
[LF] No direct flights on 26JAN for RUH-ATZ
2026-01-10 07:33:46 | WARNING  | [lf.day.no_flights] No direct flights on 26JAN
2026-01-10 07:33:46 | INFO     | [SUCCESS] Day 26JAN
2026-01-10 07:33:46 | INFO     | [DAY_START] Processing 25JAN
[LF] Processing RUH-ATZ for 25JAN
2026-01-10 07:33:46 | INFO     | [lf.day.start] Processing RUH-ATZ for 25JAN
[LF] 25JAN: found 1 direct flights
2026-01-10 07:33:47 | INFO     | [lf.day.flights_found] Found 1 flights on 25JAN
2026-01-10 07:33:49 | INFO     | [lf.flight.extracted] SM464 on 25JAN: BKG=74, LF=42.3%
[LF] SM464 25JAN: BKG=74, GRP=0, CAP=175, LF%=42.3%, Brd-Off=RUH-ATZ, Classes: O:20, U:35, X:10, T:5, S:1, L:1, K:2
[LF] Getting WEEKLY/LASTSOLD data for 1 flights
[LF] SM464 25JAN: LASTSOLD=2026-01-06 00:00:00, WEEKLY=5, TODAY=0, YDAY=0
2026-01-10 07:33:53 | INFO     | [SUCCESS] Day 25JAN
[LF] Results summary:
  2026-01-31: 0 flights
  2026-01-30: 0 flights
  2026-01-29: 0 flights
  2026-01-28: 1 flights
  2026-01-27: 1 flights
  2026-01-26: 0 flights
  2026-01-25: 1 flights
2026-01-10 07:33:53 | INFO     | [SUCCESS] LF Search Complete

============================================================
[Worker_9227] ✓ COMPLETED: RUH-ATZ
  Results: 7 dates
  Errors: 0 dates
  Total Processed: 2 groups
============================================================

2026-01-10 07:33:55 | INFO     | [Worker_9227] Completed: RUH-ATZ - 7 results, 0 errors

============================================================
[Worker_9227] Processing: AJF-CAI
  Tier 0: Range 2, Chunk 1/3
  Dates: 7 days
  Date Range: 2026-01-31 to 2026-01-25
============================================================

2026-01-10 07:33:55 | INFO     | [Worker_9227] Processing: AJF-CAI
2026-01-10 07:33:55 | INFO     |   Tier 0: Range 2, Chunk 1/3 (7 days)
2026-01-10 07:33:55 | INFO     | ======================================================================
2026-01-10 07:33:55 | INFO     | Load Factor Scraper Started - Route: AJF-CAI
2026-01-10 07:33:55 | INFO     | Log file: D:\CODERED\LAB\Artifacts\run_100126_at_07.32\logs\LF_AJF-CAI_20260110_073355.log
2026-01-10 07:33:55 | INFO     | Enhanced logging: Capturing both logging.info() and print()
2026-01-10 07:33:55 | INFO     | ======================================================================
[LF] Processing dates (override): ['31JAN', '30JAN', '29JAN', '28JAN', '27JAN', '26JAN', '25JAN']
[LF] Attaching to Chrome for Altea access
2026-01-10 07:33:55 | INFO     | Starting LF search for route: AJF-CAI
2026-01-10 07:33:55 | INFO     | [START] LF Search
[LF][[OK] SUCCESS] Connected to Chrome on 127.0.0.1:9227 (after 1 attempts)
2026-01-10 07:33:56 | INFO     | [HEALTH CHECK] [OK] Chrome connection is healthy
[LF][[OK] SUCCESS] Found Amadeus Altea window: Altéa Reservation Desktop
[LF][[INFO] INFO] URL: https://tc212.resdesktop.altea.amadeus.com/app_ard/apf/init/login?SITE=ESMPESMP&LANGUAGE=GB&MARKETS=ARDW_PROD_WBP&ACTION=clpLogin
2026-01-10 07:33:56 | INFO     | [DAY_START] Processing 31JAN
[LF] Processing AJF-CAI for 31JAN
2026-01-10 07:33:56 | INFO     | [lf.day.start] Processing AJF-CAI for 31JAN
[LF] 31JAN: found 1 direct flights
2026-01-10 07:33:57 | INFO     | [lf.day.flights_found] Found 1 flights on 31JAN
2026-01-10 07:33:59 | INFO     | [lf.flight.extracted] SM322 on 31JAN: BKG=34, LF=19.4%
[LF] SM322 31JAN: BKG=34, GRP=0, CAP=175, LF%=19.4%, Brd-Off=AJF-CAI, Classes: O:31, U:2, X:1
[LF] Getting WEEKLY/LASTSOLD data for 1 flights
[LF] SM322 31JAN: LASTSOLD=2026-01-09 00:00:00, WEEKLY=17, TODAY=0, YDAY=2
2026-01-10 07:34:02 | INFO     | [SUCCESS] Day 31JAN
2026-01-10 07:34:02 | INFO     | [DAY_START] Processing 30JAN
[LF] Processing AJF-CAI for 30JAN
2026-01-10 07:34:02 | INFO     | [lf.day.start] Processing AJF-CAI for 30JAN
[LF] No direct flights on 30JAN for AJF-CAI
2026-01-10 07:34:03 | WARNING  | [lf.day.no_flights] No direct flights on 30JAN
2026-01-10 07:34:03 | INFO     | [SUCCESS] Day 30JAN
2026-01-10 07:34:03 | INFO     | [DAY_START] Processing 29JAN
[LF] Processing AJF-CAI for 29JAN
2026-01-10 07:34:03 | INFO     | [lf.day.start] Processing AJF-CAI for 29JAN
[LF] 29JAN: found 1 direct flights
2026-01-10 07:34:04 | INFO     | [lf.day.flights_found] Found 1 flights on 29JAN
2026-01-10 07:34:06 | INFO     | [lf.flight.extracted] SM322 on 29JAN: BKG=13, LF=7.4%
[LF] SM322 29JAN: BKG=13, GRP=0, CAP=175, LF%=7.4%, Brd-Off=AJF-CAI, Classes: O:12, U:1
[LF] Getting WEEKLY/LASTSOLD data for 1 flights
[LF] SM322 29JAN: LASTSOLD=2026-01-07 00:00:00, WEEKLY=4, TODAY=0, YDAY=0
2026-01-10 07:34:09 | INFO     | [SUCCESS] Day 29JAN
2026-01-10 07:34:09 | INFO     | [DAY_START] Processing 28JAN
[LF] Processing AJF-CAI for 28JAN
2026-01-10 07:34:09 | INFO     | [lf.day.start] Processing AJF-CAI for 28JAN
[LF] No direct flights on 28JAN for AJF-CAI
2026-01-10 07:34:10 | WARNING  | [lf.day.no_flights] No direct flights on 28JAN
2026-01-10 07:34:10 | INFO     | [SUCCESS] Day 28JAN
2026-01-10 07:34:10 | INFO     | [DAY_START] Processing 27JAN
[LF] Processing AJF-CAI for 27JAN
2026-01-10 07:34:10 | INFO     | [lf.day.start] Processing AJF-CAI for 27JAN
[LF] 27JAN: found 1 direct flights
2026-01-10 07:34:11 | INFO     | [lf.day.flights_found] Found 1 flights on 27JAN
2026-01-10 07:34:13 | INFO     | [lf.flight.extracted] SM322 on 27JAN: BKG=21, LF=12.0%
[LF] SM322 27JAN: BKG=21, GRP=0, CAP=175, LF%=12.0%, Brd-Off=AJF-CAI, Classes: O:20, G:1
[LF] Getting WEEKLY/LASTSOLD data for 1 flights
[LF] SM322 27JAN: LASTSOLD=2026-01-07 00:00:00, WEEKLY=8, TODAY=0, YDAY=0
2026-01-10 07:34:16 | INFO     | [SUCCESS] Day 27JAN
2026-01-10 07:34:16 | INFO     | [DAY_START] Processing 26JAN
[LF] Processing AJF-CAI for 26JAN
2026-01-10 07:34:16 | INFO     | [lf.day.start] Processing AJF-CAI for 26JAN
[LF] No direct flights on 26JAN for AJF-CAI
2026-01-10 07:34:17 | WARNING  | [lf.day.no_flights] No direct flights on 26JAN
2026-01-10 07:34:17 | INFO     | [SUCCESS] Day 26JAN
2026-01-10 07:34:17 | INFO     | [DAY_START] Processing 25JAN
[LF] Processing AJF-CAI for 25JAN
2026-01-10 07:34:17 | INFO     | [lf.day.start] Processing AJF-CAI for 25JAN
[LF] No direct flights on 25JAN for AJF-CAI
2026-01-10 07:34:18 | WARNING  | [lf.day.no_flights] No direct flights on 25JAN
2026-01-10 07:34:18 | INFO     | [SUCCESS] Day 25JAN
[LF] Results summary:
  2026-01-31: 1 flights
  2026-01-30: 0 flights
  2026-01-29: 1 flights
  2026-01-28: 0 flights
  2026-01-27: 1 flights
  2026-01-26: 0 flights
  2026-01-25: 0 flights
2026-01-10 07:34:18 | INFO     | [SUCCESS] LF Search Complete

============================================================
[Worker_9227] ✓ COMPLETED: AJF-CAI
  Results: 7 dates
  Errors: 0 dates
  Total Processed: 3 groups
============================================================

2026-01-10 07:34:20 | INFO     | [Worker_9227] Completed: AJF-CAI - 7 results, 0 errors

============================================================
[Worker_9227] Processing: ELQ-ATZ
  Tier 0: Range 2, Chunk 1/3
  Dates: 7 days
  Date Range: 2026-01-31 to 2026-01-25
============================================================

2026-01-10 07:34:20 | INFO     | [Worker_9227] Processing: ELQ-ATZ
2026-01-10 07:34:20 | INFO     |   Tier 0: Range 2, Chunk 1/3 (7 days)
2026-01-10 07:34:20 | INFO     | ======================================================================
2026-01-10 07:34:20 | INFO     | Load Factor Scraper Started - Route: ELQ-ATZ
2026-01-10 07:34:20 | INFO     | Log file: D:\CODERED\LAB\Artifacts\run_100126_at_07.32\logs\LF_ELQ-ATZ_20260110_073420.log
2026-01-10 07:34:20 | INFO     | Enhanced logging: Capturing both logging.info() and print()
2026-01-10 07:34:20 | INFO     | ======================================================================
[LF] Processing dates (override): ['31JAN', '30JAN', '29JAN', '28JAN', '27JAN', '26JAN', '25JAN']
[LF] Attaching to Chrome for Altea access
2026-01-10 07:34:20 | INFO     | Starting LF search for route: ELQ-ATZ
2026-01-10 07:34:20 | INFO     | [START] LF Search
[LF][[OK] SUCCESS] Connected to Chrome on 127.0.0.1:9227 (after 1 attempts)
2026-01-10 07:34:21 | INFO     | [HEALTH CHECK] [OK] Chrome connection is healthy
[LF][[OK] SUCCESS] Found Amadeus Altea window: Altéa Reservation Desktop
[LF][[INFO] INFO] URL: https://tc212.resdesktop.altea.amadeus.com/app_ard/apf/init/login?SITE=ESMPESMP&LANGUAGE=GB&MARKETS=ARDW_PROD_WBP&ACTION=clpLogin
2026-01-10 07:34:21 | INFO     | [DAY_START] Processing 31JAN
[LF] Processing ELQ-ATZ for 31JAN
2026-01-10 07:34:21 | INFO     | [lf.day.start] Processing ELQ-ATZ for 31JAN
[LF] 31JAN: found 1 direct flights
2026-01-10 07:34:22 | INFO     | [lf.day.flights_found] Found 1 flights on 31JAN
2026-01-10 07:34:24 | INFO     | [lf.flight.extracted] SM436 on 31JAN: BKG=63, LF=36.0%
[LF] SM436 31JAN: BKG=63, GRP=0, CAP=175, LF%=36.0%, Brd-Off=ELQ-ATZ, Classes: O:17, U:11, X:3, T:13, W:13, S:6
[LF] Getting WEEKLY/LASTSOLD data for 1 flights
[LF] SM436 31JAN: LASTSOLD=2026-01-09 00:00:00, WEEKLY=19, TODAY=0, YDAY=5
2026-01-10 07:34:28 | INFO     | [SUCCESS] Day 31JAN
2026-01-10 07:34:28 | INFO     | [DAY_START] Processing 30JAN
[LF] Processing ELQ-ATZ for 30JAN
2026-01-10 07:34:28 | INFO     | [lf.day.start] Processing ELQ-ATZ for 30JAN
[LF] No direct flights on 30JAN for ELQ-ATZ
2026-01-10 07:34:29 | WARNING  | [lf.day.no_flights] No direct flights on 30JAN
2026-01-10 07:34:29 | INFO     | [SUCCESS] Day 30JAN
2026-01-10 07:34:29 | INFO     | [DAY_START] Processing 29JAN
[LF] Processing ELQ-ATZ for 29JAN
2026-01-10 07:34:29 | INFO     | [lf.day.start] Processing ELQ-ATZ for 29JAN
[LF] No direct flights on 29JAN for ELQ-ATZ
2026-01-10 07:34:29 | WARNING  | [lf.day.no_flights] No direct flights on 29JAN
2026-01-10 07:34:30 | INFO     | [SUCCESS] Day 29JAN
2026-01-10 07:34:30 | INFO     | [DAY_START] Processing 28JAN
[LF] Processing ELQ-ATZ for 28JAN
2026-01-10 07:34:30 | INFO     | [lf.day.start] Processing ELQ-ATZ for 28JAN
[LF] 28JAN: found 1 direct flights
2026-01-10 07:34:31 | INFO     | [lf.day.flights_found] Found 1 flights on 28JAN
2026-01-10 07:34:32 | INFO     | [lf.flight.extracted] SM436 on 28JAN: BKG=90, LF=51.4%
[LF] SM436 28JAN: BKG=90, GRP=0, CAP=175, LF%=51.4%, Brd-Off=ELQ-ATZ, Classes: O:30, U:23, X:26, T:7, W:2, G:1, K:1
[LF] Getting WEEKLY/LASTSOLD data for 1 flights
[LF] SM436 28JAN: LASTSOLD=2026-01-09 00:00:00, WEEKLY=24, TODAY=0, YDAY=3
2026-01-10 07:34:38 | INFO     | [SUCCESS] Day 28JAN
2026-01-10 07:34:38 | INFO     | [DAY_START] Processing 27JAN
[LF] Processing ELQ-ATZ for 27JAN
2026-01-10 07:34:38 | INFO     | [lf.day.start] Processing ELQ-ATZ for 27JAN
[LF] No direct flights on 27JAN for ELQ-ATZ
2026-01-10 07:34:39 | WARNING  | [lf.day.no_flights] No direct flights on 27JAN
2026-01-10 07:34:39 | INFO     | [SUCCESS] Day 27JAN
2026-01-10 07:34:39 | INFO     | [DAY_START] Processing 26JAN
[LF] Processing ELQ-ATZ for 26JAN
2026-01-10 07:34:39 | INFO     | [lf.day.start] Processing ELQ-ATZ for 26JAN
[LF] No direct flights on 26JAN for ELQ-ATZ
2026-01-10 07:34:40 | WARNING  | [lf.day.no_flights] No direct flights on 26JAN
2026-01-10 07:34:40 | INFO     | [SUCCESS] Day 26JAN
2026-01-10 07:34:40 | INFO     | [DAY_START] Processing 25JAN
[LF] Processing ELQ-ATZ for 25JAN
2026-01-10 07:34:40 | INFO     | [lf.day.start] Processing ELQ-ATZ for 25JAN
[LF] No direct flights on 25JAN for ELQ-ATZ
2026-01-10 07:34:41 | WARNING  | [lf.day.no_flights] No direct flights on 25JAN
2026-01-10 07:34:41 | INFO     | [SUCCESS] Day 25JAN
[LF] Results summary:
  2026-01-31: 1 flights
  2026-01-30: 0 flights
  2026-01-29: 0 flights
  2026-01-28: 1 flights
  2026-01-27: 0 flights
  2026-01-26: 0 flights
  2026-01-25: 0 flights
2026-01-10 07:34:41 | INFO     | [SUCCESS] LF Search Complete

============================================================
[Worker_9227] ✓ COMPLETED: ELQ-ATZ
  Results: 7 dates
  Errors: 0 dates
  Total Processed: 4 groups
============================================================

2026-01-10 07:34:43 | INFO     | [Worker_9227] Completed: ELQ-ATZ - 7 results, 0 errors

============================================================
[Worker_9227] Processing: HBE-JED
  Tier 0: Range 2, Chunk 1/3
  Dates: 7 days
  Date Range: 2026-01-31 to 2026-01-25
============================================================

2026-01-10 07:34:43 | INFO     | [Worker_9227] Processing: HBE-JED
2026-01-10 07:34:43 | INFO     |   Tier 0: Range 2, Chunk 1/3 (7 days)
2026-01-10 07:34:43 | INFO     | ======================================================================
2026-01-10 07:34:43 | INFO     | Load Factor Scraper Started - Route: HBE-JED
2026-01-10 07:34:43 | INFO     | Log file: D:\CODERED\LAB\Artifacts\run_100126_at_07.32\logs\LF_HBE-JED_20260110_073443.log
2026-01-10 07:34:43 | INFO     | Enhanced logging: Capturing both logging.info() and print()
2026-01-10 07:34:43 | INFO     | ======================================================================
[LF] Processing dates (override): ['31JAN', '30JAN', '29JAN', '28JAN', '27JAN', '26JAN', '25JAN']
[LF] Attaching to Chrome for Altea access
2026-01-10 07:34:43 | INFO     | Starting LF search for route: HBE-JED
2026-01-10 07:34:43 | INFO     | [START] LF Search
[LF][[OK] SUCCESS] Connected to Chrome on 127.0.0.1:9227 (after 1 attempts)
2026-01-10 07:34:44 | INFO     | [HEALTH CHECK] [OK] Chrome connection is healthy
[LF][[OK] SUCCESS] Found Amadeus Altea window: Altéa Reservation Desktop
[LF][[INFO] INFO] URL: https://tc212.resdesktop.altea.amadeus.com/app_ard/apf/init/login?SITE=ESMPESMP&LANGUAGE=GB&MARKETS=ARDW_PROD_WBP&ACTION=clpLogin
2026-01-10 07:34:44 | INFO     | [DAY_START] Processing 31JAN
[LF] Processing HBE-JED for 31JAN
2026-01-10 07:34:44 | INFO     | [lf.day.start] Processing HBE-JED for 31JAN
[LF] 31JAN: found 2 direct flights
2026-01-10 07:34:45 | INFO     | [lf.day.flights_found] Found 2 flights on 31JAN
2026-01-10 07:34:47 | INFO     | [lf.flight.extracted] SM457 on 31JAN: BKG=116, LF=64.8%
[LF] SM457 31JAN: BKG=116, GRP=90, CAP=179, LF%=64.8%, Brd-Off=HBE-JED, Classes: P:90, X:10, T:9, W:7
2026-01-10 07:34:49 | INFO     | [lf.flight.extracted] SM451 on 31JAN: BKG=72, LF=40.2%
[LF] SM451 31JAN: BKG=72, GRP=45, CAP=179, LF%=40.2%, Brd-Off=HBE-JED, Classes: P:45, X:5, T:4, W:10, S:2, K:4, Q:2
[LF] Getting WEEKLY/LASTSOLD data for 2 flights
[LF] SM457 31JAN: LASTSOLD=2026-01-09 00:00:00, WEEKLY=11, TODAY=0, YDAY=3
[LF] SM451 31JAN: LASTSOLD=2026-01-04 00:00:00, WEEKLY=2, TODAY=0, YDAY=0
2026-01-10 07:34:56 | INFO     | [SUCCESS] Day 31JAN
2026-01-10 07:34:56 | INFO     | [DAY_START] Processing 30JAN
[LF] Processing HBE-JED for 30JAN
2026-01-10 07:34:56 | INFO     | [lf.day.start] Processing HBE-JED for 30JAN
