
============================================================
     LF WORKER - PORT 9224
============================================================
Worker: Worker_9224
Status: READY
Waiting for tasks...
============================================================


============================================================
[Worker_9224] Processing: JED-HBE
  Tier 0: Range 2, Chunk 1/2
  Dates: 7 days
  Date Range: 2026-01-20 to 2026-01-14
============================================================

2025-12-26 02:28:27 | INFO     | ======================================================================
2025-12-26 02:28:27 | INFO     | Load Factor Scraper Started - Route: JED-HBE
2025-12-26 02:28:27 | INFO     | Log file: D:\CODERED\OUTPUTS\logs\LF_JED-HBE_20251226_022827.log
2025-12-26 02:28:27 | INFO     | Enhanced logging: Capturing both logging.info() and print()
2025-12-26 02:28:27 | INFO     | ======================================================================
[LF] Processing dates (override): ['20JAN', '19JAN', '18JAN', '17JAN', '16JAN', '15JAN', '14JAN']
[LF] Attaching to Chrome for Altea access
[LF][[OK] SUCCESS] Connected to Chrome on 127.0.0.1:9224 (after 1 attempts)
[LF][[OK] SUCCESS] Found Amadeus Altea window: Altéa Reservation Desktop
[LF][[INFO] INFO] URL: https://tc212.resdesktop.altea.amadeus.com/app_ard/apf/init/login?SITE=ESMPESMP&LANGUAGE=GB&MARKETS=ARDW_PROD_WBP&ACTION=clpLogin
[LF] Processing JED-HBE for 20JAN
[LF][ERROR] Amadeus command error detected: UNKNOWN TRANSACTION
[LF][ERROR] Command: SN20JANJEDHBE/ASM
[LF][RESYNC] Triggering immediate resync to last successful SN command
============================================================
[LF][RESYNC] Command 'SN20JANJEDHBE/ASM' failed: TECH_ERROR:UNKNOWN TRANSACTION
[LF][RESYNC] Re-running entire day from SN command for JED-HBE 20JAN
[LF][RESYNC] Attempt 1/50 (waiting 1.0s before retry...)
============================================================
[LF][RESYNC] Sending IG to clear session state...
[LF][RESYNC] Session cleared with IG
[LF] Processing JED-HBE for 20JAN
[LF] 20JAN: found 1 direct flights
[LF] SM452 20JAN: BKG=159, GRP=134, CAP=167, LF%=95.2%, Brd-Off=JED-HBE, Classes: P:134, I:13, X:8, S:4
[LF] Getting WEEKLY/LASTSOLD data for 1 flights
[LF] SM452 20JAN: LASTSOLD=2025-12-25 00:00:00, WEEKLY=13, TODAY=0, YDAY=1
[LF] Processing JED-HBE for 19JAN
[LF] 19JAN: found 2 direct flights
[LF] SM458 19JAN: BKG=137, GRP=135, CAP=167, LF%=82.0%, Brd-Off=JED-HBE, Classes: P:135, X:2
[LF] SM452 19JAN: BKG=141, GRP=135, CAP=167, LF%=84.4%, Brd-Off=JED-HBE, Classes: P:135, I:6
[LF] Getting WEEKLY/LASTSOLD data for 2 flights
[LF] SM458 19JAN: LASTSOLD=2025-12-09 00:00:00, WEEKLY=0, TODAY=0, YDAY=0
[LF] SM452 19JAN: LASTSOLD=2025-12-25 00:00:00, WEEKLY=6, TODAY=0, YDAY=3
[LF] Processing JED-HBE for 18JAN
[LF] 18JAN: found 2 direct flights
[LF] SM458 18JAN: BKG=112, GRP=94, CAP=167, LF%=67.1%, Brd-Off=JED-HBE, Classes: P:94, I:16, O:1, K:1
[LF] SM452 18JAN: BKG=120, GRP=95, CAP=167, LF%=71.9%, Brd-Off=JED-HBE, Classes: P:95, I:17, O:7, U:1
[LF] Getting WEEKLY/LASTSOLD data for 2 flights
[LF] SM458 18JAN: LASTSOLD=2025-12-24 00:00:00, WEEKLY=18, TODAY=0, YDAY=0
[LF] SM452 18JAN: LASTSOLD=2025-12-25 00:00:00, WEEKLY=13, TODAY=0, YDAY=5
[LF] Processing JED-HBE for 17JAN
[LF] 17JAN: found 2 direct flights
[LF] SM458 17JAN: BKG=46, GRP=45, CAP=167, LF%=27.5%, Brd-Off=JED-HBE, Classes: P:45, L:1
[LF] SM452 17JAN: BKG=112, GRP=106, CAP=167, LF%=67.1%, Brd-Off=JED-HBE, Classes: P:106, X:6
[LF] Getting WEEKLY/LASTSOLD data for 2 flights
[LF] SM458 17JAN: LASTSOLD=2025-12-19 00:00:00, WEEKLY=1, TODAY=0, YDAY=0
[LF] SM452 17JAN: LASTSOLD=2025-12-25 00:00:00, WEEKLY=2, TODAY=0, YDAY=1
[LF] Processing JED-HBE for 16JAN
[LF] 16JAN: found 1 direct flights
[LF] SM452 16JAN: BKG=66, GRP=45, CAP=167, LF%=39.5%, Brd-Off=JED-HBE, Classes: P:45, X:17, T:1, V:3
[LF] Getting WEEKLY/LASTSOLD data for 1 flights
[LF] SM452 16JAN: LASTSOLD=2025-12-22 00:00:00, WEEKLY=2, TODAY=0, YDAY=0
[LF] Processing JED-HBE for 15JAN
[LF] 15JAN: found 1 direct flights
[LF] SM452 15JAN: BKG=58, GRP=45, CAP=167, LF%=34.7%, Brd-Off=JED-HBE, Classes: P:45, X:10, S:1, L:2
[LF] Getting WEEKLY/LASTSOLD data for 1 flights
[LF] SM452 15JAN: LASTSOLD=2025-12-23 00:00:00, WEEKLY=2, TODAY=0, YDAY=0
[LF] Processing JED-HBE for 14JAN
[LF] 14JAN: found 3 direct flights
[LF] SM452 14JAN: BKG=142, GRP=140, CAP=167, LF%=85.0%, Brd-Off=JED-HBE, Classes: P:140, X:1, L:1
[LF] SM474 14JAN: BKG=132, GRP=130, CAP=167, LF%=79.0%, Brd-Off=JED-HBE, Classes: P:130, X:1, L:1
[LF] SM458 14JAN: BKG=122, GRP=118, CAP=167, LF%=73.0%, Brd-Off=JED-HBE, Classes: P:118, X:4
[LF] Getting WEEKLY/LASTSOLD data for 3 flights
[LF] SM452 14JAN: LASTSOLD=2025-12-19 00:00:00, WEEKLY=1, TODAY=0, YDAY=0
[LF] SM474 14JAN: LASTSOLD=2025-12-25 00:00:00, WEEKLY=2, TODAY=0, YDAY=1
[LF] SM458 14JAN: LASTSOLD=2025-12-15 00:00:00, WEEKLY=0, TODAY=0, YDAY=0
[LF] Results summary:
  2026-01-20: 1 flights
  2026-01-19: 2 flights
  2026-01-18: 2 flights
  2026-01-17: 2 flights
  2026-01-16: 1 flights
  2026-01-15: 1 flights
  2026-01-14: 3 flights

============================================================
[Worker_9224] ✓ COMPLETED: JED-HBE
  Results: 7 dates
  Errors: 0 dates
  Total Processed: 1 groups
============================================================


============================================================
[Worker_9224] Processing: JED-ATZ
  Tier 0: Range 1, Chunk 1/2
  Dates: 6 days
  Date Range: 2026-01-07 to 2026-01-02
============================================================

2025-12-26 02:30:29 | INFO     | ======================================================================
2025-12-26 02:30:29 | INFO     | Load Factor Scraper Started - Route: JED-ATZ
2025-12-26 02:30:29 | INFO     | Log file: D:\CODERED\OUTPUTS\logs\LF_JED-ATZ_20251226_023029.log
2025-12-26 02:30:29 | INFO     | Enhanced logging: Capturing both logging.info() and print()
2025-12-26 02:30:29 | INFO     | ======================================================================
[LF] Processing dates (override): ['07JAN', '06JAN', '05JAN', '04JAN', '03JAN', '02JAN']
[LF] Attaching to Chrome for Altea access
2025-12-26 02:30:29 | INFO     | Starting LF search for route: JED-ATZ
2025-12-26 02:30:29 | INFO     | [START] LF Search
[LF][[OK] SUCCESS] Connected to Chrome on 127.0.0.1:9224 (after 1 attempts)
2025-12-26 02:30:30 | INFO     | [HEALTH CHECK] [OK] Chrome connection is healthy
[LF][[OK] SUCCESS] Found Amadeus Altea window: Altéa Reservation Desktop
[LF][[INFO] INFO] URL: https://tc212.resdesktop.altea.amadeus.com/app_ard/apf/init/login?SITE=ESMPESMP&LANGUAGE=GB&MARKETS=ARDW_PROD_WBP&ACTION=clpLogin
2025-12-26 02:30:30 | INFO     | [DAY_START] Processing 07JAN
[LF] Processing JED-ATZ for 07JAN
2025-12-26 02:30:30 | INFO     | [lf.day.start] Processing JED-ATZ for 07JAN
[LF] 07JAN: found 2 direct flights
2025-12-26 02:30:31 | INFO     | [lf.day.flights_found] Found 2 flights on 07JAN
2025-12-26 02:30:34 | INFO     | [lf.flight.extracted] SM454 on 07JAN: BKG=174, LF=97.8%
[LF] SM454 07JAN: BKG=174, GRP=173, CAP=178, LF%=97.8%, Brd-Off=JED-ATZ, Classes: P:173, S:1
2025-12-26 02:30:37 | INFO     | [lf.flight.extracted] SM492 on 07JAN: BKG=183, LF=109.6%
[LF] SM492 07JAN: BKG=183, GRP=179, CAP=167, LF%=109.6%, Brd-Off=JED-ATZ, Classes: P:134, E:45, I:3, O:1
[LF] Getting WEEKLY/LASTSOLD data for 2 flights
[LF] SM454 07JAN: LASTSOLD=2025-12-25 00:00:00, WEEKLY=3, TODAY=0, YDAY=1
[LF] SM492 07JAN: LASTSOLD=2025-12-14 00:00:00, WEEKLY=0, TODAY=0, YDAY=0
2025-12-26 02:30:50 | INFO     | [SUCCESS] Day 07JAN
2025-12-26 02:30:50 | INFO     | [DAY_START] Processing 06JAN
[LF] Processing JED-ATZ for 06JAN
2025-12-26 02:30:50 | INFO     | [lf.day.start] Processing JED-ATZ for 06JAN
[LF] 06JAN: found 2 direct flights
2025-12-26 02:30:51 | INFO     | [lf.day.flights_found] Found 2 flights on 06JAN
2025-12-26 02:30:54 | INFO     | [lf.flight.extracted] SM454 on 06JAN: BKG=178, LF=106.6%
[LF] SM454 06JAN: BKG=178, GRP=177, CAP=167, LF%=106.6%, Brd-Off=JED-ATZ, Classes: P:177, I:1
2025-12-26 02:30:58 | INFO     | [lf.flight.extracted] SM456 on 06JAN: BKG=180, LF=107.8%
[LF] SM456 06JAN: BKG=180, GRP=180, CAP=167, LF%=107.8%, Brd-Off=JED-ATZ, Classes: P:180
[LF] Getting WEEKLY/LASTSOLD data for 2 flights
[LF] SM454 06JAN: LASTSOLD=2025-11-19 00:00:00, WEEKLY=0, TODAY=0, YDAY=0
[LF] SM456 06JAN: LASTSOLD=2025-11-12 00:00:00, WEEKLY=0, TODAY=0, YDAY=0
2025-12-26 02:31:10 | INFO     | [SUCCESS] Day 06JAN
2025-12-26 02:31:10 | INFO     | [DAY_START] Processing 05JAN
[LF] Processing JED-ATZ for 05JAN
2025-12-26 02:31:10 | INFO     | [lf.day.start] Processing JED-ATZ for 05JAN
[LF] 05JAN: found 4 direct flights
2025-12-26 02:31:11 | INFO     | [lf.day.flights_found] Found 4 flights on 05JAN
2025-12-26 02:31:13 | INFO     | [lf.flight.extracted] SM492 on 05JAN: BKG=90, LF=53.9%
[LF] SM492 05JAN: BKG=90, GRP=71, CAP=167, LF%=53.9%, Brd-Off=JED-ATZ, Classes: P:69, E:2, I:4, O:2, U:3, X:1, W:8, S:1
2025-12-26 02:31:17 | INFO     | [lf.flight.extracted] SM456 on 05JAN: BKG=120, LF=71.9%
[LF] SM456 05JAN: BKG=120, GRP=92, CAP=167, LF%=71.9%, Brd-Off=JED-ATZ, Classes: P:48, E:45, I:4, O:2, U:3, X:7, T:1, W:9, G:1
2025-12-26 02:31:20 | INFO     | [lf.flight.extracted] SM422 on 05JAN: BKG=171, LF=102.4%
[LF] SM422 05JAN: BKG=171, GRP=159, CAP=167, LF%=102.4%, Brd-Off=JED-ATZ, Classes: P:112, E:47, I:4, O:2, U:3, X:2, S:1
2025-12-26 02:31:24 | INFO     | [lf.flight.extracted] SM454 on 05JAN: BKG=170, LF=101.8%
[LF] SM454 05JAN: BKG=170, GRP=152, CAP=167, LF%=101.8%, Brd-Off=JED-ATZ, Classes: P:63, E:89, I:8, O:1, X:5, W:1, K:3
[LF] Getting WEEKLY/LASTSOLD data for 4 flights
[LF] SM492 05JAN: LASTSOLD=2025-12-24 00:00:00, WEEKLY=9, TODAY=0, YDAY=0
[LF] SM456 05JAN: LASTSOLD=2025-12-23 00:00:00, WEEKLY=4, TODAY=0, YDAY=0
[LF] SM422 05JAN: LASTSOLD=2025-12-17 00:00:00, WEEKLY=0, TODAY=0, YDAY=0
[LF] SM454 05JAN: LASTSOLD=2025-12-14 00:00:00, WEEKLY=0, TODAY=0, YDAY=0
2025-12-26 02:31:43 | INFO     | [SUCCESS] Day 05JAN
2025-12-26 02:31:43 | INFO     | [DAY_START] Processing 04JAN
[LF] Processing JED-ATZ for 04JAN
2025-12-26 02:31:43 | INFO     | [lf.day.start] Processing JED-ATZ for 04JAN
[LF] 04JAN: found 2 direct flights
2025-12-26 02:31:44 | INFO     | [lf.day.flights_found] Found 2 flights on 04JAN
2025-12-26 02:31:46 | INFO     | [lf.flight.extracted] SM492 on 04JAN: BKG=175, LF=104.8%
[LF] SM492 04JAN: BKG=175, GRP=175, CAP=167, LF%=104.8%, Brd-Off=JED-ATZ, Classes: P:175
2025-12-26 02:31:50 | INFO     | [lf.flight.extracted] SM456 on 04JAN: BKG=119, LF=71.3%
[LF] SM456 04JAN: BKG=119, GRP=92, CAP=167, LF%=71.3%, Brd-Off=JED-ATZ, Classes: P:92, I:4, O:2, U:6, X:4, W:8, S:2, K:1
[LF] Getting WEEKLY/LASTSOLD data for 2 flights
[LF] SM492 04JAN: LASTSOLD=2025-12-20 00:00:00, WEEKLY=3, TODAY=0, YDAY=0
[LF] SM456 04JAN: LASTSOLD=2025-12-23 00:00:00, WEEKLY=14, TODAY=0, YDAY=0
2025-12-26 02:32:00 | INFO     | [SUCCESS] Day 04JAN
2025-12-26 02:32:00 | INFO     | [DAY_START] Processing 03JAN
[LF] Processing JED-ATZ for 03JAN
2025-12-26 02:32:00 | INFO     | [lf.day.start] Processing JED-ATZ for 03JAN
[LF] 03JAN: found 3 direct flights
2025-12-26 02:32:01 | INFO     | [lf.day.flights_found] Found 3 flights on 03JAN
2025-12-26 02:32:03 | INFO     | [lf.flight.extracted] SM492 on 03JAN: BKG=160, LF=89.9%
[LF] SM492 03JAN: BKG=160, GRP=135, CAP=178, LF%=89.9%, Brd-Off=JED-ATZ, Classes: P:135, I:4, O:2, U:7, W:11, S:1
2025-12-26 02:32:07 | INFO     | [lf.flight.extracted] SM454 on 03JAN: BKG=162, LF=91.0%
[LF] SM454 03JAN: BKG=162, GRP=140, CAP=178, LF%=91.0%, Brd-Off=JED-ATZ, Classes: P:140, I:2, O:4, U:2, X:4, W:10
2025-12-26 02:32:10 | INFO     | [lf.flight.extracted] SM456 on 03JAN: BKG=130, LF=77.8%
[LF] SM456 03JAN: BKG=130, GRP=90, CAP=167, LF%=77.8%, Brd-Off=JED-ATZ, Classes: P:90, I:8, O:8, U:8, X:7, S:8, G:1
[LF] Getting WEEKLY/LASTSOLD data for 3 flights
[LF] SM492 03JAN: LASTSOLD=2025-12-23 00:00:00, WEEKLY=12, TODAY=0, YDAY=0
[LF] SM454 03JAN: LASTSOLD=2025-12-25 00:00:00, WEEKLY=7, TODAY=0, YDAY=2
[LF] SM456 03JAN: LASTSOLD=2025-12-18 00:00:00, WEEKLY=0, TODAY=0, YDAY=0
2025-12-26 02:32:25 | INFO     | [SUCCESS] Day 03JAN
2025-12-26 02:32:25 | INFO     | [DAY_START] Processing 02JAN
[LF] Processing JED-ATZ for 02JAN
2025-12-26 02:32:25 | INFO     | [lf.day.start] Processing JED-ATZ for 02JAN
[LF] 02JAN: found 1 direct flights
2025-12-26 02:32:26 | INFO     | [lf.day.flights_found] Found 1 flights on 02JAN
2025-12-26 02:32:28 | INFO     | [lf.flight.extracted] SM492 on 02JAN: BKG=164, LF=98.2%
[LF] SM492 02JAN: BKG=164, GRP=130, CAP=167, LF%=98.2%, Brd-Off=JED-ATZ, Classes: P:130, I:4, O:1, U:4, X:8, T:7, W:1, S:9
[LF] Getting WEEKLY/LASTSOLD data for 1 flights
[LF] SM492 02JAN: LASTSOLD=2025-12-22 00:00:00, WEEKLY=4, TODAY=0, YDAY=0
2025-12-26 02:32:33 | INFO     | [SUCCESS] Day 02JAN
[LF] Results summary:
  2026-01-07: 2 flights
  2026-01-06: 2 flights
  2026-01-05: 4 flights
  2026-01-04: 2 flights
  2026-01-03: 3 flights
  2026-01-02: 1 flights
2025-12-26 02:32:33 | INFO     | [SUCCESS] LF Search Complete

============================================================
[Worker_9224] ✓ COMPLETED: JED-ATZ
  Results: 6 dates
  Errors: 0 dates
  Total Processed: 2 groups
============================================================

2025-12-26 02:32:33 | INFO     | [Worker_9224] Completed: JED-ATZ - 6 results, 0 errors
[Worker_9224] Waiting for tasks...

============================================================
[Worker_9224] Shutdown signal received
Exiting...
============================================================
2025-12-26 02:34:48 | INFO     | [Worker_9224] Shutdown signal received, exiting...

============================================================
[Worker_9224] FINISHED
  Total Groups Processed: 2
============================================================

2025-12-26 02:34:48 | INFO     | [Worker_9224] Finished. Processed 2 groups.
