
============================================================
     LF WORKER - PORT 9225
============================================================
Worker: Worker_9225
Status: READY
Waiting for tasks...
============================================================


============================================================
[Worker_9225] Processing: HBE-JED
  Tier 0: Range 2, Chunk 1/2
  Dates: 7 days
  Date Range: 2026-01-20 to 2026-01-14
============================================================

2025-12-26 02:28:27 | INFO     | ======================================================================
2025-12-26 02:28:27 | INFO     | Load Factor Scraper Started - Route: HBE-JED
2025-12-26 02:28:27 | INFO     | Log file: D:\CODERED\OUTPUTS\logs\LF_HBE-JED_20251226_022827.log
2025-12-26 02:28:27 | INFO     | Enhanced logging: Capturing both logging.info() and print()
2025-12-26 02:28:27 | INFO     | ======================================================================
[LF] Processing dates (override): ['20JAN', '19JAN', '18JAN', '17JAN', '16JAN', '15JAN', '14JAN']
[LF] Attaching to Chrome for Altea access
[LF][[OK] SUCCESS] Connected to Chrome on 127.0.0.1:9225 (after 1 attempts)
[LF][[OK] SUCCESS] Found Amadeus Altea window: Altéa Reservation Desktop
[LF][[INFO] INFO] URL: https://tc212.resdesktop.altea.amadeus.com/app_ard/apf/init/login?SITE=ESMPESMP&LANGUAGE=GB&MARKETS=ARDW_PROD_WBP&ACTION=clpLogin
[LF] Processing HBE-JED for 20JAN
[LF][ERROR] Amadeus command error detected: UNKNOWN TRANSACTION
[LF][ERROR] Command: SN20JANHBEJED/ASM
[LF][RESYNC] Triggering immediate resync to last successful SN command
============================================================
[LF][RESYNC] Command 'SN20JANHBEJED/ASM' failed: TECH_ERROR:UNKNOWN TRANSACTION
[LF][RESYNC] Re-running entire day from SN command for HBE-JED 20JAN
[LF][RESYNC] Attempt 1/50 (waiting 1.0s before retry...)
============================================================
[LF][RESYNC] Sending IG to clear session state...
[LF][RESYNC] Session cleared with IG
[LF] Processing HBE-JED for 20JAN
[LF] 20JAN: found 1 direct flights
[LF] SM451 20JAN: BKG=163, GRP=135, CAP=179, LF%=91.1%, Brd-Off=HBE-JED, Classes: P:135, I:4, X:10, T:6, W:6, K:2
[LF] Getting WEEKLY/LASTSOLD data for 1 flights
[LF] SM451 20JAN: LASTSOLD=2025-12-24 00:00:00, WEEKLY=20, TODAY=0, YDAY=0
[LF] Processing HBE-JED for 19JAN
[LF] 19JAN: found 2 direct flights
[LF] SM457 19JAN: BKG=152, GRP=135, CAP=179, LF%=84.9%, Brd-Off=HBE-JED, Classes: P:135, X:10, T:6, K:1
[LF] SM451 19JAN: BKG=158, GRP=135, CAP=179, LF%=88.3%, Brd-Off=HBE-JED, Classes: P:135, X:10, T:5, W:3, S:1, K:4
[LF] Getting WEEKLY/LASTSOLD data for 2 flights
[LF] SM457 19JAN: LASTSOLD=2025-12-25 00:00:00, WEEKLY=8, TODAY=0, YDAY=4
[LF] SM451 19JAN: LASTSOLD=2025-12-25 00:00:00, WEEKLY=12, TODAY=0, YDAY=4
[LF] Processing HBE-JED for 18JAN
[LF] 18JAN: found 2 direct flights
[LF] SM451 18JAN: BKG=170, GRP=135, CAP=179, LF%=95.0%, Brd-Off=HBE-JED, Classes: P:135, X:10, T:9, W:16
[LF] SM457 18JAN: BKG=165, GRP=135, CAP=179, LF%=92.2%, Brd-Off=HBE-JED, Classes: P:135, X:10, T:9, W:11
[LF] Getting WEEKLY/LASTSOLD data for 2 flights
[LF] SM451 18JAN: LASTSOLD=2025-12-25 00:00:00, WEEKLY=13, TODAY=0, YDAY=6
[LF] SM457 18JAN: LASTSOLD=2025-12-25 00:00:00, WEEKLY=15, TODAY=0, YDAY=3
[LF] Processing HBE-JED for 17JAN
[LF] 17JAN: found 2 direct flights
[LF] SM457 17JAN: BKG=162, GRP=138, CAP=179, LF%=90.5%, Brd-Off=HBE-JED, Classes: P:138, W:10, S:8, L:5, K:1
[LF] SM451 17JAN: BKG=178, GRP=135, CAP=179, LF%=99.4%, Brd-Off=HBE-JED, Classes: P:135, X:3, W:9, S:21, G:3, L:3, V:3, K:1
[LF] Getting WEEKLY/LASTSOLD data for 2 flights
[LF] SM457 17JAN: LASTSOLD=2025-12-23 00:00:00, WEEKLY=4, TODAY=0, YDAY=0
[LF] SM451 17JAN: LASTSOLD=2025-12-18 00:00:00, WEEKLY=0, TODAY=0, YDAY=0
[LF] Processing HBE-JED for 16JAN
[LF] 16JAN: found 1 direct flights
[LF] SM451 16JAN: BKG=37, GRP=0, CAP=179, LF%=20.7%, Brd-Off=HBE-JED, Classes: T:5, G:10, L:13, V:9
[LF] Getting WEEKLY/LASTSOLD data for 1 flights
[LF] SM451 16JAN: LASTSOLD=2025-12-25 00:00:00, WEEKLY=15, TODAY=0, YDAY=2
[LF] Processing HBE-JED for 15JAN
[LF] 15JAN: found 1 direct flights
[LF] SM451 15JAN: BKG=161, GRP=135, CAP=179, LF%=89.9%, Brd-Off=HBE-JED, Classes: P:135, X:10, T:8, L:8
[LF] Getting WEEKLY/LASTSOLD data for 1 flights
[LF] SM451 15JAN: LASTSOLD=2025-12-25 00:00:00, WEEKLY=8, TODAY=0, YDAY=4
[LF] Processing HBE-JED for 14JAN
[LF] 14JAN: found 3 direct flights
[LF] SM451 14JAN: BKG=149, GRP=135, CAP=179, LF%=83.2%, Brd-Off=HBE-JED, Classes: P:135, I:3, O:3, U:3, X:2, W:3
[LF] SM457 14JAN: BKG=147, GRP=135, CAP=179, LF%=82.1%, Brd-Off=HBE-JED, Classes: P:135, X:8, T:3, L:1
[LF] SM473 14JAN: BKG=180, GRP=170, CAP=179, LF%=100.6%, Brd-Off=HBE-JED, Classes: P:170, X:9, L:1
[LF] Getting WEEKLY/LASTSOLD data for 3 flights
[LF] SM451 14JAN: LASTSOLD=2025-12-25 00:00:00, WEEKLY=1, TODAY=0, YDAY=1
[LF] SM457 14JAN: LASTSOLD=2025-12-21 00:00:00, WEEKLY=1, TODAY=0, YDAY=0
[LF] SM473 14JAN: LASTSOLD=2025-12-21 00:00:00, WEEKLY=1, TODAY=0, YDAY=0
[LF] Results summary:
  2026-01-20: 1 flights
  2026-01-19: 2 flights
  2026-01-18: 2 flights
  2026-01-17: 2 flights
  2026-01-16: 1 flights
  2026-01-15: 1 flights
  2026-01-14: 3 flights

============================================================
[Worker_9225] ✓ COMPLETED: HBE-JED
  Results: 7 dates
  Errors: 0 dates
  Total Processed: 1 groups
============================================================


============================================================
[Worker_9225] Processing: JED-CAI
  Tier 0: Range 1, Chunk 1/2
  Dates: 6 days
  Date Range: 2026-01-07 to 2026-01-02
============================================================

2025-12-26 02:30:00 | INFO     | ======================================================================
2025-12-26 02:30:00 | INFO     | Load Factor Scraper Started - Route: JED-CAI
2025-12-26 02:30:00 | INFO     | Log file: D:\CODERED\OUTPUTS\logs\LF_JED-CAI_20251226_023000.log
2025-12-26 02:30:00 | INFO     | Enhanced logging: Capturing both logging.info() and print()
2025-12-26 02:30:00 | INFO     | ======================================================================
[LF] Processing dates (override): ['07JAN', '06JAN', '05JAN', '04JAN', '03JAN', '02JAN']
[LF] Attaching to Chrome for Altea access
2025-12-26 02:30:00 | INFO     | Starting LF search for route: JED-CAI
2025-12-26 02:30:00 | INFO     | [START] LF Search
[LF][[OK] SUCCESS] Connected to Chrome on 127.0.0.1:9225 (after 1 attempts)
2025-12-26 02:30:01 | INFO     | [HEALTH CHECK] [OK] Chrome connection is healthy
[LF][[OK] SUCCESS] Found Amadeus Altea window: Altéa Reservation Desktop
[LF][[INFO] INFO] URL: https://tc212.resdesktop.altea.amadeus.com/app_ard/apf/init/login?SITE=ESMPESMP&LANGUAGE=GB&MARKETS=ARDW_PROD_WBP&ACTION=clpLogin
2025-12-26 02:30:01 | INFO     | [DAY_START] Processing 07JAN
[LF] Processing JED-CAI for 07JAN
2025-12-26 02:30:01 | INFO     | [lf.day.start] Processing JED-CAI for 07JAN
[LF] 07JAN: found 4 direct flights
2025-12-26 02:30:02 | INFO     | [lf.day.flights_found] Found 4 flights on 07JAN
2025-12-26 02:30:05 | INFO     | [lf.flight.extracted] SM476 on 07JAN: BKG=166, LF=94.9%
[LF] SM476 07JAN: BKG=166, GRP=136, CAP=175, LF%=94.9%, Brd-Off=JED-CAI, Classes: P:136, U:10, X:12, W:8
2025-12-26 02:30:10 | INFO     | [lf.flight.extracted] SM478 on 07JAN: BKG=153, LF=91.6%
[LF] SM478 07JAN: BKG=153, GRP=95, CAP=167, LF%=91.6%, Brd-Off=JED-CAI, Classes: P:48, E:47, U:10, X:12, T:10, W:22, S:4
2025-12-26 02:30:14 | INFO     | [lf.flight.extracted] SM460 on 07JAN: BKG=168, LF=94.4%
[LF] SM460 07JAN: BKG=168, GRP=137, CAP=178, LF%=94.4%, Brd-Off=JED-CAI, Classes: P:137, U:10, X:12, T:5, S:4
2025-12-26 02:30:18 | INFO     | [lf.flight.extracted] SM424 on 07JAN: BKG=178, LF=100.0%
[LF] SM424 07JAN: BKG=178, GRP=142, CAP=178, LF%=100.0%, Brd-Off=JED-CAI, Classes: P:142, U:10, X:10, T:1, W:6, S:9
[LF] Getting WEEKLY/LASTSOLD data for 4 flights
[LF] SM476 07JAN: LASTSOLD=2025-12-25 00:00:00, WEEKLY=7, TODAY=0, YDAY=5
[LF] SM478 07JAN: LASTSOLD=2025-12-25 00:00:00, WEEKLY=26, TODAY=0, YDAY=9
[LF] SM460 07JAN: LASTSOLD=2025-12-25 00:00:00, WEEKLY=7, TODAY=0, YDAY=6
[LF] SM424 07JAN: LASTSOLD=2025-12-23 00:00:00, WEEKLY=16, TODAY=0, YDAY=0
2025-12-26 02:30:43 | INFO     | [SUCCESS] Day 07JAN
2025-12-26 02:30:43 | INFO     | [DAY_START] Processing 06JAN
[LF] Processing JED-CAI for 06JAN
2025-12-26 02:30:43 | INFO     | [lf.day.start] Processing JED-CAI for 06JAN
[LF] 06JAN: found 6 direct flights
2025-12-26 02:30:45 | INFO     | [lf.day.flights_found] Found 6 flights on 06JAN
2025-12-26 02:30:47 | INFO     | [lf.flight.extracted] SM472 on 06JAN: BKG=151, LF=90.4%
[LF] SM472 06JAN: BKG=151, GRP=107, CAP=167, LF%=90.4%, Brd-Off=JED-CAI, Classes: P:69, E:38, U:20, X:6, W:8, S:7, K:3
[LPC] SM472 06JAN: Found 1 outbound flights with connecting passengers
2025-12-26 02:30:53 | INFO     | [lf.flight.extracted] SM480 on 06JAN: BKG=108, LF=64.7%
[LF] SM480 06JAN: BKG=108, GRP=88, CAP=167, LF%=64.7%, Brd-Off=JED-CAI, Classes: P:48, E:40, U:14, X:2, T:2, W:1, S:1
2025-12-26 02:30:56 | INFO     | [lf.flight.extracted] SM478 on 06JAN: BKG=121, LF=73.8%
[LF] SM478 06JAN: BKG=121, GRP=95, CAP=164, LF%=73.8%, Brd-Off=JED-CAI, Classes: P:45, E:50, U:7, X:12, T:7
2025-12-26 02:31:00 | INFO     | [lf.flight.extracted] SM460 on 06JAN: BKG=122, LF=73.0%
[LF] SM460 06JAN: BKG=122, GRP=91, CAP=167, LF%=73.0%, Brd-Off=JED-CAI, Classes: N:4, P:91, U:10, X:12, T:5
2025-12-26 02:31:04 | INFO     | [lf.flight.extracted] SM424 on 06JAN: BKG=156, LF=93.4%
[LF] SM424 06JAN: BKG=156, GRP=136, CAP=167, LF%=93.4%, Brd-Off=JED-CAI, Classes: P:136, U:9, X:7, T:4
2025-12-26 02:31:08 | INFO     | [lf.flight.extracted] SM476 on 06JAN: BKG=110, LF=67.1%
[LF] SM476 06JAN: BKG=110, GRP=86, CAP=164, LF%=67.1%, Brd-Off=JED-CAI, Classes: P:86, U:10, T:4, W:9, S:1
[LPC] SM476 06JAN: Found 0 outbound flights with connecting passengers
[LF] Getting WEEKLY/LASTSOLD data for 6 flights
[LF] SM472 06JAN: LASTSOLD=2025-12-24 00:00:00, WEEKLY=83, TODAY=0, YDAY=0
[LF] SM480 06JAN: LASTSOLD=2025-12-24 00:00:00, WEEKLY=3, TODAY=0, YDAY=0
[LF] SM478 06JAN: LASTSOLD=2025-12-25 00:00:00, WEEKLY=8, TODAY=0, YDAY=2
[LF] SM460 06JAN: LASTSOLD=2025-12-25 00:00:00, WEEKLY=7, TODAY=0, YDAY=5
[LF] SM424 06JAN: LASTSOLD=2025-12-25 00:00:00, WEEKLY=7, TODAY=0, YDAY=3
[LF] SM476 06JAN: LASTSOLD=2025-12-25 00:00:00, WEEKLY=6, TODAY=0, YDAY=1
2025-12-26 02:31:37 | INFO     | [SUCCESS] Day 06JAN
2025-12-26 02:31:37 | INFO     | [DAY_START] Processing 05JAN
[LF] Processing JED-CAI for 05JAN
2025-12-26 02:31:37 | INFO     | [lf.day.start] Processing JED-CAI for 05JAN
[LF] 05JAN: found 4 direct flights
2025-12-26 02:31:38 | INFO     | [lf.day.flights_found] Found 4 flights on 05JAN
2025-12-26 02:31:40 | INFO     | [lf.flight.extracted] SM480 on 05JAN: BKG=68, LF=40.7%
[LF] SM480 05JAN: BKG=68, GRP=44, CAP=167, LF%=40.7%, Brd-Off=JED-CAI, Classes: P:44, U:20, X:3, S:1
2025-12-26 02:31:43 | INFO     | [lf.flight.extracted] SM476 on 05JAN: BKG=175, LF=97.8%
[LF] SM476 05JAN: BKG=175, GRP=142, CAP=179, LF%=97.8%, Brd-Off=JED-CAI, Classes: P:142, U:18, X:12, W:1, S:2
2025-12-26 02:31:46 | INFO     | [lf.flight.extracted] SM478 on 05JAN: BKG=168, LF=100.6%
[LF] SM478 05JAN: BKG=168, GRP=138, CAP=167, LF%=100.6%, Brd-Off=JED-CAI, Classes: P:138, U:16, X:12, W:1, K:1
2025-12-26 02:31:50 | INFO     | [lf.flight.extracted] SM460 on 05JAN: BKG=167, LF=100.0%
[LF] SM460 05JAN: BKG=167, GRP=132, CAP=167, LF%=100.0%, Brd-Off=JED-CAI, Classes: P:132, U:15, X:3, W:1, S:9, Q:2, H:5
[LPC] SM460 05JAN: Found 0 outbound flights with connecting passengers
[LF] Getting WEEKLY/LASTSOLD data for 4 flights
[LF] SM480 05JAN: LASTSOLD=2025-12-25 00:00:00, WEEKLY=10, TODAY=0, YDAY=2
[LF] SM476 05JAN: LASTSOLD=2025-12-25 00:00:00, WEEKLY=11, TODAY=0, YDAY=4
[LF] SM478 05JAN: LASTSOLD=2025-12-24 00:00:00, WEEKLY=9, TODAY=0, YDAY=0
[LF] SM460 05JAN: LASTSOLD=2025-12-25 00:00:00, WEEKLY=10, TODAY=0, YDAY=1
2025-12-26 02:32:11 | INFO     | [SUCCESS] Day 05JAN
2025-12-26 02:32:11 | INFO     | [DAY_START] Processing 04JAN
[LF] Processing JED-CAI for 04JAN
2025-12-26 02:32:11 | INFO     | [lf.day.start] Processing JED-CAI for 04JAN
[LF] 04JAN: found 5 direct flights
2025-12-26 02:32:12 | INFO     | [lf.day.flights_found] Found 5 flights on 04JAN
2025-12-26 02:32:14 | INFO     | [lf.flight.extracted] SM424 on 04JAN: BKG=168, LF=100.6%
[LF] SM424 04JAN: BKG=168, GRP=160, CAP=167, LF%=100.6%, Brd-Off=JED-CAI, Classes: N:5, E:155, X:5, T:3
[LPC] SM424 04JAN: Found 2 outbound flights with connecting passengers
2025-12-26 02:32:27 | INFO     | [lf.flight.extracted] SM476 on 04JAN: BKG=68, LF=40.7%
[LF] SM476 04JAN: BKG=68, GRP=27, CAP=167, LF%=40.7%, Brd-Off=JED-CAI, Classes: P:27, I:17, O:2, U:19, X:1, W:1, K:1
2025-12-26 02:32:31 | INFO     | [lf.flight.extracted] SM432 on 04JAN: BKG=112, LF=67.1%
[LF] SM432 04JAN: BKG=112, GRP=96, CAP=167, LF%=67.1%, Brd-Off=JED-CAI, Classes: P:96, U:4, X:11, K:1
2025-12-26 02:32:34 | INFO     | [lf.flight.extracted] SM460 on 04JAN: BKG=131, LF=78.4%
[LF] SM460 04JAN: BKG=131, GRP=97, CAP=167, LF%=78.4%, Brd-Off=JED-CAI, Classes: N:2, P:97, U:19, X:10, W:2, S:1
2025-12-26 02:32:37 | INFO     | [lf.flight.extracted] SM478 on 04JAN: BKG=133, LF=79.6%
[LF] SM478 04JAN: BKG=133, GRP=97, CAP=167, LF%=79.6%, Brd-Off=JED-CAI, Classes: P:97, I:1, U:19, X:13, W:2, S:1
[LF] Getting WEEKLY/LASTSOLD data for 5 flights
[LF] SM424 04JAN: LASTSOLD=2025-12-19 00:00:00, WEEKLY=4, TODAY=0, YDAY=0
[LF] SM476 04JAN: LASTSOLD=2025-12-25 00:00:00, WEEKLY=27, TODAY=0, YDAY=5
[LF] SM432 04JAN: LASTSOLD=2025-12-25 00:00:00, WEEKLY=5, TODAY=0, YDAY=1
[LF] SM460 04JAN: LASTSOLD=2025-12-25 00:00:00, WEEKLY=12, TODAY=0, YDAY=6
[LF] SM478 04JAN: LASTSOLD=2025-12-24 00:00:00, WEEKLY=10, TODAY=0, YDAY=0
2025-12-26 02:32:59 | INFO     | [SUCCESS] Day 04JAN
2025-12-26 02:32:59 | INFO     | [DAY_START] Processing 03JAN
[LF] Processing JED-CAI for 03JAN
2025-12-26 02:32:59 | INFO     | [lf.day.start] Processing JED-CAI for 03JAN
[LF] 03JAN: found 3 direct flights
2025-12-26 02:33:02 | INFO     | [lf.day.flights_found] Found 3 flights on 03JAN
2025-12-26 02:33:04 | INFO     | [lf.flight.extracted] SM450 on 03JAN: BKG=162, LF=97.0%
[LF] SM450 03JAN: BKG=162, GRP=141, CAP=167, LF%=97.0%, Brd-Off=JED-CAI, Classes: P:141, U:10, X:7, T:2, K:2
[LPC] SM450 03JAN: Found 1 outbound flights with connecting passengers
2025-12-26 02:33:09 | INFO     | [lf.flight.extracted] SM476 on 03JAN: BKG=159, LF=89.3%
[LF] SM476 03JAN: BKG=159, GRP=131, CAP=178, LF%=89.3%, Brd-Off=JED-CAI, Classes: P:131, U:7, X:12, T:9
2025-12-26 02:33:12 | INFO     | [lf.flight.extracted] SM478 on 03JAN: BKG=165, LF=94.3%
[LF] SM478 03JAN: BKG=165, GRP=139, CAP=175, LF%=94.3%, Brd-Off=JED-CAI, Classes: P:139, I:5, U:15, W:6
[LF] Getting WEEKLY/LASTSOLD data for 3 flights
[LF] SM450 03JAN: LASTSOLD=2025-12-24 00:00:00, WEEKLY=2, TODAY=0, YDAY=0
[LF] SM476 03JAN: LASTSOLD=2025-12-24 00:00:00, WEEKLY=2, TODAY=0, YDAY=0
[LF] SM478 03JAN: LASTSOLD=2025-12-22 00:00:00, WEEKLY=12, TODAY=0, YDAY=0
2025-12-26 02:33:26 | INFO     | [SUCCESS] Day 03JAN
2025-12-26 02:33:26 | INFO     | [DAY_START] Processing 02JAN
[LF] Processing JED-CAI for 02JAN
2025-12-26 02:33:26 | INFO     | [lf.day.start] Processing JED-CAI for 02JAN
[LF] 02JAN: 2 cancelled flight(s) detected from SN
[LF] 02JAN: found 5 direct flights
2025-12-26 02:33:28 | INFO     | [lf.day.flights_found] Found 5 flights on 02JAN
2025-12-26 02:33:30 | INFO     | [lf.flight.extracted] SM424 on 02JAN: BKG=63, LF=37.7%
[LF] SM424 02JAN: BKG=63, GRP=45, CAP=167, LF%=37.7%, Brd-Off=JED-CAI, Classes: P:45, X:6, T:7, W:2, S:3
[LPC] SM424 02JAN: Found 2 outbound flights with connecting passengers
2025-12-26 02:33:34 | INFO     | [lf.flight.extracted] SM476 on 02JAN: BKG=74, LF=44.3%
[LF] SM476 02JAN: BKG=74, GRP=48, CAP=167, LF%=44.3%, Brd-Off=JED-CAI, Classes: P:48, I:5, O:5, U:1, X:10, T:5
2025-12-26 02:33:37 | INFO     | [lf.flight.extracted] SM480 on 02JAN: BKG=163, LF=97.6%
[LF] SM480 02JAN: BKG=163, GRP=135, CAP=167, LF%=97.6%, Brd-Off=JED-CAI, Classes: P:135, U:9, X:11, T:5, W:1, K:2
2025-12-26 02:33:40 | INFO     | [lf.flight.extracted] SM472 on 02JAN: BKG=159, LF=95.2%
[LF] SM472 02JAN: BKG=159, GRP=89, CAP=167, LF%=95.2%, Brd-Off=JED-CAI, Classes: P:89, I:5, O:5, U:12, X:23, T:23, S:2
2025-12-26 02:33:43 | INFO     | [lf.flight.extracted] SM460 on 02JAN: BKG=156, LF=93.4%
[LF] SM460 02JAN: BKG=156, GRP=118, CAP=167, LF%=93.4%, Brd-Off=JED-CAI, Classes: P:118, U:8, X:12, T:16, W:1, K:1
[LPC] SM460 02JAN: Found 0 outbound flights with connecting passengers
[LF] Getting WEEKLY/LASTSOLD data for 5 flights
[LF] SM424 02JAN: LASTSOLD=2025-12-25 00:00:00, WEEKLY=8, TODAY=0, YDAY=4
[LF] SM476 02JAN: LASTSOLD=2025-12-25 00:00:00, WEEKLY=6, TODAY=0, YDAY=1
[LF] SM480 02JAN: LASTSOLD=2025-12-25 00:00:00, WEEKLY=2, TODAY=0, YDAY=1
[LF] SM472 02JAN: LASTSOLD=2025-12-25 00:00:00, WEEKLY=17, TODAY=0, YDAY=6
[LF] SM460 02JAN: LASTSOLD=2025-12-25 00:00:00, WEEKLY=20, TODAY=0, YDAY=1
2025-12-26 02:34:07 | INFO     | [SUCCESS] Day 02JAN
[LF] Results summary:
  2026-01-07: 4 flights
  2026-01-06: 6 flights
  2026-01-05: 4 flights
  2026-01-04: 5 flights
  2026-01-03: 3 flights
  2026-01-02: 5 flights
[LF] Cancelled flights found: 2
  - SM952 02JAN (SN)
  - SM478 02JAN (SN)
2025-12-26 02:34:07 | INFO     | [SUCCESS] LF Search Complete
[Worker_9225] Cancelled flights collected: 2

============================================================
[Worker_9225] ✓ COMPLETED: JED-CAI
  Results: 6 dates
  Errors: 0 dates
  Total Processed: 2 groups
============================================================

2025-12-26 02:34:07 | INFO     | [Worker_9225] Completed: JED-CAI - 6 results, 0 errors
[Worker_9225] Waiting for tasks...

============================================================
[Worker_9225] Shutdown signal received
Exiting...
============================================================
2025-12-26 02:34:47 | INFO     | [Worker_9225] Shutdown signal received, exiting...

============================================================
[Worker_9225] FINISHED
  Total Groups Processed: 2
============================================================

2025-12-26 02:34:47 | INFO     | [Worker_9225] Finished. Processed 2 groups.
