
============================================================
     LF WORKER - PORT 9226
============================================================
Worker: Worker_9226
Status: READY
Waiting for tasks...
============================================================


============================================================
[Worker_9226] Processing: JED-CAI
  Tier 0: Range 1, Chunk 1/3
  Dates: 9 days
  Date Range: 2026-01-31 to 2026-01-23
============================================================

2026-01-05 05:37:16 | INFO     | ======================================================================
2026-01-05 05:37:16 | INFO     | Load Factor Scraper Started - Route: JED-CAI
2026-01-05 05:37:16 | INFO     | Log file: D:\CODERED\LAB\market_insights\outputs\run_generated_050126_at_05.36\logs\LF_JED-CAI_20260105_053716.log
2026-01-05 05:37:16 | INFO     | Enhanced logging: Capturing both logging.info() and print()
2026-01-05 05:37:16 | INFO     | ======================================================================
[LF] Processing dates (override): ['31JAN', '30JAN', '29JAN', '28JAN', '27JAN', '26JAN', '25JAN', '24JAN', '23JAN']
[LF] Attaching to Chrome for Altea access
[LF][[OK] SUCCESS] Connected to Chrome on 127.0.0.1:9226 (after 1 attempts)
[LF][[OK] SUCCESS] Found Amadeus Altea window: Altéa Reservation Desktop
[LF][[INFO] INFO] URL: https://tc212.resdesktop.altea.amadeus.com/app_ard/apf/init/login?SITE=ESMPESMP&LANGUAGE=GB&MARKETS=ARDW_PROD_WBP&ACTION=clpLogin
[LF] Processing JED-CAI for 31JAN
[LF][ERROR] Amadeus command error detected: UNKNOWN TRANSACTION
[LF][ERROR] Command: SN31JANJEDCAI/ASM
[LF][RESYNC] Triggering immediate resync to last successful SN command
============================================================
[LF][RESYNC] Command 'SN31JANJEDCAI/ASM' failed: TECH_ERROR:UNKNOWN TRANSACTION
[LF][RESYNC] Re-running entire day from SN command for JED-CAI 31JAN
[LF][RESYNC] Attempt 1/50 (waiting 1.0s before retry...)
============================================================
[LF][RESYNC] Sending IG to clear session state...
[LF][RESYNC] Session cleared with IG
[LF] Processing JED-CAI for 31JAN
[LF] 31JAN: found 3 direct flights
[LF] SM450 31JAN: BKG=146, GRP=130, CAP=175, LF%=83.4%, Brd-Off=JED-CAI, Classes: E:130, I:6, U:10
[LPC] SM450 31JAN: Found 1 outbound flights with connecting passengers
[LF] SM476 31JAN: BKG=165, GRP=135, CAP=175, LF%=94.3%, Brd-Off=JED-CAI, Classes: P:135, I:17, O:1, U:2, X:3, W:3, S:4
[LPC] SM476 31JAN: Found 1 outbound flights with connecting passengers
[LF] SM478 31JAN: BKG=133, GRP=110, CAP=175, LF%=76.0%, Brd-Off=JED-CAI, Classes: N:4, P:110, U:9, X:9, K:1
[LPC] SM478 31JAN: Found 0 outbound flights with connecting passengers
[LF] Getting WEEKLY/LASTSOLD data for 3 flights
[LF] SM450 31JAN: LASTSOLD=2025-12-25 00:00:00, WEEKLY=0, TODAY=0, YDAY=0
[LF] SM476 31JAN: LASTSOLD=2026-01-02 00:00:00, WEEKLY=6, TODAY=0, YDAY=0
[LF] SM478 31JAN: LASTSOLD=2026-01-04 00:00:00, WEEKLY=7, TODAY=0, YDAY=7
[LF] Processing JED-CAI for 30JAN
[LF] 30JAN: found 6 direct flights
[LF] SM424 30JAN: BKG=54, GRP=45, CAP=172, LF%=31.4%, Brd-Off=JED-CAI, Classes: P:45, I:1, U:4, X:2, Q:2
[LPC] SM424 30JAN: Found 2 outbound flights with connecting passengers
[LF] SM476 30JAN: BKG=16, GRP=0, CAP=175, LF%=9.1%, Brd-Off=JED-CAI, Classes: I:1, O:12, U:3
[LF] SM478 30JAN: BKG=25, GRP=0, CAP=175, LF%=14.3%, Brd-Off=JED-CAI, Classes: I:1, O:16, U:8
[LF] SM480 30JAN: BKG=19, GRP=0, CAP=175, LF%=10.9%, Brd-Off=JED-CAI, Classes: I:8, U:10, T:1
[LF] SM472 30JAN: BKG=49, GRP=10, CAP=175, LF%=28.0%, Brd-Off=JED-CAI, Classes: P:10, I:15, U:8, X:16
[LF] SM460 30JAN: BKG=129, GRP=90, CAP=168, LF%=76.8%, Brd-Off=JED-CAI, Classes: N:1, P:90, I:17, O:2, U:9, X:9, K:1
[LF] Getting WEEKLY/LASTSOLD data for 6 flights
[LF] SM424 30JAN: LASTSOLD=2026-01-04 00:00:00, WEEKLY=2, TODAY=0, YDAY=1
[LF] SM476 30JAN: LASTSOLD=2026-01-04 00:00:00, WEEKLY=12, TODAY=0, YDAY=2
[LF] SM478 30JAN: LASTSOLD=2026-01-01 00:00:00, WEEKLY=16, TODAY=0, YDAY=0
[LF] SM480 30JAN: LASTSOLD=2026-01-04 00:00:00, WEEKLY=1, TODAY=0, YDAY=1
[LF] SM472 30JAN: LASTSOLD=2026-01-04 00:00:00, WEEKLY=6, TODAY=0, YDAY=2
[LF] SM460 30JAN: LASTSOLD=2026-01-04 00:00:00, WEEKLY=4, TODAY=0, YDAY=2
[LF] Processing JED-CAI for 29JAN
[LF] 29JAN: found 6 direct flights
[LF] SM472 29JAN: BKG=66, GRP=48, CAP=175, LF%=37.7%, Brd-Off=JED-CAI, Classes: P:48, I:13, U:5
[LF] SM450 29JAN: BKG=125, GRP=118, CAP=172, LF%=72.7%, Brd-Off=JED-CAI, Classes: E:118, I:3, U:4
[LPC] SM450 29JAN: Found 2 outbound flights with connecting passengers
[LF] SM476 29JAN: BKG=63, GRP=55, CAP=175, LF%=36.0%, Brd-Off=JED-CAI, Classes: P:55, I:6, U:2
[LF] SM432 29JAN: BKG=168, GRP=140, CAP=175, LF%=96.0%, Brd-Off=JED-CAI, Classes: P:140, I:27, K:1
[LF] SM478 29JAN: BKG=152, GRP=140, CAP=168, LF%=90.5%, Brd-Off=JED-CAI, Classes: P:140, I:2, U:10
[LF] SM480 29JAN: BKG=167, GRP=135, CAP=175, LF%=95.4%, Brd-Off=JED-CAI, Classes: N:4, P:135, I:10, U:10, X:7, K:1
[LF] Getting WEEKLY/LASTSOLD data for 6 flights
[LF] SM472 29JAN: LASTSOLD=2026-01-03 00:00:00, WEEKLY=10, TODAY=0, YDAY=0
[LF] SM450 29JAN: LASTSOLD=2026-01-01 00:00:00, WEEKLY=2, TODAY=0, YDAY=0
[LF] SM476 29JAN: LASTSOLD=2026-01-03 00:00:00, WEEKLY=5, TODAY=0, YDAY=0
[LF] SM432 29JAN: LASTSOLD=2026-01-04 00:00:00, WEEKLY=21, TODAY=0, YDAY=1
[LF] SM478 29JAN: LASTSOLD=2026-01-03 00:00:00, WEEKLY=1, TODAY=0, YDAY=0
[LF] SM480 29JAN: LASTSOLD=2026-01-04 00:00:00, WEEKLY=1, TODAY=0, YDAY=1
[LF] Processing JED-CAI for 28JAN
[LF] 28JAN: found 4 direct flights
[LF] SM476 28JAN: BKG=102, GRP=90, CAP=175, LF%=58.3%, Brd-Off=JED-CAI, Classes: P:90, I:10, U:2
[LF] SM478 28JAN: BKG=108, GRP=90, CAP=175, LF%=61.7%, Brd-Off=JED-CAI, Classes: P:90, I:12, U:6
[LF] SM460 28JAN: BKG=128, GRP=95, CAP=168, LF%=76.2%, Brd-Off=JED-CAI, Classes: P:95, I:24, O:2, U:7
[LF] SM424 28JAN: BKG=26, GRP=0, CAP=175, LF%=14.9%, Brd-Off=JED-CAI, Classes: I:26
[LF] Getting WEEKLY/LASTSOLD data for 4 flights
[LF] SM476 28JAN: LASTSOLD=2026-01-03 00:00:00, WEEKLY=5, TODAY=0, YDAY=0
[LF] SM478 28JAN: LASTSOLD=2026-01-01 00:00:00, WEEKLY=10, TODAY=0, YDAY=0
[LF] SM460 28JAN: LASTSOLD=2026-01-04 00:00:00, WEEKLY=23, TODAY=0, YDAY=8
[LF] SM424 28JAN: LASTSOLD=2026-01-01 00:00:00, WEEKLY=14, TODAY=0, YDAY=0
[LF] Processing JED-CAI for 27JAN
[LF] 27JAN: found 6 direct flights
[LF] SM472 27JAN: BKG=6, GRP=0, CAP=175, LF%=3.4%, Brd-Off=JED-CAI, Classes: I:6
[LF] SM480 27JAN: BKG=101, GRP=80, CAP=172, LF%=58.7%, Brd-Off=JED-CAI, Classes: P:80, I:19, U:1, K:1
[LF] SM478 27JAN: BKG=67, GRP=45, CAP=168, LF%=39.9%, Brd-Off=JED-CAI, Classes: P:45, I:14, U:7, K:1
[LF] SM460 27JAN: BKG=153, GRP=129, CAP=175, LF%=87.4%, Brd-Off=JED-CAI, Classes: P:129, I:18, O:3, U:3
[LF] SM424 27JAN: BKG=5, GRP=0, CAP=175, LF%=2.9%, Brd-Off=JED-CAI, Classes: I:3, U:2
[LF] SM476 27JAN: BKG=47, GRP=45, CAP=175, LF%=26.9%, Brd-Off=JED-CAI, Classes: E:45, I:2
[LF] Getting WEEKLY/LASTSOLD data for 6 flights
[LF] SM472 27JAN: LASTSOLD=2026-01-04 00:00:00, WEEKLY=6, TODAY=0, YDAY=2
[LF] SM480 27JAN: LASTSOLD=2026-01-04 00:00:00, WEEKLY=5, TODAY=0, YDAY=3
[LF] SM478 27JAN: LASTSOLD=2026-01-04 00:00:00, WEEKLY=8, TODAY=0, YDAY=1
[LF] SM460 27JAN: LASTSOLD=2026-01-04 00:00:00, WEEKLY=59, TODAY=0, YDAY=5
[LF] SM424 27JAN: LASTSOLD=2026-01-05 00:00:00, WEEKLY=2, TODAY=2, YDAY=0
[LF] SM476 27JAN: LASTSOLD=2025-12-22 00:00:00, WEEKLY=0, TODAY=0, YDAY=0
[LF] Processing JED-CAI for 26JAN
[LF] 26JAN: found 4 direct flights
[LF] SM480 26JAN: BKG=8, GRP=0, CAP=175, LF%=4.6%, Brd-Off=JED-CAI, Classes: I:7, U:1
[LF] SM476 26JAN: BKG=103, GRP=92, CAP=175, LF%=58.9%, Brd-Off=JED-CAI, Classes: P:92, I:1, O:9, U:1
[LF] SM478 26JAN: BKG=155, GRP=135, CAP=175, LF%=88.6%, Brd-Off=JED-CAI, Classes: P:90, E:45, I:7, O:10, U:3
[LF] SM460 26JAN: BKG=153, GRP=140, CAP=175, LF%=87.4%, Brd-Off=JED-CAI, Classes: P:140, I:1, O:6, U:1, X:1, K:4
[LPC] SM460 26JAN: Found 0 outbound flights with connecting passengers
[LF] Getting WEEKLY/LASTSOLD data for 4 flights
[LF] SM480 26JAN: LASTSOLD=2026-01-02 00:00:00, WEEKLY=5, TODAY=0, YDAY=0
[LF] SM476 26JAN: LASTSOLD=2025-12-30 00:00:00, WEEKLY=10, TODAY=0, YDAY=0
[LF] SM478 26JAN: LASTSOLD=2026-01-04 00:00:00, WEEKLY=8, TODAY=0, YDAY=3
[LF] SM460 26JAN: LASTSOLD=2025-12-31 00:00:00, WEEKLY=6, TODAY=0, YDAY=0
[LF] Processing JED-CAI for 25JAN
[LF] 25JAN: found 5 direct flights
[LF] SM424 25JAN: BKG=94, GRP=90, CAP=175, LF%=53.7%, Brd-Off=JED-CAI, Classes: P:90, I:4
[LF] SM476 25JAN: BKG=52, GRP=45, CAP=175, LF%=29.7%, Brd-Off=JED-CAI, Classes: P:45, I:1, U:6
[LF] SM432 25JAN: BKG=14, GRP=0, CAP=175, LF%=8.0%, Brd-Off=JED-CAI, Classes: I:14
[LF] SM460 25JAN: BKG=112, GRP=100, CAP=175, LF%=64.0%, Brd-Off=JED-CAI, Classes: P:100, I:3, O:5, U:4
[LF] SM478 25JAN: BKG=123, GRP=95, CAP=175, LF%=70.3%, Brd-Off=JED-CAI, Classes: N:5, P:95, I:9, O:9, U:2, Q:3
[LF] Getting WEEKLY/LASTSOLD data for 5 flights
[LF] SM424 25JAN: LASTSOLD=2025-12-22 00:00:00, WEEKLY=0, TODAY=0, YDAY=0
[LF] SM476 25JAN: LASTSOLD=2025-12-19 00:00:00, WEEKLY=0, TODAY=0, YDAY=0
[LF] SM432 25JAN: LASTSOLD=2026-01-04 00:00:00, WEEKLY=14, TODAY=0, YDAY=1
[LF] SM460 25JAN: LASTSOLD=2026-01-04 00:00:00, WEEKLY=3, TODAY=0, YDAY=1
[LF] SM478 25JAN: LASTSOLD=2025-12-31 00:00:00, WEEKLY=8, TODAY=0, YDAY=0
[LF] Processing JED-CAI for 24JAN
[LF] 24JAN: found 3 direct flights
[LF] SM450 24JAN: BKG=25, GRP=0, CAP=175, LF%=14.3%, Brd-Off=JED-CAI, Classes: I:21, U:2, X:1, T:1
[LF] SM476 24JAN: BKG=147, GRP=134, CAP=168, LF%=87.5%, Brd-Off=JED-CAI, Classes: P:134, I:1, O:11, U:1
[LF] SM478 24JAN: BKG=137, GRP=90, CAP=175, LF%=78.3%, Brd-Off=JED-CAI, Classes: N:2, P:90, I:12, O:15, U:15, S:1, L:2
[LF] Getting WEEKLY/LASTSOLD data for 3 flights
[LF] SM450 24JAN: LASTSOLD=2026-01-03 00:00:00, WEEKLY=17, TODAY=0, YDAY=0
[LF] SM476 24JAN: LASTSOLD=2026-01-04 00:00:00, WEEKLY=14, TODAY=0, YDAY=1
[LF] SM478 24JAN: LASTSOLD=2026-01-04 00:00:00, WEEKLY=19, TODAY=0, YDAY=2
[LF] Processing JED-CAI for 23JAN
[LF] 23JAN: found 6 direct flights
[LF] SM424 23JAN: BKG=10, GRP=0, CAP=168, LF%=5.9%, Brd-Off=JED-CAI, Classes: I:6, O:3, U:1
[LF] SM476 23JAN: BKG=3, GRP=0, CAP=175, LF%=1.7%, Brd-Off=JED-CAI, Classes: I:3
[LF] SM478 23JAN: BKG=15, GRP=0, CAP=175, LF%=8.6%, Brd-Off=JED-CAI, Classes: I:13, O:2
[LF] SM480 23JAN: BKG=54, GRP=45, CAP=175, LF%=30.9%, Brd-Off=JED-CAI, Classes: P:45, O:7, U:2
[LF] SM472 23JAN: BKG=98, GRP=75, CAP=175, LF%=56.0%, Brd-Off=JED-CAI, Classes: P:45, E:30, I:8, O:8, U:3, X:2, S:2
[LPC] SM472 23JAN: Found 1 outbound flights with connecting passengers
[LF] SM460 23JAN: BKG=59, GRP=46, CAP=175, LF%=33.7%, Brd-Off=JED-CAI, Classes: P:46, I:6, O:4, U:1, K:2
[LF] Getting WEEKLY/LASTSOLD data for 6 flights
[LF] SM424 23JAN: LASTSOLD=2026-01-04 00:00:00, WEEKLY=7, TODAY=0, YDAY=1
[LF] SM476 23JAN: LASTSOLD=2025-12-23 00:00:00, WEEKLY=0, TODAY=0, YDAY=0
[LF] SM478 23JAN: LASTSOLD=2026-01-04 00:00:00, WEEKLY=13, TODAY=0, YDAY=5
[LF] SM480 23JAN: LASTSOLD=2026-01-01 00:00:00, WEEKLY=2, TODAY=0, YDAY=0
[LF] SM472 23JAN: LASTSOLD=2026-01-04 00:00:00, WEEKLY=4, TODAY=0, YDAY=1
[LF] SM460 23JAN: LASTSOLD=2026-01-03 00:00:00, WEEKLY=8, TODAY=0, YDAY=0
[LF] Results summary:
  2026-01-31: 3 flights
  2026-01-30: 6 flights
  2026-01-29: 6 flights
  2026-01-28: 4 flights
  2026-01-27: 6 flights
  2026-01-26: 4 flights
  2026-01-25: 5 flights
  2026-01-24: 3 flights
  2026-01-23: 6 flights

============================================================
[Worker_9226] ✓ COMPLETED: JED-CAI
  Results: 9 dates
  Errors: 0 dates
  Total Processed: 1 groups
============================================================


============================================================
[Worker_9226] Processing: ELQ-ATZ
  Tier 0: Range 1, Chunk 2/3
  Dates: 9 days
  Date Range: 2026-01-22 to 2026-01-14
============================================================

2026-01-05 05:42:15 | INFO     | ======================================================================
2026-01-05 05:42:15 | INFO     | Load Factor Scraper Started - Route: ELQ-ATZ
2026-01-05 05:42:15 | INFO     | Log file: D:\CODERED\LAB\market_insights\outputs\run_generated_050126_at_05.36\logs\LF_ELQ-ATZ_20260105_054215.log
2026-01-05 05:42:15 | INFO     | Enhanced logging: Capturing both logging.info() and print()
2026-01-05 05:42:15 | INFO     | ======================================================================
[LF] Processing dates (override): ['22JAN', '21JAN', '20JAN', '19JAN', '18JAN', '17JAN', '16JAN', '15JAN', '14JAN']
[LF] Attaching to Chrome for Altea access
2026-01-05 05:42:15 | INFO     | Starting LF search for route: ELQ-ATZ
2026-01-05 05:42:15 | INFO     | [START] LF Search
[LF][[OK] SUCCESS] Connected to Chrome on 127.0.0.1:9226 (after 1 attempts)
2026-01-05 05:42:18 | INFO     | [HEALTH CHECK] [OK] Chrome connection is healthy
[LF][[OK] SUCCESS] Found Amadeus Altea window: Altéa Reservation Desktop
[LF][[INFO] INFO] URL: https://tc212.resdesktop.altea.amadeus.com/app_ard/apf/init/login?SITE=ESMPESMP&LANGUAGE=GB&MARKETS=ARDW_PROD_WBP&ACTION=clpLogin
2026-01-05 05:42:18 | INFO     | [DAY_START] Processing 22JAN
[LF] Processing ELQ-ATZ for 22JAN
2026-01-05 05:42:18 | INFO     | [lf.day.start] Processing ELQ-ATZ for 22JAN
[LF] No direct flights on 22JAN for ELQ-ATZ
2026-01-05 05:42:19 | WARNING  | [lf.day.no_flights] No direct flights on 22JAN
2026-01-05 05:42:20 | INFO     | [SUCCESS] Day 22JAN
2026-01-05 05:42:20 | INFO     | [DAY_START] Processing 21JAN
[LF] Processing ELQ-ATZ for 21JAN
2026-01-05 05:42:20 | INFO     | [lf.day.start] Processing ELQ-ATZ for 21JAN
[LF] 21JAN: found 1 direct flights
2026-01-05 05:42:21 | INFO     | [lf.day.flights_found] Found 1 flights on 21JAN
2026-01-05 05:42:23 | INFO     | [lf.flight.extracted] SM436 on 21JAN: BKG=61, LF=36.5%
[LF] SM436 21JAN: BKG=61, GRP=0, CAP=167, LF%=36.5%, Brd-Off=ELQ-ATZ, Classes: I:16, O:20, U:18, X:6, L:1
[LF] Getting WEEKLY/LASTSOLD data for 1 flights
[LF] SM436 21JAN: LASTSOLD=2026-01-03 00:00:00, WEEKLY=18, TODAY=0, YDAY=0
2026-01-05 05:42:29 | INFO     | [SUCCESS] Day 21JAN
2026-01-05 05:42:29 | INFO     | [DAY_START] Processing 20JAN
[LF] Processing ELQ-ATZ for 20JAN
2026-01-05 05:42:29 | INFO     | [lf.day.start] Processing ELQ-ATZ for 20JAN
[LF] No direct flights on 20JAN for ELQ-ATZ
2026-01-05 05:42:31 | WARNING  | [lf.day.no_flights] No direct flights on 20JAN
2026-01-05 05:42:31 | INFO     | [SUCCESS] Day 20JAN
2026-01-05 05:42:31 | INFO     | [DAY_START] Processing 19JAN
[LF] Processing ELQ-ATZ for 19JAN
2026-01-05 05:42:31 | INFO     | [lf.day.start] Processing ELQ-ATZ for 19JAN
[LF] No direct flights on 19JAN for ELQ-ATZ
2026-01-05 05:42:32 | WARNING  | [lf.day.no_flights] No direct flights on 19JAN
2026-01-05 05:42:32 | INFO     | [SUCCESS] Day 19JAN
2026-01-05 05:42:32 | INFO     | [DAY_START] Processing 18JAN
[LF] Processing ELQ-ATZ for 18JAN
2026-01-05 05:42:32 | INFO     | [lf.day.start] Processing ELQ-ATZ for 18JAN
[LF] No direct flights on 18JAN for ELQ-ATZ
2026-01-05 05:42:34 | WARNING  | [lf.day.no_flights] No direct flights on 18JAN
2026-01-05 05:42:34 | INFO     | [SUCCESS] Day 18JAN
2026-01-05 05:42:34 | INFO     | [DAY_START] Processing 17JAN
[LF] Processing ELQ-ATZ for 17JAN
2026-01-05 05:42:34 | INFO     | [lf.day.start] Processing ELQ-ATZ for 17JAN
[LF] 17JAN: found 1 direct flights
2026-01-05 05:42:35 | INFO     | [lf.day.flights_found] Found 1 flights on 17JAN
2026-01-05 05:42:39 | INFO     | [lf.flight.extracted] SM436 on 17JAN: BKG=57, LF=34.1%
[LF] SM436 17JAN: BKG=57, GRP=0, CAP=167, LF%=34.1%, Brd-Off=ELQ-ATZ, Classes: I:17, O:2, U:22, X:16
[LF] Getting WEEKLY/LASTSOLD data for 1 flights
[LF] SM436 17JAN: LASTSOLD=2026-01-04 00:00:00, WEEKLY=8, TODAY=0, YDAY=1
2026-01-05 05:42:44 | INFO     | [SUCCESS] Day 17JAN
2026-01-05 05:42:44 | INFO     | [DAY_START] Processing 16JAN
[LF] Processing ELQ-ATZ for 16JAN
2026-01-05 05:42:44 | INFO     | [lf.day.start] Processing ELQ-ATZ for 16JAN
[LF] No direct flights on 16JAN for ELQ-ATZ
2026-01-05 05:42:46 | WARNING  | [lf.day.no_flights] No direct flights on 16JAN
2026-01-05 05:42:46 | INFO     | [SUCCESS] Day 16JAN
2026-01-05 05:42:46 | INFO     | [DAY_START] Processing 15JAN
[LF] Processing ELQ-ATZ for 15JAN
2026-01-05 05:42:46 | INFO     | [lf.day.start] Processing ELQ-ATZ for 15JAN
[LF] No direct flights on 15JAN for ELQ-ATZ
2026-01-05 05:42:48 | WARNING  | [lf.day.no_flights] No direct flights on 15JAN
2026-01-05 05:42:48 | INFO     | [SUCCESS] Day 15JAN
2026-01-05 05:42:48 | INFO     | [DAY_START] Processing 14JAN
[LF] Processing ELQ-ATZ for 14JAN
2026-01-05 05:42:48 | INFO     | [lf.day.start] Processing ELQ-ATZ for 14JAN
[LF] 14JAN: found 1 direct flights
2026-01-05 05:42:49 | INFO     | [lf.day.flights_found] Found 1 flights on 14JAN
2026-01-05 05:42:52 | INFO     | [lf.flight.extracted] SM436 on 14JAN: BKG=79, LF=47.3%
[LF] SM436 14JAN: BKG=79, GRP=0, CAP=167, LF%=47.3%, Brd-Off=ELQ-ATZ, Classes: I:25, O:18, U:30, X:6
[LF] Getting WEEKLY/LASTSOLD data for 1 flights
[LF] SM436 14JAN: LASTSOLD=2026-01-04 00:00:00, WEEKLY=41, TODAY=0, YDAY=1
2026-01-05 05:43:00 | INFO     | [SUCCESS] Day 14JAN
[LF] Results summary:
  2026-01-22: 0 flights
  2026-01-21: 1 flights
  2026-01-20: 0 flights
  2026-01-19: 0 flights
  2026-01-18: 0 flights
  2026-01-17: 1 flights
  2026-01-16: 0 flights
  2026-01-15: 0 flights
  2026-01-14: 1 flights
2026-01-05 05:43:00 | INFO     | [SUCCESS] LF Search Complete

============================================================
[Worker_9226] ✓ COMPLETED: ELQ-ATZ
  Results: 9 dates
  Errors: 0 dates
  Total Processed: 2 groups
============================================================

2026-01-05 05:43:02 | INFO     | [Worker_9226] Completed: ELQ-ATZ - 9 results, 0 errors

============================================================
[Worker_9226] Processing: JED-ATZ
  Tier 0: Range 1, Chunk 3/3
  Dates: 9 days
  Date Range: 2026-01-13 to 2026-01-05
============================================================

2026-01-05 05:43:02 | INFO     | [Worker_9226] Processing: JED-ATZ
2026-01-05 05:43:02 | INFO     |   Tier 0: Range 1, Chunk 3/3 (9 days)
2026-01-05 05:43:02 | INFO     | ======================================================================
2026-01-05 05:43:02 | INFO     | Load Factor Scraper Started - Route: JED-ATZ
2026-01-05 05:43:02 | INFO     | Log file: D:\CODERED\LAB\market_insights\outputs\run_generated_050126_at_05.36\logs\LF_JED-ATZ_20260105_054302.log
2026-01-05 05:43:02 | INFO     | Enhanced logging: Capturing both logging.info() and print()
2026-01-05 05:43:02 | INFO     | ======================================================================
[LF] Processing dates (override): ['13JAN', '12JAN', '11JAN', '10JAN', '09JAN', '08JAN', '07JAN', '06JAN', '05JAN']
[LF] Attaching to Chrome for Altea access
2026-01-05 05:43:02 | INFO     | Starting LF search for route: JED-ATZ
2026-01-05 05:43:02 | INFO     | [START] LF Search
[LF][[OK] SUCCESS] Connected to Chrome on 127.0.0.1:9226 (after 1 attempts)
2026-01-05 05:43:05 | INFO     | [HEALTH CHECK] [OK] Chrome connection is healthy
[LF][[OK] SUCCESS] Found Amadeus Altea window: Altéa Reservation Desktop
[LF][[INFO] INFO] URL: https://tc212.resdesktop.altea.amadeus.com/app_ard/apf/init/login?SITE=ESMPESMP&LANGUAGE=GB&MARKETS=ARDW_PROD_WBP&ACTION=clpLogin
2026-01-05 05:43:06 | INFO     | [DAY_START] Processing 13JAN
[LF] Processing JED-ATZ for 13JAN
2026-01-05 05:43:06 | INFO     | [lf.day.start] Processing JED-ATZ for 13JAN
[LF] 13JAN: found 2 direct flights
2026-01-05 05:43:07 | INFO     | [lf.day.flights_found] Found 2 flights on 13JAN
2026-01-05 05:43:11 | INFO     | [lf.flight.extracted] SM454 on 13JAN: BKG=165, LF=94.3%
[LF] SM454 13JAN: BKG=165, GRP=159, CAP=175, LF%=94.3%, Brd-Off=JED-ATZ, Classes: P:159, I:2, W:3, S:1
2026-01-05 05:43:15 | INFO     | [lf.flight.extracted] SM456 on 13JAN: BKG=152, LF=86.9%
[LF] SM456 13JAN: BKG=152, GRP=135, CAP=175, LF%=86.9%, Brd-Off=JED-ATZ, Classes: P:91, E:45, I:4, O:2, U:4, X:4, T:1, G:1
[LF] Getting WEEKLY/LASTSOLD data for 2 flights
[LF] SM454 13JAN: LASTSOLD=2025-12-29 00:00:00, WEEKLY=1, TODAY=0, YDAY=0
[LF] SM456 13JAN: LASTSOLD=2026-01-04 00:00:00, WEEKLY=6, TODAY=0, YDAY=1
2026-01-05 05:43:27 | INFO     | [SUCCESS] Day 13JAN
2026-01-05 05:43:27 | INFO     | [DAY_START] Processing 12JAN
[LF] Processing JED-ATZ for 12JAN
2026-01-05 05:43:27 | INFO     | [lf.day.start] Processing JED-ATZ for 12JAN
[LF] 12JAN: found 3 direct flights
2026-01-05 05:43:28 | INFO     | [lf.day.flights_found] Found 3 flights on 12JAN
2026-01-05 05:43:30 | INFO     | [lf.flight.extracted] SM456 on 12JAN: BKG=156, LF=92.9%
[LF] SM456 12JAN: BKG=156, GRP=129, CAP=168, LF%=92.9%, Brd-Off=JED-ATZ, Classes: P:129, I:2, O:2, U:13, X:7, T:2, G:1
2026-01-05 05:43:34 | INFO     | [lf.flight.extracted] SM492 on 12JAN: BKG=127, LF=72.6%
[LF] SM492 12JAN: BKG=127, GRP=94, CAP=175, LF%=72.6%, Brd-Off=JED-ATZ, Classes: P:45, E:49, I:4, O:2, U:3, X:6, T:10, W:8
2026-01-05 05:43:39 | INFO     | [lf.flight.extracted] SM454 on 12JAN: BKG=150, LF=85.7%
[LF] SM454 12JAN: BKG=150, GRP=135, CAP=175, LF%=85.7%, Brd-Off=JED-ATZ, Classes: P:94, E:41, I:4, O:2, U:4, X:5
[LF] Getting WEEKLY/LASTSOLD data for 3 flights
[LF] SM456 12JAN: LASTSOLD=2026-01-04 00:00:00, WEEKLY=20, TODAY=0, YDAY=10
[LF] SM492 12JAN: LASTSOLD=2026-01-03 00:00:00, WEEKLY=15, TODAY=0, YDAY=0
[LF] SM454 12JAN: LASTSOLD=2026-01-04 00:00:00, WEEKLY=6, TODAY=0, YDAY=1
2026-01-05 05:43:54 | INFO     | [SUCCESS] Day 12JAN
2026-01-05 05:43:54 | INFO     | [DAY_START] Processing 11JAN
[LF] Processing JED-ATZ for 11JAN
2026-01-05 05:43:54 | INFO     | [lf.day.start] Processing JED-ATZ for 11JAN
[LF] 11JAN: found 2 direct flights
2026-01-05 05:43:55 | INFO     | [lf.day.flights_found] Found 2 flights on 11JAN
2026-01-05 05:43:57 | INFO     | [lf.flight.extracted] SM492 on 11JAN: BKG=179, LF=102.3%
[LF] SM492 11JAN: BKG=179, GRP=179, CAP=175, LF%=102.3%, Brd-Off=JED-ATZ, Classes: P:179
2026-01-05 05:44:00 | INFO     | [lf.flight.extracted] SM456 on 11JAN: BKG=157, LF=89.7%
[LF] SM456 11JAN: BKG=157, GRP=141, CAP=175, LF%=89.7%, Brd-Off=JED-ATZ, Classes: P:141, I:4, O:2, U:3, X:1, S:1, V:4, K:1
[LF] Getting WEEKLY/LASTSOLD data for 2 flights
[LF] SM492 11JAN: LASTSOLD=2025-11-23 00:00:00, WEEKLY=0, TODAY=0, YDAY=0
[LF] SM456 11JAN: LASTSOLD=2026-01-02 00:00:00, WEEKLY=1, TODAY=0, YDAY=0
2026-01-05 05:44:11 | INFO     | [SUCCESS] Day 11JAN
2026-01-05 05:44:11 | INFO     | [DAY_START] Processing 10JAN
[LF] Processing JED-ATZ for 10JAN
2026-01-05 05:44:11 | INFO     | [lf.day.start] Processing JED-ATZ for 10JAN
[LF] 10JAN: found 3 direct flights
2026-01-05 05:44:12 | INFO     | [lf.day.flights_found] Found 3 flights on 10JAN
2026-01-05 05:44:14 | INFO     | [lf.flight.extracted] SM492 on 10JAN: BKG=158, LF=90.3%
[LF] SM492 10JAN: BKG=158, GRP=139, CAP=175, LF%=90.3%, Brd-Off=JED-ATZ, Classes: P:139, I:4, O:2, U:3, T:5, S:5
2026-01-05 05:44:18 | INFO     | [lf.flight.extracted] SM454 on 10JAN: BKG=164, LF=93.7%
[LF] SM454 10JAN: BKG=164, GRP=139, CAP=175, LF%=93.7%, Brd-Off=JED-ATZ, Classes: P:139, I:4, O:2, U:3, X:5, T:7, W:3, S:1
2026-01-05 05:44:21 | INFO     | [lf.flight.extracted] SM456 on 10JAN: BKG=163, LF=93.1%
[LF] SM456 10JAN: BKG=163, GRP=143, CAP=175, LF%=93.1%, Brd-Off=JED-ATZ, Classes: P:142, E:1, I:4, O:2, U:3, X:5, S:3, V:1, K:2
[LF] Getting WEEKLY/LASTSOLD data for 3 flights
[LF] SM492 10JAN: LASTSOLD=2026-01-04 00:00:00, WEEKLY=6, TODAY=0, YDAY=5
[LF] SM454 10JAN: LASTSOLD=2026-01-04 00:00:00, WEEKLY=10, TODAY=0, YDAY=7
[LF] SM456 10JAN: LASTSOLD=2026-01-01 00:00:00, WEEKLY=5, TODAY=0, YDAY=0
2026-01-05 05:44:38 | INFO     | [SUCCESS] Day 10JAN
2026-01-05 05:44:38 | INFO     | [DAY_START] Processing 09JAN
[LF] Processing JED-ATZ for 09JAN
2026-01-05 05:44:38 | INFO     | [lf.day.start] Processing JED-ATZ for 09JAN
[LF] 09JAN: found 1 direct flights
2026-01-05 05:44:39 | INFO     | [lf.day.flights_found] Found 1 flights on 09JAN
2026-01-05 05:44:41 | INFO     | [lf.flight.extracted] SM492 on 09JAN: BKG=84, LF=48.0%
[LF] SM492 09JAN: BKG=84, GRP=2, CAP=175, LF%=48.0%, Brd-Off=JED-ATZ, Classes: E:2, I:4, O:2, U:3, X:5, T:39, W:21, S:5, V:1, K:2
[LF] Getting WEEKLY/LASTSOLD data for 1 flights
[LF] SM492 09JAN: LASTSOLD=2026-01-04 00:00:00, WEEKLY=39, TODAY=0, YDAY=13
2026-01-05 05:44:46 | INFO     | [SUCCESS] Day 09JAN
2026-01-05 05:44:46 | INFO     | [DAY_START] Processing 08JAN
[LF] Processing JED-ATZ for 08JAN
2026-01-05 05:44:46 | INFO     | [lf.day.start] Processing JED-ATZ for 08JAN
[LF] 08JAN: 1 cancelled flight(s) detected from SN
[LF] 08JAN: found 3 direct flights
2026-01-05 05:44:47 | INFO     | [lf.day.flights_found] Found 3 flights on 08JAN
2026-01-05 05:44:49 | INFO     | [lf.flight.extracted] SM422 on 08JAN: BKG=168, LF=96.0%
[LF] SM422 08JAN: BKG=168, GRP=139, CAP=175, LF%=96.0%, Brd-Off=JED-ATZ, Classes: P:135, E:4, I:9, O:11, U:3, X:1, W:2, S:3
2026-01-05 05:44:53 | INFO     | [lf.flight.extracted] SM454 on 08JAN: BKG=167, LF=95.4%
[LF] SM454 08JAN: BKG=167, GRP=87, CAP=175, LF%=95.4%, Brd-Off=JED-ATZ, Classes: P:86, E:1, I:4, O:2, U:3, X:8, T:38, W:10, S:14, K:1
2026-01-05 05:44:56 | INFO     | [lf.flight.extracted] SM456 on 08JAN: BKG=177, LF=105.4%
[LF] SM456 08JAN: BKG=177, GRP=170, CAP=168, LF%=105.4%, Brd-Off=JED-ATZ, Classes: P:170, I:3, O:1, U:3
[LF] Getting WEEKLY/LASTSOLD data for 3 flights
[LF] SM422 08JAN: LASTSOLD=2025-12-30 00:00:00, WEEKLY=2, TODAY=0, YDAY=0
[LF] SM454 08JAN: LASTSOLD=2026-01-01 00:00:00, WEEKLY=25, TODAY=0, YDAY=0
[LF] SM456 08JAN: LASTSOLD=2025-12-24 00:00:00, WEEKLY=0, TODAY=0, YDAY=0
2026-01-05 05:45:13 | INFO     | [SUCCESS] Day 08JAN
2026-01-05 05:45:13 | INFO     | [DAY_START] Processing 07JAN
[LF] Processing JED-ATZ for 07JAN
2026-01-05 05:45:13 | INFO     | [lf.day.start] Processing JED-ATZ for 07JAN
[LF] 07JAN: found 2 direct flights
2026-01-05 05:45:14 | INFO     | [lf.day.flights_found] Found 2 flights on 07JAN
2026-01-05 05:45:16 | INFO     | [lf.flight.extracted] SM454 on 07JAN: BKG=179, LF=102.3%
[LF] SM454 07JAN: BKG=179, GRP=175, CAP=175, LF%=102.3%, Brd-Off=JED-ATZ, Classes: P:175, E:2, W:1, S:1
2026-01-05 05:45:19 | INFO     | [lf.flight.extracted] SM492 on 07JAN: BKG=183, LF=104.6%
[LF] SM492 07JAN: BKG=183, GRP=179, CAP=175, LF%=104.6%, Brd-Off=JED-ATZ, Classes: P:134, E:45, I:3, O:1
[LF] Getting WEEKLY/LASTSOLD data for 2 flights
[LF] SM454 07JAN: LASTSOLD=2025-12-29 00:00:00, WEEKLY=3, TODAY=0, YDAY=0
[LF] SM492 07JAN: LASTSOLD=2025-12-14 00:00:00, WEEKLY=0, TODAY=0, YDAY=0
2026-01-05 05:45:31 | INFO     | [SUCCESS] Day 07JAN
2026-01-05 05:45:31 | INFO     | [DAY_START] Processing 06JAN
[LF] Processing JED-ATZ for 06JAN
2026-01-05 05:45:31 | INFO     | [lf.day.start] Processing JED-ATZ for 06JAN
[LF] 06JAN: found 2 direct flights
2026-01-05 05:45:32 | INFO     | [lf.day.flights_found] Found 2 flights on 06JAN
2026-01-05 05:45:34 | INFO     | [lf.flight.extracted] SM454 on 06JAN: BKG=178, LF=100.0%
[LF] SM454 06JAN: BKG=178, GRP=177, CAP=178, LF%=100.0%, Brd-Off=JED-ATZ, Classes: P:177, I:1
2026-01-05 05:45:37 | INFO     | [lf.flight.extracted] SM456 on 06JAN: BKG=180, LF=102.9%
[LF] SM456 06JAN: BKG=180, GRP=180, CAP=175, LF%=102.9%, Brd-Off=JED-ATZ, Classes: P:180
[LF] Getting WEEKLY/LASTSOLD data for 2 flights
[LF] SM454 06JAN: LASTSOLD=2025-11-19 00:00:00, WEEKLY=0, TODAY=0, YDAY=0
[LF] SM456 06JAN: LASTSOLD=2025-11-12 00:00:00, WEEKLY=0, TODAY=0, YDAY=0
2026-01-05 05:45:48 | INFO     | [SUCCESS] Day 06JAN
[LF] Skipping 05JAN (Today) - will be processed by supplement scan
[LF] Results summary:
  2026-01-13: 2 flights
  2026-01-12: 3 flights
  2026-01-11: 2 flights
  2026-01-10: 3 flights
  2026-01-09: 1 flights
  2026-01-08: 3 flights
  2026-01-07: 2 flights
  2026-01-06: 2 flights
[LF] Cancelled flights found: 1
  - SM492 08JAN (SN)
2026-01-05 05:45:48 | INFO     | [SUCCESS] LF Search Complete
[Worker_9226] Cancelled flights collected: 1

============================================================
[Worker_9226] ✓ COMPLETED: JED-ATZ
  Results: 8 dates
  Errors: 0 dates
  Total Processed: 3 groups
============================================================

2026-01-05 05:45:50 | INFO     | [Worker_9226] Completed: JED-ATZ - 8 results, 0 errors
[Worker_9226] Waiting for tasks...

============================================================
[Worker_9226] Shutdown signal received
Exiting...
============================================================
2026-01-05 05:51:26 | INFO     | [Worker_9226] Shutdown signal received, exiting...

============================================================
[Worker_9226] FINISHED
  Total Groups Processed: 3
============================================================

2026-01-05 05:51:26 | INFO     | [Worker_9226] Finished. Processed 3 groups.
