
============================================================
     LF WORKER - PORT 9233
============================================================
Worker: Worker_9233
Status: READY
Waiting for tasks...
============================================================


============================================================
[Worker_9233] Processing: HBE-JED
  Tier 0: Range 2, Chunk 1/2
  Dates: 7 days
  Date Range: 2026-01-20 to 2026-01-14
============================================================

2025-12-26 16:06:00 | INFO     | ======================================================================
2025-12-26 16:06:00 | INFO     | Load Factor Scraper Started - Route: HBE-JED
2025-12-26 16:06:00 | INFO     | Log file: D:\CODERED\LAB\market_insights\outputs\logs\LF_HBE-JED_20251226_160600.log
2025-12-26 16:06:00 | INFO     | Enhanced logging: Capturing both logging.info() and print()
2025-12-26 16:06:00 | INFO     | ======================================================================
[LF] Processing dates (override): ['20JAN', '19JAN', '18JAN', '17JAN', '16JAN', '15JAN', '14JAN']
[LF] Attaching to Chrome for Altea access
[LF][[OK] SUCCESS] Connected to Chrome on 127.0.0.1:9233 (after 1 attempts)
[LF][[OK] SUCCESS] Found Amadeus Altea window: Altéa Reservation Desktop
[LF][[INFO] INFO] URL: https://tc212.resdesktop.altea.amadeus.com/app_ard/apf/init/login?SITE=ESMPESMP&LANGUAGE=GB&MARKETS=ARDW_PROD_WBP&ACTION=clpLogin
[LF] Processing HBE-JED for 20JAN
[LF][ERROR] Amadeus command error detected: UNKNOWN TRANSACTION
[LF][ERROR] Command: SN20JANHBEJED/ASM
[LF][RESYNC] Triggering immediate resync to last successful SN command
============================================================
[LF][RESYNC] Command 'SN20JANHBEJED/ASM' failed: TECH_ERROR:UNKNOWN TRANSACTION
[LF][RESYNC] Re-running entire day from SN command for HBE-JED 20JAN
[LF][RESYNC] Attempt 1/50 (waiting 1.0s before retry...)
============================================================
[LF][RESYNC] Sending IG to clear session state...
[LF][RESYNC] Session cleared with IG
[LF] Processing HBE-JED for 20JAN
[LF] 20JAN: found 1 direct flights
[LF][ERROR] Amadeus command error detected: REQUESTED DISPLAY NOT AVAILABLE
[LF][ERROR] Command: M
[LF][RESYNC] Triggering immediate resync to last successful SN command
============================================================
[LF][RESYNC] Command 'M' failed: TECH_ERROR:REQUESTED DISPLAY NOT AVAILABLE
[LF][RESYNC] Re-running entire day from SN command for HBE-JED 20JAN
[LF][RESYNC] Attempt 2/50 (waiting 1.0s before retry...)
============================================================
[LF][RESYNC] Sending IG to clear session state...
[LF][RESYNC] Session cleared with IG
[LF] Processing HBE-JED for 20JAN
[LF] 20JAN: found 1 direct flights
[LF] SM451 20JAN: BKG=163, GRP=135, CAP=179, LF%=91.1%, Brd-Off=HBE-JED, Classes: P:135, I:4, X:10, T:6, W:6, K:2
[LF] Getting WEEKLY/LASTSOLD data for 1 flights
[LF] SM451 20JAN: LASTSOLD=2025-12-24 00:00:00, WEEKLY=20, TODAY=0, YDAY=0
[LF] Processing HBE-JED for 19JAN
[LF] 19JAN: found 2 direct flights
[LF] SM457 19JAN: BKG=152, GRP=135, CAP=179, LF%=84.9%, Brd-Off=HBE-JED, Classes: P:135, X:10, T:6, K:1
[LF] SM451 19JAN: BKG=162, GRP=135, CAP=179, LF%=90.5%, Brd-Off=HBE-JED, Classes: P:135, X:10, T:9, W:3, S:1, K:4
[LF] Getting WEEKLY/LASTSOLD data for 2 flights
[LF] SM457 19JAN: LASTSOLD=2025-12-25 00:00:00, WEEKLY=8, TODAY=0, YDAY=4
[LF] SM451 19JAN: LASTSOLD=2025-12-26 00:00:00, WEEKLY=16, TODAY=4, YDAY=4
[LF] Processing HBE-JED for 18JAN
[LF] 18JAN: found 2 direct flights
[LF] SM451 18JAN: BKG=170, GRP=135, CAP=179, LF%=95.0%, Brd-Off=HBE-JED, Classes: P:135, X:10, T:9, W:16
[LF] SM457 18JAN: BKG=163, GRP=135, CAP=179, LF%=91.1%, Brd-Off=HBE-JED, Classes: P:135, X:10, T:7, W:11
[LF] Getting WEEKLY/LASTSOLD data for 2 flights
[LF] SM451 18JAN: LASTSOLD=2025-12-25 00:00:00, WEEKLY=13, TODAY=0, YDAY=6
[LF] SM457 18JAN: LASTSOLD=2025-12-25 00:00:00, WEEKLY=13, TODAY=0, YDAY=3
[LF] Processing HBE-JED for 17JAN
[LF] 17JAN: found 2 direct flights
[LF] SM457 17JAN: BKG=162, GRP=138, CAP=179, LF%=90.5%, Brd-Off=HBE-JED, Classes: P:138, W:10, S:8, L:5, K:1
[LF] SM451 17JAN: BKG=178, GRP=135, CAP=179, LF%=99.4%, Brd-Off=HBE-JED, Classes: P:135, X:3, W:9, S:21, G:3, L:3, V:3, K:1
[LF] Getting WEEKLY/LASTSOLD data for 2 flights
[LF] SM457 17JAN: LASTSOLD=2025-12-23 00:00:00, WEEKLY=4, TODAY=0, YDAY=0
[LF] SM451 17JAN: LASTSOLD=2025-12-18 00:00:00, WEEKLY=0, TODAY=0, YDAY=0
[LF] Processing HBE-JED for 16JAN
[LF] 16JAN: found 1 direct flights
[LF] SM451 16JAN: BKG=42, GRP=0, CAP=179, LF%=23.5%, Brd-Off=HBE-JED, Classes: T:5, G:10, L:13, V:9, K:5
[LF] Getting WEEKLY/LASTSOLD data for 1 flights
[LF] SM451 16JAN: LASTSOLD=2025-12-25 00:00:00, WEEKLY=15, TODAY=0, YDAY=2
[LF] Processing HBE-JED for 15JAN
[LF] 15JAN: found 1 direct flights
[LF] SM451 15JAN: BKG=161, GRP=135, CAP=179, LF%=89.9%, Brd-Off=HBE-JED, Classes: P:135, X:10, T:8, L:8
[LF] Getting WEEKLY/LASTSOLD data for 1 flights
[LF] SM451 15JAN: LASTSOLD=2025-12-25 00:00:00, WEEKLY=8, TODAY=0, YDAY=4
[LF] Processing HBE-JED for 14JAN
[LF] 14JAN: found 3 direct flights
[LF] SM451 14JAN: BKG=150, GRP=135, CAP=179, LF%=83.8%, Brd-Off=HBE-JED, Classes: P:135, I:3, O:3, U:3, X:2, W:3, S:1
[LF] SM457 14JAN: BKG=147, GRP=135, CAP=179, LF%=82.1%, Brd-Off=HBE-JED, Classes: P:135, X:8, T:3, L:1
[LF] SM473 14JAN: BKG=180, GRP=170, CAP=179, LF%=100.6%, Brd-Off=HBE-JED, Classes: P:170, X:9, L:1
[LF] Getting WEEKLY/LASTSOLD data for 3 flights
[LF] SM451 14JAN: LASTSOLD=2025-12-26 00:00:00, WEEKLY=2, TODAY=1, YDAY=1
[LF] SM457 14JAN: LASTSOLD=2025-12-21 00:00:00, WEEKLY=1, TODAY=0, YDAY=0
[LF] SM473 14JAN: LASTSOLD=2025-12-21 00:00:00, WEEKLY=1, TODAY=0, YDAY=0
[LF] Results summary:
  2026-01-20: 1 flights
  2026-01-19: 2 flights
  2026-01-18: 2 flights
  2026-01-17: 2 flights
  2026-01-16: 1 flights
  2026-01-15: 1 flights
  2026-01-14: 3 flights

============================================================
[Worker_9233] ✓ COMPLETED: HBE-JED
  Results: 7 dates
  Errors: 0 dates
  Total Processed: 1 groups
============================================================


============================================================
[Worker_9233] Processing: HBE-JED
  Tier 0: Range 2, Chunk 2/2
  Dates: 6 days
  Date Range: 2026-01-13 to 2026-01-08
============================================================

2025-12-26 16:07:40 | INFO     | ======================================================================
2025-12-26 16:07:40 | INFO     | Load Factor Scraper Started - Route: HBE-JED
2025-12-26 16:07:40 | INFO     | Log file: D:\CODERED\LAB\market_insights\outputs\logs\LF_HBE-JED_20251226_160740.log
2025-12-26 16:07:40 | INFO     | Enhanced logging: Capturing both logging.info() and print()
2025-12-26 16:07:40 | INFO     | ======================================================================
[LF] Processing dates (override): ['13JAN', '12JAN', '11JAN', '10JAN', '09JAN', '08JAN']
[LF] Attaching to Chrome for Altea access
2025-12-26 16:07:40 | INFO     | Starting LF search for route: HBE-JED
2025-12-26 16:07:40 | INFO     | [START] LF Search
[LF][[OK] SUCCESS] Connected to Chrome on 127.0.0.1:9233 (after 1 attempts)
2025-12-26 16:07:41 | INFO     | [HEALTH CHECK] [OK] Chrome connection is healthy
[LF][[OK] SUCCESS] Found Amadeus Altea window: Altéa Reservation Desktop
[LF][[INFO] INFO] URL: https://tc212.resdesktop.altea.amadeus.com/app_ard/apf/init/login?SITE=ESMPESMP&LANGUAGE=GB&MARKETS=ARDW_PROD_WBP&ACTION=clpLogin
2025-12-26 16:07:41 | INFO     | [DAY_START] Processing 13JAN
[LF] Processing HBE-JED for 13JAN
2025-12-26 16:07:41 | INFO     | [lf.day.start] Processing HBE-JED for 13JAN
[LF] 13JAN: found 1 direct flights
2025-12-26 16:07:42 | INFO     | [lf.day.flights_found] Found 1 flights on 13JAN
2025-12-26 16:07:44 | INFO     | [lf.flight.extracted] SM451 on 13JAN: BKG=148, LF=82.7%
[LF] SM451 13JAN: BKG=148, GRP=140, CAP=179, LF%=82.7%, Brd-Off=HBE-JED, Classes: P:140, X:3, W:5
[LF] Getting WEEKLY/LASTSOLD data for 1 flights
[LF] SM451 13JAN: LASTSOLD=2025-12-26 00:00:00, WEEKLY=6, TODAY=2, YDAY=1
2025-12-26 16:07:47 | INFO     | [SUCCESS] Day 13JAN
2025-12-26 16:07:47 | INFO     | [DAY_START] Processing 12JAN
[LF] Processing HBE-JED for 12JAN
2025-12-26 16:07:47 | INFO     | [lf.day.start] Processing HBE-JED for 12JAN
[LF] 12JAN: found 2 direct flights
2025-12-26 16:07:48 | INFO     | [lf.day.flights_found] Found 2 flights on 12JAN
2025-12-26 16:07:50 | INFO     | [lf.flight.extracted] SM457 on 12JAN: BKG=177, LF=98.9%
[LF] SM457 12JAN: BKG=177, GRP=170, CAP=179, LF%=98.9%, Brd-Off=HBE-JED, Classes: P:170, X:7
2025-12-26 16:07:53 | INFO     | [lf.flight.extracted] SM451 on 12JAN: BKG=150, LF=83.8%
[LF] SM451 12JAN: BKG=150, GRP=135, CAP=179, LF%=83.8%, Brd-Off=HBE-JED, Classes: P:135, X:10, T:2, W:1, S:2
[LF] Getting WEEKLY/LASTSOLD data for 2 flights
[LF] SM457 12JAN: LASTSOLD=2025-12-18 00:00:00, WEEKLY=0, TODAY=0, YDAY=0
[LF] SM451 12JAN: LASTSOLD=2025-12-25 00:00:00, WEEKLY=12, TODAY=0, YDAY=4
2025-12-26 16:07:57 | INFO     | [SUCCESS] Day 12JAN
2025-12-26 16:07:57 | INFO     | [DAY_START] Processing 11JAN
[LF] Processing HBE-JED for 11JAN
2025-12-26 16:07:57 | INFO     | [lf.day.start] Processing HBE-JED for 11JAN
[LF] 11JAN: found 2 direct flights
2025-12-26 16:07:58 | INFO     | [lf.day.flights_found] Found 2 flights on 11JAN
2025-12-26 16:07:59 | INFO     | [lf.flight.extracted] SM451 on 11JAN: BKG=148, LF=82.7%
[LF] SM451 11JAN: BKG=148, GRP=135, CAP=179, LF%=82.7%, Brd-Off=HBE-JED, Classes: P:135, X:12, T:1
2025-12-26 16:08:03 | INFO     | [lf.flight.extracted] SM457 on 11JAN: BKG=148, LF=82.7%
[LF] SM457 11JAN: BKG=148, GRP=135, CAP=179, LF%=82.7%, Brd-Off=HBE-JED, Classes: P:135, X:13
[LF] Getting WEEKLY/LASTSOLD data for 2 flights
[LF] SM451 11JAN: LASTSOLD=2025-12-25 00:00:00, WEEKLY=4, TODAY=0, YDAY=4
[LF] SM457 11JAN: LASTSOLD=2025-12-25 00:00:00, WEEKLY=12, TODAY=0, YDAY=3
2025-12-26 16:08:06 | INFO     | [SUCCESS] Day 11JAN
2025-12-26 16:08:06 | INFO     | [DAY_START] Processing 10JAN
[LF] Processing HBE-JED for 10JAN
2025-12-26 16:08:06 | INFO     | [lf.day.start] Processing HBE-JED for 10JAN
[LF] 10JAN: found 2 direct flights
2025-12-26 16:08:07 | INFO     | [lf.day.flights_found] Found 2 flights on 10JAN
2025-12-26 16:08:09 | INFO     | [lf.flight.extracted] SM457 on 10JAN: BKG=135, LF=75.4%
[LF] SM457 10JAN: BKG=135, GRP=125, CAP=179, LF%=75.4%, Brd-Off=HBE-JED, Classes: P:125, X:10
2025-12-26 16:08:12 | INFO     | [lf.flight.extracted] SM451 on 10JAN: BKG=153, LF=85.5%
[LF] SM451 10JAN: BKG=153, GRP=135, CAP=179, LF%=85.5%, Brd-Off=HBE-JED, Classes: P:135, X:10, T:5, W:1, G:2
[LF] Getting WEEKLY/LASTSOLD data for 2 flights
[LF] SM457 10JAN: LASTSOLD=2025-12-11 00:00:00, WEEKLY=0, TODAY=0, YDAY=0
[LF] SM451 10JAN: LASTSOLD=2025-12-24 00:00:00, WEEKLY=2, TODAY=0, YDAY=0
2025-12-26 16:08:18 | INFO     | [SUCCESS] Day 10JAN
2025-12-26 16:08:18 | INFO     | [DAY_START] Processing 09JAN
[LF] Processing HBE-JED for 09JAN
2025-12-26 16:08:18 | INFO     | [lf.day.start] Processing HBE-JED for 09JAN
[LF] 09JAN: found 1 direct flights
2025-12-26 16:08:19 | INFO     | [lf.day.flights_found] Found 1 flights on 09JAN
2025-12-26 16:08:22 | INFO     | [lf.flight.extracted] SM451 on 09JAN: BKG=59, LF=33.0%
[LF] SM451 09JAN: BKG=59, GRP=0, CAP=179, LF%=33.0%, Brd-Off=HBE-JED, Classes: I:15, O:15, U:24, X:3, T:1, K:1
[LF] Getting WEEKLY/LASTSOLD data for 1 flights
[LF] SM451 09JAN: LASTSOLD=2025-12-25 00:00:00, WEEKLY=13, TODAY=0, YDAY=1
2025-12-26 16:08:26 | INFO     | [SUCCESS] Day 09JAN
2025-12-26 16:08:26 | INFO     | [DAY_START] Processing 08JAN
[LF] Processing HBE-JED for 08JAN
2025-12-26 16:08:26 | INFO     | [lf.day.start] Processing HBE-JED for 08JAN
[LF] 08JAN: found 1 direct flights
2025-12-26 16:08:27 | INFO     | [lf.day.flights_found] Found 1 flights on 08JAN
2025-12-26 16:08:29 | INFO     | [lf.flight.extracted] SM451 on 08JAN: BKG=159, LF=88.8%
[LF] SM451 08JAN: BKG=159, GRP=138, CAP=179, LF%=88.8%, Brd-Off=HBE-JED, Classes: N:1, P:138, I:1, X:13, T:3, S:1, K:2
[LF] Getting WEEKLY/LASTSOLD data for 1 flights
[LF] SM451 08JAN: LASTSOLD=2025-12-25 00:00:00, WEEKLY=9, TODAY=0, YDAY=5
2025-12-26 16:08:32 | INFO     | [SUCCESS] Day 08JAN
[LF] Results summary:
  2026-01-13: 1 flights
  2026-01-12: 2 flights
  2026-01-11: 2 flights
  2026-01-10: 2 flights
  2026-01-09: 1 flights
  2026-01-08: 1 flights
2025-12-26 16:08:32 | INFO     | [SUCCESS] LF Search Complete

============================================================
[Worker_9233] ✓ COMPLETED: HBE-JED
  Results: 6 dates
  Errors: 0 dates
  Total Processed: 2 groups
============================================================

2025-12-26 16:08:32 | INFO     | [Worker_9233] Completed: HBE-JED - 6 results, 0 errors

============================================================
[Worker_9233] Processing: ATZ-MED
  Tier 0: Range 1, Chunk 1/2
  Dates: 6 days
  Date Range: 2026-01-07 to 2026-01-02
============================================================

2025-12-26 16:08:32 | INFO     | [Worker_9233] Processing: ATZ-MED
2025-12-26 16:08:32 | INFO     |   Tier 0: Range 1, Chunk 1/2 (6 days)
2025-12-26 16:08:32 | INFO     | ======================================================================
2025-12-26 16:08:32 | INFO     | Load Factor Scraper Started - Route: ATZ-MED
2025-12-26 16:08:32 | INFO     | Log file: D:\CODERED\LAB\market_insights\outputs\logs\LF_ATZ-MED_20251226_160832.log
2025-12-26 16:08:32 | INFO     | Enhanced logging: Capturing both logging.info() and print()
2025-12-26 16:08:32 | INFO     | ======================================================================
[LF] Processing dates (override): ['07JAN', '06JAN', '05JAN', '04JAN', '03JAN', '02JAN']
[LF] Attaching to Chrome for Altea access
2025-12-26 16:08:32 | INFO     | Starting LF search for route: ATZ-MED
2025-12-26 16:08:32 | INFO     | [START] LF Search
[LF][[OK] SUCCESS] Connected to Chrome on 127.0.0.1:9233 (after 1 attempts)
2025-12-26 16:08:33 | INFO     | [HEALTH CHECK] [OK] Chrome connection is healthy
[LF][[OK] SUCCESS] Found Amadeus Altea window: Altéa Reservation Desktop
[LF][[INFO] INFO] URL: https://tc212.resdesktop.altea.amadeus.com/app_ard/apf/init/login?SITE=ESMPESMP&LANGUAGE=GB&MARKETS=ARDW_PROD_WBP&ACTION=clpLogin
2025-12-26 16:08:33 | INFO     | [DAY_START] Processing 07JAN
[LF] Processing ATZ-MED for 07JAN
2025-12-26 16:08:33 | INFO     | [lf.day.start] Processing ATZ-MED for 07JAN
[LF] 07JAN: found 1 direct flights
2025-12-26 16:08:34 | INFO     | [lf.day.flights_found] Found 1 flights on 07JAN
2025-12-26 16:08:36 | INFO     | [lf.flight.extracted] SM489 on 07JAN: BKG=170, LF=95.0%
[LF] SM489 07JAN: BKG=170, GRP=135, CAP=179, LF%=95.0%, Brd-Off=ATZ-MED, Classes: P:135, I:9, O:9, U:6, X:10, Y:1
[LF] Getting WEEKLY/LASTSOLD data for 1 flights
[LF] SM489 07JAN: LASTSOLD=2025-12-25 00:00:00, WEEKLY=21, TODAY=0, YDAY=3
2025-12-26 16:08:39 | INFO     | [SUCCESS] Day 07JAN
2025-12-26 16:08:39 | INFO     | [DAY_START] Processing 06JAN
[LF] Processing ATZ-MED for 06JAN
2025-12-26 16:08:39 | INFO     | [lf.day.start] Processing ATZ-MED for 06JAN
[LF] 06JAN: found 1 direct flights
2025-12-26 16:08:40 | INFO     | [lf.day.flights_found] Found 1 flights on 06JAN
2025-12-26 16:08:42 | INFO     | [lf.flight.extracted] SM487 on 06JAN: BKG=28, LF=15.6%
[LF] SM487 06JAN: BKG=28, GRP=0, CAP=179, LF%=15.6%, Brd-Off=ATZ-MED, Classes: I:19, O:7, U:2
[LF] Getting WEEKLY/LASTSOLD data for 1 flights
[LF] SM487 06JAN: LASTSOLD=2025-12-25 00:00:00, WEEKLY=19, TODAY=0, YDAY=1
2025-12-26 16:08:45 | INFO     | [SUCCESS] Day 06JAN
2025-12-26 16:08:45 | INFO     | [DAY_START] Processing 05JAN
[LF] Processing ATZ-MED for 05JAN
2025-12-26 16:08:45 | INFO     | [lf.day.start] Processing ATZ-MED for 05JAN
[LF] 05JAN: found 1 direct flights
2025-12-26 16:08:46 | INFO     | [lf.day.flights_found] Found 1 flights on 05JAN
2025-12-26 16:08:48 | INFO     | [lf.flight.extracted] SM487 on 05JAN: BKG=46, LF=25.7%
[LF] SM487 05JAN: BKG=46, GRP=0, CAP=179, LF%=25.7%, Brd-Off=ATZ-MED, Classes: I:19, O:15, U:5, X:6, K:1
[LF] Getting WEEKLY/LASTSOLD data for 1 flights
[LF] SM487 05JAN: LASTSOLD=2025-12-25 00:00:00, WEEKLY=10, TODAY=0, YDAY=1
2025-12-26 16:08:52 | INFO     | [SUCCESS] Day 05JAN
2025-12-26 16:08:52 | INFO     | [DAY_START] Processing 04JAN
[LF] Processing ATZ-MED for 04JAN
2025-12-26 16:08:52 | INFO     | [lf.day.start] Processing ATZ-MED for 04JAN
[LF] No direct flights on 04JAN for ATZ-MED
2025-12-26 16:08:54 | WARNING  | [lf.day.no_flights] No direct flights on 04JAN
2025-12-26 16:08:54 | INFO     | [SUCCESS] Day 04JAN
2025-12-26 16:08:54 | INFO     | [DAY_START] Processing 03JAN
[LF] Processing ATZ-MED for 03JAN
2025-12-26 16:08:54 | INFO     | [lf.day.start] Processing ATZ-MED for 03JAN
[LF] 03JAN: found 1 direct flights
2025-12-26 16:08:55 | INFO     | [lf.day.flights_found] Found 1 flights on 03JAN
2025-12-26 16:08:58 | INFO     | [lf.flight.extracted] SM487 on 03JAN: BKG=83, LF=46.4%
[LF] SM487 03JAN: BKG=83, GRP=45, CAP=179, LF%=46.4%, Brd-Off=ATZ-MED, Classes: P:45, I:9, O:15, U:11, X:3
[LF] Getting WEEKLY/LASTSOLD data for 1 flights
[LF] SM487 03JAN: LASTSOLD=2025-12-25 00:00:00, WEEKLY=17, TODAY=0, YDAY=5
2025-12-26 16:09:03 | INFO     | [SUCCESS] Day 03JAN
2025-12-26 16:09:03 | INFO     | [DAY_START] Processing 02JAN
[LF] Processing ATZ-MED for 02JAN
2025-12-26 16:09:03 | INFO     | [lf.day.start] Processing ATZ-MED for 02JAN
[LF] No direct flights on 02JAN for ATZ-MED
2025-12-26 16:09:05 | WARNING  | [lf.day.no_flights] No direct flights on 02JAN
2025-12-26 16:09:05 | INFO     | [SUCCESS] Day 02JAN
[LF] Results summary:
  2026-01-07: 1 flights
  2026-01-06: 1 flights
  2026-01-05: 1 flights
  2026-01-04: 0 flights
  2026-01-03: 1 flights
  2026-01-02: 0 flights
2025-12-26 16:09:05 | INFO     | [SUCCESS] LF Search Complete

============================================================
[Worker_9233] ✓ COMPLETED: ATZ-MED
  Results: 6 dates
  Errors: 0 dates
  Total Processed: 3 groups
============================================================

2025-12-26 16:09:05 | INFO     | [Worker_9233] Completed: ATZ-MED - 6 results, 0 errors

============================================================
[Worker_9233] Processing: JED-CAI
  Tier 0: Range 1, Chunk 2/2
  Dates: 6 days
  Date Range: 2026-01-01 to 2025-12-27
============================================================

2025-12-26 16:09:05 | INFO     | [Worker_9233] Processing: JED-CAI
2025-12-26 16:09:05 | INFO     |   Tier 0: Range 1, Chunk 2/2 (6 days)
2025-12-26 16:09:05 | INFO     | ======================================================================
2025-12-26 16:09:05 | INFO     | Load Factor Scraper Started - Route: JED-CAI
2025-12-26 16:09:05 | INFO     | Log file: D:\CODERED\LAB\market_insights\outputs\logs\LF_JED-CAI_20251226_160905.log
2025-12-26 16:09:05 | INFO     | Enhanced logging: Capturing both logging.info() and print()
2025-12-26 16:09:05 | INFO     | ======================================================================
[LF] Processing dates (override): ['01JAN', '31DEC', '30DEC', '29DEC', '28DEC', '27DEC']
[LF] Attaching to Chrome for Altea access
2025-12-26 16:09:05 | INFO     | Starting LF search for route: JED-CAI
2025-12-26 16:09:05 | INFO     | [START] LF Search
[LF][[OK] SUCCESS] Connected to Chrome on 127.0.0.1:9233 (after 1 attempts)
2025-12-26 16:09:06 | INFO     | [HEALTH CHECK] [OK] Chrome connection is healthy
[LF][[OK] SUCCESS] Found Amadeus Altea window: Altéa Reservation Desktop
[LF][[INFO] INFO] URL: https://tc212.resdesktop.altea.amadeus.com/app_ard/apf/init/login?SITE=ESMPESMP&LANGUAGE=GB&MARKETS=ARDW_PROD_WBP&ACTION=clpLogin
2025-12-26 16:09:06 | INFO     | [DAY_START] Processing 01JAN
[LF] Processing JED-CAI for 01JAN
2025-12-26 16:09:06 | INFO     | [lf.day.start] Processing JED-CAI for 01JAN
[LF] 01JAN: found 7 direct flights
2025-12-26 16:09:08 | INFO     | [lf.day.flights_found] Found 7 flights on 01JAN
2025-12-26 16:09:16 | INFO     | [lf.flight.extracted] SM424 on 01JAN: BKG=23, LF=13.8%
[LF] SM424 01JAN: BKG=23, GRP=0, CAP=167, LF%=13.8%, Brd-Off=JED-CAI, Classes: U:20, X:3
[LPC] SM424 01JAN: Found 1 outbound flights with connecting passengers
2025-12-26 16:09:22 | INFO     | [lf.flight.extracted] SM472 on 01JAN: BKG=83, LF=50.6%
[LF] SM472 01JAN: BKG=83, GRP=51, CAP=164, LF%=50.6%, Brd-Off=JED-CAI, Classes: P:51, U:20, X:6, S:6
[LPC] SM472 01JAN: Found 1 outbound flights with connecting passengers
2025-12-26 16:09:28 | INFO     | [lf.flight.extracted] SM450 on 01JAN: BKG=179, LF=107.2%
[LF] SM450 01JAN: BKG=179, GRP=175, CAP=167, LF%=107.2%, Brd-Off=JED-CAI, Classes: N:5, P:46, E:125, U:3
[LPC] SM450 01JAN: Found 1 outbound flights with connecting passengers
2025-12-26 16:09:44 | INFO     | [lf.flight.extracted] SM476 on 01JAN: BKG=168, LF=96.5%
[LF] SM476 01JAN: BKG=168, GRP=128, CAP=174, LF%=96.5%, Brd-Off=JED-CAI, Classes: P:88, E:40, I:5, O:5, U:18, X:8, W:1, S:3
[LPC] SM476 01JAN: Found 3 outbound flights with connecting passengers
2025-12-26 16:09:53 | INFO     | [lf.flight.extracted] SM432 on 01JAN: BKG=0, LF=0.0%
[LF] SM432 01JAN: BKG=0, GRP=0, CAP=167, LF%=0.0%, Brd-Off=JED-ATZ
2025-12-26 16:10:14 | INFO     | [lf.flight.extracted] SM478 on 01JAN: BKG=160, LF=97.6%
[LF] SM478 01JAN: BKG=160, GRP=128, CAP=164, LF%=97.6%, Brd-Off=JED-CAI, Classes: P:128, X:10, T:5, W:11, S:6
[LPC] SM478 01JAN: Found 0 outbound flights with connecting passengers
2025-12-26 16:10:20 | INFO     | [lf.flight.extracted] SM480 on 01JAN: BKG=168, LF=94.4%
[LF] SM480 01JAN: BKG=168, GRP=139, CAP=178, LF%=94.4%, Brd-Off=JED-CAI, Classes: N:6, P:139, X:8, T:2, W:1, S:3, K:9
[LF] Getting WEEKLY/LASTSOLD data for 6 flights
[LF] SM424 01JAN: LASTSOLD=2025-12-26 00:00:00, WEEKLY=10, TODAY=1, YDAY=5
[LF] SM472 01JAN: LASTSOLD=2025-12-26 00:00:00, WEEKLY=17, TODAY=6, YDAY=4
[LF] SM450 01JAN: LASTSOLD=2025-12-21 00:00:00, WEEKLY=47, TODAY=0, YDAY=0
[LF] SM476 01JAN: LASTSOLD=2025-12-23 00:00:00, WEEKLY=28, TODAY=0, YDAY=0
[LF] SM478 01JAN: LASTSOLD=2025-12-26 00:00:00, WEEKLY=23, TODAY=2, YDAY=2
[LF] SM480 01JAN: LASTSOLD=2025-12-26 00:00:00, WEEKLY=3, TODAY=1, YDAY=0
2025-12-26 16:10:51 | INFO     | [SUCCESS] Day 01JAN
2025-12-26 16:10:51 | INFO     | [DAY_START] Processing 31DEC
[LF] Processing JED-CAI for 31DEC
2025-12-26 16:10:51 | INFO     | [lf.day.start] Processing JED-CAI for 31DEC
[LF] 31DEC: found 3 direct flights
2025-12-26 16:10:53 | INFO     | [lf.day.flights_found] Found 3 flights on 31DEC
2025-12-26 16:10:55 | INFO     | [lf.flight.extracted] SM476 on 31DEC: BKG=175, LF=98.3%
[LF] SM476 31DEC: BKG=175, GRP=132, CAP=178, LF%=98.3%, Brd-Off=JED-CAI, Classes: P:132, I:10, O:10, U:21, X:2
2025-12-26 16:11:00 | INFO     | [lf.flight.extracted] SM460 on 31DEC: BKG=119, LF=66.8%
[LF] SM460 31DEC: BKG=119, GRP=42, CAP=178, LF%=66.8%, Brd-Off=JED-CAI, Classes: P:42, I:10, O:10, U:21, X:24, T:3, W:1, S:8
[LPC] SM460 31DEC: Found 4 outbound flights with connecting passengers
2025-12-26 16:11:05 | INFO     | [lf.flight.extracted] SM478 on 31DEC: BKG=165, LF=92.7%
[LF] SM478 31DEC: BKG=165, GRP=100, CAP=178, LF%=92.7%, Brd-Off=JED-CAI, Classes: P:100, I:10, O:10, U:21, X:17, S:6, G:1
[LF] Getting WEEKLY/LASTSOLD data for 3 flights
[LF] SM476 31DEC: LASTSOLD=2025-12-25 00:00:00, WEEKLY=10, TODAY=0, YDAY=1
[LF] SM460 31DEC: LASTSOLD=2025-12-25 00:00:00, WEEKLY=20, TODAY=0, YDAY=2
[LF] SM478 31DEC: LASTSOLD=2025-12-24 00:00:00, WEEKLY=16, TODAY=0, YDAY=0
2025-12-26 16:11:24 | INFO     | [SUCCESS] Day 31DEC
2025-12-26 16:11:24 | INFO     | [DAY_START] Processing 30DEC
[LF] Processing JED-CAI for 30DEC
2025-12-26 16:11:24 | INFO     | [lf.day.start] Processing JED-CAI for 30DEC
[LF] 30DEC: found 6 direct flights
2025-12-26 16:11:25 | INFO     | [lf.day.flights_found] Found 6 flights on 30DEC
2025-12-26 16:11:27 | INFO     | [lf.flight.extracted] SM472 on 30DEC: BKG=157, LF=88.2%
[LF] SM472 30DEC: BKG=157, GRP=89, CAP=178, LF%=88.2%, Brd-Off=JED-CAI, Classes: P:89, I:20, O:10, U:11, X:8, T:18, K:1
[LPC] SM472 30DEC: Found 2 outbound flights with connecting passengers
2025-12-26 16:11:32 | INFO     | [lf.flight.extracted] SM480 on 30DEC: BKG=175, LF=98.3%
[LF] SM480 30DEC: BKG=175, GRP=141, CAP=178, LF%=98.3%, Brd-Off=JED-CAI, Classes: P:141, I:17, O:11, U:6
2025-12-26 16:11:36 | INFO     | [lf.flight.extracted] SM478 on 30DEC: BKG=170, LF=95.5%
[LF] SM478 30DEC: BKG=170, GRP=123, CAP=178, LF%=95.5%, Brd-Off=JED-CAI, Classes: P:78, E:45, I:21, O:10, U:11, X:4, S:1
[LPC] SM478 30DEC: Found 1 outbound flights with connecting passengers
2025-12-26 16:11:41 | INFO     | [lf.flight.extracted] SM460 on 30DEC: BKG=164, LF=93.7%
[LF] SM460 30DEC: BKG=164, GRP=94, CAP=175, LF%=93.7%, Brd-Off=JED-CAI, Classes: N:1, P:94, I:20, O:10, U:11, X:20, T:2, S:6
2025-12-26 16:11:44 | INFO     | [lf.flight.extracted] SM424 on 30DEC: BKG=174, LF=97.8%
[LF] SM424 30DEC: BKG=174, GRP=133, CAP=178, LF%=97.8%, Brd-Off=JED-CAI, Classes: P:88, E:45, I:20, O:10, U:10, V:1
2025-12-26 16:11:47 | INFO     | [lf.flight.extracted] SM476 on 30DEC: BKG=172, LF=96.6%
[LF] SM476 30DEC: BKG=172, GRP=100, CAP=178, LF%=96.6%, Brd-Off=JED-CAI, Classes: P:101, I:20, O:9, U:11, X:25, T:2, W:1, S:3
[LF] Getting WEEKLY/LASTSOLD data for 6 flights
[LF] SM472 30DEC: LASTSOLD=2025-12-24 00:00:00, WEEKLY=14, TODAY=0, YDAY=0
[LF] SM480 30DEC: LASTSOLD=2025-12-24 00:00:00, WEEKLY=8, TODAY=0, YDAY=0
[LF] SM478 30DEC: LASTSOLD=2025-12-24 00:00:00, WEEKLY=10, TODAY=0, YDAY=0
[LF] SM460 30DEC: LASTSOLD=2025-12-25 00:00:00, WEEKLY=19, TODAY=0, YDAY=1
[LF] SM424 30DEC: LASTSOLD=2025-12-24 00:00:00, WEEKLY=10, TODAY=0, YDAY=0
[LF] SM476 30DEC: LASTSOLD=2025-12-25 00:00:00, WEEKLY=15, TODAY=0, YDAY=2
2025-12-26 16:12:16 | INFO     | [SUCCESS] Day 30DEC
2025-12-26 16:12:16 | INFO     | [DAY_START] Processing 29DEC
[LF] Processing JED-CAI for 29DEC
2025-12-26 16:12:16 | INFO     | [lf.day.start] Processing JED-CAI for 29DEC
[LF] 29DEC: found 4 direct flights
2025-12-26 16:12:17 | INFO     | [lf.day.flights_found] Found 4 flights on 29DEC
2025-12-26 16:12:19 | INFO     | [lf.flight.extracted] SM480 on 29DEC: BKG=99, LF=55.6%
[LF] SM480 29DEC: BKG=99, GRP=0, CAP=178, LF%=55.6%, Brd-Off=JED-CAI, Classes: I:35, O:38, U:16, X:7, S:2, L:1
[LPC] SM480 29DEC: Found 2 outbound flights with connecting passengers
2025-12-26 16:12:23 | INFO     | [lf.flight.extracted] SM476 on 29DEC: BKG=171, LF=96.1%
[LF] SM476 29DEC: BKG=171, GRP=138, CAP=178, LF%=96.1%, Brd-Off=JED-CAI, Classes: P:138, I:20, O:10, S:2, G:1
2025-12-26 16:12:26 | INFO     | [lf.flight.extracted] SM478 on 29DEC: BKG=176, LF=100.6%
[LF] SM478 29DEC: BKG=176, GRP=129, CAP=175, LF%=100.6%, Brd-Off=JED-CAI, Classes: P:129, I:17, O:10, U:11, X:1, T:7, S:1
2025-12-26 16:12:30 | INFO     | [lf.flight.extracted] SM460 on 29DEC: BKG=177, LF=101.1%
[LF] SM460 29DEC: BKG=177, GRP=131, CAP=175, LF%=101.1%, Brd-Off=JED-CAI, Classes: P:131, I:16, O:1, X:1, W:3, S:22, G:3
[LPC] SM460 29DEC: Found 0 outbound flights with connecting passengers
[LF] Getting WEEKLY/LASTSOLD data for 4 flights
[LF] SM480 29DEC: LASTSOLD=2025-12-26 00:00:00, WEEKLY=39, TODAY=1, YDAY=2
[LF] SM476 29DEC: LASTSOLD=2025-12-23 00:00:00, WEEKLY=11, TODAY=0, YDAY=0
[LF] SM478 29DEC: LASTSOLD=2025-12-22 00:00:00, WEEKLY=8, TODAY=0, YDAY=0
[LF] SM460 29DEC: LASTSOLD=2025-12-25 00:00:00, WEEKLY=13, TODAY=0, YDAY=1
2025-12-26 16:12:54 | INFO     | [SUCCESS] Day 29DEC
2025-12-26 16:12:54 | INFO     | [DAY_START] Processing 28DEC
[LF] Processing JED-CAI for 28DEC
2025-12-26 16:12:54 | INFO     | [lf.day.start] Processing JED-CAI for 28DEC
[LF] 28DEC: 1 cancelled flight(s) detected from SN
[LF] 28DEC: found 4 direct flights
2025-12-26 16:12:55 | INFO     | [lf.day.flights_found] Found 4 flights on 28DEC
2025-12-26 16:12:58 | INFO     | [lf.flight.extracted] SM424 on 28DEC: BKG=177, LF=101.1%
[LF] SM424 28DEC: BKG=177, GRP=129, CAP=175, LF%=101.1%, Brd-Off=JED-CAI, Classes: N:2, P:27, E:100, I:25, O:14, U:5, X:1, S:3
[LPC] SM424 28DEC: Found 2 outbound flights with connecting passengers
2025-12-26 16:13:14 | INFO     | [lf.flight.extracted] SM476 on 28DEC: BKG=176, LF=98.9%
[LF] SM476 28DEC: BKG=176, GRP=145, CAP=178, LF%=98.9%, Brd-Off=JED-CAI, Classes: P:96, E:50, I:19, O:10, W:1
2025-12-26 16:13:17 | INFO     | [lf.flight.extracted] SM460 on 28DEC: BKG=177, LF=99.4%
[LF] SM460 28DEC: BKG=177, GRP=130, CAP=178, LF%=99.4%, Brd-Off=JED-CAI, Classes: P:130, I:18, O:10, U:9, X:1, S:9
[LPC] SM460 28DEC: Found 0 outbound flights with connecting passengers
2025-12-26 16:13:22 | INFO     | [lf.flight.extracted] SM478 on 28DEC: BKG=168, LF=94.4%
[LF] SM478 28DEC: BKG=168, GRP=130, CAP=178, LF%=94.4%, Brd-Off=JED-CAI, Classes: P:130, I:20, O:9, U:4, X:2, S:2, L:1
[LF] Getting WEEKLY/LASTSOLD data for 4 flights
[LF] SM424 28DEC: LASTSOLD=2025-12-24 00:00:00, WEEKLY=19, TODAY=0, YDAY=0
[LF] SM476 28DEC: LASTSOLD=2025-12-24 00:00:00, WEEKLY=11, TODAY=0, YDAY=0
[LF] SM460 28DEC: LASTSOLD=2025-12-23 00:00:00, WEEKLY=12, TODAY=0, YDAY=0
[LF] SM478 28DEC: LASTSOLD=2025-12-26 00:00:00, WEEKLY=12, TODAY=2, YDAY=0
2025-12-26 16:13:42 | INFO     | [SUCCESS] Day 28DEC
2025-12-26 16:13:42 | INFO     | [DAY_START] Processing 27DEC
[LF] Processing JED-CAI for 27DEC
2025-12-26 16:13:42 | INFO     | [lf.day.start] Processing JED-CAI for 27DEC
[LF] 27DEC: found 3 direct flights
2025-12-26 16:13:43 | INFO     | [lf.day.flights_found] Found 3 flights on 27DEC
2025-12-26 16:13:45 | INFO     | [lf.flight.extracted] SM450 on 27DEC: BKG=105, LF=59.0%
[LF] SM450 27DEC: BKG=105, GRP=0, CAP=178, LF%=59.0%, Brd-Off=JED-CAI, Classes: I:69, O:24, U:9, W:1, S:2
[LPC] SM450 27DEC: Found 1 outbound flights with connecting passengers
2025-12-26 16:13:49 | INFO     | [lf.flight.extracted] SM476 on 27DEC: BKG=165, LF=92.7%
[LF] SM476 27DEC: BKG=165, GRP=126, CAP=178, LF%=92.7%, Brd-Off=JED-CAI, Classes: P:126, I:16, O:10, U:12, X:1
2025-12-26 16:13:53 | INFO     | [lf.flight.extracted] SM478 on 27DEC: BKG=175, LF=98.3%
[LF] SM478 27DEC: BKG=175, GRP=133, CAP=178, LF%=98.3%, Brd-Off=JED-CAI, Classes: N:4, P:86, E:45, I:10, O:9, U:9, X:1, S:11
[LPC] SM478 27DEC: Found 0 outbound flights with connecting passengers
[LF] Getting WEEKLY/LASTSOLD data for 3 flights
[LF] SM450 27DEC: LASTSOLD=2025-12-26 00:00:00, WEEKLY=67, TODAY=8, YDAY=25
[LF] SM476 27DEC: LASTSOLD=2025-12-23 00:00:00, WEEKLY=10, TODAY=0, YDAY=0
[LF] SM478 27DEC: LASTSOLD=2025-12-24 00:00:00, WEEKLY=5, TODAY=0, YDAY=0
2025-12-26 16:14:09 | INFO     | [SUCCESS] Day 27DEC
[LF] Results summary:
  2026-01-01: 7 flights
  2025-12-31: 3 flights
  2025-12-30: 6 flights
  2025-12-29: 4 flights
  2025-12-28: 4 flights
  2025-12-27: 3 flights
[LF] Cancelled flights found: 1
  - SM432 28DEC (SN)
2025-12-26 16:14:09 | INFO     | [SUCCESS] LF Search Complete
[Worker_9233] Cancelled flights collected: 1

============================================================
[Worker_9233] ✓ COMPLETED: JED-CAI
  Results: 6 dates
  Errors: 0 dates
  Total Processed: 4 groups
============================================================

2025-12-26 16:14:09 | INFO     | [Worker_9233] Completed: JED-CAI - 6 results, 0 errors

============================================================
[Worker_9233] Shutdown signal received
Exiting...
============================================================
2025-12-26 16:14:14 | INFO     | [Worker_9233] Shutdown signal received, exiting...

============================================================
[Worker_9233] FINISHED
  Total Groups Processed: 4
============================================================

2025-12-26 16:14:14 | INFO     | [Worker_9233] Finished. Processed 4 groups.
