
============================================================
     LF WORKER - PORT 9222
============================================================
Worker: Worker_9222
Status: READY
Waiting for tasks...
============================================================


============================================================
[Worker_9222] Processing: CAI-MED
  Tier 0: Range 2, Chunk 1/2
  Dates: 6 days
  Date Range: 2026-01-16 to 2026-01-11
============================================================

2025-12-27 00:04:44 | INFO     | ======================================================================
2025-12-27 00:04:44 | INFO     | Load Factor Scraper Started - Route: CAI-MED
2025-12-27 00:04:44 | INFO     | Log file: D:\CODERED\LAB\market_insights\outputs\logs\LF_CAI-MED_20251227_000444.log
2025-12-27 00:04:44 | INFO     | Enhanced logging: Capturing both logging.info() and print()
2025-12-27 00:04:44 | INFO     | ======================================================================
[LF] Processing dates (override): ['16JAN', '15JAN', '14JAN', '13JAN', '12JAN', '11JAN']
[LF] Attaching to Chrome for Altea access
[LF][[OK] SUCCESS] Connected to Chrome on 127.0.0.1:9222 (after 1 attempts)
[LF][[OK] SUCCESS] Found Amadeus Altea window: Altéa Reservation Desktop
[LF][[INFO] INFO] URL: https://tc212.resdesktop.altea.amadeus.com/app_ard/apf/init/login?SITE=ESMPESMP&LANGUAGE=GB&MARKETS=ARDW_PROD_WBP&ACTION=clpLogin
[LF] Processing CAI-MED for 16JAN
[LF][ERROR] Amadeus command error detected: UNKNOWN TRANSACTION
[LF][ERROR] Command: SN16JANCAIMED/ASM
[LF][RESYNC] Triggering immediate resync to last successful SN command
============================================================
[LF][RESYNC] Command 'SN16JANCAIMED/ASM' failed: TECH_ERROR:UNKNOWN TRANSACTION
[LF][RESYNC] Re-running entire day from SN command for CAI-MED 16JAN
[LF][RESYNC] Attempt 1/50 (waiting 1.0s before retry...)
============================================================
[LF][RESYNC] Sending IG to clear session state...
[LF][RESYNC] Session cleared with IG
[LF] Processing CAI-MED for 16JAN
[LF] No direct flights on 16JAN for CAI-MED
[LF] Processing CAI-MED for 15JAN
[LF] 15JAN: found 1 direct flights
[LF] SM493 15JAN: BKG=165, GRP=135, CAP=179, LF%=92.2%, Brd-Off=CAI-MED, Classes: N:3, P:135, T:10, W:14, S:3
[LF] Getting WEEKLY/LASTSOLD data for 1 flights
[LF] SM493 15JAN: LASTSOLD=2025-12-25 00:00:00, WEEKLY=14, TODAY=0, YDAY=0
[LF] Processing CAI-MED for 14JAN
[LF] No direct flights on 14JAN for CAI-MED
[LF] Processing CAI-MED for 13JAN
[LF] 13JAN: found 1 direct flights
[LF] SM493 13JAN: BKG=146, GRP=140, CAP=179, LF%=81.6%, Brd-Off=CAI-MED, Classes: P:140, I:1, T:5
[LF] Getting WEEKLY/LASTSOLD data for 1 flights
[LF] SM493 13JAN: LASTSOLD=2025-12-24 00:00:00, WEEKLY=4, TODAY=0, YDAY=0
[LF] Processing CAI-MED for 12JAN
[LF] 12JAN: found 1 direct flights
[LF] SM495 12JAN: BKG=139, GRP=135, CAP=176, LF%=79.0%, Brd-Off=CAI-MED, Classes: P:135, X:2, T:2
[LF] Getting WEEKLY/LASTSOLD data for 1 flights
[LF] SM495 12JAN: LASTSOLD=2025-12-24 00:00:00, WEEKLY=2, TODAY=0, YDAY=0
[LF] Processing CAI-MED for 11JAN
[LF] 11JAN: found 1 direct flights
[LF] SM493 11JAN: BKG=148, GRP=145, CAP=176, LF%=84.1%, Brd-Off=CAI-MED, Classes: P:95, E:50, X:1, T:2
[LF] Getting WEEKLY/LASTSOLD data for 1 flights
[LF] SM493 11JAN: LASTSOLD=2025-12-21 00:00:00, WEEKLY=1, TODAY=0, YDAY=0
[LF] Results summary:
  2026-01-16: 0 flights
  2026-01-15: 1 flights
  2026-01-14: 0 flights
  2026-01-13: 1 flights
  2026-01-12: 1 flights
  2026-01-11: 1 flights

============================================================
[Worker_9222] ✓ COMPLETED: CAI-MED
  Results: 6 dates
  Errors: 0 dates
  Total Processed: 1 groups
============================================================


============================================================
[Worker_9222] Processing: ATZ-MED
  Tier 0: Range 2, Chunk 2/2
  Dates: 5 days
  Date Range: 2026-01-10 to 2026-01-06
============================================================

2025-12-27 00:05:20 | INFO     | ======================================================================
2025-12-27 00:05:20 | INFO     | Load Factor Scraper Started - Route: ATZ-MED
2025-12-27 00:05:20 | INFO     | Log file: D:\CODERED\LAB\market_insights\outputs\logs\LF_ATZ-MED_20251227_000520.log
2025-12-27 00:05:20 | INFO     | Enhanced logging: Capturing both logging.info() and print()
2025-12-27 00:05:20 | INFO     | ======================================================================
[LF] Processing dates (override): ['10JAN', '09JAN', '08JAN', '07JAN', '06JAN']
[LF] Attaching to Chrome for Altea access
2025-12-27 00:05:20 | INFO     | Starting LF search for route: ATZ-MED
2025-12-27 00:05:20 | INFO     | [START] LF Search
[LF][[OK] SUCCESS] Connected to Chrome on 127.0.0.1:9222 (after 1 attempts)
2025-12-27 00:05:21 | INFO     | [HEALTH CHECK] [OK] Chrome connection is healthy
[LF][[OK] SUCCESS] Found Amadeus Altea window: Altéa Reservation Desktop
[LF][[INFO] INFO] URL: https://tc212.resdesktop.altea.amadeus.com/app_ard/apf/init/login?SITE=ESMPESMP&LANGUAGE=GB&MARKETS=ARDW_PROD_WBP&ACTION=clpLogin
2025-12-27 00:05:21 | INFO     | [DAY_START] Processing 10JAN
[LF] Processing ATZ-MED for 10JAN
2025-12-27 00:05:21 | INFO     | [lf.day.start] Processing ATZ-MED for 10JAN
[LF] 10JAN: found 1 direct flights
2025-12-27 00:05:22 | INFO     | [lf.day.flights_found] Found 1 flights on 10JAN
2025-12-27 00:05:24 | INFO     | [lf.flight.extracted] SM487 on 10JAN: BKG=115, LF=64.2%
[LF] SM487 10JAN: BKG=115, GRP=90, CAP=179, LF%=64.2%, Brd-Off=ATZ-MED, Classes: P:90, I:19, O:5, X:1
[LF] Getting WEEKLY/LASTSOLD data for 1 flights
[LF] SM487 10JAN: LASTSOLD=2025-12-26 00:00:00, WEEKLY=15, TODAY=0, YDAY=1
2025-12-27 00:05:29 | INFO     | [SUCCESS] Day 10JAN
2025-12-27 00:05:29 | INFO     | [DAY_START] Processing 09JAN
[LF] Processing ATZ-MED for 09JAN
2025-12-27 00:05:29 | INFO     | [lf.day.start] Processing ATZ-MED for 09JAN
[LF] No direct flights on 09JAN for ATZ-MED
2025-12-27 00:05:30 | WARNING  | [lf.day.no_flights] No direct flights on 09JAN
2025-12-27 00:05:30 | INFO     | [SUCCESS] Day 09JAN
2025-12-27 00:05:30 | INFO     | [DAY_START] Processing 08JAN
[LF] Processing ATZ-MED for 08JAN
2025-12-27 00:05:30 | INFO     | [lf.day.start] Processing ATZ-MED for 08JAN
[LF] No direct flights on 08JAN for ATZ-MED
2025-12-27 00:05:31 | WARNING  | [lf.day.no_flights] No direct flights on 08JAN
2025-12-27 00:05:32 | INFO     | [SUCCESS] Day 08JAN
2025-12-27 00:05:32 | INFO     | [DAY_START] Processing 07JAN
[LF] Processing ATZ-MED for 07JAN
2025-12-27 00:05:32 | INFO     | [lf.day.start] Processing ATZ-MED for 07JAN
[LF] 07JAN: found 1 direct flights
2025-12-27 00:05:33 | INFO     | [lf.day.flights_found] Found 1 flights on 07JAN
2025-12-27 00:05:35 | INFO     | [lf.flight.extracted] SM489 on 07JAN: BKG=171, LF=95.5%
[LF] SM489 07JAN: BKG=171, GRP=135, CAP=179, LF%=95.5%, Brd-Off=ATZ-MED, Classes: P:135, I:9, O:9, U:7, X:10, Y:1
[LF] Getting WEEKLY/LASTSOLD data for 1 flights
[LF] SM489 07JAN: LASTSOLD=2025-12-26 00:00:00, WEEKLY=22, TODAY=0, YDAY=1
2025-12-27 00:05:38 | INFO     | [SUCCESS] Day 07JAN
2025-12-27 00:05:38 | INFO     | [DAY_START] Processing 06JAN
[LF] Processing ATZ-MED for 06JAN
2025-12-27 00:05:38 | INFO     | [lf.day.start] Processing ATZ-MED for 06JAN
[LF] 06JAN: found 1 direct flights
2025-12-27 00:05:39 | INFO     | [lf.day.flights_found] Found 1 flights on 06JAN
2025-12-27 00:05:41 | INFO     | [lf.flight.extracted] SM487 on 06JAN: BKG=29, LF=16.2%
[LF] SM487 06JAN: BKG=29, GRP=0, CAP=179, LF%=16.2%, Brd-Off=ATZ-MED, Classes: I:19, O:8, U:2
[LF] Getting WEEKLY/LASTSOLD data for 1 flights
[LF] SM487 06JAN: LASTSOLD=2025-12-26 00:00:00, WEEKLY=16, TODAY=0, YDAY=1
2025-12-27 00:05:45 | INFO     | [SUCCESS] Day 06JAN
[LF] Results summary:
  2026-01-10: 1 flights
  2026-01-09: 0 flights
  2026-01-08: 0 flights
  2026-01-07: 1 flights
  2026-01-06: 1 flights
2025-12-27 00:05:45 | INFO     | [SUCCESS] LF Search Complete

============================================================
[Worker_9222] ✓ COMPLETED: ATZ-MED
  Results: 5 dates
  Errors: 0 dates
  Total Processed: 2 groups
============================================================

2025-12-27 00:05:45 | INFO     | [Worker_9222] Completed: ATZ-MED - 5 results, 0 errors

============================================================
[Worker_9222] Processing: JED-CAI
  Tier 0: Range 1, Chunk 1/2
  Dates: 5 days
  Date Range: 2026-01-05 to 2026-01-01
============================================================

2025-12-27 00:05:45 | INFO     | [Worker_9222] Processing: JED-CAI
2025-12-27 00:05:45 | INFO     |   Tier 0: Range 1, Chunk 1/2 (5 days)
2025-12-27 00:05:45 | INFO     | ======================================================================
2025-12-27 00:05:45 | INFO     | Load Factor Scraper Started - Route: JED-CAI
2025-12-27 00:05:45 | INFO     | Log file: D:\CODERED\LAB\market_insights\outputs\logs\LF_JED-CAI_20251227_000545.log
2025-12-27 00:05:45 | INFO     | Enhanced logging: Capturing both logging.info() and print()
2025-12-27 00:05:45 | INFO     | ======================================================================
[LF] Processing dates (override): ['05JAN', '04JAN', '03JAN', '02JAN', '01JAN']
[LF] Attaching to Chrome for Altea access
2025-12-27 00:05:45 | INFO     | Starting LF search for route: JED-CAI
2025-12-27 00:05:45 | INFO     | [START] LF Search
[LF][[OK] SUCCESS] Connected to Chrome on 127.0.0.1:9222 (after 1 attempts)
2025-12-27 00:05:46 | INFO     | [HEALTH CHECK] [OK] Chrome connection is healthy
[LF][[OK] SUCCESS] Found Amadeus Altea window: Altéa Reservation Desktop
[LF][[INFO] INFO] URL: https://tc212.resdesktop.altea.amadeus.com/app_ard/apf/init/login?SITE=ESMPESMP&LANGUAGE=GB&MARKETS=ARDW_PROD_WBP&ACTION=clpLogin
2025-12-27 00:05:46 | INFO     | [DAY_START] Processing 05JAN
[LF] Processing JED-CAI for 05JAN
2025-12-27 00:05:46 | INFO     | [lf.day.start] Processing JED-CAI for 05JAN
[LF] 05JAN: found 4 direct flights
2025-12-27 00:05:48 | INFO     | [lf.day.flights_found] Found 4 flights on 05JAN
2025-12-27 00:05:50 | INFO     | [lf.flight.extracted] SM480 on 05JAN: BKG=69, LF=41.3%
[LF] SM480 05JAN: BKG=69, GRP=44, CAP=167, LF%=41.3%, Brd-Off=JED-CAI, Classes: P:44, U:21, X:3, S:1
2025-12-27 00:05:54 | INFO     | [lf.flight.extracted] SM476 on 05JAN: BKG=177, LF=98.9%
[LF] SM476 05JAN: BKG=177, GRP=142, CAP=179, LF%=98.9%, Brd-Off=JED-CAI, Classes: P:142, U:20, X:12, W:1, S:2
2025-12-27 00:05:57 | INFO     | [lf.flight.extracted] SM478 on 05JAN: BKG=168, LF=100.6%
[LF] SM478 05JAN: BKG=168, GRP=138, CAP=167, LF%=100.6%, Brd-Off=JED-CAI, Classes: P:138, U:16, X:12, W:1, K:1
2025-12-27 00:06:01 | INFO     | [lf.flight.extracted] SM460 on 05JAN: BKG=167, LF=100.0%
[LF] SM460 05JAN: BKG=167, GRP=132, CAP=167, LF%=100.0%, Brd-Off=JED-CAI, Classes: P:132, U:15, X:3, W:1, S:9, Q:2, H:5
[LPC] SM460 05JAN: Found 0 outbound flights with connecting passengers
[LF] Getting WEEKLY/LASTSOLD data for 4 flights
[LF] SM480 05JAN: LASTSOLD=2025-12-26 00:00:00, WEEKLY=10, TODAY=0, YDAY=1
[LF] SM476 05JAN: LASTSOLD=2025-12-26 00:00:00, WEEKLY=13, TODAY=0, YDAY=2
[LF] SM478 05JAN: LASTSOLD=2025-12-24 00:00:00, WEEKLY=8, TODAY=0, YDAY=0
[LF] SM460 05JAN: LASTSOLD=2025-12-25 00:00:00, WEEKLY=10, TODAY=0, YDAY=0
2025-12-27 00:06:21 | INFO     | [SUCCESS] Day 05JAN
2025-12-27 00:06:21 | INFO     | [DAY_START] Processing 04JAN
[LF] Processing JED-CAI for 04JAN
2025-12-27 00:06:21 | INFO     | [lf.day.start] Processing JED-CAI for 04JAN
[LF] 04JAN: found 5 direct flights
2025-12-27 00:06:22 | INFO     | [lf.day.flights_found] Found 5 flights on 04JAN
2025-12-27 00:06:24 | INFO     | [lf.flight.extracted] SM424 on 04JAN: BKG=168, LF=100.6%
[LF] SM424 04JAN: BKG=168, GRP=160, CAP=167, LF%=100.6%, Brd-Off=JED-CAI, Classes: N:5, E:155, X:5, T:3
[LPC] SM424 04JAN: Found 2 outbound flights with connecting passengers
2025-12-27 00:06:37 | INFO     | [lf.flight.extracted] SM476 on 04JAN: BKG=74, LF=44.3%
[LF] SM476 04JAN: BKG=74, GRP=27, CAP=167, LF%=44.3%, Brd-Off=JED-CAI, Classes: P:27, I:17, O:2, U:25, X:1, W:1, K:1
2025-12-27 00:06:41 | INFO     | [lf.flight.extracted] SM432 on 04JAN: BKG=114, LF=68.3%
[LF] SM432 04JAN: BKG=114, GRP=96, CAP=167, LF%=68.3%, Brd-Off=JED-CAI, Classes: P:96, U:4, X:13, K:1
2025-12-27 00:06:44 | INFO     | [lf.flight.extracted] SM460 on 04JAN: BKG=132, LF=79.0%
[LF] SM460 04JAN: BKG=132, GRP=97, CAP=167, LF%=79.0%, Brd-Off=JED-CAI, Classes: N:2, P:97, U:20, X:10, W:2, S:1
2025-12-27 00:06:48 | INFO     | [lf.flight.extracted] SM478 on 04JAN: BKG=133, LF=79.6%
[LF] SM478 04JAN: BKG=133, GRP=97, CAP=167, LF%=79.6%, Brd-Off=JED-CAI, Classes: P:97, I:1, U:19, X:13, W:2, S:1
[LF] Getting WEEKLY/LASTSOLD data for 5 flights
[LF] SM424 04JAN: LASTSOLD=2025-12-19 00:00:00, WEEKLY=0, TODAY=0, YDAY=0
[LF] SM476 04JAN: LASTSOLD=2025-12-26 00:00:00, WEEKLY=32, TODAY=0, YDAY=5
[LF] SM432 04JAN: LASTSOLD=2025-12-26 00:00:00, WEEKLY=7, TODAY=0, YDAY=2
[LF] SM460 04JAN: LASTSOLD=2025-12-26 00:00:00, WEEKLY=13, TODAY=0, YDAY=1
[LF] SM478 04JAN: LASTSOLD=2025-12-24 00:00:00, WEEKLY=10, TODAY=0, YDAY=0
2025-12-27 00:07:11 | INFO     | [SUCCESS] Day 04JAN
2025-12-27 00:07:11 | INFO     | [DAY_START] Processing 03JAN
[LF] Processing JED-CAI for 03JAN
2025-12-27 00:07:11 | INFO     | [lf.day.start] Processing JED-CAI for 03JAN
[LF] 03JAN: found 3 direct flights
2025-12-27 00:07:12 | INFO     | [lf.day.flights_found] Found 3 flights on 03JAN
2025-12-27 00:07:14 | INFO     | [lf.flight.extracted] SM450 on 03JAN: BKG=162, LF=97.0%
[LF] SM450 03JAN: BKG=162, GRP=141, CAP=167, LF%=97.0%, Brd-Off=JED-CAI, Classes: P:141, U:10, X:7, T:2, K:2
[LPC] SM450 03JAN: Found 1 outbound flights with connecting passengers
2025-12-27 00:07:18 | INFO     | [lf.flight.extracted] SM476 on 03JAN: BKG=162, LF=91.0%
[LF] SM476 03JAN: BKG=162, GRP=131, CAP=178, LF%=91.0%, Brd-Off=JED-CAI, Classes: P:131, U:7, X:12, T:9, S:3
2025-12-27 00:07:21 | INFO     | [lf.flight.extracted] SM478 on 03JAN: BKG=165, LF=94.3%
[LF] SM478 03JAN: BKG=165, GRP=139, CAP=175, LF%=94.3%, Brd-Off=JED-CAI, Classes: P:139, I:5, U:15, W:6
[LF] Getting WEEKLY/LASTSOLD data for 3 flights
[LF] SM450 03JAN: LASTSOLD=2025-12-24 00:00:00, WEEKLY=2, TODAY=0, YDAY=0
[LF] SM476 03JAN: LASTSOLD=2025-12-26 00:00:00, WEEKLY=5, TODAY=0, YDAY=3
[LF] SM478 03JAN: LASTSOLD=2025-12-22 00:00:00, WEEKLY=12, TODAY=0, YDAY=0
2025-12-27 00:07:36 | INFO     | [SUCCESS] Day 03JAN
2025-12-27 00:07:36 | INFO     | [DAY_START] Processing 02JAN
[LF] Processing JED-CAI for 02JAN
2025-12-27 00:07:36 | INFO     | [lf.day.start] Processing JED-CAI for 02JAN
[LF] 02JAN: 2 cancelled flight(s) detected from SN
[LF] 02JAN: found 5 direct flights
2025-12-27 00:07:37 | INFO     | [lf.day.flights_found] Found 5 flights on 02JAN
2025-12-27 00:07:39 | INFO     | [lf.flight.extracted] SM424 on 02JAN: BKG=67, LF=40.1%
[LF] SM424 02JAN: BKG=67, GRP=45, CAP=167, LF%=40.1%, Brd-Off=JED-CAI, Classes: P:45, X:6, T:11, W:2, S:3
[LPC] SM424 02JAN: Found 2 outbound flights with connecting passengers
2025-12-27 00:07:44 | INFO     | [lf.flight.extracted] SM476 on 02JAN: BKG=73, LF=43.7%
[LF] SM476 02JAN: BKG=73, GRP=48, CAP=167, LF%=43.7%, Brd-Off=JED-CAI, Classes: P:48, I:5, O:5, U:1, X:10, T:4
2025-12-27 00:07:47 | INFO     | [lf.flight.extracted] SM480 on 02JAN: BKG=163, LF=97.6%
[LF] SM480 02JAN: BKG=163, GRP=135, CAP=167, LF%=97.6%, Brd-Off=JED-CAI, Classes: P:135, U:9, X:11, T:5, W:1, K:2
2025-12-27 00:07:50 | INFO     | [lf.flight.extracted] SM472 on 02JAN: BKG=157, LF=94.0%
[LF] SM472 02JAN: BKG=157, GRP=89, CAP=167, LF%=94.0%, Brd-Off=JED-CAI, Classes: P:89, I:5, O:5, U:12, X:22, T:22, S:2
2025-12-27 00:07:53 | INFO     | [lf.flight.extracted] SM460 on 02JAN: BKG=153, LF=91.6%
[LF] SM460 02JAN: BKG=153, GRP=118, CAP=167, LF%=91.6%, Brd-Off=JED-CAI, Classes: P:118, U:8, X:12, T:13, W:1, K:1
[LPC] SM460 02JAN: Found 0 outbound flights with connecting passengers
[LF] Getting WEEKLY/LASTSOLD data for 5 flights
[LF] SM424 02JAN: LASTSOLD=2025-12-26 00:00:00, WEEKLY=12, TODAY=0, YDAY=4
[LF] SM476 02JAN: LASTSOLD=2025-12-24 00:00:00, WEEKLY=5, TODAY=0, YDAY=0
[LF] SM480 02JAN: LASTSOLD=2025-12-26 00:00:00, WEEKLY=2, TODAY=0, YDAY=1
[LF] SM472 02JAN: LASTSOLD=2025-12-26 00:00:00, WEEKLY=16, TODAY=0, YDAY=2
[LF] SM460 02JAN: LASTSOLD=2025-12-24 00:00:00, WEEKLY=19, TODAY=0, YDAY=0
2025-12-27 00:08:16 | INFO     | [SUCCESS] Day 02JAN
2025-12-27 00:08:16 | INFO     | [DAY_START] Processing 01JAN
[LF] Processing JED-CAI for 01JAN
2025-12-27 00:08:16 | INFO     | [lf.day.start] Processing JED-CAI for 01JAN
[LF] 01JAN: found 7 direct flights
2025-12-27 00:08:17 | INFO     | [lf.day.flights_found] Found 7 flights on 01JAN
2025-12-27 00:08:18 | INFO     | [lf.flight.extracted] SM424 on 01JAN: BKG=23, LF=13.8%
[LF] SM424 01JAN: BKG=23, GRP=0, CAP=167, LF%=13.8%, Brd-Off=JED-CAI, Classes: U:20, X:3
[LPC] SM424 01JAN: Found 1 outbound flights with connecting passengers
2025-12-27 00:08:27 | INFO     | [lf.flight.extracted] SM472 on 01JAN: BKG=87, LF=53.0%
[LF] SM472 01JAN: BKG=87, GRP=51, CAP=164, LF%=53.0%, Brd-Off=JED-CAI, Classes: P:51, U:20, X:9, T:1, S:6
[LPC] SM472 01JAN: Found 1 outbound flights with connecting passengers
2025-12-27 00:08:31 | INFO     | [lf.flight.extracted] SM450 on 01JAN: BKG=179, LF=107.2%
[LF] SM450 01JAN: BKG=179, GRP=175, CAP=167, LF%=107.2%, Brd-Off=JED-CAI, Classes: N:5, P:46, E:125, U:3
[LPC] SM450 01JAN: Found 1 outbound flights with connecting passengers
2025-12-27 00:08:41 | INFO     | [lf.flight.extracted] SM476 on 01JAN: BKG=168, LF=96.5%
[LF] SM476 01JAN: BKG=168, GRP=128, CAP=174, LF%=96.5%, Brd-Off=JED-CAI, Classes: P:88, E:40, I:5, O:5, U:18, X:8, W:1, S:3
[LPC] SM476 01JAN: Found 3 outbound flights with connecting passengers
2025-12-27 00:08:48 | INFO     | [lf.flight.extracted] SM432 on 01JAN: BKG=0, LF=0.0%
[LF] SM432 01JAN: BKG=0, GRP=0, CAP=167, LF%=0.0%, Brd-Off=JED-ATZ
2025-12-27 00:09:02 | INFO     | [lf.flight.extracted] SM478 on 01JAN: BKG=159, LF=97.0%
[LF] SM478 01JAN: BKG=159, GRP=128, CAP=164, LF%=97.0%, Brd-Off=JED-CAI, Classes: P:128, X:10, T:5, W:10, S:6
[LPC] SM478 01JAN: Found 0 outbound flights with connecting passengers
2025-12-27 00:09:06 | INFO     | [lf.flight.extracted] SM480 on 01JAN: BKG=168, LF=94.4%
[LF] SM480 01JAN: BKG=168, GRP=139, CAP=178, LF%=94.4%, Brd-Off=JED-CAI, Classes: N:6, P:139, X:8, T:2, W:1, S:3, K:9
[LF] Getting WEEKLY/LASTSOLD data for 6 flights
[LF] SM424 01JAN: LASTSOLD=2025-12-26 00:00:00, WEEKLY=10, TODAY=0, YDAY=1
[LF] SM472 01JAN: LASTSOLD=2025-12-26 00:00:00, WEEKLY=21, TODAY=0, YDAY=10
[LF] SM450 01JAN: LASTSOLD=2025-12-21 00:00:00, WEEKLY=46, TODAY=0, YDAY=0
[LF] SM476 01JAN: LASTSOLD=2025-12-23 00:00:00, WEEKLY=28, TODAY=0, YDAY=0
[LF] SM478 01JAN: LASTSOLD=2025-12-26 00:00:00, WEEKLY=22, TODAY=0, YDAY=1
[LF] SM480 01JAN: LASTSOLD=2025-12-26 00:00:00, WEEKLY=3, TODAY=0, YDAY=1
2025-12-27 00:09:32 | INFO     | [SUCCESS] Day 01JAN
[LF] Results summary:
  2026-01-05: 4 flights
  2026-01-04: 5 flights
  2026-01-03: 3 flights
  2026-01-02: 5 flights
  2026-01-01: 7 flights
[LF] Cancelled flights found: 2
  - SM952 02JAN (SN)
  - SM478 02JAN (SN)
2025-12-27 00:09:32 | INFO     | [SUCCESS] LF Search Complete
[Worker_9222] Cancelled flights collected: 2

============================================================
[Worker_9222] ✓ COMPLETED: JED-CAI
  Results: 5 dates
  Errors: 0 dates
  Total Processed: 3 groups
============================================================

2025-12-27 00:09:32 | INFO     | [Worker_9222] Completed: JED-CAI - 5 results, 0 errors
[Worker_9222] Waiting for tasks...

============================================================
[Worker_9222] Shutdown signal received
Exiting...
============================================================
2025-12-27 00:10:32 | INFO     | [Worker_9222] Shutdown signal received, exiting...

============================================================
[Worker_9222] FINISHED
  Total Groups Processed: 3
============================================================

2025-12-27 00:10:32 | INFO     | [Worker_9222] Finished. Processed 3 groups.
