
============================================================
     LF WORKER - PORT 9222
============================================================
Worker: Worker_9222
Status: READY
Waiting for tasks...
============================================================


============================================================
[Worker_9222] Processing: JED-CAI
  Tier 0: Range 1, Chunk 2/2
  Dates: 13 days
  Date Range: 2026-01-18 to 2026-01-06
============================================================

2026-01-06 09:20:44 | INFO     | ======================================================================
2026-01-06 09:20:44 | INFO     | Load Factor Scraper Started - Route: JED-CAI
2026-01-06 09:20:44 | INFO     | Log file: D:\CODERED\LAB\market_insights\outputs\run_generated_060126_at_09.20\logs\LF_JED-CAI_20260106_092044.log
2026-01-06 09:20:44 | INFO     | Enhanced logging: Capturing both logging.info() and print()
2026-01-06 09:20:44 | INFO     | ======================================================================
[LF] Processing dates (override): ['18JAN', '17JAN', '16JAN', '15JAN', '14JAN', '13JAN', '12JAN', '11JAN', '10JAN', '09JAN', '08JAN', '07JAN', '06JAN']
[LF] Attaching to Chrome for Altea access
[LF][[OK] SUCCESS] Connected to Chrome on 127.0.0.1:9222 (after 1 attempts)
[LF][[OK] SUCCESS] Found Amadeus Altea window: Altéa Reservation Desktop
[LF][[INFO] INFO] URL: https://tc212.resdesktop.altea.amadeus.com/app_ard/apf/init/login?SITE=ESMPESMP&LANGUAGE=GB&MARKETS=ARDW_PROD_WBP&ACTION=clpLogin
[LF] Processing JED-CAI for 18JAN
[LF][ERROR] Amadeus command error detected: UNKNOWN TRANSACTION
[LF][ERROR] Command: SN18JANJEDCAI/ASM
[LF][RESYNC] Triggering immediate resync to last successful SN command
============================================================
[LF][RESYNC] Command 'SN18JANJEDCAI/ASM' failed: TECH_ERROR:UNKNOWN TRANSACTION
[LF][RESYNC] Re-running entire day from SN command for JED-CAI 18JAN
[LF][RESYNC] Attempt 1/50 (waiting 1.0s before retry...)
============================================================
[LF][RESYNC] Sending IG to clear session state...
[LF][RESYNC] Session cleared with IG
[LF] Processing JED-CAI for 18JAN
[LF] 18JAN: found 5 direct flights
[LF][[SYNC] RETRYING] Cannot focus on command line
[LF][[INFO] INFO] Will try 50 times before pausing...
[LF][[SYNC] RETRYING] Cannot focus on command line
[LF][[INFO] INFO] Will try 50 times before pausing...
[LF] SM424 18JAN: BKG=100, GRP=80, CAP=175, LF%=57.1%, Brd-Off=JED-CAI, Classes: O:41, U:30, X:27, T:25, W:26, S:11, G:10, L:1
[LF][ERROR] Amadeus command error detected: UNKNOWN TRANSACTION
[LF][ERROR] Command: LPC/+TE/SM424/18JAN/t
[LF][RESYNC] Triggering immediate resync to last successful SN command
[LPC] Error parsing connecting passengers for SM424/18JAN: LPC/+TE/SM424/18JAN/t: TECH_ERROR:UNKNOWN TRANSACTION
[LF][[SYNC] RETRYING] Cannot focus on command line
[LF][[INFO] INFO] Will try 50 times before pausing...
[LF][ERROR] Amadeus command error detected: UNKNOWN TRANSACTION
[LF][ERROR] Command: M
[LF][RESYNC] Triggering immediate resync to last successful SN command
============================================================
[LF][RESYNC] Command 'M' failed: TECH_ERROR:UNKNOWN TRANSACTION
[LF][RESYNC] Re-running entire day from SN command for JED-CAI 18JAN
[LF][RESYNC] Attempt 2/50 (waiting 1.0s before retry...)
============================================================
[LF][RESYNC] Sending IG to clear session state...
[LF][[SYNC] RETRYING] Cannot focus on command line
[LF][[INFO] INFO] Will try 50 times before pausing...
[LF][RESYNC] Warning: IG command failed: Message: stale element reference: stale element not found in the current frame
  (Session info: chrome=143.0.7499.170); For documentation on this error, please visit: https://www.selenium.dev/documentation/webdriver/troubleshooting/errors#staleelementreferenceexception
Stacktrace:
Symbols not available. Dumping unresolved backtrace:
	0x7ff67fc788e5
	0x7ff67fc78940
	0x7ff67fa5165d
	0x7ff67fa592cc
	0x7ff67fa5c3b4
	0x7ff67fa5c47f
	0x7ff67faabc4c
	0x7ff67fa9f15b
	0x7ff67fad1fda
	0x7ff67fa9c746
	0x7ff67fafac97
	0x7ff67fa9ac29
	0x7ff67fa9ba93
	0x7ff67ff90640
	0x7ff67ff8af80
	0x7ff67ffa96e6
	0x7ff67fc95de4
	0x7ff67fc9ed8c
	0x7ff67fc82004
	0x7ff67fc821b5
	0x7ff67fc67ee2
	0x7ff845c6e8d7
	0x7ff846d6c53c

[LF] Processing JED-CAI for 18JAN
[LF][[SYNC] RETRYING] Cannot focus on command line
[LF][[INFO] INFO] Will try 50 times before pausing...
[LF][RECONNECT] Connection lost. Attempting reconnect #1...
[LF][INFO] Make sure Chrome is open with remote debugging port
[LF][[OK] SUCCESS] Connected to Chrome on 127.0.0.1:9222 (after 1 attempts)
[LF][[OK] SUCCESS] Found Amadeus Altea window: Altéa Reservation Desktop
[LF][[INFO] INFO] URL: https://tc212.resdesktop.altea.amadeus.com/app_ard/apf/init/login?SITE=ESMPESMP&LANGUAGE=GB&MARKETS=ARDW_PROD_WBP&ACTION=clpLogin
[LF][SUCCESS] Chrome reconnected successfully!
[LF][RESUME] Restoring session context with: SN18JANJEDCAI/ASM
[LF][RESUME] Session context restored!
[LF] Processing JED-CAI for 18JAN
[LF] 18JAN: found 5 direct flights
[LF][[SYNC] RETRYING] Cannot focus on command line
[LF][[INFO] INFO] Will try 50 times before pausing...
[LF] SM424 18JAN: BKG=100, GRP=80, CAP=175, LF%=57.1%, Brd-Off=JED-CAI, Classes: P:136, U:8, X:10, T:14, W:10
[LF][RECONNECT] Connection lost. Attempting reconnect #2...
[LF][INFO] Make sure Chrome is open with remote debugging port
[LF][[OK] SUCCESS] Connected to Chrome on 127.0.0.1:9222 (after 1 attempts)
[LF][[OK] SUCCESS] Found Amadeus Altea window: Altéa Reservation Desktop
[LF][[INFO] INFO] URL: https://tc212.resdesktop.altea.amadeus.com/app_ard/apf/init/login?SITE=ESMPESMP&LANGUAGE=GB&MARKETS=ARDW_PROD_WBP&ACTION=clpLogin
[LF][SUCCESS] Chrome reconnected successfully!
[LF][RESUME] Restoring session context with: SN18JANJEDCAI/ASM
[LF][[SYNC] RETRYING] Cannot focus on command line
[LF][[INFO] INFO] Will try 50 times before pausing...
[LF][RESUME] Session context restored!
[LF] Processing JED-CAI for 18JAN
[LF] 18JAN: found 5 direct flights
[LF] SM424 18JAN: BKG=100, GRP=80, CAP=175, LF%=57.1%, Brd-Off=JED-CAI, Classes: P:80, I:20
[LF][[SYNC] RETRYING] Cannot focus on command line
[LF][[INFO] INFO] Will try 50 times before pausing...
[LF][[SYNC] RETRYING] Cannot focus on command line
[LF][[INFO] INFO] Will try 50 times before pausing...
[LF] SM476 18JAN: BKG=6, GRP=0, CAP=175, LF%=3.4%, Brd-Off=JED-CAI, Classes: U:179
[LF] SM432 18JAN: BKG=52, GRP=40, CAP=175, LF%=29.7%, Brd-Off=JED-CAI, Classes: P:40, I:8, U:4
[LF][[SYNC] RETRYING] Cannot focus on command line
[LF][[INFO] INFO] Will try 50 times before pausing...
[LF] SM460 18JAN: BKG=69, GRP=49, CAP=175, LF%=39.4%, Brd-Off=JED-CAI, Classes: P:49, I:17, O:2, U:1
[LF][[SYNC] RETRYING] Cannot focus on command line
[LF][[INFO] INFO] Will try 50 times before pausing...
[LF][[SYNC] RETRYING] Cannot focus on command line
[LF][[INFO] INFO] Will try 50 times before pausing...
[LF][RECONNECT] Connection lost. Attempting reconnect #3...
[LF][INFO] Make sure Chrome is open with remote debugging port
[LF][[OK] SUCCESS] Connected to Chrome on 127.0.0.1:9222 (after 1 attempts)
[LF][[OK] SUCCESS] Found Amadeus Altea window: Altéa Reservation Desktop
[LF][[INFO] INFO] URL: https://tc212.resdesktop.altea.amadeus.com/app_ard/apf/init/login?SITE=ESMPESMP&LANGUAGE=GB&MARKETS=ARDW_PROD_WBP&ACTION=clpLogin
[LF][SUCCESS] Chrome reconnected successfully!
[LF][RESUME] Restoring session context with: SN18JANJEDCAI/ASM
[LF][[SYNC] RETRYING] Cannot focus on command line
[LF][[INFO] INFO] Will try 50 times before pausing...
[LF][[SYNC] RETRYING] Cannot focus on command line
[LF][[INFO] INFO] Will try 50 times before pausing...
[LF][ERROR] Amadeus command error detected: INVALID FLIGHT NUMBER
[LF][ERROR] Command: SN18JANJEDCAI/ASM
[LF][RESYNC] Triggering immediate resync to last successful SN command
[LF][RESUME] Failed to restore context: SN18JANJEDCAI/ASM: TECH_ERROR:INVALID FLIGHT NUMBER
[LF] Processing JED-CAI for 18JAN
[LF][[SYNC] RETRYING] Cannot focus on command line
[LF][[INFO] INFO] Will try 50 times before pausing...
[LF] Processing JED-CAI for 18JAN
[LF][ERROR] Amadeus command error detected: INVALID FORMAT
[LF][ERROR] Command: SN18JANJEDCAI/ASM
[LF][RESYNC] Triggering immediate resync to last successful SN command
============================================================
[LF][RESYNC] Command 'SN18JANJEDCAI/ASM' failed: TECH_ERROR:INVALID FORMAT
[LF][RESYNC] Re-running entire day from SN command for JED-CAI 18JAN
[LF][RESYNC] Attempt 1/50 (waiting 1.0s before retry...)
============================================================
[LF][RESYNC] Sending IG to clear session state...
[LF][RESYNC] Session cleared with IG
[LF] Processing JED-CAI for 18JAN
[LF][[SYNC] RETRYING] Cannot focus on command line
[LF][[INFO] INFO] Will try 50 times before pausing...
[LF] 18JAN: found 5 direct flights
[LF][[SYNC] RETRYING] Cannot focus on command line
[LF][[INFO] INFO] Will try 50 times before pausing...
[LF] SM424 18JAN: BKG=100, GRP=80, CAP=175, LF%=57.1%, Brd-Off=JED-CAI, Classes: I:39, O:2, U:58, X:7
[LF] SM476 18JAN: BKG=6, GRP=0, CAP=175, LF%=3.4%, Brd-Off=JED-CAI, Classes: I:4, U:2
[LF][ERROR] Amadeus command error detected: INVALID FORMAT
[LF][ERROR] Command: LL/I/SM432/18JAN
[LF][RESYNC] Triggering immediate resync to last successful SN command
============================================================
[LF][RESYNC] Command 'LL/I/SM432/18JAN' failed: TECH_ERROR:INVALID FORMAT
[LF][RESYNC] Re-running entire day from SN command for JED-CAI 18JAN
[LF][RESYNC] Attempt 2/50 (waiting 1.0s before retry...)
============================================================
[LF][RESYNC] Sending IG to clear session state...
[LF][RESYNC] Session cleared with IG
[LF] Processing JED-CAI for 18JAN
[LF][[SYNC] RETRYING] Cannot focus on command line
[LF][[INFO] INFO] Will try 50 times before pausing...
[LF][ERROR] Max retries (5) exceeded for 18JAN - skipping day
[LF] Processing JED-CAI for 17JAN
[LF][[SYNC] RETRYING] Cannot focus on command line
[LF][[INFO] INFO] Will try 50 times before pausing...
[LF] 17JAN: found 3 direct flights
[LF] SM450 17JAN: BKG=30, GRP=0, CAP=175, LF%=17.1%, Brd-Off=JED-CAI, Classes: I:17, O:7, U:6
[LF] SM476 17JAN: BKG=119, GRP=92, CAP=175, LF%=68.0%, Brd-Off=JED-CAI, Classes: P:92, I:3, O:4, U:10, X:10
[LF][[SYNC] RETRYING] Cannot focus on command line
[LF][[INFO] INFO] Will try 50 times before pausing...
[LF][[SYNC] RETRYING] Cannot focus on command line
[LF][[INFO] INFO] Will try 50 times before pausing...
[LF] SM478 17JAN: BKG=121, GRP=72, CAP=175, LF%=69.1%, Brd-Off=JED-CAI, Classes: P:145, T:5, W:9, S:9, G:4
[LF] Getting WEEKLY/LASTSOLD data for 3 flights
[LF][[SYNC] RETRYING] Cannot focus on command line
[LF][[INFO] INFO] Will try 50 times before pausing...
[LF][RECONNECT] Connection lost. Attempting reconnect #1...
[LF][INFO] Make sure Chrome is open with remote debugging port
[LF][[OK] SUCCESS] Connected to Chrome on 127.0.0.1:9222 (after 1 attempts)
[LF][[OK] SUCCESS] Found Amadeus Altea window: Altéa Reservation Desktop
[LF][[INFO] INFO] URL: https://tc212.resdesktop.altea.amadeus.com/app_ard/apf/init/login?SITE=ESMPESMP&LANGUAGE=GB&MARKETS=ARDW_PROD_WBP&ACTION=clpLogin
[LF][SUCCESS] Chrome reconnected successfully!
[LF][RESUME] Restoring session context with: SN17JANJEDCAI/ASM
[LF][[SYNC] RETRYING] Cannot focus on command line
[LF][[INFO] INFO] Will try 50 times before pausing...
[LF][RESUME] Session context restored!
[LF] Processing JED-CAI for 17JAN
[LF] 17JAN: found 3 direct flights
[LF] SM450 17JAN: BKG=30, GRP=0, CAP=175, LF%=17.1%, Brd-Off=JED-CAI, Classes: I:17, O:7, U:6
[LF][ERROR] Amadeus command error detected: INVALID FORMAT
[LF][ERROR] Command: LPC/+TE/SM450/17JAN/t
[LF][RESYNC] Triggering immediate resync to last successful SN command
[LPC] Error parsing connecting passengers for SM450/17JAN: LPC/+TE/SM450/17JAN/t: TECH_ERROR:INVALID FORMAT
[LF][ERROR] Amadeus command error detected: UNKNOWN TRANSACTION
[LF][ERROR] Command: LL/I/SM476/17JAN
[LF][RESYNC] Triggering immediate resync to last successful SN command
============================================================
[LF][RESYNC] Command 'LL/I/SM476/17JAN' failed: TECH_ERROR:UNKNOWN TRANSACTION
[LF][RESYNC] Re-running entire day from SN command for JED-CAI 17JAN
[LF][RESYNC] Attempt 1/50 (waiting 1.0s before retry...)
============================================================
[LF][RESYNC] Sending IG to clear session state...
[LF][RESYNC] Session cleared with IG
[LF] Processing JED-CAI for 17JAN
[LF] 17JAN: found 3 direct flights
[LF] SM450 17JAN: BKG=30, GRP=0, CAP=175, LF%=17.1%, Brd-Off=JED-CAI, Classes: I:17, O:7, U:6
[LF][[SYNC] RETRYING] Cannot focus on command line
[LF][[INFO] INFO] Will try 50 times before pausing...
[LF][ERROR] Amadeus command error detected: INVALID DISPLAY OPTION CODE
[LF][ERROR] Command: LPC/+TE/SM450/17JAN/t
[LF][RESYNC] Triggering immediate resync to last successful SN command
[LPC] Error parsing connecting passengers for SM450/17JAN: LPC/+TE/SM450/17JAN/t: TECH_ERROR:INVALID DISPLAY OPTION CODE
[LF][[SYNC] RETRYING] Cannot focus on command line
[LF][[INFO] INFO] Will try 50 times before pausing...
[LF][ERROR] Amadeus command error detected: UNKNOWN TRANSACTION
[LF][ERROR] Command: LL/I/SM476/17JAN
[LF][RESYNC] Triggering immediate resync to last successful SN command
============================================================
[LF][RESYNC] Command 'LL/I/SM476/17JAN' failed: TECH_ERROR:UNKNOWN TRANSACTION
[LF][RESYNC] Re-running entire day from SN command for JED-CAI 17JAN
[LF][RESYNC] Attempt 2/50 (waiting 1.0s before retry...)
============================================================
[LF][RESYNC] Sending IG to clear session state...
[LF][RESYNC] Session cleared with IG
[LF] Processing JED-CAI for 17JAN
[LF] 17JAN: found 3 direct flights
[LF] SM450 17JAN: BKG=30, GRP=0, CAP=175, LF%=17.1%, Brd-Off=JED-CAI, Classes: I:17, O:7, U:6
[LF][RECONNECT] Connection lost. Attempting reconnect #2...
[LF][INFO] Make sure Chrome is open with remote debugging port
[LF][[OK] SUCCESS] Connected to Chrome on 127.0.0.1:9222 (after 1 attempts)
[LF][[OK] SUCCESS] Found Amadeus Altea window: Altéa Reservation Desktop
[LF][[INFO] INFO] URL: https://tc212.resdesktop.altea.amadeus.com/app_ard/apf/init/login?SITE=ESMPESMP&LANGUAGE=GB&MARKETS=ARDW_PROD_WBP&ACTION=clpLogin
[LF][SUCCESS] Chrome reconnected successfully!
[LF][RESUME] Restoring session context with: SN17JANJEDCAI/ASM
[LF][RESUME] Failed to restore context: Message: stale element reference: stale element not found in the current frame
  (Session info: chrome=143.0.7499.170); For documentation on this error, please visit: https://www.selenium.dev/documentation/webdriver/troubleshooting/errors#staleelementreferenceexception
Stacktrace:
Symbols not available. Dumping unresolved backtrace:
	0x7ff67fc788e5
	0x7ff67fc78940
	0x7ff67fa5165d
	0x7ff67fa592cc
	0x7ff67fa5c74e
	0x7ff67fafc05f
	0x7ff67fad1fda
	0x7ff67fafac97
	0x7ff67fa9ac29
	0x7ff67fa9ba93
	0x7ff67ff90640
	0x7ff67ff8af80
	0x7ff67ffa96e6
	0x7ff67fc95de4
	0x7ff67fc9ed8c
	0x7ff67fc82004
	0x7ff67fc821b5
	0x7ff67fc67ee2
	0x7ff845c6e8d7
	0x7ff846d6c53c

[LF] Processing JED-CAI for 17JAN
[LF][[SYNC] RETRYING] Cannot focus on command line
[LF][[INFO] INFO] Will try 50 times before pausing...
[LF] 17JAN: found 3 direct flights
[LF][RECONNECT] Connection lost. Attempting reconnect #3...
[LF][INFO] Make sure Chrome is open with remote debugging port
[LF][[OK] SUCCESS] Connected to Chrome on 127.0.0.1:9222 (after 1 attempts)
[LF][[OK] SUCCESS] Found Amadeus Altea window: Altéa Reservation Desktop
[LF][[INFO] INFO] URL: https://tc212.resdesktop.altea.amadeus.com/app_ard/apf/init/login?SITE=ESMPESMP&LANGUAGE=GB&MARKETS=ARDW_PROD_WBP&ACTION=clpLogin
[LF][SUCCESS] Chrome reconnected successfully!
[LF][RESUME] Restoring session context with: SN17JANJEDCAI/ASM
[LF][[SYNC] RETRYING] Cannot focus on command line
[LF][[INFO] INFO] Will try 50 times before pausing...
[LF][ERROR] Amadeus command error detected: INVALID FLIGHT NUMBER
[LF][ERROR] Command: SN17JANJEDCAI/ASM
[LF][RESYNC] Triggering immediate resync to last successful SN command
[LF][RESUME] Failed to restore context: SN17JANJEDCAI/ASM: TECH_ERROR:INVALID FLIGHT NUMBER
[LF] Processing JED-CAI for 17JAN
[LF][[SYNC] RETRYING] Cannot focus on command line
[LF][[INFO] INFO] Will try 50 times before pausing...
[LF] 17JAN: found 3 direct flights
[LF] SM450 17JAN: BKG=30, GRP=0, CAP=175, LF%=17.1%, Brd-Off=JED-CAI, Classes: I:17, O:7, U:6
[LF][[SYNC] RETRYING] Cannot focus on command line
[LF][[INFO] INFO] Will try 50 times before pausing...
[LF] SM476 17JAN: BKG=119, GRP=92, CAP=175, LF%=68.0%, Brd-Off=JED-CAI, Classes: P:92, I:3, O:4, U:10, X:10
[LF][[SYNC] RETRYING] Cannot focus on command line
[LF][[INFO] INFO] Will try 50 times before pausing...
[LF][ERROR] Amadeus command error detected: INVALID FORMAT
[LF][ERROR] Command: LL/I/SM478/17JAN
[LF][RESYNC] Triggering immediate resync to last successful SN command
============================================================
[LF][RESYNC] Command 'LL/I/SM478/17JAN' failed: TECH_ERROR:INVALID FORMAT
[LF][RESYNC] Re-running entire day from SN command for JED-CAI 17JAN
[LF][RESYNC] Attempt 1/50 (waiting 1.0s before retry...)
============================================================
[LF][RESYNC] Sending IG to clear session state...
[LF][[SYNC] RETRYING] Cannot focus on command line
[LF][[INFO] INFO] Will try 50 times before pausing...
[LF][RESYNC] Session cleared with IG
[LF] Processing JED-CAI for 17JAN
[LF] 17JAN: found 3 direct flights
[LF] SM450 17JAN: BKG=30, GRP=0, CAP=175, LF%=17.1%, Brd-Off=JED-CAI, Classes: I:17, O:7, U:6
[LF][[SYNC] RETRYING] Cannot focus on command line
[LF][[INFO] INFO] Will try 50 times before pausing...
[LF][ERROR] Amadeus command error detected: UNKNOWN TRANSACTION
[LF][ERROR] Command: LL/I/SM476/17JAN
[LF][RESYNC] Triggering immediate resync to last successful SN command
============================================================
[LF][RESYNC] Command 'LL/I/SM476/17JAN' failed: TECH_ERROR:UNKNOWN TRANSACTION
[LF][RESYNC] Re-running entire day from SN command for JED-CAI 17JAN
[LF][RESYNC] Attempt 2/50 (waiting 1.0s before retry...)
============================================================
[LF][RESYNC] Sending IG to clear session state...
[LF][RESYNC] Session cleared with IG
[LF] Processing JED-CAI for 17JAN
[LF] 17JAN: found 3 direct flights
[LF] SM450 17JAN: BKG=30, GRP=0, CAP=175, LF%=17.1%, Brd-Off=JED-CAI, Classes: I:17, O:7, U:6
[LF][[SYNC] RETRYING] Cannot focus on command line
[LF][[INFO] INFO] Will try 50 times before pausing...
[LF] SM476 17JAN: BKG=119, GRP=92, CAP=175, LF%=68.0%, Brd-Off=JED-CAI, Classes: P:92, I:3, O:4, U:10, X:10
[LF][[SYNC] RETRYING] Cannot focus on command line
[LF][[INFO] INFO] Will try 50 times before pausing...
[LF][ERROR] Amadeus command error detected: INVALID FORMAT
[LF][ERROR] Command: LL/I/SM478/17JAN
[LF][RESYNC] Triggering immediate resync to last successful SN command
============================================================
[LF][RESYNC] Command 'LL/I/SM478/17JAN' failed: TECH_ERROR:INVALID FORMAT
[LF][RESYNC] Re-running entire day from SN command for JED-CAI 17JAN
[LF][RESYNC] Attempt 3/50 (waiting 1.0s before retry...)
============================================================
[LF][RESYNC] Sending IG to clear session state...
[LF][[SYNC] RETRYING] Cannot focus on command line
[LF][[INFO] INFO] Will try 50 times before pausing...
[LF][RESYNC] Session cleared with IG
[LF] Processing JED-CAI for 17JAN
[LF] 17JAN: found 3 direct flights
[LF] SM450 17JAN: BKG=30, GRP=0, CAP=175, LF%=17.1%, Brd-Off=JED-CAI, Classes: I:17, O:7, U:6
[LF][[SYNC] RETRYING] Cannot focus on command line
[LF][[INFO] INFO] Will try 50 times before pausing...
[LF] Processing JED-CAI for 17JAN
[LF][[SYNC] RETRYING] Cannot focus on command line
[LF][[INFO] INFO] Will try 50 times before pausing...
[LF] 17JAN: found 3 direct flights
[LF][[SYNC] RETRYING] Cannot focus on command line
[LF][[INFO] INFO] Will try 50 times before pausing...
[LF][[SYNC] RETRYING] Cannot focus on command line
[LF][[INFO] INFO] Will try 50 times before pausing...
[LF] SM450 17JAN: BKG=30, GRP=0, CAP=175, LF%=17.1%, Brd-Off=JED-CAI, Classes: I:5, O:30, U:15, X:15, T:35, W:10
[LF][[SYNC] RETRYING] Cannot focus on command line
[LF][[INFO] INFO] Will try 50 times before pausing...
[LF][ERROR] Max retries (5) exceeded for 17JAN - skipping day
[LF] Processing JED-CAI for 16JAN
[LF][[SYNC] RETRYING] Cannot focus on command line
[LF][[INFO] INFO] Will try 50 times before pausing...
[LF] 16JAN: found 6 direct flights
[LF] SM424 16JAN: BKG=16, GRP=0, CAP=175, LF%=9.1%, Brd-Off=JED-CAI, Classes: I:14, O:1, U:1
[LF][[SYNC] RETRYING] Cannot focus on command line
[LF][[INFO] INFO] Will try 50 times before pausing...
[LF][ERROR] Amadeus command error detected: INVALID FORMAT
[LF][ERROR] Command: LL/I/SM476/16JAN
[LF][RESYNC] Triggering immediate resync to last successful SN command
============================================================
[LF][RESYNC] Command 'LL/I/SM476/16JAN' failed: TECH_ERROR:INVALID FORMAT
[LF][RESYNC] Re-running entire day from SN command for JED-CAI 16JAN
[LF][RESYNC] Attempt 1/50 (waiting 1.0s before retry...)
============================================================
[LF][RESYNC] Sending IG to clear session state...
[LF][[SYNC] RETRYING] Cannot focus on command line
[LF][[INFO] INFO] Will try 50 times before pausing...
[LF][RESYNC] Warning: IG command failed: Message: element not interactable
  (Session info: chrome=143.0.7499.170); For documentation on this error, please visit: https://www.selenium.dev/documentation/webdriver/troubleshooting/errors#elementnotinteractableexception
Stacktrace:
Symbols not available. Dumping unresolved backtrace:
	0x7ff67fc788e5
	0x7ff67fc78940
	0x7ff67fa51465
	0x7ff67faa34c9
	0x7ff67faa14b9
	0x7ff67fad1fda
	0x7ff67fa9c746
	0x7ff67fafac97
	0x7ff67fa9ac29
	0x7ff67fa9ba93
	0x7ff67ff90640
	0x7ff67ff8af80
	0x7ff67ffa96e6
	0x7ff67fc95de4
	0x7ff67fc9ed8c
	0x7ff67fc82004
	0x7ff67fc821b5
	0x7ff67fc67ee2
	0x7ff845c6e8d7
	0x7ff846d6c53c

[LF] Processing JED-CAI for 16JAN
[LF][[SYNC] RETRYING] Cannot focus on command line
[LF][[INFO] INFO] Will try 50 times before pausing...
[LF] 16JAN: found 6 direct flights
[LF][[SYNC] RETRYING] Cannot focus on command line
[LF][[INFO] INFO] Will try 50 times before pausing...
[LF][RECONNECT] Connection lost. Attempting reconnect #1...
[LF][INFO] Make sure Chrome is open with remote debugging port
[LF][[OK] SUCCESS] Connected to Chrome on 127.0.0.1:9222 (after 1 attempts)
[LF][[OK] SUCCESS] Found Amadeus Altea window: Altéa Reservation Desktop
[LF][[INFO] INFO] URL: https://tc212.resdesktop.altea.amadeus.com/app_ard/apf/init/login?SITE=ESMPESMP&LANGUAGE=GB&MARKETS=ARDW_PROD_WBP&ACTION=clpLogin
[LF][SUCCESS] Chrome reconnected successfully!
[LF][RESUME] Restoring session context with: SN16JANJEDCAI/ASM
[LF][[SYNC] RETRYING] Cannot focus on command line
[LF][[INFO] INFO] Will try 50 times before pausing...
[LF][RESUME] Session context restored!
[LF] Processing JED-CAI for 16JAN
[LF] 16JAN: found 6 direct flights
[LF][[SYNC] RETRYING] Cannot focus on command line
[LF][[INFO] INFO] Will try 50 times before pausing...
[LF][RECONNECT] Connection lost. Attempting reconnect #2...
[LF][INFO] Make sure Chrome is open with remote debugging port
[LF][[OK] SUCCESS] Connected to Chrome on 127.0.0.1:9222 (after 1 attempts)
[LF][[OK] SUCCESS] Found Amadeus Altea window: Altéa Reservation Desktop
[LF][[INFO] INFO] URL: https://tc212.resdesktop.altea.amadeus.com/app_ard/apf/init/login?SITE=ESMPESMP&LANGUAGE=GB&MARKETS=ARDW_PROD_WBP&ACTION=clpLogin
[LF][SUCCESS] Chrome reconnected successfully!
[LF][RESUME] Restoring session context with: SN16JANJEDCAI/ASM
[LF][[SYNC] RETRYING] Cannot focus on command line
[LF][[INFO] INFO] Will try 50 times before pausing...
[LF][RESUME] Session context restored!
[LF] Processing JED-CAI for 16JAN
[LF] 16JAN: found 6 direct flights
[LF] SM424 16JAN: BKG=16, GRP=0, CAP=175, LF%=9.1%, Brd-Off=JED-CAI, Classes: I:14, O:1, U:1
[LF][[SYNC] RETRYING] Cannot focus on command line
[LF][[INFO] INFO] Will try 50 times before pausing...
[LF] SM476 16JAN: BKG=11, GRP=0, CAP=175, LF%=6.3%, Brd-Off=JED-CAI, Classes: I:5, O:2, U:4
[LF][[SYNC] RETRYING] Cannot focus on command line
[LF][[INFO] INFO] Will try 50 times before pausing...
[LF] SM478 16JAN: BKG=0, GRP=0, CAP=168, LF%=0.0%, Brd-Off=JED-CAI
[LF][[SYNC] RETRYING] Cannot focus on command line
[LF][[INFO] INFO] Will try 50 times before pausing...
[LF] SM480 16JAN: BKG=39, GRP=0, CAP=175, LF%=22.3%, Brd-Off=JED-CAI, Classes: I:16, O:11, U:7, G:1, K:4
[LF][[SYNC] RETRYING] Cannot focus on command line
[LF][[INFO] INFO] Will try 50 times before pausing...
[LF] SM472 16JAN: BKG=108, GRP=49, CAP=175, LF%=61.7%, Brd-Off=JED-CAI, Classes: E:49, I:3, O:29, U:17, X:10
[LF][[SYNC] RETRYING] Cannot focus on command line
[LF][[INFO] INFO] Will try 50 times before pausing...
[LF] SM460 16JAN: BKG=66, GRP=42, CAP=175, LF%=37.7%, Brd-Off=JED-CAI, Classes: P:42, I:7, O:11, U:5, G:1
[LF] Getting WEEKLY/LASTSOLD data for 5 flights
[LF][[SYNC] RETRYING] Cannot focus on command line
[LF][[INFO] INFO] Will try 50 times before pausing...
[LF] SM424 16JAN: LASTSOLD=2026-01-05 00:00:00, WEEKLY=12, TODAY=0, YDAY=1
[LF][ERROR] Amadeus command error detected: INVALID FORMAT
[LF][ERROR] Command: LP/L(99)/SM476/16JAN
[LF][RESYNC] Triggering immediate resync to last successful SN command
[LF][ERROR] SM476 16JAN: LP/L(99)/SM476/16JAN: TECH_ERROR:INVALID FORMAT
[LF] SM480 16JAN: LASTSOLD=2026-01-05 00:00:00, WEEKLY=19, TODAY=0, YDAY=2
[LF] SM472 16JAN: LASTSOLD=2026-01-06 00:00:00, WEEKLY=4, TODAY=1, YDAY=2
[LF] SM460 16JAN: LASTSOLD=2026-01-05 00:00:00, WEEKLY=16, TODAY=0, YDAY=7
[LF] Processing JED-CAI for 15JAN
[LF] 15JAN: found 6 direct flights
[LF] SM472 15JAN: BKG=79, GRP=45, CAP=175, LF%=45.1%, Brd-Off=JED-CAI, Classes: P:45, I:24, U:9, X:1
[LF][[SYNC] RETRYING] Cannot focus on command line
[LF][[INFO] INFO] Will try 50 times before pausing...
[LF][[SYNC] RETRYING] Cannot focus on command line
[LF][[INFO] INFO] Will try 50 times before pausing...
[LF][[SYNC] RETRYING] Cannot focus on command line
[LF][[INFO] INFO] Will try 50 times before pausing...
[LF][[SYNC] RETRYING] Cannot focus on command line
[LF][[INFO] INFO] Will try 50 times before pausing...
[LF] SM450 15JAN: BKG=10, GRP=0, CAP=175, LF%=5.7%, Brd-Off=JED-CAI, Classes: O:180
[LF][[SYNC] RETRYING] Cannot focus on command line
[LF][[INFO] INFO] Will try 50 times before pausing...
[LF] SM476 15JAN: BKG=14, GRP=0, CAP=175, LF%=8.0%, Brd-Off=JED-CAI, Classes: I:14
[LF][[SYNC] RETRYING] Cannot focus on command line
[LF][[INFO] INFO] Will try 50 times before pausing...
[LF][ERROR] Amadeus command error detected: INVALID FORMAT
[LF][ERROR] Command: LL/I/SM432/15JAN
[LF][RESYNC] Triggering immediate resync to last successful SN command
============================================================
[LF][RESYNC] Command 'LL/I/SM432/15JAN' failed: TECH_ERROR:INVALID FORMAT
[LF][RESYNC] Re-running entire day from SN command for JED-CAI 15JAN
[LF][RESYNC] Attempt 1/50 (waiting 1.0s before retry...)
============================================================
[LF][RESYNC] Sending IG to clear session state...
[LF][[SYNC] RETRYING] Cannot focus on command line
[LF][[INFO] INFO] Will try 50 times before pausing...
[LF][RESYNC] Session cleared with IG
[LF] Processing JED-CAI for 15JAN
[LF] 15JAN: found 6 direct flights
[LF][[SYNC] RETRYING] Cannot focus on command line
[LF][[INFO] INFO] Will try 50 times before pausing...
[LF][[SYNC] RETRYING] Cannot focus on command line
[LF][[INFO] INFO] Will try 50 times before pausing...
[LF][ERROR] Amadeus command error detected: UNKNOWN TRANSACTION
[LF][ERROR] Command: M
[LF][RESYNC] Triggering immediate resync to last successful SN command
============================================================
[LF][RESYNC] Command 'M' failed: TECH_ERROR:UNKNOWN TRANSACTION
[LF][RESYNC] Re-running entire day from SN command for JED-CAI 15JAN
[LF][RESYNC] Attempt 2/50 (waiting 1.0s before retry...)
============================================================
[LF][RESYNC] Sending IG to clear session state...
[LF][[SYNC] RETRYING] Cannot focus on command line
[LF][[INFO] INFO] Will try 50 times before pausing...
[LF][RESYNC] Session cleared with IG
[LF] Processing JED-CAI for 15JAN
[LF] 15JAN: found 6 direct flights
[LF][[SYNC] RETRYING] Cannot focus on command line
[LF][[INFO] INFO] Will try 50 times before pausing...
[LF][ERROR] Amadeus command error detected: UNKNOWN TRANSACTION
[LF][ERROR] Command: LL/I/SM472/15JAN
[LF][RESYNC] Triggering immediate resync to last successful SN command
============================================================
[LF][RESYNC] Command 'LL/I/SM472/15JAN' failed: TECH_ERROR:UNKNOWN TRANSACTION
[LF][RESYNC] Re-running entire day from SN command for JED-CAI 15JAN
[LF][RESYNC] Attempt 3/50 (waiting 1.0s before retry...)
============================================================
[LF][RESYNC] Sending IG to clear session state...
[LF][RESYNC] Session cleared with IG
[LF] Processing JED-CAI for 15JAN
[LF] 15JAN: found 6 direct flights
[LF] SM472 15JAN: BKG=79, GRP=45, CAP=175, LF%=45.1%, Brd-Off=JED-CAI, Classes: P:45, I:24, U:9, X:1
[LF] SM450 15JAN: BKG=10, GRP=0, CAP=175, LF%=5.7%, Brd-Off=JED-CAI, Classes: I:9, U:1
[LF][[SYNC] RETRYING] Cannot focus on command line
[LF][[INFO] INFO] Will try 50 times before pausing...
[LF][[SYNC] RETRYING] Cannot focus on command line
[LF][[INFO] INFO] Will try 50 times before pausing...
[LF][RECONNECT] Connection lost. Attempting reconnect #1...
[LF][INFO] Make sure Chrome is open with remote debugging port
[LF][[OK] SUCCESS] Connected to Chrome on 127.0.0.1:9222 (after 1 attempts)
[LF][[OK] SUCCESS] Found Amadeus Altea window: Altéa Reservation Desktop
[LF][[INFO] INFO] URL: https://tc212.resdesktop.altea.amadeus.com/app_ard/apf/init/login?SITE=ESMPESMP&LANGUAGE=GB&MARKETS=ARDW_PROD_WBP&ACTION=clpLogin
[LF][SUCCESS] Chrome reconnected successfully!
[LF][RESUME] Restoring session context with: SN15JANJEDCAI/ASM
[LF][[SYNC] RETRYING] Cannot focus on command line
[LF][[INFO] INFO] Will try 50 times before pausing...
[LF][RESUME] Session context restored!
[LF] Processing JED-CAI for 15JAN
[LF] 15JAN: found 6 direct flights
[LF] SM472 15JAN: BKG=79, GRP=45, CAP=175, LF%=45.1%, Brd-Off=JED-CAI, Classes: P:45, I:24, U:9, X:1
[LF][[SYNC] RETRYING] Cannot focus on command line
[LF][[INFO] INFO] Will try 50 times before pausing...
[LF][[SYNC] RETRYING] Cannot focus on command line
[LF][[INFO] INFO] Will try 50 times before pausing...
[LF][RECONNECT] Connection lost. Attempting reconnect #2...
[LF][INFO] Make sure Chrome is open with remote debugging port
[LF][[OK] SUCCESS] Connected to Chrome on 127.0.0.1:9222 (after 1 attempts)
[LF][[OK] SUCCESS] Found Amadeus Altea window: Altéa Reservation Desktop
[LF][[INFO] INFO] URL: https://tc212.resdesktop.altea.amadeus.com/app_ard/apf/init/login?SITE=ESMPESMP&LANGUAGE=GB&MARKETS=ARDW_PROD_WBP&ACTION=clpLogin
[LF][SUCCESS] Chrome reconnected successfully!
[LF][RESUME] Restoring session context with: SN15JANJEDCAI/ASM
[LF][[SYNC] RETRYING] Cannot focus on command line
[LF][[INFO] INFO] Will try 50 times before pausing...
[LF][RESUME] Session context restored!
[LF] Processing JED-CAI for 15JAN
[LF][[SYNC] RETRYING] Cannot focus on command line
[LF][[INFO] INFO] Will try 50 times before pausing...
[LF] 15JAN: found 6 direct flights
[LF] SM472 15JAN: BKG=79, GRP=45, CAP=175, LF%=45.1%, Brd-Off=JED-CAI, Classes: P:45, I:24, U:9, X:1
[LF][[SYNC] RETRYING] Cannot focus on command line
[LF][[INFO] INFO] Will try 50 times before pausing...
[LF] SM450 15JAN: BKG=10, GRP=0, CAP=175, LF%=5.7%, Brd-Off=JED-CAI, Classes: I:9, U:1
[LF] SM476 15JAN: BKG=14, GRP=0, CAP=175, LF%=8.0%, Brd-Off=JED-CAI, Classes: I:14
[LF] SM432 15JAN: BKG=8, GRP=0, CAP=172, LF%=4.7%, Brd-Off=JED-CAI, Classes: I:8
[LF] SM478 15JAN: BKG=136, GRP=94, CAP=175, LF%=77.7%, Brd-Off=JED-CAI, Classes: P:94, I:27, O:5, U:9, X:1
[LF] SM480 15JAN: BKG=143, GRP=92, CAP=175, LF%=81.7%, Brd-Off=JED-CAI, Classes: P:92, I:24, O:17, U:8, S:1, L:1
[LF] Getting WEEKLY/LASTSOLD data for 6 flights
[LF] SM472 15JAN: LASTSOLD=2026-01-06 00:00:00, WEEKLY=24, TODAY=3, YDAY=7
[LF] SM450 15JAN: LASTSOLD=2026-01-04 00:00:00, WEEKLY=9, TODAY=0, YDAY=0
[LF] SM476 15JAN: LASTSOLD=2026-01-05 00:00:00, WEEKLY=12, TODAY=0, YDAY=2
[LF] SM432 15JAN: LASTSOLD=2026-01-04 00:00:00, WEEKLY=8, TODAY=0, YDAY=0
[LF] SM478 15JAN: LASTSOLD=2026-01-05 00:00:00, WEEKLY=23, TODAY=0, YDAY=8
[LF] SM480 15JAN: LASTSOLD=2026-01-06 00:00:00, WEEKLY=35, TODAY=1, YDAY=7
[LF] Processing JED-CAI for 14JAN
[LF] 14JAN: found 4 direct flights
[LF] SM476 14JAN: BKG=92, GRP=47, CAP=175, LF%=52.6%, Brd-Off=JED-CAI, Classes: P:47, I:24, O:14, U:6, S:1
[LPC] SM476 14JAN: Found 1 outbound flights with connecting passengers
[LF] SM478 14JAN: BKG=141, GRP=96, CAP=175, LF%=80.6%, Brd-Off=JED-CAI, Classes: P:51, E:45, I:24, O:4, U:15, X:2
[LF] SM460 14JAN: BKG=157, GRP=125, CAP=175, LF%=89.7%, Brd-Off=JED-CAI, Classes: P:125, I:18, O:8, U:6
[LF] SM424 14JAN: BKG=41, GRP=0, CAP=175, LF%=23.4%, Brd-Off=JED-CAI, Classes: I:25, O:11, U:4, G:1
[LF] Getting WEEKLY/LASTSOLD data for 4 flights
[LF] SM476 14JAN: LASTSOLD=2026-01-06 00:00:00, WEEKLY=32, TODAY=2, YDAY=5
[LF] SM478 14JAN: LASTSOLD=2026-01-05 00:00:00, WEEKLY=21, TODAY=0, YDAY=10
[LF] SM460 14JAN: LASTSOLD=2026-01-05 00:00:00, WEEKLY=23, TODAY=0, YDAY=3
[LF] SM424 14JAN: LASTSOLD=2026-01-05 00:00:00, WEEKLY=23, TODAY=0, YDAY=2
[LF] Processing JED-CAI for 13JAN
[LF] 13JAN: found 6 direct flights
[LF] SM472 13JAN: BKG=99, GRP=49, CAP=175, LF%=56.6%, Brd-Off=JED-CAI, Classes: P:49, I:12, O:18, U:16, S:4
[LPC] SM472 13JAN: Found 1 outbound flights with connecting passengers
[LF] SM480 13JAN: BKG=125, GRP=85, CAP=175, LF%=71.4%, Brd-Off=JED-CAI, Classes: P:40, E:45, U:19, X:21
[LF] SM478 13JAN: BKG=142, GRP=126, CAP=175, LF%=81.1%, Brd-Off=JED-CAI, Classes: P:126, U:14, X:1, K:1
[LF] SM460 13JAN: BKG=116, GRP=94, CAP=175, LF%=66.3%, Brd-Off=JED-CAI, Classes: N:2, P:93, E:1, U:9, X:11
[LF] SM424 13JAN: BKG=71, GRP=46, CAP=175, LF%=40.6%, Brd-Off=JED-CAI, Classes: P:46, I:2, O:14, U:9
[LF] SM476 13JAN: BKG=95, GRP=75, CAP=175, LF%=54.3%, Brd-Off=JED-CAI, Classes: P:75, O:13, U:3, X:3, K:1
[LF] Getting WEEKLY/LASTSOLD data for 6 flights
[LF] SM472 13JAN: LASTSOLD=2026-01-05 00:00:00, WEEKLY=46, TODAY=0, YDAY=8
[LF] SM480 13JAN: LASTSOLD=2026-01-05 00:00:00, WEEKLY=19, TODAY=0, YDAY=11
[LF] SM478 13JAN: LASTSOLD=2026-01-05 00:00:00, WEEKLY=5, TODAY=0, YDAY=2
[LF] SM460 13JAN: LASTSOLD=2026-01-05 00:00:00, WEEKLY=52, TODAY=0, YDAY=1
[LF] SM424 13JAN: LASTSOLD=2026-01-05 00:00:00, WEEKLY=20, TODAY=0, YDAY=4
[LF] SM476 13JAN: LASTSOLD=2026-01-06 00:00:00, WEEKLY=15, TODAY=2, YDAY=1
[LF] Processing JED-CAI for 12JAN
[LF] 12JAN: found 4 direct flights
[LF] SM480 12JAN: BKG=164, GRP=131, CAP=175, LF%=93.7%, Brd-Off=JED-CAI, Classes: P:131, U:24, X:8, W:1
[LF] SM476 12JAN: BKG=158, GRP=117, CAP=167, LF%=94.6%, Brd-Off=JED-CAI, Classes: P:117, U:12, X:23, T:4, G:1, K:1
[LF] SM478 12JAN: BKG=156, GRP=125, CAP=175, LF%=89.1%, Brd-Off=JED-CAI, Classes: P:125, U:10, X:15, T:3, S:2, K:1
[LPC] SM478 12JAN: Found 1 outbound flights with connecting passengers
[LF] SM460 12JAN: BKG=175, GRP=112, CAP=175, LF%=100.0%, Brd-Off=JED-CAI, Classes: P:112, O:15, U:26, X:20, G:1, L:1
[LPC] SM460 12JAN: Found 0 outbound flights with connecting passengers
[LF] Getting WEEKLY/LASTSOLD data for 4 flights
[LF] SM480 12JAN: LASTSOLD=2026-01-01 00:00:00, WEEKLY=14, TODAY=0, YDAY=0
[LF] SM476 12JAN: LASTSOLD=2026-01-05 00:00:00, WEEKLY=27, TODAY=0, YDAY=10
[LF] SM478 12JAN: LASTSOLD=2026-01-05 00:00:00, WEEKLY=18, TODAY=0, YDAY=5
[LF] SM460 12JAN: LASTSOLD=2026-01-06 00:00:00, WEEKLY=50, TODAY=2, YDAY=17
[LF] Processing JED-CAI for 11JAN
[LF] 11JAN: found 5 direct flights
[LF] SM424 11JAN: BKG=175, GRP=128, CAP=175, LF%=100.0%, Brd-Off=JED-CAI, Classes: N:1, P:65, E:62, U:9, X:13, T:19, V:6
[LPC] SM424 11JAN: Found 1 outbound flights with connecting passengers
[LF] SM476 11JAN: BKG=166, GRP=66, CAP=175, LF%=94.9%, Brd-Off=JED-CAI, Classes: P:66, I:1, U:23, X:30, T:17, W:15, S:13, Q:1
[LPC] SM476 11JAN: Found 1 outbound flights with connecting passengers
[LF] SM432 11JAN: BKG=167, GRP=140, CAP=175, LF%=95.4%, Brd-Off=JED-CAI, Classes: P:140, O:7, U:12, X:8
[LF] SM460 11JAN: BKG=175, GRP=94, CAP=175, LF%=100.0%, Brd-Off=JED-CAI, Classes: P:94, I:16, O:14, U:14, X:14, T:10, W:7, S:4, G:2
[LPC] SM460 11JAN: Found 0 outbound flights with connecting passengers
[LF] SM478 11JAN: BKG=165, GRP=137, CAP=175, LF%=94.3%, Brd-Off=JED-CAI, Classes: P:43, E:94, U:13, X:11, S:4
[LF] Getting WEEKLY/LASTSOLD data for 5 flights
[LF] SM424 11JAN: LASTSOLD=2026-01-05 00:00:00, WEEKLY=27, TODAY=0, YDAY=1
[LF] SM476 11JAN: LASTSOLD=2026-01-05 00:00:00, WEEKLY=59, TODAY=0, YDAY=1
[LF] SM432 11JAN: LASTSOLD=2026-01-01 00:00:00, WEEKLY=4, TODAY=0, YDAY=0
[LF] SM460 11JAN: LASTSOLD=2026-01-05 00:00:00, WEEKLY=49, TODAY=0, YDAY=4
[LF] SM478 11JAN: LASTSOLD=2026-01-01 00:00:00, WEEKLY=3, TODAY=0, YDAY=0
[LF] Processing JED-CAI for 10JAN
[LF] 10JAN: found 3 direct flights
[LF] SM450 10JAN: BKG=167, GRP=79, CAP=175, LF%=95.4%, Brd-Off=JED-CAI, Classes: P:79, U:10, X:12, T:5, W:8, S:4, G:10, L:11, V:25, K:3
[LPC] SM450 10JAN: Found 2 outbound flights with connecting passengers
[LF] SM476 10JAN: BKG=161, GRP=88, CAP=175, LF%=92.0%, Brd-Off=JED-CAI, Classes: P:88, U:10, X:12, T:12, W:1, G:19, L:11, V:8
[LPC] SM476 10JAN: Found 2 outbound flights with connecting passengers
[LF] SM478 10JAN: BKG=168, GRP=121, CAP=175, LF%=96.0%, Brd-Off=JED-CAI, Classes: P:121, U:10, X:15, T:17, W:2, K:3
[LF] Getting WEEKLY/LASTSOLD data for 3 flights
[LF] SM450 10JAN: LASTSOLD=2026-01-05 00:00:00, WEEKLY=10, TODAY=0, YDAY=3
[LF] SM476 10JAN: LASTSOLD=2026-01-05 00:00:00, WEEKLY=16, TODAY=0, YDAY=6
[LF] SM478 10JAN: LASTSOLD=2026-01-05 00:00:00, WEEKLY=6, TODAY=0, YDAY=2
[LF] Processing JED-CAI for 09JAN
[LF] 09JAN: found 6 direct flights
[LF] SM424 09JAN: BKG=131, GRP=1, CAP=175, LF%=74.9%, Brd-Off=JED-CAI, Classes: P:1, U:10, X:12, T:7, W:11, S:8, G:5, L:27, V:44, K:6
[LPC] SM424 09JAN: Found 2 outbound flights with connecting passengers
[LF] SM476 09JAN: BKG=170, GRP=58, CAP=175, LF%=97.1%, Brd-Off=JED-CAI, Classes: P:58, U:10, X:12, T:10, W:8, S:29, G:14, L:15, V:14
[LPC] SM476 09JAN: Found 1 outbound flights with connecting passengers
[LF] SM478 09JAN: BKG=138, GRP=0, CAP=175, LF%=78.9%, Brd-Off=JED-CAI, Classes: U:10, X:12, T:12, W:12, S:11, G:11, L:25, V:23, K:22
[LPC] SM478 09JAN: Found 2 outbound flights with connecting passengers
[LF] SM480 09JAN: BKG=172, GRP=45, CAP=175, LF%=98.3%, Brd-Off=JED-CAI, Classes: P:45, U:9, X:12, T:12, W:10, S:14, G:21, L:10, V:32, K:7
[LF] SM472 09JAN: BKG=164, GRP=54, CAP=175, LF%=93.7%, Brd-Off=JED-CAI, Classes: P:54, U:10, X:12, T:12, W:12, S:11, G:15, L:16, V:19, K:3
[LPC] SM472 09JAN: Found 0 outbound flights with connecting passengers
[LF] SM460 09JAN: BKG=175, GRP=135, CAP=175, LF%=100.0%, Brd-Off=JED-CAI, Classes: P:135, U:10, X:12, T:8, G:1, V:9
[LPC] SM460 09JAN: Found 0 outbound flights with connecting passengers
[LF] Getting WEEKLY/LASTSOLD data for 6 flights
[LF] SM424 09JAN: LASTSOLD=2026-01-05 00:00:00, WEEKLY=32, TODAY=0, YDAY=12
[LF] SM476 09JAN: LASTSOLD=2026-01-02 00:00:00, WEEKLY=5, TODAY=0, YDAY=0
[LF] SM478 09JAN: LASTSOLD=2026-01-05 00:00:00, WEEKLY=13, TODAY=0, YDAY=3
[LF] SM480 09JAN: LASTSOLD=2026-01-05 00:00:00, WEEKLY=25, TODAY=0, YDAY=4
[LF] SM472 09JAN: LASTSOLD=2026-01-06 00:00:00, WEEKLY=38, TODAY=5, YDAY=15
[LF] SM460 09JAN: LASTSOLD=2026-01-05 00:00:00, WEEKLY=10, TODAY=0, YDAY=1
[LF] Processing JED-CAI for 08JAN
[LF] 08JAN: found 6 direct flights
[LF] SM472 08JAN: BKG=178, GRP=47, CAP=178, LF%=100.0%, Brd-Off=JED-CAI, Classes: P:49, U:19, X:21, T:28, W:15, S:44, K:2
[LPC] SM472 08JAN: Found 4 outbound flights with connecting passengers
[LF] SM450 08JAN: BKG=178, GRP=15, CAP=178, LF%=100.0%, Brd-Off=JED-CAI, Classes: E:15, U:10, X:12, T:25, W:1, S:25, G:21, L:15, V:23, K:19, Q:10, H:2
[LPC] SM450 08JAN: Found 3 outbound flights with connecting passengers
[LF] SM476 08JAN: BKG=178, GRP=120, CAP=178, LF%=100.0%, Brd-Off=JED-CAI, Classes: P:120, U:10, X:17, T:7, W:5, S:19
[LPC] SM476 08JAN: Found 1 outbound flights with connecting passengers
[LF] SM432 08JAN: BKG=178, GRP=120, CAP=178, LF%=100.0%, Brd-Off=JED-CAI, Classes: P:121, X:12, T:17, W:16, S:5, G:7
[LF] SM478 08JAN: BKG=178, GRP=92, CAP=178, LF%=100.0%, Brd-Off=JED-CAI, Classes: P:92, U:10, X:12, T:11, W:11, S:11, G:11, L:18, K:1, Q:1
[LF] SM480 08JAN: BKG=177, GRP=90, CAP=178, LF%=99.4%, Brd-Off=JED-CAI, Classes: P:90, U:10, X:12, T:12, W:10, S:11, G:16, L:3, V:13
[LF] Getting WEEKLY/LASTSOLD data for 6 flights
[LF] SM472 08JAN: LASTSOLD=2026-01-05 00:00:00, WEEKLY=32, TODAY=0, YDAY=10
[LF] SM450 08JAN: LASTSOLD=2026-01-05 00:00:00, WEEKLY=15, TODAY=0, YDAY=13
[LF] SM476 08JAN: LASTSOLD=2026-01-05 00:00:00, WEEKLY=4, TODAY=0, YDAY=3
[LF] SM432 08JAN: LASTSOLD=2026-01-06 00:00:00, WEEKLY=10, TODAY=2, YDAY=8
[LF] SM478 08JAN: LASTSOLD=2026-01-06 00:00:00, WEEKLY=17, TODAY=3, YDAY=2
[LF] SM480 08JAN: LASTSOLD=2026-01-06 00:00:00, WEEKLY=7, TODAY=1, YDAY=4
[LF] Processing JED-CAI for 07JAN
[LF] 07JAN: found 4 direct flights
[LF] SM476 07JAN: BKG=178, GRP=136, CAP=178, LF%=100.0%, Brd-Off=JED-CAI, Classes: P:136, U:10, X:11, T:3, W:8, S:7, G:3
[LF] SM478 07JAN: BKG=178, GRP=95, CAP=178, LF%=100.0%, Brd-Off=JED-CAI, Classes: P:48, E:47, U:10, X:12, T:20, W:22, S:10, G:9
[LF] SM460 07JAN: BKG=179, GRP=137, CAP=179, LF%=100.0%, Brd-Off=JED-CAI, Classes: P:137, U:10, X:11, T:13, S:3, L:2, K:3
[LPC] SM460 07JAN: Found 0 outbound flights with connecting passengers
[LF] SM424 07JAN: BKG=178, GRP=142, CAP=178, LF%=100.0%, Brd-Off=JED-CAI, Classes: N:1, P:142, U:10, X:9, T:5, W:5, S:5, G:1
[LF] Getting WEEKLY/LASTSOLD data for 4 flights
[LF] SM476 07JAN: LASTSOLD=2026-01-05 00:00:00, WEEKLY=5, TODAY=0, YDAY=2
[LF] SM478 07JAN: LASTSOLD=2026-01-05 00:00:00, WEEKLY=15, TODAY=0, YDAY=1
[LF] SM460 07JAN: LASTSOLD=2026-01-05 00:00:00, WEEKLY=9, TODAY=0, YDAY=5
[LF] SM424 07JAN: LASTSOLD=2026-01-04 00:00:00, WEEKLY=5, TODAY=0, YDAY=0
[LF] Skipping 06JAN (Today) - will be processed by supplement scan
[LF] Results summary:
  2026-01-16: 6 flights
  2026-01-15: 6 flights
  2026-01-14: 4 flights
  2026-01-13: 6 flights
  2026-01-12: 4 flights
  2026-01-11: 5 flights
  2026-01-10: 3 flights
  2026-01-09: 6 flights
  2026-01-08: 6 flights
  2026-01-07: 4 flights
  2026-01-18: [ERROR] Max retries (5) exceeded for 18JAN
  2026-01-17: [ERROR] Max retries (5) exceeded for 17JAN

============================================================
[Worker_9222] ✓ COMPLETED: JED-CAI
  Results: 10 dates
  Errors: 2 dates
  Total Processed: 1 groups
============================================================


============================================================
[Worker_9222] Shutdown signal received
Exiting...
============================================================

============================================================
[Worker_9222] FINISHED
  Total Groups Processed: 1
============================================================

