
============================================================
     LF WORKER - PORT 9225
============================================================
Worker: Worker_9225
Status: READY
Waiting for tasks...
============================================================


============================================================
[Worker_9225] Processing: JED-ATZ
  Tier 0: Range 2, Chunk 2/2
  Dates: 6 days
  Date Range: 2026-01-13 to 2026-01-08
============================================================

2025-12-26 01:53:41 | INFO     | ======================================================================
2025-12-26 01:53:41 | INFO     | Load Factor Scraper Started - Route: JED-ATZ
2025-12-26 01:53:41 | INFO     | Log file: D:\CODERED\OUTPUTS\logs\LF_JED-ATZ_20251226_015341.log
2025-12-26 01:53:41 | INFO     | Enhanced logging: Capturing both logging.info() and print()
2025-12-26 01:53:41 | INFO     | ======================================================================
[LF] Processing dates (override): ['13JAN', '12JAN', '11JAN', '10JAN', '09JAN', '08JAN']
[LF] Attaching to Chrome for Altea access
[LF][[OK] SUCCESS] Connected to Chrome on 127.0.0.1:9225 (after 1 attempts)
[LF][[OK] SUCCESS] Found Amadeus Altea window: Altéa Reservation Desktop
[LF][[INFO] INFO] URL: https://tc212.resdesktop.altea.amadeus.com/app_ard/apf/init/login?SITE=ESMPESMP&LANGUAGE=GB&MARKETS=ARDW_PROD_WBP&ACTION=clpLogin
[LF] Processing JED-ATZ for 13JAN
[LF][ERROR] Amadeus command error detected: UNKNOWN TRANSACTION
[LF][ERROR] Command: SN13JANJEDATZ/ASM
[LF][RESYNC] Triggering immediate resync to last successful SN command
============================================================
[LF][RESYNC] Command 'SN13JANJEDATZ/ASM' failed: TECH_ERROR:UNKNOWN TRANSACTION
[LF][RESYNC] Re-running entire day from SN command for JED-ATZ 13JAN
[LF][RESYNC] Attempt 1/50 (waiting 1.0s before retry...)
============================================================
[LF][RESYNC] Sending IG to clear session state...
[LF][RESYNC] Session cleared with IG
[LF] Processing JED-ATZ for 13JAN
[LF] 13JAN: found 2 direct flights
[LF] SM454 13JAN: BKG=173, GRP=169, CAP=167, LF%=103.6%, Brd-Off=JED-ATZ, Classes: P:169, I:2, W:1, S:1
[LF] SM456 13JAN: BKG=137, GRP=127, CAP=167, LF%=82.0%, Brd-Off=JED-ATZ, Classes: P:81, E:46, I:4, O:2, U:3, G:1
[LF] Getting WEEKLY/LASTSOLD data for 2 flights
[LF] SM454 13JAN: LASTSOLD=2025-12-07 00:00:00, WEEKLY=0, TODAY=0, YDAY=0
[LF] SM456 13JAN: LASTSOLD=2025-12-10 00:00:00, WEEKLY=0, TODAY=0, YDAY=0
[LF] Processing JED-ATZ for 12JAN
[LF] 12JAN: found 3 direct flights
[LF] SM456 12JAN: BKG=139, GRP=130, CAP=167, LF%=83.2%, Brd-Off=JED-ATZ, Classes: P:130, I:4, O:2, U:3
[LF] SM492 12JAN: BKG=112, GRP=94, CAP=167, LF%=67.1%, Brd-Off=JED-ATZ, Classes: P:45, E:49, I:4, O:2, U:3, X:1, W:8
[LF] SM454 12JAN: BKG=144, GRP=135, CAP=167, LF%=86.2%, Brd-Off=JED-ATZ, Classes: P:94, E:41, I:4, O:2, U:3
[LF] Getting WEEKLY/LASTSOLD data for 3 flights
[LF] SM456 12JAN: LASTSOLD=2025-12-16 00:00:00, WEEKLY=0, TODAY=0, YDAY=0
[LF] SM492 12JAN: LASTSOLD=2025-12-24 00:00:00, WEEKLY=8, TODAY=0, YDAY=0
[LF] SM454 12JAN: LASTSOLD=2025-12-25 00:00:00, WEEKLY=5, TODAY=0, YDAY=5
[LF] Processing JED-ATZ for 11JAN
[LF] 11JAN: found 2 direct flights
[LF] SM492 11JAN: BKG=180, GRP=180, CAP=167, LF%=107.8%, Brd-Off=JED-ATZ, Classes: P:180
[LF] SM456 11JAN: BKG=156, GRP=141, CAP=167, LF%=93.4%, Brd-Off=JED-ATZ, Classes: P:141, I:4, O:2, U:3, X:1, V:4, K:1
[LF] Getting WEEKLY/LASTSOLD data for 2 flights
[LF] SM492 11JAN: LASTSOLD=2025-11-23 00:00:00, WEEKLY=0, TODAY=0, YDAY=0
[LF] SM456 11JAN: LASTSOLD=2025-12-24 00:00:00, WEEKLY=7, TODAY=0, YDAY=0
[LF] Processing JED-ATZ for 10JAN
[LF] 10JAN: found 3 direct flights
[LF] SM492 10JAN: BKG=152, GRP=139, CAP=167, LF%=91.0%, Brd-Off=JED-ATZ, Classes: P:139, I:4, O:2, U:3, S:4
[LF] SM454 10JAN: BKG=154, GRP=139, CAP=167, LF%=92.2%, Brd-Off=JED-ATZ, Classes: P:139, I:4, O:2, U:3, X:5, W:1
[LF] SM456 10JAN: BKG=162, GRP=142, CAP=167, LF%=97.0%, Brd-Off=JED-ATZ, Classes: P:142, I:4, O:2, U:3, X:5, S:2, V:1, K:3
[LPC] SM456 10JAN: Found 0 outbound flights with connecting passengers
[LF] Getting WEEKLY/LASTSOLD data for 3 flights
[LF] SM492 10JAN: LASTSOLD=2025-12-25 00:00:00, WEEKLY=52, TODAY=0, YDAY=6
[LF] SM454 10JAN: LASTSOLD=2025-12-23 00:00:00, WEEKLY=52, TODAY=0, YDAY=0
[LF] SM456 10JAN: LASTSOLD=2025-12-24 00:00:00, WEEKLY=13, TODAY=0, YDAY=0
[LF] Processing JED-ATZ for 09JAN
[LF] 09JAN: found 1 direct flights
[LF] SM492 09JAN: BKG=44, GRP=2, CAP=167, LF%=26.4%, Brd-Off=JED-ATZ, Classes: E:2, I:4, O:2, U:3, X:5, T:14, W:10, S:2, V:1, K:1
[LF] Getting WEEKLY/LASTSOLD data for 1 flights
[LF] SM492 09JAN: LASTSOLD=2025-12-24 00:00:00, WEEKLY=25, TODAY=0, YDAY=0
[LF] Processing JED-ATZ for 08JAN
[LF] 08JAN: 1 cancelled flight(s) detected from SN
[LF] 08JAN: found 3 direct flights
[LF] SM422 08JAN: BKG=167, GRP=139, CAP=167, LF%=100.0%, Brd-Off=JED-ATZ, Classes: P:135, E:4, I:10, O:9, U:3, X:1, W:2, S:3
[LF] SM454 08JAN: BKG=132, GRP=86, CAP=167, LF%=79.0%, Brd-Off=JED-ATZ, Classes: P:86, I:4, O:2, U:3, X:8, T:13, W:1, S:14, K:1
[LF] SM456 08JAN: BKG=179, GRP=171, CAP=167, LF%=107.2%, Brd-Off=JED-ATZ, Classes: P:171, I:4, O:1, U:3
[LF] Getting WEEKLY/LASTSOLD data for 3 flights
[LF] SM422 08JAN: LASTSOLD=2025-12-17 00:00:00, WEEKLY=0, TODAY=0, YDAY=0
[LF] SM454 08JAN: LASTSOLD=2025-12-25 00:00:00, WEEKLY=13, TODAY=0, YDAY=6
[LF] SM456 08JAN: LASTSOLD=2025-12-24 00:00:00, WEEKLY=3, TODAY=0, YDAY=0
[LF] Results summary:
  2026-01-13: 2 flights
  2026-01-12: 3 flights
  2026-01-11: 2 flights
  2026-01-10: 3 flights
  2026-01-09: 1 flights
  2026-01-08: 3 flights
[LF] Cancelled flights found: 1
  - SM492 08JAN (SN)
[Worker_9225] Cancelled flights collected: 1

============================================================
[Worker_9225] ✓ COMPLETED: JED-ATZ
  Results: 6 dates
  Errors: 0 dates
  Total Processed: 1 groups
============================================================


============================================================
[Worker_9225] Processing: HBE-JED
  Tier 0: Range 1, Chunk 1/2
  Dates: 6 days
  Date Range: 2026-01-07 to 2026-01-02
============================================================

2025-12-26 01:55:54 | INFO     | ======================================================================
2025-12-26 01:55:54 | INFO     | Load Factor Scraper Started - Route: HBE-JED
2025-12-26 01:55:54 | INFO     | Log file: D:\CODERED\OUTPUTS\logs\LF_HBE-JED_20251226_015554.log
2025-12-26 01:55:54 | INFO     | Enhanced logging: Capturing both logging.info() and print()
2025-12-26 01:55:54 | INFO     | ======================================================================
[LF] Processing dates (override): ['07JAN', '06JAN', '05JAN', '04JAN', '03JAN', '02JAN']
[LF] Attaching to Chrome for Altea access
2025-12-26 01:55:54 | INFO     | Starting LF search for route: HBE-JED
2025-12-26 01:55:54 | INFO     | [START] LF Search
[LF][[OK] SUCCESS] Connected to Chrome on 127.0.0.1:9225 (after 1 attempts)
2025-12-26 01:55:55 | INFO     | [HEALTH CHECK] [OK] Chrome connection is healthy
[LF][[OK] SUCCESS] Found Amadeus Altea window: Altéa Reservation Desktop
[LF][[INFO] INFO] URL: https://tc212.resdesktop.altea.amadeus.com/app_ard/apf/init/login?SITE=ESMPESMP&LANGUAGE=GB&MARKETS=ARDW_PROD_WBP&ACTION=clpLogin
2025-12-26 01:55:55 | INFO     | [DAY_START] Processing 07JAN
[LF] Processing HBE-JED for 07JAN
2025-12-26 01:55:55 | INFO     | [lf.day.start] Processing HBE-JED for 07JAN
[LF] 07JAN: found 3 direct flights
2025-12-26 01:55:57 | INFO     | [lf.day.flights_found] Found 3 flights on 07JAN
2025-12-26 01:55:58 | INFO     | [lf.flight.extracted] SM451 on 07JAN: BKG=160, LF=89.4%
[LF] SM451 07JAN: BKG=160, GRP=140, CAP=179, LF%=89.4%, Brd-Off=HBE-JED, Classes: P:140, X:10, T:3, W:5, S:2
2025-12-26 01:56:02 | INFO     | [lf.flight.extracted] SM457 on 07JAN: BKG=173, LF=96.7%
[LF] SM457 07JAN: BKG=173, GRP=135, CAP=179, LF%=96.7%, Brd-Off=HBE-JED, Classes: P:135, I:9, O:9, U:9, X:9, T:2
2025-12-26 01:56:06 | INFO     | [lf.flight.extracted] SM473 on 07JAN: BKG=176, LF=98.3%
[LF] SM473 07JAN: BKG=176, GRP=170, CAP=179, LF%=98.3%, Brd-Off=HBE-JED, Classes: P:170, X:6
[LF] Getting WEEKLY/LASTSOLD data for 3 flights
[LF] SM451 07JAN: LASTSOLD=2025-12-25 00:00:00, WEEKLY=5, TODAY=0, YDAY=2
[LF] SM457 07JAN: LASTSOLD=2025-12-17 00:00:00, WEEKLY=0, TODAY=0, YDAY=0
[LF] SM473 07JAN: LASTSOLD=2025-12-21 00:00:00, WEEKLY=3, TODAY=0, YDAY=0
2025-12-26 01:56:14 | INFO     | [SUCCESS] Day 07JAN
2025-12-26 01:56:14 | INFO     | [DAY_START] Processing 06JAN
[LF] Processing HBE-JED for 06JAN
2025-12-26 01:56:14 | INFO     | [lf.day.start] Processing HBE-JED for 06JAN
[LF] 06JAN: found 1 direct flights
2025-12-26 01:56:16 | INFO     | [lf.day.flights_found] Found 1 flights on 06JAN
2025-12-26 01:56:18 | INFO     | [lf.flight.extracted] SM451 on 06JAN: BKG=158, LF=88.3%
[LF] SM451 06JAN: BKG=158, GRP=135, CAP=179, LF%=88.3%, Brd-Off=HBE-JED, Classes: P:135, X:15, T:8
[LF] Getting WEEKLY/LASTSOLD data for 1 flights
[LF] SM451 06JAN: LASTSOLD=2025-12-25 00:00:00, WEEKLY=5, TODAY=0, YDAY=3
2025-12-26 01:56:22 | INFO     | [SUCCESS] Day 06JAN
2025-12-26 01:56:22 | INFO     | [DAY_START] Processing 05JAN
[LF] Processing HBE-JED for 05JAN
2025-12-26 01:56:22 | INFO     | [lf.day.start] Processing HBE-JED for 05JAN
[LF] 05JAN: found 2 direct flights
2025-12-26 01:56:23 | INFO     | [lf.day.flights_found] Found 2 flights on 05JAN
2025-12-26 01:56:25 | INFO     | [lf.flight.extracted] SM457 on 05JAN: BKG=170, LF=95.0%
[LF] SM457 05JAN: BKG=170, GRP=135, CAP=179, LF%=95.0%, Brd-Off=HBE-JED, Classes: P:135, I:8, O:8, U:8, X:8, T:3
2025-12-26 01:56:29 | INFO     | [lf.flight.extracted] SM451 on 05JAN: BKG=158, LF=88.3%
[LF] SM451 05JAN: BKG=158, GRP=135, CAP=179, LF%=88.3%, Brd-Off=HBE-JED, Classes: P:135, X:10, T:9, S:2, K:2
[LF] Getting WEEKLY/LASTSOLD data for 2 flights
[LF] SM457 05JAN: LASTSOLD=2025-12-25 00:00:00, WEEKLY=3, TODAY=0, YDAY=1
[LF] SM451 05JAN: LASTSOLD=2025-12-25 00:00:00, WEEKLY=5, TODAY=0, YDAY=2
2025-12-26 01:56:36 | INFO     | [SUCCESS] Day 05JAN
2025-12-26 01:56:36 | INFO     | [DAY_START] Processing 04JAN
[LF] Processing HBE-JED for 04JAN
2025-12-26 01:56:36 | INFO     | [lf.day.start] Processing HBE-JED for 04JAN
[LF] 04JAN: found 2 direct flights
2025-12-26 01:56:37 | INFO     | [lf.day.flights_found] Found 2 flights on 04JAN
2025-12-26 01:56:39 | INFO     | [lf.flight.extracted] SM451 on 04JAN: BKG=146, LF=81.6%
[LF] SM451 04JAN: BKG=146, GRP=135, CAP=179, LF%=81.6%, Brd-Off=HBE-JED, Classes: P:135, X:10, T:1
2025-12-26 01:56:43 | INFO     | [lf.flight.extracted] SM457 on 04JAN: BKG=165, LF=92.2%
[LF] SM457 04JAN: BKG=165, GRP=140, CAP=179, LF%=92.2%, Brd-Off=HBE-JED, Classes: P:140, X:18, T:6, K:1
[LF] Getting WEEKLY/LASTSOLD data for 2 flights
[LF] SM451 04JAN: LASTSOLD=2025-12-25 00:00:00, WEEKLY=3, TODAY=0, YDAY=1
[LF] SM457 04JAN: LASTSOLD=2025-12-25 00:00:00, WEEKLY=10, TODAY=0, YDAY=1
2025-12-26 01:56:49 | INFO     | [SUCCESS] Day 04JAN
2025-12-26 01:56:49 | INFO     | [DAY_START] Processing 03JAN
[LF] Processing HBE-JED for 03JAN
2025-12-26 01:56:49 | INFO     | [lf.day.start] Processing HBE-JED for 03JAN
[LF] 03JAN: found 2 direct flights
2025-12-26 01:56:51 | INFO     | [lf.day.flights_found] Found 2 flights on 03JAN
2025-12-26 01:56:53 | INFO     | [lf.flight.extracted] SM457 on 03JAN: BKG=125, LF=69.8%
[LF] SM457 03JAN: BKG=125, GRP=106, CAP=179, LF%=69.8%, Brd-Off=HBE-JED, Classes: P:106, X:8, T:8, S:3
[LPC] SM457 03JAN: Found 1 outbound flights with connecting passengers
2025-12-26 01:56:58 | INFO     | [lf.flight.extracted] SM451 on 03JAN: BKG=87, LF=48.6%
[LF] SM451 03JAN: BKG=87, GRP=45, CAP=179, LF%=48.6%, Brd-Off=HBE-JED, Classes: P:45, U:14, X:14, T:11, W:3
[LF] Getting WEEKLY/LASTSOLD data for 2 flights
[LF] SM457 03JAN: LASTSOLD=2025-12-25 00:00:00, WEEKLY=3, TODAY=0, YDAY=1
[LF] SM451 03JAN: LASTSOLD=2025-12-25 00:00:00, WEEKLY=19, TODAY=0, YDAY=6
2025-12-26 01:57:07 | INFO     | [SUCCESS] Day 03JAN
2025-12-26 01:57:07 | INFO     | [DAY_START] Processing 02JAN
[LF] Processing HBE-JED for 02JAN
2025-12-26 01:57:07 | INFO     | [lf.day.start] Processing HBE-JED for 02JAN
[LF] 02JAN: found 1 direct flights
2025-12-26 01:57:08 | INFO     | [lf.day.flights_found] Found 1 flights on 02JAN
2025-12-26 01:57:10 | INFO     | [lf.flight.extracted] SM451 on 02JAN: BKG=63, LF=35.2%
[LF] SM451 02JAN: BKG=63, GRP=45, CAP=179, LF%=35.2%, Brd-Off=HBE-JED, Classes: P:45, U:6, T:12
[LF] Getting WEEKLY/LASTSOLD data for 1 flights
[LF] SM451 02JAN: LASTSOLD=2025-12-25 00:00:00, WEEKLY=8, TODAY=0, YDAY=5
2025-12-26 01:57:13 | INFO     | [SUCCESS] Day 02JAN
[LF] Results summary:
  2026-01-07: 3 flights
  2026-01-06: 1 flights
  2026-01-05: 2 flights
  2026-01-04: 2 flights
  2026-01-03: 2 flights
  2026-01-02: 1 flights
2025-12-26 01:57:13 | INFO     | [SUCCESS] LF Search Complete

============================================================
[Worker_9225] ✓ COMPLETED: HBE-JED
  Results: 6 dates
  Errors: 0 dates
  Total Processed: 2 groups
============================================================

2025-12-26 01:57:15 | INFO     | [Worker_9225] Completed: HBE-JED - 6 results, 0 errors

============================================================
[Worker_9225] Processing: HBE-JED
  Tier 0: Range 1, Chunk 2/2
  Dates: 6 days
  Date Range: 2026-01-01 to 2025-12-27
============================================================

2025-12-26 01:57:15 | INFO     | [Worker_9225] Processing: HBE-JED
2025-12-26 01:57:15 | INFO     |   Tier 0: Range 1, Chunk 2/2 (6 days)
2025-12-26 01:57:15 | INFO     | ======================================================================
2025-12-26 01:57:15 | INFO     | Load Factor Scraper Started - Route: HBE-JED
2025-12-26 01:57:15 | INFO     | Log file: D:\CODERED\OUTPUTS\logs\LF_HBE-JED_20251226_015715.log
2025-12-26 01:57:15 | INFO     | Enhanced logging: Capturing both logging.info() and print()
2025-12-26 01:57:15 | INFO     | ======================================================================
[LF] Processing dates (override): ['01JAN', '31DEC', '30DEC', '29DEC', '28DEC', '27DEC']
[LF] Attaching to Chrome for Altea access
2025-12-26 01:57:15 | INFO     | Starting LF search for route: HBE-JED
2025-12-26 01:57:15 | INFO     | [START] LF Search
[LF][[OK] SUCCESS] Connected to Chrome on 127.0.0.1:9225 (after 1 attempts)
2025-12-26 01:57:17 | INFO     | [HEALTH CHECK] [OK] Chrome connection is healthy
[LF][[OK] SUCCESS] Found Amadeus Altea window: Altéa Reservation Desktop
[LF][[INFO] INFO] URL: https://tc212.resdesktop.altea.amadeus.com/app_ard/apf/init/login?SITE=ESMPESMP&LANGUAGE=GB&MARKETS=ARDW_PROD_WBP&ACTION=clpLogin
2025-12-26 01:57:17 | INFO     | [DAY_START] Processing 01JAN
[LF] Processing HBE-JED for 01JAN
2025-12-26 01:57:17 | INFO     | [lf.day.start] Processing HBE-JED for 01JAN
[LF] 01JAN: found 1 direct flights
2025-12-26 01:57:19 | INFO     | [lf.day.flights_found] Found 1 flights on 01JAN
2025-12-26 01:57:21 | INFO     | [lf.flight.extracted] SM451 on 01JAN: BKG=168, LF=93.8%
[LF] SM451 01JAN: BKG=168, GRP=150, CAP=179, LF%=93.8%, Brd-Off=HBE-JED, Classes: P:150, X:1, T:17
[LPC] SM451 01JAN: Found 1 outbound flights with connecting passengers
[LF] Getting WEEKLY/LASTSOLD data for 1 flights
[LF] SM451 01JAN: LASTSOLD=2025-12-21 00:00:00, WEEKLY=1, TODAY=0, YDAY=0
2025-12-26 01:57:24 | INFO     | [SUCCESS] Day 01JAN
2025-12-26 01:57:24 | INFO     | [DAY_START] Processing 31DEC
[LF] Processing HBE-JED for 31DEC
2025-12-26 01:57:24 | INFO     | [lf.day.start] Processing HBE-JED for 31DEC
[LF] 31DEC: found 3 direct flights
2025-12-26 01:57:26 | INFO     | [lf.day.flights_found] Found 3 flights on 31DEC
2025-12-26 01:57:28 | INFO     | [lf.flight.extracted] SM451 on 31DEC: BKG=155, LF=86.6%
[LF] SM451 31DEC: BKG=155, GRP=130, CAP=179, LF%=86.6%, Brd-Off=HBE-JED, Classes: P:130, X:20, T:4, S:1
2025-12-26 01:57:31 | INFO     | [lf.flight.extracted] SM457 on 31DEC: BKG=162, LF=90.5%
[LF] SM457 31DEC: BKG=162, GRP=138, CAP=179, LF%=90.5%, Brd-Off=HBE-JED, Classes: P:138, X:17, T:7
2025-12-26 01:57:35 | INFO     | [lf.flight.extracted] SM473 on 31DEC: BKG=166, LF=92.7%
[LF] SM473 31DEC: BKG=166, GRP=148, CAP=179, LF%=92.7%, Brd-Off=HBE-JED, Classes: P:148, X:10, T:5, W:3
[LF] Getting WEEKLY/LASTSOLD data for 3 flights
[LF] SM451 31DEC: LASTSOLD=2025-12-25 00:00:00, WEEKLY=9, TODAY=0, YDAY=3
[LF] SM457 31DEC: LASTSOLD=2025-12-25 00:00:00, WEEKLY=8, TODAY=0, YDAY=5
[LF] SM473 31DEC: LASTSOLD=2025-12-24 00:00:00, WEEKLY=10, TODAY=0, YDAY=0
2025-12-26 01:57:51 | INFO     | [SUCCESS] Day 31DEC
2025-12-26 01:57:51 | INFO     | [DAY_START] Processing 30DEC
[LF] Processing HBE-JED for 30DEC
2025-12-26 01:57:51 | INFO     | [lf.day.start] Processing HBE-JED for 30DEC
[LF] 30DEC: found 1 direct flights
2025-12-26 01:57:52 | INFO     | [lf.day.flights_found] Found 1 flights on 30DEC
2025-12-26 01:57:54 | INFO     | [lf.flight.extracted] SM451 on 30DEC: BKG=169, LF=94.4%
[LF] SM451 30DEC: BKG=169, GRP=137, CAP=179, LF%=94.4%, Brd-Off=HBE-JED, Classes: P:137, I:5, O:5, U:5, X:5, T:10, W:1, K:1
[LPC] SM451 30DEC: Found 0 outbound flights with connecting passengers
[LF] Getting WEEKLY/LASTSOLD data for 1 flights
[LF] SM451 30DEC: LASTSOLD=2025-12-22 00:00:00, WEEKLY=1, TODAY=0, YDAY=0
2025-12-26 01:57:58 | INFO     | [SUCCESS] Day 30DEC
2025-12-26 01:57:58 | INFO     | [DAY_START] Processing 29DEC
[LF] Processing HBE-JED for 29DEC
2025-12-26 01:57:58 | INFO     | [lf.day.start] Processing HBE-JED for 29DEC
[LF] 29DEC: found 2 direct flights
2025-12-26 01:57:59 | INFO     | [lf.day.flights_found] Found 2 flights on 29DEC
2025-12-26 01:58:01 | INFO     | [lf.flight.extracted] SM457 on 29DEC: BKG=163, LF=91.1%
[LF] SM457 29DEC: BKG=163, GRP=134, CAP=179, LF%=91.1%, Brd-Off=HBE-JED, Classes: P:134, U:10, X:10, T:7, W:2
2025-12-26 01:58:04 | INFO     | [lf.flight.extracted] SM451 on 29DEC: BKG=180, LF=100.6%
[LF] SM451 29DEC: BKG=180, GRP=160, CAP=179, LF%=100.6%, Brd-Off=HBE-JED, Classes: P:160, X:10, T:9, K:1
[LF] Getting WEEKLY/LASTSOLD data for 2 flights
[LF] SM457 29DEC: LASTSOLD=2025-12-25 00:00:00, WEEKLY=21, TODAY=0, YDAY=2
[LF] SM451 29DEC: LASTSOLD=2025-12-24 00:00:00, WEEKLY=6, TODAY=0, YDAY=0
2025-12-26 01:58:16 | INFO     | [SUCCESS] Day 29DEC
2025-12-26 01:58:16 | INFO     | [DAY_START] Processing 28DEC
[LF] Processing HBE-JED for 28DEC
2025-12-26 01:58:16 | INFO     | [lf.day.start] Processing HBE-JED for 28DEC
[LF] 28DEC: found 2 direct flights
2025-12-26 01:58:17 | INFO     | [lf.day.flights_found] Found 2 flights on 28DEC
2025-12-26 01:58:19 | INFO     | [lf.flight.extracted] SM451 on 28DEC: BKG=155, LF=86.6%
[LF] SM451 28DEC: BKG=155, GRP=125, CAP=179, LF%=86.6%, Brd-Off=HBE-JED, Classes: P:125, I:18, O:7, T:2, G:2, K:1
2025-12-26 01:58:22 | INFO     | [lf.flight.extracted] SM457 on 28DEC: BKG=139, LF=77.6%
[LF] SM457 28DEC: BKG=139, GRP=95, CAP=179, LF%=77.6%, Brd-Off=HBE-JED, Classes: P:95, U:5, X:22, T:14, W:2, S:1
[LF] Getting WEEKLY/LASTSOLD data for 2 flights
[LF] SM451 28DEC: LASTSOLD=2025-12-25 00:00:00, WEEKLY=29, TODAY=0, YDAY=25
[LF] SM457 28DEC: LASTSOLD=2025-12-25 00:00:00, WEEKLY=23, TODAY=0, YDAY=1
2025-12-26 01:58:34 | INFO     | [SUCCESS] Day 28DEC
2025-12-26 01:58:34 | INFO     | [DAY_START] Processing 27DEC
[LF] Processing HBE-JED for 27DEC
2025-12-26 01:58:34 | INFO     | [lf.day.start] Processing HBE-JED for 27DEC
[LF] 27DEC: found 2 direct flights
2025-12-26 01:58:35 | INFO     | [lf.day.flights_found] Found 2 flights on 27DEC
2025-12-26 01:58:37 | INFO     | [lf.flight.extracted] SM457 on 27DEC: BKG=146, LF=81.6%
[LF] SM457 27DEC: BKG=146, GRP=119, CAP=179, LF%=81.6%, Brd-Off=HBE-JED, Classes: P:119, X:14, T:8, S:5
2025-12-26 01:58:40 | INFO     | [lf.flight.extracted] SM451 on 27DEC: BKG=173, LF=96.7%
[LF] SM451 27DEC: BKG=173, GRP=134, CAP=179, LF%=96.7%, Brd-Off=HBE-JED, Classes: P:134, O:5, U:5, X:10, T:17, W:2
[LF] Getting WEEKLY/LASTSOLD data for 2 flights
[LF] SM457 27DEC: LASTSOLD=2025-12-25 00:00:00, WEEKLY=23, TODAY=0, YDAY=8
[LF] SM451 27DEC: LASTSOLD=2025-12-25 00:00:00, WEEKLY=16, TODAY=0, YDAY=5
2025-12-26 01:58:51 | INFO     | [SUCCESS] Day 27DEC
[LF] Results summary:
  2026-01-01: 1 flights
  2025-12-31: 3 flights
  2025-12-30: 1 flights
  2025-12-29: 2 flights
  2025-12-28: 2 flights
  2025-12-27: 2 flights
2025-12-26 01:58:51 | INFO     | [SUCCESS] LF Search Complete

============================================================
[Worker_9225] ✓ COMPLETED: HBE-JED
  Results: 6 dates
  Errors: 0 dates
  Total Processed: 3 groups
============================================================

2025-12-26 01:58:53 | INFO     | [Worker_9225] Completed: HBE-JED - 6 results, 0 errors
[Worker_9225] Waiting for tasks...

============================================================
[Worker_9225] Shutdown signal received
Exiting...
============================================================
2025-12-26 01:59:48 | INFO     | [Worker_9225] Shutdown signal received, exiting...

============================================================
[Worker_9225] FINISHED
  Total Groups Processed: 3
============================================================

2025-12-26 01:59:48 | INFO     | [Worker_9225] Finished. Processed 3 groups.
