
============================================================
     LF WORKER - PORT 9223
============================================================
Worker: Worker_9223
Status: READY
Waiting for tasks...
============================================================


============================================================
[Worker_9223] Processing: CAI-MED
  Tier 0: Range 2, Chunk 1/2
  Dates: 6 days
  Date Range: 2026-01-16 to 2026-01-11
============================================================

2025-12-25 22:37:05 | INFO     | ======================================================================
2025-12-25 22:37:05 | INFO     | Load Factor Scraper Started - Route: CAI-MED
2025-12-25 22:37:05 | INFO     | Log file: D:\CODERED\OUTPUTS\logs\LF_CAI-MED_20251225_223705.log
2025-12-25 22:37:05 | INFO     | Enhanced logging: Capturing both logging.info() and print()
2025-12-25 22:37:05 | INFO     | ======================================================================
[LF] Processing dates (override): ['16JAN', '15JAN', '14JAN', '13JAN', '12JAN', '11JAN']
[LF] Attaching to Chrome for Altea access
[LF][[OK] SUCCESS] Connected to Chrome on 127.0.0.1:9223 (after 1 attempts)
[LF][[OK] SUCCESS] Found Amadeus Altea window: Altéa Reservation Desktop
[LF][[INFO] INFO] URL: https://tc212.resdesktop.altea.amadeus.com/app_ard/apf/init/login?SITE=ESMPESMP&LANGUAGE=GB&MARKETS=ARDW_PROD_WBP&ACTION=clpLogin
[LF] Processing CAI-MED for 16JAN
[LF][ERROR] Amadeus command error detected: UNKNOWN TRANSACTION
[LF][ERROR] Command: SN16JANCAIMED/ASM
[LF][RESYNC] Triggering immediate resync to last successful SN command
============================================================
[LF][RESYNC] Command 'SN16JANCAIMED/ASM' failed: TECH_ERROR:UNKNOWN TRANSACTION
[LF][RESYNC] Re-running entire day from SN command for CAI-MED 16JAN
[LF][RESYNC] Attempt 1/50 (waiting 1.0s before retry...)
============================================================
[LF][RESYNC] Sending IG to clear session state...
[LF][RESYNC] Session cleared with IG
[LF] Processing CAI-MED for 16JAN
[LF] No direct flights on 16JAN for CAI-MED
[LF] Processing CAI-MED for 15JAN
[LF] 15JAN: found 1 direct flights
[LF] SM493 15JAN: BKG=161, GRP=135, CAP=180, LF%=89.4%, Brd-Off=CAI-MED, Classes: N:3, P:135, T:10, W:13
[LF] Getting WEEKLY/LASTSOLD data for 1 flights
[LF] SM493 15JAN: LASTSOLD=2025-12-25 00:00:00, WEEKLY=16, TODAY=9, YDAY=2
[LF] Processing CAI-MED for 14JAN
[LF] No direct flights on 14JAN for CAI-MED
[LF] Processing CAI-MED for 13JAN
[LF] 13JAN: found 1 direct flights
[LF] SM493 13JAN: BKG=146, GRP=140, CAP=180, LF%=81.1%, Brd-Off=CAI-MED, Classes: P:140, I:1, T:5
[LF] Getting WEEKLY/LASTSOLD data for 1 flights
[LF] SM493 13JAN: LASTSOLD=2025-12-24 00:00:00, WEEKLY=4, TODAY=0, YDAY=3
[LF] Processing CAI-MED for 12JAN
[LF] 12JAN: found 1 direct flights
[LF] SM495 12JAN: BKG=139, GRP=135, CAP=177, LF%=78.5%, Brd-Off=CAI-MED, Classes: P:135, X:2, T:2
[LF] Getting WEEKLY/LASTSOLD data for 1 flights
[LF] SM495 12JAN: LASTSOLD=2025-12-24 00:00:00, WEEKLY=2, TODAY=0, YDAY=2
[LF] Processing CAI-MED for 11JAN
[LF] 11JAN: found 1 direct flights
[LF] SM493 11JAN: BKG=148, GRP=145, CAP=177, LF%=83.6%, Brd-Off=CAI-MED, Classes: P:95, E:50, X:1, T:2
[LF] Getting WEEKLY/LASTSOLD data for 1 flights
[LF] SM493 11JAN: LASTSOLD=2025-12-21 00:00:00, WEEKLY=1, TODAY=0, YDAY=0
[LF] Results summary:
  2026-01-16: 0 flights
  2026-01-15: 1 flights
  2026-01-14: 0 flights
  2026-01-13: 1 flights
  2026-01-12: 1 flights
  2026-01-11: 1 flights

============================================================
[Worker_9223] ✓ COMPLETED: CAI-MED
  Results: 6 dates
  Errors: 0 dates
  Total Processed: 1 groups
============================================================


============================================================
[Worker_9223] Processing: CAI-MED
  Tier 0: Range 2, Chunk 2/2
  Dates: 5 days
  Date Range: 2026-01-10 to 2026-01-06
============================================================

2025-12-25 22:37:44 | INFO     | ======================================================================
2025-12-25 22:37:44 | INFO     | Load Factor Scraper Started - Route: CAI-MED
2025-12-25 22:37:44 | INFO     | Log file: D:\CODERED\OUTPUTS\logs\LF_CAI-MED_20251225_223744.log
2025-12-25 22:37:44 | INFO     | Enhanced logging: Capturing both logging.info() and print()
2025-12-25 22:37:44 | INFO     | ======================================================================
[LF] Processing dates (override): ['10JAN', '09JAN', '08JAN', '07JAN', '06JAN']
[LF] Attaching to Chrome for Altea access
2025-12-25 22:37:44 | INFO     | Starting LF search for route: CAI-MED
2025-12-25 22:37:44 | INFO     | [START] LF Search
[LF][[OK] SUCCESS] Connected to Chrome on 127.0.0.1:9223 (after 1 attempts)
2025-12-25 22:37:46 | INFO     | [HEALTH CHECK] [OK] Chrome connection is healthy
[LF][[OK] SUCCESS] Found Amadeus Altea window: Altéa Reservation Desktop
[LF][[INFO] INFO] URL: https://tc212.resdesktop.altea.amadeus.com/app_ard/apf/init/login?SITE=ESMPESMP&LANGUAGE=GB&MARKETS=ARDW_PROD_WBP&ACTION=clpLogin
2025-12-25 22:37:46 | INFO     | [DAY_START] Processing 10JAN
[LF] Processing CAI-MED for 10JAN
2025-12-25 22:37:46 | INFO     | [lf.day.start] Processing CAI-MED for 10JAN
[LF] 10JAN: found 1 direct flights
2025-12-25 22:37:47 | INFO     | [lf.day.flights_found] Found 1 flights on 10JAN
2025-12-25 22:37:49 | INFO     | [lf.flight.extracted] SM493 on 10JAN: BKG=97, LF=54.8%
[LF] SM493 10JAN: BKG=97, GRP=90, CAP=177, LF%=54.8%, Brd-Off=CAI-MED, Classes: P:90, X:4, T:3
[LF] Getting WEEKLY/LASTSOLD data for 1 flights
[LF] SM493 10JAN: LASTSOLD=2025-12-25 00:00:00, WEEKLY=6, TODAY=1, YDAY=3
2025-12-25 22:37:52 | INFO     | [SUCCESS] Day 10JAN
2025-12-25 22:37:52 | INFO     | [DAY_START] Processing 09JAN
[LF] Processing CAI-MED for 09JAN
2025-12-25 22:37:52 | INFO     | [lf.day.start] Processing CAI-MED for 09JAN
[LF] No direct flights on 09JAN for CAI-MED
2025-12-25 22:37:52 | WARNING  | [lf.day.no_flights] No direct flights on 09JAN
2025-12-25 22:37:53 | INFO     | [SUCCESS] Day 09JAN
2025-12-25 22:37:53 | INFO     | [DAY_START] Processing 08JAN
[LF] Processing CAI-MED for 08JAN
2025-12-25 22:37:53 | INFO     | [lf.day.start] Processing CAI-MED for 08JAN
[LF] 08JAN: found 1 direct flights
2025-12-25 22:37:54 | INFO     | [lf.day.flights_found] Found 1 flights on 08JAN
2025-12-25 22:37:56 | INFO     | [lf.flight.extracted] SM493 on 08JAN: BKG=162, LF=90.0%
[LF] SM493 08JAN: BKG=162, GRP=135, CAP=180, LF%=90.0%, Brd-Off=CAI-MED, Classes: P:135, I:3, O:13, T:9, W:2
[LF] Getting WEEKLY/LASTSOLD data for 1 flights
[LF] SM493 08JAN: LASTSOLD=2025-12-25 00:00:00, WEEKLY=19, TODAY=8, YDAY=7
2025-12-25 22:37:59 | INFO     | [SUCCESS] Day 08JAN
2025-12-25 22:37:59 | INFO     | [DAY_START] Processing 07JAN
[LF] Processing CAI-MED for 07JAN
2025-12-25 22:37:59 | INFO     | [lf.day.start] Processing CAI-MED for 07JAN
[LF] No direct flights on 07JAN for CAI-MED
2025-12-25 22:38:00 | WARNING  | [lf.day.no_flights] No direct flights on 07JAN
2025-12-25 22:38:00 | INFO     | [SUCCESS] Day 07JAN
2025-12-25 22:38:00 | INFO     | [DAY_START] Processing 06JAN
[LF] Processing CAI-MED for 06JAN
2025-12-25 22:38:00 | INFO     | [lf.day.start] Processing CAI-MED for 06JAN
[LF] 06JAN: found 1 direct flights
2025-12-25 22:38:01 | INFO     | [lf.day.flights_found] Found 1 flights on 06JAN
2025-12-25 22:38:03 | INFO     | [lf.flight.extracted] SM493 on 06JAN: BKG=119, LF=66.1%
[LF] SM493 06JAN: BKG=119, GRP=90, CAP=180, LF%=66.1%, Brd-Off=CAI-MED, Classes: P:90, I:1, O:16, U:5, X:5, T:2
[LF] Getting WEEKLY/LASTSOLD data for 1 flights
[LF] SM493 06JAN: LASTSOLD=2025-12-25 00:00:00, WEEKLY=21, TODAY=9, YDAY=8
2025-12-25 22:38:06 | INFO     | [SUCCESS] Day 06JAN
[LF] Results summary:
  2026-01-10: 1 flights
  2026-01-09: 0 flights
  2026-01-08: 1 flights
  2026-01-07: 0 flights
  2026-01-06: 1 flights
2025-12-25 22:38:06 | INFO     | [SUCCESS] LF Search Complete

============================================================
[Worker_9223] ✓ COMPLETED: CAI-MED
  Results: 5 dates
  Errors: 0 dates
  Total Processed: 2 groups
============================================================

2025-12-25 22:38:08 | INFO     | [Worker_9223] Completed: CAI-MED - 5 results, 0 errors

============================================================
[Worker_9223] Processing: JED-CAI
  Tier 0: Range 1, Chunk 1/2
  Dates: 6 days
  Date Range: 2026-01-05 to 2025-12-31
============================================================

2025-12-25 22:38:08 | INFO     | [Worker_9223] Processing: JED-CAI
2025-12-25 22:38:08 | INFO     |   Tier 0: Range 1, Chunk 1/2 (6 days)
2025-12-25 22:38:08 | INFO     | ======================================================================
2025-12-25 22:38:08 | INFO     | Load Factor Scraper Started - Route: JED-CAI
2025-12-25 22:38:08 | INFO     | Log file: D:\CODERED\OUTPUTS\logs\LF_JED-CAI_20251225_223808.log
2025-12-25 22:38:08 | INFO     | Enhanced logging: Capturing both logging.info() and print()
2025-12-25 22:38:08 | INFO     | ======================================================================
[LF] Processing dates (override): ['05JAN', '04JAN', '03JAN', '02JAN', '01JAN', '31DEC']
[LF] Attaching to Chrome for Altea access
2025-12-25 22:38:08 | INFO     | Starting LF search for route: JED-CAI
2025-12-25 22:38:08 | INFO     | [START] LF Search
[LF][[OK] SUCCESS] Connected to Chrome on 127.0.0.1:9223 (after 1 attempts)
2025-12-25 22:38:10 | INFO     | [HEALTH CHECK] [OK] Chrome connection is healthy
[LF][[OK] SUCCESS] Found Amadeus Altea window: Altéa Reservation Desktop
[LF][[INFO] INFO] URL: https://tc212.resdesktop.altea.amadeus.com/app_ard/apf/init/login?SITE=ESMPESMP&LANGUAGE=GB&MARKETS=ARDW_PROD_WBP&ACTION=clpLogin
2025-12-25 22:38:10 | INFO     | [DAY_START] Processing 05JAN
[LF] Processing JED-CAI for 05JAN
2025-12-25 22:38:10 | INFO     | [lf.day.start] Processing JED-CAI for 05JAN
[LF] 05JAN: found 4 direct flights
2025-12-25 22:38:11 | INFO     | [lf.day.flights_found] Found 4 flights on 05JAN
2025-12-25 22:38:13 | INFO     | [lf.flight.extracted] SM480 on 05JAN: BKG=66, LF=39.3%
[LF] SM480 05JAN: BKG=66, GRP=44, CAP=168, LF%=39.3%, Brd-Off=JED-CAI, Classes: P:44, U:18, X:3, S:1
2025-12-25 22:38:16 | INFO     | [lf.flight.extracted] SM476 on 05JAN: BKG=175, LF=97.2%
[LF] SM476 05JAN: BKG=175, GRP=142, CAP=180, LF%=97.2%, Brd-Off=JED-CAI, Classes: P:142, U:18, X:12, W:1, S:2
2025-12-25 22:38:20 | INFO     | [lf.flight.extracted] SM478 on 05JAN: BKG=168, LF=100.0%
[LF] SM478 05JAN: BKG=168, GRP=138, CAP=168, LF%=100.0%, Brd-Off=JED-CAI, Classes: P:138, U:16, X:12, W:1, K:1
2025-12-25 22:38:23 | INFO     | [lf.flight.extracted] SM460 on 05JAN: BKG=167, LF=99.4%
[LF] SM460 05JAN: BKG=167, GRP=132, CAP=168, LF%=99.4%, Brd-Off=JED-CAI, Classes: P:132, U:15, X:3, W:1, S:9, Q:2, H:5
[LPC] SM460 05JAN: Found 0 outbound flights with connecting passengers
[LF] Getting WEEKLY/LASTSOLD data for 4 flights
[LF] SM480 05JAN: LASTSOLD=2025-12-24 00:00:00, WEEKLY=8, TODAY=0, YDAY=4
[LF] SM476 05JAN: LASTSOLD=2025-12-25 00:00:00, WEEKLY=11, TODAY=4, YDAY=4
[LF] SM478 05JAN: LASTSOLD=2025-12-24 00:00:00, WEEKLY=9, TODAY=0, YDAY=1
[LF] SM460 05JAN: LASTSOLD=2025-12-25 00:00:00, WEEKLY=10, TODAY=1, YDAY=2
2025-12-25 22:38:44 | INFO     | [SUCCESS] Day 05JAN
2025-12-25 22:38:44 | INFO     | [DAY_START] Processing 04JAN
[LF] Processing JED-CAI for 04JAN
2025-12-25 22:38:44 | INFO     | [lf.day.start] Processing JED-CAI for 04JAN
[LF] 04JAN: found 5 direct flights
2025-12-25 22:38:45 | INFO     | [lf.day.flights_found] Found 5 flights on 04JAN
2025-12-25 22:38:46 | INFO     | [lf.flight.extracted] SM424 on 04JAN: BKG=168, LF=100.0%
[LF] SM424 04JAN: BKG=168, GRP=160, CAP=168, LF%=100.0%, Brd-Off=JED-CAI, Classes: N:5, E:155, X:5, T:3
[LPC] SM424 04JAN: Found 2 outbound flights with connecting passengers
2025-12-25 22:39:00 | INFO     | [lf.flight.extracted] SM476 on 04JAN: BKG=68, LF=40.5%
[LF] SM476 04JAN: BKG=68, GRP=27, CAP=168, LF%=40.5%, Brd-Off=JED-CAI, Classes: P:27, I:17, O:2, U:19, X:1, W:1, K:1
2025-12-25 22:39:03 | INFO     | [lf.flight.extracted] SM432 on 04JAN: BKG=112, LF=66.7%
[LF] SM432 04JAN: BKG=112, GRP=96, CAP=168, LF%=66.7%, Brd-Off=JED-CAI, Classes: P:96, U:4, X:11, K:1
2025-12-25 22:39:07 | INFO     | [lf.flight.extracted] SM460 on 04JAN: BKG=131, LF=78.0%
[LF] SM460 04JAN: BKG=131, GRP=97, CAP=168, LF%=78.0%, Brd-Off=JED-CAI, Classes: N:2, P:97, U:19, X:10, W:2, S:1
2025-12-25 22:39:10 | INFO     | [lf.flight.extracted] SM478 on 04JAN: BKG=133, LF=79.2%
[LF] SM478 04JAN: BKG=133, GRP=97, CAP=168, LF%=79.2%, Brd-Off=JED-CAI, Classes: P:97, I:1, U:19, X:13, W:2, S:1
[LF] Getting WEEKLY/LASTSOLD data for 5 flights
[LF] SM424 04JAN: LASTSOLD=2025-12-19 00:00:00, WEEKLY=7, TODAY=0, YDAY=0
[LF] SM476 04JAN: LASTSOLD=2025-12-25 00:00:00, WEEKLY=28, TODAY=5, YDAY=1
[LF] SM432 04JAN: LASTSOLD=2025-12-25 00:00:00, WEEKLY=5, TODAY=1, YDAY=2
[LF] SM460 04JAN: LASTSOLD=2025-12-25 00:00:00, WEEKLY=12, TODAY=6, YDAY=2
[LF] SM478 04JAN: LASTSOLD=2025-12-24 00:00:00, WEEKLY=16, TODAY=0, YDAY=4
2025-12-25 22:39:33 | INFO     | [SUCCESS] Day 04JAN
2025-12-25 22:39:33 | INFO     | [DAY_START] Processing 03JAN
[LF] Processing JED-CAI for 03JAN
2025-12-25 22:39:33 | INFO     | [lf.day.start] Processing JED-CAI for 03JAN
[LF] 03JAN: found 3 direct flights
2025-12-25 22:39:34 | INFO     | [lf.day.flights_found] Found 3 flights on 03JAN
2025-12-25 22:39:36 | INFO     | [lf.flight.extracted] SM450 on 03JAN: BKG=162, LF=96.4%
[LF] SM450 03JAN: BKG=162, GRP=141, CAP=168, LF%=96.4%, Brd-Off=JED-CAI, Classes: P:141, U:10, X:7, T:2, K:2
[LPC] SM450 03JAN: Found 1 outbound flights with connecting passengers
2025-12-25 22:39:40 | INFO     | [lf.flight.extracted] SM476 on 03JAN: BKG=159, LF=88.8%
[LF] SM476 03JAN: BKG=159, GRP=131, CAP=179, LF%=88.8%, Brd-Off=JED-CAI, Classes: P:131, U:7, X:12, T:9
2025-12-25 22:39:44 | INFO     | [lf.flight.extracted] SM478 on 03JAN: BKG=165, LF=93.8%
[LF] SM478 03JAN: BKG=165, GRP=139, CAP=176, LF%=93.8%, Brd-Off=JED-CAI, Classes: P:139, I:5, U:15, W:6
[LF] Getting WEEKLY/LASTSOLD data for 3 flights
[LF] SM450 03JAN: LASTSOLD=2025-12-24 00:00:00, WEEKLY=2, TODAY=0, YDAY=2
[LF] SM476 03JAN: LASTSOLD=2025-12-24 00:00:00, WEEKLY=2, TODAY=0, YDAY=1
[LF] SM478 03JAN: LASTSOLD=2025-12-22 00:00:00, WEEKLY=12, TODAY=0, YDAY=0
2025-12-25 22:39:59 | INFO     | [SUCCESS] Day 03JAN
2025-12-25 22:39:59 | INFO     | [DAY_START] Processing 02JAN
[LF] Processing JED-CAI for 02JAN
2025-12-25 22:39:59 | INFO     | [lf.day.start] Processing JED-CAI for 02JAN
[LF] 02JAN: 2 cancelled flight(s) detected from SN
[LF] 02JAN: found 5 direct flights
2025-12-25 22:40:00 | INFO     | [lf.day.flights_found] Found 5 flights on 02JAN
2025-12-25 22:40:02 | INFO     | [lf.flight.extracted] SM424 on 02JAN: BKG=63, LF=37.5%
[LF] SM424 02JAN: BKG=63, GRP=45, CAP=168, LF%=37.5%, Brd-Off=JED-CAI, Classes: P:45, X:6, T:8, W:2, S:2
[LPC] SM424 02JAN: Found 1 outbound flights with connecting passengers
2025-12-25 22:40:06 | INFO     | [lf.flight.extracted] SM476 on 02JAN: BKG=74, LF=44.0%
[LF] SM476 02JAN: BKG=74, GRP=48, CAP=168, LF%=44.0%, Brd-Off=JED-CAI, Classes: P:48, I:5, O:5, U:1, X:10, T:5
2025-12-25 22:40:09 | INFO     | [lf.flight.extracted] SM480 on 02JAN: BKG=163, LF=97.0%
[LF] SM480 02JAN: BKG=163, GRP=135, CAP=168, LF%=97.0%, Brd-Off=JED-CAI, Classes: P:135, U:9, X:11, T:5, W:1, K:2
2025-12-25 22:40:13 | INFO     | [lf.flight.extracted] SM472 on 02JAN: BKG=158, LF=94.0%
[LF] SM472 02JAN: BKG=158, GRP=89, CAP=168, LF%=94.0%, Brd-Off=JED-CAI, Classes: P:89, I:5, O:5, U:12, X:23, T:22, S:2
2025-12-25 22:40:16 | INFO     | [lf.flight.extracted] SM460 on 02JAN: BKG=155, LF=92.3%
[LF] SM460 02JAN: BKG=155, GRP=118, CAP=168, LF%=92.3%, Brd-Off=JED-CAI, Classes: P:118, U:8, X:12, T:15, W:1, K:1
[LPC] SM460 02JAN: Found 0 outbound flights with connecting passengers
[LF] Getting WEEKLY/LASTSOLD data for 5 flights
[LF] SM424 02JAN: LASTSOLD=2025-12-25 00:00:00, WEEKLY=9, TODAY=3, YDAY=2
[LF] SM476 02JAN: LASTSOLD=2025-12-25 00:00:00, WEEKLY=55, TODAY=1, YDAY=5
[LF] SM480 02JAN: LASTSOLD=2025-12-25 00:00:00, WEEKLY=3, TODAY=1, YDAY=0
[LF] SM472 02JAN: LASTSOLD=2025-12-25 00:00:00, WEEKLY=40, TODAY=5, YDAY=4
[LF] SM460 02JAN: LASTSOLD=2025-12-24 00:00:00, WEEKLY=19, TODAY=0, YDAY=7
2025-12-25 22:40:39 | INFO     | [SUCCESS] Day 02JAN
2025-12-25 22:40:39 | INFO     | [DAY_START] Processing 01JAN
[LF] Processing JED-CAI for 01JAN
2025-12-25 22:40:39 | INFO     | [lf.day.start] Processing JED-CAI for 01JAN
[LF] 01JAN: found 7 direct flights
2025-12-25 22:40:40 | INFO     | [lf.day.flights_found] Found 7 flights on 01JAN
2025-12-25 22:40:42 | INFO     | [lf.flight.extracted] SM424 on 01JAN: BKG=22, LF=13.1%
[LF] SM424 01JAN: BKG=22, GRP=0, CAP=168, LF%=13.1%, Brd-Off=JED-CAI, Classes: U:19, X:3
[LPC] SM424 01JAN: Found 1 outbound flights with connecting passengers
2025-12-25 22:40:46 | INFO     | [lf.flight.extracted] SM472 on 01JAN: BKG=76, LF=46.1%
[LF] SM472 01JAN: BKG=76, GRP=51, CAP=165, LF%=46.1%, Brd-Off=JED-CAI, Classes: P:51, U:18, X:1, S:6
[LPC] SM472 01JAN: Found 1 outbound flights with connecting passengers
2025-12-25 22:40:50 | INFO     | [lf.flight.extracted] SM450 on 01JAN: BKG=179, LF=106.5%
[LF] SM450 01JAN: BKG=179, GRP=175, CAP=168, LF%=106.5%, Brd-Off=JED-CAI, Classes: N:5, P:46, E:125, U:3
[LPC] SM450 01JAN: Found 1 outbound flights with connecting passengers
2025-12-25 22:41:01 | INFO     | [lf.flight.extracted] SM476 on 01JAN: BKG=170, LF=97.1%
[LF] SM476 01JAN: BKG=170, GRP=128, CAP=175, LF%=97.1%, Brd-Off=JED-CAI, Classes: P:88, E:40, I:5, O:5, U:18, X:8, W:1, S:5
[LPC] SM476 01JAN: Found 3 outbound flights with connecting passengers
2025-12-25 22:41:07 | INFO     | [lf.flight.extracted] SM432 on 01JAN: BKG=0, LF=0.0%
[LF] SM432 01JAN: BKG=0, GRP=0, CAP=168, LF%=0.0%, Brd-Off=JED-ATZ
2025-12-25 22:41:21 | INFO     | [lf.flight.extracted] SM478 on 01JAN: BKG=159, LF=96.4%
[LF] SM478 01JAN: BKG=159, GRP=128, CAP=165, LF%=96.4%, Brd-Off=JED-CAI, Classes: P:128, X:10, T:5, W:10, S:6
[LPC] SM478 01JAN: Found 0 outbound flights with connecting passengers
2025-12-25 22:41:26 | INFO     | [lf.flight.extracted] SM480 on 01JAN: BKG=167, LF=93.3%
[LF] SM480 01JAN: BKG=167, GRP=139, CAP=179, LF%=93.3%, Brd-Off=JED-CAI, Classes: N:6, P:139, X:8, T:2, W:1, S:2, K:9
[LF] Getting WEEKLY/LASTSOLD data for 6 flights
[LF] SM424 01JAN: LASTSOLD=2025-12-25 00:00:00, WEEKLY=9, TODAY=5, YDAY=4
[LF] SM472 01JAN: LASTSOLD=2025-12-25 00:00:00, WEEKLY=10, TODAY=3, YDAY=4
[LF] SM450 01JAN: LASTSOLD=2025-12-21 00:00:00, WEEKLY=50, TODAY=0, YDAY=0
[LF] SM476 01JAN: LASTSOLD=2025-12-25 00:00:00, WEEKLY=29, TODAY=1, YDAY=0
[LF] SM478 01JAN: LASTSOLD=2025-12-25 00:00:00, WEEKLY=22, TODAY=3, YDAY=9
[LF] SM480 01JAN: LASTSOLD=2025-12-24 00:00:00, WEEKLY=3, TODAY=0, YDAY=1
2025-12-25 22:41:51 | INFO     | [SUCCESS] Day 01JAN
2025-12-25 22:41:51 | INFO     | [DAY_START] Processing 31DEC
[LF] Processing JED-CAI for 31DEC
2025-12-25 22:41:51 | INFO     | [lf.day.start] Processing JED-CAI for 31DEC
[LF] 31DEC: found 3 direct flights
2025-12-25 22:41:52 | INFO     | [lf.day.flights_found] Found 3 flights on 31DEC
2025-12-25 22:41:54 | INFO     | [lf.flight.extracted] SM476 on 31DEC: BKG=175, LF=97.8%
[LF] SM476 31DEC: BKG=175, GRP=132, CAP=179, LF%=97.8%, Brd-Off=JED-CAI, Classes: P:132, I:10, O:10, U:21, X:2
2025-12-25 22:41:58 | INFO     | [lf.flight.extracted] SM460 on 31DEC: BKG=118, LF=65.9%
[LF] SM460 31DEC: BKG=118, GRP=42, CAP=179, LF%=65.9%, Brd-Off=JED-CAI, Classes: P:42, I:10, O:10, U:21, X:24, T:3, S:8
[LPC] SM460 31DEC: Found 4 outbound flights with connecting passengers
2025-12-25 22:42:02 | INFO     | [lf.flight.extracted] SM478 on 31DEC: BKG=165, LF=92.2%
[LF] SM478 31DEC: BKG=165, GRP=100, CAP=179, LF%=92.2%, Brd-Off=JED-CAI, Classes: P:100, I:10, O:10, U:21, X:17, S:6, G:1
[LF] Getting WEEKLY/LASTSOLD data for 3 flights
[LF] SM476 31DEC: LASTSOLD=2025-12-25 00:00:00, WEEKLY=12, TODAY=1, YDAY=9
[LF] SM460 31DEC: LASTSOLD=2025-12-25 00:00:00, WEEKLY=19, TODAY=1, YDAY=10
[LF] SM478 31DEC: LASTSOLD=2025-12-24 00:00:00, WEEKLY=22, TODAY=0, YDAY=1
2025-12-25 22:42:18 | INFO     | [SUCCESS] Day 31DEC
[LF] Results summary:
  2026-01-05: 4 flights
  2026-01-04: 5 flights
  2026-01-03: 3 flights
  2026-01-02: 5 flights
  2026-01-01: 7 flights
  2025-12-31: 3 flights
[LF] Cancelled flights found: 2
  - SM952 02JAN (SN)
  - SM478 02JAN (SN)
2025-12-25 22:42:18 | INFO     | [SUCCESS] LF Search Complete
[Worker_9223] Cancelled flights collected: 2

============================================================
[Worker_9223] ✓ COMPLETED: JED-CAI
  Results: 6 dates
  Errors: 0 dates
  Total Processed: 3 groups
============================================================

2025-12-25 22:42:20 | INFO     | [Worker_9223] Completed: JED-CAI - 6 results, 0 errors
