
============================================================
     LF WORKER - PORT 9225
============================================================
Worker: Worker_9225
Status: READY
Waiting for tasks...
============================================================


============================================================
[Worker_9225] Processing: JED-ATZ
  Tier 0: Range 2, Chunk 2/2
  Dates: 5 days
  Date Range: 2026-01-10 to 2026-01-06
============================================================

2025-12-25 22:37:05 | INFO     | ======================================================================
2025-12-25 22:37:05 | INFO     | Load Factor Scraper Started - Route: JED-ATZ
2025-12-25 22:37:05 | INFO     | Log file: D:\CODERED\OUTPUTS\logs\LF_JED-ATZ_20251225_223705.log
2025-12-25 22:37:05 | INFO     | Enhanced logging: Capturing both logging.info() and print()
2025-12-25 22:37:05 | INFO     | ======================================================================
[LF] Processing dates (override): ['10JAN', '09JAN', '08JAN', '07JAN', '06JAN']
[LF] Attaching to Chrome for Altea access
[LF][[OK] SUCCESS] Connected to Chrome on 127.0.0.1:9225 (after 1 attempts)
[LF][[OK] SUCCESS] Found Amadeus Altea window: Altéa Reservation Desktop
[LF][[INFO] INFO] URL: https://tc212.resdesktop.altea.amadeus.com/app_ard/apf/init/login?SITE=ESMPESMP&LANGUAGE=GB&MARKETS=ARDW_PROD_WBP&ACTION=clpLogin
[LF] Processing JED-ATZ for 10JAN
[LF][ERROR] Amadeus command error detected: UNKNOWN TRANSACTION
[LF][ERROR] Command: SN10JANJEDATZ/ASM
[LF][RESYNC] Triggering immediate resync to last successful SN command
============================================================
[LF][RESYNC] Command 'SN10JANJEDATZ/ASM' failed: TECH_ERROR:UNKNOWN TRANSACTION
[LF][RESYNC] Re-running entire day from SN command for JED-ATZ 10JAN
[LF][RESYNC] Attempt 1/50 (waiting 1.0s before retry...)
============================================================
[LF][RESYNC] Sending IG to clear session state...
[LF][RESYNC] Session cleared with IG
[LF] Processing JED-ATZ for 10JAN
[LF] 10JAN: found 3 direct flights
[LF] SM492 10JAN: BKG=152, GRP=139, CAP=168, LF%=90.5%, Brd-Off=JED-ATZ, Classes: P:139, I:4, O:2, U:3, S:4
[LF] SM454 10JAN: BKG=154, GRP=139, CAP=168, LF%=91.7%, Brd-Off=JED-ATZ, Classes: P:139, I:4, O:2, U:3, X:5, W:1
[LF] SM456 10JAN: BKG=162, GRP=142, CAP=168, LF%=96.4%, Brd-Off=JED-ATZ, Classes: P:142, I:4, O:2, U:3, X:5, S:2, V:1, K:3
[LPC] SM456 10JAN: Found 0 outbound flights with connecting passengers
[LF] Getting WEEKLY/LASTSOLD data for 3 flights
[LF] SM492 10JAN: LASTSOLD=2025-12-25 00:00:00, WEEKLY=52, TODAY=6, YDAY=0
[LF] SM454 10JAN: LASTSOLD=2025-12-23 00:00:00, WEEKLY=52, TODAY=0, YDAY=0
[LF] SM456 10JAN: LASTSOLD=2025-12-24 00:00:00, WEEKLY=13, TODAY=0, YDAY=1
[LF] Processing JED-ATZ for 09JAN
[LF] 09JAN: found 1 direct flights
[LF] SM492 09JAN: BKG=44, GRP=2, CAP=168, LF%=26.2%, Brd-Off=JED-ATZ, Classes: E:2, I:4, O:2, U:3, X:5, T:14, W:10, S:2, V:1, K:1
[LF] Getting WEEKLY/LASTSOLD data for 1 flights
[LF] SM492 09JAN: LASTSOLD=2025-12-24 00:00:00, WEEKLY=25, TODAY=0, YDAY=8
[LF] Processing JED-ATZ for 08JAN
[LF] 08JAN: 1 cancelled flight(s) detected from SN
[LF] 08JAN: found 3 direct flights
[LF] SM422 08JAN: BKG=167, GRP=139, CAP=168, LF%=99.4%, Brd-Off=JED-ATZ, Classes: P:135, E:4, I:10, O:9, U:3, X:1, W:2, S:3
[LF] SM454 08JAN: BKG=135, GRP=86, CAP=168, LF%=80.4%, Brd-Off=JED-ATZ, Classes: P:86, I:4, O:2, U:3, X:8, T:16, W:1, S:14, K:1
[LF] SM456 08JAN: BKG=179, GRP=171, CAP=168, LF%=106.5%, Brd-Off=JED-ATZ, Classes: P:171, I:4, O:1, U:3
[LF] Getting WEEKLY/LASTSOLD data for 3 flights
[LF] SM422 08JAN: LASTSOLD=2025-12-17 00:00:00, WEEKLY=0, TODAY=0, YDAY=0
[LF] SM454 08JAN: LASTSOLD=2025-12-25 00:00:00, WEEKLY=16, TODAY=6, YDAY=2
[LF] SM456 08JAN: LASTSOLD=2025-12-24 00:00:00, WEEKLY=3, TODAY=0, YDAY=3
[LF] Processing JED-ATZ for 07JAN
[LF] 07JAN: found 2 direct flights
[LF] SM454 07JAN: BKG=174, GRP=173, CAP=179, LF%=97.2%, Brd-Off=JED-ATZ, Classes: P:173, S:1
[LF] SM492 07JAN: BKG=183, GRP=179, CAP=168, LF%=108.9%, Brd-Off=JED-ATZ, Classes: P:134, E:45, I:3, O:1
[LF] Getting WEEKLY/LASTSOLD data for 2 flights
[LF] SM454 07JAN: LASTSOLD=2025-12-25 00:00:00, WEEKLY=3, TODAY=1, YDAY=0
[LF] SM492 07JAN: LASTSOLD=2025-12-14 00:00:00, WEEKLY=0, TODAY=0, YDAY=0
[LF] Processing JED-ATZ for 06JAN
[LF] 06JAN: found 2 direct flights
[LF] SM454 06JAN: BKG=179, GRP=178, CAP=168, LF%=106.5%, Brd-Off=JED-ATZ, Classes: P:178, I:1
[LF] SM456 06JAN: BKG=180, GRP=180, CAP=168, LF%=107.1%, Brd-Off=JED-ATZ, Classes: P:180
[LF] Getting WEEKLY/LASTSOLD data for 2 flights
[LF] SM454 06JAN: LASTSOLD=2025-11-19 00:00:00, WEEKLY=0, TODAY=0, YDAY=0
[LF] SM456 06JAN: LASTSOLD=2025-11-12 00:00:00, WEEKLY=0, TODAY=0, YDAY=0
[LF] Results summary:
  2026-01-10: 3 flights
  2026-01-09: 1 flights
  2026-01-08: 3 flights
  2026-01-07: 2 flights
  2026-01-06: 2 flights
[LF] Cancelled flights found: 1
  - SM492 08JAN (SN)
[Worker_9225] Cancelled flights collected: 1

============================================================
[Worker_9225] ✓ COMPLETED: JED-ATZ
  Results: 5 dates
  Errors: 0 dates
  Total Processed: 1 groups
============================================================


============================================================
[Worker_9225] Processing: JED-CAI
  Tier 0: Range 1, Chunk 2/2
  Dates: 5 days
  Date Range: 2025-12-30 to 2025-12-26
============================================================

2025-12-25 22:38:49 | INFO     | ======================================================================
2025-12-25 22:38:49 | INFO     | Load Factor Scraper Started - Route: JED-CAI
2025-12-25 22:38:49 | INFO     | Log file: D:\CODERED\OUTPUTS\logs\LF_JED-CAI_20251225_223849.log
2025-12-25 22:38:49 | INFO     | Enhanced logging: Capturing both logging.info() and print()
2025-12-25 22:38:49 | INFO     | ======================================================================
[LF] Processing dates (override): ['30DEC', '29DEC', '28DEC', '27DEC', '26DEC']
[LF] Attaching to Chrome for Altea access
2025-12-25 22:38:49 | INFO     | Starting LF search for route: JED-CAI
2025-12-25 22:38:49 | INFO     | [START] LF Search
[LF][[OK] SUCCESS] Connected to Chrome on 127.0.0.1:9225 (after 1 attempts)
2025-12-25 22:38:50 | INFO     | [HEALTH CHECK] [OK] Chrome connection is healthy
[LF][[OK] SUCCESS] Found Amadeus Altea window: Altéa Reservation Desktop
[LF][[INFO] INFO] URL: https://tc212.resdesktop.altea.amadeus.com/app_ard/apf/init/login?SITE=ESMPESMP&LANGUAGE=GB&MARKETS=ARDW_PROD_WBP&ACTION=clpLogin
2025-12-25 22:38:50 | INFO     | [DAY_START] Processing 30DEC
[LF] Processing JED-CAI for 30DEC
2025-12-25 22:38:50 | INFO     | [lf.day.start] Processing JED-CAI for 30DEC
[LF] 30DEC: found 6 direct flights
2025-12-25 22:38:51 | INFO     | [lf.day.flights_found] Found 6 flights on 30DEC
2025-12-25 22:38:53 | INFO     | [lf.flight.extracted] SM472 on 30DEC: BKG=157, LF=87.7%
[LF] SM472 30DEC: BKG=157, GRP=89, CAP=179, LF%=87.7%, Brd-Off=JED-CAI, Classes: P:89, I:20, O:10, U:11, X:8, T:18, K:1
[LPC] SM472 30DEC: Found 2 outbound flights with connecting passengers
2025-12-25 22:38:58 | INFO     | [lf.flight.extracted] SM480 on 30DEC: BKG=175, LF=97.8%
[LF] SM480 30DEC: BKG=175, GRP=141, CAP=179, LF%=97.8%, Brd-Off=JED-CAI, Classes: P:141, I:17, O:11, U:6
2025-12-25 22:39:01 | INFO     | [lf.flight.extracted] SM478 on 30DEC: BKG=170, LF=95.0%
[LF] SM478 30DEC: BKG=170, GRP=123, CAP=179, LF%=95.0%, Brd-Off=JED-CAI, Classes: P:78, E:45, I:21, O:10, U:11, X:4, S:1
[LPC] SM478 30DEC: Found 1 outbound flights with connecting passengers
2025-12-25 22:39:06 | INFO     | [lf.flight.extracted] SM460 on 30DEC: BKG=164, LF=93.2%
[LF] SM460 30DEC: BKG=164, GRP=94, CAP=176, LF%=93.2%, Brd-Off=JED-CAI, Classes: N:1, P:94, I:20, O:10, U:11, X:20, T:2, S:6
2025-12-25 22:39:09 | INFO     | [lf.flight.extracted] SM424 on 30DEC: BKG=174, LF=97.2%
[LF] SM424 30DEC: BKG=174, GRP=133, CAP=179, LF%=97.2%, Brd-Off=JED-CAI, Classes: P:88, E:45, I:20, O:10, U:10, V:1
2025-12-25 22:39:13 | INFO     | [lf.flight.extracted] SM476 on 30DEC: BKG=172, LF=96.1%
[LF] SM476 30DEC: BKG=172, GRP=100, CAP=179, LF%=96.1%, Brd-Off=JED-CAI, Classes: P:101, I:20, O:9, U:11, X:25, T:2, W:1, S:3
[LF] Getting WEEKLY/LASTSOLD data for 6 flights
[LF] SM472 30DEC: LASTSOLD=2025-12-24 00:00:00, WEEKLY=14, TODAY=0, YDAY=8
[LF] SM480 30DEC: LASTSOLD=2025-12-24 00:00:00, WEEKLY=8, TODAY=0, YDAY=1
[LF] SM478 30DEC: LASTSOLD=2025-12-24 00:00:00, WEEKLY=10, TODAY=0, YDAY=1
[LF] SM460 30DEC: LASTSOLD=2025-12-25 00:00:00, WEEKLY=21, TODAY=1, YDAY=4
[LF] SM424 30DEC: LASTSOLD=2025-12-24 00:00:00, WEEKLY=10, TODAY=0, YDAY=1
[LF] SM476 30DEC: LASTSOLD=2025-12-25 00:00:00, WEEKLY=18, TODAY=2, YDAY=3
2025-12-25 22:39:42 | INFO     | [SUCCESS] Day 30DEC
2025-12-25 22:39:42 | INFO     | [DAY_START] Processing 29DEC
[LF] Processing JED-CAI for 29DEC
2025-12-25 22:39:42 | INFO     | [lf.day.start] Processing JED-CAI for 29DEC
[LF] 29DEC: found 4 direct flights
2025-12-25 22:39:43 | INFO     | [lf.day.flights_found] Found 4 flights on 29DEC
2025-12-25 22:39:45 | INFO     | [lf.flight.extracted] SM480 on 29DEC: BKG=98, LF=54.8%
[LF] SM480 29DEC: BKG=98, GRP=0, CAP=179, LF%=54.8%, Brd-Off=JED-CAI, Classes: I:35, O:38, U:16, X:6, S:2, L:1
[LPC] SM480 29DEC: Found 2 outbound flights with connecting passengers
2025-12-25 22:39:50 | INFO     | [lf.flight.extracted] SM476 on 29DEC: BKG=171, LF=95.5%
[LF] SM476 29DEC: BKG=171, GRP=138, CAP=179, LF%=95.5%, Brd-Off=JED-CAI, Classes: P:138, I:20, O:10, S:2, G:1
2025-12-25 22:39:53 | INFO     | [lf.flight.extracted] SM478 on 29DEC: BKG=176, LF=100.0%
[LF] SM478 29DEC: BKG=176, GRP=129, CAP=176, LF%=100.0%, Brd-Off=JED-CAI, Classes: P:129, I:17, O:10, U:11, X:1, T:7, S:1
2025-12-25 22:39:56 | INFO     | [lf.flight.extracted] SM460 on 29DEC: BKG=177, LF=100.6%
[LF] SM460 29DEC: BKG=177, GRP=131, CAP=176, LF%=100.6%, Brd-Off=JED-CAI, Classes: P:131, I:16, O:1, X:1, W:3, S:22, G:3
[LPC] SM460 29DEC: Found 0 outbound flights with connecting passengers
[LF] Getting WEEKLY/LASTSOLD data for 4 flights
[LF] SM480 29DEC: LASTSOLD=2025-12-25 00:00:00, WEEKLY=45, TODAY=2, YDAY=10
[LF] SM476 29DEC: LASTSOLD=2025-12-23 00:00:00, WEEKLY=11, TODAY=0, YDAY=0
[LF] SM478 29DEC: LASTSOLD=2025-12-22 00:00:00, WEEKLY=8, TODAY=0, YDAY=0
2025-12-25 22:40:14 | ERROR    | Failed to load D:\CODERED\LAB\market_insights\outputs\run_generated_251225_at_22.36\checkpoints\flight_booking_data.json: Extra data: line 287 column 1 (char 7206)
[LF] SM460 29DEC: LASTSOLD=2025-12-25 00:00:00, WEEKLY=13, TODAY=1, YDAY=1
2025-12-25 22:40:19 | INFO     | [SUCCESS] Day 29DEC
2025-12-25 22:40:19 | INFO     | [DAY_START] Processing 28DEC
[LF] Processing JED-CAI for 28DEC
2025-12-25 22:40:19 | INFO     | [lf.day.start] Processing JED-CAI for 28DEC
[LF] 28DEC: 1 cancelled flight(s) detected from SN
[LF] 28DEC: found 4 direct flights
2025-12-25 22:40:20 | INFO     | [lf.day.flights_found] Found 4 flights on 28DEC
2025-12-25 22:40:21 | INFO     | [lf.flight.extracted] SM424 on 28DEC: BKG=177, LF=100.6%
[LF] SM424 28DEC: BKG=177, GRP=129, CAP=176, LF%=100.6%, Brd-Off=JED-CAI, Classes: N:2, P:27, E:100, I:25, O:14, U:5, X:1, S:3
[LPC] SM424 28DEC: Found 2 outbound flights with connecting passengers
2025-12-25 22:40:31 | INFO     | [lf.flight.extracted] SM476 on 28DEC: BKG=176, LF=98.3%
[LF] SM476 28DEC: BKG=176, GRP=145, CAP=179, LF%=98.3%, Brd-Off=JED-CAI, Classes: P:96, E:50, I:19, O:10, W:1
2025-12-25 22:40:35 | INFO     | [lf.flight.extracted] SM460 on 28DEC: BKG=177, LF=98.9%
[LF] SM460 28DEC: BKG=177, GRP=130, CAP=179, LF%=98.9%, Brd-Off=JED-CAI, Classes: P:130, I:18, O:10, U:9, X:1, S:9
[LPC] SM460 28DEC: Found 0 outbound flights with connecting passengers
2025-12-25 22:40:39 | INFO     | [lf.flight.extracted] SM478 on 28DEC: BKG=166, LF=92.7%
[LF] SM478 28DEC: BKG=166, GRP=130, CAP=179, LF%=92.7%, Brd-Off=JED-CAI, Classes: P:130, I:20, O:9, U:4, S:2, L:1
[LF] Getting WEEKLY/LASTSOLD data for 4 flights
[LF] SM424 28DEC: LASTSOLD=2025-12-24 00:00:00, WEEKLY=19, TODAY=0, YDAY=4
[LF] SM476 28DEC: LASTSOLD=2025-12-24 00:00:00, WEEKLY=11, TODAY=0, YDAY=3
[LF] SM460 28DEC: LASTSOLD=2025-12-23 00:00:00, WEEKLY=12, TODAY=0, YDAY=0
[LF] SM478 28DEC: LASTSOLD=2025-12-22 00:00:00, WEEKLY=10, TODAY=0, YDAY=0
2025-12-25 22:40:57 | INFO     | [SUCCESS] Day 28DEC
2025-12-25 22:40:57 | INFO     | [DAY_START] Processing 27DEC
[LF] Processing JED-CAI for 27DEC
2025-12-25 22:40:57 | INFO     | [lf.day.start] Processing JED-CAI for 27DEC
[LF] 27DEC: found 3 direct flights
2025-12-25 22:40:58 | INFO     | [lf.day.flights_found] Found 3 flights on 27DEC
2025-12-25 22:41:00 | INFO     | [lf.flight.extracted] SM450 on 27DEC: BKG=96, LF=53.6%
[LF] SM450 27DEC: BKG=96, GRP=0, CAP=179, LF%=53.6%, Brd-Off=JED-CAI, Classes: I:60, O:24, U:9, W:1, S:2
[LPC] SM450 27DEC: Found 1 outbound flights with connecting passengers
2025-12-25 22:41:05 | INFO     | [lf.flight.extracted] SM476 on 27DEC: BKG=165, LF=92.2%
[LF] SM476 27DEC: BKG=165, GRP=126, CAP=179, LF%=92.2%, Brd-Off=JED-CAI, Classes: P:126, I:16, O:10, U:12, X:1
2025-12-25 22:41:08 | INFO     | [lf.flight.extracted] SM478 on 27DEC: BKG=177, LF=98.9%
[LF] SM478 27DEC: BKG=177, GRP=133, CAP=179, LF%=98.9%, Brd-Off=JED-CAI, Classes: N:4, P:86, E:45, I:12, O:9, U:9, X:1, S:11
[LPC] SM478 27DEC: Found 0 outbound flights with connecting passengers
[LF] Getting WEEKLY/LASTSOLD data for 3 flights
[LF] SM450 27DEC: LASTSOLD=2025-12-25 00:00:00, WEEKLY=58, TODAY=24, YDAY=18
[LF] SM476 27DEC: LASTSOLD=2025-12-23 00:00:00, WEEKLY=10, TODAY=0, YDAY=0
[LF] SM478 27DEC: LASTSOLD=2025-12-24 00:00:00, WEEKLY=5, TODAY=0, YDAY=2
2025-12-25 22:41:24 | INFO     | [SUCCESS] Day 27DEC
2025-12-25 22:41:24 | INFO     | [DAY_START] Processing 26DEC
[LF] Processing JED-CAI for 26DEC
2025-12-25 22:41:24 | INFO     | [lf.day.start] Processing JED-CAI for 26DEC
[LF] 26DEC: 2 cancelled flight(s) detected from SN
[LF] 26DEC: found 4 direct flights
2025-12-25 22:41:25 | INFO     | [lf.day.flights_found] Found 4 flights on 26DEC
2025-12-25 22:41:27 | INFO     | [lf.flight.extracted] SM424 on 26DEC: BKG=66, LF=36.9%
[LF] SM424 26DEC: BKG=66, GRP=0, CAP=179, LF%=36.9%, Brd-Off=JED-CAI, Classes: I:50, O:10, X:2, W:1, S:3
[LPC] SM424 26DEC: Found 1 outbound flights with connecting passengers
2025-12-25 22:41:31 | INFO     | [lf.flight.extracted] SM476 on 26DEC: BKG=66, LF=36.9%
[LF] SM476 26DEC: BKG=66, GRP=0, CAP=179, LF%=36.9%, Brd-Off=JED-CAI, Classes: I:57, O:5, U:2, S:2
[LPC] SM476 26DEC: Found 1 outbound flights with connecting passengers
2025-12-25 22:41:36 | INFO     | [lf.flight.extracted] SM480 on 26DEC: BKG=134, LF=74.9%
[LF] SM480 26DEC: BKG=134, GRP=1, CAP=179, LF%=74.9%, Brd-Off=JED-CAI, Classes: P:1, I:75, O:44, U:5, X:1, W:1, S:7
2025-12-25 22:41:39 | INFO     | [lf.flight.extracted] SM460 on 26DEC: BKG=168, LF=93.8%
[LF] SM460 26DEC: BKG=168, GRP=45, CAP=179, LF%=93.8%, Brd-Off=JED-CAI, Classes: P:45, I:63, O:41, U:16, X:1, S:2
[LPC] SM460 26DEC: Found 0 outbound flights with connecting passengers
[LF] Getting WEEKLY/LASTSOLD data for 4 flights
[LF] SM424 26DEC: LASTSOLD=2025-12-25 00:00:00, WEEKLY=44, TODAY=21, YDAY=7
[LF] SM476 26DEC: LASTSOLD=2025-12-25 00:00:00, WEEKLY=42, TODAY=16, YDAY=7
[LF] SM480 26DEC: LASTSOLD=2025-12-25 00:00:00, WEEKLY=62, TODAY=7, YDAY=12
[LF] SM460 26DEC: LASTSOLD=2025-12-25 00:00:00, WEEKLY=57, TODAY=9, YDAY=21
2025-12-25 22:41:59 | INFO     | [SUCCESS] Day 26DEC
[LF] Results summary:
  2025-12-30: 6 flights
  2025-12-29: 4 flights
  2025-12-28: 4 flights
  2025-12-27: 3 flights
  2025-12-26: 4 flights
[LF] Cancelled flights found: 3
  - SM432 28DEC (SN)
  - SM478 26DEC (SN)
  - SM472 26DEC (SN)
2025-12-25 22:41:59 | INFO     | [SUCCESS] LF Search Complete
[Worker_9225] Cancelled flights collected: 3

============================================================
[Worker_9225] ✓ COMPLETED: JED-CAI
  Results: 5 dates
  Errors: 0 dates
  Total Processed: 2 groups
============================================================

2025-12-25 22:42:01 | INFO     | [Worker_9225] Completed: JED-CAI - 5 results, 0 errors

============================================================
[Worker_9225] Shutdown signal received
Exiting...
============================================================
2025-12-25 22:42:06 | INFO     | [Worker_9225] Shutdown signal received, exiting...

============================================================
[Worker_9225] FINISHED
  Total Groups Processed: 2
============================================================

2025-12-25 22:42:06 | INFO     | [Worker_9225] Finished. Processed 2 groups.
