
============================================================
     LF WORKER - PORT 9222
============================================================
Worker: Worker_9222
Status: READY
Waiting for tasks...
============================================================


============================================================
[Worker_9222] Processing: JED-CAI
  Tier 0: Range 1, Chunk 1/3
  Dates: 7 days
  Date Range: 2026-01-20 to 2026-01-14
============================================================

2025-12-31 15:58:08 | INFO     | ======================================================================
2025-12-31 15:58:08 | INFO     | Load Factor Scraper Started - Route: JED-CAI
2025-12-31 15:58:08 | INFO     | Log file: D:\CODERED\LAB\market_insights\outputs\run_generated_311225_at_15.57\logs\LF_JED-CAI_20251231_155808.log
2025-12-31 15:58:08 | INFO     | Enhanced logging: Capturing both logging.info() and print()
2025-12-31 15:58:08 | INFO     | ======================================================================
[LF] Processing dates (override): ['20JAN', '19JAN', '18JAN', '17JAN', '16JAN', '15JAN', '14JAN']
[LF] Attaching to Chrome for Altea access
[LF][[OK] SUCCESS] Connected to Chrome on 127.0.0.1:9222 (after 1 attempts)
[LF][[OK] SUCCESS] Found Amadeus Altea window: Altéa Reservation Desktop
[LF][[INFO] INFO] URL: https://tc212.resdesktop.altea.amadeus.com/app_ard/apf/init/login?SITE=ESMPESMP&LANGUAGE=GB&MARKETS=ARDW_PROD_WBP&ACTION=clpLogin
[LF] Processing JED-CAI for 20JAN
[LF][ERROR] Amadeus command error detected: UNKNOWN TRANSACTION
[LF][ERROR] Command: SN20JANJEDCAI/ASM
[LF][RESYNC] Triggering immediate resync to last successful SN command
============================================================
[LF][RESYNC] Command 'SN20JANJEDCAI/ASM' failed: TECH_ERROR:UNKNOWN TRANSACTION
[LF][RESYNC] Re-running entire day from SN command for JED-CAI 20JAN
[LF][RESYNC] Attempt 1/50 (waiting 1.0s before retry...)
============================================================
[LF][RESYNC] Sending IG to clear session state...
[LF][RESYNC] Session cleared with IG
[LF] Processing JED-CAI for 20JAN
[LF] 20JAN: found 7 direct flights
[LF] SM472 20JAN: BKG=9, GRP=0, CAP=175, LF%=5.1%, Brd-Off=JED-CAI, Classes: I:7, U:2
[LF] SM954 20JAN: BKG=8, GRP=0, CAP=167, LF%=4.8%, Brd-Off=JED-CAI, Classes: I:8
[LF] SM480 20JAN: BKG=110, GRP=93, CAP=175, LF%=62.9%, Brd-Off=JED-CAI, Classes: P:93, I:8, O:1, U:8
[LF] SM478 20JAN: BKG=143, GRP=130, CAP=168, LF%=85.1%, Brd-Off=JED-CAI, Classes: P:130, I:4, O:1, U:7, L:1
[LF] SM460 20JAN: BKG=117, GRP=95, CAP=175, LF%=66.9%, Brd-Off=JED-CAI, Classes: N:3, P:95, I:8, O:1, U:10
[LF] SM424 20JAN: BKG=12, GRP=0, CAP=167, LF%=7.2%, Brd-Off=JED-CAI, Classes: I:9, U:3
[LF] SM476 20JAN: BKG=54, GRP=45, CAP=175, LF%=30.9%, Brd-Off=JED-CAI, Classes: P:45, I:1, U:3, S:5
[LPC] SM476 20JAN: Found 0 outbound flights with connecting passengers
[LF] Getting WEEKLY/LASTSOLD data for 7 flights
[LF] SM472 20JAN: LASTSOLD=2025-12-30 00:00:00, WEEKLY=6, TODAY=0, YDAY=2
[LF] SM954 20JAN: LASTSOLD=2025-12-28 00:00:00, WEEKLY=6, TODAY=0, YDAY=0
[LF] SM480 20JAN: LASTSOLD=2025-12-31 00:00:00, WEEKLY=9, TODAY=1, YDAY=5
[LF] SM478 20JAN: LASTSOLD=2025-12-30 00:00:00, WEEKLY=6, TODAY=0, YDAY=2
[LF] SM460 20JAN: LASTSOLD=2025-12-30 00:00:00, WEEKLY=12, TODAY=0, YDAY=3
[LF] SM424 20JAN: LASTSOLD=2025-12-31 00:00:00, WEEKLY=7, TODAY=1, YDAY=1
[LF] SM476 20JAN: LASTSOLD=2025-12-31 00:00:00, WEEKLY=6, TODAY=1, YDAY=5
[LF] Processing JED-CAI for 19JAN
[LF] 19JAN: found 4 direct flights
[LF] SM480 19JAN: BKG=2, GRP=0, CAP=175, LF%=1.1%, Brd-Off=JED-CAI, Classes: I:1, U:1
[LF] SM476 19JAN: BKG=147, GRP=133, CAP=175, LF%=84.0%, Brd-Off=JED-CAI, Classes: P:133, I:8, U:6
[LF] SM478 19JAN: BKG=67, GRP=51, CAP=175, LF%=38.3%, Brd-Off=JED-CAI, Classes: P:51, I:10, U:6
[LF] SM460 19JAN: BKG=149, GRP=141, CAP=167, LF%=89.2%, Brd-Off=JED-CAI, Classes: P:91, E:50, I:8
[LPC] SM460 19JAN: Found 0 outbound flights with connecting passengers
[LF] Getting WEEKLY/LASTSOLD data for 4 flights
[LF] SM480 19JAN: LASTSOLD=2025-12-30 00:00:00, WEEKLY=1, TODAY=0, YDAY=1
[LF] SM476 19JAN: LASTSOLD=2025-12-30 00:00:00, WEEKLY=5, TODAY=0, YDAY=1
[LF] SM478 19JAN: LASTSOLD=2025-12-30 00:00:00, WEEKLY=4, TODAY=0, YDAY=2
[LF] SM460 19JAN: LASTSOLD=2025-12-31 00:00:00, WEEKLY=10, TODAY=2, YDAY=7
[LF] Processing JED-CAI for 18JAN
[LF] 18JAN: found 5 direct flights
[LF] SM424 18JAN: BKG=107, GRP=90, CAP=167, LF%=64.1%, Brd-Off=JED-CAI, Classes: P:90, I:17
[LF][[SYNC] RETRYING] Cannot focus on command line
[LF][[INFO] INFO] Will try 50 times before pausing...
[LF][[SYNC] RETRYING] Cannot focus on command line
[LF][[INFO] INFO] Will try 50 times before pausing...
[LF][ERROR] Amadeus command error detected: INVALID FORMAT
[LF][ERROR] Command: LL/I/SM476/18JAN
[LF][RESYNC] Triggering immediate resync to last successful SN command
============================================================
[LF][RESYNC] Command 'LL/I/SM476/18JAN' failed: TECH_ERROR:INVALID FORMAT
[LF][RESYNC] Re-running entire day from SN command for JED-CAI 18JAN
[LF][RESYNC] Attempt 1/50 (waiting 1.0s before retry...)
============================================================
[LF][RESYNC] Sending IG to clear session state...
[LF][RESYNC] Session cleared with IG
[LF] Processing JED-CAI for 18JAN
[LF] 18JAN: found 5 direct flights
[LF][[SYNC] RETRYING] Cannot focus on command line
[LF][[INFO] INFO] Will try 50 times before pausing...
[LF][RECONNECT] Connection lost. Attempting reconnect #1...
[LF][INFO] Make sure Chrome is open with remote debugging port
[LF][[OK] SUCCESS] Connected to Chrome on 127.0.0.1:9222 (after 1 attempts)
[LF][[OK] SUCCESS] Found Amadeus Altea window: Altéa Reservation Desktop
[LF][[INFO] INFO] URL: https://tc212.resdesktop.altea.amadeus.com/app_ard/apf/init/login?SITE=ESMPESMP&LANGUAGE=GB&MARKETS=ARDW_PROD_WBP&ACTION=clpLogin
[LF][SUCCESS] Chrome reconnected successfully!
[LF][RESUME] Restoring session context with: SN18JANJEDCAI/ASM
[LF][RESUME] Session context restored!
[LF] Processing JED-CAI for 18JAN
[LF][[SYNC] RETRYING] Cannot focus on command line
[LF][[INFO] INFO] Will try 50 times before pausing...
[LF] 18JAN: found 5 direct flights
[LF][[SYNC] RETRYING] Cannot focus on command line
[LF][[INFO] INFO] Will try 50 times before pausing...
[LF] SM424 18JAN: BKG=107, GRP=90, CAP=167, LF%=64.1%, Brd-Off=JED-CAI, Classes: P:90, I:17
[LF][[SYNC] RETRYING] Cannot focus on command line
[LF][[INFO] INFO] Will try 50 times before pausing...
[LF][[SYNC] RETRYING] Cannot focus on command line
[LF][[INFO] INFO] Will try 50 times before pausing...
[LF][ERROR] Amadeus command error detected: INVALID FORMAT
[LF][ERROR] Command: M
[LF][RESYNC] Triggering immediate resync to last successful SN command
============================================================
[LF][RESYNC] Command 'M' failed: TECH_ERROR:INVALID FORMAT
[LF][RESYNC] Re-running entire day from SN command for JED-CAI 18JAN
[LF][RESYNC] Attempt 1/50 (waiting 1.0s before retry...)
============================================================
[LF][RESYNC] Sending IG to clear session state...
[LF][RESYNC] Session cleared with IG
[LF] Processing JED-CAI for 18JAN
[LF][[SYNC] RETRYING] Cannot focus on command line
[LF][[INFO] INFO] Will try 50 times before pausing...
[LF] 18JAN: found 5 direct flights
[LF] SM424 18JAN: BKG=107, GRP=90, CAP=167, LF%=64.1%, Brd-Off=JED-CAI, Classes: P:90, I:17
[LF][[SYNC] RETRYING] Cannot focus on command line
[LF][[INFO] INFO] Will try 50 times before pausing...
[LF] SM476 18JAN: BKG=4, GRP=0, CAP=175, LF%=2.3%, Brd-Off=JED-CAI, Classes: I:2, U:2
[LF][[SYNC] RETRYING] Cannot focus on command line
[LF][[INFO] INFO] Will try 50 times before pausing...
[LF][ERROR] Amadeus command error detected: INVALID DISPLAY OPTION CODE
[LF][ERROR] Command: LPC/+TE/SM476/18JAN/t
[LF][RESYNC] Triggering immediate resync to last successful SN command
[LPC] Error parsing connecting passengers for SM476/18JAN: LPC/+TE/SM476/18JAN/t: TECH_ERROR:INVALID DISPLAY OPTION CODE
[LF][[SYNC] RETRYING] Cannot focus on command line
[LF][[INFO] INFO] Will try 50 times before pausing...
[LF][[SYNC] RETRYING] Cannot focus on command line
[LF][[INFO] INFO] Will try 50 times before pausing...
[LF] SM432 18JAN: BKG=48, GRP=40, CAP=175, LF%=27.4%, Brd-Off=JED-CAI, Classes: O:1, U:79, X:25, T:25, W:6, S:3, G:2
[LF][[SYNC] RETRYING] Cannot focus on command line
[LF][[INFO] INFO] Will try 50 times before pausing...
[LF] SM460 18JAN: BKG=57, GRP=49, CAP=167, LF%=34.1%, Brd-Off=JED-CAI, Classes: P:49, I:6, O:1, U:1
[LF][[SYNC] RETRYING] Cannot focus on command line
[LF][[INFO] INFO] Will try 50 times before pausing...
[LF][[SYNC] RETRYING] Cannot focus on command line
[LF][[INFO] INFO] Will try 50 times before pausing...
[LF][RECONNECT] Connection lost. Attempting reconnect #2...
[LF][INFO] Make sure Chrome is open with remote debugging port
[LF][[OK] SUCCESS] Connected to Chrome on 127.0.0.1:9222 (after 1 attempts)
[LF][[OK] SUCCESS] Found Amadeus Altea window: Altéa Reservation Desktop
[LF][[INFO] INFO] URL: https://tc212.resdesktop.altea.amadeus.com/app_ard/apf/init/login?SITE=ESMPESMP&LANGUAGE=GB&MARKETS=ARDW_PROD_WBP&ACTION=clpLogin
[LF][SUCCESS] Chrome reconnected successfully!
[LF][RESUME] Restoring session context with: SN18JANJEDCAI/ASM
[LF][[SYNC] RETRYING] Cannot focus on command line
[LF][[INFO] INFO] Will try 50 times before pausing...
[LF][RESUME] Failed to restore context: Message: stale element reference: stale element not found in the current frame
  (Session info: chrome=143.0.7499.170); For documentation on this error, please visit: https://www.selenium.dev/documentation/webdriver/troubleshooting/errors#stale-element-reference-exception
Stacktrace:
Symbols not available. Dumping unresolved backtrace:
	0x7ff6033488e5
	0x7ff603348940
	0x7ff60312165d
	0x7ff6031292cc
	0x7ff60312c74e
	0x7ff6031cc05f
	0x7ff6031a1fda
	0x7ff6031cac97
	0x7ff60316ac29
	0x7ff60316ba93
	0x7ff603660640
	0x7ff60365af80
	0x7ff6036796e6
	0x7ff603365de4
	0x7ff60336ed8c
	0x7ff603352004
	0x7ff6033521b5
	0x7ff603337ee2
	0x7ffea5c0e8d7
	0x7ffea6b6c53c

[LF] Processing JED-CAI for 18JAN
[LF][[SYNC] RETRYING] Cannot focus on command line
[LF][[INFO] INFO] Will try 50 times before pausing...
[LF] 18JAN: found 5 direct flights
[LF][[SYNC] RETRYING] Cannot focus on command line
[LF][[INFO] INFO] Will try 50 times before pausing...
[LF][RECONNECT] Connection lost. Attempting reconnect #3...
[LF][INFO] Make sure Chrome is open with remote debugging port
[LF][[OK] SUCCESS] Connected to Chrome on 127.0.0.1:9222 (after 1 attempts)
[LF][[OK] SUCCESS] Found Amadeus Altea window: Altéa Reservation Desktop
[LF][[INFO] INFO] URL: https://tc212.resdesktop.altea.amadeus.com/app_ard/apf/init/login?SITE=ESMPESMP&LANGUAGE=GB&MARKETS=ARDW_PROD_WBP&ACTION=clpLogin
[LF][SUCCESS] Chrome reconnected successfully!
[LF][RESUME] Restoring session context with: SN18JANJEDCAI/ASM
[LF][[SYNC] RETRYING] Cannot focus on command line
[LF][[INFO] INFO] Will try 50 times before pausing...
[LF][RESUME] Session context restored!
[LF] Processing JED-CAI for 18JAN
[LF] 18JAN: found 5 direct flights
[LF][[SYNC] RETRYING] Cannot focus on command line
[LF][[INFO] INFO] Will try 50 times before pausing...
[LF] SM424 18JAN: BKG=107, GRP=90, CAP=167, LF%=64.1%, Brd-Off=JED-CAI, Classes: P:90, I:17
[LF] SM476 18JAN: BKG=4, GRP=0, CAP=175, LF%=2.3%, Brd-Off=JED-CAI, Classes: I:2, U:2
[LF] SM432 18JAN: BKG=48, GRP=40, CAP=175, LF%=27.4%, Brd-Off=JED-CAI, Classes: P:40, I:4, U:4
[LF] SM460 18JAN: BKG=57, GRP=49, CAP=167, LF%=34.1%, Brd-Off=JED-CAI, Classes: P:49, I:6, O:1, U:1
[LF] SM478 18JAN: BKG=171, GRP=141, CAP=168, LF%=101.8%, Brd-Off=JED-CAI, Classes: P:141, I:23, O:1, U:3, S:3
[LF] Getting WEEKLY/LASTSOLD data for 5 flights
[LF][[SYNC] RETRYING] Cannot focus on command line
[LF][[INFO] INFO] Will try 50 times before pausing...
[LF] SM424 18JAN: LASTSOLD=2025-12-31 00:00:00, WEEKLY=10, TODAY=6, YDAY=0
[LF][ERROR] Amadeus command error detected: UNKNOWN TRANSACTION
[LF][ERROR] Command: LP/L(99)/SM476/18JAN
[LF][RESYNC] Triggering immediate resync to last successful SN command
[LF][ERROR] SM476 18JAN: LP/L(99)/SM476/18JAN: TECH_ERROR:UNKNOWN TRANSACTION
[LF] SM432 18JAN: LASTSOLD=2025-12-30 00:00:00, WEEKLY=14, TODAY=0, YDAY=1
[LF][[SYNC] RETRYING] Cannot focus on command line
[LF][[INFO] INFO] Will try 50 times before pausing...
[LF][ERROR] Amadeus command error detected: UNKNOWN TRANSACTION
[LF][ERROR] Command: M
[LF][RESYNC] Triggering immediate resync to last successful SN command
[LF][ERROR] SM460 18JAN: M: TECH_ERROR:UNKNOWN TRANSACTION
[LF][ERROR] Amadeus command error detected: UNKNOWN TRANSACTION
[LF][ERROR] Command: LP/L(99)/SM478/18JAN
[LF][RESYNC] Triggering immediate resync to last successful SN command
[LF][ERROR] SM478 18JAN: LP/L(99)/SM478/18JAN: TECH_ERROR:UNKNOWN TRANSACTION
[LF] Processing JED-CAI for 17JAN
[LF] 17JAN: found 3 direct flights
[LF] SM450 17JAN: BKG=14, GRP=0, CAP=167, LF%=8.4%, Brd-Off=JED-CAI, Classes: I:9, U:5
[LF] SM476 17JAN: BKG=117, GRP=93, CAP=175, LF%=66.9%, Brd-Off=JED-CAI, Classes: P:93, O:4, U:10, X:10
[LF][[SYNC] RETRYING] Cannot focus on command line
[LF][[INFO] INFO] Will try 50 times before pausing...
[LF] SM478 17JAN: BKG=128, GRP=82, CAP=175, LF%=73.1%, Brd-Off=JED-CAI, Classes: P:82, I:15, O:15, U:7, X:9
[LF] Getting WEEKLY/LASTSOLD data for 3 flights
[LF][[SYNC] RETRYING] Cannot focus on command line
[LF][[INFO] INFO] Will try 50 times before pausing...
[LF] SM450 17JAN: LASTSOLD=2025-12-31 00:00:00, WEEKLY=9, TODAY=1, YDAY=5
[LF][ERROR] Amadeus command error detected: INVALID FORMAT
[LF][ERROR] Command: LP/L(99)/SM476/17JAN
[LF][RESYNC] Triggering immediate resync to last successful SN command
[LF][ERROR] SM476 17JAN: LP/L(99)/SM476/17JAN: TECH_ERROR:INVALID FORMAT
[LF][ERROR] Amadeus command error detected: UNKNOWN TRANSACTION
[LF][ERROR] Command: LP/L(99)/SM478/17JAN
[LF][RESYNC] Triggering immediate resync to last successful SN command
[LF][ERROR] SM478 17JAN: LP/L(99)/SM478/17JAN: TECH_ERROR:UNKNOWN TRANSACTION
[LF] Processing JED-CAI for 16JAN
[LF][[SYNC] RETRYING] Cannot focus on command line
[LF][[INFO] INFO] Will try 50 times before pausing...
[LF] 16JAN: found 6 direct flights
[LF] SM424 16JAN: BKG=8, GRP=0, CAP=167, LF%=4.8%, Brd-Off=JED-CAI, Classes: I:6, O:1, U:1
[LF][[SYNC] RETRYING] Cannot focus on command line
[LF][[INFO] INFO] Will try 50 times before pausing...
[LF][ERROR] Amadeus command error detected: UNKNOWN TRANSACTION
[LF][ERROR] Command: LPC/+TE/SM424/16JAN/t
[LF][RESYNC] Triggering immediate resync to last successful SN command
[LPC] Error parsing connecting passengers for SM424/16JAN: LPC/+TE/SM424/16JAN/t: TECH_ERROR:UNKNOWN TRANSACTION
[LF][[SYNC] RETRYING] Cannot focus on command line
[LF][[INFO] INFO] Will try 50 times before pausing...
[LF] SM476 16JAN: BKG=10, GRP=0, CAP=175, LF%=5.7%, Brd-Off=JED-CAI, Classes: I:20, O:10, U:15, X:20, T:30, W:11, L:1
[LF] SM478 16JAN: BKG=10, GRP=0, CAP=175, LF%=5.7%, Brd-Off=JED-CAI, Classes: I:10
[LF][[SYNC] RETRYING] Cannot focus on command line
[LF][[INFO] INFO] Will try 50 times before pausing...
[LF][[SYNC] RETRYING] Cannot focus on command line
[LF][[INFO] INFO] Will try 50 times before pausing...
[LF][ERROR] Amadeus command error detected: INVALID FLIGHT NUMBER
[LF][ERROR] Command: M
[LF][RESYNC] Triggering immediate resync to last successful SN command
============================================================
[LF][RESYNC] Command 'M' failed: TECH_ERROR:INVALID FLIGHT NUMBER
[LF][RESYNC] Re-running entire day from SN command for JED-CAI 16JAN
[LF][RESYNC] Attempt 1/50 (waiting 1.0s before retry...)
============================================================
[LF][RESYNC] Sending IG to clear session state...
[LF][RESYNC] Session cleared with IG
[LF] Processing JED-CAI for 16JAN
[LF][[SYNC] RETRYING] Cannot focus on command line
[LF][[INFO] INFO] Will try 50 times before pausing...
[LF] 16JAN: found 6 direct flights
[LF][[SYNC] RETRYING] Cannot focus on command line
[LF][[INFO] INFO] Will try 50 times before pausing...
[LF][ERROR] Amadeus command error detected: UNKNOWN TRANSACTION
[LF][ERROR] Command: LL/I/SM424/16JAN
[LF][RESYNC] Triggering immediate resync to last successful SN command
============================================================
[LF][RESYNC] Command 'LL/I/SM424/16JAN' failed: TECH_ERROR:UNKNOWN TRANSACTION
[LF][RESYNC] Re-running entire day from SN command for JED-CAI 16JAN
[LF][RESYNC] Attempt 2/50 (waiting 1.0s before retry...)
============================================================
[LF][RESYNC] Sending IG to clear session state...
[LF][RESYNC] Session cleared with IG
[LF] Processing JED-CAI for 16JAN
[LF] 16JAN: found 6 direct flights
[LF][[SYNC] RETRYING] Cannot focus on command line
[LF][[INFO] INFO] Will try 50 times before pausing...
[LF] SM424 16JAN: BKG=8, GRP=0, CAP=167, LF%=4.8%, Brd-Off=JED-CAI, Classes: I:6, O:1, U:1
[LF][[SYNC] RETRYING] Cannot focus on command line
[LF][[INFO] INFO] Will try 50 times before pausing...
[LF][[SYNC] RETRYING] Cannot focus on command line
[LF][[INFO] INFO] Will try 50 times before pausing...
[LF] SM476 16JAN: BKG=10, GRP=0, CAP=175, LF%=5.7%, Brd-Off=JED-CAI, Classes: I:20, O:18, U:1, X:30, T:21, W:18, S:7
[LF] SM478 16JAN: BKG=10, GRP=0, CAP=175, LF%=5.7%, Brd-Off=JED-CAI, Classes: I:10
[LF] SM480 16JAN: BKG=22, GRP=0, CAP=175, LF%=12.6%, Brd-Off=JED-CAI, Classes: I:2, O:8, U:7, G:1, K:4
[LF][[SYNC] RETRYING] Cannot focus on command line
[LF][[INFO] INFO] Will try 50 times before pausing...
[LF][[SYNC] RETRYING] Cannot focus on command line
[LF][[INFO] INFO] Will try 50 times before pausing...
[LF] SM472 16JAN: BKG=104, GRP=49, CAP=175, LF%=59.4%, Brd-Off=JED-CAI, Classes: P:137, I:10, O:21, U:2, X:4, S:1, V:1
[LF][[SYNC] RETRYING] Cannot focus on command line
[LF][[INFO] INFO] Will try 50 times before pausing...
[LF] SM460 16JAN: BKG=50, GRP=42, CAP=167, LF%=29.9%, Brd-Off=JED-CAI, Classes: P:42, O:2, U:5, G:1
[LF] Getting WEEKLY/LASTSOLD data for 6 flights
[LF] SM424 16JAN: LASTSOLD=2025-12-31 00:00:00, WEEKLY=7, TODAY=1, YDAY=3
[LF] SM476 16JAN: LASTSOLD=2025-12-30 00:00:00, WEEKLY=6, TODAY=0, YDAY=1
[LF] SM478 16JAN: LASTSOLD=2025-12-30 00:00:00, WEEKLY=10, TODAY=0, YDAY=8
[LF] SM480 16JAN: LASTSOLD=2025-12-31 00:00:00, WEEKLY=14, TODAY=1, YDAY=1
[LF][[SYNC] RETRYING] Cannot focus on command line
[LF][[INFO] INFO] Will try 50 times before pausing...
[LF] SM472 16JAN: LASTSOLD=2025-12-29 00:00:00, WEEKLY=44, TODAY=0, YDAY=0
[LF] SM460 16JAN: LASTSOLD=2025-12-28 00:00:00, WEEKLY=45, TODAY=0, YDAY=0
[LF] Processing JED-CAI for 15JAN
[LF][[SYNC] RETRYING] Cannot focus on command line
[LF][[INFO] INFO] Will try 50 times before pausing...
[LF] 15JAN: found 6 direct flights
[LF] SM472 15JAN: BKG=57, GRP=45, CAP=175, LF%=32.6%, Brd-Off=JED-CAI, Classes: P:45, I:2, U:9, X:1
[LF][[SYNC] RETRYING] Cannot focus on command line
[LF][[INFO] INFO] Will try 50 times before pausing...
[LF][[SYNC] RETRYING] Cannot focus on command line
[LF][[INFO] INFO] Will try 50 times before pausing...
[LF][ERROR] Amadeus command error detected: INVALID FORMAT
[LF][ERROR] Command: M
[LF][RESYNC] Triggering immediate resync to last successful SN command
============================================================
[LF][RESYNC] Command 'M' failed: TECH_ERROR:INVALID FORMAT
[LF][RESYNC] Re-running entire day from SN command for JED-CAI 15JAN
[LF][RESYNC] Attempt 1/50 (waiting 1.0s before retry...)
============================================================
[LF][RESYNC] Sending IG to clear session state...
[LF][RESYNC] Session cleared with IG
[LF] Processing JED-CAI for 15JAN
[LF] 15JAN: found 6 direct flights
[LF] SM472 15JAN: BKG=57, GRP=45, CAP=175, LF%=32.6%, Brd-Off=JED-CAI, Classes: P:45, I:2, U:9, X:1
[LF] SM450 15JAN: BKG=1, GRP=0, CAP=167, LF%=0.6%, Brd-Off=JED-CAI, Classes: U:1
[LF][[SYNC] RETRYING] Cannot focus on command line
[LF][[INFO] INFO] Will try 50 times before pausing...
[LF] SM476 15JAN: BKG=5, GRP=0, CAP=175, LF%=2.9%, Brd-Off=JED-CAI, Classes: P:130, I:10, O:10, U:21, X:2, S:5
[LF] SM432 15JAN: BKG=1, GRP=0, CAP=172, LF%=0.6%, Brd-Off=JED-CAI, Classes: I:1
[LF][[SYNC] RETRYING] Cannot focus on command line
[LF][[INFO] INFO] Will try 50 times before pausing...
[LF][[SYNC] RETRYING] Cannot focus on command line
[LF][[INFO] INFO] Will try 50 times before pausing...
[LF] SM478 15JAN: BKG=114, GRP=94, CAP=175, LF%=65.1%, Brd-Off=JED-CAI, Classes: P:136, I:9, O:11, U:8, X:9, T:3
[LF][[SYNC] RETRYING] Cannot focus on command line
[LF][[INFO] INFO] Will try 50 times before pausing...
[LF][[SYNC] RETRYING] Cannot focus on command line
[LF][[INFO] INFO] Will try 50 times before pausing...
[LF][ERROR] Amadeus command error detected: INVALID FORMAT
[LF][ERROR] Command: M
[LF][RESYNC] Triggering immediate resync to last successful SN command
============================================================
[LF][RESYNC] Command 'M' failed: TECH_ERROR:INVALID FORMAT
[LF][RESYNC] Re-running entire day from SN command for JED-CAI 15JAN
[LF][RESYNC] Attempt 2/50 (waiting 1.0s before retry...)
============================================================
[LF][RESYNC] Sending IG to clear session state...
[LF][RESYNC] Session cleared with IG
[LF] Processing JED-CAI for 15JAN
[LF][[SYNC] RETRYING] Cannot focus on command line
[LF][[INFO] INFO] Will try 50 times before pausing...
[LF][[SYNC] RETRYING] Cannot focus on command line
[LF][[INFO] INFO] Will try 50 times before pausing...
[LF][[SYNC] RETRYING] Cannot focus on command line
[LF][[INFO] INFO] Will try 50 times before pausing...
[LF] 15JAN: found 6 direct flights
[LF] SM472 15JAN: BKG=57, GRP=45, CAP=175, LF%=32.6%, Brd-Off=JED-CAI, Classes: P:45, I:2, U:9, X:1
[LF] SM450 15JAN: BKG=1, GRP=0, CAP=167, LF%=0.6%, Brd-Off=JED-CAI, Classes: U:1
[LF] SM476 15JAN: BKG=5, GRP=0, CAP=175, LF%=2.9%, Brd-Off=JED-CAI, Classes: I:4, Y:1
[LF][[SYNC] RETRYING] Cannot focus on command line
[LF][[INFO] INFO] Will try 50 times before pausing...
[LF] SM432 15JAN: BKG=1, GRP=0, CAP=172, LF%=0.6%, Brd-Off=JED-CAI, Classes: P:123, I:9, U:2, X:29, T:4
[LF][[SYNC] RETRYING] Cannot focus on command line
[LF][[INFO] INFO] Will try 50 times before pausing...
[LF] SM478 15JAN: BKG=117, GRP=94, CAP=175, LF%=66.9%, Brd-Off=JED-CAI, Classes: P:94, I:13, U:9, X:1
[LF] SM480 15JAN: BKG=116, GRP=92, CAP=175, LF%=66.3%, Brd-Off=JED-CAI, Classes: P:92, I:15, U:7, S:1, L:1
[LF] Getting WEEKLY/LASTSOLD data for 6 flights
[LF] SM472 15JAN: LASTSOLD=2025-12-30 00:00:00, WEEKLY=2, TODAY=0, YDAY=2
[LF][[SYNC] RETRYING] Cannot focus on command line
[LF][[INFO] INFO] Will try 50 times before pausing...
[LF] SM450 15JAN: LASTSOLD=2025-11-03 00:00:00, WEEKLY=0, TODAY=0, YDAY=0
[LF] SM476 15JAN: LASTSOLD=2025-12-29 00:00:00, WEEKLY=5, TODAY=0, YDAY=0
[LF][[SYNC] RETRYING] Cannot focus on command line
[LF][[INFO] INFO] Will try 50 times before pausing...
[LF] SM432 15JAN: LASTSOLD=2025-12-30 00:00:00, WEEKLY=1, TODAY=0, YDAY=1
[LF][[SYNC] RETRYING] Cannot focus on command line
[LF][[INFO] INFO] Will try 50 times before pausing...
[LF][ERROR] Amadeus command error detected: UNKNOWN TRANSACTION
[LF][ERROR] Command: LP/L(99)/SM478/15JAN
[LF][RESYNC] Triggering immediate resync to last successful SN command
[LF][ERROR] SM478 15JAN: LP/L(99)/SM478/15JAN: TECH_ERROR:UNKNOWN TRANSACTION
[LF] SM480 15JAN: LASTSOLD=2025-12-31 00:00:00, WEEKLY=20, TODAY=1, YDAY=6
[LF] Processing JED-CAI for 14JAN
[LF] 14JAN: found 4 direct flights
[LF][[SYNC] RETRYING] Cannot focus on command line
[LF][[INFO] INFO] Will try 50 times before pausing...
[LF][[SYNC] RETRYING] Cannot focus on command line
[LF][[INFO] INFO] Will try 50 times before pausing...
[LF][ERROR] Amadeus command error detected: INVALID ENTRY
[LF][ERROR] Command: M
[LF][RESYNC] Triggering immediate resync to last successful SN command
============================================================
[LF][RESYNC] Command 'M' failed: TECH_ERROR:INVALID ENTRY
[LF][RESYNC] Re-running entire day from SN command for JED-CAI 14JAN
[LF][RESYNC] Attempt 1/50 (waiting 1.0s before retry...)
============================================================
[LF][RESYNC] Sending IG to clear session state...
[LF][RESYNC] Session cleared with IG
[LF] Processing JED-CAI for 14JAN
[LF] 14JAN: found 4 direct flights
[LF][[SYNC] RETRYING] Cannot focus on command line
[LF][[INFO] INFO] Will try 50 times before pausing...
[LF][RECONNECT] Connection lost. Attempting reconnect #1...
[LF][INFO] Make sure Chrome is open with remote debugging port
[LF][[OK] SUCCESS] Connected to Chrome on 127.0.0.1:9222 (after 1 attempts)
[LF][[OK] SUCCESS] Found Amadeus Altea window: Altéa Reservation Desktop
[LF][[INFO] INFO] URL: https://tc212.resdesktop.altea.amadeus.com/app_ard/apf/init/login?SITE=ESMPESMP&LANGUAGE=GB&MARKETS=ARDW_PROD_WBP&ACTION=clpLogin
[LF][SUCCESS] Chrome reconnected successfully!
[LF][RESUME] Restoring session context with: SN14JANJEDCAI/ASM
[LF][[SYNC] RETRYING] Cannot focus on command line
[LF][[INFO] INFO] Will try 50 times before pausing...
[LF][ERROR] Amadeus command error detected: INVALID FORMAT
[LF][ERROR] Command: SN14JANJEDCAI/ASM
[LF][RESYNC] Triggering immediate resync to last successful SN command
[LF][RESUME] Failed to restore context: SN14JANJEDCAI/ASM: TECH_ERROR:INVALID FORMAT
[LF] Processing JED-CAI for 14JAN
[LF] 14JAN: found 4 direct flights
[LF] SM476 14JAN: BKG=64, GRP=47, CAP=175, LF%=36.6%, Brd-Off=JED-CAI, Classes: P:47, I:10, U:6, S:1
[LPC] SM476 14JAN: Found 1 outbound flights with connecting passengers
[LF][[SYNC] RETRYING] Cannot focus on command line
[LF][[INFO] INFO] Will try 50 times before pausing...
[LF] SM478 14JAN: BKG=122, GRP=96, CAP=175, LF%=69.7%, Brd-Off=JED-CAI, Classes: P:51, E:45, I:11, U:13, X:2
[LF][[SYNC] RETRYING] Cannot focus on command line
[LF][[INFO] INFO] Will try 50 times before pausing...
[LF] SM460 14JAN: BKG=144, GRP=126, CAP=167, LF%=86.2%, Brd-Off=JED-CAI, Classes: P:126, I:12, U:6
[LF] SM424 14JAN: BKG=21, GRP=0, CAP=167, LF%=12.6%, Brd-Off=JED-CAI, Classes: I:17, U:3, G:1
[LF] Getting WEEKLY/LASTSOLD data for 4 flights
[LF][[SYNC] RETRYING] Cannot focus on command line
[LF][[INFO] INFO] Will try 50 times before pausing...
[LF][[SYNC] RETRYING] Cannot focus on command line
[LF][[INFO] INFO] Will try 50 times before pausing...
[LF] SM476 14JAN: LASTSOLD=2025-12-31 00:00:00, WEEKLY=11, TODAY=1, YDAY=3
[LF][ERROR] Amadeus command error detected: UNKNOWN TRANSACTION
[LF][ERROR] Command: LP/L(99)/SM478/14JAN
[LF][RESYNC] Triggering immediate resync to last successful SN command
[LF][ERROR] SM478 14JAN: LP/L(99)/SM478/14JAN: TECH_ERROR:UNKNOWN TRANSACTION
[LF][[SYNC] RETRYING] Cannot focus on command line
[LF][[INFO] INFO] Will try 50 times before pausing...
[LF] SM460 14JAN: LASTSOLD=2025-12-31 00:00:00, WEEKLY=12, TODAY=1, YDAY=8
[LF][[SYNC] RETRYING] Cannot focus on command line
[LF][[INFO] INFO] Will try 50 times before pausing...
[LF] SM424 14JAN: LASTSOLD=2025-12-31 00:00:00, WEEKLY=13, TODAY=1, YDAY=2
[LF] Results summary:
  2026-01-20: 7 flights
  2026-01-19: 4 flights
  2026-01-18: 5 flights
  2026-01-17: 3 flights
  2026-01-16: 6 flights
  2026-01-15: 6 flights
  2026-01-14: 4 flights

============================================================
[Worker_9222] ✓ COMPLETED: JED-CAI
  Results: 7 dates
  Errors: 0 dates
  Total Processed: 1 groups
============================================================


============================================================
[Worker_9222] Shutdown signal received
Exiting...
============================================================

============================================================
[Worker_9222] FINISHED
  Total Groups Processed: 1
============================================================

