
============================================================
     LF WORKER - PORT 9223
============================================================
Worker: Worker_9223
Status: READY
Waiting for tasks...
============================================================


============================================================
[Worker_9223] Processing: JED-ATZ
  Tier 0: Range 1, Chunk 1/3
  Dates: 7 days
  Date Range: 2026-01-20 to 2026-01-14
============================================================

2025-12-31 15:58:08 | INFO     | ======================================================================
2025-12-31 15:58:08 | INFO     | Load Factor Scraper Started - Route: JED-ATZ
2025-12-31 15:58:08 | INFO     | Log file: D:\CODERED\LAB\market_insights\outputs\run_generated_311225_at_15.57\logs\LF_JED-ATZ_20251231_155808.log
2025-12-31 15:58:08 | INFO     | Enhanced logging: Capturing both logging.info() and print()
2025-12-31 15:58:08 | INFO     | ======================================================================
[LF] Processing dates (override): ['20JAN', '19JAN', '18JAN', '17JAN', '16JAN', '15JAN', '14JAN']
[LF] Attaching to Chrome for Altea access
[LF][[OK] SUCCESS] Connected to Chrome on 127.0.0.1:9223 (after 1 attempts)
[LF][[OK] SUCCESS] Found Amadeus Altea window: Altéa Reservation Desktop
[LF][[INFO] INFO] URL: https://tc212.resdesktop.altea.amadeus.com/app_ard/apf/init/login?SITE=ESMPESMP&LANGUAGE=GB&MARKETS=ARDW_PROD_WBP&ACTION=clpLogin
[LF] Processing JED-ATZ for 20JAN
[LF][ERROR] Amadeus command error detected: UNKNOWN TRANSACTION
[LF][ERROR] Command: SN20JANJEDATZ/ASM
[LF][RESYNC] Triggering immediate resync to last successful SN command
============================================================
[LF][RESYNC] Command 'SN20JANJEDATZ/ASM' failed: TECH_ERROR:UNKNOWN TRANSACTION
[LF][RESYNC] Re-running entire day from SN command for JED-ATZ 20JAN
[LF][RESYNC] Attempt 1/50 (waiting 1.0s before retry...)
============================================================
[LF][RESYNC] Sending IG to clear session state...
[LF][RESYNC] Session cleared with IG
[LF] Processing JED-ATZ for 20JAN
[LF] 20JAN: found 2 direct flights
[LF] SM454 20JAN: BKG=136, GRP=100, CAP=175, LF%=77.7%, Brd-Off=JED-ATZ, Classes: P:95, E:5, I:28, O:7, S:1
[LF] SM456 20JAN: BKG=167, GRP=134, CAP=168, LF%=99.4%, Brd-Off=JED-ATZ, Classes: P:90, E:44, I:26, O:4, U:3
[LF] Getting WEEKLY/LASTSOLD data for 2 flights
[LF] SM454 20JAN: LASTSOLD=2025-12-31 00:00:00, WEEKLY=22, TODAY=4, YDAY=5
[LF] SM456 20JAN: LASTSOLD=2025-12-29 00:00:00, WEEKLY=19, TODAY=0, YDAY=0
[LF] Processing JED-ATZ for 19JAN
[LF] 19JAN: found 4 direct flights
[LF] SM492 19JAN: BKG=72, GRP=48, CAP=175, LF%=41.1%, Brd-Off=JED-ATZ, Classes: P:48, I:21, O:2, S:1
[LF] SM456 19JAN: BKG=21, GRP=0, CAP=175, LF%=12.0%, Brd-Off=JED-ATZ, Classes: I:17, O:4
[LF] SM422 19JAN: BKG=30, GRP=0, CAP=175, LF%=17.1%, Brd-Off=JED-ATZ, Classes: I:24, O:5, K:1
[LF] SM454 19JAN: BKG=121, GRP=91, CAP=175, LF%=69.1%, Brd-Off=JED-ATZ, Classes: E:91, I:17, O:10, U:2, S:1
[LF] Getting WEEKLY/LASTSOLD data for 4 flights
[LF] SM492 19JAN: LASTSOLD=2025-12-31 00:00:00, WEEKLY=11, TODAY=4, YDAY=1
[LF] SM456 19JAN: LASTSOLD=2025-12-29 00:00:00, WEEKLY=11, TODAY=0, YDAY=0
[LF] SM422 19JAN: LASTSOLD=2025-12-30 00:00:00, WEEKLY=14, TODAY=0, YDAY=2
[LF] SM454 19JAN: LASTSOLD=2025-12-30 00:00:00, WEEKLY=10, TODAY=0, YDAY=3
[LF] Processing JED-ATZ for 18JAN
[LF] 18JAN: found 2 direct flights
[LF] SM492 18JAN: BKG=133, GRP=93, CAP=175, LF%=76.0%, Brd-Off=JED-ATZ, Classes: P:93, I:17, O:17, U:1, X:5
[LF] SM456 18JAN: BKG=78, GRP=45, CAP=175, LF%=44.6%, Brd-Off=JED-ATZ, Classes: P:45, I:17, O:15, S:1
[LF] Getting WEEKLY/LASTSOLD data for 2 flights
[LF] SM492 18JAN: LASTSOLD=2025-12-31 00:00:00, WEEKLY=16, TODAY=4, YDAY=5
[LF] SM456 18JAN: LASTSOLD=2025-12-28 00:00:00, WEEKLY=15, TODAY=0, YDAY=0
[LF] Processing JED-ATZ for 17JAN
[LF] 17JAN: found 3 direct flights
[LF] SM492 17JAN: BKG=115, GRP=93, CAP=175, LF%=65.7%, Brd-Off=JED-ATZ, Classes: P:45, E:48, I:10, O:8, U:2, L:1, K:1
[LF] SM454 17JAN: BKG=53, GRP=45, CAP=175, LF%=30.3%, Brd-Off=JED-ATZ, Classes: P:45, I:4, U:4
[LF] SM456 17JAN: BKG=57, GRP=45, CAP=175, LF%=32.6%, Brd-Off=JED-ATZ, Classes: P:45, I:4, O:2, U:2, X:1, G:3
[LF] Getting WEEKLY/LASTSOLD data for 3 flights
[LF] SM492 17JAN: LASTSOLD=2025-12-31 00:00:00, WEEKLY=66, TODAY=51, YDAY=12
[LF] SM454 17JAN: LASTSOLD=2025-12-14 00:00:00, WEEKLY=0, TODAY=0, YDAY=0
[LF] SM456 17JAN: LASTSOLD=2025-12-30 00:00:00, WEEKLY=6, TODAY=0, YDAY=2
[LF] Processing JED-ATZ for 16JAN
[LF] 16JAN: found 1 direct flights
[LF] SM492 16JAN: BKG=61, GRP=45, CAP=175, LF%=34.9%, Brd-Off=JED-ATZ, Classes: P:45, I:4, O:2, U:3, X:5, L:2
[LF] Getting WEEKLY/LASTSOLD data for 1 flights
[LF] SM492 16JAN: LASTSOLD=2025-12-31 00:00:00, WEEKLY=7, TODAY=2, YDAY=3
[LF] Processing JED-ATZ for 15JAN
[LF] 15JAN: found 3 direct flights
[LF] SM422 15JAN: BKG=150, GRP=125, CAP=175, LF%=85.7%, Brd-Off=JED-ATZ, Classes: P:128, I:20, W:1, K:1
[LF] SM454 15JAN: BKG=143, GRP=129, CAP=175, LF%=81.7%, Brd-Off=JED-ATZ, Classes: P:129, I:4, O:2, U:3, S:2, V:2, K:1
[LF] SM456 15JAN: BKG=127, GRP=118, CAP=175, LF%=72.6%, Brd-Off=JED-ATZ, Classes: P:118, I:4, O:2, U:1, S:2
[LF] Getting WEEKLY/LASTSOLD data for 3 flights
[LF] SM422 15JAN: LASTSOLD=2025-12-31 00:00:00, WEEKLY=91, TODAY=4, YDAY=0
[LF] SM454 15JAN: LASTSOLD=2025-12-22 00:00:00, WEEKLY=0, TODAY=0, YDAY=0
[LF] SM456 15JAN: LASTSOLD=2025-12-14 00:00:00, WEEKLY=0, TODAY=0, YDAY=0
[LF] Processing JED-ATZ for 14JAN
[LF] 14JAN: found 2 direct flights
[LF] SM454 14JAN: BKG=179, GRP=172, CAP=175, LF%=102.3%, Brd-Off=JED-ATZ, Classes: P:136, E:36, I:4, O:2, U:1
[LF] SM492 14JAN: BKG=131, GRP=90, CAP=175, LF%=74.9%, Brd-Off=JED-ATZ, Classes: P:90, I:18, O:18, U:4, W:1
[LF] Getting WEEKLY/LASTSOLD data for 2 flights
[LF] SM454 14JAN: LASTSOLD=2025-12-28 00:00:00, WEEKLY=2, TODAY=0, YDAY=0
[LF] SM492 14JAN: WEEKLY=99 → LP/T MANDATORY
[DEBUG] SM492 14JAN: Match #1: HK 25DEC | Line: 001 *01HUSSEIN/MAHMOUD H          	8ICMEU W  HK 25DEC SWI1G
[DEBUG] SM492 14JAN: Match #2: HK 27DEC | Line: 002  01ABD ELHAFIZ/MOHAM          	9M447D U  HK 27DEC ISTSM07TP
[DEBUG] SM492 14JAN: Match #3: HK 27DEC | Line: 003  01ABDELNAEIM/AHMED           	9LL8JM U  HK 27DEC QCAS22124
[DEBUG] SM492 14JAN: Match #4: HK 27DEC | Line: 004  01ALI/KHALED YOUSRY          	8KV8QO U  HK 27DEC QCAS22124
[DEBUG] SM492 14JAN: Match #5: HK 28DEC | Line: 005  01MOHAMED/MAHMOUD R          	9X9F9T U  HK 28DEC RUHAA28WH
[DEBUG] SM492 14JAN: Match #6: HK 27DEC | Line: 006  01ABDELHAFEZ/SABRIN          	9JWX7A O  HK 27DEC JEDSM08AA
[DEBUG] SM492 14JAN: DUPLICATE #1: 001 HK 25DEC | Skipping
[DEBUG] SM492 14JAN: DUPLICATE #2: 002 HK 27DEC | Skipping
[DEBUG] SM492 14JAN: DUPLICATE #3: 003 HK 27DEC | Skipping
[DEBUG] SM492 14JAN: DUPLICATE #4: 004 HK 27DEC | Skipping
[DEBUG] SM492 14JAN: DUPLICATE #5: 005 HK 28DEC | Skipping
[DEBUG] SM492 14JAN: DUPLICATE #6: 006 HK 27DEC | Skipping
[DEBUG] SM492 14JAN: Match #7: HK 26DEC | Line: 007  01ABDELKADER/AHMED           	93GLOQ O  HK 26DEC TIFS2222K
[DEBUG] SM492 14JAN: Match #8: HK 26DEC | Line: 008  01ABDELLAH/ABDELGHA          	92AFXC O  HK 26DEC QCAS228WD
[DEBUG] SM492 14JAN: Match #9: HK 27DEC | Line: 009  01ABDELMEGID/SEOUDY          	9JNSAV O  HK 27DEC RUHAA28WH
[DEBUG] SM492 14JAN: Match #10: HK 26DEC | Line: 010  01ABDELMONEIM/HASSA          	937NGD O  HK 26DEC RUHAA28WH
[DEBUG] SM492 14JAN: Match #11: HK 27DEC | Line: 011  02ABOSTEIT/MAI M             	9AQWG2 O  HK 27DEC RUHAA28WH
[DEBUG] SM492 14JAN: Match #12: HK 27DEC | Line: 015  02AHMED/MAKKA K              	9AQWG2 O  HK 27DEC RUHAA28WH
[DEBUG] SM492 14JAN: Match #13: HK 26DEC | Line: 016  01AHMED/MAMDOUH MR           	9277CB O  HK 26DEC QCAS228WD
[DEBUG] SM492 14JAN: Match #14: HK 27DEC | Line: 017  01MAHMOUD/AMIN MR            	9FB3GB O  HK 27DEC TIFS22102
[DEBUG] SM492 14JAN: Match #15: HK 26DEC | Line: 018  01MAHMOUD/YEHYA MR           	8ZRO7Q O  HK 26DEC QCAS22124
[DEBUG] SM492 14JAN: Match #16: HK 27DEC | Line: 019  01MOHAAMED/HOSSAM            	9LINBQ O  HK 27DEC RUHS228YD
[DEBUG] SM492 14JAN: Match #17: HK 26DEC | Line: 021  01MOHAMMADEIN/MOHAM          	948JYN O  HK 26DEC RUHAA28WH
[DEBUG] SM492 14JAN: Match #18: HK 27DEC | Line: 022  01SAAD/ABDELRAHMAN           	9JPNJX O  HK 27DEC TIFS22102
[DEBUG] SM492 14JAN: Match #19: HK 27DEC | Line: 023  01ZEIDAN/MOHAMED FA          	9FHB9K O  HK 27DEC QCAS22124
[DEBUG] SM492 14JAN: Match #20: HK 25DEC | Line: 024  01ABDELNABY/EID AHM          	8N3KWO I  HK 25DEC RUHS228YD
[DEBUG] SM492 14JAN: Match #21: HK 25DEC | Line: 025  01ABDELNAEIM/HUSSEI          	8KBKQY I  HK 25DEC RUHS228YD
[DEBUG] SM492 14JAN: Match #22: HK 25DEC | Line: 026  01ABDELRAHMAN/AHMED          	8NCZ7N I  HK 25DEC RUHS228YD
[DEBUG] SM492 14JAN: Match #23: HK 25DEC | Line: 027  01AHMED/ABDELMAKSOU          	8I2364 I  HK 25DEC RUHAA28WH
[DEBUG] SM492 14JAN: Match #24: HK 26DEC | Line: 029  01BAKHIT/AHMED MERS          	8XPVHU I  HK 26DEC RUHS228YD
[DEBUG] SM492 14JAN: Match #25: HK 26DEC | Line: 031  01ELFOULLY/TAHA              	8YM49V I  HK 26DEC RUHS228YD
[DEBUG] SM492 14JAN: Match #26: HK 25DEC | Line: 032  01HEMID/MOUSTAFA MR          	8L2OEB I  HK 25DEC QCAS22124
[DEBUG] SM492 14JAN: Match #27: HK 25DEC | Line: 033  01HOFNY/ABDELFATAH           	8MP6JT I  HK 25DEC TIFS2222K
[DEBUG] SM492 14JAN: Match #28: HK 26DEC | Line: 034  01KHALIL/ELHASSAN A          	8R6IYO I  HK 26DEC JEDSM08AA
[DEBUG] SM492 14JAN: Match #29: HK 25DEC | Line: 035  01MAHMOUD/HATEM MOH          	8N59DX I  HK 25DEC RUHS228YD
[DEBUG] SM492 14JAN: Match #30: HK 25DEC | Line: 036  01MOHAMED/IBRAHIM K          	8JOU3O I  HK 25DEC ABTS22113
[DEBUG] SM492 14JAN: Match #31: HK 25DEC | Line: 037  02MOHAMED/MAHMOUD Y          	8N6X5M I  HK 25DEC RUHS2232V
[DEBUG] SM492 14JAN: Match #32: HK 25DEC | Line: 038  01MOHAMED/MARIAM MR          	8HWQYW I  HK 25DEC ISTSM07TP
[DEBUG] SM492 14JAN: Match #33: HK 25DEC | Line: 039  01MOHAMED/MOHAMED F          	8LRUSR I  HK 25DEC RUHAA28WH
[DEBUG] SM492 14JAN: Match #34: HK 25DEC | Line: 040  02MOHAMED/MOUSTAFA           	8N6X5M I  HK 25DEC RUHS2232V
[DEBUG] SM492 14JAN: Match #35: HK 26DEC | Line: 041  01MOHAMED ALI/ARAFA          	8ZXM9J I  HK 26DEC BRQCK28EK
[DEBUG] SM492 14JAN: Match #36: HK 29DEC | Line: 042N 01ABDELAAL/KHALAFSA          	9736BU P  HK 29DEC CAISM05IN
[DEBUG] SM492 14JAN: Match #37: HK 29DEC | Line: 043N 01ABDELBAKY/BATTA I          	9JIYRI P  HK 29DEC CAISM05IN
[DEBUG] SM492 14JAN: Match #38: HK 29DEC | Line: 044N 01ABDELBASET/ESSAM           	9JIYRI P  HK 29DEC CAISM05IN
[DEBUG] SM492 14JAN: Match #39: HK 29DEC | Line: 045N 01ABDELGALEIL/ASMAA          	9736BU P  HK 29DEC CAISM05IN
[DEBUG] SM492 14JAN: Match #40: HK 29DEC | Line: 046N 01ABDELGAWAD/MAIMOU          	9736BU P  HK 29DEC CAISM05IN
[DEBUG] SM492 14JAN: Match #41: HK 29DEC | Line: 047N 01ABDELGAWAD/SALAHA          	9736BU P  HK 29DEC CAISM05IN
[DEBUG] SM492 14JAN: Match #42: HK 29DEC | Line: 048N 01ABDELKADER/MONABA          	9736BU P  HK 29DEC CAISM05IN
[DEBUG] SM492 14JAN: Match #43: HK 29DEC | Line: 049N 01ABDELKADER/ZEINAB          	9JIYRI P  HK 29DEC CAISM05IN
[DEBUG] SM492 14JAN: Match #44: HK 29DEC | Line: 050N 01ABDELNASER/SAFIA           	9JIYRI P  HK 29DEC CAISM05IN
[DEBUG] SM492 14JAN: Match #45: HK 29DEC | Line: 051N 01ABDELRAHMAN/NAGWA          	9736BU P  HK 29DEC CAISM05IN
[DEBUG] SM492 14JAN: Match #46: HK 29DEC | Line: 052N 01ABDELRAZEK/ASMAAE          	9736BU P  HK 29DEC CAISM05IN
[DEBUG] SM492 14JAN: Match #47: HK 29DEC | Line: 053N 01ABOELLIL/AYDAMOHA          	9736BU P  HK 29DEC CAISM05IN
[DEBUG] SM492 14JAN: Match #48: HK 29DEC | Line: 054N 01ABOELQASEM/MOHAME          	9736BU P  HK 29DEC CAISM05IN
[DEBUG] SM492 14JAN: Match #49: HK 29DEC | Line: 055N 01ABOUELKASSEM/ESSM          	9736BU P  HK 29DEC CAISM05IN
[DEBUG] SM492 14JAN: Match #50: HK 29DEC | Line: 056N 01AFIFY/TAHANYSAFWA          	9736BU P  HK 29DEC CAISM05IN
[DEBUG] SM492 14JAN: Match #51: HK 29DEC | Line: 057N 01AHMED/AHMED MOKHT          	9JIYRI P  HK 29DEC CAISM05IN
[DEBUG] SM492 14JAN: Match #52: HK 29DEC | Line: 058N 01AHMED/EMAN MOKTHA          	9JIYRI P  HK 29DEC CAISM05IN
[DEBUG] SM492 14JAN: Match #53: HK 29DEC | Line: 059N 01AHMED/HANAN HASSA          	9JIYRI P  HK 29DEC CAISM05IN
[DEBUG] SM492 14JAN: Match #54: HK 29DEC | Line: 060N 01AHMED/SAYED MAHMO          	9JIYRI P  HK 29DEC CAISM05IN
[DEBUG] SM492 14JAN: Match #55: HK 29DEC | Line: 061N 01ALI/ABIRSALEM              	9736BU P  HK 29DEC CAISM05IN
[DEBUG] SM492 14JAN: Match #56: HK 29DEC | Line: 062N 01ALI/AHMED ABDELRA          	9JIYRI P  HK 29DEC CAISM05IN
[DEBUG] SM492 14JAN: Match #57: HK 29DEC | Line: 063N 01ALI/AMALALI                	9736BU P  HK 29DEC CAISM05IN
[DEBUG] SM492 14JAN: Match #58: HK 29DEC | Line: 064N 01ALI/MOEMENABDELHA          	9736BU P  HK 29DEC CAISM05IN
[DEBUG] SM492 14JAN: Match #59: HK 29DEC | Line: 065N 01ALI/MOHAMED SAYED          	9JIYRI P  HK 29DEC CAISM05IN
[DEBUG] SM492 14JAN: Match #60: HK 29DEC | Line: 066N 01ALI/SAYEDARASMI            	9736BU P  HK 29DEC CAISM05IN
[DEBUG] SM492 14JAN: Match #61: HK 29DEC | Line: 067N 01ALY/ASHRAF MOHAME          	9JIYRI P  HK 29DEC CAISM05IN
[DEBUG] SM492 14JAN: Match #62: HK 29DEC | Line: 068N 01ALY/ELSHAIMAA FAW          	9JIYRI P  HK 29DEC CAISM05IN
[DEBUG] SM492 14JAN: Match #63: HK 29DEC | Line: 069N 01ALY/EMAN ANTAR             	9JIYRI P  HK 29DEC CAISM05IN
[DEBUG] SM492 14JAN: Match #64: HK 29DEC | Line: 070N 01ALY/MANAR SAYED            	9JIYRI P  HK 29DEC CAISM05IN
[DEBUG] SM492 14JAN: Match #65: HK 29DEC | Line: 071N 01ALY/MSHAALLA ALY           	9JIYRI P  HK 29DEC CAISM05IN
[DEBUG] SM492 14JAN: Match #66: HK 29DEC | Line: 072N 01ALY/WALAA FAWZY            	9JIYRI P  HK 29DEC CAISM05IN
[DEBUG] SM492 14JAN: Match #67: HK 29DEC | Line: 073N 01AWAD/BADRIA SHAHA          	9JIYRI P  HK 29DEC CAISM05IN
[DEBUG] SM492 14JAN: Match #68: HK 29DEC | Line: 074N 01EDRIS/ABDULRAHMAN          	9736BU P  HK 29DEC CAISM05IN
[DEBUG] SM492 14JAN: Match #69: HK 29DEC | Line: 075N 01EDRIS/AHMEDSAEED           	9736BU P  HK 29DEC CAISM05IN
[DEBUG] SM492 14JAN: Match #70: HK 29DEC | Line: 076N 01FARAG/SOMAIAADHAM          	9736BU P  HK 29DEC CAISM05IN
[DEBUG] SM492 14JAN: Match #71: HK 29DEC | Line: 077N 01GAD/ENAIAT ZAKY            	9JIYRI P  HK 29DEC CAISM05IN
[DEBUG] SM492 14JAN: Match #72: HK 29DEC | Line: 078N 01GOMAA/BAKR ABOUZE          	9JIYRI P  HK 29DEC CAISM05IN
[DEBUG] SM492 14JAN: Match #73: HK 29DEC | Line: 079N 01HASSAN/DAWABA ISM          	9JIYRI P  HK 29DEC CAISM05IN
[DEBUG] SM492 14JAN: Match #74: HK 29DEC | Line: 080N 01HASSAN/NADIAABDEL          	9736BU P  HK 29DEC CAISM05IN
[DEBUG] SM492 14JAN: Match #75: HK 29DEC | Line: 081N 01HASSAN/ZEINABIBRA          	9736BU P  HK 29DEC CAISM05IN
[DEBUG] SM492 14JAN: Match #76: HK 29DEC | Line: 082N 01HASSANIEN/FATMASA          	9736BU P  HK 29DEC CAISM05IN
[DEBUG] SM492 14JAN: Match #77: HK 29DEC | Line: 083N 01HEMDAN/GAMILA MOH          	9JIYRI P  HK 29DEC CAISM05IN
[DEBUG] SM492 14JAN: Match #78: HK 29DEC | Line: 084N 01HUSSEIN/HOSNY HAS          	9JIYRI P  HK 29DEC CAISM05IN
[DEBUG] SM492 14JAN: Match #79: HK 29DEC | Line: 085N 01IBRAHIM/MEDHAT AL          	9JIYRI P  HK 29DEC CAISM05IN
[DEBUG] SM492 14JAN: Match #80: HK 29DEC | Line: 086N 01IBRAHIM/NEAMAKASE          	9736BU P  HK 29DEC CAISM05IN
[DEBUG] SM492 14JAN: Match #81: HK 29DEC | Line: 087N 01IBRAHIM/SANAA ABO          	9JIYRI P  HK 29DEC CAISM05IN
[DEBUG] SM492 14JAN: Match #82: HK 29DEC | Line: 088N 01IBRAHIM/ZAINAHOMA          	9736BU P  HK 29DEC CAISM05IN
[DEBUG] SM492 14JAN: Match #83: HK 29DEC | Line: 089N 01ISMAEIL/ASMHAN MO          	9JIYRI P  HK 29DEC CAISM05IN
[DEBUG] SM492 14JAN: Match #84: HK 29DEC | Line: 090N 01ISMAIL/EMANSAYED           	9736BU P  HK 29DEC CAISM05IN
[DEBUG] SM492 14JAN: Match #85: HK 29DEC | Line: 091N 01ISMAIL/MAMDOUHABD          	9736BU P  HK 29DEC CAISM05IN
[DEBUG] SM492 14JAN: Match #86: HK 29DEC | Line: 092N 01ISMAIL/SHAIMAAMAM          	9736BU P  HK 29DEC CAISM05IN
[DEBUG] SM492 14JAN: Match #87: HK 29DEC | Line: 093N 01ISMAIL/ZEINAB ADA          	9JIYRI P  HK 29DEC CAISM05IN
[DEBUG] SM492 14JAN: Match #88: HK 29DEC | Line: 094N 01KAWASHTY/ASMAA MO          	9JIYRI P  HK 29DEC CAISM05IN
[DEBUG] SM492 14JAN: Match #89: HK 29DEC | Line: 095N 01KAWASHTY/NAWAL MO          	9JIYRI P  HK 29DEC CAISM05IN
[DEBUG] SM492 14JAN: Match #90: HK 29DEC | Line: 096N 01KAWSHTY/SABAH MOH          	9JIYRI P  HK 29DEC CAISM05IN
[DEBUG] SM492 14JAN: Match #91: HK 29DEC | Line: 097N 01KHALIL/KHEDRAABDE          	9736BU P  HK 29DEC CAISM05IN
[DEBUG] SM492 14JAN: Match #92: HK 29DEC | Line: 098N 01MADI/WAELMOHAMED           	9736BU P  HK 29DEC CAISM05IN
[DEBUG] SM492 14JAN: Match #93: HK 29DEC | Line: 099N 01MAHMOUD/AHMED SAL          	9JIYRI P  HK 29DEC CAISM05IN
[DEBUG] SM492 14JAN: Match #94: HK 29DEC | Line: 100N 01MAHMOUD/FATMA MAH          	9JIYRI P  HK 29DEC CAISM05IN
[DEBUG] SM492 14JAN: Match #95: HK 29DEC | Line: 101N 01MAHMOUD/MANSOURA           	9JIYRI P  HK 29DEC CAISM05IN
[DEBUG] SM492 14JAN: Match #96: HK 29DEC | Line: 102N 01MANSOUR/MAHMOUDHA          	9736BU P  HK 29DEC CAISM05IN
[DEBUG] SM492 14JAN: Match #97: HK 29DEC | Line: 103N 01MANSOUR/ZEINABMAN          	9736BU P  HK 29DEC CAISM05IN
[DEBUG] SM492 14JAN: Match #98: HK 29DEC | Line: 104N 01MASOUD/MAHMOUD ZA          	9JIYRI P  HK 29DEC CAISM05IN
[DEBUG] SM492 14JAN: Match #99: HK 29DEC | Line: 105N 01MOHAMED/ASMAAHUSS          	9736BU P  HK 29DEC CAISM05IN
[DEBUG] SM492 14JAN: Match #100: HK 29DEC | Line: 106N 01MOHAMED/AYDAKHALL          	9736BU P  HK 29DEC CAISM05IN
[DEBUG] SM492 14JAN: Match #101: HK 29DEC | Line: 107N 01MOHAMED/FAYEZASAY          	9736BU P  HK 29DEC CAISM05IN
[DEBUG] SM492 14JAN: Match #102: HK 29DEC | Line: 108N 01MOHAMED/HEBA MOUS          	9JIYRI P  HK 29DEC CAISM05IN
[DEBUG] SM492 14JAN: Match #103: HK 29DEC | Line: 109N 01MOHAMED/SAKHIAFAR          	9736BU P  HK 29DEC CAISM05IN
[DEBUG] SM492 14JAN: Match #104: HK 29DEC | Line: 110N 01MOHAMED/SAMAHSAYE          	9736BU P  HK 29DEC CAISM05IN
[DEBUG] SM492 14JAN: Match #105: HK 29DEC | Line: 111N 01MOHAMED/SHAIMAA A          	9JIYRI P  HK 29DEC CAISM05IN
[DEBUG] SM492 14JAN: Match #106: HK 29DEC | Line: 112N 01MOHAMED/YASSERHUS          	9736BU P  HK 29DEC CAISM05IN
[DEBUG] SM492 14JAN: Match #107: HK 29DEC | Line: 113N 01MOUSSA/HOURIAMAHM          	9736BU P  HK 29DEC CAISM05IN
[DEBUG] SM492 14JAN: Match #108: HK 29DEC | Line: 114N 01MOUSSA/LABIBAMAHM          	9736BU P  HK 29DEC CAISM05IN
[DEBUG] SM492 14JAN: Match #109: HK 29DEC | Line: 115N 01MOUSSA/SALEMFATHI          	9736BU P  HK 29DEC CAISM05IN
[DEBUG] SM492 14JAN: Match #110: HK 29DEC | Line: 116N 01OMAR/MAHMOUD SABE          	9JIYRI P  HK 29DEC CAISM05IN
[DEBUG] SM492 14JAN: Match #111: HK 29DEC | Line: 117N 01OTHMAN/NEFISA TOS          	9JIYRI P  HK 29DEC CAISM05IN
[DEBUG] SM492 14JAN: Match #112: HK 29DEC | Line: 118N 01RABEH/ABLAAMOHAME          	9736BU P  HK 29DEC CAISM05IN
[DEBUG] SM492 14JAN: Match #113: HK 29DEC | Line: 119N 01RAGAB/ALY ABDELTA          	9JIYRI P  HK 29DEC CAISM05IN
[DEBUG] SM492 14JAN: Match #114: HK 29DEC | Line: 120N 01RAYES/NADYALI              	9736BU P  HK 29DEC CAISM05IN
[DEBUG] SM492 14JAN: Match #115: HK 29DEC | Line: 121N 01SAYED/BAYADA SAYE          	9JIYRI P  HK 29DEC CAISM05IN
[DEBUG] SM492 14JAN: Match #116: HK 29DEC | Line: 122N 01SAYED/HADIRGALAL           	9736BU P  HK 29DEC CAISM05IN
[DEBUG] SM492 14JAN: Match #117: HK 29DEC | Line: 123N 01SAYED/MAHMOUD MOH          	9JIYRI P  HK 29DEC CAISM05IN
[DEBUG] SM492 14JAN: Match #118: HK 29DEC | Line: 124N 01SAYED/SALEH MOSTA          	9JIYRI P  HK 29DEC CAISM05IN
[DEBUG] SM492 14JAN: Match #119: HK 29DEC | Line: 125N 01SHERIF/SALAH SAAD          	9JIYRI P  HK 29DEC CAISM05IN
[DEBUG] SM492 14JAN: Match #120: HK 29DEC | Line: 126N 01SOLIMAN/SAYEDAT A          	9JIYRI P  HK 29DEC CAISM05IN
[DEBUG] SM492 14JAN: Match #121: HK 29DEC | Line: 127N 01SOLIMAN/WAFAA ABD          	9JIYRI P  HK 29DEC CAISM05IN
[DEBUG] SM492 14JAN: DUPLICATE #7: 125N HK 29DEC | Skipping
[DEBUG] SM492 14JAN: DUPLICATE #8: 126N HK 29DEC | Skipping
[DEBUG] SM492 14JAN: DUPLICATE #9: 127N HK 29DEC | Skipping
[DEBUG] SM492 14JAN: Match #122: HK 29DEC | Line: 128N 01TOUNI/RAGHDAALAM           	9736BU P  HK 29DEC CAISM05IN
[DEBUG] SM492 14JAN: Match #123: HK 29DEC | Line: 129N 01YOUNES/ABDALLAMOR          	9736BU P  HK 29DEC CAISM05IN
[DEBUG] SM492 14JAN: Match #124: HK 29DEC | Line: 130N 01ZEIDAN/SAMIRASAYE          	9736BU P  HK 29DEC CAISM05IN
[DEBUG] SM492 14JAN: Match #125: HK 29DEC | Line: 131N 01ZOHDY/NOUR TAMER           	9JIYRI P  HK 29DEC CAISM05IN
[LF] SM492 14JAN: LP/T count complete. True WEEKLY: 125, TODAY: 0, YDAY: 0 | Removed 9 duplicates
[LF] SM492 14JAN: LP/T result: WEEKLY=125, TODAY=0, YDAY=0
[LF] SM492 14JAN: LASTSOLD=2025-12-29 00:00:00, WEEKLY=125, TODAY=0, YDAY=0
[LF] Results summary:
  2026-01-20: 2 flights
  2026-01-19: 4 flights
  2026-01-18: 2 flights
  2026-01-17: 3 flights
  2026-01-16: 1 flights
  2026-01-15: 3 flights
  2026-01-14: 2 flights

============================================================
[Worker_9223] ✓ COMPLETED: JED-ATZ
  Results: 7 dates
  Errors: 0 dates
  Total Processed: 1 groups
============================================================

[Worker_9223] Waiting for tasks...

============================================================
[Worker_9223] Shutdown signal received
Exiting...
============================================================

============================================================
[Worker_9223] FINISHED
  Total Groups Processed: 1
============================================================

