
============================================================
     LF WORKER - PORT 9233
============================================================
Worker: Worker_9233
Status: READY
Waiting for tasks...
============================================================


============================================================
[Worker_9233] Processing: TUU-CAI
  Tier 0: Range 2, Chunk 1/3
  Dates: 5 days
  Date Range: 2026-01-31 to 2026-01-27
============================================================

2026-01-03 05:22:44 | INFO     | ======================================================================
2026-01-03 05:22:44 | INFO     | Load Factor Scraper Started - Route: TUU-CAI
2026-01-03 05:22:44 | INFO     | Log file: D:\CODERED\LAB\market_insights\outputs\run_generated_030126_at_05.10\logs\LF_TUU-CAI_20260103_052244.log
2026-01-03 05:22:44 | INFO     | Enhanced logging: Capturing both logging.info() and print()
2026-01-03 05:22:44 | INFO     | ======================================================================
[LF] Processing dates (override): ['31JAN', '30JAN', '29JAN', '28JAN', '27JAN']
[LF] Attaching to Chrome for Altea access
[LF][[OK] SUCCESS] Connected to Chrome on 127.0.0.1:9233 (after 1 attempts)
[LF][[OK] SUCCESS] Found Amadeus Altea window: Altéa Reservation Desktop
[LF][[INFO] INFO] URL: https://tc212.resdesktop.altea.amadeus.com/app_ard/apf/init/login?SITE=ESMPESMP&LANGUAGE=GB&MARKETS=ARDW_PROD_WBP&ACTION=clpLogin
[LF] Processing TUU-CAI for 31JAN
[LF][ERROR] Amadeus command error detected: UNKNOWN TRANSACTION
[LF][ERROR] Command: SN31JANTUUCAI/ASM
[LF][RESYNC] Triggering immediate resync to last successful SN command
============================================================
[LF][RESYNC] Command 'SN31JANTUUCAI/ASM' failed: TECH_ERROR:UNKNOWN TRANSACTION
[LF][RESYNC] Re-running entire day from SN command for TUU-CAI 31JAN
[LF][RESYNC] Attempt 1/50 (waiting 1.0s before retry...)
============================================================
[LF][RESYNC] Sending IG to clear session state...
[LF][RESYNC] Session cleared with IG
[LF] Processing TUU-CAI for 31JAN
[LF] 31JAN: found 1 direct flights
[LF] SM326 31JAN: BKG=7, GRP=0, CAP=175, LF%=4.0%, Brd-Off=TUU-CAI, Classes: I:6, O:1
[LF] Getting WEEKLY/LASTSOLD data for 1 flights
[LF] SM326 31JAN: LASTSOLD=2026-01-02 00:00:00, WEEKLY=5, TODAY=0, YDAY=1
[LF] Processing TUU-CAI for 30JAN
[LF] No direct flights on 30JAN for TUU-CAI
[LF] Processing TUU-CAI for 29JAN
[LF] 29JAN: found 1 direct flights
[LF] SM326 29JAN: BKG=18, GRP=0, CAP=175, LF%=10.3%, Brd-Off=TUU-CAI, Classes: I:10, O:4, U:4
[LF] Getting WEEKLY/LASTSOLD data for 1 flights
[LF] SM326 29JAN: LASTSOLD=2026-01-01 00:00:00, WEEKLY=6, TODAY=0, YDAY=0
[LF] Processing TUU-CAI for 28JAN
[LF] 28JAN: found 1 direct flights
[LF] SM326 28JAN: BKG=5, GRP=0, CAP=175, LF%=2.9%, Brd-Off=TUU-CAI, Classes: I:3, O:2
[LF] Getting WEEKLY/LASTSOLD data for 1 flights
[LF] SM326 28JAN: LASTSOLD=2025-12-31 00:00:00, WEEKLY=3, TODAY=0, YDAY=0
[LF] Processing TUU-CAI for 27JAN
[LF] No direct flights on 27JAN for TUU-CAI
[LF] Results summary:
  2026-01-31: 1 flights
  2026-01-30: 0 flights
  2026-01-29: 1 flights
  2026-01-28: 1 flights
  2026-01-27: 0 flights

============================================================
[Worker_9233] ✓ COMPLETED: TUU-CAI
  Results: 5 dates
  Errors: 0 dates
  Total Processed: 1 groups
============================================================


============================================================
[Worker_9233] Processing: HBE-JED
  Tier 0: Range 2, Chunk 1/3
  Dates: 5 days
  Date Range: 2026-01-31 to 2026-01-27
============================================================

2026-01-03 05:23:13 | INFO     | ======================================================================
2026-01-03 05:23:13 | INFO     | Load Factor Scraper Started - Route: HBE-JED
2026-01-03 05:23:13 | INFO     | Log file: D:\CODERED\LAB\market_insights\outputs\run_generated_030126_at_05.10\logs\LF_HBE-JED_20260103_052313.log
2026-01-03 05:23:13 | INFO     | Enhanced logging: Capturing both logging.info() and print()
2026-01-03 05:23:13 | INFO     | ======================================================================
[LF] Processing dates (override): ['31JAN', '30JAN', '29JAN', '28JAN', '27JAN']
[LF] Attaching to Chrome for Altea access
2026-01-03 05:23:13 | INFO     | Starting LF search for route: HBE-JED
2026-01-03 05:23:13 | INFO     | [START] LF Search
[LF][[OK] SUCCESS] Connected to Chrome on 127.0.0.1:9233 (after 1 attempts)
2026-01-03 05:23:14 | INFO     | [HEALTH CHECK] [OK] Chrome connection is healthy
[LF][[OK] SUCCESS] Found Amadeus Altea window: Altéa Reservation Desktop
[LF][[INFO] INFO] URL: https://tc212.resdesktop.altea.amadeus.com/app_ard/apf/init/login?SITE=ESMPESMP&LANGUAGE=GB&MARKETS=ARDW_PROD_WBP&ACTION=clpLogin
2026-01-03 05:23:14 | INFO     | [DAY_START] Processing 31JAN
[LF] Processing HBE-JED for 31JAN
2026-01-03 05:23:14 | INFO     | [lf.day.start] Processing HBE-JED for 31JAN
[LF] 31JAN: found 2 direct flights
2026-01-03 05:23:15 | INFO     | [lf.day.flights_found] Found 2 flights on 31JAN
2026-01-03 05:23:17 | INFO     | [lf.flight.extracted] SM457 on 31JAN: BKG=105, LF=58.7%
[LF] SM457 31JAN: BKG=105, GRP=90, CAP=179, LF%=58.7%, Brd-Off=HBE-JED, Classes: P:90, X:10, T:5
2026-01-03 05:23:20 | INFO     | [lf.flight.extracted] SM451 on 31JAN: BKG=70, LF=39.1%
[LF] SM451 31JAN: BKG=70, GRP=45, CAP=179, LF%=39.1%, Brd-Off=HBE-JED, Classes: P:45, X:5, T:4, W:8, S:2, K:4, Q:2
[LF] Getting WEEKLY/LASTSOLD data for 2 flights
[LF] SM457 31JAN: LASTSOLD=2026-01-01 00:00:00, WEEKLY=5, TODAY=0, YDAY=0
[LF] SM451 31JAN: LASTSOLD=2026-01-01 00:00:00, WEEKLY=6, TODAY=0, YDAY=0
2026-01-03 05:23:25 | INFO     | [SUCCESS] Day 31JAN
2026-01-03 05:23:25 | INFO     | [DAY_START] Processing 30JAN
[LF] Processing HBE-JED for 30JAN
2026-01-03 05:23:25 | INFO     | [lf.day.start] Processing HBE-JED for 30JAN
[LF] 30JAN: found 1 direct flights
2026-01-03 05:23:26 | INFO     | [lf.day.flights_found] Found 1 flights on 30JAN
2026-01-03 05:23:28 | INFO     | [lf.flight.extracted] SM451 on 30JAN: BKG=100, LF=55.9%
[LF] SM451 30JAN: BKG=100, GRP=90, CAP=179, LF%=55.9%, Brd-Off=HBE-JED, Classes: P:90, W:5, S:2, K:3
[LF] Getting WEEKLY/LASTSOLD data for 1 flights
[LF] SM451 30JAN: LASTSOLD=2026-01-02 00:00:00, WEEKLY=5, TODAY=0, YDAY=1
2026-01-03 05:23:30 | INFO     | [SUCCESS] Day 30JAN
2026-01-03 05:23:30 | INFO     | [DAY_START] Processing 29JAN
[LF] Processing HBE-JED for 29JAN
2026-01-03 05:23:30 | INFO     | [lf.day.start] Processing HBE-JED for 29JAN
[LF] 29JAN: found 1 direct flights
2026-01-03 05:23:31 | INFO     | [lf.day.flights_found] Found 1 flights on 29JAN
2026-01-03 05:23:33 | INFO     | [lf.flight.extracted] SM451 on 29JAN: BKG=153, LF=85.5%
[LF] SM451 29JAN: BKG=153, GRP=135, CAP=179, LF%=85.5%, Brd-Off=HBE-JED, Classes: P:135, X:10, T:8
[LF] Getting WEEKLY/LASTSOLD data for 1 flights
[LF] SM451 29JAN: LASTSOLD=2026-01-02 00:00:00, WEEKLY=8, TODAY=0, YDAY=3
2026-01-03 05:23:36 | INFO     | [SUCCESS] Day 29JAN
2026-01-03 05:23:36 | INFO     | [DAY_START] Processing 28JAN
[LF] Processing HBE-JED for 28JAN
2026-01-03 05:23:36 | INFO     | [lf.day.start] Processing HBE-JED for 28JAN
[LF] 28JAN: found 3 direct flights
2026-01-03 05:23:37 | INFO     | [lf.day.flights_found] Found 3 flights on 28JAN
2026-01-03 05:23:39 | INFO     | [lf.flight.extracted] SM451 on 28JAN: BKG=158, LF=88.3%
[LF] SM451 28JAN: BKG=158, GRP=135, CAP=179, LF%=88.3%, Brd-Off=HBE-JED, Classes: P:135, X:8, T:8, W:4, S:3
2026-01-03 05:23:42 | INFO     | [lf.flight.extracted] SM457 on 28JAN: BKG=111, LF=62.0%
[LF] SM457 28JAN: BKG=111, GRP=90, CAP=179, LF%=62.0%, Brd-Off=HBE-JED, Classes: P:90, X:9, T:4, W:8
2026-01-03 05:23:45 | INFO     | [lf.flight.extracted] SM473 on 28JAN: BKG=180, LF=100.6%
[LF] SM473 28JAN: BKG=180, GRP=170, CAP=179, LF%=100.6%, Brd-Off=HBE-JED, Classes: P:170, X:10
[LF] Getting WEEKLY/LASTSOLD data for 3 flights
[LF] SM451 28JAN: LASTSOLD=2026-01-02 00:00:00, WEEKLY=13, TODAY=0, YDAY=2
[LF] SM457 28JAN: LASTSOLD=2026-01-01 00:00:00, WEEKLY=18, TODAY=0, YDAY=0
[LF] SM473 28JAN: LASTSOLD=2025-12-19 00:00:00, WEEKLY=0, TODAY=0, YDAY=0
2026-01-03 05:23:52 | INFO     | [SUCCESS] Day 28JAN
2026-01-03 05:23:52 | INFO     | [DAY_START] Processing 27JAN
[LF] Processing HBE-JED for 27JAN
2026-01-03 05:23:52 | INFO     | [lf.day.start] Processing HBE-JED for 27JAN
[LF] 27JAN: found 2 direct flights
2026-01-03 05:23:53 | INFO     | [lf.day.flights_found] Found 2 flights on 27JAN
2026-01-03 05:23:55 | INFO     | [lf.flight.extracted] SM479 on 27JAN: BKG=175, LF=99.4%
[LF] SM479 27JAN: BKG=175, GRP=175, CAP=176, LF%=99.4%, Brd-Off=HBE-JED, Classes: P:175
2026-01-03 05:23:58 | INFO     | [lf.flight.extracted] SM451 on 27JAN: BKG=179, LF=100.0%
[LF] SM451 27JAN: BKG=179, GRP=138, CAP=179, LF%=100.0%, Brd-Off=HBE-JED, Classes: P:138, X:10, T:9, W:15, S:5, K:2
[LF] Getting WEEKLY/LASTSOLD data for 2 flights
[LF] SM479 27JAN: LASTSOLD=2025-12-02 00:00:00, WEEKLY=0, TODAY=0, YDAY=0
[LF] SM451 27JAN: LASTSOLD=2025-12-31 00:00:00, WEEKLY=16, TODAY=0, YDAY=0
2026-01-03 05:24:04 | INFO     | [SUCCESS] Day 27JAN
[LF] Results summary:
  2026-01-31: 2 flights
  2026-01-30: 1 flights
  2026-01-29: 1 flights
  2026-01-28: 3 flights
  2026-01-27: 2 flights
2026-01-03 05:24:04 | INFO     | [SUCCESS] LF Search Complete

============================================================
[Worker_9233] ✓ COMPLETED: HBE-JED
  Results: 5 dates
  Errors: 0 dates
  Total Processed: 2 groups
============================================================

2026-01-03 05:24:06 | INFO     | [Worker_9233] Completed: HBE-JED - 5 results, 0 errors

============================================================
[Worker_9233] Processing: TUU-CAI
  Tier 0: Range 2, Chunk 2/3
  Dates: 4 days
  Date Range: 2026-01-26 to 2026-01-23
============================================================

2026-01-03 05:24:06 | INFO     | [Worker_9233] Processing: TUU-CAI
2026-01-03 05:24:06 | INFO     |   Tier 0: Range 2, Chunk 2/3 (4 days)
2026-01-03 05:24:06 | INFO     | ======================================================================
2026-01-03 05:24:06 | INFO     | Load Factor Scraper Started - Route: TUU-CAI
2026-01-03 05:24:06 | INFO     | Log file: D:\CODERED\LAB\market_insights\outputs\run_generated_030126_at_05.10\logs\LF_TUU-CAI_20260103_052406.log
2026-01-03 05:24:06 | INFO     | Enhanced logging: Capturing both logging.info() and print()
2026-01-03 05:24:06 | INFO     | ======================================================================
[LF] Processing dates (override): ['26JAN', '25JAN', '24JAN', '23JAN']
[LF] Attaching to Chrome for Altea access
2026-01-03 05:24:06 | INFO     | Starting LF search for route: TUU-CAI
2026-01-03 05:24:06 | INFO     | [START] LF Search
[LF][[OK] SUCCESS] Connected to Chrome on 127.0.0.1:9233 (after 1 attempts)
2026-01-03 05:24:07 | INFO     | [HEALTH CHECK] [OK] Chrome connection is healthy
[LF][[OK] SUCCESS] Found Amadeus Altea window: Altéa Reservation Desktop
[LF][[INFO] INFO] URL: https://tc212.resdesktop.altea.amadeus.com/app_ard/apf/init/login?SITE=ESMPESMP&LANGUAGE=GB&MARKETS=ARDW_PROD_WBP&ACTION=clpLogin
2026-01-03 05:24:07 | INFO     | [DAY_START] Processing 26JAN
[LF] Processing TUU-CAI for 26JAN
2026-01-03 05:24:07 | INFO     | [lf.day.start] Processing TUU-CAI for 26JAN
[LF] No direct flights on 26JAN for TUU-CAI
2026-01-03 05:24:08 | WARNING  | [lf.day.no_flights] No direct flights on 26JAN
2026-01-03 05:24:08 | INFO     | [SUCCESS] Day 26JAN
2026-01-03 05:24:08 | INFO     | [DAY_START] Processing 25JAN
[LF] Processing TUU-CAI for 25JAN
2026-01-03 05:24:08 | INFO     | [lf.day.start] Processing TUU-CAI for 25JAN
[LF] No direct flights on 25JAN for TUU-CAI
2026-01-03 05:24:09 | WARNING  | [lf.day.no_flights] No direct flights on 25JAN
2026-01-03 05:24:09 | INFO     | [SUCCESS] Day 25JAN
2026-01-03 05:24:09 | INFO     | [DAY_START] Processing 24JAN
[LF] Processing TUU-CAI for 24JAN
2026-01-03 05:24:09 | INFO     | [lf.day.start] Processing TUU-CAI for 24JAN
[LF] 24JAN: found 1 direct flights
2026-01-03 05:24:10 | INFO     | [lf.day.flights_found] Found 1 flights on 24JAN
2026-01-03 05:24:12 | INFO     | [lf.flight.extracted] SM326 on 24JAN: BKG=10, LF=5.7%
[LF] SM326 24JAN: BKG=10, GRP=0, CAP=175, LF%=5.7%, Brd-Off=TUU-CAI, Classes: I:10
[LF] Getting WEEKLY/LASTSOLD data for 1 flights
[LF] SM326 24JAN: LASTSOLD=2026-01-02 00:00:00, WEEKLY=8, TODAY=0, YDAY=4
2026-01-03 05:24:15 | INFO     | [SUCCESS] Day 24JAN
2026-01-03 05:24:15 | INFO     | [DAY_START] Processing 23JAN
[LF] Processing TUU-CAI for 23JAN
2026-01-03 05:24:15 | INFO     | [lf.day.start] Processing TUU-CAI for 23JAN
[LF] No direct flights on 23JAN for TUU-CAI
2026-01-03 05:24:16 | WARNING  | [lf.day.no_flights] No direct flights on 23JAN
2026-01-03 05:24:16 | INFO     | [SUCCESS] Day 23JAN
[LF] Results summary:
  2026-01-26: 0 flights
  2026-01-25: 0 flights
  2026-01-24: 1 flights
  2026-01-23: 0 flights
2026-01-03 05:24:16 | INFO     | [SUCCESS] LF Search Complete

============================================================
[Worker_9233] ✓ COMPLETED: TUU-CAI
  Results: 4 dates
  Errors: 0 dates
  Total Processed: 3 groups
============================================================

2026-01-03 05:24:18 | INFO     | [Worker_9233] Completed: TUU-CAI - 4 results, 0 errors

============================================================
[Worker_9233] Processing: HBE-MED
  Tier 0: Range 2, Chunk 2/3
  Dates: 4 days
  Date Range: 2026-01-26 to 2026-01-23
============================================================

2026-01-03 05:24:18 | INFO     | [Worker_9233] Processing: HBE-MED
2026-01-03 05:24:18 | INFO     |   Tier 0: Range 2, Chunk 2/3 (4 days)
2026-01-03 05:24:18 | INFO     | ======================================================================
2026-01-03 05:24:18 | INFO     | Load Factor Scraper Started - Route: HBE-MED
2026-01-03 05:24:18 | INFO     | Log file: D:\CODERED\LAB\market_insights\outputs\run_generated_030126_at_05.10\logs\LF_HBE-MED_20260103_052418.log
2026-01-03 05:24:18 | INFO     | Enhanced logging: Capturing both logging.info() and print()
2026-01-03 05:24:18 | INFO     | ======================================================================
[LF] Processing dates (override): ['26JAN', '25JAN', '24JAN', '23JAN']
[LF] Attaching to Chrome for Altea access
2026-01-03 05:24:18 | INFO     | Starting LF search for route: HBE-MED
2026-01-03 05:24:18 | INFO     | [START] LF Search
[LF][[OK] SUCCESS] Connected to Chrome on 127.0.0.1:9233 (after 1 attempts)
2026-01-03 05:24:19 | INFO     | [HEALTH CHECK] [OK] Chrome connection is healthy
[LF][[OK] SUCCESS] Found Amadeus Altea window: Altéa Reservation Desktop
[LF][[INFO] INFO] URL: https://tc212.resdesktop.altea.amadeus.com/app_ard/apf/init/login?SITE=ESMPESMP&LANGUAGE=GB&MARKETS=ARDW_PROD_WBP&ACTION=clpLogin
2026-01-03 05:24:19 | INFO     | [DAY_START] Processing 26JAN
[LF] Processing HBE-MED for 26JAN
2026-01-03 05:24:19 | INFO     | [lf.day.start] Processing HBE-MED for 26JAN
[LF] No direct flights on 26JAN for HBE-MED
2026-01-03 05:24:20 | WARNING  | [lf.day.no_flights] No direct flights on 26JAN
2026-01-03 05:24:20 | INFO     | [SUCCESS] Day 26JAN
2026-01-03 05:24:20 | INFO     | [DAY_START] Processing 25JAN
[LF] Processing HBE-MED for 25JAN
2026-01-03 05:24:20 | INFO     | [lf.day.start] Processing HBE-MED for 25JAN
[LF] 25JAN: found 1 direct flights
2026-01-03 05:24:21 | INFO     | [lf.day.flights_found] Found 1 flights on 25JAN
2026-01-03 05:24:23 | INFO     | [lf.flight.extracted] SM485 on 25JAN: BKG=180, LF=102.3%
[LF] SM485 25JAN: BKG=180, GRP=135, CAP=176, LF%=102.3%, Brd-Off=HBE-MED, Classes: P:135, X:9, T:3, W:6, S:9, G:9, L:1, K:8
[LF] Getting WEEKLY/LASTSOLD data for 1 flights
[LF] SM485 25JAN: LASTSOLD=2025-12-29 00:00:00, WEEKLY=3, TODAY=0, YDAY=0
2026-01-03 05:24:27 | INFO     | [SUCCESS] Day 25JAN
2026-01-03 05:24:27 | INFO     | [DAY_START] Processing 24JAN
[LF] Processing HBE-MED for 24JAN
2026-01-03 05:24:27 | INFO     | [lf.day.start] Processing HBE-MED for 24JAN
[LF] No direct flights on 24JAN for HBE-MED
2026-01-03 05:24:28 | WARNING  | [lf.day.no_flights] No direct flights on 24JAN
2026-01-03 05:24:28 | INFO     | [SUCCESS] Day 24JAN
2026-01-03 05:24:28 | INFO     | [DAY_START] Processing 23JAN
[LF] Processing HBE-MED for 23JAN
2026-01-03 05:24:28 | INFO     | [lf.day.start] Processing HBE-MED for 23JAN
[LF] No direct flights on 23JAN for HBE-MED
2026-01-03 05:24:29 | WARNING  | [lf.day.no_flights] No direct flights on 23JAN
2026-01-03 05:24:29 | INFO     | [SUCCESS] Day 23JAN
[LF] Results summary:
  2026-01-26: 0 flights
  2026-01-25: 1 flights
  2026-01-24: 0 flights
  2026-01-23: 0 flights
2026-01-03 05:24:29 | INFO     | [SUCCESS] LF Search Complete

============================================================
[Worker_9233] ✓ COMPLETED: HBE-MED
  Results: 4 dates
  Errors: 0 dates
  Total Processed: 4 groups
============================================================

2026-01-03 05:24:31 | INFO     | [Worker_9233] Completed: HBE-MED - 4 results, 0 errors

============================================================
[Worker_9233] Processing: HBE-JED
  Tier 0: Range 2, Chunk 2/3
  Dates: 4 days
  Date Range: 2026-01-26 to 2026-01-23
============================================================

2026-01-03 05:24:31 | INFO     | [Worker_9233] Processing: HBE-JED
2026-01-03 05:24:31 | INFO     |   Tier 0: Range 2, Chunk 2/3 (4 days)
2026-01-03 05:24:31 | INFO     | ======================================================================
2026-01-03 05:24:31 | INFO     | Load Factor Scraper Started - Route: HBE-JED
2026-01-03 05:24:31 | INFO     | Log file: D:\CODERED\LAB\market_insights\outputs\run_generated_030126_at_05.10\logs\LF_HBE-JED_20260103_052431.log
2026-01-03 05:24:31 | INFO     | Enhanced logging: Capturing both logging.info() and print()
2026-01-03 05:24:31 | INFO     | ======================================================================
[LF] Processing dates (override): ['26JAN', '25JAN', '24JAN', '23JAN']
[LF] Attaching to Chrome for Altea access
2026-01-03 05:24:31 | INFO     | Starting LF search for route: HBE-JED
2026-01-03 05:24:31 | INFO     | [START] LF Search
[LF][[OK] SUCCESS] Connected to Chrome on 127.0.0.1:9233 (after 1 attempts)
2026-01-03 05:24:33 | INFO     | [HEALTH CHECK] [OK] Chrome connection is healthy
[LF][[OK] SUCCESS] Found Amadeus Altea window: Altéa Reservation Desktop
[LF][[INFO] INFO] URL: https://tc212.resdesktop.altea.amadeus.com/app_ard/apf/init/login?SITE=ESMPESMP&LANGUAGE=GB&MARKETS=ARDW_PROD_WBP&ACTION=clpLogin
2026-01-03 05:24:33 | INFO     | [DAY_START] Processing 26JAN
[LF] Processing HBE-JED for 26JAN
2026-01-03 05:24:33 | INFO     | [lf.day.start] Processing HBE-JED for 26JAN
[LF] 26JAN: found 5 direct flights
2026-01-03 05:24:34 | INFO     | [lf.day.flights_found] Found 5 flights on 26JAN
2026-01-03 05:24:35 | INFO     | [lf.flight.extracted] SM953 on 26JAN: BKG=175, LF=99.4%
[LF] SM953 26JAN: BKG=175, GRP=175, CAP=176, LF%=99.4%, Brd-Off=HBE-JED, Classes: P:175
2026-01-03 05:24:38 | INFO     | [lf.flight.extracted] SM457 on 26JAN: BKG=178, LF=99.4%
[LF] SM457 26JAN: BKG=178, GRP=135, CAP=179, LF%=99.4%, Brd-Off=HBE-JED, Classes: P:135, X:10, T:9, W:18, S:6
2026-01-03 05:24:42 | INFO     | [lf.flight.extracted] SM451 on 26JAN: BKG=150, LF=85.2%
[LF] SM451 26JAN: BKG=150, GRP=135, CAP=176, LF%=85.2%, Brd-Off=HBE-JED, Classes: P:135, X:3, T:3, W:3, S:2, G:2, L:2
2026-01-03 05:24:45 | INFO     | [lf.flight.extracted] SM955 on 26JAN: BKG=175, LF=97.8%
[LF] SM955 26JAN: BKG=175, GRP=175, CAP=179, LF%=97.8%, Brd-Off=HBE-JED, Classes: P:175
2026-01-03 05:24:48 | INFO     | [lf.flight.extracted] SM957 on 26JAN: BKG=175, LF=97.8%
[LF] SM957 26JAN: BKG=175, GRP=175, CAP=179, LF%=97.8%, Brd-Off=HBE-JED, Classes: P:175
[LF] Getting WEEKLY/LASTSOLD data for 5 flights
[LF] SM953 26JAN: LASTSOLD=2025-11-26 00:00:00, WEEKLY=0, TODAY=0, YDAY=0
[LF] SM457 26JAN: LASTSOLD=2026-01-02 00:00:00, WEEKLY=34, TODAY=0, YDAY=1
[LF] SM451 26JAN: LASTSOLD=2026-01-02 00:00:00, WEEKLY=12, TODAY=0, YDAY=4
[LF] SM955 26JAN: LASTSOLD=2025-12-02 00:00:00, WEEKLY=0, TODAY=0, YDAY=0
[LF] SM957 26JAN: LASTSOLD=2025-11-26 00:00:00, WEEKLY=0, TODAY=0, YDAY=0
2026-01-03 05:24:57 | INFO     | [SUCCESS] Day 26JAN
2026-01-03 05:24:57 | INFO     | [DAY_START] Processing 25JAN
[LF] Processing HBE-JED for 25JAN
2026-01-03 05:24:57 | INFO     | [lf.day.start] Processing HBE-JED for 25JAN
[LF] 25JAN: found 2 direct flights
2026-01-03 05:24:58 | INFO     | [lf.day.flights_found] Found 2 flights on 25JAN
2026-01-03 05:25:00 | INFO     | [lf.flight.extracted] SM451 on 25JAN: BKG=177, LF=100.0%
[LF] SM451 25JAN: BKG=177, GRP=135, CAP=177, LF%=100.0%, Brd-Off=HBE-JED, Classes: P:135, X:10, T:9, W:18, S:5
2026-01-03 05:25:03 | INFO     | [lf.flight.extracted] SM457 on 25JAN: BKG=179, LF=100.0%
[LF] SM457 25JAN: BKG=179, GRP=160, CAP=179, LF%=100.0%, Brd-Off=HBE-JED, Classes: P:160, X:10, T:9
[LF] Getting WEEKLY/LASTSOLD data for 2 flights
[LF] SM451 25JAN: LASTSOLD=2026-01-01 00:00:00, WEEKLY=18, TODAY=0, YDAY=0
[LF] SM457 25JAN: LASTSOLD=2025-12-28 00:00:00, WEEKLY=1, TODAY=0, YDAY=0
2026-01-03 05:25:09 | INFO     | [SUCCESS] Day 25JAN
2026-01-03 05:25:09 | INFO     | [DAY_START] Processing 24JAN
[LF] Processing HBE-JED for 24JAN
2026-01-03 05:25:09 | INFO     | [lf.day.start] Processing HBE-JED for 24JAN
[LF] 24JAN: found 2 direct flights
2026-01-03 05:25:10 | INFO     | [lf.day.flights_found] Found 2 flights on 24JAN
2026-01-03 05:25:12 | INFO     | [lf.flight.extracted] SM457 on 24JAN: BKG=176, LF=100.0%
[LF] SM457 24JAN: BKG=176, GRP=135, CAP=176, LF%=100.0%, Brd-Off=HBE-JED, Classes: P:135, X:10, T:9, W:16, S:6
2026-01-03 05:25:15 | INFO     | [lf.flight.extracted] SM451 on 24JAN: BKG=176, LF=100.0%
[LF] SM451 24JAN: BKG=176, GRP=135, CAP=176, LF%=100.0%, Brd-Off=HBE-JED, Classes: P:135, X:10, T:5, W:5, S:5, G:5, L:5, V:6
[LF] Getting WEEKLY/LASTSOLD data for 2 flights
[LF] SM457 24JAN: LASTSOLD=2025-12-28 00:00:00, WEEKLY=1, TODAY=0, YDAY=0
[LF] SM451 24JAN: LASTSOLD=2025-12-31 00:00:00, WEEKLY=7, TODAY=0, YDAY=0
2026-01-03 05:25:23 | INFO     | [SUCCESS] Day 24JAN
2026-01-03 05:25:23 | INFO     | [DAY_START] Processing 23JAN
[LF] Processing HBE-JED for 23JAN
2026-01-03 05:25:23 | INFO     | [lf.day.start] Processing HBE-JED for 23JAN
[LF] 23JAN: found 1 direct flights
2026-01-03 05:25:24 | INFO     | [lf.day.flights_found] Found 1 flights on 23JAN
2026-01-03 05:25:26 | INFO     | [lf.flight.extracted] SM451 on 23JAN: BKG=174, LF=98.3%
[LF] SM451 23JAN: BKG=174, GRP=135, CAP=177, LF%=98.3%, Brd-Off=HBE-JED, Classes: P:135, W:10, S:5, G:3, L:3, V:3, K:3, Q:3, H:3, M:6
[LF] Getting WEEKLY/LASTSOLD data for 1 flights
[LF] SM451 23JAN: LASTSOLD=2026-01-01 00:00:00, WEEKLY=8, TODAY=0, YDAY=0
2026-01-03 05:25:29 | INFO     | [SUCCESS] Day 23JAN
[LF] Results summary:
  2026-01-26: 5 flights
  2026-01-25: 2 flights
  2026-01-24: 2 flights
  2026-01-23: 1 flights
2026-01-03 05:25:29 | INFO     | [SUCCESS] LF Search Complete

============================================================
[Worker_9233] ✓ COMPLETED: HBE-JED
  Results: 4 dates
  Errors: 0 dates
  Total Processed: 5 groups
============================================================

2026-01-03 05:25:32 | INFO     | [Worker_9233] Completed: HBE-JED - 4 results, 0 errors

============================================================
[Worker_9233] Processing: CAI-MED
  Tier 0: Range 2, Chunk 3/3
  Dates: 4 days
  Date Range: 2026-01-22 to 2026-01-19
============================================================

2026-01-03 05:25:32 | INFO     | [Worker_9233] Processing: CAI-MED
2026-01-03 05:25:32 | INFO     |   Tier 0: Range 2, Chunk 3/3 (4 days)
2026-01-03 05:25:32 | INFO     | ======================================================================
2026-01-03 05:25:32 | INFO     | Load Factor Scraper Started - Route: CAI-MED
2026-01-03 05:25:32 | INFO     | Log file: D:\CODERED\LAB\market_insights\outputs\run_generated_030126_at_05.10\logs\LF_CAI-MED_20260103_052532.log
2026-01-03 05:25:32 | INFO     | Enhanced logging: Capturing both logging.info() and print()
2026-01-03 05:25:32 | INFO     | ======================================================================
[LF] Processing dates (override): ['22JAN', '21JAN', '20JAN', '19JAN']
[LF] Attaching to Chrome for Altea access
2026-01-03 05:25:32 | INFO     | Starting LF search for route: CAI-MED
2026-01-03 05:25:32 | INFO     | [START] LF Search
[LF][[OK] SUCCESS] Connected to Chrome on 127.0.0.1:9233 (after 1 attempts)
2026-01-03 05:25:33 | INFO     | [HEALTH CHECK] [OK] Chrome connection is healthy
[LF][[OK] SUCCESS] Found Amadeus Altea window: Altéa Reservation Desktop
[LF][[INFO] INFO] URL: https://tc212.resdesktop.altea.amadeus.com/app_ard/apf/init/login?SITE=ESMPESMP&LANGUAGE=GB&MARKETS=ARDW_PROD_WBP&ACTION=clpLogin
2026-01-03 05:25:33 | INFO     | [DAY_START] Processing 22JAN
[LF] Processing CAI-MED for 22JAN
2026-01-03 05:25:33 | INFO     | [lf.day.start] Processing CAI-MED for 22JAN
[LF] 22JAN: found 1 direct flights
2026-01-03 05:25:34 | INFO     | [lf.day.flights_found] Found 1 flights on 22JAN
2026-01-03 05:25:36 | INFO     | [lf.flight.extracted] SM493 on 22JAN: BKG=174, LF=97.2%
[LF] SM493 22JAN: BKG=174, GRP=95, CAP=179, LF%=97.2%, Brd-Off=CAI-MED, Classes: N:5, P:95, T:12, W:15, S:15, G:14, L:15, V:2, K:1
[LF] Getting WEEKLY/LASTSOLD data for 1 flights
[LF] SM493 22JAN: LASTSOLD=2025-12-29 00:00:00, WEEKLY=21, TODAY=0, YDAY=0
2026-01-03 05:25:40 | INFO     | [SUCCESS] Day 22JAN
2026-01-03 05:25:40 | INFO     | [DAY_START] Processing 21JAN
[LF] Processing CAI-MED for 21JAN
2026-01-03 05:25:40 | INFO     | [lf.day.start] Processing CAI-MED for 21JAN
[LF] No direct flights on 21JAN for CAI-MED
2026-01-03 05:25:41 | WARNING  | [lf.day.no_flights] No direct flights on 21JAN
2026-01-03 05:25:42 | INFO     | [SUCCESS] Day 21JAN
2026-01-03 05:25:42 | INFO     | [DAY_START] Processing 20JAN
[LF] Processing CAI-MED for 20JAN
2026-01-03 05:25:42 | INFO     | [lf.day.start] Processing CAI-MED for 20JAN
[LF] 20JAN: found 1 direct flights
2026-01-03 05:25:43 | INFO     | [lf.day.flights_found] Found 1 flights on 20JAN
2026-01-03 05:25:44 | INFO     | [lf.flight.extracted] SM493 on 20JAN: BKG=177, LF=98.9%
[LF] SM493 20JAN: BKG=177, GRP=160, CAP=179, LF%=98.9%, Brd-Off=CAI-MED, Classes: P:135, E:25, T:10, W:7
[LF] Getting WEEKLY/LASTSOLD data for 1 flights
[LF] SM493 20JAN: LASTSOLD=2025-12-31 00:00:00, WEEKLY=5, TODAY=0, YDAY=0
2026-01-03 05:25:48 | INFO     | [SUCCESS] Day 20JAN
2026-01-03 05:25:48 | INFO     | [DAY_START] Processing 19JAN
[LF] Processing CAI-MED for 19JAN
2026-01-03 05:25:48 | INFO     | [lf.day.start] Processing CAI-MED for 19JAN
[LF] 19JAN: found 1 direct flights
2026-01-03 05:25:49 | INFO     | [lf.day.flights_found] Found 1 flights on 19JAN
2026-01-03 05:25:51 | INFO     | [lf.flight.extracted] SM495 on 19JAN: BKG=178, LF=99.4%
[LF] SM495 19JAN: BKG=178, GRP=175, CAP=179, LF%=99.4%, Brd-Off=CAI-MED, Classes: P:90, E:85, T:2, K:1
[LF] Getting WEEKLY/LASTSOLD data for 1 flights
[LF] SM495 19JAN: LASTSOLD=2025-12-31 00:00:00, WEEKLY=1, TODAY=0, YDAY=0
2026-01-03 05:25:54 | INFO     | [SUCCESS] Day 19JAN
[LF] Results summary:
  2026-01-22: 1 flights
  2026-01-21: 0 flights
  2026-01-20: 1 flights
  2026-01-19: 1 flights
2026-01-03 05:25:54 | INFO     | [SUCCESS] LF Search Complete

============================================================
[Worker_9233] ✓ COMPLETED: CAI-MED
  Results: 4 dates
  Errors: 0 dates
  Total Processed: 6 groups
============================================================

2026-01-03 05:25:56 | INFO     | [Worker_9233] Completed: CAI-MED - 4 results, 0 errors

============================================================
[Worker_9233] Processing: ATZ-JED
  Tier 0: Range 2, Chunk 3/3
  Dates: 4 days
  Date Range: 2026-01-22 to 2026-01-19
============================================================

2026-01-03 05:25:56 | INFO     | [Worker_9233] Processing: ATZ-JED
2026-01-03 05:25:56 | INFO     |   Tier 0: Range 2, Chunk 3/3 (4 days)
2026-01-03 05:25:56 | INFO     | ======================================================================
2026-01-03 05:25:56 | INFO     | Load Factor Scraper Started - Route: ATZ-JED
2026-01-03 05:25:56 | INFO     | Log file: D:\CODERED\LAB\market_insights\outputs\run_generated_030126_at_05.10\logs\LF_ATZ-JED_20260103_052556.log
2026-01-03 05:25:56 | INFO     | Enhanced logging: Capturing both logging.info() and print()
2026-01-03 05:25:56 | INFO     | ======================================================================
[LF] Processing dates (override): ['22JAN', '21JAN', '20JAN', '19JAN']
[LF] Attaching to Chrome for Altea access
2026-01-03 05:25:56 | INFO     | Starting LF search for route: ATZ-JED
2026-01-03 05:25:56 | INFO     | [START] LF Search
[LF][[OK] SUCCESS] Connected to Chrome on 127.0.0.1:9233 (after 1 attempts)
2026-01-03 05:25:57 | INFO     | [HEALTH CHECK] [OK] Chrome connection is healthy
[LF][[OK] SUCCESS] Found Amadeus Altea window: Altéa Reservation Desktop
[LF][[INFO] INFO] URL: https://tc212.resdesktop.altea.amadeus.com/app_ard/apf/init/login?SITE=ESMPESMP&LANGUAGE=GB&MARKETS=ARDW_PROD_WBP&ACTION=clpLogin
2026-01-03 05:25:57 | INFO     | [DAY_START] Processing 22JAN
[LF] Processing ATZ-JED for 22JAN
2026-01-03 05:25:57 | INFO     | [lf.day.start] Processing ATZ-JED for 22JAN
[LF] 22JAN: found 3 direct flights
2026-01-03 05:25:59 | INFO     | [lf.day.flights_found] Found 3 flights on 22JAN
2026-01-03 05:26:01 | INFO     | [lf.flight.extracted] SM963 on 22JAN: BKG=179, LF=100.0%
[LF] SM963 22JAN: BKG=179, GRP=135, CAP=179, LF%=100.0%, Brd-Off=ATZ-JED, Classes: P:135, X:10, T:10, W:10, S:13, K:1
2026-01-03 05:26:05 | INFO     | [lf.flight.extracted] SM453 on 22JAN: BKG=157, LF=87.7%
[LF] SM453 22JAN: BKG=157, GRP=135, CAP=179, LF%=87.7%, Brd-Off=ATZ-JED, Classes: P:135, X:4, T:4, W:7, S:7
2026-01-03 05:26:09 | INFO     | [lf.flight.extracted] SM455 on 22JAN: BKG=117, LF=65.4%
[LF] SM455 22JAN: BKG=117, GRP=90, CAP=179, LF%=65.4%, Brd-Off=ATZ-JED, Classes: P:90, X:4, T:4, W:7, S:12
[LF] Getting WEEKLY/LASTSOLD data for 3 flights
[LF] SM963 22JAN: LASTSOLD=2026-01-03 00:00:00, WEEKLY=22, TODAY=1, YDAY=1
[LF] SM453 22JAN: LASTSOLD=2026-01-01 00:00:00, WEEKLY=7, TODAY=0, YDAY=0
[LF] SM455 22JAN: LASTSOLD=2026-01-02 00:00:00, WEEKLY=13, TODAY=0, YDAY=2
2026-01-03 05:26:20 | INFO     | [SUCCESS] Day 22JAN
2026-01-03 05:26:20 | INFO     | [DAY_START] Processing 21JAN
[LF] Processing ATZ-JED for 21JAN
2026-01-03 05:26:20 | INFO     | [lf.day.start] Processing ATZ-JED for 21JAN
[LF] 21JAN: found 3 direct flights
2026-01-03 05:26:21 | INFO     | [lf.day.flights_found] Found 3 flights on 21JAN
2026-01-03 05:26:23 | INFO     | [lf.flight.extracted] SM453 on 21JAN: BKG=179, LF=100.0%
[LF] SM453 21JAN: BKG=179, GRP=168, CAP=179, LF%=100.0%, Brd-Off=ATZ-JED, Classes: P:135, E:33, X:6, T:3, S:2
2026-01-03 05:26:28 | INFO     | [lf.flight.extracted] SM491 on 21JAN: BKG=180, LF=100.6%
[LF] SM491 21JAN: BKG=180, GRP=180, CAP=179, LF%=100.6%, Brd-Off=ATZ-JED, Classes: P:180
2026-01-03 05:26:32 | INFO     | [lf.flight.extracted] SM421 on 21JAN: BKG=180, LF=100.6%
[LF] SM421 21JAN: BKG=180, GRP=180, CAP=179, LF%=100.6%, Brd-Off=ATZ-JED, Classes: P:180
[LF] Getting WEEKLY/LASTSOLD data for 3 flights
[LF] SM453 21JAN: LASTSOLD=2025-12-24 00:00:00, WEEKLY=0, TODAY=0, YDAY=0
[LF] SM491 21JAN: LASTSOLD=2025-12-24 00:00:00, WEEKLY=0, TODAY=0, YDAY=0
[LF] SM421 21JAN: LASTSOLD=2025-12-06 00:00:00, WEEKLY=0, TODAY=0, YDAY=0
2026-01-03 05:26:37 | INFO     | [SUCCESS] Day 21JAN
2026-01-03 05:26:37 | INFO     | [DAY_START] Processing 20JAN
[LF] Processing ATZ-JED for 20JAN
2026-01-03 05:26:37 | INFO     | [lf.day.start] Processing ATZ-JED for 20JAN
[LF] 20JAN: found 2 direct flights
2026-01-03 05:26:38 | INFO     | [lf.day.flights_found] Found 2 flights on 20JAN
2026-01-03 05:26:40 | INFO     | [lf.flight.extracted] SM453 on 20JAN: BKG=151, LF=84.4%
[LF] SM453 20JAN: BKG=151, GRP=135, CAP=179, LF%=84.4%, Brd-Off=ATZ-JED, Classes: P:135, X:3, T:5, W:8
2026-01-03 05:26:43 | INFO     | [lf.flight.extracted] SM455 on 20JAN: BKG=174, LF=97.2%
[LF] SM455 20JAN: BKG=174, GRP=135, CAP=179, LF%=97.2%, Brd-Off=ATZ-JED, Classes: P:135, I:14, X:4, T:4, W:8, S:9
[LF] Getting WEEKLY/LASTSOLD data for 2 flights
[LF] SM453 20JAN: LASTSOLD=2026-01-01 00:00:00, WEEKLY=9, TODAY=0, YDAY=0
[LF] SM455 20JAN: LASTSOLD=2026-01-01 00:00:00, WEEKLY=26, TODAY=0, YDAY=0
2026-01-03 05:26:48 | INFO     | [SUCCESS] Day 20JAN
2026-01-03 05:26:48 | INFO     | [DAY_START] Processing 19JAN
[LF] Processing ATZ-JED for 19JAN
2026-01-03 05:26:48 | INFO     | [lf.day.start] Processing ATZ-JED for 19JAN
[LF] 19JAN: found 4 direct flights
2026-01-03 05:26:49 | INFO     | [lf.day.flights_found] Found 4 flights on 19JAN
2026-01-03 05:26:51 | INFO     | [lf.flight.extracted] SM491 on 19JAN: BKG=125, LF=69.8%
[LF] SM491 19JAN: BKG=125, GRP=90, CAP=179, LF%=69.8%, Brd-Off=ATZ-JED, Classes: P:90, I:8, O:8, U:8, X:8, T:1, W:1, K:1
2026-01-03 05:26:55 | INFO     | [lf.flight.extracted] SM455 on 19JAN: BKG=146, LF=81.6%
[LF] SM455 19JAN: BKG=146, GRP=135, CAP=179, LF%=81.6%, Brd-Off=ATZ-JED, Classes: P:135, X:10, T:1
2026-01-03 05:26:58 | INFO     | [lf.flight.extracted] SM421 on 19JAN: BKG=140, LF=78.2%
[LF] SM421 19JAN: BKG=140, GRP=90, CAP=179, LF%=78.2%, Brd-Off=ATZ-JED, Classes: P:90, U:18, X:17, T:2, W:8, K:5
2026-01-03 05:27:02 | INFO     | [lf.flight.extracted] SM453 on 19JAN: BKG=180, LF=100.6%
[LF] SM453 19JAN: BKG=180, GRP=175, CAP=179, LF%=100.6%, Brd-Off=ATZ-JED, Classes: P:175, X:4, T:1
[LF] Getting WEEKLY/LASTSOLD data for 4 flights
[LF] SM491 19JAN: LASTSOLD=2026-01-02 00:00:00, WEEKLY=31, TODAY=0, YDAY=1
[LF] SM455 19JAN: LASTSOLD=2026-01-02 00:00:00, WEEKLY=8, TODAY=0, YDAY=1
[LF] SM421 19JAN: LASTSOLD=2026-01-02 00:00:00, WEEKLY=41, TODAY=0, YDAY=13
[LF] SM453 19JAN: LASTSOLD=2025-12-21 00:00:00, WEEKLY=0, TODAY=0, YDAY=0
2026-01-03 05:27:11 | INFO     | [SUCCESS] Day 19JAN
[LF] Results summary:
  2026-01-22: 3 flights
  2026-01-21: 3 flights
  2026-01-20: 2 flights
  2026-01-19: 4 flights
2026-01-03 05:27:11 | INFO     | [SUCCESS] LF Search Complete

============================================================
[Worker_9233] ✓ COMPLETED: ATZ-JED
  Results: 4 dates
  Errors: 0 dates
  Total Processed: 7 groups
============================================================

2026-01-03 05:27:13 | INFO     | [Worker_9233] Completed: ATZ-JED - 4 results, 0 errors

============================================================
[Worker_9233] Processing: TUU-ATZ
  Tier 0: Range 1, Chunk 1/3
  Dates: 6 days
  Date Range: 2026-01-18 to 2026-01-13
============================================================

2026-01-03 05:27:13 | INFO     | [Worker_9233] Processing: TUU-ATZ
2026-01-03 05:27:13 | INFO     |   Tier 0: Range 1, Chunk 1/3 (6 days)
2026-01-03 05:27:13 | INFO     | ======================================================================
2026-01-03 05:27:13 | INFO     | Load Factor Scraper Started - Route: TUU-ATZ
2026-01-03 05:27:13 | INFO     | Log file: D:\CODERED\LAB\market_insights\outputs\run_generated_030126_at_05.10\logs\LF_TUU-ATZ_20260103_052713.log
2026-01-03 05:27:13 | INFO     | Enhanced logging: Capturing both logging.info() and print()
2026-01-03 05:27:13 | INFO     | ======================================================================
[LF] Processing dates (override): ['18JAN', '17JAN', '16JAN', '15JAN', '14JAN', '13JAN']
[LF] Attaching to Chrome for Altea access
2026-01-03 05:27:13 | INFO     | Starting LF search for route: TUU-ATZ
2026-01-03 05:27:13 | INFO     | [START] LF Search
[LF][[OK] SUCCESS] Connected to Chrome on 127.0.0.1:9233 (after 1 attempts)
2026-01-03 05:27:14 | INFO     | [HEALTH CHECK] [OK] Chrome connection is healthy
[LF][[OK] SUCCESS] Found Amadeus Altea window: Altéa Reservation Desktop
[LF][[INFO] INFO] URL: https://tc212.resdesktop.altea.amadeus.com/app_ard/apf/init/login?SITE=ESMPESMP&LANGUAGE=GB&MARKETS=ARDW_PROD_WBP&ACTION=clpLogin
2026-01-03 05:27:14 | INFO     | [DAY_START] Processing 18JAN
[LF] Processing TUU-ATZ for 18JAN
2026-01-03 05:27:14 | INFO     | [lf.day.start] Processing TUU-ATZ for 18JAN
[LF] No direct flights on 18JAN for TUU-ATZ
2026-01-03 05:27:16 | WARNING  | [lf.day.no_flights] No direct flights on 18JAN
2026-01-03 05:27:16 | INFO     | [SUCCESS] Day 18JAN
2026-01-03 05:27:16 | INFO     | [DAY_START] Processing 17JAN
[LF] Processing TUU-ATZ for 17JAN
2026-01-03 05:27:16 | INFO     | [lf.day.start] Processing TUU-ATZ for 17JAN
[LF] No direct flights on 17JAN for TUU-ATZ
2026-01-03 05:27:17 | WARNING  | [lf.day.no_flights] No direct flights on 17JAN
2026-01-03 05:27:17 | INFO     | [SUCCESS] Day 17JAN
2026-01-03 05:27:17 | INFO     | [DAY_START] Processing 16JAN
[LF] Processing TUU-ATZ for 16JAN
2026-01-03 05:27:17 | INFO     | [lf.day.start] Processing TUU-ATZ for 16JAN
[LF] 16JAN: found 1 direct flights
2026-01-03 05:27:18 | INFO     | [lf.day.flights_found] Found 1 flights on 16JAN
2026-01-03 05:27:20 | INFO     | [lf.flight.extracted] SM328 on 16JAN: BKG=46, LF=26.3%
[LF] SM328 16JAN: BKG=46, GRP=0, CAP=175, LF%=26.3%, Brd-Off=TUU-ATZ, Classes: I:20, O:20, U:6
[LF] Getting WEEKLY/LASTSOLD data for 1 flights
[LF] SM328 16JAN: LASTSOLD=2026-01-02 00:00:00, WEEKLY=26, TODAY=0, YDAY=8
2026-01-03 05:27:24 | INFO     | [SUCCESS] Day 16JAN
2026-01-03 05:27:24 | INFO     | [DAY_START] Processing 15JAN
[LF] Processing TUU-ATZ for 15JAN
2026-01-03 05:27:24 | INFO     | [lf.day.start] Processing TUU-ATZ for 15JAN
[LF] No direct flights on 15JAN for TUU-ATZ
2026-01-03 05:27:25 | WARNING  | [lf.day.no_flights] No direct flights on 15JAN
2026-01-03 05:27:25 | INFO     | [SUCCESS] Day 15JAN
2026-01-03 05:27:25 | INFO     | [DAY_START] Processing 14JAN
[LF] Processing TUU-ATZ for 14JAN
2026-01-03 05:27:25 | INFO     | [lf.day.start] Processing TUU-ATZ for 14JAN
[LF] No direct flights on 14JAN for TUU-ATZ
2026-01-03 05:27:26 | WARNING  | [lf.day.no_flights] No direct flights on 14JAN
2026-01-03 05:27:26 | INFO     | [SUCCESS] Day 14JAN
2026-01-03 05:27:26 | INFO     | [DAY_START] Processing 13JAN
[LF] Processing TUU-ATZ for 13JAN
2026-01-03 05:27:26 | INFO     | [lf.day.start] Processing TUU-ATZ for 13JAN
[LF] No direct flights on 13JAN for TUU-ATZ
2026-01-03 05:27:27 | WARNING  | [lf.day.no_flights] No direct flights on 13JAN
2026-01-03 05:27:27 | INFO     | [SUCCESS] Day 13JAN
[LF] Results summary:
  2026-01-18: 0 flights
  2026-01-17: 0 flights
  2026-01-16: 1 flights
  2026-01-15: 0 flights
  2026-01-14: 0 flights
  2026-01-13: 0 flights
2026-01-03 05:27:27 | INFO     | [SUCCESS] LF Search Complete

============================================================
[Worker_9233] ✓ COMPLETED: TUU-ATZ
  Results: 6 dates
  Errors: 0 dates
  Total Processed: 8 groups
============================================================

2026-01-03 05:27:29 | INFO     | [Worker_9233] Completed: TUU-ATZ - 6 results, 0 errors

============================================================
[Worker_9233] Processing: CAI-JED
  Tier 0: Range 1, Chunk 1/3
  Dates: 6 days
  Date Range: 2026-01-18 to 2026-01-13
============================================================

2026-01-03 05:27:29 | INFO     | [Worker_9233] Processing: CAI-JED
2026-01-03 05:27:29 | INFO     |   Tier 0: Range 1, Chunk 1/3 (6 days)
2026-01-03 05:27:29 | INFO     | ======================================================================
2026-01-03 05:27:29 | INFO     | Load Factor Scraper Started - Route: CAI-JED
2026-01-03 05:27:29 | INFO     | Log file: D:\CODERED\LAB\market_insights\outputs\run_generated_030126_at_05.10\logs\LF_CAI-JED_20260103_052729.log
2026-01-03 05:27:29 | INFO     | Enhanced logging: Capturing both logging.info() and print()
2026-01-03 05:27:29 | INFO     | ======================================================================
[LF] Processing dates (override): ['18JAN', '17JAN', '16JAN', '15JAN', '14JAN', '13JAN']
[LF] Attaching to Chrome for Altea access
2026-01-03 05:27:29 | INFO     | Starting LF search for route: CAI-JED
2026-01-03 05:27:29 | INFO     | [START] LF Search
[LF][[OK] SUCCESS] Connected to Chrome on 127.0.0.1:9233 (after 1 attempts)
2026-01-03 05:27:30 | INFO     | [HEALTH CHECK] [OK] Chrome connection is healthy
[LF][[OK] SUCCESS] Found Amadeus Altea window: Altéa Reservation Desktop
[LF][[INFO] INFO] URL: https://tc212.resdesktop.altea.amadeus.com/app_ard/apf/init/login?SITE=ESMPESMP&LANGUAGE=GB&MARKETS=ARDW_PROD_WBP&ACTION=clpLogin
2026-01-03 05:27:30 | INFO     | [DAY_START] Processing 18JAN
[LF] Processing CAI-JED for 18JAN
2026-01-03 05:27:30 | INFO     | [lf.day.start] Processing CAI-JED for 18JAN
[LF] 18JAN: found 5 direct flights
2026-01-03 05:27:31 | INFO     | [lf.day.flights_found] Found 5 flights on 18JAN
2026-01-03 05:27:33 | INFO     | [lf.flight.extracted] SM475 on 18JAN: BKG=181, LF=101.1%
[LF] SM475 18JAN: BKG=181, GRP=137, CAP=179, LF%=101.1%, Brd-Off=CAI-JED, Classes: P:137, U:8, X:13, T:13, W:7, S:3
2026-01-03 05:27:36 | INFO     | [lf.flight.extracted] SM431 on 18JAN: BKG=179, LF=100.0%
[LF] SM431 18JAN: BKG=179, GRP=90, CAP=179, LF%=100.0%, Brd-Off=CAI-JED, Classes: P:90, I:9, O:9, U:8, X:43, T:13, W:6, S:1
2026-01-03 05:27:40 | INFO     | [lf.flight.extracted] SM459 on 18JAN: BKG=179, LF=100.0%
[LF] SM459 18JAN: BKG=179, GRP=139, CAP=179, LF%=100.0%, Brd-Off=CAI-JED, Classes: P:139, U:6, X:21, T:6, W:7
2026-01-03 05:27:43 | INFO     | [lf.flight.extracted] SM477 on 18JAN: BKG=179, LF=100.0%
[LF] SM477 18JAN: BKG=179, GRP=135, CAP=179, LF%=100.0%, Brd-Off=CAI-JED, Classes: P:135, U:8, X:17, T:14, W:5
2026-01-03 05:27:46 | INFO     | [lf.flight.extracted] SM479 on 18JAN: BKG=179, LF=100.0%
[LF] SM479 18JAN: BKG=179, GRP=90, CAP=179, LF%=100.0%, Brd-Off=CAI-JED, Classes: P:90, U:6, X:39, T:30, W:14
[LF] Getting WEEKLY/LASTSOLD data for 5 flights
[LF] SM475 18JAN: LASTSOLD=2026-01-01 00:00:00, WEEKLY=10, TODAY=0, YDAY=0
[LF] SM431 18JAN: LASTSOLD=2026-01-02 00:00:00, WEEKLY=62, TODAY=0, YDAY=3
[LF] SM459 18JAN: LASTSOLD=2025-12-30 00:00:00, WEEKLY=18, TODAY=0, YDAY=0
2026-01-03 05:27:59 | ERROR    | Atomic write failed for D:\CODERED\LAB\market_insights\outputs\run_generated_030126_at_05.10\checkpoints\flight_booking_data.json: [WinError 5] Access is denied: 'D:\\CODERED\\LAB\\market_insights\\outputs\\run_generated_030126_at_05.10\\checkpoints\\flight_booking_data.tmp_436b68f4' -> 'D:\\CODERED\\LAB\\market_insights\\outputs\\run_generated_030126_at_05.10\\checkpoints\\flight_booking_data.json'
[LF] SM477 18JAN: LASTSOLD=2025-12-29 00:00:00, WEEKLY=24, TODAY=0, YDAY=0
[LF] SM479 18JAN: LASTSOLD=2025-12-31 00:00:00, WEEKLY=35, TODAY=0, YDAY=0
2026-01-03 05:28:06 | INFO     | [SUCCESS] Day 18JAN
2026-01-03 05:28:06 | INFO     | [DAY_START] Processing 17JAN
[LF] Processing CAI-JED for 17JAN
2026-01-03 05:28:06 | INFO     | [lf.day.start] Processing CAI-JED for 17JAN
[LF] 17JAN: found 4 direct flights
2026-01-03 05:28:07 | INFO     | [lf.day.flights_found] Found 4 flights on 17JAN
2026-01-03 05:28:09 | INFO     | [lf.flight.extracted] SM449 on 17JAN: BKG=180, LF=100.6%
[LF] SM449 17JAN: BKG=180, GRP=128, CAP=179, LF%=100.6%, Brd-Off=CAI-JED, Classes: P:45, E:83, U:10, X:4, T:14, W:16, S:8
2026-01-03 05:28:12 | INFO     | [lf.flight.extracted] SM475 on 17JAN: BKG=179, LF=100.0%
[LF] SM475 17JAN: BKG=179, GRP=135, CAP=179, LF%=100.0%, Brd-Off=CAI-JED, Classes: P:135, U:9, X:3, T:13, W:19
2026-01-03 05:28:15 | INFO     | [lf.flight.extracted] SM477 on 17JAN: BKG=179, LF=100.0%
[LF] SM477 17JAN: BKG=179, GRP=90, CAP=179, LF%=100.0%, Brd-Off=CAI-JED, Classes: P:90, U:10, X:3, T:15, W:24, S:14, G:12, L:10, V:1
[LPC] SM477 17JAN: Found 1 outbound flights with connecting passengers
2026-01-03 05:28:19 | INFO     | [lf.flight.extracted] SM423 on 17JAN: BKG=179, LF=100.0%
[LF] SM423 17JAN: BKG=179, GRP=45, CAP=179, LF%=100.0%, Brd-Off=CAI-JED, Classes: P:45, U:11, X:2, T:24, W:24, S:34, G:13, L:12, V:13, K:1
[LF] Getting WEEKLY/LASTSOLD data for 4 flights
[LF] SM449 17JAN: LASTSOLD=2025-12-21 00:00:00, WEEKLY=0, TODAY=0, YDAY=0
[LF] SM475 17JAN: LASTSOLD=2025-12-24 00:00:00, WEEKLY=0, TODAY=0, YDAY=0
[LF] SM477 17JAN: LASTSOLD=2025-12-31 00:00:00, WEEKLY=2, TODAY=0, YDAY=0
[LF] SM423 17JAN: LASTSOLD=2026-01-02 00:00:00, WEEKLY=20, TODAY=0, YDAY=1
2026-01-03 05:28:36 | INFO     | [SUCCESS] Day 17JAN
2026-01-03 05:28:36 | INFO     | [DAY_START] Processing 16JAN
[LF] Processing CAI-JED for 16JAN
2026-01-03 05:28:36 | INFO     | [lf.day.start] Processing CAI-JED for 16JAN
[LF] 16JAN: found 5 direct flights
2026-01-03 05:28:37 | INFO     | [lf.day.flights_found] Found 5 flights on 16JAN
2026-01-03 05:28:39 | INFO     | [lf.flight.extracted] SM475 on 16JAN: BKG=179, LF=100.0%
[LF] SM475 16JAN: BKG=179, GRP=90, CAP=179, LF%=100.0%, Brd-Off=CAI-JED, Classes: P:90, U:12, X:6, T:13, W:46, S:12
2026-01-03 05:28:42 | INFO     | [lf.flight.extracted] SM477 on 16JAN: BKG=177, LF=98.9%
[LF] SM477 16JAN: BKG=177, GRP=90, CAP=179, LF%=98.9%, Brd-Off=CAI-JED, Classes: P:90, U:8, X:5, T:6, W:46, S:17, G:5
2026-01-03 05:28:45 | INFO     | [lf.flight.extracted] SM479 on 16JAN: BKG=152, LF=84.9%
[LF] SM479 16JAN: BKG=152, GRP=45, CAP=179, LF%=84.9%, Brd-Off=CAI-JED, Classes: E:45, U:9, X:4, T:28, W:45, S:15, G:6
2026-01-03 05:28:49 | INFO     | [lf.flight.extracted] SM471 on 16JAN: BKG=123, LF=68.7%
[LF] SM471 16JAN: BKG=123, GRP=0, CAP=179, LF%=68.7%, Brd-Off=CAI-JED, Classes: U:10, X:3, T:13, W:36, S:44, G:11, L:6
2026-01-03 05:28:52 | INFO     | [lf.flight.extracted] SM459 on 16JAN: BKG=157, LF=87.7%
[LF] SM459 16JAN: BKG=157, GRP=0, CAP=179, LF%=87.7%, Brd-Off=CAI-JED, Classes: U:10, X:3, T:14, W:48, S:38, G:21, L:13, V:8, K:2
[LF] Getting WEEKLY/LASTSOLD data for 5 flights
[LF] SM475 16JAN: LASTSOLD=2026-01-01 00:00:00, WEEKLY=39, TODAY=0, YDAY=0
[LF] SM477 16JAN: LASTSOLD=2026-01-02 00:00:00, WEEKLY=46, TODAY=0, YDAY=5
[LF] SM479 16JAN: LASTSOLD=2026-01-02 00:00:00, WEEKLY=49, TODAY=0, YDAY=6
[LF] SM471 16JAN: LASTSOLD=2026-01-02 00:00:00, WEEKLY=45, TODAY=0, YDAY=5
[LF] SM459 16JAN: LASTSOLD=2026-01-01 00:00:00, WEEKLY=46, TODAY=0, YDAY=0
2026-01-03 05:29:16 | INFO     | [SUCCESS] Day 16JAN
2026-01-03 05:29:16 | INFO     | [DAY_START] Processing 15JAN
[LF] Processing CAI-JED for 15JAN
2026-01-03 05:29:16 | INFO     | [lf.day.start] Processing CAI-JED for 15JAN
[LF] 15JAN: found 6 direct flights
2026-01-03 05:29:18 | INFO     | [lf.day.flights_found] Found 6 flights on 15JAN
2026-01-03 05:29:20 | INFO     | [lf.flight.extracted] SM449 on 15JAN: BKG=147, LF=82.1%
[LF] SM449 15JAN: BKG=147, GRP=45, CAP=179, LF%=82.1%, Brd-Off=CAI-JED, Classes: P:45, I:5, O:5, U:21, X:36, T:9, W:19, S:7
2026-01-03 05:29:23 | INFO     | [lf.flight.extracted] SM475 on 15JAN: BKG=179, LF=100.0%
[LF] SM475 15JAN: BKG=179, GRP=139, CAP=179, LF%=100.0%, Brd-Off=CAI-JED, Classes: P:139, U:18, X:17, S:5
2026-01-03 05:29:26 | INFO     | [lf.flight.extracted] SM431 on 15JAN: BKG=176, LF=100.0%
[LF] SM431 15JAN: BKG=176, GRP=141, CAP=176, LF%=100.0%, Brd-Off=CAI-JED, Classes: P:141, U:11, X:20, S:4
2026-01-03 05:29:29 | INFO     | [lf.flight.extracted] SM477 on 15JAN: BKG=179, LF=100.0%
[LF] SM477 15JAN: BKG=179, GRP=135, CAP=179, LF%=100.0%, Brd-Off=CAI-JED, Classes: P:135, U:6, X:7, T:13, W:4, S:9, G:5
2026-01-03 05:29:32 | INFO     | [lf.flight.extracted] SM479 on 15JAN: BKG=179, LF=100.0%
[LF] SM479 15JAN: BKG=179, GRP=125, CAP=179, LF%=100.0%, Brd-Off=CAI-JED, Classes: P:125, U:6, X:5, T:29, W:3, S:6, G:5
2026-01-03 05:29:36 | INFO     | [lf.flight.extracted] SM423 on 15JAN: BKG=101, LF=56.4%
[LF] SM423 15JAN: BKG=101, GRP=0, CAP=179, LF%=56.4%, Brd-Off=CAI-JED, Classes: U:6, X:7, T:23, W:37, S:15, G:13
[LF] Getting WEEKLY/LASTSOLD data for 6 flights
[LF] SM449 15JAN: LASTSOLD=2026-01-03 00:00:00, WEEKLY=96, TODAY=2, YDAY=8
[LF] SM475 15JAN: LASTSOLD=2026-01-01 00:00:00, WEEKLY=30, TODAY=0, YDAY=0
[LF] SM431 15JAN: LASTSOLD=2026-01-02 00:00:00, WEEKLY=26, TODAY=0, YDAY=1
[LF] SM477 15JAN: LASTSOLD=2025-12-30 00:00:00, WEEKLY=20, TODAY=0, YDAY=0
[LF] SM479 15JAN: LASTSOLD=2025-12-30 00:00:00, WEEKLY=12, TODAY=0, YDAY=0
[LF] SM423 15JAN: LASTSOLD=2026-01-02 00:00:00, WEEKLY=52, TODAY=0, YDAY=3
2026-01-03 05:29:58 | INFO     | [SUCCESS] Day 15JAN
2026-01-03 05:29:58 | INFO     | [DAY_START] Processing 14JAN
[LF] Processing CAI-JED for 14JAN
2026-01-03 05:29:58 | INFO     | [lf.day.start] Processing CAI-JED for 14JAN
[LF] 14JAN: found 5 direct flights
2026-01-03 05:29:59 | INFO     | [lf.day.flights_found] Found 5 flights on 14JAN
2026-01-03 05:30:01 | INFO     | [lf.flight.extracted] SM423 on 14JAN: BKG=168, LF=93.8%
[LF] SM423 14JAN: BKG=168, GRP=139, CAP=179, LF%=93.8%, Brd-Off=CAI-JED, Classes: P:49, E:90, U:17, X:10, T:2
2026-01-03 05:30:04 | INFO     | [lf.flight.extracted] SM475 on 14JAN: BKG=107, LF=59.8%
[LF] SM475 14JAN: BKG=107, GRP=45, CAP=179, LF%=59.8%, Brd-Off=CAI-JED, Classes: P:45, U:30, X:20, T:12
2026-01-03 05:30:08 | INFO     | [lf.flight.extracted] SM459 on 14JAN: BKG=145, LF=81.0%
[LF] SM459 14JAN: BKG=145, GRP=85, CAP=179, LF%=81.0%, Brd-Off=CAI-JED, Classes: P:85, U:29, X:14, T:16, W:1
2026-01-03 05:30:11 | INFO     | [lf.flight.extracted] SM477 on 14JAN: BKG=178, LF=98.9%
[LF] SM477 14JAN: BKG=178, GRP=140, CAP=180, LF%=98.9%, Brd-Off=CAI-JED, Classes: P:140, U:8, X:15, T:13, W:2
2026-01-03 05:30:15 | INFO     | [lf.flight.extracted] SM471 on 14JAN: BKG=154, LF=86.0%
[LF] SM471 14JAN: BKG=154, GRP=48, CAP=179, LF%=86.0%, Brd-Off=CAI-JED, Classes: P:48, U:21, X:46, T:15, W:14, S:6, G:4
[LF] Getting WEEKLY/LASTSOLD data for 5 flights
[LF] SM423 14JAN: LASTSOLD=2025-12-30 00:00:00, WEEKLY=12, TODAY=0, YDAY=0
[LF] SM475 14JAN: LASTSOLD=2026-01-02 00:00:00, WEEKLY=46, TODAY=0, YDAY=9
[LF] SM459 14JAN: LASTSOLD=2026-01-03 00:00:00, WEEKLY=43, TODAY=4, YDAY=8
[LF] SM477 14JAN: LASTSOLD=2026-01-01 00:00:00, WEEKLY=5, TODAY=0, YDAY=0
[LF] SM471 14JAN: LASTSOLD=2026-01-02 00:00:00, WEEKLY=61, TODAY=0, YDAY=2
2026-01-03 05:30:32 | INFO     | [SUCCESS] Day 14JAN
2026-01-03 05:30:32 | INFO     | [DAY_START] Processing 13JAN
[LF] Processing CAI-JED for 13JAN
2026-01-03 05:30:32 | INFO     | [lf.day.start] Processing CAI-JED for 13JAN
[LF] 13JAN: found 6 direct flights
2026-01-03 05:30:33 | INFO     | [lf.day.flights_found] Found 6 flights on 13JAN
2026-01-03 05:30:35 | INFO     | [lf.flight.extracted] SM471 on 13JAN: BKG=99, LF=55.3%
[LF] SM471 13JAN: BKG=99, GRP=50, CAP=179, LF%=55.3%, Brd-Off=CAI-JED, Classes: E:50, O:15, U:25, X:2, S:7
2026-01-03 05:30:38 | INFO     | [lf.flight.extracted] SM479 on 13JAN: BKG=177, LF=98.9%
[LF] SM479 13JAN: BKG=177, GRP=150, CAP=179, LF%=98.9%, Brd-Off=CAI-JED, Classes: P:75, E:75, U:6, X:20, W:1
2026-01-03 05:30:41 | INFO     | [lf.flight.extracted] SM477 on 13JAN: BKG=161, LF=89.9%
[LF] SM477 13JAN: BKG=161, GRP=120, CAP=179, LF%=89.9%, Brd-Off=CAI-JED, Classes: P:80, E:40, O:10, U:20, X:11
2026-01-03 05:30:45 | INFO     | [lf.flight.extracted] SM459 on 13JAN: BKG=79, LF=44.1%
[LF] SM459 13JAN: BKG=79, GRP=35, CAP=179, LF%=44.1%, Brd-Off=CAI-JED, Classes: P:35, O:10, U:22, X:11, S:1
2026-01-03 05:30:48 | INFO     | [lf.flight.extracted] SM423 on 13JAN: BKG=75, LF=41.9%
[LF] SM423 13JAN: BKG=75, GRP=0, CAP=179, LF%=41.9%, Brd-Off=CAI-JED, Classes: O:10, U:33, X:30, S:2
2026-01-03 05:30:51 | INFO     | [lf.flight.extracted] SM475 on 13JAN: BKG=103, LF=57.5%
[LF] SM475 13JAN: BKG=103, GRP=45, CAP=179, LF%=57.5%, Brd-Off=CAI-JED, Classes: P:45, U:33, X:20, T:5
[LF] Getting WEEKLY/LASTSOLD data for 6 flights
[LF] SM471 13JAN: LASTSOLD=2026-01-02 00:00:00, WEEKLY=39, TODAY=0, YDAY=3
[LF] SM479 13JAN: LASTSOLD=2025-12-31 00:00:00, WEEKLY=14, TODAY=0, YDAY=0
[LF] SM477 13JAN: LASTSOLD=2026-01-03 00:00:00, WEEKLY=27, TODAY=2, YDAY=3
[LF] SM459 13JAN: LASTSOLD=2026-01-02 00:00:00, WEEKLY=28, TODAY=0, YDAY=5
[LF] SM423 13JAN: LASTSOLD=2026-01-02 00:00:00, WEEKLY=57, TODAY=0, YDAY=4
[LF] SM475 13JAN: LASTSOLD=2026-01-02 00:00:00, WEEKLY=42, TODAY=0, YDAY=8
2026-01-03 05:31:12 | INFO     | [SUCCESS] Day 13JAN
[LF] Results summary:
  2026-01-18: 5 flights
  2026-01-17: 4 flights
  2026-01-16: 5 flights
  2026-01-15: 6 flights
  2026-01-14: 5 flights
  2026-01-13: 6 flights
2026-01-03 05:31:12 | INFO     | [SUCCESS] LF Search Complete

============================================================
[Worker_9233] ✓ COMPLETED: CAI-JED
  Results: 6 dates
  Errors: 0 dates
  Total Processed: 9 groups
============================================================

2026-01-03 05:31:14 | INFO     | [Worker_9233] Completed: CAI-JED - 6 results, 0 errors

============================================================
[Worker_9233] Processing: CAI-JED
  Tier 0: Range 1, Chunk 3/3
  Dates: 5 days
  Date Range: 2026-01-07 to 2026-01-03
============================================================

2026-01-03 05:31:14 | INFO     | [Worker_9233] Processing: CAI-JED
2026-01-03 05:31:14 | INFO     |   Tier 0: Range 1, Chunk 3/3 (5 days)
2026-01-03 05:31:14 | INFO     | ======================================================================
2026-01-03 05:31:14 | INFO     | Load Factor Scraper Started - Route: CAI-JED
2026-01-03 05:31:14 | INFO     | Log file: D:\CODERED\LAB\market_insights\outputs\run_generated_030126_at_05.10\logs\LF_CAI-JED_20260103_053114.log
2026-01-03 05:31:14 | INFO     | Enhanced logging: Capturing both logging.info() and print()
2026-01-03 05:31:14 | INFO     | ======================================================================
[LF] Processing dates (override): ['07JAN', '06JAN', '05JAN', '04JAN', '03JAN']
[LF] Attaching to Chrome for Altea access
2026-01-03 05:31:14 | INFO     | Starting LF search for route: CAI-JED
2026-01-03 05:31:14 | INFO     | [START] LF Search
[LF][[OK] SUCCESS] Connected to Chrome on 127.0.0.1:9233 (after 1 attempts)
2026-01-03 05:31:15 | INFO     | [HEALTH CHECK] [OK] Chrome connection is healthy
[LF][[OK] SUCCESS] Found Amadeus Altea window: Altéa Reservation Desktop
[LF][[INFO] INFO] URL: https://tc212.resdesktop.altea.amadeus.com/app_ard/apf/init/login?SITE=ESMPESMP&LANGUAGE=GB&MARKETS=ARDW_PROD_WBP&ACTION=clpLogin
2026-01-03 05:31:15 | INFO     | [DAY_START] Processing 07JAN
[LF] Processing CAI-JED for 07JAN
2026-01-03 05:31:15 | INFO     | [lf.day.start] Processing CAI-JED for 07JAN
[LF] 07JAN: found 5 direct flights
2026-01-03 05:31:16 | INFO     | [lf.day.flights_found] Found 5 flights on 07JAN
2026-01-03 05:31:18 | INFO     | [lf.flight.extracted] SM423 on 07JAN: BKG=154, LF=87.5%
[LF] SM423 07JAN: BKG=154, GRP=95, CAP=176, LF%=87.5%, Brd-Off=CAI-JED, Classes: P:50, E:45, I:42, O:3, U:6, X:4, T:4
2026-01-03 05:31:22 | INFO     | [lf.flight.extracted] SM475 on 07JAN: BKG=126, LF=70.4%
[LF] SM475 07JAN: BKG=126, GRP=45, CAP=179, LF%=70.4%, Brd-Off=CAI-JED, Classes: P:45, I:72, U:6, K:3
2026-01-03 05:31:25 | INFO     | [lf.flight.extracted] SM459 on 07JAN: BKG=125, LF=69.8%
[LF] SM459 07JAN: BKG=125, GRP=85, CAP=179, LF%=69.8%, Brd-Off=CAI-JED, Classes: P:85, I:34, O:4, U:2
2026-01-03 05:31:28 | INFO     | [lf.flight.extracted] SM477 on 07JAN: BKG=160, LF=89.4%
[LF] SM477 07JAN: BKG=160, GRP=90, CAP=179, LF%=89.4%, Brd-Off=CAI-JED, Classes: P:90, I:48, O:19, U:2, X:1
2026-01-03 05:31:31 | INFO     | [lf.flight.extracted] SM471 on 07JAN: BKG=68, LF=38.0%
[LF] SM471 07JAN: BKG=68, GRP=0, CAP=179, LF%=38.0%, Brd-Off=CAI-JED, Classes: I:29, O:25, U:10, X:4
[LF] Getting WEEKLY/LASTSOLD data for 5 flights
[LF] SM423 07JAN: LASTSOLD=2026-01-02 00:00:00, WEEKLY=30, TODAY=0, YDAY=10
[LF] SM475 07JAN: LASTSOLD=2026-01-02 00:00:00, WEEKLY=64, TODAY=0, YDAY=4
[LF] SM459 07JAN: LASTSOLD=2026-01-02 00:00:00, WEEKLY=22, TODAY=0, YDAY=8
[LF] SM477 07JAN: LASTSOLD=2026-01-02 00:00:00, WEEKLY=53, TODAY=0, YDAY=8
[LF] SM471 07JAN: LASTSOLD=2026-01-03 00:00:00, WEEKLY=38, TODAY=1, YDAY=1
2026-01-03 05:31:52 | INFO     | [SUCCESS] Day 07JAN
2026-01-03 05:31:52 | INFO     | [DAY_START] Processing 06JAN
[LF] Processing CAI-JED for 06JAN
2026-01-03 05:31:52 | INFO     | [lf.day.start] Processing CAI-JED for 06JAN
[LF] 06JAN: found 6 direct flights
2026-01-03 05:31:53 | INFO     | [lf.day.flights_found] Found 6 flights on 06JAN
2026-01-03 05:31:55 | INFO     | [lf.flight.extracted] SM471 on 06JAN: BKG=101, LF=56.4%
[LF] SM471 06JAN: BKG=101, GRP=48, CAP=179, LF%=56.4%, Brd-Off=CAI-JED, Classes: P:48, I:45, O:3, U:1, X:4
2026-01-03 05:31:58 | INFO     | [lf.flight.extracted] SM479 on 06JAN: BKG=134, LF=74.9%
[LF] SM479 06JAN: BKG=134, GRP=90, CAP=179, LF%=74.9%, Brd-Off=CAI-JED, Classes: P:90, I:30, O:3, U:11
2026-01-03 05:32:01 | INFO     | [lf.flight.extracted] SM477 on 06JAN: BKG=144, LF=80.5%
[LF] SM477 06JAN: BKG=144, GRP=94, CAP=179, LF%=80.5%, Brd-Off=CAI-JED, Classes: P:94, I:32, O:8, U:6, X:4
2026-01-03 05:32:04 | INFO     | [lf.flight.extracted] SM459 on 06JAN: BKG=179, LF=101.7%
[LF] SM459 06JAN: BKG=179, GRP=160, CAP=176, LF%=101.7%, Brd-Off=CAI-JED, Classes: P:160, I:7, U:12
2026-01-03 05:32:07 | INFO     | [lf.flight.extracted] SM423 on 06JAN: BKG=82, LF=45.8%
[LF] SM423 06JAN: BKG=82, GRP=0, CAP=179, LF%=45.8%, Brd-Off=CAI-JED, Classes: I:48, O:19, U:14, X:1
2026-01-03 05:32:11 | INFO     | [lf.flight.extracted] SM475 on 06JAN: BKG=110, LF=61.1%
[LF] SM475 06JAN: BKG=110, GRP=45, CAP=180, LF%=61.1%, Brd-Off=CAI-JED, Classes: P:45, I:33, O:16, U:13, X:3
[LF] Getting WEEKLY/LASTSOLD data for 6 flights
[LF] SM471 06JAN: LASTSOLD=2026-01-03 00:00:00, WEEKLY=26, TODAY=1, YDAY=7
[LF] SM479 06JAN: LASTSOLD=2026-01-02 00:00:00, WEEKLY=31, TODAY=0, YDAY=9
[LF] SM477 06JAN: LASTSOLD=2026-01-02 00:00:00, WEEKLY=40, TODAY=0, YDAY=10
[LF] SM459 06JAN: LASTSOLD=2025-12-31 00:00:00, WEEKLY=7, TODAY=0, YDAY=0
[LF] SM423 06JAN: LASTSOLD=2026-01-01 00:00:00, WEEKLY=53, TODAY=0, YDAY=0
[LF] SM475 06JAN: LASTSOLD=2026-01-02 00:00:00, WEEKLY=39, TODAY=0, YDAY=2
2026-01-03 05:32:33 | INFO     | [SUCCESS] Day 06JAN
2026-01-03 05:32:33 | INFO     | [DAY_START] Processing 05JAN
[LF] Processing CAI-JED for 05JAN
2026-01-03 05:32:33 | INFO     | [lf.day.start] Processing CAI-JED for 05JAN
[LF] 05JAN: found 3 direct flights
2026-01-03 05:32:34 | INFO     | [lf.day.flights_found] Found 3 flights on 05JAN
2026-01-03 05:32:36 | INFO     | [lf.flight.extracted] SM475 on 05JAN: BKG=150, LF=83.8%
[LF] SM475 05JAN: BKG=150, GRP=87, CAP=179, LF%=83.8%, Brd-Off=CAI-JED, Classes: P:87, I:15, O:2, U:4, X:10, T:11, W:18, S:3
2026-01-03 05:32:39 | INFO     | [lf.flight.extracted] SM477 on 05JAN: BKG=137, LF=77.8%
[LF] SM477 05JAN: BKG=137, GRP=33, CAP=176, LF%=77.8%, Brd-Off=CAI-JED, Classes: P:33, I:53, O:17, U:15, X:15, T:2, S:2
2026-01-03 05:32:42 | INFO     | [lf.flight.extracted] SM459 on 05JAN: BKG=153, LF=86.9%
[LF] SM459 05JAN: BKG=153, GRP=45, CAP=176, LF%=86.9%, Brd-Off=CAI-JED, Classes: E:45, I:55, O:30, U:12, X:9, T:2
[LF] Getting WEEKLY/LASTSOLD data for 3 flights
[LF] SM475 05JAN: LASTSOLD=2026-01-02 00:00:00, WEEKLY=17, TODAY=0, YDAY=2
[LF] SM477 05JAN: LASTSOLD=2026-01-02 00:00:00, WEEKLY=67, TODAY=0, YDAY=3
[LF] SM459 05JAN: LASTSOLD=2026-01-02 00:00:00, WEEKLY=77, TODAY=0, YDAY=13
2026-01-03 05:32:57 | INFO     | [SUCCESS] Day 05JAN
2026-01-03 05:32:57 | INFO     | [DAY_START] Processing 04JAN
[LF] Processing CAI-JED for 04JAN
2026-01-03 05:32:57 | INFO     | [lf.day.start] Processing CAI-JED for 04JAN
[LF] 04JAN: found 5 direct flights
2026-01-03 05:32:57 | INFO     | [lf.day.flights_found] Found 5 flights on 04JAN
2026-01-03 05:32:59 | INFO     | [lf.flight.extracted] SM475 on 04JAN: BKG=53, LF=29.6%
[LF] SM475 04JAN: BKG=53, GRP=0, CAP=179, LF%=29.6%, Brd-Off=CAI-JED, Classes: I:30, O:7, U:8, X:7, S:1
2026-01-03 05:33:02 | INFO     | [lf.flight.extracted] SM431 on 04JAN: BKG=82, LF=45.8%
[LF] SM431 04JAN: BKG=82, GRP=40, CAP=179, LF%=45.8%, Brd-Off=CAI-JED, Classes: P:40, I:29, O:4, X:7, S:2
2026-01-03 05:33:06 | INFO     | [lf.flight.extracted] SM459 on 04JAN: BKG=176, LF=98.3%
[LF] SM459 04JAN: BKG=176, GRP=126, CAP=179, LF%=98.3%, Brd-Off=CAI-JED, Classes: P:126, I:35, O:12, U:2, X:1
2026-01-03 05:33:09 | INFO     | [lf.flight.extracted] SM477 on 04JAN: BKG=135, LF=76.7%
[LF] SM477 04JAN: BKG=135, GRP=47, CAP=176, LF%=76.7%, Brd-Off=CAI-JED, Classes: P:47, I:69, O:15, U:4
2026-01-03 05:33:13 | INFO     | [lf.flight.extracted] SM479 on 04JAN: BKG=103, LF=57.2%
[LF] SM479 04JAN: BKG=103, GRP=0, CAP=180, LF%=57.2%, Brd-Off=CAI-JED, Classes: I:59, O:26, U:15, X:3
[LF] Getting WEEKLY/LASTSOLD data for 5 flights
[LF] SM475 04JAN: LASTSOLD=2026-01-01 00:00:00, WEEKLY=35, TODAY=0, YDAY=0
[LF] SM431 04JAN: LASTSOLD=2026-01-03 00:00:00, WEEKLY=24, TODAY=2, YDAY=7
[LF] SM459 04JAN: LASTSOLD=2026-01-02 00:00:00, WEEKLY=46, TODAY=0, YDAY=2
[LF] SM477 04JAN: LASTSOLD=2026-01-02 00:00:00, WEEKLY=79, TODAY=0, YDAY=5
[LF] SM479 04JAN: LASTSOLD=2026-01-03 00:00:00, WEEKLY=78, TODAY=6, YDAY=7
2026-01-03 05:33:34 | INFO     | [SUCCESS] Day 04JAN
[LF] Skipping 03JAN (Today) - will be processed by supplement scan
[LF] Results summary:
  2026-01-07: 5 flights
  2026-01-06: 6 flights
  2026-01-05: 3 flights
  2026-01-04: 5 flights
2026-01-03 05:33:34 | INFO     | [SUCCESS] LF Search Complete

============================================================
[Worker_9233] ✓ COMPLETED: CAI-JED
  Results: 4 dates
  Errors: 0 dates
  Total Processed: 10 groups
============================================================

2026-01-03 05:33:36 | INFO     | [Worker_9233] Completed: CAI-JED - 4 results, 0 errors
[Worker_9233] Waiting for tasks...

============================================================
[Worker_9233] Shutdown signal received
Exiting...
============================================================
2026-01-03 05:39:01 | INFO     | [Worker_9233] Shutdown signal received, exiting...

============================================================
[Worker_9233] FINISHED
  Total Groups Processed: 10
============================================================

2026-01-03 05:39:01 | INFO     | [Worker_9233] Finished. Processed 10 groups.
