
============================================================
     LF WORKER - PORT 9232
============================================================
Worker: Worker_9232
Status: READY
Waiting for tasks...
============================================================


============================================================
[Worker_9232] Processing: ATZ-ELQ
  Tier 0: Range 2, Chunk 1/2
  Dates: 6 days
  Date Range: 2026-01-20 to 2026-01-15
============================================================

2025-12-27 17:35:25 | INFO     | ======================================================================
2025-12-27 17:35:25 | INFO     | Load Factor Scraper Started - Route: ATZ-ELQ
2025-12-27 17:35:25 | INFO     | Log file: D:\CODERED\LAB\market_insights\outputs\logs\LF_ATZ-ELQ_20251227_173525.log
2025-12-27 17:35:25 | INFO     | Enhanced logging: Capturing both logging.info() and print()
2025-12-27 17:35:25 | INFO     | ======================================================================
[LF] Processing dates (override): ['20JAN', '19JAN', '18JAN', '17JAN', '16JAN', '15JAN']
[LF] Attaching to Chrome for Altea access
[LF][[OK] SUCCESS] Connected to Chrome on 127.0.0.1:9232 (after 1 attempts)
[LF][[OK] SUCCESS] Found Amadeus Altea window: Altéa Reservation Desktop
[LF][[INFO] INFO] URL: https://tc212.resdesktop.altea.amadeus.com/app_ard/apf/init/login?SITE=ESMPESMP&LANGUAGE=GB&MARKETS=ARDW_PROD_WBP&ACTION=clpLogin
[LF] Processing ATZ-ELQ for 20JAN
[LF][ERROR] Amadeus command error detected: UNKNOWN TRANSACTION
[LF][ERROR] Command: SN20JANATZELQ/ASM
[LF][RESYNC] Triggering immediate resync to last successful SN command
============================================================
[LF][RESYNC] Command 'SN20JANATZELQ/ASM' failed: TECH_ERROR:UNKNOWN TRANSACTION
[LF][RESYNC] Re-running entire day from SN command for ATZ-ELQ 20JAN
[LF][RESYNC] Attempt 1/50 (waiting 1.0s before retry...)
============================================================
[LF][RESYNC] Sending IG to clear session state...
[LF][RESYNC] Session cleared with IG
[LF] Processing ATZ-ELQ for 20JAN
[LF] 20JAN: found 1 direct flights
[LF] SM435 20JAN: BKG=21, GRP=0, CAP=179, LF%=11.7%, Brd-Off=ATZ-ELQ, Classes: I:10, O:9, U:1, W:1
[LF] Getting WEEKLY/LASTSOLD data for 1 flights
[LF] SM435 20JAN: LASTSOLD=2025-12-26 00:00:00, WEEKLY=10, TODAY=0, YDAY=1
[LF] Processing ATZ-ELQ for 19JAN
[LF] No direct flights on 19JAN for ATZ-ELQ
[LF] Processing ATZ-ELQ for 18JAN
[LF] No direct flights on 18JAN for ATZ-ELQ
[LF] Processing ATZ-ELQ for 17JAN
[LF] 17JAN: found 1 direct flights
[LF] SM435 17JAN: BKG=25, GRP=0, CAP=179, LF%=14.0%, Brd-Off=ATZ-ELQ, Classes: I:8, X:15, K:2
[LF] Getting WEEKLY/LASTSOLD data for 1 flights
[LF] SM435 17JAN: LASTSOLD=2025-12-27 00:00:00, WEEKLY=17, TODAY=1, YDAY=1
[LF] Processing ATZ-ELQ for 16JAN
[LF] No direct flights on 16JAN for ATZ-ELQ
[LF] Processing ATZ-ELQ for 15JAN
[LF] No direct flights on 15JAN for ATZ-ELQ
[LF] Results summary:
  2026-01-20: 1 flights
  2026-01-19: 0 flights
  2026-01-18: 0 flights
  2026-01-17: 1 flights
  2026-01-16: 0 flights
  2026-01-15: 0 flights

============================================================
[Worker_9232] ✓ COMPLETED: ATZ-ELQ
  Results: 6 dates
  Errors: 0 dates
  Total Processed: 1 groups
============================================================


============================================================
[Worker_9232] Processing: ATZ-RUH
  Tier 0: Range 2, Chunk 2/2
  Dates: 5 days
  Date Range: 2026-01-14 to 2026-01-10
============================================================

2025-12-27 17:36:00 | INFO     | ======================================================================
2025-12-27 17:36:00 | INFO     | Load Factor Scraper Started - Route: ATZ-RUH
2025-12-27 17:36:00 | INFO     | Log file: D:\CODERED\LAB\market_insights\outputs\logs\LF_ATZ-RUH_20251227_173600.log
2025-12-27 17:36:00 | INFO     | Enhanced logging: Capturing both logging.info() and print()
2025-12-27 17:36:00 | INFO     | ======================================================================
[LF] Processing dates (override): ['14JAN', '13JAN', '12JAN', '11JAN', '10JAN']
[LF] Attaching to Chrome for Altea access
2025-12-27 17:36:00 | INFO     | Starting LF search for route: ATZ-RUH
2025-12-27 17:36:00 | INFO     | [START] LF Search
[LF][[OK] SUCCESS] Connected to Chrome on 127.0.0.1:9232 (after 1 attempts)
2025-12-27 17:36:01 | INFO     | [HEALTH CHECK] [OK] Chrome connection is healthy
[LF][[OK] SUCCESS] Found Amadeus Altea window: Altéa Reservation Desktop
[LF][[INFO] INFO] URL: https://tc212.resdesktop.altea.amadeus.com/app_ard/apf/init/login?SITE=ESMPESMP&LANGUAGE=GB&MARKETS=ARDW_PROD_WBP&ACTION=clpLogin
2025-12-27 17:36:01 | INFO     | [DAY_START] Processing 14JAN
[LF] Processing ATZ-RUH for 14JAN
2025-12-27 17:36:01 | INFO     | [lf.day.start] Processing ATZ-RUH for 14JAN
[LF] 14JAN: found 1 direct flights
2025-12-27 17:36:02 | INFO     | [lf.day.flights_found] Found 1 flights on 14JAN
2025-12-27 17:36:04 | INFO     | [lf.flight.extracted] SM465 on 14JAN: BKG=79, LF=44.1%
[LF] SM465 14JAN: BKG=79, GRP=0, CAP=179, LF%=44.1%, Brd-Off=ATZ-RUH, Classes: I:1, O:9, U:17, X:15, T:9, W:7, S:9, G:8, L:4
[LF] Getting WEEKLY/LASTSOLD data for 1 flights
[LF] SM465 14JAN: LASTSOLD=2025-12-27 00:00:00, WEEKLY=22, TODAY=3, YDAY=3
2025-12-27 17:36:10 | INFO     | [SUCCESS] Day 14JAN
2025-12-27 17:36:10 | INFO     | [DAY_START] Processing 13JAN
[LF] Processing ATZ-RUH for 13JAN
2025-12-27 17:36:10 | INFO     | [lf.day.start] Processing ATZ-RUH for 13JAN
[LF] 13JAN: found 1 direct flights
2025-12-27 17:36:12 | INFO     | [lf.day.flights_found] Found 1 flights on 13JAN
2025-12-27 17:36:14 | INFO     | [lf.flight.extracted] SM463 on 13JAN: BKG=62, LF=34.6%
[LF] SM463 13JAN: BKG=62, GRP=0, CAP=179, LF%=34.6%, Brd-Off=ATZ-RUH, Classes: I:4, O:4, X:13, T:20, W:7, S:9, G:5
[LF] Getting WEEKLY/LASTSOLD data for 1 flights
[LF] SM463 13JAN: LASTSOLD=2025-12-27 00:00:00, WEEKLY=16, TODAY=1, YDAY=1
2025-12-27 17:36:19 | INFO     | [SUCCESS] Day 13JAN
2025-12-27 17:36:19 | INFO     | [DAY_START] Processing 12JAN
[LF] Processing ATZ-RUH for 12JAN
2025-12-27 17:36:19 | INFO     | [lf.day.start] Processing ATZ-RUH for 12JAN
[LF] No direct flights on 12JAN for ATZ-RUH
2025-12-27 17:36:20 | WARNING  | [lf.day.no_flights] No direct flights on 12JAN
2025-12-27 17:36:21 | INFO     | [SUCCESS] Day 12JAN
2025-12-27 17:36:21 | INFO     | [DAY_START] Processing 11JAN
[LF] Processing ATZ-RUH for 11JAN
2025-12-27 17:36:21 | INFO     | [lf.day.start] Processing ATZ-RUH for 11JAN
[LF] 11JAN: found 1 direct flights
2025-12-27 17:36:21 | INFO     | [lf.day.flights_found] Found 1 flights on 11JAN
2025-12-27 17:36:27 | INFO     | [lf.flight.extracted] SM463 on 11JAN: BKG=85, LF=47.5%
[LF] SM463 11JAN: BKG=85, GRP=0, CAP=179, LF%=47.5%, Brd-Off=ATZ-RUH, Classes: I:1, O:4, U:3, X:12, T:10, W:10, S:29, G:16
[LF] Getting WEEKLY/LASTSOLD data for 1 flights
[LF] SM463 11JAN: LASTSOLD=2025-12-27 00:00:00, WEEKLY=31, TODAY=2, YDAY=4
2025-12-27 17:36:34 | INFO     | [SUCCESS] Day 11JAN
2025-12-27 17:36:34 | INFO     | [DAY_START] Processing 10JAN
[LF] Processing ATZ-RUH for 10JAN
2025-12-27 17:36:34 | INFO     | [lf.day.start] Processing ATZ-RUH for 10JAN
[LF] No direct flights on 10JAN for ATZ-RUH
2025-12-27 17:36:34 | WARNING  | [lf.day.no_flights] No direct flights on 10JAN
2025-12-27 17:36:35 | INFO     | [SUCCESS] Day 10JAN
[LF] Results summary:
  2026-01-14: 1 flights
  2026-01-13: 1 flights
  2026-01-12: 0 flights
  2026-01-11: 1 flights
  2026-01-10: 0 flights
2025-12-27 17:36:35 | INFO     | [SUCCESS] LF Search Complete

============================================================
[Worker_9232] ✓ COMPLETED: ATZ-RUH
  Results: 5 dates
  Errors: 0 dates
  Total Processed: 2 groups
============================================================

2025-12-27 17:36:37 | INFO     | [Worker_9232] Completed: ATZ-RUH - 5 results, 0 errors

============================================================
[Worker_9232] Processing: ATZ-RUH
  Tier 0: Range 1, Chunk 1/2
  Dates: 7 days
  Date Range: 2026-01-10 to 2026-01-04
============================================================

2025-12-27 17:36:37 | INFO     | [Worker_9232] Processing: ATZ-RUH
2025-12-27 17:36:37 | INFO     |   Tier 0: Range 1, Chunk 1/2 (7 days)
2025-12-27 17:36:37 | INFO     | ======================================================================
2025-12-27 17:36:37 | INFO     | Load Factor Scraper Started - Route: ATZ-RUH
2025-12-27 17:36:37 | INFO     | Log file: D:\CODERED\LAB\market_insights\outputs\logs\LF_ATZ-RUH_20251227_173637.log
2025-12-27 17:36:37 | INFO     | Enhanced logging: Capturing both logging.info() and print()
2025-12-27 17:36:37 | INFO     | ======================================================================
[LF] Processing dates (override): ['10JAN', '09JAN', '08JAN', '07JAN', '06JAN', '05JAN', '04JAN']
[LF] Attaching to Chrome for Altea access
2025-12-27 17:36:37 | INFO     | Starting LF search for route: ATZ-RUH
2025-12-27 17:36:37 | INFO     | [START] LF Search
[LF][[OK] SUCCESS] Connected to Chrome on 127.0.0.1:9232 (after 1 attempts)
2025-12-27 17:36:38 | INFO     | [HEALTH CHECK] [OK] Chrome connection is healthy
[LF][[OK] SUCCESS] Found Amadeus Altea window: Altéa Reservation Desktop
[LF][[INFO] INFO] URL: https://tc212.resdesktop.altea.amadeus.com/app_ard/apf/init/login?SITE=ESMPESMP&LANGUAGE=GB&MARKETS=ARDW_PROD_WBP&ACTION=clpLogin
2025-12-27 17:36:38 | INFO     | [DAY_START] Processing 10JAN
[LF] Processing ATZ-RUH for 10JAN
2025-12-27 17:36:38 | INFO     | [lf.day.start] Processing ATZ-RUH for 10JAN
[LF] No direct flights on 10JAN for ATZ-RUH
2025-12-27 17:36:38 | WARNING  | [lf.day.no_flights] No direct flights on 10JAN
2025-12-27 17:36:39 | INFO     | [SUCCESS] Day 10JAN
2025-12-27 17:36:39 | INFO     | [DAY_START] Processing 09JAN
[LF] Processing ATZ-RUH for 09JAN
2025-12-27 17:36:39 | INFO     | [lf.day.start] Processing ATZ-RUH for 09JAN
[LF] No direct flights on 09JAN for ATZ-RUH
2025-12-27 17:36:40 | WARNING  | [lf.day.no_flights] No direct flights on 09JAN
2025-12-27 17:36:40 | INFO     | [SUCCESS] Day 09JAN
2025-12-27 17:36:40 | INFO     | [DAY_START] Processing 08JAN
[LF] Processing ATZ-RUH for 08JAN
2025-12-27 17:36:40 | INFO     | [lf.day.start] Processing ATZ-RUH for 08JAN
[LF] No direct flights on 08JAN for ATZ-RUH
2025-12-27 17:36:41 | WARNING  | [lf.day.no_flights] No direct flights on 08JAN
2025-12-27 17:36:41 | INFO     | [SUCCESS] Day 08JAN
2025-12-27 17:36:41 | INFO     | [DAY_START] Processing 07JAN
[LF] Processing ATZ-RUH for 07JAN
2025-12-27 17:36:41 | INFO     | [lf.day.start] Processing ATZ-RUH for 07JAN
[LF] 07JAN: found 1 direct flights
2025-12-27 17:36:43 | INFO     | [lf.day.flights_found] Found 1 flights on 07JAN
2025-12-27 17:36:47 | INFO     | [lf.flight.extracted] SM465 on 07JAN: BKG=90, LF=50.3%
[LF] SM465 07JAN: BKG=90, GRP=0, CAP=179, LF%=50.3%, Brd-Off=ATZ-RUH, Classes: I:2, O:7, U:10, X:8, T:9, W:13, S:8, G:23, L:9, Y:1
[LF] Getting WEEKLY/LASTSOLD data for 1 flights
[LF] SM465 07JAN: LASTSOLD=2025-12-27 00:00:00, WEEKLY=30, TODAY=9, YDAY=0
2025-12-27 17:36:54 | INFO     | [SUCCESS] Day 07JAN
2025-12-27 17:36:54 | INFO     | [DAY_START] Processing 06JAN
[LF] Processing ATZ-RUH for 06JAN
2025-12-27 17:36:54 | INFO     | [lf.day.start] Processing ATZ-RUH for 06JAN
[LF] 06JAN: found 1 direct flights
2025-12-27 17:36:55 | INFO     | [lf.day.flights_found] Found 1 flights on 06JAN
2025-12-27 17:36:57 | INFO     | [lf.flight.extracted] SM463 on 06JAN: BKG=96, LF=53.6%
[LF] SM463 06JAN: BKG=96, GRP=0, CAP=179, LF%=53.6%, Brd-Off=ATZ-RUH, Classes: I:4, O:9, X:17, T:10, W:30, S:9, G:9, L:8
[LF] Getting WEEKLY/LASTSOLD data for 1 flights
[LF] SM463 06JAN: LASTSOLD=2025-12-27 00:00:00, WEEKLY=15, TODAY=1, YDAY=3
2025-12-27 17:37:03 | ERROR    | Atomic write failed for D:\CODERED\LAB\market_insights\outputs\run_generated_271225_at_17.35\checkpoints\flight_booking_data.json: [WinError 2] The system cannot find the file specified: 'D:\\CODERED\\LAB\\market_insights\\outputs\\run_generated_271225_at_17.35\\checkpoints\\flight_booking_data.json'
2025-12-27 17:37:03 | INFO     | [SUCCESS] Day 06JAN
2025-12-27 17:37:03 | INFO     | [DAY_START] Processing 05JAN
[LF] Processing ATZ-RUH for 05JAN
2025-12-27 17:37:03 | INFO     | [lf.day.start] Processing ATZ-RUH for 05JAN
[LF] No direct flights on 05JAN for ATZ-RUH
2025-12-27 17:37:04 | WARNING  | [lf.day.no_flights] No direct flights on 05JAN
2025-12-27 17:37:04 | INFO     | [SUCCESS] Day 05JAN
2025-12-27 17:37:04 | INFO     | [DAY_START] Processing 04JAN
[LF] Processing ATZ-RUH for 04JAN
2025-12-27 17:37:04 | INFO     | [lf.day.start] Processing ATZ-RUH for 04JAN
[LF] 04JAN: found 1 direct flights
2025-12-27 17:37:05 | INFO     | [lf.day.flights_found] Found 1 flights on 04JAN
2025-12-27 17:37:07 | INFO     | [lf.flight.extracted] SM463 on 04JAN: BKG=117, LF=65.4%
[LF] SM463 04JAN: BKG=117, GRP=0, CAP=179, LF%=65.4%, Brd-Off=ATZ-RUH, Classes: O:6, U:7, X:17, T:20, W:10, S:10, G:19, L:27, K:1
[LF] Getting WEEKLY/LASTSOLD data for 1 flights
[LF] SM463 04JAN: LASTSOLD=2025-12-26 00:00:00, WEEKLY=25, TODAY=0, YDAY=4
2025-12-27 17:37:14 | INFO     | [SUCCESS] Day 04JAN
[LF] Results summary:
  2026-01-10: 0 flights
  2026-01-09: 0 flights
  2026-01-08: 0 flights
  2026-01-07: 1 flights
  2026-01-06: 1 flights
  2026-01-05: 0 flights
  2026-01-04: 1 flights
2025-12-27 17:37:14 | INFO     | [SUCCESS] LF Search Complete

============================================================
[Worker_9232] ✓ COMPLETED: ATZ-RUH
  Results: 7 dates
  Errors: 0 dates
  Total Processed: 3 groups
============================================================

2025-12-27 17:37:16 | INFO     | [Worker_9232] Completed: ATZ-RUH - 7 results, 0 errors

============================================================
[Worker_9232] Processing: JED-CAI
  Tier 0: Range 1, Chunk 2/2
  Dates: 7 days
  Date Range: 2026-01-03 to 2025-12-28
============================================================

2025-12-27 17:37:16 | INFO     | [Worker_9232] Processing: JED-CAI
2025-12-27 17:37:16 | INFO     |   Tier 0: Range 1, Chunk 2/2 (7 days)
2025-12-27 17:37:16 | INFO     | ======================================================================
2025-12-27 17:37:16 | INFO     | Load Factor Scraper Started - Route: JED-CAI
2025-12-27 17:37:16 | INFO     | Log file: D:\CODERED\LAB\market_insights\outputs\logs\LF_JED-CAI_20251227_173716.log
2025-12-27 17:37:16 | INFO     | Enhanced logging: Capturing both logging.info() and print()
2025-12-27 17:37:16 | INFO     | ======================================================================
[LF] Processing dates (override): ['03JAN', '02JAN', '01JAN', '31DEC', '30DEC', '29DEC', '28DEC']
[LF] Attaching to Chrome for Altea access
2025-12-27 17:37:16 | INFO     | Starting LF search for route: JED-CAI
2025-12-27 17:37:16 | INFO     | [START] LF Search
[LF][[OK] SUCCESS] Connected to Chrome on 127.0.0.1:9232 (after 1 attempts)
2025-12-27 17:37:17 | INFO     | [HEALTH CHECK] [OK] Chrome connection is healthy
[LF][[OK] SUCCESS] Found Amadeus Altea window: Altéa Reservation Desktop
[LF][[INFO] INFO] URL: https://tc212.resdesktop.altea.amadeus.com/app_ard/apf/init/login?SITE=ESMPESMP&LANGUAGE=GB&MARKETS=ARDW_PROD_WBP&ACTION=clpLogin
2025-12-27 17:37:17 | INFO     | [DAY_START] Processing 03JAN
[LF] Processing JED-CAI for 03JAN
2025-12-27 17:37:17 | INFO     | [lf.day.start] Processing JED-CAI for 03JAN
[LF] 03JAN: found 3 direct flights
2025-12-27 17:37:18 | INFO     | [lf.day.flights_found] Found 3 flights on 03JAN
2025-12-27 17:37:20 | INFO     | [lf.flight.extracted] SM450 on 03JAN: BKG=162, LF=97.0%
[LF] SM450 03JAN: BKG=162, GRP=141, CAP=167, LF%=97.0%, Brd-Off=JED-CAI, Classes: P:141, U:10, X:7, T:2, K:2
[LPC] SM450 03JAN: Found 1 outbound flights with connecting passengers
2025-12-27 17:37:25 | INFO     | [lf.flight.extracted] SM476 on 03JAN: BKG=162, LF=91.0%
[LF] SM476 03JAN: BKG=162, GRP=131, CAP=178, LF%=91.0%, Brd-Off=JED-CAI, Classes: P:131, U:7, X:12, T:9, S:3
2025-12-27 17:37:29 | INFO     | [lf.flight.extracted] SM478 on 03JAN: BKG=165, LF=94.3%
[LF] SM478 03JAN: BKG=165, GRP=139, CAP=175, LF%=94.3%, Brd-Off=JED-CAI, Classes: P:139, I:5, U:15, W:6
[LF] Getting WEEKLY/LASTSOLD data for 3 flights
[LF] SM450 03JAN: LASTSOLD=2025-12-24 00:00:00, WEEKLY=2, TODAY=0, YDAY=0
[LF] SM476 03JAN: LASTSOLD=2025-12-26 00:00:00, WEEKLY=5, TODAY=0, YDAY=3
2025-12-27 17:38:13 | ERROR    | Atomic write failed for D:\CODERED\LAB\market_insights\outputs\run_generated_271225_at_17.35\checkpoints\flight_booking_data.json: [WinError 32] The process cannot access the file because it is being used by another process: 'D:\\CODERED\\LAB\\market_insights\\outputs\\run_generated_271225_at_17.35\\checkpoints\\flight_booking_data.tmp' -> 'D:\\CODERED\\LAB\\market_insights\\outputs\\run_generated_271225_at_17.35\\checkpoints\\flight_booking_data.json'
[LF] SM478 03JAN: LASTSOLD=2025-12-22 00:00:00, WEEKLY=12, TODAY=0, YDAY=0
2025-12-27 17:38:37 | INFO     | [SUCCESS] Day 03JAN
2025-12-27 17:38:37 | INFO     | [DAY_START] Processing 02JAN
[LF] Processing JED-CAI for 02JAN
2025-12-27 17:38:37 | INFO     | [lf.day.start] Processing JED-CAI for 02JAN
[LF] 02JAN: 2 cancelled flight(s) detected from SN
[LF] 02JAN: found 5 direct flights
2025-12-27 17:38:39 | INFO     | [lf.day.flights_found] Found 5 flights on 02JAN
2025-12-27 17:38:42 | INFO     | [lf.flight.extracted] SM424 on 02JAN: BKG=68, LF=40.7%
[LF] SM424 02JAN: BKG=68, GRP=45, CAP=167, LF%=40.7%, Brd-Off=JED-CAI, Classes: P:45, X:6, T:12, W:2, S:3
[LPC] SM424 02JAN: Found 2 outbound flights with connecting passengers
2025-12-27 17:38:49 | INFO     | [lf.flight.extracted] SM476 on 02JAN: BKG=73, LF=43.7%
[LF] SM476 02JAN: BKG=73, GRP=48, CAP=167, LF%=43.7%, Brd-Off=JED-CAI, Classes: P:48, I:5, O:5, U:1, X:10, T:4
2025-12-27 17:38:52 | INFO     | [lf.flight.extracted] SM480 on 02JAN: BKG=163, LF=97.6%
[LF] SM480 02JAN: BKG=163, GRP=135, CAP=167, LF%=97.6%, Brd-Off=JED-CAI, Classes: P:135, U:9, X:11, T:5, W:1, K:2
2025-12-27 17:39:26 | INFO     | [lf.flight.extracted] SM472 on 02JAN: BKG=160, LF=95.8%
[LF] SM472 02JAN: BKG=160, GRP=90, CAP=167, LF%=95.8%, Brd-Off=JED-CAI, Classes: P:90, I:5, O:5, U:12, X:22, T:24, S:2
2025-12-27 17:39:35 | INFO     | [lf.flight.extracted] SM460 on 02JAN: BKG=156, LF=93.4%
[LF] SM460 02JAN: BKG=156, GRP=118, CAP=167, LF%=93.4%, Brd-Off=JED-CAI, Classes: P:118, U:8, X:12, T:16, W:1, K:1
[LPC] SM460 02JAN: Found 0 outbound flights with connecting passengers
[LF] Getting WEEKLY/LASTSOLD data for 5 flights
[LF] SM424 02JAN: LASTSOLD=2025-12-27 00:00:00, WEEKLY=13, TODAY=1, YDAY=4
[LF] SM476 02JAN: LASTSOLD=2025-12-24 00:00:00, WEEKLY=5, TODAY=0, YDAY=0
[LF] SM480 02JAN: LASTSOLD=2025-12-26 00:00:00, WEEKLY=2, TODAY=0, YDAY=1
[LF] SM472 02JAN: LASTSOLD=2025-12-27 00:00:00, WEEKLY=20, TODAY=4, YDAY=2
[LF] SM460 02JAN: LASTSOLD=2025-12-27 00:00:00, WEEKLY=22, TODAY=3, YDAY=0
2025-12-27 17:40:06 | INFO     | [SUCCESS] Day 02JAN
2025-12-27 17:40:06 | INFO     | [DAY_START] Processing 01JAN
[LF] Processing JED-CAI for 01JAN
2025-12-27 17:40:06 | INFO     | [lf.day.start] Processing JED-CAI for 01JAN
[LF] 01JAN: found 7 direct flights
2025-12-27 17:40:07 | INFO     | [lf.day.flights_found] Found 7 flights on 01JAN
2025-12-27 17:40:09 | INFO     | [lf.flight.extracted] SM424 on 01JAN: BKG=23, LF=13.8%
[LF] SM424 01JAN: BKG=23, GRP=0, CAP=167, LF%=13.8%, Brd-Off=JED-CAI, Classes: U:20, X:3
[LPC] SM424 01JAN: Found 1 outbound flights with connecting passengers
2025-12-27 17:40:13 | INFO     | [lf.flight.extracted] SM472 on 01JAN: BKG=87, LF=53.0%
[LF] SM472 01JAN: BKG=87, GRP=51, CAP=164, LF%=53.0%, Brd-Off=JED-CAI, Classes: P:51, U:20, X:9, T:1, S:6
[LPC] SM472 01JAN: Found 1 outbound flights with connecting passengers
2025-12-27 17:40:18 | INFO     | [lf.flight.extracted] SM450 on 01JAN: BKG=179, LF=107.2%
[LF] SM450 01JAN: BKG=179, GRP=175, CAP=167, LF%=107.2%, Brd-Off=JED-CAI, Classes: N:5, P:46, E:125, U:3
[LPC] SM450 01JAN: Found 1 outbound flights with connecting passengers
2025-12-27 17:40:28 | INFO     | [lf.flight.extracted] SM476 on 01JAN: BKG=168, LF=96.5%
[LF] SM476 01JAN: BKG=168, GRP=128, CAP=174, LF%=96.5%, Brd-Off=JED-CAI, Classes: P:88, E:40, I:5, O:5, U:18, X:8, W:1, S:3
[LPC] SM476 01JAN: Found 3 outbound flights with connecting passengers
2025-12-27 17:40:35 | INFO     | [lf.flight.extracted] SM432 on 01JAN: BKG=0, LF=0.0%
[LF] SM432 01JAN: BKG=0, GRP=0, CAP=167, LF%=0.0%, Brd-Off=JED-ATZ
2025-12-27 17:40:50 | INFO     | [lf.flight.extracted] SM478 on 01JAN: BKG=159, LF=97.0%
[LF] SM478 01JAN: BKG=159, GRP=128, CAP=164, LF%=97.0%, Brd-Off=JED-CAI, Classes: P:128, X:10, T:5, W:10, S:6
[LPC] SM478 01JAN: Found 0 outbound flights with connecting passengers
2025-12-27 17:40:55 | INFO     | [lf.flight.extracted] SM480 on 01JAN: BKG=168, LF=94.4%
[LF] SM480 01JAN: BKG=168, GRP=139, CAP=178, LF%=94.4%, Brd-Off=JED-CAI, Classes: N:6, P:139, X:8, T:2, W:1, S:3, K:9
[LF] Getting WEEKLY/LASTSOLD data for 6 flights
[LF] SM424 01JAN: LASTSOLD=2025-12-26 00:00:00, WEEKLY=10, TODAY=0, YDAY=1
[LF] SM472 01JAN: LASTSOLD=2025-12-27 00:00:00, WEEKLY=21, TODAY=3, YDAY=7
[LF] SM450 01JAN: LASTSOLD=2025-12-21 00:00:00, WEEKLY=46, TODAY=0, YDAY=0
[LF] SM476 01JAN: LASTSOLD=2025-12-23 00:00:00, WEEKLY=28, TODAY=0, YDAY=0
[LF] SM478 01JAN: LASTSOLD=2025-12-26 00:00:00, WEEKLY=22, TODAY=0, YDAY=1
[LF] SM480 01JAN: LASTSOLD=2025-12-26 00:00:00, WEEKLY=3, TODAY=0, YDAY=1
2025-12-27 17:41:20 | INFO     | [SUCCESS] Day 01JAN
2025-12-27 17:41:20 | INFO     | [DAY_START] Processing 31DEC
[LF] Processing JED-CAI for 31DEC
2025-12-27 17:41:20 | INFO     | [lf.day.start] Processing JED-CAI for 31DEC
[LF] 31DEC: found 3 direct flights
2025-12-27 17:41:21 | INFO     | [lf.day.flights_found] Found 3 flights on 31DEC
2025-12-27 17:41:23 | INFO     | [lf.flight.extracted] SM476 on 31DEC: BKG=176, LF=98.9%
[LF] SM476 31DEC: BKG=176, GRP=132, CAP=178, LF%=98.9%, Brd-Off=JED-CAI, Classes: P:132, I:10, O:10, U:21, X:2, L:1
2025-12-27 17:41:26 | INFO     | [lf.flight.extracted] SM460 on 31DEC: BKG=120, LF=67.4%
[LF] SM460 31DEC: BKG=120, GRP=42, CAP=178, LF%=67.4%, Brd-Off=JED-CAI, Classes: P:42, I:10, O:10, U:21, X:24, T:3, W:2, S:8
[LPC] SM460 31DEC: Found 4 outbound flights with connecting passengers
2025-12-27 17:41:30 | INFO     | [lf.flight.extracted] SM478 on 31DEC: BKG=165, LF=92.7%
[LF] SM478 31DEC: BKG=165, GRP=100, CAP=178, LF%=92.7%, Brd-Off=JED-CAI, Classes: P:100, I:10, O:10, U:21, X:18, S:6
[LF] Getting WEEKLY/LASTSOLD data for 3 flights
[LF] SM476 31DEC: LASTSOLD=2025-12-27 00:00:00, WEEKLY=11, TODAY=1, YDAY=0
[LF] SM460 31DEC: LASTSOLD=2025-12-27 00:00:00, WEEKLY=20, TODAY=1, YDAY=0
[LF] SM478 31DEC: LASTSOLD=2025-12-27 00:00:00, WEEKLY=16, TODAY=1, YDAY=0
2025-12-27 17:41:45 | INFO     | [SUCCESS] Day 31DEC
2025-12-27 17:41:45 | INFO     | [DAY_START] Processing 30DEC
[LF] Processing JED-CAI for 30DEC
2025-12-27 17:41:45 | INFO     | [lf.day.start] Processing JED-CAI for 30DEC
[LF] 30DEC: found 6 direct flights
2025-12-27 17:41:45 | INFO     | [lf.day.flights_found] Found 6 flights on 30DEC
2025-12-27 17:41:47 | INFO     | [lf.flight.extracted] SM472 on 30DEC: BKG=160, LF=89.9%
[LF] SM472 30DEC: BKG=160, GRP=89, CAP=178, LF%=89.9%, Brd-Off=JED-CAI, Classes: P:89, I:20, O:10, U:11, X:8, T:21, K:1
[LPC] SM472 30DEC: Found 2 outbound flights with connecting passengers
2025-12-27 17:41:52 | INFO     | [lf.flight.extracted] SM480 on 30DEC: BKG=175, LF=98.3%
[LF] SM480 30DEC: BKG=175, GRP=141, CAP=178, LF%=98.3%, Brd-Off=JED-CAI, Classes: P:141, I:17, O:11, U:6
2025-12-27 17:41:55 | INFO     | [lf.flight.extracted] SM478 on 30DEC: BKG=170, LF=95.5%
[LF] SM478 30DEC: BKG=170, GRP=123, CAP=178, LF%=95.5%, Brd-Off=JED-CAI, Classes: P:78, E:45, I:21, O:10, U:11, X:4, S:1
[LPC] SM478 30DEC: Found 1 outbound flights with connecting passengers
2025-12-27 17:42:00 | INFO     | [lf.flight.extracted] SM460 on 30DEC: BKG=168, LF=96.0%
[LF] SM460 30DEC: BKG=168, GRP=94, CAP=175, LF%=96.0%, Brd-Off=JED-CAI, Classes: N:1, P:94, I:20, O:10, U:11, X:20, T:4, W:2, S:6
2025-12-27 17:42:03 | INFO     | [lf.flight.extracted] SM424 on 30DEC: BKG=174, LF=97.8%
[LF] SM424 30DEC: BKG=174, GRP=133, CAP=178, LF%=97.8%, Brd-Off=JED-CAI, Classes: P:88, E:45, I:20, O:10, U:10, V:1
2025-12-27 17:42:06 | INFO     | [lf.flight.extracted] SM476 on 30DEC: BKG=173, LF=98.9%
[LF] SM476 30DEC: BKG=173, GRP=100, CAP=175, LF%=98.9%, Brd-Off=JED-CAI, Classes: P:101, I:20, O:9, U:11, X:25, T:2, W:2, S:3
[LF] Getting WEEKLY/LASTSOLD data for 6 flights
[LF] SM472 30DEC: LASTSOLD=2025-12-27 00:00:00, WEEKLY=17, TODAY=2, YDAY=1
[LF] SM480 30DEC: LASTSOLD=2025-12-24 00:00:00, WEEKLY=8, TODAY=0, YDAY=0
[LF] SM478 30DEC: LASTSOLD=2025-12-24 00:00:00, WEEKLY=10, TODAY=0, YDAY=0
[LF] SM460 30DEC: LASTSOLD=2025-12-27 00:00:00, WEEKLY=19, TODAY=3, YDAY=0
[LF] SM424 30DEC: LASTSOLD=2025-12-24 00:00:00, WEEKLY=10, TODAY=0, YDAY=0
[LF] SM476 30DEC: LASTSOLD=2025-12-27 00:00:00, WEEKLY=16, TODAY=1, YDAY=1
2025-12-27 17:42:35 | INFO     | [SUCCESS] Day 30DEC
2025-12-27 17:42:35 | INFO     | [DAY_START] Processing 29DEC
[LF] Processing JED-CAI for 29DEC
2025-12-27 17:42:35 | INFO     | [lf.day.start] Processing JED-CAI for 29DEC
[LF] 29DEC: found 4 direct flights
2025-12-27 17:42:36 | INFO     | [lf.day.flights_found] Found 4 flights on 29DEC
2025-12-27 17:42:37 | INFO     | [lf.flight.extracted] SM480 on 29DEC: BKG=106, LF=59.6%
[LF] SM480 29DEC: BKG=106, GRP=0, CAP=178, LF%=59.6%, Brd-Off=JED-CAI, Classes: I:35, O:38, U:16, X:14, S:2, L:1
[LPC] SM480 29DEC: Found 2 outbound flights with connecting passengers
2025-12-27 17:42:42 | INFO     | [lf.flight.extracted] SM476 on 29DEC: BKG=171, LF=96.1%
[LF] SM476 29DEC: BKG=171, GRP=138, CAP=178, LF%=96.1%, Brd-Off=JED-CAI, Classes: P:138, I:20, O:10, S:2, G:1
2025-12-27 17:42:45 | INFO     | [lf.flight.extracted] SM478 on 29DEC: BKG=176, LF=100.6%
[LF] SM478 29DEC: BKG=176, GRP=129, CAP=175, LF%=100.6%, Brd-Off=JED-CAI, Classes: P:129, I:17, O:10, U:11, X:1, T:7, S:1
2025-12-27 17:42:48 | INFO     | [lf.flight.extracted] SM460 on 29DEC: BKG=177, LF=101.1%
[LF] SM460 29DEC: BKG=177, GRP=131, CAP=175, LF%=101.1%, Brd-Off=JED-CAI, Classes: P:131, I:16, O:1, X:1, W:3, S:22, G:3
[LPC] SM460 29DEC: Found 0 outbound flights with connecting passengers
[LF] Getting WEEKLY/LASTSOLD data for 4 flights
[LF] SM480 29DEC: LASTSOLD=2025-12-27 00:00:00, WEEKLY=43, TODAY=5, YDAY=3
[LF] SM476 29DEC: LASTSOLD=2025-12-23 00:00:00, WEEKLY=10, TODAY=0, YDAY=0
[LF] SM478 29DEC: LASTSOLD=2025-12-22 00:00:00, WEEKLY=8, TODAY=0, YDAY=0
[LF] SM460 29DEC: LASTSOLD=2025-12-25 00:00:00, WEEKLY=11, TODAY=0, YDAY=0
2025-12-27 17:43:10 | INFO     | [SUCCESS] Day 29DEC
2025-12-27 17:43:10 | INFO     | [DAY_START] Processing 28DEC
[LF] Processing JED-CAI for 28DEC
2025-12-27 17:43:10 | INFO     | [lf.day.start] Processing JED-CAI for 28DEC
[LF] 28DEC: 1 cancelled flight(s) detected from SN
[LF] 28DEC: found 4 direct flights
2025-12-27 17:43:11 | INFO     | [lf.day.flights_found] Found 4 flights on 28DEC
2025-12-27 17:43:13 | INFO     | [lf.flight.extracted] SM424 on 28DEC: BKG=177, LF=101.1%
[LF] SM424 28DEC: BKG=177, GRP=129, CAP=175, LF%=101.1%, Brd-Off=JED-CAI, Classes: N:2, P:27, E:100, I:25, O:14, U:5, X:1, S:3
[LPC] SM424 28DEC: Found 2 outbound flights with connecting passengers
2025-12-27 17:43:22 | INFO     | [lf.flight.extracted] SM476 on 28DEC: BKG=177, LF=99.4%
[LF] SM476 28DEC: BKG=177, GRP=145, CAP=178, LF%=99.4%, Brd-Off=JED-CAI, Classes: P:96, E:50, I:19, O:10, T:1, W:1
2025-12-27 17:43:25 | INFO     | [lf.flight.extracted] SM460 on 28DEC: BKG=177, LF=102.9%
[LF] SM460 28DEC: BKG=177, GRP=130, CAP=172, LF%=102.9%, Brd-Off=JED-CAI, Classes: P:130, I:18, O:10, U:9, X:1, S:9
[LPC] SM460 28DEC: Found 0 outbound flights with connecting passengers
2025-12-27 17:43:29 | INFO     | [lf.flight.extracted] SM478 on 28DEC: BKG=173, LF=97.2%
[LF] SM478 28DEC: BKG=173, GRP=130, CAP=178, LF%=97.2%, Brd-Off=JED-CAI, Classes: P:130, I:20, O:9, U:4, X:7, S:2, L:1
[LF] Getting WEEKLY/LASTSOLD data for 4 flights
[LF] SM424 28DEC: LASTSOLD=2025-12-24 00:00:00, WEEKLY=18, TODAY=0, YDAY=0
[LF] SM476 28DEC: LASTSOLD=2025-12-26 00:00:00, WEEKLY=11, TODAY=0, YDAY=1
[LF] SM460 28DEC: LASTSOLD=2025-12-23 00:00:00, WEEKLY=12, TODAY=0, YDAY=0
[LF] SM478 28DEC: LASTSOLD=2025-12-27 00:00:00, WEEKLY=17, TODAY=3, YDAY=4
2025-12-27 17:43:48 | INFO     | [SUCCESS] Day 28DEC
[LF] Results summary:
  2026-01-03: 3 flights
  2026-01-02: 5 flights
  2026-01-01: 7 flights
  2025-12-31: 3 flights
  2025-12-30: 6 flights
  2025-12-29: 4 flights
  2025-12-28: 4 flights
[LF] Cancelled flights found: 3
  - SM952 02JAN (SN)
  - SM478 02JAN (SN)
  - SM432 28DEC (SN)
2025-12-27 17:43:48 | INFO     | [SUCCESS] LF Search Complete
[Worker_9232] Cancelled flights collected: 3

============================================================
[Worker_9232] ✓ COMPLETED: JED-CAI
  Results: 7 dates
  Errors: 0 dates
  Total Processed: 4 groups
============================================================

2025-12-27 17:43:50 | INFO     | [Worker_9232] Completed: JED-CAI - 7 results, 0 errors
[Worker_9232] Waiting for tasks...

============================================================
[Worker_9232] Shutdown signal received
Exiting...
============================================================
2025-12-27 17:48:10 | INFO     | [Worker_9232] Shutdown signal received, exiting...

============================================================
[Worker_9232] FINISHED
  Total Groups Processed: 4
============================================================

2025-12-27 17:48:10 | INFO     | [Worker_9232] Finished. Processed 4 groups.
