
============================================================
     LF WORKER - PORT 9227
============================================================
Worker: Worker_9227
Status: READY
Waiting for tasks...
============================================================


============================================================
[Worker_9227] Processing: CAI-RUH
  Tier 0: Range 2, Chunk 1/3
  Dates: 4 days
  Date Range: 2026-01-21 to 2026-01-18
============================================================

2025-12-29 07:26:11 | INFO     | ======================================================================
2025-12-29 07:26:11 | INFO     | Load Factor Scraper Started - Route: CAI-RUH
2025-12-29 07:26:11 | INFO     | Log file: D:\CODERED\LAB\market_insights\outputs\run_generated_291225_at_07.25\logs\LF_CAI-RUH_20251229_072611.log
2025-12-29 07:26:11 | INFO     | Enhanced logging: Capturing both logging.info() and print()
2025-12-29 07:26:11 | INFO     | ======================================================================
[LF] Processing dates (override): ['21JAN', '20JAN', '19JAN', '18JAN']
[LF] Attaching to Chrome for Altea access
[LF][[OK] SUCCESS] Connected to Chrome on 127.0.0.1:9227 (after 1 attempts)
[LF][[OK] SUCCESS] Found Amadeus Altea window: Altéa Reservation Desktop
[LF][[INFO] INFO] URL: https://tc212.resdesktop.altea.amadeus.com/app_ard/apf/init/login?SITE=ESMPESMP&LANGUAGE=GB&MARKETS=ARDW_PROD_WBP&ACTION=clpLogin
[LF] Processing CAI-RUH for 21JAN
[LF][ERROR] Amadeus command error detected: UNKNOWN TRANSACTION
[LF][ERROR] Command: SN21JANCAIRUH/ASM
[LF][RESYNC] Triggering immediate resync to last successful SN command
============================================================
[LF][RESYNC] Command 'SN21JANCAIRUH/ASM' failed: TECH_ERROR:UNKNOWN TRANSACTION
[LF][RESYNC] Re-running entire day from SN command for CAI-RUH 21JAN
[LF][RESYNC] Attempt 1/50 (waiting 1.0s before retry...)
============================================================
[LF][RESYNC] Sending IG to clear session state...
[LF][RESYNC] Session cleared with IG
[LF] Processing CAI-RUH for 21JAN
[LF] 21JAN: found 2 direct flights
[LF] SM461 21JAN: BKG=40, GRP=0, CAP=179, LF%=22.4%, Brd-Off=CAI-RUH, Classes: O:20, U:10, X:10
[LF] SM469 21JAN: BKG=54, GRP=0, CAP=179, LF%=30.2%, Brd-Off=CAI-RUH, Classes: O:19, U:15, X:15, T:5
[LF] Getting WEEKLY/LASTSOLD data for 2 flights
[LF] SM461 21JAN: LASTSOLD=2025-12-29 00:00:00, WEEKLY=19, TODAY=1, YDAY=0
[LF] SM469 21JAN: LASTSOLD=2025-12-28 00:00:00, WEEKLY=19, TODAY=0, YDAY=5
[LF] Processing CAI-RUH for 20JAN
[LF] 20JAN: found 1 direct flights
[LF] SM469 20JAN: BKG=51, GRP=0, CAP=179, LF%=28.5%, Brd-Off=CAI-RUH, Classes: O:20, U:15, X:10, T:6
[LF] Getting WEEKLY/LASTSOLD data for 1 flights
[LF] SM469 20JAN: LASTSOLD=2025-12-28 00:00:00, WEEKLY=12, TODAY=0, YDAY=4
[LF] Processing CAI-RUH for 19JAN
[LF] 19JAN: found 1 direct flights
[LF] SM469 19JAN: BKG=34, GRP=0, CAP=179, LF%=19.0%, Brd-Off=CAI-RUH, Classes: O:5, U:8, X:6, T:10, W:5
[LF] Getting WEEKLY/LASTSOLD data for 1 flights
[LF] SM469 19JAN: LASTSOLD=2025-12-26 00:00:00, WEEKLY=7, TODAY=0, YDAY=0
[LF] Processing CAI-RUH for 18JAN
[LF] 18JAN: found 1 direct flights
[LF] SM461 18JAN: BKG=45, GRP=0, CAP=179, LF%=25.1%, Brd-Off=CAI-RUH, Classes: O:1, U:6, X:9, T:9, W:11, S:2, G:7
[LF] Getting WEEKLY/LASTSOLD data for 1 flights
[LF] SM461 18JAN: LASTSOLD=2025-12-20 00:00:00, WEEKLY=0, TODAY=0, YDAY=0
[LF] Results summary:
  2026-01-21: 2 flights
  2026-01-20: 1 flights
  2026-01-19: 1 flights
  2026-01-18: 1 flights

============================================================
[Worker_9227] ✓ COMPLETED: CAI-RUH
  Results: 4 dates
  Errors: 0 dates
  Total Processed: 1 groups
============================================================


============================================================
[Worker_9227] Processing: ATZ-RUH
  Tier 0: Range 2, Chunk 3/3
  Dates: 3 days
  Date Range: 2026-01-13 to 2026-01-11
============================================================

2025-12-29 07:26:56 | INFO     | ======================================================================
2025-12-29 07:26:56 | INFO     | Load Factor Scraper Started - Route: ATZ-RUH
2025-12-29 07:26:56 | INFO     | Log file: D:\CODERED\LAB\market_insights\outputs\run_generated_291225_at_07.25\logs\LF_ATZ-RUH_20251229_072656.log
2025-12-29 07:26:56 | INFO     | Enhanced logging: Capturing both logging.info() and print()
2025-12-29 07:26:56 | INFO     | ======================================================================
[LF] Processing dates (override): ['13JAN', '12JAN', '11JAN']
[LF] Attaching to Chrome for Altea access
2025-12-29 07:26:56 | INFO     | Starting LF search for route: ATZ-RUH
2025-12-29 07:26:56 | INFO     | [START] LF Search
[LF][[OK] SUCCESS] Connected to Chrome on 127.0.0.1:9227 (after 1 attempts)
2025-12-29 07:26:57 | INFO     | [HEALTH CHECK] [OK] Chrome connection is healthy
[LF][[OK] SUCCESS] Found Amadeus Altea window: Altéa Reservation Desktop
[LF][[INFO] INFO] URL: https://tc212.resdesktop.altea.amadeus.com/app_ard/apf/init/login?SITE=ESMPESMP&LANGUAGE=GB&MARKETS=ARDW_PROD_WBP&ACTION=clpLogin
2025-12-29 07:26:58 | INFO     | [DAY_START] Processing 13JAN
[LF] Processing ATZ-RUH for 13JAN
2025-12-29 07:26:58 | INFO     | [lf.day.start] Processing ATZ-RUH for 13JAN
[LF] 13JAN: found 1 direct flights
2025-12-29 07:26:58 | INFO     | [lf.day.flights_found] Found 1 flights on 13JAN
2025-12-29 07:27:01 | INFO     | [lf.flight.extracted] SM463 on 13JAN: BKG=69, LF=38.6%
[LF] SM463 13JAN: BKG=69, GRP=0, CAP=179, LF%=38.6%, Brd-Off=ATZ-RUH, Classes: I:4, O:4, X:13, T:20, W:7, S:9, G:11, L:1
[LF] Getting WEEKLY/LASTSOLD data for 1 flights
[LF] SM463 13JAN: LASTSOLD=2025-12-28 00:00:00, WEEKLY=15, TODAY=0, YDAY=4
2025-12-29 07:27:05 | INFO     | [SUCCESS] Day 13JAN
2025-12-29 07:27:05 | INFO     | [DAY_START] Processing 12JAN
[LF] Processing ATZ-RUH for 12JAN
2025-12-29 07:27:05 | INFO     | [lf.day.start] Processing ATZ-RUH for 12JAN
[LF] No direct flights on 12JAN for ATZ-RUH
2025-12-29 07:27:06 | WARNING  | [lf.day.no_flights] No direct flights on 12JAN
2025-12-29 07:27:07 | INFO     | [SUCCESS] Day 12JAN
2025-12-29 07:27:07 | INFO     | [DAY_START] Processing 11JAN
[LF] Processing ATZ-RUH for 11JAN
2025-12-29 07:27:07 | INFO     | [lf.day.start] Processing ATZ-RUH for 11JAN
[LF] 11JAN: found 1 direct flights
2025-12-29 07:27:08 | INFO     | [lf.day.flights_found] Found 1 flights on 11JAN
2025-12-29 07:27:10 | INFO     | [lf.flight.extracted] SM463 on 11JAN: BKG=82, LF=45.8%
[LF] SM463 11JAN: BKG=82, GRP=0, CAP=179, LF%=45.8%, Brd-Off=ATZ-RUH, Classes: I:1, O:4, U:3, X:12, T:10, W:10, S:28, G:13, L:1
[LF] Getting WEEKLY/LASTSOLD data for 1 flights
[LF] SM463 11JAN: LASTSOLD=2025-12-27 00:00:00, WEEKLY=33, TODAY=0, YDAY=0
2025-12-29 07:27:15 | INFO     | [SUCCESS] Day 11JAN
[LF] Results summary:
  2026-01-13: 1 flights
  2026-01-12: 0 flights
  2026-01-11: 1 flights
2025-12-29 07:27:15 | INFO     | [SUCCESS] LF Search Complete

============================================================
[Worker_9227] ✓ COMPLETED: ATZ-RUH
  Results: 3 dates
  Errors: 0 dates
  Total Processed: 2 groups
============================================================

2025-12-29 07:27:17 | INFO     | [Worker_9227] Completed: ATZ-RUH - 3 results, 0 errors

============================================================
[Worker_9227] Processing: CAI-RUH
  Tier 0: Range 1, Chunk 1/3
  Dates: 5 days
  Date Range: 2026-01-10 to 2026-01-06
============================================================

2025-12-29 07:27:17 | INFO     | [Worker_9227] Processing: CAI-RUH
2025-12-29 07:27:17 | INFO     |   Tier 0: Range 1, Chunk 1/3 (5 days)
2025-12-29 07:27:17 | INFO     | ======================================================================
2025-12-29 07:27:17 | INFO     | Load Factor Scraper Started - Route: CAI-RUH
2025-12-29 07:27:17 | INFO     | Log file: D:\CODERED\LAB\market_insights\outputs\run_generated_291225_at_07.25\logs\LF_CAI-RUH_20251229_072717.log
2025-12-29 07:27:17 | INFO     | Enhanced logging: Capturing both logging.info() and print()
2025-12-29 07:27:17 | INFO     | ======================================================================
[LF] Processing dates (override): ['10JAN', '09JAN', '08JAN', '07JAN', '06JAN']
[LF] Attaching to Chrome for Altea access
2025-12-29 07:27:17 | INFO     | Starting LF search for route: CAI-RUH
2025-12-29 07:27:17 | INFO     | [START] LF Search
[LF][[OK] SUCCESS] Connected to Chrome on 127.0.0.1:9227 (after 1 attempts)
2025-12-29 07:27:18 | INFO     | [HEALTH CHECK] [OK] Chrome connection is healthy
[LF][[OK] SUCCESS] Found Amadeus Altea window: Altéa Reservation Desktop
[LF][[INFO] INFO] URL: https://tc212.resdesktop.altea.amadeus.com/app_ard/apf/init/login?SITE=ESMPESMP&LANGUAGE=GB&MARKETS=ARDW_PROD_WBP&ACTION=clpLogin
2025-12-29 07:27:18 | INFO     | [DAY_START] Processing 10JAN
[LF] Processing CAI-RUH for 10JAN
2025-12-29 07:27:18 | INFO     | [lf.day.start] Processing CAI-RUH for 10JAN
[LF] 10JAN: found 1 direct flights
2025-12-29 07:27:19 | INFO     | [lf.day.flights_found] Found 1 flights on 10JAN
2025-12-29 07:27:21 | INFO     | [lf.flight.extracted] SM461 on 10JAN: BKG=51, LF=28.5%
[LF] SM461 10JAN: BKG=51, GRP=0, CAP=179, LF%=28.5%, Brd-Off=CAI-RUH, Classes: I:5, O:9, U:19, X:18
[LF] Getting WEEKLY/LASTSOLD data for 1 flights
[LF] SM461 10JAN: LASTSOLD=2025-12-28 00:00:00, WEEKLY=23, TODAY=0, YDAY=1
2025-12-29 07:27:25 | INFO     | [SUCCESS] Day 10JAN
2025-12-29 07:27:25 | INFO     | [DAY_START] Processing 09JAN
[LF] Processing CAI-RUH for 09JAN
2025-12-29 07:27:25 | INFO     | [lf.day.start] Processing CAI-RUH for 09JAN
[LF] 09JAN: found 2 direct flights
2025-12-29 07:27:26 | INFO     | [lf.day.flights_found] Found 2 flights on 09JAN
2025-12-29 07:27:28 | INFO     | [lf.flight.extracted] SM461 on 09JAN: BKG=50, LF=27.9%
[LF] SM461 09JAN: BKG=50, GRP=0, CAP=179, LF%=27.9%, Brd-Off=CAI-RUH, Classes: I:15, O:15, U:15, X:5
2025-12-29 07:27:31 | INFO     | [lf.flight.extracted] SM469 on 09JAN: BKG=41, LF=22.9%
[LF] SM469 09JAN: BKG=41, GRP=0, CAP=179, LF%=22.9%, Brd-Off=CAI-RUH, Classes: I:4, O:10, U:19, X:7, S:1
[LF] Getting WEEKLY/LASTSOLD data for 2 flights
[LF] SM461 09JAN: LASTSOLD=2025-12-28 00:00:00, WEEKLY=12, TODAY=0, YDAY=2
[LF] SM469 09JAN: LASTSOLD=2025-12-28 00:00:00, WEEKLY=14, TODAY=0, YDAY=1
2025-12-29 07:27:38 | INFO     | [SUCCESS] Day 09JAN
2025-12-29 07:27:38 | INFO     | [DAY_START] Processing 08JAN
[LF] Processing CAI-RUH for 08JAN
2025-12-29 07:27:38 | INFO     | [lf.day.start] Processing CAI-RUH for 08JAN
[LF] 08JAN: found 1 direct flights
2025-12-29 07:27:40 | INFO     | [lf.day.flights_found] Found 1 flights on 08JAN
2025-12-29 07:27:42 | INFO     | [lf.flight.extracted] SM461 on 08JAN: BKG=77, LF=43.0%
[LF] SM461 08JAN: BKG=77, GRP=0, CAP=179, LF%=43.0%, Brd-Off=CAI-RUH, Classes: I:15, O:45, U:15, X:2
[LF] Getting WEEKLY/LASTSOLD data for 1 flights
[LF] SM461 08JAN: LASTSOLD=2025-12-28 00:00:00, WEEKLY=46, TODAY=0, YDAY=6
2025-12-29 07:27:47 | INFO     | [SUCCESS] Day 08JAN
2025-12-29 07:27:47 | INFO     | [DAY_START] Processing 07JAN
[LF] Processing CAI-RUH for 07JAN
2025-12-29 07:27:47 | INFO     | [lf.day.start] Processing CAI-RUH for 07JAN
[LF] 07JAN: found 2 direct flights
2025-12-29 07:27:48 | INFO     | [lf.day.flights_found] Found 2 flights on 07JAN
2025-12-29 07:27:51 | INFO     | [lf.flight.extracted] SM461 on 07JAN: BKG=77, LF=43.0%
[LF] SM461 07JAN: BKG=77, GRP=0, CAP=179, LF%=43.0%, Brd-Off=CAI-RUH, Classes: I:15, O:45, U:15, X:1, S:1
2025-12-29 07:27:55 | INFO     | [lf.flight.extracted] SM469 on 07JAN: BKG=52, LF=29.0%
[LF] SM469 07JAN: BKG=52, GRP=0, CAP=179, LF%=29.0%, Brd-Off=CAI-RUH, Classes: I:11, O:20, U:14, X:6, W:1
[LF] Getting WEEKLY/LASTSOLD data for 2 flights
[LF] SM461 07JAN: LASTSOLD=2025-12-28 00:00:00, WEEKLY=48, TODAY=0, YDAY=11
[LF] SM469 07JAN: LASTSOLD=2025-12-28 00:00:00, WEEKLY=20, TODAY=0, YDAY=5
2025-12-29 07:28:04 | INFO     | [SUCCESS] Day 07JAN
2025-12-29 07:28:04 | INFO     | [DAY_START] Processing 06JAN
[LF] Processing CAI-RUH for 06JAN
2025-12-29 07:28:04 | INFO     | [lf.day.start] Processing CAI-RUH for 06JAN
[LF] 06JAN: found 1 direct flights
2025-12-29 07:28:05 | INFO     | [lf.day.flights_found] Found 1 flights on 06JAN
2025-12-29 07:28:07 | INFO     | [lf.flight.extracted] SM469 on 06JAN: BKG=70, LF=39.1%
[LF] SM469 06JAN: BKG=70, GRP=0, CAP=179, LF%=39.1%, Brd-Off=CAI-RUH, Classes: I:5, O:30, U:15, X:14, T:6
[LF] Getting WEEKLY/LASTSOLD data for 1 flights
[LF] SM469 06JAN: LASTSOLD=2025-12-28 00:00:00, WEEKLY=27, TODAY=0, YDAY=9
2025-12-29 07:28:12 | INFO     | [SUCCESS] Day 06JAN
[LF] Results summary:
  2026-01-10: 1 flights
  2026-01-09: 2 flights
  2026-01-08: 1 flights
  2026-01-07: 2 flights
  2026-01-06: 1 flights
2025-12-29 07:28:12 | INFO     | [SUCCESS] LF Search Complete

============================================================
[Worker_9227] ✓ COMPLETED: CAI-RUH
  Results: 5 dates
  Errors: 0 dates
  Total Processed: 3 groups
============================================================

2025-12-29 07:28:14 | INFO     | [Worker_9227] Completed: CAI-RUH - 5 results, 0 errors

============================================================
[Worker_9227] Processing: JED-CAI
  Tier 0: Range 1, Chunk 3/3
  Dates: 4 days
  Date Range: 2026-01-01 to 2025-12-29
============================================================

2025-12-29 07:28:14 | INFO     | [Worker_9227] Processing: JED-CAI
2025-12-29 07:28:14 | INFO     |   Tier 0: Range 1, Chunk 3/3 (4 days)
2025-12-29 07:28:14 | INFO     | ======================================================================
2025-12-29 07:28:14 | INFO     | Load Factor Scraper Started - Route: JED-CAI
2025-12-29 07:28:14 | INFO     | Log file: D:\CODERED\LAB\market_insights\outputs\run_generated_291225_at_07.25\logs\LF_JED-CAI_20251229_072814.log
2025-12-29 07:28:14 | INFO     | Enhanced logging: Capturing both logging.info() and print()
2025-12-29 07:28:14 | INFO     | ======================================================================
[LF] Processing dates (override): ['01JAN', '31DEC', '30DEC', '29DEC']
[LF] Attaching to Chrome for Altea access
2025-12-29 07:28:14 | INFO     | Starting LF search for route: JED-CAI
2025-12-29 07:28:14 | INFO     | [START] LF Search
[LF][[OK] SUCCESS] Connected to Chrome on 127.0.0.1:9227 (after 1 attempts)
2025-12-29 07:28:15 | INFO     | [HEALTH CHECK] [OK] Chrome connection is healthy
[LF][[OK] SUCCESS] Found Amadeus Altea window: Altéa Reservation Desktop
[LF][[INFO] INFO] URL: https://tc212.resdesktop.altea.amadeus.com/app_ard/apf/init/login?SITE=ESMPESMP&LANGUAGE=GB&MARKETS=ARDW_PROD_WBP&ACTION=clpLogin
2025-12-29 07:28:15 | INFO     | [DAY_START] Processing 01JAN
[LF] Processing JED-CAI for 01JAN
2025-12-29 07:28:15 | INFO     | [lf.day.start] Processing JED-CAI for 01JAN
[LF] 01JAN: found 7 direct flights
2025-12-29 07:28:16 | INFO     | [lf.day.flights_found] Found 7 flights on 01JAN
2025-12-29 07:28:18 | INFO     | [lf.flight.extracted] SM424 on 01JAN: BKG=33, LF=19.8%
[LF] SM424 01JAN: BKG=33, GRP=0, CAP=167, LF%=19.8%, Brd-Off=JED-CAI, Classes: U:20, X:13
[LPC] SM424 01JAN: Found 2 outbound flights with connecting passengers
2025-12-29 07:28:24 | INFO     | [lf.flight.extracted] SM472 on 01JAN: BKG=100, LF=58.1%
[LF] SM472 01JAN: BKG=100, GRP=51, CAP=172, LF%=58.1%, Brd-Off=JED-CAI, Classes: P:51, U:20, X:20, T:3, S:6
[LPC] SM472 01JAN: Found 1 outbound flights with connecting passengers
2025-12-29 07:28:29 | INFO     | [lf.flight.extracted] SM450 on 01JAN: BKG=178, LF=106.6%
[LF] SM450 01JAN: BKG=178, GRP=175, CAP=167, LF%=106.6%, Brd-Off=JED-CAI, Classes: N:5, P:46, E:125, U:2
[LPC] SM450 01JAN: Found 1 outbound flights with connecting passengers
2025-12-29 07:28:40 | INFO     | [lf.flight.extracted] SM476 on 01JAN: BKG=174, LF=100.0%
[LF] SM476 01JAN: BKG=174, GRP=128, CAP=174, LF%=100.0%, Brd-Off=JED-CAI, Classes: P:88, E:40, I:5, O:5, U:18, X:13, W:1, S:3, K:1
[LPC] SM476 01JAN: Found 3 outbound flights with connecting passengers
2025-12-29 07:28:49 | INFO     | [lf.flight.extracted] SM432 on 01JAN: BKG=0, LF=0.0%
[LF] SM432 01JAN: BKG=0, GRP=0, CAP=175, LF%=0.0%, Brd-Off=JED-ATZ
2025-12-29 07:29:06 | INFO     | [lf.flight.extracted] SM478 on 01JAN: BKG=162, LF=92.6%
[LF] SM478 01JAN: BKG=162, GRP=128, CAP=175, LF%=92.6%, Brd-Off=JED-CAI, Classes: P:128, X:10, T:7, W:11, S:6
[LPC] SM478 01JAN: Found 0 outbound flights with connecting passengers
2025-12-29 07:29:11 | INFO     | [lf.flight.extracted] SM480 on 01JAN: BKG=168, LF=101.8%
[LF] SM480 01JAN: BKG=168, GRP=139, CAP=165, LF%=101.8%, Brd-Off=JED-CAI, Classes: N:6, P:139, X:8, T:2, W:1, S:3, K:9
[LF] Getting WEEKLY/LASTSOLD data for 6 flights
[LF] SM424 01JAN: LASTSOLD=2025-12-28 00:00:00, WEEKLY=20, TODAY=0, YDAY=10
[LF] SM472 01JAN: LASTSOLD=2025-12-28 00:00:00, WEEKLY=34, TODAY=0, YDAY=8
[LF] SM450 01JAN: LASTSOLD=2025-12-21 00:00:00, WEEKLY=0, TODAY=0, YDAY=0
[LF] SM476 01JAN: LASTSOLD=2025-12-28 00:00:00, WEEKLY=11, TODAY=0, YDAY=6
[LF] SM478 01JAN: LASTSOLD=2025-12-28 00:00:00, WEEKLY=15, TODAY=0, YDAY=2
[LF] SM480 01JAN: LASTSOLD=2025-12-26 00:00:00, WEEKLY=3, TODAY=0, YDAY=0
2025-12-29 07:29:38 | INFO     | [SUCCESS] Day 01JAN
2025-12-29 07:29:38 | INFO     | [DAY_START] Processing 31DEC
[LF] Processing JED-CAI for 31DEC
2025-12-29 07:29:38 | INFO     | [lf.day.start] Processing JED-CAI for 31DEC
[LF] 31DEC: found 3 direct flights
2025-12-29 07:29:39 | INFO     | [lf.day.flights_found] Found 3 flights on 31DEC
2025-12-29 07:29:41 | INFO     | [lf.flight.extracted] SM476 on 31DEC: BKG=173, LF=97.2%
[LF] SM476 31DEC: BKG=173, GRP=130, CAP=178, LF%=97.2%, Brd-Off=JED-CAI, Classes: P:130, I:10, O:10, U:21, X:2
2025-12-29 07:29:45 | INFO     | [lf.flight.extracted] SM460 on 31DEC: BKG=166, LF=93.3%
[LF] SM460 31DEC: BKG=166, GRP=42, CAP=178, LF%=93.3%, Brd-Off=JED-CAI, Classes: P:42, I:10, O:20, U:40, X:40, T:3, W:3, S:8
[LPC] SM460 31DEC: Found 4 outbound flights with connecting passengers
2025-12-29 07:29:49 | INFO     | [lf.flight.extracted] SM478 on 31DEC: BKG=165, LF=92.7%
[LF] SM478 31DEC: BKG=165, GRP=101, CAP=178, LF%=92.7%, Brd-Off=JED-CAI, Classes: P:101, I:10, O:10, U:21, X:17, S:6
[LF] Getting WEEKLY/LASTSOLD data for 3 flights
[LF] SM476 31DEC: LASTSOLD=2025-12-25 00:00:00, WEEKLY=10, TODAY=0, YDAY=0
[LF] SM460 31DEC: LASTSOLD=2025-12-28 00:00:00, WEEKLY=64, TODAY=0, YDAY=45
[LF] SM478 31DEC: LASTSOLD=2025-12-28 00:00:00, WEEKLY=16, TODAY=0, YDAY=2
2025-12-29 07:30:05 | INFO     | [SUCCESS] Day 31DEC
2025-12-29 07:30:05 | INFO     | [DAY_START] Processing 30DEC
[LF] Processing JED-CAI for 30DEC
2025-12-29 07:30:05 | INFO     | [lf.day.start] Processing JED-CAI for 30DEC
[LF] 30DEC: found 6 direct flights
2025-12-29 07:30:06 | INFO     | [lf.day.flights_found] Found 6 flights on 30DEC
2025-12-29 07:30:09 | INFO     | [lf.flight.extracted] SM472 on 30DEC: BKG=175, LF=98.3%
[LF] SM472 30DEC: BKG=175, GRP=89, CAP=178, LF%=98.3%, Brd-Off=JED-CAI, Classes: P:89, I:20, O:10, U:11, X:8, T:31, W:5, K:1
[LPC] SM472 30DEC: Found 2 outbound flights with connecting passengers
2025-12-29 07:30:14 | INFO     | [lf.flight.extracted] SM480 on 30DEC: BKG=178, LF=100.0%
[LF] SM480 30DEC: BKG=178, GRP=140, CAP=178, LF%=100.0%, Brd-Off=JED-CAI, Classes: P:140, I:18, O:11, U:6, T:3
2025-12-29 07:30:17 | INFO     | [lf.flight.extracted] SM478 on 30DEC: BKG=174, LF=101.2%
[LF] SM478 30DEC: BKG=174, GRP=123, CAP=172, LF%=101.2%, Brd-Off=JED-CAI, Classes: P:78, E:45, I:21, O:10, U:11, X:4, T:3, S:1, G:1
[LPC] SM478 30DEC: Found 1 outbound flights with connecting passengers
2025-12-29 07:30:22 | INFO     | [lf.flight.extracted] SM460 on 30DEC: BKG=167, LF=93.3%
[LF] SM460 30DEC: BKG=167, GRP=94, CAP=179, LF%=93.3%, Brd-Off=JED-CAI, Classes: N:1, P:94, I:20, O:10, U:11, X:20, T:3, W:1, S:7
2025-12-29 07:30:25 | INFO     | [lf.flight.extracted] SM424 on 30DEC: BKG=174, LF=101.2%
[LF] SM424 30DEC: BKG=174, GRP=133, CAP=172, LF%=101.2%, Brd-Off=JED-CAI, Classes: P:88, E:45, I:20, O:10, U:10, V:1
2025-12-29 07:30:29 | INFO     | [lf.flight.extracted] SM476 on 30DEC: BKG=174, LF=99.4%
[LF] SM476 30DEC: BKG=174, GRP=100, CAP=175, LF%=99.4%, Brd-Off=JED-CAI, Classes: P:101, I:20, O:9, U:10, X:25, T:2, W:3, S:4
[LF] Getting WEEKLY/LASTSOLD data for 6 flights
[LF] SM472 30DEC: LASTSOLD=2025-12-29 00:00:00, WEEKLY=30, TODAY=1, YDAY=13
[LF] SM480 30DEC: LASTSOLD=2025-12-28 00:00:00, WEEKLY=12, TODAY=0, YDAY=3
[LF] SM478 30DEC: LASTSOLD=2025-12-28 00:00:00, WEEKLY=14, TODAY=0, YDAY=4
[LF] SM460 30DEC: LASTSOLD=2025-12-28 00:00:00, WEEKLY=18, TODAY=0, YDAY=1
[LF] SM424 30DEC: LASTSOLD=2025-12-24 00:00:00, WEEKLY=10, TODAY=0, YDAY=0
[LF] SM476 30DEC: LASTSOLD=2025-12-28 00:00:00, WEEKLY=15, TODAY=0, YDAY=2
2025-12-29 07:31:01 | INFO     | [SUCCESS] Day 30DEC
[LF] Skipping 29DEC (Today) - will be processed by supplement scan
[LF] Results summary:
  2026-01-01: 7 flights
  2025-12-31: 3 flights
  2025-12-30: 6 flights
2025-12-29 07:31:01 | INFO     | [SUCCESS] LF Search Complete

============================================================
[Worker_9227] ✓ COMPLETED: JED-CAI
  Results: 3 dates
  Errors: 0 dates
  Total Processed: 4 groups
============================================================

2025-12-29 07:31:03 | INFO     | [Worker_9227] Completed: JED-CAI - 3 results, 0 errors
[Worker_9227] Waiting for tasks...

============================================================
[Worker_9227] Shutdown signal received
Exiting...
============================================================
2025-12-29 07:34:58 | INFO     | [Worker_9227] Shutdown signal received, exiting...

============================================================
[Worker_9227] FINISHED
  Total Groups Processed: 4
============================================================

2025-12-29 07:34:58 | INFO     | [Worker_9227] Finished. Processed 4 groups.
