
============================================================
     LF WORKER - PORT 9232
============================================================
Worker: Worker_9232
Status: READY
Waiting for tasks...
============================================================


============================================================
[Worker_9232] Processing: ATZ-RUH
  Tier 0: Range 2, Chunk 1/3
  Dates: 4 days
  Date Range: 2026-01-21 to 2026-01-18
============================================================

2025-12-29 07:26:11 | INFO     | ======================================================================
2025-12-29 07:26:11 | INFO     | Load Factor Scraper Started - Route: ATZ-RUH
2025-12-29 07:26:11 | INFO     | Log file: D:\CODERED\LAB\market_insights\outputs\run_generated_291225_at_07.25\logs\LF_ATZ-RUH_20251229_072611.log
2025-12-29 07:26:11 | INFO     | Enhanced logging: Capturing both logging.info() and print()
2025-12-29 07:26:11 | INFO     | ======================================================================
[LF] Processing dates (override): ['21JAN', '20JAN', '19JAN', '18JAN']
[LF] Attaching to Chrome for Altea access
[LF][[OK] SUCCESS] Connected to Chrome on 127.0.0.1:9232 (after 1 attempts)
[LF][[OK] SUCCESS] Found Amadeus Altea window: Altéa Reservation Desktop
[LF][[INFO] INFO] URL: https://tc212.resdesktop.altea.amadeus.com/app_ard/apf/init/login?SITE=ESMPESMP&LANGUAGE=GB&MARKETS=ARDW_PROD_WBP&ACTION=clpLogin
[LF] Processing ATZ-RUH for 21JAN
[LF][ERROR] Amadeus command error detected: UNKNOWN TRANSACTION
[LF][ERROR] Command: SN21JANATZRUH/ASM
[LF][RESYNC] Triggering immediate resync to last successful SN command
============================================================
[LF][RESYNC] Command 'SN21JANATZRUH/ASM' failed: TECH_ERROR:UNKNOWN TRANSACTION
[LF][RESYNC] Re-running entire day from SN command for ATZ-RUH 21JAN
[LF][RESYNC] Attempt 1/50 (waiting 1.0s before retry...)
============================================================
[LF][RESYNC] Sending IG to clear session state...
[LF][RESYNC] Session cleared with IG
[LF] Processing ATZ-RUH for 21JAN
[LF] 21JAN: found 1 direct flights
[LF] SM465 21JAN: BKG=63, GRP=0, CAP=179, LF%=35.2%, Brd-Off=ATZ-RUH, Classes: O:2, U:5, X:24, T:9, W:8, S:9, G:5, V:1
[LF] Getting WEEKLY/LASTSOLD data for 1 flights
[LF] SM465 21JAN: LASTSOLD=2025-12-28 00:00:00, WEEKLY=31, TODAY=0, YDAY=5
[LF] Processing ATZ-RUH for 20JAN
[LF] 20JAN: found 1 direct flights
[LF] SM463 20JAN: BKG=60, GRP=0, CAP=179, LF%=33.5%, Brd-Off=ATZ-RUH, Classes: O:4, U:8, X:3, T:5, W:10, S:28, G:2
[LF] Getting WEEKLY/LASTSOLD data for 1 flights
[LF] SM463 20JAN: LASTSOLD=2025-12-28 00:00:00, WEEKLY=26, TODAY=0, YDAY=2
[LF] Processing ATZ-RUH for 19JAN
[LF] No direct flights on 19JAN for ATZ-RUH
[LF] Processing ATZ-RUH for 18JAN
[LF] 18JAN: found 1 direct flights
[LF] SM463 18JAN: BKG=84, GRP=0, CAP=179, LF%=46.9%, Brd-Off=ATZ-RUH, Classes: U:1, X:16, T:13, W:10, S:10, G:10, L:19, V:4, K:1
[LF] Getting WEEKLY/LASTSOLD data for 1 flights
[LF] SM463 18JAN: LASTSOLD=2025-12-28 00:00:00, WEEKLY=30, TODAY=0, YDAY=3
[LF] Results summary:
  2026-01-21: 1 flights
  2026-01-20: 1 flights
  2026-01-19: 0 flights
  2026-01-18: 1 flights

============================================================
[Worker_9232] ✓ COMPLETED: ATZ-RUH
  Results: 4 dates
  Errors: 0 dates
  Total Processed: 1 groups
============================================================


============================================================
[Worker_9232] Processing: CAI-RUH
  Tier 0: Range 2, Chunk 3/3
  Dates: 3 days
  Date Range: 2026-01-13 to 2026-01-11
============================================================

2025-12-29 07:26:46 | INFO     | ======================================================================
2025-12-29 07:26:46 | INFO     | Load Factor Scraper Started - Route: CAI-RUH
2025-12-29 07:26:46 | INFO     | Log file: D:\CODERED\LAB\market_insights\outputs\run_generated_291225_at_07.25\logs\LF_CAI-RUH_20251229_072646.log
2025-12-29 07:26:46 | INFO     | Enhanced logging: Capturing both logging.info() and print()
2025-12-29 07:26:46 | INFO     | ======================================================================
[LF] Processing dates (override): ['13JAN', '12JAN', '11JAN']
[LF] Attaching to Chrome for Altea access
2025-12-29 07:26:46 | INFO     | Starting LF search for route: CAI-RUH
2025-12-29 07:26:46 | INFO     | [START] LF Search
[LF][[OK] SUCCESS] Connected to Chrome on 127.0.0.1:9232 (after 1 attempts)
2025-12-29 07:26:48 | INFO     | [HEALTH CHECK] [OK] Chrome connection is healthy
[LF][[OK] SUCCESS] Found Amadeus Altea window: Altéa Reservation Desktop
[LF][[INFO] INFO] URL: https://tc212.resdesktop.altea.amadeus.com/app_ard/apf/init/login?SITE=ESMPESMP&LANGUAGE=GB&MARKETS=ARDW_PROD_WBP&ACTION=clpLogin
2025-12-29 07:26:48 | INFO     | [DAY_START] Processing 13JAN
[LF] Processing CAI-RUH for 13JAN
2025-12-29 07:26:48 | INFO     | [lf.day.start] Processing CAI-RUH for 13JAN
[LF] 13JAN: found 1 direct flights
2025-12-29 07:26:49 | INFO     | [lf.day.flights_found] Found 1 flights on 13JAN
2025-12-29 07:26:51 | INFO     | [lf.flight.extracted] SM469 on 13JAN: BKG=63, LF=35.2%
[LF] SM469 13JAN: BKG=63, GRP=0, CAP=179, LF%=35.2%, Brd-Off=CAI-RUH, Classes: I:15, O:15, U:15, X:15, T:2, S:1
[LF] Getting WEEKLY/LASTSOLD data for 1 flights
[LF] SM469 13JAN: LASTSOLD=2025-12-28 00:00:00, WEEKLY=29, TODAY=0, YDAY=2
2025-12-29 07:26:55 | INFO     | [SUCCESS] Day 13JAN
2025-12-29 07:26:55 | INFO     | [DAY_START] Processing 12JAN
[LF] Processing CAI-RUH for 12JAN
2025-12-29 07:26:55 | INFO     | [lf.day.start] Processing CAI-RUH for 12JAN
[LF] 12JAN: found 1 direct flights
2025-12-29 07:26:56 | INFO     | [lf.day.flights_found] Found 1 flights on 12JAN
2025-12-29 07:26:58 | INFO     | [lf.flight.extracted] SM469 on 12JAN: BKG=67, LF=37.4%
[LF] SM469 12JAN: BKG=67, GRP=0, CAP=179, LF%=37.4%, Brd-Off=CAI-RUH, Classes: I:15, O:25, U:15, X:11, S:1
[LF] Getting WEEKLY/LASTSOLD data for 1 flights
[LF] SM469 12JAN: LASTSOLD=2025-12-28 00:00:00, WEEKLY=43, TODAY=0, YDAY=9
2025-12-29 07:27:03 | INFO     | [SUCCESS] Day 12JAN
2025-12-29 07:27:03 | INFO     | [DAY_START] Processing 11JAN
[LF] Processing CAI-RUH for 11JAN
2025-12-29 07:27:03 | INFO     | [lf.day.start] Processing CAI-RUH for 11JAN
[LF] 11JAN: found 1 direct flights
2025-12-29 07:27:04 | INFO     | [lf.day.flights_found] Found 1 flights on 11JAN
2025-12-29 07:27:06 | INFO     | [lf.flight.extracted] SM461 on 11JAN: BKG=57, LF=31.8%
[LF] SM461 11JAN: BKG=57, GRP=0, CAP=179, LF%=31.8%, Brd-Off=CAI-RUH, Classes: I:15, O:25, U:11, X:6
[LF] Getting WEEKLY/LASTSOLD data for 1 flights
[LF] SM461 11JAN: LASTSOLD=2025-12-28 00:00:00, WEEKLY=26, TODAY=0, YDAY=10
2025-12-29 07:27:10 | INFO     | [SUCCESS] Day 11JAN
[LF] Results summary:
  2026-01-13: 1 flights
  2026-01-12: 1 flights
  2026-01-11: 1 flights
2025-12-29 07:27:10 | INFO     | [SUCCESS] LF Search Complete

============================================================
[Worker_9232] ✓ COMPLETED: CAI-RUH
  Results: 3 dates
  Errors: 0 dates
  Total Processed: 2 groups
============================================================

2025-12-29 07:27:12 | INFO     | [Worker_9232] Completed: CAI-RUH - 3 results, 0 errors

============================================================
[Worker_9232] Processing: JED-ATZ
  Tier 0: Range 1, Chunk 1/3
  Dates: 5 days
  Date Range: 2026-01-10 to 2026-01-06
============================================================

2025-12-29 07:27:12 | INFO     | [Worker_9232] Processing: JED-ATZ
2025-12-29 07:27:12 | INFO     |   Tier 0: Range 1, Chunk 1/3 (5 days)
2025-12-29 07:27:12 | INFO     | ======================================================================
2025-12-29 07:27:12 | INFO     | Load Factor Scraper Started - Route: JED-ATZ
2025-12-29 07:27:12 | INFO     | Log file: D:\CODERED\LAB\market_insights\outputs\run_generated_291225_at_07.25\logs\LF_JED-ATZ_20251229_072712.log
2025-12-29 07:27:12 | INFO     | Enhanced logging: Capturing both logging.info() and print()
2025-12-29 07:27:12 | INFO     | ======================================================================
[LF] Processing dates (override): ['10JAN', '09JAN', '08JAN', '07JAN', '06JAN']
[LF] Attaching to Chrome for Altea access
2025-12-29 07:27:12 | INFO     | Starting LF search for route: JED-ATZ
2025-12-29 07:27:12 | INFO     | [START] LF Search
[LF][[OK] SUCCESS] Connected to Chrome on 127.0.0.1:9232 (after 1 attempts)
2025-12-29 07:27:13 | INFO     | [HEALTH CHECK] [OK] Chrome connection is healthy
[LF][[OK] SUCCESS] Found Amadeus Altea window: Altéa Reservation Desktop
[LF][[INFO] INFO] URL: https://tc212.resdesktop.altea.amadeus.com/app_ard/apf/init/login?SITE=ESMPESMP&LANGUAGE=GB&MARKETS=ARDW_PROD_WBP&ACTION=clpLogin
2025-12-29 07:27:13 | INFO     | [DAY_START] Processing 10JAN
[LF] Processing JED-ATZ for 10JAN
2025-12-29 07:27:13 | INFO     | [lf.day.start] Processing JED-ATZ for 10JAN
[LF] 10JAN: found 3 direct flights
2025-12-29 07:27:14 | INFO     | [lf.day.flights_found] Found 3 flights on 10JAN
2025-12-29 07:27:16 | INFO     | [lf.flight.extracted] SM492 on 10JAN: BKG=152, LF=91.0%
[LF] SM492 10JAN: BKG=152, GRP=139, CAP=167, LF%=91.0%, Brd-Off=JED-ATZ, Classes: P:139, I:4, O:2, U:3, S:4
2025-12-29 07:27:19 | INFO     | [lf.flight.extracted] SM454 on 10JAN: BKG=154, LF=92.2%
[LF] SM454 10JAN: BKG=154, GRP=139, CAP=167, LF%=92.2%, Brd-Off=JED-ATZ, Classes: P:139, I:4, O:2, U:3, X:5, W:1
2025-12-29 07:27:23 | INFO     | [lf.flight.extracted] SM456 on 10JAN: BKG=161, LF=96.4%
[LF] SM456 10JAN: BKG=161, GRP=142, CAP=167, LF%=96.4%, Brd-Off=JED-ATZ, Classes: P:142, I:4, O:2, U:3, X:5, S:2, V:1, K:2
[LF] Getting WEEKLY/LASTSOLD data for 3 flights
[LF] SM492 10JAN: LASTSOLD=2025-12-25 00:00:00, WEEKLY=52, TODAY=0, YDAY=0
[LF] SM454 10JAN: LASTSOLD=2025-12-23 00:00:00, WEEKLY=52, TODAY=0, YDAY=0
[LF] SM456 10JAN: LASTSOLD=2025-12-23 00:00:00, WEEKLY=4, TODAY=0, YDAY=0
2025-12-29 07:27:38 | INFO     | [SUCCESS] Day 10JAN
2025-12-29 07:27:38 | INFO     | [DAY_START] Processing 09JAN
[LF] Processing JED-ATZ for 09JAN
2025-12-29 07:27:38 | INFO     | [lf.day.start] Processing JED-ATZ for 09JAN
[LF] 09JAN: found 1 direct flights
2025-12-29 07:27:39 | INFO     | [lf.day.flights_found] Found 1 flights on 09JAN
2025-12-29 07:27:41 | INFO     | [lf.flight.extracted] SM492 on 09JAN: BKG=45, LF=27.0%
[LF] SM492 09JAN: BKG=45, GRP=2, CAP=167, LF%=27.0%, Brd-Off=JED-ATZ, Classes: E:2, I:4, O:2, U:3, X:5, T:16, W:10, S:1, V:1, K:1
[LF] Getting WEEKLY/LASTSOLD data for 1 flights
[LF] SM492 09JAN: LASTSOLD=2025-12-28 00:00:00, WEEKLY=21, TODAY=0, YDAY=2
2025-12-29 07:27:45 | INFO     | [SUCCESS] Day 09JAN
2025-12-29 07:27:45 | INFO     | [DAY_START] Processing 08JAN
[LF] Processing JED-ATZ for 08JAN
2025-12-29 07:27:45 | INFO     | [lf.day.start] Processing JED-ATZ for 08JAN
[LF] 08JAN: 1 cancelled flight(s) detected from SN
[LF] 08JAN: found 3 direct flights
2025-12-29 07:27:47 | INFO     | [lf.day.flights_found] Found 3 flights on 08JAN
2025-12-29 07:27:49 | INFO     | [lf.flight.extracted] SM422 on 08JAN: BKG=166, LF=99.4%
[LF] SM422 08JAN: BKG=166, GRP=139, CAP=167, LF%=99.4%, Brd-Off=JED-ATZ, Classes: P:135, E:4, I:9, O:9, U:3, X:1, W:2, S:3
2025-12-29 07:27:53 | INFO     | [lf.flight.extracted] SM454 on 08JAN: BKG=147, LF=88.0%
[LF] SM454 08JAN: BKG=147, GRP=86, CAP=167, LF%=88.0%, Brd-Off=JED-ATZ, Classes: P:86, I:4, O:2, U:3, X:8, T:28, W:2, S:13, K:1
2025-12-29 07:27:56 | INFO     | [lf.flight.extracted] SM456 on 08JAN: BKG=179, LF=107.2%
[LF] SM456 08JAN: BKG=179, GRP=171, CAP=167, LF%=107.2%, Brd-Off=JED-ATZ, Classes: P:171, I:4, O:1, U:3
[LF] Getting WEEKLY/LASTSOLD data for 3 flights
[LF] SM422 08JAN: LASTSOLD=2025-12-17 00:00:00, WEEKLY=0, TODAY=0, YDAY=0
[LF] SM454 08JAN: LASTSOLD=2025-12-28 00:00:00, WEEKLY=26, TODAY=0, YDAY=10
[LF] SM456 08JAN: LASTSOLD=2025-12-24 00:00:00, WEEKLY=3, TODAY=0, YDAY=0
2025-12-29 07:28:13 | INFO     | [SUCCESS] Day 08JAN
2025-12-29 07:28:13 | INFO     | [DAY_START] Processing 07JAN
[LF] Processing JED-ATZ for 07JAN
2025-12-29 07:28:13 | INFO     | [lf.day.start] Processing JED-ATZ for 07JAN
[LF] 07JAN: found 2 direct flights
2025-12-29 07:28:14 | INFO     | [lf.day.flights_found] Found 2 flights on 07JAN
2025-12-29 07:28:16 | INFO     | [lf.flight.extracted] SM454 on 07JAN: BKG=176, LF=98.9%
[LF] SM454 07JAN: BKG=176, GRP=175, CAP=178, LF%=98.9%, Brd-Off=JED-ATZ, Classes: P:173, E:2, S:1
2025-12-29 07:28:19 | INFO     | [lf.flight.extracted] SM492 on 07JAN: BKG=183, LF=109.6%
[LF] SM492 07JAN: BKG=183, GRP=179, CAP=167, LF%=109.6%, Brd-Off=JED-ATZ, Classes: P:134, E:45, I:3, O:1
[LF] Getting WEEKLY/LASTSOLD data for 2 flights
[LF] SM454 07JAN: LASTSOLD=2025-12-28 00:00:00, WEEKLY=6, TODAY=0, YDAY=3
[LF] SM492 07JAN: LASTSOLD=2025-12-14 00:00:00, WEEKLY=0, TODAY=0, YDAY=0
2025-12-29 07:28:31 | INFO     | [SUCCESS] Day 07JAN
2025-12-29 07:28:31 | INFO     | [DAY_START] Processing 06JAN
[LF] Processing JED-ATZ for 06JAN
2025-12-29 07:28:31 | INFO     | [lf.day.start] Processing JED-ATZ for 06JAN
[LF] 06JAN: found 2 direct flights
2025-12-29 07:28:32 | INFO     | [lf.day.flights_found] Found 2 flights on 06JAN
2025-12-29 07:28:34 | INFO     | [lf.flight.extracted] SM454 on 06JAN: BKG=178, LF=106.6%
[LF] SM454 06JAN: BKG=178, GRP=177, CAP=167, LF%=106.6%, Brd-Off=JED-ATZ, Classes: P:177, I:1
2025-12-29 07:28:37 | INFO     | [lf.flight.extracted] SM456 on 06JAN: BKG=180, LF=107.8%
[LF] SM456 06JAN: BKG=180, GRP=180, CAP=167, LF%=107.8%, Brd-Off=JED-ATZ, Classes: P:180
[LF] Getting WEEKLY/LASTSOLD data for 2 flights
[LF] SM454 06JAN: LASTSOLD=2025-11-19 00:00:00, WEEKLY=0, TODAY=0, YDAY=0
[LF] SM456 06JAN: LASTSOLD=2025-11-12 00:00:00, WEEKLY=0, TODAY=0, YDAY=0
2025-12-29 07:28:49 | INFO     | [SUCCESS] Day 06JAN
[LF] Results summary:
  2026-01-10: 3 flights
  2026-01-09: 1 flights
  2026-01-08: 3 flights
  2026-01-07: 2 flights
  2026-01-06: 2 flights
[LF] Cancelled flights found: 1
  - SM492 08JAN (SN)
2025-12-29 07:28:49 | INFO     | [SUCCESS] LF Search Complete
[Worker_9232] Cancelled flights collected: 1

============================================================
[Worker_9232] ✓ COMPLETED: JED-ATZ
  Results: 5 dates
  Errors: 0 dates
  Total Processed: 3 groups
============================================================

2025-12-29 07:28:51 | INFO     | [Worker_9232] Completed: JED-ATZ - 5 results, 0 errors
[Worker_9232] Waiting for tasks...

============================================================
[Worker_9232] Shutdown signal received
Exiting...
============================================================
2025-12-29 07:34:57 | INFO     | [Worker_9232] Shutdown signal received, exiting...

============================================================
[Worker_9232] FINISHED
  Total Groups Processed: 3
============================================================

2025-12-29 07:34:57 | INFO     | [Worker_9232] Finished. Processed 3 groups.
